,_index,_type,_id,_score,_source.body
708,msmarco,_doc,MARCO_6153308,4.9546123,"The risk of lung cancer increases with the number of cigarettes smoked over time; doctors refer to this risk in terms of pack-years of smoking history (the number of packs of cigarettes smoked per day multiplied by the number of years smoked).hile someone who smokes one pack of cigarettes per day has a risk for the development of lung cancer that is 25 times higher than a nonsmoker, pipe and cigar smokers have a risk of lung cancer that is about five times that of a nonsmoker. Recommended Related to Lung Cancer."
709,msmarco,_doc,MARCO_2436260,4.9542036,"Some causes of a lung mass include: 1  Lung cancer. 2  Other cancers – Some cancers that may appear as a mass in the lungs include lymphomas and sarcomas. 3  Benign (non-cancerous) lung tumors, such as hamartomas, which are the most common type of benign lung tumor."
710,msmarco,_doc,MARCO_7646892,4.9527097,"What Are the Most Common Mesothelioma Symptoms? Unfortunately, asbestosis and mesothelioma symptoms, mirror many other types of lung-related diseases. Symptoms can be different based on the type of cancer and can be vague and mild even as the disease progresses into a later stage. Early signs can be so slight that they are mistaken as normal aches and pains or symptoms of other illnesses, making asbestos-related cancer hard to detect. Common Symptoms."
711,msmarco,_doc,MARCO_4926582,4.951496,"This accumulation can cause shortness of breath. - Lung nodules. Small lumps may form in the lungs (rheumatoid nodules), as well as in other parts of the body. Lung nodules usually cause no signs or symptoms, and they don't pose a risk of lung cancer. In some cases, however, a nodule can rupture and cause a collapsed lung. - Scarring of the lungs."
712,msmarco,_doc,MARCO_3120502,4.950799,"My Mom has lung cancer and it has metastasized to her liver. She is in the advanced stage of small cell lung cancer. She has gotten in real bad shape over the last few weeks. Her feet have swollen up so much, I can barely distinguish her toes. I asked the nurse why and she said it has to do with the liver failure.y Mom has lung cancer and it has metastasized to her liver. She is in the advanced stage of small cell lung cancer. She has gotten in real bad shape over the last few weeks. Her feet have swollen up so much, I can barely distinguish her toes. I asked the nurse why and she said it has to do with the liver failure."
713,msmarco,_doc,MARCO_2138283,4.950799,"Surgery for non-small cell lung cancer. Surgery to remove the cancer (often along with other treatments) may be an option for early stage non-small cell lung cancer (NSCLC). If surgery can be done, it provides the best chance to cure NSCLC.f your doctor thinks the lung cancer can be treated with surgery, pulmonary function tests will be done beforehand to see if you would still have enough healthy lung tissue left after surgery. Other tests will check the function of your heart and other organs to be sure you’re healthy enough for surgery."
714,msmarco,_doc,MARCO_1736086,4.9503126,"Other factors. 1  It’s thought that some previous lung diseases may increase the risk of lung cancer – especially some that have caused scaring in the lungs (see more in here). 2  Lung cancer is associated with smoking. 3  Again, smoking is the leading risk factor for lung cancer."
715,msmarco,_doc,MARCO_4915375,4.9486446,"1 Each year there are more new cases of skin cancer than the combined incidence of cancers of the breast, prostate, lung and colon. 2  Treatment of nonmelanoma skin cancers increased by nearly 77 percent between 1992 and 2006.3  Over the past three decades, more people have had skin cancer than all other cancers combined. Each year there are more new cases of skin cancer than the combined incidence of cancers of the breast, prostate, lung and colon. 2  Treatment of nonmelanoma skin cancers increased by nearly 77 percent between 1992 and 2006."
716,msmarco,_doc,MARCO_2806307,4.94837,"A form of pneumonia that is caused by the bacterium Legionella pneumophilia is called Legionnaires' disease or. adenocarcinoma of the lung. also known as lung cancer, it arises from the soft tissues of the lung. The two major forms are small-cell lung cancer and non-small-cell lung cancer."
717,msmarco,_doc,MARCO_2123373,4.9470825,Anxiety and panic attacks are also common causes of lung symptoms and include rapid breathing that may result in hyperventilation or fainting. Airway obstruction causes lung symptoms that may include rapid shallow breathing. Lung injury from chest trauma can lead to breathing symptoms.nxiety and panic attacks are also common causes of lung symptoms and include rapid breathing that may result in hyperventilation or fainting. Airway obstruction causes lung symptoms that may include rapid shallow breathing. Lung injury from chest trauma can lead to breathing symptoms.
718,msmarco,_doc,MARCO_4208252,4.946993,"In Stage IIIA, the tumor has extended into lymph nodes in the tracheal area outside the lung, which may include the diaphragm and chest wall, on the same side of the body on which the cancer originated. In Stage IIIB, the cancer has extended into lymph nodes in the neck or in the opposite lung from its origin.All forms and stages of lung cancer are established in a definitive diagnosis through a biopsy. This involves the doctor inserting a needle into the chest and withdrawing a sample of tissue.n Stage IIIB, the cancer has extended into lymph nodes in the neck or in the opposite lung from its origin."
719,msmarco,_doc,MARCO_5886115,4.944846,"1 Lung cancer leads to the most number of deaths in both men and women, accounting for about 30% of all cancer deaths. 2  Breast cancer is the second leading cause of cancer death in women, after lung cancer; it is also the second most frequently diagnosed cancer in women, after skin cancers.t has long been known that exposure to high levels of certain chemicals, such as those in some occupational settings, can cause cancer. There is now growing scientific evidence that exposure to lower levels of chemicals in the general environment is contributing to society’s cancer burden."
720,msmarco,_doc,MARCO_7541284,4.9431944,"Non small cell lung cancer stage 2 is also divided into stage 2A and 2B. For stage 2A lung cancer, between 36 and 46 out of every 100 people diagnosed (36% to 46%) will survive for 5 years or more with treatment.or stage 2A lung cancer, almost 40 out of every 100 people diagnosed (40%) will survive for 5 years or more after they are diagnosed. For stage 2B small cell lung cancer, almost 20 out of every 100 people diagnosed (20%) will survive for 5 years or more after diagnosis."
721,msmarco,_doc,MARCO_250229,4.941055,"Brain tumors account for one in every 100 cancers diagnosed annually in the United States. Most malignant brain tumors and brain cancers have spread from other tumors in the body to the skull, including cancers of the breast and lung, malignant melanoma and blood cell cancers (such as leukemia and lymphoma).rain tumors account for one in every 100 cancers diagnosed annually in the United States. Most malignant brain tumors and brain cancers have spread from other tumors in the body to the skull, including cancers of the breast and lung, malignant melanoma and blood cell cancers (such as leukemia and lymphoma)."
722,msmarco,_doc,MARCO_1331555,4.941055,"Smoking is a major risk factor for heart attacks, strokes, chronic obstructive pulmonary disease (COPD) (including emphysema and chronic bronchitis), and cancer (particularly lung cancer, cancers of the larynx and mouth, and pancreatic cancer). It also causes peripheral vascular disease and hypertension.moking is a major risk factor for heart attacks, strokes, chronic obstructive pulmonary disease (COPD) (including emphysema and chronic bronchitis), and cancer (particularly lung cancer, cancers of the larynx and mouth, and pancreatic cancer). It also causes peripheral vascular disease and hypertension."
723,msmarco,_doc,MARCO_2194480,4.941055,"A serious problem that may occur in cancer in which cancer cells spread from the original (primary) tumor to the meninges (thin layers of tissue that cover and protect the brain and spinal cord). It can happen in many types of cancer, but is the most common in melanoma, breast, lung, and gastrointestinal cancer. serious problem that may occur in cancer in which cancer cells spread from the original (primary) tumor to the meninges (thin layers of tissue that cover and protect the brain and spinal cord). It can happen in many types of cancer, but is the most common in melanoma, breast, lung, and gastrointestinal cancer."
724,msmarco,_doc,MARCO_5921043,4.941055,"Secondary cancer in the lymph nodes. Secondary cancer in the lymph nodes is when cancer cells have spread to the lymph nodes from a cancer that began elsewhere in the body. We have separate information about the different types of lymphomas | .We hope this information answers your questions.hen cancer spreads to lymph nodes, the cancer cells in the nodes will look like cells from the primary tumour when they’re examined under the microscope. For example, when a lung cancer | has spread to the lymph nodes, the cells in the lymph nodes look like lung cancer cells. This affects the way they are treated."
725,msmarco,_doc,MARCO_3962523,4.940618,"What is Lung Cancer? Lung cancer arises when a series of mutations in normal lung cells cause them to become abnormal and grow out of control. These changes can take place anywhere from the bronchus (the windpipe), down to the small air sacs in the periphery of the lungs (the alveoli) where oxygen exchange takes place. It's important to note that lung cancer is a multifactorial."
726,msmarco,_doc,MARCO_7541288,4.939403,"For stage 2A lung cancer, almost 40 out of every 100 people diagnosed (40%) will survive for 5 years or more after they are diagnosed. For stage 2B small cell lung cancer, almost 20 out of every 100 people diagnosed (20%) will survive for 5 years or more after diagnosis.or stage 2A lung cancer, almost 40 out of every 100 people diagnosed (40%) will survive for 5 years or more after they are diagnosed. For stage 2B small cell lung cancer, almost 20 out of every 100 people diagnosed (20%) will survive for 5 years or more after diagnosis."
727,msmarco,_doc,MARCO_3985694,4.9390717,"Cancer that metastasizes (spreads) to the bones from other parts of the body, such as the breast, lung, or prostate, is called metastatic cancer, and is named for the organ or tissue in which it began. Primary bone cancer is far less common than cancer that spreads to the bones.ain is the most common symptom of bone cancer, but not all bone cancers cause pain (1). Persistent or unusual pain or swelling in or near a bone can be caused by cancer or by other conditions."
728,msmarco,_doc,MARCO_3379756,4.9339795,Many cancers like leukemia have no apparent cause. Some other types of cancers like lung cancers have identifiable causes like smoking in most cases. Lung cancer can occur in those who have never smoked in their life. It is hard to know in these cases what is causing that patients lung cancer.
729,msmarco,_doc,MARCO_2051644,4.9334936,"The average American woman has about a one in 17 chance of developing lung cancer in her lifetime, regardless of her smoking habits. This cancer is also more common in older individuals, with most lung cancer patients being 65 or older and is slightly more common in white women than women of other races. Colorectal Cancer. The CDC reports that colorectal cancer, also known as colon cancer, is the third most common cancer among women and is most often found in people aged 50 and older. This is cancer of the colon or rectum, and occurs when uncontrolled cell growth in the large intestines leads to the growth of small tumors known as polyps."
730,msmarco,_doc,MARCO_1480078,4.933113,"Yes you can survive with one lung and lung cancer patients rountinely have one lung removed. Yeah. 12-31-2000, 10:35 AM. Yes, it is possible to live with just one lung (if the lung is in reasonably good condition.) Some lung cancer patients are treated by surgical removal of one lung."
731,msmarco,_doc,MARCO_3403550,4.9328957,"Most lung tumours show up on X-rays as a white-grey mass. However, chest X-rays cannot give a definitive diagnosis because they often cannot distinguish between cancer and other conditions, such as a lung abscess (a collection of pus that forms in the lungs).f your chest X-ray suggests you may have lung cancer, you should be referred to a specialist (if you've haven't already been) in chest conditions such as lung cancer."
732,msmarco,_doc,MARCO_4707756,4.9328957,"Squamous cell carcinoma of the lungs is one form of non-small cell lung cancer. Non-small cell lung cancers account for about 80 percent of lung cancers, and of these, roughly 30 percent are squamous cell carcinomas. Squamous cell carcinoma begins in the tissue that lines the air passages in the lungs. It is also known as epidermoid carcinoma."
733,msmarco,_doc,MARCO_5371067,4.9328957,"Fluid in the lungs - what does this mean? My mom recently had a chest x-ray, and it revealed that she has fluid in one of her lungs. Her doctor said not to worry too much about it, but he's going to do a CT scan just to be certain it's not lung cancer. There's no tumor, just fluid. If this was cancer, wouldn't there be a... show more My mom recently had a chest x-ray, and it revealed that she has fluid in one of her lungs. Her doctor said not to worry too much about it, but he's going to do a CT scan just to be certain it's not lung cancer."
734,msmarco,_doc,MARCO_3752440,4.9320273,"As with most cancer treatments, the choice of therapy is dictated mostly by the cancer type and the stage of the disease. In lung cancer there are two main types, non-small cell lung cancer (NSCLC) and small cell lung cancer (SCLC) ."
735,msmarco,_doc,MARCO_805369,4.9318414,"The average age of someone diagnosed with lung cancer is about 70. Only 2 to 3 percent of the 228,190 people diagnosed with lung cancer in 2013 are younger than 40. Nunez says the only sign that something was wrong was a small bump on her left collarbone.“It had never bothered me and I felt fine,” she says.he average age of someone diagnosed with lung cancer is about 70. Only 2 to 3 percent of the 228,190 people diagnosed with lung cancer in 2013 are younger than 40. Nunez says the only sign that something was wrong was a small bump on her left collarbone. “It had never bothered me and I felt fine,” she says."
736,msmarco,_doc,MARCO_1925745,4.9318414,"Lung cancer mainly occurs in older people. About 2 out of 3 people diagnosed with lung cancer are 65 or older; fewer than 2% of all cases are found in people younger than 45. The average age at the time of diagnosis is about 70.Overall, the chance that a man will develop lung cancer in his lifetime is about 1 in 13; for a woman, the risk is about 1 in 16.bout 2 out of 3 people diagnosed with lung cancer are 65 or older; fewer than 2% of all cases are found in people younger than 45. The average age at the time of diagnosis is about 70."
737,msmarco,_doc,MARCO_1937071,4.9318414,"CD22 antigen is broadly expressed on lung cancer cells and is a target for antibody-based therapy.Tuscano JM, Kato J, Pearson D, Xiong C, Newell L, Ma Y, Gandara DR, O'Donnell RT. Most patients with lung cancer still die from their disease, necessitating additional options to improve treatment.Here, we provide evidence for targeting CD22, a cell adhesion protein known to influence B-cell survival that we found is also widely expressed in lung cancer cells.D22 antigen is broadly expressed on lung cancer cells and is a target for antibody-based therapy."
738,msmarco,_doc,MARCO_6965464,4.9318414,"There are different types of treatment for patients with non-small cell lung cancer. Different types of treatments are available for patients with non-small cell lung cancer. Some treatments are standard (the currently used treatment), and some are being tested in clinical trials.Before starting treatment, patients may want to think about taking part in a clinical trial.SCLC is any type of epithelial lung cancer other than small cell lung cancer (SCLC). The most common types of NSCLC are squamous cell carcinoma, large cell carcinoma, and adenocarcinoma, but there are several other types that occur less frequently, and all types can occur in unusual histologic variants."
739,msmarco,_doc,MARCO_6965463,4.9318414,"Chemotherapy drugs used to treat non–small cell lung cancer can be given on some of the same days as radiation therapy treatments. Cisplatin (Platinol AQ), which is a standard drug used for non–small cell lung cancer, makes cancer cells more sensitive to the effects of radiation.efore treatment starts, a person with non–small cell lung cancer may have a treatment planning session. The radiation therapy team uses a computed tomography (CT) scan to create 3-dimensional pictures of the tumour, lungs and surrounding organs. This information is used to plan and guide treatment."
740,msmarco,_doc,MARCO_6447359,4.9318414,"Radon is a cancer-causing radioactive gas. You cannot see, smell or taste radon, but it may be a problem in your home. The Surgeon General has warned that radon is the second leading cause of lung cancer in the United States today.If you smoke and your home has high radon levels, you're at high risk for developing lung cancer.ou cannot see, smell or taste radon, but it may be a problem in your home. The Surgeon General has warned that radon is the second leading cause of lung cancer in the United States today. If you smoke and your home has high radon levels, you're at high risk for developing lung cancer."
741,msmarco,_doc,MARCO_3627469,4.930077,"About Hilar Mass. 179 discussions. About Lung Cancer. 295,192 discussions. Lung cancer is one of the most common cancers in the world. It is a leading cause of cancer death in men and women in the United States. Cigarette smoking causes most lung cancers."
742,msmarco,_doc,MARCO_7811018,4.9292336,"Lung surgery is most effective for early-stage lung cancers, especially non-small cell lung cancer. Lung function tests, possibly including a lung scan, are usually done before surgery is considered. You may not be a good candidate for surgery to remove all or part of a lung if you have poor lung function."
743,msmarco,_doc,MARCO_1885701,4.9281287,"Lung cancer staging. In medicine, lung cancer staging is the assessment of the extent to which a lung cancer has spread from its original source. As with most cancers, staging is an important determinant of treatment and prognosis. In general, more advanced stages of cancer are less amenable to treatment and have a worse prognosis."
744,msmarco,_doc,MARCO_3831560,4.9281287,"Lung cancer is one of the most common cancers in the world. It is a leading cause of cancer death in men and women in the United States. Cigarette smoking causes most lung cancers. The more cigarettes you smoke per day and the earlier you started smoking, the greater your risk of lung cancer."
745,msmarco,_doc,MARCO_3240587,4.9261823,"The stage of the cancer at the time of diagnosis also directly impacts treatment. For example, if the lung cancer is found early, when the cancer is isolated to the. lung tissue, the treatment of choice is surgery. If the lung cancer is diagnosed. late when the cancer has spread to other organs, then the treatment of choice."
746,msmarco,_doc,MARCO_8366284,4.9261823,"Lung Cancer Screening. Lung cancer is the number-one cancer killer in America, taking more American lives than colon, breast and prostate cancer combined. Every year, 200,000 Americans are diagnosed with lung cancer and 160,000 die from it. That’s 450 people a day."
747,msmarco,_doc,MARCO_1777684,4.9252033,"Updated August 02, 2016. Squamous cell carcinoma of the lungs is one form of non-small cell lung cancer. Non-small cell lung cancers account for about 80 percent of lung cancers, and of these, roughly 30 percent are squamous cell carcinomas. Squamous cell carcinoma begins in the tissue that lines the air passages in the lungs. It is also known as epidermoid carcinoma."
748,msmarco,_doc,MARCO_1978149,4.925189,"Possible symptoms of testicular cancer You can’t be sure you have testicular cancer based on symptoms alone, so it’s important to see a doctor about any testicular symptoms that concern you. Don’t wait. Symptoms in the testicles The most common symptom of testicular cancer is a painless lump on or in a testicle.ossible symptoms of testicular cancer You can’t be sure you have testicular cancer based on symptoms alone, so it’s important to see a doctor about any testicular symptoms that concern you. Don’t wait. Symptoms in the testicles The most common symptom of testicular cancer is a painless lump on or in a testicle."
749,msmarco,_doc,MARCO_677161,4.924309,"Overall Life Expectancy. The life expectancy for people with lung cancer has been improving over the past 40 years, although long-term survival remains low. In the mid-1970s, 12.2 percent of people with lung cancer lived at least 5 years after diagnosis.In 2010, 17.3 percent of people with lung cancer lived at least 5 years after diagnosis.ife expectancy can be described by different statistics. A survival rate is the percentage of people who survive over a given period. For example, a 5-year survival rate of 25 percent means that over 5 years, 25 out of every 100 people with lung cancer will be alive."
750,msmarco,_doc,MARCO_5427322,4.924309,"The most effective means of reducing risk for radon-related lung cancer in these households is to encourage the smoker to stop using tobacco products (3,8,9). However, to maximize lung cancer risk reduction, smokers in residences with high radon concentrations should quit smoking and reduce high radon levels (8).he most effective means of reducing risk for radon-related lung cancer in these households is to encourage the smoker to stop using tobacco products (3,8,9). However, to maximize lung cancer risk reduction, smokers in residences with high radon concentrations should quit smoking and reduce high radon levels (8)."
751,msmarco,_doc,MARCO_8393283,4.924309,"Data in this report provide a comprehensive picture of lung cancer in Australia including how lung cancer rates differ by geographical area, socioeconomic status, Indigenous status and country of birth. ISBN 978-1-74249-222-3; Cat. no.CAN 58; 206pp.; Internet only. 1  publication.2  Summary.ata in this report provide a comprehensive picture of lung cancer in Australia including how lung cancer rates differ by geographical area, socioeconomic status, Indigenous status and country of birth. ISBN 978-1-74249-222-3; Cat. no. CAN 58; 206pp.; Internet only. 1  publication. 2  Summary."
752,msmarco,_doc,MARCO_8823365,4.924309,"GeneCentric’s first product line, developed using CSP™, is redefining the taxonomy of lung cancer. The first application of CSP TM was launched with partner LabCorp® and is available as HistoPlus SM: Lung Cancer.With a robust pipeline, an experienced industry leadership team, and a business model emphasizes the rapid development of genomic tumor classifers, GeneCentric is revolutionizing cancer treatment. GeneCentric will present a poster entitled “Evaluation of a Lung Cancer RNA Expression Subtyping Panel and Comparison with Histologic Diagnosis in Lung Tumor Samples from Multiple Data Sets Including The Cancer Genome Atlas (TCGA)”."
753,msmarco,_doc,MARCO_28049,4.9242377,"Cancer that starts in the lung is called lung cancer. Cancer cells can spread to other parts of the body. For instance, cancer cells in the lung can travel to the bone and grow there. When cancer cells spread, it’s called metastasis (muh-TAS-tuh-sis)."
754,msmarco,_doc,MARCO_2554626,4.9242377,"Lung cancer is the leading cause of cancer death in the United States, with an estimated 221,200 new diagnoses and 158,040 deaths in 2015, according to the National Cancer Institute. The most common type of lung cancer, NSCLC occurs when cancer cells form in the tissues of the lung."
755,msmarco,_doc,MARCO_3518329,4.9242377,"Between 1960 and 1990, deaths from lung cancer among women increased by more than 500%.7. In 1987, lung cancer surpassed breast cancer to become the leading cause of cancer death among U.S. women.8. In 2000, 67,600 women died from lung cancer.8."
756,msmarco,_doc,MARCO_6697134,4.9242377,"321,032 discussions. Lung cancer is one of the most common cancers in the world. It is a leading cause of cancer death in men and women in the United States. Cigarette smoking causes most lung cancers. The more cigarettes you smoke per day and the earlier you started smoking, the greater your risk of lung cancer."
757,msmarco,_doc,MARCO_6627150,4.9242377,"321,144 discussions. Lung cancer is one of the most common cancers in the world. It is a leading cause of cancer death in men and women in the United States. Cigarette smoking causes most lung cancers. The more cigarettes you smoke per day and the earlier you started smoking, the greater your risk of lung cancer."
758,msmarco,_doc,MARCO_905010,4.923428,"All lung cancer damages lungs by clotting them and not allowing you to take in a proper amount of air when you breath.this enables you in that you cant do athletic activity's …   Lung cancer affects the lungs. In the lungs there is a tumor.he lungs provide a surface for gas exchange in mammals. Inside the lungs are the alveoli, in which oxygen dissolves into the blood. Is is basically a gas exchange."
759,msmarco,_doc,MARCO_1232272,4.922295,"Lung cancer is the leading cause of cancer death in the United States, with about 221,000 new cases and 158,000 deaths in 2015, according to the U.S. National Cancer Institute. Non-small cell lung cancer is the most common type of lung cancer. WebMD News from HealthDay."
