,_index,_type,_id,_score,_source.body
488,msmarco,_doc,MARCO_2033701,5.1827035,"A group of lung cancers that are named for the kinds of cells found in the cancer and how the cells look under a microscope. The three main types of non-small cell lung cancer are squamous cell carcinoma, large cell carcinoma, and adenocarcinoma. Non-small cell lung cancer is the most common kind of lung cancer."
489,msmarco,_doc,MARCO_7034028,5.1827035,"The challenge is figuring out which nodules are or will become cancer. All lung cancer starts with a nodule but 95% of lung nodules are not cancer. Nodules that are not cancer may be the result of a bacterial or fungal infection in the past that causes inflammation and scarring in the lungs. For the small group of people who are screened and have lung cancer, it is usually found in the earliest, most curable stages."
490,msmarco,_doc,MARCO_7570447,5.1827035,"Squamous cell lung cancer, or squamous cell carcinoma Cancer that begins in the skin or in tissues that line or cover internal organs of the lung, is one type of non-small cell lung cancer (NSCLC) A group of lung cancers that are named for the kinds of cells found in the cancer and how the cells look under a microscope."
491,msmarco,_doc,MARCO_2084165,5.182656,"Lung cancer can cause symptoms in several ways. It can cause symptoms by growing and pressing on airways and structures in and near the lungs. It can cause general symptoms related to cancer growth, such as fatigue and weight loss."
492,msmarco,_doc,MARCO_656173,5.1821456,"Key Points. 1  There is no prescribed diet plan for someone with lung cancer. 2  Your nutritional needs during lung cancer will change. 3  Some foods can affect your lung cancer symptoms, making them worse or better."
493,msmarco,_doc,MARCO_3752437,5.181183,Non-small cell lung cancer. Non-small cell lung cancer accounts for nearly nine out of every 10 cases and usually grows at a slower rate than SCLC. There are three main types of non-small cell lung cancer: 1  Squamous cell: This type of lung cancer is found centrally in the lung and is generally linked to smoking.
494,msmarco,_doc,MARCO_3401379,5.181183,"Treatment of lung cancer can involve a combination of surgery, chemotherapy, targeted therapy, immunotherapy, and radiation therapy as well as newer experimental methods. The general prognosis of lung cancer is poor because doctors tend not to find the disease until it is at an advanced stage. Five-year survival is around 54% for early stage lung cancer that is localized to the lungs, but only around 4% in advanced, inoperable lung cancer."
495,msmarco,_doc,MARCO_6909900,5.181183,"A lung adenocarcinoma is a type of lung cancer that begins in the glandular cells of the lungs. These cells create and release fluids such as mucus. About 40 percent of all lung cancers are non-small cell adenocarcinomas. The two other main types of lung cancer are squamous cell carcinoma and large cell carcinoma. The majority of cancers that begin in the breast, pancreas, and prostate also are adenocarcinomas."
496,msmarco,_doc,MARCO_3555376,5.181152,"When cancer spreads to lymph nodes, the cancer cells in the nodes will look like cells from the primary tumour when they’re examined under the microscope. For example, when a lung cancer | has spread to the lymph nodes, the cells in the lymph nodes look like lung cancer cells.This affects the way they are treated.his can lead to symptoms like breathlessness or backache. Sometimes a lymph node, or group of nodes, may appear larger than they should on a scan, such as an ultrasound scan, CT scan or MRI scan. This may be a sign that there is a secondary cancer in the lymph nodes."
497,msmarco,_doc,MARCO_8422441,5.179722,if you have other symptoms along with back pain it can be more likely that you are dealing with lung cancer early symptoms of lung cancer may include a persistent cough coughing up blood shortness of breath or general symptoms such as fatigue or unexplained weight loss
498,msmarco,_doc,MARCO_5043576,5.1792116,"Lung cancer and smoking often, but not always, go hand in hand. As lung cancer stages advance, lung cancer symptoms include coughing, wheezing, shortness of breath, and bloody mucus. Treatment includes surgery, chemotherapy, and/or radiation."
499,msmarco,_doc,MARCO_8360907,5.1792116,"It may also be used as the first treatment for lung cancers that can't be removed during surgery. For people with advanced lung cancer, radiation therapy may be used to relieve pain and other symptoms. For people with lung cancers that are very small, one option may be stereotactic body radiotherapy."
500,msmarco,_doc,MARCO_6920322,5.1788387,"What will happen in the end stages, and how do people die from lung cancer? Physical changes during the final stages of lung cancer can be related to the tumor in the lungs, the spread of cancer to other parts of the body, or due to the terminal stages of cancer in general. By definition, the final stage of lung cancer implies that treatment options have been exhausted; a cure is not possible."
501,msmarco,_doc,MARCO_1244911,5.1773405,"Lung Cancer Risks. Because our lungs draw in and utilize the air from outside of our body, anything that we breathe in can affect their health. The most important risk factor for lung cancer is smoking tobacco. Nearly 87% of all lung cancers in the United States are smoking-related. Quitting smoking helps to reduce that risk – learn more about smoking cessation programs. Exposure to secondhand smoke also increases the risk of lung cancer."
502,msmarco,_doc,MARCO_4456895,5.1769447,"Tumors may also develop from the covering of the spinal cord (meningioma) or from a nerve root (schwannoma, neuroma or “nerve sheath tumor”). Some tumors may develop within the bony spine surrounding the spinal cord. The most common primary spinal column tumors are chordoma, chondro­sarcoma, giant cell tumor, osteosarcoma and aneurysmal bone cyst. These tumors may cause problems if they grow enough to compress the spinal cord and cause paralysis. They can also cause problems by disrupting the normal architecture of the spine and rendering the spine unsta­ble. This lack of stability can result in deformation of the spine and thus cause pain or paralysis. Cancers elsewhere in the body (lung cancer, breast cancer, prostate cancer, colon cancer or melanoma, for example) have the potential to spread or “metas­tasize.” Tumors that metastasize to the brain or spine often cause symptoms and require treatment. Are there common signs and symptoms of brain tumors? The symptoms of a brain tumor depend on the size and the location of the tumor in the ..."
503,msmarco,_doc,MARCO_2719108,5.1769094,"NSCLC is the most common type of lung cancer. About 85% of lung cancers are NSCLC. In people with NSCLC, the cancer may spread from the lungs to other parts of the body. This is called advanced NSCLC. This type of cancer is also known as metastatic (met-tuh-STA-tik) or stage 4 lung cancer. Most common places in the body where advanced NSCLC may spread."
504,msmarco,_doc,MARCO_5440812,5.1769094,"Stages of non-small cell lung cancer: 1  Stage I non-small cell lung cancer: Cancer may be present in the underlying lung tissues, but the lymph nodes remain unaffected. 2  Stage II non-small cell lung cancer: The cancer may have spread to nearby lymph nodes or into the chest wall."
505,msmarco,_doc,MARCO_4196556,5.1733522,"Lung cancer has multiple ways of impacting a body. This depends on the stage of lung cancer and at which point it becomes diagnosed. At early stages, lung cancers are often asymptomatic and most patients are unaware that they have the disease. As the disease becomes more advanced, variable symptoms can develop."
506,msmarco,_doc,MARCO_7513928,5.1733522,"Lung cancer often spreads (metastasizes) to other parts of the body, such as the brain and the bones. Cancer that spreads can cause pain, nausea, headaches, or other signs and symptoms depending on what organ is affected. Once lung cancer has spread beyond the lungs, it's generally not curable."
507,msmarco,_doc,MARCO_182132,5.1730556,"Stages of non-small cell lung cancer: 1  Occult stage non-small cell lung cancer: Cancer cells are found in sputum, but no tumor can be found in the lung by imaging tests or bronchoscopy, or the tumor is too small to be checked.  Stage 0 non-small cell lung cancer: Cancer at this stage is also known as carcinoma in situ."
508,msmarco,_doc,MARCO_929404,5.171132,"The complete study can be found here. The prevalence of this type of lung cancer makes this study even more exciting. Non-small cell lung cancer accounts for about 87% of diagnosed lung cancers, and lung cancer in general accounts for about 13% of all cancers. Litsea cubeba is also known as ‘May Chang‘, an essential oil steam distilled from the seeds of trees most commonly sourced as wildcrafted from China."
509,msmarco,_doc,MARCO_7824045,5.170427,Let's take a look at the symptoms of liver metastases and how these are treated. 1  You may also be interested in learning about the management of: 2  Brain metastases from lung cancer. 3  Bone metastases from lung cancer. 4  Adrenal gland metastases from lung cancer.
510,msmarco,_doc,MARCO_5641305,5.169767,as noted asbestos exposure can lead to the development of various cancers and other illnesses we have briefly outlined the most common types of asbestos disease which are mesothelioma mesothelioma is a rare and fatal cancer that attacks the protective lining of the lungs heart or stomachdespite the rarity of this illness the national cancer institute states that it is also the most common type of cancer caused by exposure to asbestoshe most common symptoms of asbestos caused lung cancer include anemia coughing and hoarseness shortness of breath or change in breathing patterns chronic chest pain fatigue weight loss
511,msmarco,_doc,MARCO_841050,5.1696777,"Bronchioles and alveoli. Smoking causes the majority of lung cancers — both in smokers and in people exposed to secondhand smoke. But lung cancer also occurs in people who never smoked and in those who never had prolonged exposure to secondhand smoke. In these cases, there may be no clear cause of lung cancer.moking causes the majority of lung cancers — both in smokers and in people exposed to secondhand smoke. But lung cancer also occurs in people who never smoked and in those who never had prolonged exposure to secondhand smoke."
512,msmarco,_doc,MARCO_1536800,5.1696386,"Screening means checking your body for cancer before you have symptoms. Getting screening tests regularly may find breast, cervical, and colorectal (colon) cancers early, when treatment is likely to work best.Lung cancer screening is recommended for some people who are at high risk.creening means checking your body for cancer before you have symptoms. Getting screening tests regularly may find breast, cervical, and colorectal (colon) cancers early, when treatment is likely to work best. Lung cancer screening is recommended for some people who are at high risk."
513,msmarco,_doc,MARCO_3118015,5.168124,"Secondary Brain Tumors. Secondary brain tumors are tumors caused from cancer that originates in another part of the body. These tumors are not the same as primary brain tumors. The spread of cancer within the body is called metastasis. Cancer that spreads to the brain is the same disease and has the same name as the original (primary) cancer. For example, if lung cancer spreads to the brain, the disease is called metastatic lung cancer because the cells in the secondary tumor resemble abnormal lung cells, not abnormal brain cells. Treatment for secondary brain tumors depends on where the cancer started and the extent of the spread as well as other factors, including the patient's age general health, and response to ..."
514,msmarco,_doc,MARCO_538997,5.167863,"Liver Cancer (Definition). Cancer of the liver can be a primary cancer (hepatocellular cancer) & is more common in those exposed to hepatitis b or hepatitis c or cirrhosis from other causes. It can also be a secondary cancer, spread from another site such as colon, stomach, lung, etc.iver Cancer (Definition). Cancer of the liver can be a primary cancer (hepatocellular cancer) & is more common in those exposed to hepatitis b or hepatitis c or cirrhosis from other causes. It can also be a secondary cancer, spread from another site such as colon, stomach, lung, etc."
515,msmarco,_doc,MARCO_4641439,5.165095,"Symptoms That May Suggest Lung Cancer. The symptoms of back pain related to lung cancer are diverse but have certain tell-tale signs. If it involves the spine, it can mimic many of the symptoms of an upper back injury. If it doesn't, the pain may be generalized like a muscle ache or sharp like a pinched nerve."
516,msmarco,_doc,MARCO_1978626,5.1645846,"People who smoke have the greatest risk of lung cancer. The risk of lung cancer increases with the length of time and number of cigarettes you've smoked. If you quit smoking, even after smoking for many years, you can significantly reduce your chances of developing lung cancer. 1  Symptoms."
517,msmarco,_doc,MARCO_558908,5.162178,"Symptoms of lung cancer are mild or even unnoticeable in the early stages of the disease. You’re likely to have noticeable symptoms in the late stages. Lung cancer symptoms include coughing, shortness of breath, and wheezing. You may also experience shoulder or back pain, numbness of your limbs, and jaundice."
518,msmarco,_doc,MARCO_2583485,5.1620445,"Does Smoking Cause Lung Cancer. die from lung cancer and other smoking related diseases than they die from aids, drug abuse, car accidents and homicide, combined. Cigarette smoking is a danger to our life and health.It is the leading known cause of lung cancer.oes Smoking Cause Lung Cancer. die from lung cancer and other smoking related diseases than they die from aids, drug abuse, car accidents and homicide, combined. Cigarette smoking is a danger to our life and health."
519,msmarco,_doc,MARCO_6472757,5.161668,"Lung cancer (small cell) Small cell lung cancer is the least common type of lung cancer and can cause a cough, chest pain, and more. Swallowed object Symptoms of swallowing an object include coughing, choking, vomiting, throat pain, breathing trouble, and more."
520,msmarco,_doc,MARCO_135782,5.1606193,"A pleural effusion is a buildup of extra fluid in the pleural space, which is the space between the lungs and the chest wall. About half of people with cancer develop a pleural effusion.Cancer growing in the pleural space causes a malignant pleural effusion.More than 75% of people with a malignant pleural effusion have lymphoma or cancers of the breast, lung, or ovary. This condition is considered a sign of metastatic cancer, or cancer that has spread to other areas of the body.ancer growing in the pleural space causes a malignant pleural effusion. More than 75% of people with a malignant pleural effusion have lymphoma or cancers of the breast, lung, or ovary. This condition is considered a sign of metastatic cancer, or cancer that has spread to other areas of the body."
521,msmarco,_doc,MARCO_3239280,5.160244,"But there are dozens of different ribbon colors representing each type of cancer. Breast cancer organizations have done a great job of promoting pink ribbons, but there are more common cancers that have their own ribbon colors that deserve recognition as well. The three most common types of cancer are skin cancer (or melanoma), lung cancer and prostate cancer (in that order). Skin cancer is represented by a black ribbon, lung cancer by a white ribbon and prostate cancer is light blue. The first documentation of symbolic ribbons comes from medieval times."
522,msmarco,_doc,MARCO_6209354,5.160244,"Tobacco use is the cause of about 22% of cancer deaths. Another 10% is due to obesity, a poor diet, lack of physical activity, and consumption of alcohol. Other factors include certain infections, exposure to ionizing radiation, and environmental pollutants.t caused about 8.2 million deaths or 14.6% of all human deaths. The most common types of cancer in males are lung cancer, prostate cancer, colorectal cancer, and stomach cancer, and in females, the most common types are breast cancer, colorectal cancer, lung cancer, and cervical cancer."
523,msmarco,_doc,MARCO_3658893,5.1596265,"10 of the Worst Diseases Smoking Causes. Smoking cigarettes will kill you, but before you die, you could experience some pretty terrible diseases and health conditions from smoking. Here are some of the most gruesome diseases caused by smoking*: Lung Cancer. More people die from lung cancer than any other type of cancer. Cigarette smoking is the number one risk factor for lung cancer; it's responsible for 87 percent of lung cancer deaths. Your chance of still being alive five years after being diagnosed is less than 1 in 5."
524,msmarco,_doc,MARCO_5350357,5.1596265,"Jeff Healey had a surgery for Lung Cancer last year (Blog Entry: Jeff Healey Lung Cancer). Patrick Swayze-On March 5, 2008, media announced that the Roadhouse buddy Patrick Swayze is battling cancer.eff Healey had a surgery for Lung Cancer last year (Blog Entry: Jeff Healey Lung Cancer). Patrick Swayze-On March 5, 2008, media announced that the Roadhouse buddy Patrick Swayze is battling cancer."
525,msmarco,_doc,MARCO_5666417,5.1596265,"Primary lung tumors account for 50% of all metastatic brain tumors. Lung cancer is the most common origin of metastatic disease. Of lung cancer patients who survive for more than 2 years, 80% will have brain metastases.esticular tumor is a uncommon cancer and yet it more frequently metastasizes to the brain as compared with lung cancer. Patients with brain metastasis at the same time of having systemic cancer (synchronous metastasis) tend to do worse as compared with patients with metachronous metastatic disease."
526,msmarco,_doc,MARCO_4627140,5.158754,"CT scan for lung cancer. CT scan for lung cancer. A CT scan reveals the anatomy of the lungs and surrounding tissues, which our cancer doctors use to diagnose and monitor tumor growth. If neurological symptoms are present, a CT scan of the brain may be performed to check for metastases."
527,msmarco,_doc,MARCO_6209352,5.1564455,"Cancer, also known as a malignant tumor or malignant neoplasm, is a group of diseases involving abnormal cell growth with the potential to invade or spread to other parts of the body.Not all tumors are cancerous; benign tumors do not spread to other parts of the body.t caused about 8.2 million deaths or 14.6% of all human deaths. The most common types of cancer in males are lung cancer, prostate cancer, colorectal cancer, and stomach cancer, and in females, the most common types are breast cancer, colorectal cancer, lung cancer, and cervical cancer."
528,msmarco,_doc,MARCO_154488,5.1559505,Itching skin and Liver cancer and Thyroid symptoms and Abdominal symptoms (2 causes) Itching skin and Liver cancer and Thyroid symptoms and Arthritis-like symptoms (2 causes) Itching skin and Liver cancer and Thyroid symptoms and Cancer-related symptoms (2 causes) Itching skin and Liver cancer and Thyroid symptoms and Diabetes-like symptoms (2 causes) Itching skin and Liver cancer and Thyroid symptoms and Diabetes-related symptoms (2 causes) Itching skin and Liver cancer and Thyroid symptoms ...
529,msmarco,_doc,MARCO_1734123,5.155806,"Limited stage: In this stage, cancer is found on one side of the chest, involving just one part of the lung and nearby lymph nodes. Extensive stage: In this stage, cancer has spread to other regions of the chest or other parts of the body.tage I: The cancer is located only in the lungs and has not spread to any lymph nodes. Stage II: The cancer is in the lung and nearby lymph nodes. Stage III: Cancer is found in the lung and in the lymph nodes in the middle of the chest, also described as locally advanced disease."
530,msmarco,_doc,MARCO_6679234,5.155806,"All lung cancer starts with a nodule but 95% of lung nodules are not cancer and most do not need further attention, especially in people at low risk for lung cancer. Nodules that are not cancer may be the result of a bacterial or fungal infection in the past that causes inflammation and scarring in the lungs.octors may call them lesions, coin lesions or solitary pulmonary nodules (SPN). Lung nodules are very common – at least 50% of people have them by the time they are 50 years old. The challenge is figuring out which nodules are or will become cancer."
531,msmarco,_doc,MARCO_4606755,5.15444,"Pleural mesothelioma is a disease that affects the lining of the lungs, or lung pleura. Sometimes doctors refer to this disease as mesothelioma of the pleura. It is a common misconception that mesothelioma is a type of primary lung cancer; it is not.Mesothelioma is a cancer of the serous membranes. These membranes enclose a number of organs throughout the midsection of the body, including the lungs.ometimes doctors refer to this disease as mesothelioma of the pleura. It is a common misconception that mesothelioma is a type of primary lung cancer; it is not. Mesothelioma is a cancer of the serous membranes. These membranes enclose a number of organs throughout the midsection of the body, including the lungs."
532,msmarco,_doc,MARCO_4651584,5.1526537,"Those abbreviations stand for: fluorodeoxyglucose (FDG)-positron emission tomography (PET). The role of this procedure is to detect metabolically active malignant lesions including lung cancer, colorectal cancer, lymphoma, melanoma, breast cancer, ovarian cancer, brain cancer and multiple myeloma.hose abbreviations stand for: fluorodeoxyglucose (FDG)-positron emission tomography (PET). The role of this procedure is to detect metabolically active malignant lesions including lung cancer, colorectal cancer, lymphoma, melanoma, breast cancer, ovarian cancer, brain cancer and multiple myeloma."
533,msmarco,_doc,MARCO_8528933,5.151993,"As noted, asbestos exposure can lead to the development of various cancers and other illnesses. We have briefly outlined the most common types of asbestos disease, which are: 1  Mesothelioma: Mesothelioma is a rare and fatal cancer that attacks the protective lining of the lungs, heart, or stomach. Asbestos-Caused Lung Cancer: Lung cancer is one of the most common asbestos diseases. 2  Individuals exposed to asbestos over long periods of time have an increased risk of developing lung cancer, especially those who smoke tobacco."
534,msmarco,_doc,MARCO_3403543,5.150648,"This is often the first test your doctor will do to look for any masses or spots on the lungs. Plain x-rays of your chest can be done at imaging centers, hospitals, and even in some doctors’ offices. If the x-ray is normal, you probably don’t have lung cancer (although some lung cancers may not show up on an x-ray).If something suspicious is seen, your doctor may order more tests.lain x-rays of your chest can be done at imaging centers, hospitals, and even in some doctors’ offices. If the x-ray is normal, you probably don’t have lung cancer (although some lung cancers may not show up on an x-ray). If something suspicious is seen, your doctor may order more tests."
535,msmarco,_doc,MARCO_3400285,5.1471257,"1 Typically, metastatic lung cancer in the adrenal glands also causes no symptoms at the time of diagnosis. 2  Metastasis to the bones is most common with small cell lung cancer but can occur with NSCLC. 3  Lung cancer that has metastasized to the bone causes deep pain, usually in the backbone (vertebrae), thighbones, and ribs."
536,msmarco,_doc,MARCO_8334626,5.1471257,"Tools & Resources. Dogs Sniff Out Lung Cancer in Humans. Aug. 17, 2011 -- German researchers say that highly trained dogs are able to reliably sniff out lung cancer in human breath. In its early stages, lung cancer has few symptoms, making it difficult for doctors to catch it early, when it's still treatable."
537,msmarco,_doc,MARCO_8366288,5.1471257,Lung cancer screening. Medicare Part B (Medical Insurance) covers a lung cancer screening with Low Dose Computed Tomography (LDCT) once per year. People with Part B who meet all of these conditions: 1  They're 55-77.  They're asymptomatic (they don’t have signs or symptoms of lung cancer).
538,msmarco,_doc,MARCO_2112274,5.145092,"Some people use Panax ginseng to treat breast cancer and prevent ovarian cancer, liver cancer, lung cancer, and skin cancer. Other uses include treatment of anemia, diabetes, inflammation of the stomach lining (gastritis), fever, hangover, chronic obstructive pulmonary disease (COPD), and asthma.ome people use Panax ginseng to treat breast cancer and prevent ovarian cancer, liver cancer, lung cancer, and skin cancer. Other uses include treatment of anemia, diabetes, inflammation of the stomach lining (gastritis), fever, hangover, chronic obstructive pulmonary disease (COPD), and asthma."
539,msmarco,_doc,MARCO_3751270,5.145092,Prognosis. Breast cancer is the second most lethal cancer in women. (Lung cancer is the leading cancer killer in women.) The good news is that early detection and new treatments have improved survival rates.The 5-year survival rate for women diagnosed with cancer is 80%.n-Depth From A.D.A.M. Breast cancer is the second most lethal cancer in women. (Lung cancer is the leading cancer killer in women.) The good news is that early detection and new treatments have improved survival rates. The 5-year survival rate for women diagnosed with cancer is 80%.
