,_index,_type,_id,_score,_source.body
231,msmarco,_doc,MARCO_3811541,5.6519413,"While cigarette smoking is the most important risk factor for lung cancer, asbestos exposure is also an important factor. Inhaled asbestos and smoking work together synergistically to cause lung cancer.The risk of lung cancer in a smoker that has been exposed to asbestos is higher than the risk of the two factors combined. Smokers and those exposed to asbestos each have about a 5 to 10-fold increased risk of developing lung cancer.nhaled asbestos and smoking work together synergistically to cause lung cancer. The risk of lung cancer in a smoker that has been exposed to asbestos is higher than the risk of the two factors combined. Smokers and those exposed to asbestos each have about a 5 to 10-fold increased risk of developing lung cancer."
232,msmarco,_doc,MARCO_805368,5.6486225,"The risk of getting lung cancer increases with age and is greater in men than in women. The tables below shows the percentage of men or women (how many out of 100) who will get lung cancer over different time periods. The time periods are based on the person's current age.For example, go to the men’s current age 60. The table shows 2.05% of men who are now 60 years old will get lung cancer sometime during the next 10 years. That is, 2 or 3 out of every 100 men who are 60 years old today will get lung cancer by the age of 70.he risk of getting lung cancer increases with age and is greater in men than in women. The tables below shows the percentage of men or women (how many out of 100) who will get lung cancer over different time periods. The time periods are based on the person's current age."
233,msmarco,_doc,MARCO_2282265,5.6486225,"There are some estimates that lifetime risk of lung cancer in a very heavy smoker is about 30% overall, whereas it is 1% or less in nonsmokers. This translates into about a third of very heavy smokers developing lung cancer. Also, 15 to 20 of every 100 patients who have lung cancer are lifelong nonsmokers.Some get it because of secondhand smoke and some get it for unknown reasons. People who start smoking at younger ages are at higher risk later in life. Lung cancer rates begin increasing in the mid to late 40s and peak in the late 70s.lso, 15 to 20 of every 100 patients who have lung cancer are lifelong nonsmokers. Some get it because of secondhand smoke and some get it for unknown reasons. People who start smoking at younger ages are at higher risk later in life. Lung cancer rates begin increasing in the mid to late 40s and peak in the late 70s."
234,msmarco,_doc,MARCO_8497728,5.6486225,1 EGFR mutations are associated with non-small cell lung cancer. 2  Epidermal growth factor receptor gene mutations are associated with treatment response in advanced non-small cell lung cancer. 3  The epidermal growth factor receptor (EGFR) is over-expressed in 40-80% of patients with non-small-cell lung cancer (NSCLC). Epidermal growth factor receptor mutation is associated with response to therapy in resected advanced non-small-cell lung cancer. 2  Nuclear EGFR protein expression predicts poor survival in early stage non-small cell lung cancer. 3  EGFR activating mutations are associated with brain metastases in non-small lung cancer.
235,msmarco,_doc,MARCO_6617626,5.64753,"The one-year survival rate is the percentage of people who survive at least one year after the cancer is found. For all people with lung cancer, the one-year survival rate is 44%. The five-year survival rate is 17%. Survival rates depend on several factors, the subtype of lung cancer and the stage of disease.Of the 15% of lung cancers detected at an early stage (stages I to III), the five-year survival rate is 54%.he one-year survival rate is the percentage of people who survive at least one year after the cancer is found. For all people with lung cancer, the one-year survival rate is 44%. The five-year survival rate is 17%. Survival rates depend on several factors, the subtype of lung cancer and the stage of disease."
236,msmarco,_doc,MARCO_5222523,5.645954,"Symptoms of cancer depend on the type and location of the cancer. For example, lung cancer can cause coughing, shortness of breath, or chest pain. Colon cancer often causes diarrhea, constipation, and blood in the stool.ymptoms of cancer depend on the type and location of the cancer. For example, lung cancer can cause coughing, shortness of breath, or chest pain. Colon cancer often causes diarrhea, constipation, and blood in the stool."
237,msmarco,_doc,MARCO_5641308,5.6443024,asbestos caused lung cancer lung cancer is one of the most common asbestos diseases individuals exposed to asbestos over long periods of time have an increased risk of developing lung cancer especially those who smoke tobaccohe most common symptoms of asbestos caused lung cancer include anemia coughing and hoarseness shortness of breath or change in breathing patterns chronic chest pain fatigue weight loss
238,msmarco,_doc,MARCO_1278959,5.640025,"Test for Stage IV Lung Cancer. Despite being spread to the brain, the stage IV lung cancer can spread to the bones, liver, and the adrenal glands. By using normal x-rays, CT scans, bone scans, and blood tests, stage IV cancer diagnosis is done.During the stage IV lung cancer if bone scans are done, then it might disclose the metastases in the bone.est for Stage IV Lung Cancer. Despite being spread to the brain, the stage IV lung cancer can spread to the bones, liver, and the adrenal glands. By using normal x-rays, CT scans, bone scans, and blood tests, stage IV cancer diagnosis is done."
239,msmarco,_doc,MARCO_1925742,5.6338625,"The risk of getting lung cancer increases with age and is greater in men than in women. The tables below shows the percentage of men or women (how many out of 100) who will get lung cancer over different time periods. The time periods are based on the person's current age.For example, go to the men’s current age 60.The table shows 2.05% of men who are now 60 years old will get lung cancer sometime during the next 10 years. That is, 2 or 3 out of every 100 men who are 60 years old today will get lung cancer by the age of 70.he time periods are based on the person's current age. For example, go to the men’s current age 60. The table shows 2.05% of men who are now 60 years old will get lung cancer sometime during the next 10 years. That is, 2 or 3 out of every 100 men who are 60 years old today will get lung cancer by the age of 70."
240,msmarco,_doc,MARCO_8204326,5.6338625,"As with other forms of lung cancer, your risk of adenocarcinoma increases if you. 1  Smoke. Smoking cigarettes is by far the leading risk factor for lung cancer. 2  Breathe tobacco smoke. Nonsmokers who inhale fumes from cigarette, cigar, and pipe smoking have an increased risk of lung cancer. 3  Are exposed to radon gas. Radon is a colorless, odorless radioactive gas formed in the ground. It seeps into the lower floors of homes and other buildings and can contaminate drinking water. Radon exposure is the second leading cause of lung cancer. It’s not clear whether elevated radon levels contribute to lung cancer in nonsmokers. But radon exposure does contribute to increased rates of lung cancer in smokers and in people who regularly breathe high amounts of the gas (miners, for example). You can test radon levels in your home with a radon testing kit. Are exposed to asbestos."
241,msmarco,_doc,MARCO_7363067,5.630678,Pleural effusion can be caused by cancer cells spreading to the pleura. It can also develop if cancer cells block or change the flow of lymph fluid in the pleural cavity. The following cancers are more likely to cause pleural effusion: 1  lung cancer. 2  breast cancer. 3  non-Hodgkin lymphoma. 4  Hodgkin lymphoma. 5  ovarian cancer.6  leukemia. 7  melanoma. 8  mesothelioma. 9  uterine cancer. 10  cervical cancer. 11  stomach cancer. 12  sarcomas. 13  cancer of unknown primary (CUP).he following cancers are more likely to cause pleural effusion: 1  lung cancer. 2  breast cancer. 3  non-Hodgkin lymphoma. 4  Hodgkin lymphoma. 5  ovarian cancer. 6  leukemia. 7  melanoma. 8  mesothelioma. 9  uterine cancer. 10  cervical cancer. 11  stomach cancer. 12  sarcomas. 13  cancer of unknown primary (CUP).
242,msmarco,_doc,MARCO_8037077,5.6264715,"This is how doctors can tell that it is cancer that has spread from another part of the body. Metastatic cancer has the same name as the primary cancer. For example, breast cancer that spreads to the lung is called metastatic breast cancer, not lung cancer. It is treated as stage IV breast cancer, not as lung cancer. Sometimes when people are diagnosed with metastatic cancer, doctors cannot tell where it started. This type of cancer is called cancer of unknown primary origin, or CUP. See the Carcinoma of Unknown Primary page for more information."
243,msmarco,_doc,MARCO_3365940,5.6227245,"Lung Cancer. A malignant pleural effusion is a complication that occurs in 30 percent of lung cancers. It can also occur with other cancers, such as breast cancer, ovarian cancer, leukemias, and lymphomas. With lung cancer, a malignant pleural effusion may be the first sign of cancer, or it can occur as a late complication of advanced lung cancer."
244,msmarco,_doc,MARCO_1383457,5.6188526,"In women, breast cancer is the most common type of cancer diagnosed, with 252,710 women and 2,240 men expected to be diagnosed. These numbers are important. Men get breast cancer too, and one out of every 100 cases of breast cancer occurs in a man. Most Common Cause of Cancer Death in Women. While many more women are diagnosed with breast cancer than lung cancer, lung cancer is the most common cause of cancer-related deaths in women. In 2017 it's expected that 71,280 women will die from lung cancer and 40,610 from breast cancer."
245,msmarco,_doc,MARCO_2033638,5.6177435,"The above pictures were primarily about how smoking causes cancer of the lung and other sites. But the assault on the lungs from the tars in tobacco are not just limited to causing cancer. Other lung diseases are directly caused by smoking, the most well known are the chronic obstructive lung diseases.he above pictures were primarily about how smoking causes cancer of the lung and other sites. But the assault on the lungs from the tars in tobacco are not just limited to causing cancer. Other lung diseases are directly caused by smoking, the most well known are the chronic obstructive lung diseases."
246,msmarco,_doc,MARCO_217418,5.614999,"Lung Cancer Symptoms, Stages, and Treatment. Lung Cancer: The Leading Cause of Cancer Death. Lung cancer has emerged as the leading killer of men and women stricken with invasive cancer, affecting husbands and wives, friends and neighbors, and causing suffering for many families."
247,msmarco,_doc,MARCO_3466603,5.6112623,"Ten most common causes of cancer death in females. Lung cancer is also the most common cause of cancer deaths in females, accounting for just over a fifth (21%) of all female cancer deaths.[ 1-3 ] Breast cancer is the second most common cause of cancer deaths in women, accounting for 15% of all female cancer deaths.here are more than 200 different types of cancer, but four of them-lung, bowel, breast and prostate cancer together account for almost half (46%) of all cancer deaths in the UK (2012). Lung is by far the most common cause of cancer death in the UK."
248,msmarco,_doc,MARCO_6275755,5.6112623,"1 Lung cancer: Non-small cell lung cancer accounts for 80 percent of lung cancers, and adenocarcinoma is the most common type. 2  Prostate cancer: Cancer that forms in the prostate gland is typically an adenocarcinoma, which makes up 99 percent of all prostate cancers. Esophageal cancer: Cancer that forms in the glandular cells of the esophagus is known as adenocarcinoma. 2  This is the most common type of esophageal cancer. 3  Colorectal cancer: Cancer that develops in the intestinal gland cells that line the inside of the colon and/or rectum is an adenocarcinoma."
249,msmarco,_doc,MARCO_2138284,5.6092043,"So when cancer develops in another system or organ in the body, the chances are great that it eventually will find its way to the lungs. In fact, often the discovery of a lung metastasis is the first indication that the patient has cancer, and it prompts a search for the primary cancer in the body.auses of a Lung Metastasis. Common cancers that metastasize to the lungs include breast cancer, colon cancer, prostate cancer, bladder cancer, neuroblastoma, sarcoma and others."
250,msmarco,_doc,MARCO_3811540,5.606326,"1 Asbestosis, an inflammatory condition of lungs that can cause shortness of breath, coughing, and eventually scarring of the lungs that makes it hard to breathe. 2  Mesothelioma, a rare cancer that affects the lining of the lungs, chest cavity, or abdomen. 3  Lung cancer. Asbestosis, an inflammatory condition of lungs that can cause shortness of breath, coughing, and eventually scarring of the lungs that makes it hard to breathe. 2  Mesothelioma, a rare cancer that affects the lining of the lungs, chest cavity, or abdomen. 3  Lung cancer."
251,msmarco,_doc,MARCO_4528316,5.6049514,"Most common cancer. Prostate cancer is the most common cancer in men in the UK, with more than 30,000 men diagnosed annually. Around 10,000 men die from it every year, making it the second most common cause of cancer deaths in men after lung cancer. Most men with early prostate cancer have no symptoms at all. Some of the symptoms of prostate cancer below can also be caused by other prostate problems. Symptoms of all prostate problems include: 1  needing to urinate often, especially at night. 2  difficulty starting to urinate. 3  straining to urinate or taking a long time to finish."
252,msmarco,_doc,MARCO_1734120,5.600909,"Progressing Toward Death. When treatment for lung cancer has failed to stop advancement of the disease, a few main symptoms are of most concern. Pain at the primary cancer site and in any place where it has spread is the first symptom that needs the attention of the treating health care providers and family members.ung cancer patients enter definite stages of death. Photo Credit Jupiterimages/Photos.com/Getty Images. Lung cancer is the most common cancer in the United States, and while often treatable, it frequently progresses and causes death."
253,msmarco,_doc,MARCO_589747,5.5976577,"Most cancers that start in the lung, known as primary lung cancers, are carcinomas. The two main types are small-cell lung carcinoma (SCLC) and non-small-cell lung carcinoma (NSCLC). The most common symptoms are coughing (including coughing up blood), weight loss, shortness of breath, and chest pains. The vast majority (85%) of cases of lung cancer are due to long-term tobacco smoking."
254,msmarco,_doc,MARCO_4926581,5.5939174,"Lung (Definition) 1  Deoxygenated blood enters the lungs from the right side of the heart and travels to the lungs. 2  A lung nodule is a symptom in which a person has a chest x-ray or CT scan that shows a small lump (nodule) in a lung. A lung nodule can be cancerous or non-cancerous. If cancerous, it can be a lung cancer or can be a metastatic cancer that spread from another part of the body. ...Read more."
255,msmarco,_doc,MARCO_5290662,5.589992,"For Women: Breast cancer is the leading cancer for women in the US. Lung cancer is the second most common form of cancer and colorectal cancer is third among white women. The number 2 and 3 cancers are reversed among black and Asian/Pacific Island women. For all women, the fourth leading cancer is cancer of the uterus. For Men: Prostate cancer is the leading cancer for men in the US. It is followed by lung cancer and then colorectal cancer. The fourth most common cancer is race-dependent. It is bladder cancer for white men, cancer of the mouth and throat for black men; and stomach cancer for Asian/Pacific Island men."
256,msmarco,_doc,MARCO_3818696,5.5844755,"Diseases and Condition That Are Similar to Lung Cancer. In reviewing the signs and symptoms of lung cancer you'll notice that there are many other conditions which have similar signs and symptoms, In fact, a large number of people with lung cancer are first misdiagnosed with these other conditions, delaying treatment."
257,msmarco,_doc,MARCO_2771361,5.581553,"Eventually, people with lung cancer do develop symptoms. Approximately 95% of people. diagnosed with lung cancer have symptoms related to the disease. However, they occur late. in the cancerous process. The long silent growth period of lung cancer has led to great."
258,msmarco,_doc,MARCO_7112612,5.580537,"A malignant pleural effusion is a complication that occurs in 30 percent of lung cancers. It can also occur with other cancers, such as breast cancer, ovarian cancer, leukemias, and lymphomas. With lung cancer, a malignant pleural effusion may be the first sign of cancer, or it can occur as a late complication of advanced lung cancer. Overview A pleural effusion is defined as an abnormal amount of fluid in the space between the layers of tissue (the pleura) that line the lungs. If cancer cells are present in this fluid (the pleural cavity), it is called a malignant (cancerous) pleural effusion."
259,msmarco,_doc,MARCO_28055,5.5788493,"Cancers that spread to the lungs: Cancers that start in other organs (such as the breast, pancreas, kidney, or skin) can sometimes spread (metastasize) to the lungs, but these are not lung cancers. For example, cancer that starts in the breast and spreads to the lungs is still breast cancer, not lung cancer."
260,msmarco,_doc,MARCO_5908108,5.5779533,"Primary lung cancer starts in the lungs. The cancer cells are abnormal lung cells. Sometimes, people will have cancer travel from another part of their body or metastasize to their lungs. This is called secondary lung cancer because the lungs are a secondary site compared to the original primary location of the cancer."
261,msmarco,_doc,MARCO_3178149,5.576745,"A cancer that has spread to another part of the body is called a secondary cancer. The most common areas that lung cancer spreads to are the lymph nodes (in the chest, abdomen, neck or armpit), the liver, the bones and the brain. More rarely lung cancer can spread to the adrenal glands or to other areas of the body. cancer that has spread to another part of the body is called a secondary cancer. The most common areas that lung cancer spreads to are the lymph nodes (in the chest, abdomen, neck or armpit), the liver, the bones and the brain. More rarely lung cancer can spread to the adrenal glands or to other areas of the body."
262,msmarco,_doc,MARCO_6338452,5.576745,"When cancer spreads to lymph nodes, the cancer cells in the nodes will look like cells from the primary tumour when they’re examined under the microscope. For example, when a lung cancer | has spread to the lymph nodes, the cells in the lymph nodes look like lung cancer cells.This affects the way they are treated.hen cancer spreads to lymph nodes, the cancer cells in the nodes will look like cells from the primary tumour when they’re examined under the microscope. For example, when a lung cancer | has spread to the lymph nodes, the cells in the lymph nodes look like lung cancer cells."
263,msmarco,_doc,MARCO_3586482,5.575011,"For Women: Breast cancer is the leading cancer for women in the US. Lung cancer is the second most common form of cancer and colorectal cancer is third among white women. The number 2 and 3 cancers are reversed among black and Asian/Pacific Island women. For all women, the fourth leading cancer is cancer of the uterus. For Men: Prostate cancer is the leading cancer for men in the US. It is followed by lung cancer and then colorectal cancer. The fourth most common cancer is race-dependent. It is bladder cancer for white men, cancer of the mouth and throat for black men; and stomach cancer for Asian/Pacific Island men. For Children: The most common malignancies in childhood are leukemia, followed by brain tumors, and lymphoma."
264,msmarco,_doc,MARCO_108749,5.5749507,"There are two types of lung cancer: non-small cell lung cancer and small cell lung cancer. Most people diagnosed with lung cancer have non-small cell lung cancer. For each type of cancer, the outlook and the treatment may differ."
265,msmarco,_doc,MARCO_108755,5.572131,"Most people diagnosed with lung cancer have non-small cell lung cancer. For each type of cancer, the outlook and the treatment may differ. Non-small cell lung cancer occurs in the airways of the lungs or the outer part of the lungs. It usually grows slower than small cell lung cancers."
266,msmarco,_doc,MARCO_5986646,5.5685024,Bronchial obstruction and Lung symptoms and Breathing difficulties (9 causes) Bronchial obstruction and Lung symptoms and Throat symptoms (9 causes) Bronchial obstruction and Lung symptoms and Cough (8 causes) Bronchial obstruction and Lung symptoms and Head symptoms (8 causes) Bronchial obstruction and Lung symptoms and Heart symptoms (8 causes) Bronchial obstruction and Lung symptoms and Skin symptoms (8 causes)
267,msmarco,_doc,MARCO_3400281,5.5669827,"1 Metastatic lung cancer in the liver usually does not cause any symptoms, at least at the time of diagnosis. 2  Typically, metastatic lung cancer in the adrenal glands also causes no symptoms at the time of diagnosis. 3  Metastasis to the bones is most common with small cell lung cancer but can occur with NSCLC."
268,msmarco,_doc,MARCO_1037979,5.563371,"The lungs are a pair of spongy, air-filled organs located on either side of the chest (thorax). The trachea (windpipe) conducts inhaled air into the lungs through its tubular branches, called bronchi. The bronchi then divide into smaller and smaller branches (bronchioles), finally becoming microscopic. Lung cancer: Cancer may affect almost any part of the lung. 2  Most lung cancer is caused by smoking. 3  Tuberculosis: A slowly progressive pneumonia caused by the bacteria Mycobacterium tuberculosis. 4  Chronic cough, fever, weight loss, and night sweats are common symptoms of tuberculosis."
269,msmarco,_doc,MARCO_879646,5.561651,"Smoking has been linked to various types of cancer — including cancer of the lung, bladder, cervix and kidney. And chewing tobacco has been linked to cancer of the oral cavity and pancreas. Even if you don't use tobacco, exposure to secondhand smoke might increase your risk of lung cancer.Avoiding tobacco — or deciding to stop using it — is one of the most important health decisions you can make. It's also an important part of cancer prevention.moking has been linked to various types of cancer — including cancer of the lung, bladder, cervix and kidney. And chewing tobacco has been linked to cancer of the oral cavity and pancreas. Even if you don't use tobacco, exposure to secondhand smoke might increase your risk of lung cancer."
270,msmarco,_doc,MARCO_8397814,5.561164,"Cancer, also called malignancy, is an abnormal growth of cells. There are more than 100 types of cancer, including breast cancer, skin cancer, lung cancer, colon cancer, prostate cancer, and lymphoma. Symptoms vary depending on the type.Cancer treatment may include chemotherapy, radiation, and/or surgery.he earlier cancer is diagnosed and treated, the better the chance of its being cured. Some types of cancer -- such as those of the skin, breast, mouth, testicles, prostate, and rectum -- may be detected by routine self-exam or other screening measures before the symptoms become serious."
271,msmarco,_doc,MARCO_6718908,5.5601406,"Cancer often spreads (metastasizes) to the bones from other sites in the body (e.g., breast cancer, prostate cancer, lung cancer). When this occurs, the cancer cells resemble cells from the area they originated from, not bone cancer cells. This type of cancer is called metastatic bone cancer or secondary bone cancer.Bones are a specialized type of dense tissue (called osseous tissue) that comprises the framework of the body (the skeleton). Most bones are hollow and consist of bone cells (osteocytes) embedded in calcified tissue.ancer often spreads (metastasizes) to the bones from other sites in the body (e.g., breast cancer, prostate cancer, lung cancer). When this occurs, the cancer cells resemble cells from the area they originated from, not bone cancer cells. This type of cancer is called metastatic bone cancer or secondary bone cancer."
272,msmarco,_doc,MARCO_7150698,5.56011,People also viewed. 1  Talk to a doctor live online for free. 2  Extensive small cell lung cancer spread to bone adrenal glands. 3  Lung cancer metastasis to adrenal gland. 4  Stage iv lung cancer with mets to adrenal gland. 5  Ask a doctor a question free online. 6  Cancer of the adrenal gland symptoms. 7  Tumor or cancer of the adrenal gland.
273,msmarco,_doc,MARCO_1227209,5.5594316,"Passive exposure to tobacco smoke (passive smoking) also can cause lung cancer. The two types of lung cancer, which grow and spread differently, are small cell lung cancers (SCLC) and non-small cell lung cancers (NSCLC). The stage of lung cancer refers to the extent to which the cancer has spread in the body."
274,msmarco,_doc,MARCO_4417192,5.5545683,"The secondary cancer is named according to the primary cancer. For example, a cancer that starts in the lungs and spreads to the liver is still a lung cancer. The secondary cancer in the liver is made up of lung cancer cells and not liver cells. Secondary cancers are also usually treated according to the primary cancer. Knowing where the cancer started helps the doctors to know what types of treatment to use for the secondary cancer."
