,_index,_type,_id,_score,_source.body
708,msmarco,_doc,MARCO_5142902,4.3715177,"1 With a rapid strep test, results are ready in 10 minutes instead of 1 to 2 days with a throat culture. 2  If the rapid strep test results are positive, antibiotics can be started immediately. 3  A throat culture is more accurate than the rapid strep test. Find the cause of a sore throat. 2  Most sore throat infections are caused by a virus. 3  A throat culture shows the difference between a bacterial infection and a viral infection. 4  Finding the organism that is causing the infection can guide treatment."
709,msmarco,_doc,MARCO_1604976,4.3706503,"Smoking causes more than 48% of deaths caused by 12 cancers. Everyone knows smoking can cause lung cancer. But it also causes a whole array of other varieties of the disease, from pancreatic cancer to leukemia. Now, new research sheds light on just how deadly tobacco can be when smokers get cancer. Smoking causes more than 48% of deaths from the 12 types of cancer sometimes caused by smoking, according to new research in JAMA Internal Medicine. Smoking caused more than 80% of lung cancer deaths as well as 77% of larynx cancer deaths. Other top cancers caused by smoking include esophagus, kidney and liver cancer."
710,msmarco,_doc,MARCO_3379755,4.369864,"Factors that increase the risk of development of cancer is known as risk factors for cancer. These risk factors may be modifiable like smoking where a person can exert control or un-modifiable factors like age and gender. Smoking can cause cancers of the lungs, mouth, throat, bladder, kidneys and several other organs."
711,msmarco,_doc,MARCO_5674679,4.369864,"Passive smoking. Breathing in other people's smoke, also called second-hand smoke, can cause cancer. Passive smoking can increase a non-smoker's risk of getting lung cancer by a quarter, and may also increase the risk of cancers of the larynx (voice box) and pharynx (upper throat)."
712,msmarco,_doc,MARCO_8262676,4.369483,"Strep throat. Another possible cause of white spots on the tonsils is strep throat. Strep throat is caused by bacteria called streptococcus, and has symptoms such as inflammation and throat pain. Strep throat often includes symptoms such as loss of appetite, very sore throat, difficulty swallowing, swelling of the lymph nodes in the neck, sudden onset of fever, child, and headache."
713,msmarco,_doc,MARCO_7510304,4.369483,"Swollen throat glands are often caused by infection. Strep throat is a common infection of the throat tissues caused by group A streptococcal bacteria. Common symptoms of strep throat include fever, headache, sore throat, and tender, swollen glands in the neck. School-age children most frequently contract strep throat, although the infection may occur in any age group."
714,msmarco,_doc,MARCO_8775576,4.369483,"However, having a painful sore throat on just one side is less common. Having a sore throat on just one side of your throat has a number of causes which may be quite obvious. Other causes of pain in just the left or right side of your throat require a careful medical examination especially if your sore throat is persistent. Advertisement For example, if you have had a wisdom tooth extracted, you may experience pain and swelling on that side of your throat."
715,msmarco,_doc,MARCO_156287,4.3690352,"Strep throat is a contagious disease caused by infection with streptococcal bacteria, which causes inflammation and swelling of the mucous membranes lining the back of the throat and the tonsils.trep throat is a contagious disease caused by infection with streptococcal bacteria, which causes inflammation and swelling of the mucous membranes lining the back of the throat and the tonsils."
716,msmarco,_doc,MARCO_2669802,4.3690352,1 Burning symptoms and Throat symptoms and Face symptoms (208 causes) 2  Burning symptoms and Throat symptoms and Pain (203 causes) 3  Burning symptoms and Throat symptoms and Sensory symptoms (201 causes)  Burning symptoms and Throat symptoms and Sensations (197 causes)
717,msmarco,_doc,MARCO_8467461,4.3677263,"Post-nasal drip occurs when thick or excessive amounts of mucus drip into the back of the throat. The inflammatory substances in the drip coupled with trying to clear the excessive mucus, causes irritation and discomfort. Excess mucus running down the throat may cause hoarseness and lead to a cough. In fact, post-nasal drip is the most common cause of coughs. Other common symptoms include tickling in the throat, snorting, constant clearing of the throat, and difficulty breathing. A sore throat results due to the continual attempts to clear the excess mucus."
718,msmarco,_doc,MARCO_2669804,4.3671,1 Burning symptoms and Throat symptoms and Digestive symptoms (209 causes) 2  Burning symptoms and Throat symptoms and Face symptoms (208 causes) 3  Burning symptoms and Throat symptoms and Pain (203 causes)  Burning symptoms and Throat symptoms and Sensory symptoms (201 causes)
719,msmarco,_doc,MARCO_4725058,4.3671,"Tonsillitis is painful swelling in the tonsils, causing sore throat, red tonsils, pain, fever, and more. Mononucleosis is a viral infection causing extreme fatigue, sore throat, fever, rash, muscle aches, and more. Viral pharyngitis is a sore throat caused by a virus, and causes throat pain and cold-like symptoms."
720,msmarco,_doc,MARCO_7604450,4.3671,"Sensation of something stuck in the throat: Introduction. Sensation of something stuck in the throat: difficulty in swallowing. See detailed information below for a list of 25 causes of Sensation of something stuck in the throat, Symptom Checker, including diseases and drug side effect causes. » Review Causes of Sensation of something stuck in the throat: Causes | Symptom Checker »."
721,msmarco,_doc,MARCO_8168659,4.3669524,"Around 9,000 people each year are diagnosed with cancer in the oropharynx – areas in the throat including the base of the tongue and tonsils – that may be caused by HPV. This statistic indicates that HPV-related head and neck cancer is an epidemic. What is HPV-related cancer? HPV is an extremely common sexually transmitted infection."
722,msmarco,_doc,MARCO_8262672,4.3656335,"What Causes White Spots on Throat? There are a number of different reasons why white spots or patches can appear on your throat or tonsils. Here are the most common reasons: 1. Strep Throat. One of the reasons for the appearance of white spots on the throat is a bacterial infection called strep throat. It is caused by Streptococcus pyogenes bacteria. Although strep throat mainly affects children and teenagers, it can also affect adults."
723,msmarco,_doc,MARCO_6383244,4.3656335,GERD can give you a burning feeling in your mouth. It can cause you to have a sore throat or to have trouble swallowing. You may feel like food is sticking in your throat. GERD may also make you feel like you're choking or that your throat is tight.ERD can give you a burning feeling in your mouth. It can cause you to have a sore throat or to have trouble swallowing. You may feel like food is sticking in your throat. GERD may also make you feel like you're choking or that your throat is tight.
724,msmarco,_doc,MARCO_538628,4.3651667,1 Chest symptoms and Sore throat and Nerve symptoms (65 causes). 2  Chest symptoms and Sore throat and Pain (65 causes). 3  Chest symptoms and Sore throat and Respiratory symptoms (65 causes). 4  Chest symptoms and Sore throat and Sensory symptoms (65 causes).
725,msmarco,_doc,MARCO_2669803,4.3651667,1 Burning symptoms and Throat symptoms and Mouth symptoms (219 causes) 2  Burning symptoms and Throat symptoms and Abdominal symptoms (210 causes) 3  Burning symptoms and Throat symptoms and Digestive symptoms (209 causes)  Burning symptoms and Throat symptoms and Face symptoms (208 causes)
726,msmarco,_doc,MARCO_2669806,4.3651667,1 Burning symptoms and Throat symptoms and Nerve symptoms (228 causes) 2  Burning symptoms and Throat symptoms and Head symptoms (222 causes) 3  Burning symptoms and Throat symptoms and Mouth symptoms (219 causes)  Burning symptoms and Throat symptoms and Abdominal symptoms (210 causes)
727,msmarco,_doc,MARCO_4154403,4.3651667,"1 Most sore throats are caused by a virus, such as a cold. 2  Antibiotics won't work for sore throats caused by a virus. 3  I'm not sure It may help to go back and read Get the Facts.. 4  Most sore throats are caused by a virus, such as a cold. 5  Antibiotics won't work for sore throats caused by a virus."
728,msmarco,_doc,MARCO_3611775,4.3651667,1 Sore throat and Tongue ulcers and Sore tongue (10 causes) 2  Sore throat and Tongue ulcers and Tongue symptoms (10 causes) 3  Sore throat and Tongue ulcers and Face symptoms (9 causes)  Sore throat and Tongue ulcers and Head symptoms (9 causes)
729,msmarco,_doc,MARCO_3611777,4.3651667,1 Sore throat and Tongue ulcers and Mouth ulcers (10 causes) 2  Sore throat and Tongue ulcers and Sore tongue (10 causes) 3  Sore throat and Tongue ulcers and Tongue symptoms (10 causes)  Sore throat and Tongue ulcers and Face symptoms (9 causes)
730,msmarco,_doc,MARCO_93996,4.363235,"Other causes. Allergies to pollens and molds such as cat and dog dander and house dust are common causes of sore throats. Irritation caused by dry heat, a chronic stuffy nose, pollutants and chemicals, and straining your voice can also irritate your throat. Reflux, or a regurgitation of stomach acids up into the back of the throat, can cause you to wake up with a sore throat."
731,msmarco,_doc,MARCO_2030308,4.363235,"Viral pharyngitis is a sore throat caused by a virus, and causes throat pain and cold-like symptoms. Tonsillitis. Tonsillitis is painful swelling in the tonsils, causing sore throat, red tonsils, pain, fever, and more. Mononucleosis. Mononucleosis is a viral infection causing extreme fatigue, sore throat, fever, rash, muscle aches, and more."
732,msmarco,_doc,MARCO_5625372,4.3629117,"Throat cancer is a significant health threat, but both patients and doctors easily overlook the first signs of throat cancer."
733,msmarco,_doc,MARCO_1394503,4.3617907,Advertisement. Throat infections are caused in humans mainly due to viral or bacterial infections. The scientific term used for these infections is Pharyngitis. Sore throat is the most common and the first symptom to be seen in a person affected by throat infection.dvertisement. Throat infections are caused in humans mainly due to viral or bacterial infections. The scientific term used for these infections is Pharyngitis. Sore throat is the most common and the first symptom to be seen in a person affected by throat infection.
734,msmarco,_doc,MARCO_5575845,4.3617907,"Common Causes of a Sore Throat With Blisters. If you’ve ever had a cold, strep throat, or even allergies, you’ve probably experienced the discomfort of a sore throat. Sore throats are a pain for everyone, and when you have a sore throat with blisters, your discomfort level can go from bad to worse in an instant. Because a variety of viruses and conditions can cause a sore throat with blisters, it’s important to be aware of what to do when you find yourself with telling symptoms."
735,msmarco,_doc,MARCO_6686377,4.3617907,"Post-nasal drip often leads to a sore, irritated throat. Although there is usually no infection, the tonsils and other tissues in the throat may swell. This can cause discomfort or a feeling that there is a lump in the throat.Successful treatment of the post-nasal drip will usually clear up these throat symptoms.ost-nasal drip often leads to a sore, irritated throat. Although there is usually no infection, the tonsils and other tissues in the throat may swell. This can cause discomfort or a feeling that there is a lump in the throat."
736,msmarco,_doc,MARCO_5229504,4.3613057,1 Sore throat and Swollen glands and Nerve symptoms (46 causes). 2  Sore throat and Swollen glands and Respiratory symptoms (46 causes). 3  Sore throat and Swollen glands and Sensory symptoms (46 causes). 4  Sore throat and Swollen glands and Swollen lymph nodes (46 causes).
737,msmarco,_doc,MARCO_4154398,4.359378,"1 No You're right. 2  Most sore throats are caused by a virus, such as a cold. 3  Antibiotics won't work for sore throats caused by a virus. 4  I'm not sure It may help to go back and read Get the Facts.. 5  Most sore throats are caused by a virus, such as a cold. 6  Antibiotics won't work for sore throats caused by a virus."
738,msmarco,_doc,MARCO_5497041,4.358236,"Mouth cancer can occur anywhere in the mouth, including the lips, tongue and throat, as well as the salivary glands, pharynx, larynx and sinuses. Although the exact cause of oral cancer is unclear, there are certain lifestyle factors that can put someone at risk for this disease. Tobacco of any kind – cigarettes, cigars, pipes and smokeless tobacco – increase your risk for oral cancer."
739,msmarco,_doc,MARCO_7131350,4.358236,"Even the same carcinogen, such as alcohol, causes cancer in different ways in different parts of the body. Alcohol is classified as a 'Group 1 carcinogen' which means that, like processed meat, the evidence that alcohol can be linked to cancer is extremely strong, Hughes explained -- particularly cancer of the mouth, throat, esophagus, breast, liver, stomach and bowel."
740,msmarco,_doc,MARCO_132617,4.357956,"Sore throat is caused by inflammation of the throat (pharynx). The pharynx is the area behind the tonsils. A sore throat may be the first symptom of a mild illness, such as a cold or the flu, or of more severe illnesses, such as mononucleosis, strep throat or scarlet fever. A sore throat that comes on suddenly is called acute pharyngitis. It can be caused by bacteria or viruses. A sore throat that lasts for a long time is called chronic pharyngitis. It occurs when a respiratory, sinus, or ..."
741,msmarco,_doc,MARCO_2055110,4.357956,"(Redirected from Strep throat). Streptococcal pharyngitis, streptococcal tonsillitis, or streptococcal sore throat (known colloquially as strep throat) is a type of pharyngitis caused by a group A streptococcal infection.It affects the pharynx including the tonsils and possibly the larynx.Redirected from Strep throat). Streptococcal pharyngitis, streptococcal tonsillitis, or streptococcal sore throat (known colloquially as strep throat) is a type of pharyngitis caused by a group A streptococcal infection."
742,msmarco,_doc,MARCO_6082422,4.357956,"Infections from viruses or bacteria are the main cause of sore throats and can make it difficult to talk and breathe. Allergies and sinus infections can also contribute to a sore throat. If you have a sore throat that lasts for more than five to seven days, you should see your doctor.onsillitis is an infection of the lumpy-appearing lymphatic tissues on each side of the back of the throat. Infections in the nose and sinuses also can cause sore throats, because mucus from the nose drains down into the throat and carries the infection with it."
743,msmarco,_doc,MARCO_6061747,4.357956,"It is the cause of 5-15% sore throats in adults and 37% of sore throats in children. This highly contagious infection is spread through contact with an infected person or object, even in the strep throat incubation period.t is the cause of 5-15% sore throats in adults and 37% of sore throats in children. This highly contagious infection is spread through contact with an infected person or object, even in the strep throat incubation period."
744,msmarco,_doc,MARCO_3570087,4.355528,"What Causes Sore Throat? Sore throat (also called pharyngitis) is typically caused by a viral or bacterial infection. An estimated 200 to 300 different strains of virus cause colds and sore throat.1 In up to 90% of cases, sore throat is caused by viruses linked to the common cold or flu. The other 10% of cases result from bacterial infections or some other medical condition."
745,msmarco,_doc,MARCO_7653708,4.355528,"A sore throat (throat infection, pharyngitis) is caused when a virus (or bacteria) infects the area at the back of your throat (pharynx). This causes redness and swelling (inflammation), and can be painful, especially when you swallow. Most throat infections are caused by viruses, including the same viruses that cause: 1  colds (rhinovirus, coronavirus). 2  flu (influenza A and B viruses). 3  laryngitis and croup (parainfluenza virus)."
746,msmarco,_doc,MARCO_6914823,4.3550224,"Along with these two main types, throat cancer can be broken into two additional types. One type is pharyngeal cancer, which develops in the neck and throat. This includes:"
747,msmarco,_doc,MARCO_294435,4.354128,"Pain in the throat may be caused by a variety of inflammations of the larynx, pharynx, or tonsils. Throat soreness is typically associated with painful swallowing. Inflammation of the pharynx (pharyngitis) is the most common form of sore throat and is usually from virus infection.ain in the throat may be caused by a variety of inflammations of the larynx, pharynx, or tonsils. Throat soreness is typically associated with painful swallowing. Inflammation of the pharynx (pharyngitis) is the most common form of sore throat and is usually from virus infection."
748,msmarco,_doc,MARCO_1394510,4.354128,"Infections from viruses or bacteria are the main cause of sore throats and can make it difficult to talk and breathe. Allergies and sinus infections can also contribute to a sore throat. If you have a sore throat that lasts for more than five to seven days, you should see your doctor.nfections from viruses or bacteria are the main cause of sore throats and can make it difficult to talk and breathe. Allergies and sinus infections can also contribute to a sore throat. If you have a sore throat that lasts for more than five to seven days, you should see your doctor."
749,msmarco,_doc,MARCO_2595241,4.354128,"Tonsillitis refers to tonsils that are inflamed. Strep throat is an infection caused by a specific type of bacteria, Streptococcus. When your child has a strep throat, the tonsils are usually very inflamed, and the inflammation may affect the surrounding part of the throat as well.onsillitis refers to tonsils that are inflamed. Strep throat is an infection caused by a specific type of bacteria, Streptococcus. When your child has a strep throat, the tonsils are usually very inflamed, and the inflammation may affect the surrounding part of the throat as well."
750,msmarco,_doc,MARCO_2349951,4.354128,"Post-nasal drip often leads to a sore, irritated throat. Although there is usually no infection, the tonsils and other tissues in the throat may swell. This can cause discomfort or a feeling that there is a lump in the throat.Successful treatment of the post-nasal drip will usually clear up these throat symptoms.lthough there is usually no infection, the tonsils and other tissues in the throat may swell. This can cause discomfort or a feeling that there is a lump in the throat. Successful treatment of the post-nasal drip will usually clear up these throat symptoms."
751,msmarco,_doc,MARCO_8433156,4.354128,"Thankfully, we have the convenience of antibiotics, which can cure your strep throat quickly and effectively. Let’s take a look at strep throat and some common antibiotics that can be used for treatment. Strep Throat and Antibiotics. Strep throat is a bacterial infection of the throat and tonsils. The main bacteria responsible for causing strep throat is known as Streptococcus pyogenes, or simply group A Streptococcus. This strain of bacteria is also known to cause certain skin infections, like impetigo and cellulitis."
752,msmarco,_doc,MARCO_803048,4.3540106,"A sore throat caused by a virus can be just as painful as strep throat. But if you have cold symptoms such as coughing, sneezing, or a runny or stuffy nose, you probably do not have strep throat. The most common symptoms of strep throat are: 1  A sudden, severe sore throat.2  Pain when you swallow.3  Fever over 101°F (38.3°C) .ut if you have cold symptoms such as coughing, sneezing, or a runny or stuffy nose, you probably do not have strep throat. The most common symptoms of strep throat are: 1  A sudden, severe sore throat."
753,msmarco,_doc,MARCO_2533393,4.3526316,bacteria strep throat is an infection caused by a particular strain of streptococcus bacteria this infection can also damage the heart valves rheumatic fever and kidneys nephritis cause scarlet fever tonsillitis pneumonia sinusitis and ear infectionssymptoms of strep throat often include fever greater than 101 f white draining patches on the throat and swollen or tender lymph glands in the neckumors of the throat tongue and larynx voice box can cause a sore throat with pain radiating to the ear and or difficulty swallowing other important symptoms can include hoarseness noisy breathing a lump in the neck unexplained weight loss and or spitting up blood in the saliva or phlegm
754,msmarco,_doc,MARCO_5502908,4.3526316,"According to the American Academy of Allergy, Asthma and Immunology, or AAAAI, oral allergy syndrome, including watermelon allergies, primarily affect your mouth and throat. If you have an allergy to watermelon, eating the fruit can cause your throat and mouth to swell and itch.Your tongue may also swell in response to the allergen. Severe reactions are rare, but may cause severe throat swelling accompanied by shortness of breath. Symptoms of watermelon allergy occur immediately.ccording to the American Academy of Allergy, Asthma and Immunology, or AAAAI, oral allergy syndrome, including watermelon allergies, primarily affect your mouth and throat. If you have an allergy to watermelon, eating the fruit can cause your throat and mouth to swell and itch."
755,msmarco,_doc,MARCO_7528600,4.3518414,"Sunburn causes a reddened, irritated area of skin caused by overexposure to the sun's rays or other UV light. Chickenpox is an illness that causes a red, itchy rash, fever, headache, sore throat, and body aches. Viral pharyngitis is a sore throat caused by a virus, and causes throat pain and cold-like symptoms. Gastroenteritis is inflammation of the stomach and intestine that causes diarrhea and vomiting."
756,msmarco,_doc,MARCO_1967833,4.3516855,"Although, by definition, strep throat is caused by the Streptococcus pyogenes bacteria, other bacteria can occasionally invade the throat and cause similar symptoms. Other possible bacterial invaders include staphylococcus, neisseria and Haemophilus influenzae.lthough, by definition, strep throat is caused by the Streptococcus pyogenes bacteria, other bacteria can occasionally invade the throat and cause similar symptoms. Other possible bacterial invaders include staphylococcus, neisseria and Haemophilus influenzae."
757,msmarco,_doc,MARCO_8046966,4.351089,Signs of throat cancer may be difficult to identify in the early stages of the disease. Signs of throat cancer may be difficult to identify in the early stages of the disease. X Close
758,msmarco,_doc,MARCO_1132284,4.3503075,"Sore throats caused by a bacterial infection—like strep throat or tonsillitis—can be severe. You’re probably most familiar with strep throat, which makes up only about 10 percent of acute sore throat complaints in adults. Unlike with a cold, you won’t usually experience sneezing, congestion, or cough with strep throat. What you will have is a sore throat that starts quickly and can cause a whole lot of pain while swallowing. You may also have bad breath, fever, and swollen lymph nodes in your neck."
759,msmarco,_doc,MARCO_5921636,4.3503075,"They tend to form in the back of the throat, on the base of the tongue, or most commonly in the pockets on the tonsils themselves. While they are essentially harmless, tonsil balls can cause a myriad of symptoms ranging from sore throat and pus in the throat to difficulty swallowing and coughing.hey tend to form in the back of the throat, on the base of the tongue, or most commonly in the pockets on the tonsils themselves. While they are essentially harmless, tonsil balls can cause a myriad of symptoms ranging from sore throat and pus in the throat to difficulty swallowing and coughing."
760,msmarco,_doc,MARCO_6762283,4.3503075,"Medicines and treatments for a throat infection. A sore throat will often get better by itself, as the body’s immune system can usually take care of the infection without any treatment. Antibiotics aren’t helpful for most people with a throat infection. Most throat infections are caused by a virus, so antibiotics won’t help. Antibiotics don’t kill viruses. Even when a throat infection is caused by bacteria, antibiotics are only recommended for people who are more likely to get complications of a throat infection or develop tonsillitis."
761,msmarco,_doc,MARCO_1046672,4.3494463,"A sore throat, also known as strep throat, is a bacterial infection which can come from a number of different types of bacteria. A common sore throat differs from a strep throat because it is usually a viral infection.Both types of sore throats are contagious and can be passed from person to person in any place with close contact. The viral sore throat and the strep throat are both described as a painful soreness feeling. sore throat, also known as strep throat, is a bacterial infection which can come from a number of different types of bacteria. A common sore throat differs from a strep throat because it is usually a viral infection."
762,msmarco,_doc,MARCO_6260557,4.3494463,"The male ruby-throated hummingbird has a glowing, bright red throat. The blue-throated male has a dark blue colored throat that appears black in dim light. The female ruby-and blue-throated hummingbird is fairly colorless.The blue-throated female has a rounded tail with light gray or white corners.he male ruby-throated hummingbird has a glowing, bright red throat. The blue-throated male has a dark blue colored throat that appears black in dim light. The female ruby-and blue-throated hummingbird is fairly colorless."
