,_index,_type,_id,_score,_source.body
501,msmarco,_doc,MARCO_6058372,4.6209855,"Mono is caused by a virus and it can get into all parts of your body. Usually the main problems are in the throat with large, painful tonsils and sore throat Mono can also cause your spleen to enlarge and can cause almost any organ in the body to have inflammation. In brief: All body systems. Mono is caused by a virus and it can get into all parts of your body. Usually the main problems are in the throat with large, painful tonsils and sore throat Mono can also cause your spleen to enlarge and can cause almost any organ in the body to have inflammation."
502,msmarco,_doc,MARCO_5962842,4.6201444,"The subglottis connects to the trachea, which takes air to the lungs. Cancer of the larynx, can also be called laryngeal cancer, can develop in any part of the larynx, but most begins in the glottis. The inner walls of the larynx are lined with cells called squamous cells. Almost all laryngeal cancers begin in these cells. If cancer of the larynx spreads, the cancer cells often spread to nearby lymph nodes in the neck. The cancer cells can also spread to the back of the tongue, other parts of the throat and neck, the lungs, and other parts of the body."
503,msmarco,_doc,MARCO_3467570,4.619457,"All of these vaccines help prevent infection by HPV-16 and HPV-18. These 2 types cause about 70% of all cervical cancers and pre-cancers, as well as many cancers of the anus, penis, vulva, vagina, and throat. Gardasil also helps prevent infection by the 2 types of HPV (HPV-6 and HPV-11) that cause most genital warts."
504,msmarco,_doc,MARCO_407699,4.6190896,"1 Cancer. 2  All tobacco smoke contains chemicals that can cause cancer, and cigar smoke is no exception. 3  Regular cigar smoking increases the risk of several types of cancers, including cancers of the mouth, lip, tongue, throat, esophagus, larynx and lung. 4  Lung and heart disease."
505,msmarco,_doc,MARCO_5535101,4.617237,"Viral Throat Infections. Aside from strep throat, most sore throats caused by are contagious, viral throat infections that cannot be treated with antibiotics. The most common culprits of a viral throat infection include coxsackievirus, mononucleosis, and the flu.Mononucleosis (mono) is a virus that causes symptoms that can last for weeks or months at a time. Viral throat infections are best treated with rest, liquids and other home remedies.esides a sore throat, symptoms of a viral infection may include a low-grade fever, a runny or stuffy nose and a slight cough. Mild sore throats also can accompany a cold or flu."
506,msmarco,_doc,MARCO_5628566,4.617237,"1 Strep throat. 2  Strep throats infection can cause white spots in the throat as well as inflammation and pain in the tonsils and throat area. 3  You may notice pus forming around these spots if the infection is severe along with headaches, unexplainable fatigue, fever and inflammation of the lymph nodes. Strep throat. 2  Strep throats infection can cause white spots in the throat as well as inflammation and pain in the tonsils and throat area. 3  You may notice pus forming around these spots if the infection is severe along with headaches, unexplainable fatigue, fever and inflammation of the lymph nodes."
507,msmarco,_doc,MARCO_6622823,4.617165,"Don't Take Antibiotics for Your Cold. Antibiotics do not get rid of sore throats caused by the common cold. The common cold is caused by a virus, and antibiotics will not help. Overuse of antibiotics can cause microbial resistance, and lead to superbugs that are resistant to standard medications.n infection caused by strep throat is often characterized as being very painful. You may have difficulty swallowing your own saliva. The pain from a sore throat caused by strep tends to be more severe, and lasts longer than a sore throat caused by a cold."
508,msmarco,_doc,MARCO_8459343,4.6161814,"Human Papillomavirus (HPV) and Cancer. Human papillomavirus (HPV) causes most cervical cancers, as well as some cancers of the vagina, vulva, penis, anus, rectum, and oropharynx (cancers of the back of the throat, including the base of the tongue and tonsils). HPV vaccines are recommended for preteen girls and boys to protect against HPV infection."
509,msmarco,_doc,MARCO_5128268,4.6157475,"Salivary glands. Mayo Clinic in Minnesota is has been recognized as one of the top hospitals in Ear, Nose & Throat in the nation for 2015-2016 by U.S. News & World Report. You have three pairs of major salivary glands under and behind your jaw — parotid, sublingual and submandibular. Many other tiny salivary glands are in your lips, inside your cheeks, and throughout your mouth and throat. Salivary gland cancer most commonly occurs in the parotid gland, which is just in front of the ear. Treatment for salivary gland cancer often involves surgery. Other treatments for salivary gland cancer may include radiation therapy and chemotherapy."
510,msmarco,_doc,MARCO_8666788,4.613671,"Symptoms of heartburn and GERD are a burning feeling in the chest, throat, or mouth, nausea, and more. Lung cancer (small cell) Small cell lung cancer is the least common type of lung cancer and can cause a cough, chest pain, and more. Pleural effusion. Pleural effusion is buildup of fluid in the pleura and can cause difficulty breathing or chest pain."
511,msmarco,_doc,MARCO_8673873,4.610782,"HPV is a group of more than 150 related viruses. Each HPV virus in this large group is given a number which is called its HPV type. HPV is named for the warts (papillomas) some HPV types can cause. Some other HPV types can lead to cancer. Men and women can get cancer of mouth/ throat, and anus/rectum caused by HPV infections. Men can also get penile HPV cancer."
512,msmarco,_doc,MARCO_8437256,4.6078963,"The human papillomavirus (HPV) vaccine protects against infection by certain strains of HPV. Human papillomavirus can cause cervical cancer and genital warts. HPV has also been linked to other kinds of cancers, including vaginal, vulvar, penile, anal, mouth and throat cancers. HPV is a common virus that is spread through sexual contact. There are several types of HPV. Many of the types do not cause problems. Some types of HPV can lead to:"
513,msmarco,_doc,MARCO_3642171,4.607473,"Symptoms of tonsil cancer include a sore at the back of the throat that does not heal, or one tonsil that is bigger than the other. It may or may not be painful.Tonsil cancer is known to cause bleeding, bad breath, or altered taste.ost tonsil cancers are squamous cell carcinomas, which arise in the lining tissues of the mouth, although it is possible for lymphoma (a type of immune system cancer) to develop in the tonsils."
514,msmarco,_doc,MARCO_1560882,4.605747,"Bacteria: Strep throat is an infection caused by a particular strain of streptococcus bacteria. This infection can also cause damage to the heart valves (rheumatic fever) and kidneys (nephritis). Streptococcal infections can also cause scarlet fever, tonsillitis, pneumonia, sinusitis and ear infections.nfections in the nose and sinuses can also cause sore throats because mucus from the nose drains down into the throat and carries the infection with it. The most dangerous throat infection is epiglottitis, caused by bacteria that infect a portion of the larynx (voice box) and cause swelling that closes the airway."
515,msmarco,_doc,MARCO_1633245,4.602143,"Common symptoms include fever, sore throat, and enlarged lymph nodes. It is the cause of 15–40% of sore throats among children and 5–15% in adults. Strep throat is a contagious infection, spread through close contact with an infected individual.A definitive diagnosis is made based on the results of a throat culture.ommon symptoms include fever, sore throat, and enlarged lymph nodes. It is the cause of 15–40% of sore throats among children and 5–15% in adults. Strep throat is a contagious infection, spread through close contact with an infected individual. A definitive diagnosis is made based on the results of a throat culture."
516,msmarco,_doc,MARCO_4577457,4.602143,"Incubation Period for Strep Throat. After a person has been infected with the bacteria (group A streptococcus) that cause strep throat, they do not immediately have any signs or symptoms of strep throat. On average, it takes about two to four days for symptoms to start.This period between transmission and the beginning of symptoms is called the strep throat incubation period.. This throat infection is typically spread through contact with infected throat mucus, nasal discharge, or saliva.fter a person has been infected with the bacteria (group A streptococcus) that cause strep throat, they do not immediately have any signs or symptoms of strep throat. On average, it takes about two to four days for symptoms to start."
517,msmarco,_doc,MARCO_597734,4.6021323,"Michael Douglas wondered if his wife Catherine Zeta-Jones’ stint in rehab was a trigger for his cancer. Turns out, it wasn’t. Michael Douglas revealed the cause of his throat cancer was not smoking and drinking - as he previously believed — but instead by performing oral sex. The 68-year-old actor was incredibly honest in an interview with The Guardian, explaining that he learned his cancer was caused by the human papillomavirus (HPV)."
518,msmarco,_doc,MARCO_880026,4.5972466,"Causes of Throat clearing: The following medical conditions are some of the possible causes of Throat clearing. There are likely to be other possible causes, so ask your doctor about your symptoms. 1  Habitual throat clearing. 2  Dry throat - see also causes of dry throat.  Anxiety."
519,msmarco,_doc,MARCO_682313,4.5972466,1 Dry throat and Mouth symptoms (25 causes) 2  Dry throat and Nerve symptoms (25 causes) 3  Dry throat and Respiratory symptoms (25 causes)  Dry throat and Throat symptoms (25 causes)
520,msmarco,_doc,MARCO_4941065,4.5963798,"People with thyroid cancer often experience the following symptoms or signs. Sometimes, people with thyroid cancer do not show any of these symptoms. Or, these symptoms may be caused by a medical condition that is not cancer. A lump in the front of the neck, near the Adam's apple. Hoarseness. Swollen glands in the neck. Difficulty swallowing. Difficulty breathing. Pain in the throat or neck. A cough that persists and is not caused by a cold. If you are concerned about one or more of the symptoms or signs on this list, please talk with your doctor."
521,msmarco,_doc,MARCO_7653706,4.5953,1 Throat infection and Throat symptoms (8 causes). 2  Throat infection and Mouth symptoms (7 causes). 3  Throat infection and Pain swallowing (7 causes). 4  Throat infection and Sensory symptoms (7 causes).
522,msmarco,_doc,MARCO_2055423,4.587533,Neck pain and Throat pain and Sensory symptoms (13 causes) Neck pain and Throat pain and Sore throat (13 causes) Neck pain and Throat pain and Neck symptoms (12 causes) Neck pain and Throat pain and Respiratory symptoms (12 causes)
523,msmarco,_doc,MARCO_5337293,4.587533,"Throat itch: Introduction. Throat itch: Abnormal itching sensation in the throat. See detailed information below for a list of 6 causes of Throat itch, Symptom Checker, including diseases and drug side effect causes. » Review Causes of Throat itch: Causes | Symptom Checker »."
524,msmarco,_doc,MARCO_254744,4.585672,"Barretts Disease. Barretts Disease if left untreated can develop into cancer so it’s worth learning about. This disorder affects the digestive tract of a person, specifically the esophagus. Barretts Disease refers to an anomalous change of the cells in the inner lining of the inferior part on the esophagus.The esophagus is just a part of the body’s digestive system. It is a muscular cylinder that unites the stomach and the pharynx or the throat (See: Throat cancer symptoms).arretts Disease. Barretts Disease if left untreated can develop into cancer so it’s worth learning about. This disorder affects the digestive tract of a person, specifically the esophagus. Barretts Disease refers to an anomalous change of the cells in the inner lining of the inferior part on the esophagus."
525,msmarco,_doc,MARCO_1148129,4.585672,"Sometimes, a cancerous thyroid nodule can't be seen or felt by you or your doctor. In those cases, you may notice a swollen lymph node instead. Lymph nodes fight infection and are located throughout your body. If thyroid cancer spreads to the lymph nodes in your neck, then the lymph nodes will become swollen.Lymph nodes can become enlarged for a variety of reasons—many of them not related to thyroid cancer. When you have a severe sore throat, for instance, the lymph nodes in your neck may swell.But after the infection goes away, the lymph nodes return to their normal size.ymph nodes can become enlarged for a variety of reasons—many of them not related to thyroid cancer. When you have a severe sore throat, for instance, the lymph nodes in your neck may swell. But after the infection goes away, the lymph nodes return to their normal size."
526,msmarco,_doc,MARCO_2047368,4.585672,"Relax-your doctor is just being thorough. It can mean any number of things. You might have swollen lymph nodes because your body is fighting an infection, such as strep throat, or a lung infection. It is very unlikely it is cancer. Lymph nodes swell whenever the body aquires an infection as a type of defense mechanism.Lymph nodes also swell when you have lymphoma, a type of cancer. In your case the doctor has probably ordered blood tests as a precaution. I am glad that you went to the doctor and got your blood work done.elax-your doctor is just being thorough. It can mean any number of things. You might have swollen lymph nodes because your body is fighting an infection, such as strep throat, or a lung infection. It is very unlikely it is cancer. Lymph nodes swell whenever the body aquires an infection as a type of defense mechanism."
527,msmarco,_doc,MARCO_8046972,4.5849075,"Symptoms of these cancers may include: 1  A sore throat that does not go away. 2  Constant coughing. 3  Pain when swallowing. 4  Trouble swallowing. 5  Ear pain. 6  Trouble breathing. 7  Weight loss. 8  A lump or mass in the neck (due to spread of the cancer to nearby lymph nodes) Many of these symptoms are more likely to be caused by conditions other than laryngeal or hypopharyngeal cancer. Still, if you have any of these symptoms, it is very important to have them checked by a doctor so that the cause can be found and treated, if needed."
528,msmarco,_doc,MARCO_6312426,4.5838776,"A sore throat refers to pain, itchiness, or irritation of the throat. You may have difficulty swallowing food and liquids, and the pain may get worse when you try to swallow. bacterial infection can also cause a sore throat. These types of infections include: 1  strep throat: inflammation of the throat caused by the Streptococcal bacteria. 2  diphtheria: infectious disease that causes throat inflammation."
529,msmarco,_doc,MARCO_1132290,4.583661,"A number of bacterial infections can cause a sore throat. The most common is Streptococcus pyogenes, or group A streptococcus, which causes strep throat. Other causes of a sore throat include: Allergies. Allergies to pet dander, molds, dust and pollen can cause a sore throat. The problem may be complicated by postnasal drip, which can irritate and inflame the throat."
530,msmarco,_doc,MARCO_5229503,4.583661,1 Sore throat and Swollen glands and Pain (45 causes). 2  Sore throat and Swollen glands and Sensations (44 causes). 3  Sore throat and Swollen glands and Throat symptoms (44 causes). 4  Sore throat and Swollen glands and Swelling symptoms (42 causes).
531,msmarco,_doc,MARCO_1109994,4.581948,"A sore throat is pain, scratchiness or irritation of the throat that often worsens when you swallow. The most common cause of a sore throat (pharyngitis) is a viral infection, such as a cold or the flu. A sore throat caused by a virus resolves on its own. Strep throat (streptococcal infection), a less common type of sore throat caused by bacteria, requires treatment with antibiotics to prevent complications."
532,msmarco,_doc,MARCO_538631,4.581728,1 Chest symptoms and Sore throat and Respiratory symptoms (65 causes). 2  Chest symptoms and Sore throat and Sensory symptoms (65 causes). 3  Chest symptoms and Sore throat and Sensations (64 causes). 4  Chest symptoms and Sore throat and Throat symptoms (63 causes).
533,msmarco,_doc,MARCO_538624,4.581728,1 Chest symptoms and Sore throat and Sensations (64 causes). 2  Chest symptoms and Sore throat and Throat symptoms (63 causes). 3  Chest symptoms and Sore throat and Breath symptoms (57 causes). 4  Chest symptoms and Sore throat and Head symptoms (56 causes).
534,msmarco,_doc,MARCO_5120549,4.581728,"Strep throat is a contagious disease caused by infection with streptococcal bacteria, which causes inflammation and swelling of the mucous membranes lining the back of the throat and the tonsils.hough strep throat is the most common bacterial cause of sore throat, it is important to note that most cases of sore throat are in fact due to a viral infection (caused by a virus)."
535,msmarco,_doc,MARCO_6916963,4.581728,"Red throat: Introduction. Red throat: Redness inside the throat. See detailed information below for a list of 44 causes of Red throat, Symptom Checker, Assessment Questionnaire, including diseases and drug side effect causes. » Review Causes of Red throat: Causes | Symptom Checker » | Assessment Questionnaire »."
536,msmarco,_doc,MARCO_762094,4.581499,"BUILDING AWARENESS AND PROVIDING EDUCATION ABOUT HPV THROAT CANCER. We’re talking about HPV because about 79 million Americans are infected. Every year, 14 million people become newly infected with HPV. The CDC says HPV is the MOST common sexually transmitted infection. Every year in the U.S., 27,000 people will get cancer caused by HPV. And by 2020, HPV-related oropharyngeal or head and neck cancers will outnumber cervical cancer cases."
537,msmarco,_doc,MARCO_8538391,4.581499,"This has caused a backlash among smokers who mock the health statistics and, persuasively to some, attribute most of smoking's ills to bad genetics. A reexamination of the statistics might help to clear the air. Didn't kill grandpa. Surprisingly, fewer than 10 percent of lifelong smokers will get lung cancer. Fewer yet will contract the long list of other cancers, such as throat or mouth cancers. In the game of risk, you're more likely to have a condom break than to get cancer from smoking."
538,msmarco,_doc,MARCO_3288557,4.58002,"Strep throat infection Strep throat usually causes throat pain and difficulty swallowing. This photo of strep throat shows inflammation and red spots, caused by the infection. It's possible for you or your child to have many of these signs and symptoms but not have strep throat. The cause of these signs and symptoms could be a viral infection or some other illness. That's why your doctor generally tests specifically for strep throat."
539,msmarco,_doc,MARCO_3342965,4.5797963,"Throat burning sensation: Introduction. Throat burning sensation: Abnormal burning sensation in the throat. See detailed information below for a list of 4 causes of Throat burning sensation, Symptom Checker, including diseases and drug side effect causes. » Review Causes of Throat burning sensation: Causes | Symptom Checker »."
540,msmarco,_doc,MARCO_2342211,4.5791874,"The human papillomaviruses (also known as HPV) are a group of more than 150 viruses, 40 of which are known to infect the genital areas. Other types infect the skin and the lining of the throat. It is possible to be infected with HPV without knowing you have it, and the majority of infections do not produce any symptoms.ertain strains of HPV can cause precancerous changes in cells in the area where the infection occurs. The infection can lead to different types of cancers, including cervical cancer in women. Cancer-causing HPVs are referred to as high-risk, carcinogenic, or oncogenic HPVs."
541,msmarco,_doc,MARCO_1978151,4.575939,"An infection caused by strep throat is often characterized as being very painful. You may have difficulty swallowing your own saliva. The pain from a sore throat caused by strep tends to be more severe, and lasts longer than a sore throat caused by a cold.f your sore throat is associated with a fine, sandpaper-like pink rash on the skin, it could be scarlet fever, which is definitely associated with the bacteria that causes strep throat."
542,msmarco,_doc,MARCO_5032914,4.575757,"General lung cancer symptoms. Lung cancer symptoms – coughing up blood. It should be noted that whilst coughing up blood (haemoptysis) usually presenting as phlegm with blood in it, is perceived as being a sure sign of lung cancer, this is not always the case. There are many reasons why people cough up blood that have nothing to do with lung cancer. The most common reason is chest infection. Additional causes include nosebleeds, occasionally bleeding in the throat, irritation in the airways (tracheobronchitis) or inflammation of the stomach or oesophagus."
543,msmarco,_doc,MARCO_2786996,4.572089,"While this type of breathing pattern generally isn't harmful in short durations it can cause the throat to become dry and raw if stress and/or anxiety are sustained. Once the throat becomes dry and raw, it can cause a persistent tickling sensation that can cause a persistent dry cough. Moreover, persistent coughing can also irritate the throat, which can cause a persistent cycle of dry throat, coughing, irritated and dry throat, coughing, and so on."
544,msmarco,_doc,MARCO_5120546,4.572089,"Strep throat is caused by infection with Group A Streptococcus (GAS) bacteria, specifically Streptococcus pyogenes. The streptococcal infection invades the pharyngeal tissue and causes a localized inflammatory reaction of the throat and tonsils.hough strep throat is the most common bacterial cause of sore throat, it is important to note that most cases of sore throat are in fact due to a viral infection (caused by a virus)."
545,msmarco,_doc,MARCO_751187,4.5683947,"Dry throat is also caused by tobacco or marijuana use, voice strain, vomiting, excessive coughing, throat inflammation, allergies, and, in rare cases, cancers of the throat and esophagus."
546,msmarco,_doc,MARCO_6821033,4.5683947,"I was wondering if skunk smell is dangerous to your health does it cause throat cancer or anything. My throat is irritating me, I tried washing my mouth to get the taste off but it's still irritating my throat. Add your answer."
547,msmarco,_doc,MARCO_294433,4.568247,"A foreign body lodged in the tonsils or throat may often cause a sudden sore throat. Common causes include fish bones, although in children larger foreign objects may be lodged in the respiratory tract.here are a number of causes of a sore throat and while infections are considered to be the leading cause, other non-infectious conditions like GERD is now recognized as a major contributing factor to a persistent sore throat, especially a morning sore throat."
548,msmarco,_doc,MARCO_957478,4.568247,"Strep throat is a bacterial infection that causes inflammation and pain in the throat. This common condition is caused by group A Streptococcus bacteria. Strep throat is a bacterial infection that causes inflammation and pain in the throat. This common condition is caused by group A Streptococcus bacteria. Strep throat can affect children and adults of all ages. However, it’s especially common in children between the ages of 5 and 15."
549,msmarco,_doc,MARCO_2039491,4.567781,"1 Pipes: Pipe smoking causes lung cancer and increases the risk of cancers of the mouth, throat, larynx, and esophagus (9, 15, 16). 2  Hookahs or waterpipes (other names include argileh, ghelyoon, hubble bubble, shisha, boory, goza, and narghile): A hookah is a device used to smoke tobacco.f these premature deaths, about 36 percent are from cancer, 39 percent are from heart disease and stroke, and 24 percent are from lung disease (1). Smoking is the leading cause of premature, preventable death in this country."
550,msmarco,_doc,MARCO_4575659,4.567781,"Tobacco Facts. 1  Smoking is the No. 1 preventable cause of death in Canada. 2  Smoking kills more than 37,000 Canadians each year – six times more than vehicle collisions, suicides, murders and AIDS combined. 3  Tobacco use is also linked to cancer of the bladder, kidney, pancreas, cervix, mouth, throat, esophagus, larynx, stomach, colon, rectum and breast. There are some 4.2 million Canadians 15+ and older who smoke. Cigarette smoking causes about 30% of cancer deaths in Canada and 85% of lung cancers."
551,msmarco,_doc,MARCO_1560874,4.564665,"Infections from viruses or bacteria are the main cause of sore throats and can make it difficult to talk and breathe. Allergies and sinus infections can also contribute to a sore throat. If you have a sore throat that lasts for more than five to seven days, you should see your doctor.rritation caused by dry heat, a chronic stuffy nose, pollutants and chemicals, and straining your voice can also irritate your throat. Reflux, or a regurgitation of stomach acids up into the back of the throat, can cause you to wake up with a sore throat."
552,msmarco,_doc,MARCO_5210157,4.564665,"Avoid sharing utensils like cups, knives, and forks. 1  Strep throat can cause white spots on throat. 2  Tonsillitis can cause white spots on tonsils. 3  Tonsil stones – white dots on back of throat. 4  Oral thrush – white patches on throat. 5  Mononucleosis – white spots on throat. 6  Leukoplakia can cause white spots on throat and mouth."
