,_index,_type,_id,_score,_source.body
0,msmarco,_doc,MARCO_3878348,7.039211,"There are two main types of throat cancer: Squamous cell carcinoma develops in the thin, flat cells that line much of the throat. These cells look scale-like when checked under a microscope. This type of throat cancer is the most common in the United States. Adenocarcinoma begins in the glandular cells of the throat. Throat cancer includes several different cancers under the head and neck umbrella. Laryngeal cancer and pharyngeal cancer are two of the most common types of throat cancer. Pharyngeal cancer is broken into three types: 1  Nasopharynx cancer forms in the upper part of the throat.  Oropharynx cancer forms in the middle part of the throat."
1,msmarco,_doc,MARCO_191050,6.9345493,This type of throat cancer is the most common in the United States. Adenocarcinoma begins in the glandular cells of the throat. Throat cancer includes several different cancers under the head and neck umbrella. Laryngeal cancer and pharyngeal cancer are two of the most common types of throat cancer. Pharyngeal cancer is broken into three types: Nasopharynx cancer forms in the upper part of the throat. Oropharynx cancer forms in the middle part of the throat. Hypopharynx cancer forms in the bottom part of the throat.
2,msmarco,_doc,MARCO_8610842,6.8617353,"Types of throat cancer. Throat cancer is a general term that applies to cancer that develops in the throat (pharyngeal cancer) or in the voice box (laryngeal cancer). The throat and the voice box are closely connected, with the voice box located just below the throat. Though most throat cancers involve the same types of cells, specific terms are used to differentiate the part of the throat where cancer originated. 1  Nasopharyngeal cancer begins in the nasopharynx — the part of your throat just behind your nose."
3,msmarco,_doc,MARCO_3090847,6.786216,"Throat cancer refers to cancerous tumors that develop in your throat (pharynx), voice box (larynx) or tonsils. Your throat is a muscular tube that begins behind your nose and ends in your neck. Throat cancer most often begins in the flat cells that line the inside of your throat. Your voice box sits just below your throat and is also susceptible to throat cancer. The voice box is made of cartilage and contains the vocal cords that vibrate to make sound when you talk. Throat cancer can also affect the piece of cartilage (epiglottis) that acts as a lid for your windpipe. Tonsil cancer, another form of throat cancer, affects the tonsils, which are located on the back of the throat."
4,msmarco,_doc,MARCO_789620,6.7267632,"What is throat cancer? Throat cancer is any cancer that forms in the throat. The throat, also called the pharynx, is a 5-inch-long tube that runs from your nose to your neck. The larynx (voice box) and pharynx are the two main places throat cancer forms. Throat cancer is a type of head and neck cancer, which includes cancer of the mouth, tonsils, nose, sinuses, salivary glands and neck lymph nodes. Learn about the types of throat cancer."
5,msmarco,_doc,MARCO_1373522,6.605218,"Throat or larynx cancer. Throat cancer is cancer of the vocal cords, larynx (voice box), or other areas of the throat. People who smoke or use tobacco are at risk of developing throat cancer. Drinking too much alcohol over a long time also increases risk. Smoking and drinking alcohol combined lead to an increased risk for throat cancer. Most throat cancers develop in adults older than 50. Men are more likely than women to develop throat cancer."
6,msmarco,_doc,MARCO_291004,6.58726,"Types of Cancer: Throat Cancer. Throat cancer refers to cancerous tumors that develop in your throat (pharynx) or voice box (larynx). Throat cancer includes cancer of the nasopharynx (the upper part of the throat behind the nose), the oropharynx (the middle part of the pharynx), and the hypopharynx (the bottom part of the pharynx). Cancer of the larynx (voice box) may also be included as a type of throat cancer, and is also called pharyngeal cancer."
7,msmarco,_doc,MARCO_2925873,6.5680447,"Throat anatomy. Throat cancer occurs when cells in your throat develop genetic mutations. These mutations cause cells to grow uncontrollably and continue living after healthy cells would normally die. The accumulating cells can form a tumor in your throat.It's not clear what causes the mutation that causes throat cancer. Hypopharyngeal cancer (laryngopharyngeal cancer) begins in the hypopharynx (laryngopharynx) — the lower part of your throat, just above your esophagus and windpipe."
8,msmarco,_doc,MARCO_8374752,6.504155,"How long does a sore throat last? A sore throat, also referred to as a throat infection, is an inflammation of the pharynx that is located in the back part of the throat. The question that lingers on most peoples minds is how long does a sore throat last? The duration of a sore throat depends on its cause. For example—a sore throat caused by persistent irritation such as smoking cigarettes or other toxic stuff, can last for the duration that the individual is exposed to the offending substance. However, a sore throat despite its cause should last between 7 to 10 days. Any sore throat symptoms lasting for more than ten days necessitate immediate doctor’s attention for diagnosis and further treatment. This is because such sore throats can be underlying symptoms of serious illnesses such as throat cancer or even AIDS. Another common question is; how long does a sore throat last if it caused by a virus? Viral sore throats that mostly produce flu- like symptoms last for a few days—at most seven to ten days. Viral sore throats get better after the first few days, and normally clear up when the flu disappears."
9,msmarco,_doc,MARCO_6617627,6.500861,"Throat cancer survival rate may differ depending on the stages. Under this cancer, four stages can be classified. Among the most critical stage is the stage 4. Stage 4 throat cancer survival rate is around 30 percent. This is the lowest percentage of survival rate of throat cancer.This stage is widely affecting the lips, the mouth and the lymph nodes. In contrast, stage 3 throat cancer survival rate levels up to 50 to 60 percent.If stages 3 and 4 are low in survival rates, stages 1 and 2 have higher percentages. This implies that you can either have higher or lower survival rate depending on the stage of your cancer.hroat cancer survival rate may differ depending on the stages. Under this cancer, four stages can be classified. Among the most critical stage is the stage 4. Stage 4 throat cancer survival rate is around 30 percent. This is the lowest percentage of survival rate of throat cancer."
10,msmarco,_doc,MARCO_3005493,6.4814157,"For a minority of cases, the virus doesn’t go away and can cause serious health problems. These include genital warts and warts in the throat (known as recurrent respiratory papillomatosis, or RRP). HPV can also cause cervical cancer and other cancers of the genitals, head, neck, and throat. The types of HPV that cause warts are different from the types that cause cancer. As such, having genital warts caused by HPV does not mean that you will develop cancer. Cancers caused by HPV often don’t show symptoms until the cancer is in later stages of growth."
11,msmarco,_doc,MARCO_7524397,6.4732776,"Smoking Causes Mouth and Throat Cancer. Smoking can affect the health of your mouth and throat. As well as the obvious effects such as unsightly stains on your teeth and bad breath, smoking is the major cause of cancers of the mouth, throat, oesophagus, pharynx, larynx (voice box), tongue, lips and salivary glands.1, 2 The longer you smoke, and the more you smoke, the greater the risk of these cancers. 2.s well as the obvious effects such as unsightly stains on your teeth and bad breath, smoking is the major cause of cancers of the mouth, throat, oesophagus, pharynx, larynx (voice box), tongue, lips and salivary glands. 1, 2 The longer you smoke, and the more you smoke, the greater the risk of these cancers. 2."
12,msmarco,_doc,MARCO_2925879,6.46766,"Types of throat cancer. Throat cancer is a general term that applies to cancer that develops in the throat (pharyngeal cancer) or in the voice box (laryngeal cancer). The throat and the voice box are closely connected, with the voice box located just below the throat. Hypopharyngeal cancer (laryngopharyngeal cancer) begins in the hypopharynx (laryngopharynx) — the lower part of your throat, just above your esophagus and windpipe."
13,msmarco,_doc,MARCO_3878347,6.4580584,"What is throat cancer? Throat cancer is any cancer that forms in the throat. The throat, also called the pharynx, is a 5-inch-long tube that runs from your nose to your neck. The larynx (voice box) and pharynx are the two main places throat cancer forms. Throat cancer is a type of head and neck cancer, which includes cancer of the mouth, tonsils, nose, sinuses, salivary glands and neck lymph nodes."
14,msmarco,_doc,MARCO_191056,6.4305763,"Throat Cancer Symptoms. Most often, throat cancer symptoms are mistaken with the symptoms of other diseases. Throat Cancer is also called as Larynx cancer, Vocal cord cancer or Cancer of the glottis. Throat cancer is a specific type of cancer of the vocal cords, voice box (larynx), or other areas of the throat."
15,msmarco,_doc,MARCO_8591076,6.3545027,"Pharngitis is medical term for a sore throat. Pharyngitis is an inflammation of the pharynx (throat) that results in throat discomfort, pain and/or throat scratchiness; in some individuals it may cause painful swallowing.Sore throat is usually caused by a viral infection and less commonly, a bacterial infection usually by group A streptococci (strep throat).Other causes of sore throat include inflammation due to allergy, toxins, or cancer. Some doctors distinguish pharyngitis from laryngitis and/or tonsillitis, but others do not.harngitis is medical term for a sore throat. Pharyngitis is an inflammation of the pharynx (throat) that results in throat discomfort, pain and/or throat scratchiness; in some individuals it may cause painful swallowing."
16,msmarco,_doc,MARCO_8452826,6.3354626,"1 Some types of HPV may cause genital warts. 2  These are called low-risk types of HPV. 3  Some types of HPV may cause cell changes that sometimes lead to cervical cancer and certain other genital and throat cancers. 4  These are called high-risk types.5  This page discusses these high-risk types.es, high-risk types of genital HPV can cause cancer of the cervix, vagina, vulva, anus, penis, and throat. The type of cancer HPV causes most often is cervical cancer. Most HPV infections go away by themselves and don't cause cancer."
17,msmarco,_doc,MARCO_5990560,6.32237,"Throat or larynx cancer. Throat cancer is cancer of the vocal cords, larynx (voice box), or other areas of the throat. People who smoke or use tobacco are at risk of developing throat cancer. Drinking too much alcohol over a long time also increases risk. Smoking and drinking alcohol combined lead to an increased risk for throat cancer. Most throat cancers develop in adults older than 50."
18,msmarco,_doc,MARCO_6291496,6.3129063,"1 Some types of HPV may cause genital warts. 2  These are called low-risk types of HPV. 3  Some types of HPV may cause cell changes that sometimes lead to cervical cancer and certain other genital and throat cancers. 4  These are called high-risk types.5  This page discusses these high-risk types.es, high-risk types of genital HPV can cause cancer of the cervix, vagina, vulva, anus, penis, and throat. The type of cancer HPV causes most often is cervical cancer. Most HPV infections go away by themselves and don't cause cancer. But abnormal cells can develop when high-risk types of HPV don't go away."
19,msmarco,_doc,MARCO_3466594,6.312118,"For Women: Breast cancer is the leading cancer for women in the US. Lung cancer is the second most common form of cancer and colorectal cancer is third among white women. The number 2 and 3 cancers are reversed among black and Asian/Pacific Island women.For all women, the fourth leading cancer is cancer of the uterus.For Men: Prostate cancer is the leading cancer for men in the US.It is followed by lung cancer and then colorectal cancer. The fourth most common cancer is race-dependent.It is bladder cancer for white men, cancer of the mouth and throat for black men; and stomach cancer for Asian/Pacific Island men. For Children: The most common malignancies in childhood are leukemia, followed by brain tumors, and lymphoma.he fourth most common cancer is race-dependent. It is bladder cancer for white men, cancer of the mouth and throat for black men; and stomach cancer for Asian/Pacific Island men. For Children: The most common malignancies in childhood are leukemia, followed by brain tumors, and lymphoma."
20,msmarco,_doc,MARCO_8046971,6.3041754,"Throat cancer refers to cancer of the voice box, the vocal cords, and other parts of the throat, such as the tonsils and oropharynx. Throat cancer is often grouped into two categories: pharyngeal cancer and laryngeal cancer. Pharyngeal cancer forms in the pharynx. This is the hollow tube that runs from behind your nose to the top of your windpipe. Laryngeal cancer forms in the larynx, which is your voice box. Throat cancer is relatively uncommon when compared to other cancers."
21,msmarco,_doc,MARCO_8149031,6.288879,"Prognosis of Throat cancer (Squamous Cell Carcinoma of the Tonsil) How is Throat cancer (Squamous Cell Carcinoma of the Tonsil) Treated? What is Throat cancer (Squamous Cell Carcinoma of the Tonsil) Throat cancer or squamous cell carcinoma of the tonsil is a part of cancers of the head and neck. In oncology squamous cell cancers of the head and neck are often considered together because they share many similarities - in incidence, cancer type, predisposing factors, pathological features, treatment of the cancer and cancer prognosis."
22,msmarco,_doc,MARCO_7663308,6.2821407,Contents. 1  Rattling noises AND Throat symptoms: Causes of All Symptoms. 2  Rattling noises OR Throat symptoms: 3325 causes. 3  Rattling noises: Causes. 4  Rattling noises: Introduction. 5  Throat symptoms: 3321 causes. 6  Throat symptoms: Introduction. 7  Rattling noises and Throat symptoms and Cellophane -type crackles (8 causes) Rattling noises and Throat symptoms and Cellophane-like crackles (8 causes) Rattling noises and Throat symptoms and Cough (8 causes) Rattling noises and Throat symptoms and Crackles (8 causes) Rattling noises and Throat symptoms and Head symptoms (8 causes) Rattling noises and Throat symptoms and Lung symptoms (8 causes) Rattling noises and Throat symptoms and Rales (8 causes) Rattling noises and Throat symptoms and Rattling or crackling noises (8 causes) Rattling noises and Throat symptoms and Respiratory symptoms (8 causes)
23,msmarco,_doc,MARCO_4976182,6.268688,"Throat cancer stages. Making an educated treatment decision begins with the stage, or progression, of the disease. The stage of throat cancer is one of the most important factors in evaluating treatment options.Our cancer doctors use a variety of diagnostic tests to evaluate throat cancer and develop an individualized treatment plan.he stage of throat cancer is one of the most important factors in evaluating treatment options. Our cancer doctors use a variety of diagnostic tests to evaluate throat cancer and develop an individualized treatment plan."
24,msmarco,_doc,MARCO_6810221,6.2674875,"Why Adults Should Get the HPV Vaccine. HPV infection is extremely common; most sexually active people will be infected with HPV at some point in life. HPV infection usually causes no symptoms, but can cause genital warts and anal cancer in both women and men.HPV can also cause throat cancer.In women, HPV infection can cause cells in the cervix to grow abnormally. In a small fraction of women, these HPV-induced changes will develop into cervical cancer.PV infection usually causes no symptoms, but can cause genital warts and anal cancer in both women and men. HPV can also cause throat cancer. In women, HPV infection can cause cells in the cervix to grow abnormally. In a small fraction of women, these HPV-induced changes will develop into cervical cancer."
25,msmarco,_doc,MARCO_7972824,6.2129536,"Throat cancer refers to cancerous tumors that develop in your throat (pharynx), voice box (larynx) or tonsils. Your throat is a muscular tube that begins behind your nose and ends in your neck. Throat cancer most often begins in the flat cells that line the inside of your throat. Your voice box sits just below your throat and is also susceptible to throat cancer. The voice box is made of cartilage and contains the vocal cords that vibrate to make sound when you talk. Throat cancer can also affect the piece of cartilage (epiglottis) that acts as a lid for your windpipe."
26,msmarco,_doc,MARCO_8617383,6.209849,"Cancer and its treatment can sometimes cause difficulty chewing and/or swallowing. Difficulty chewing can result from physical changes to the mouth, jaw or tongue caused by cancers like oral cancer. Pain or difficulty swallowing, or dysphagia, is a common symptom of cancers like throat cancer and esophageal cancer. Symptoms of dysphagia may include pain while swallowing, inability to swallow, choking or coughing while eating, a sensation of food getting stuck in the throat, and soreness, pain and/or swelling in the throat or mouth. Difficulty chewing and/or swallowing can be scary."
27,msmarco,_doc,MARCO_2925881,6.1978025,1 Surgery for early-stage throat cancer. 2  Throat cancer that is confined to the surface of the throat or the vocal cords may be treated surgically using endoscopy. 3  Your doctor may insert a hollow endoscope into your throat or voice box and then pass special surgical tools or a laser through the scope.ptions may include: 1  Surgery for early-stage throat cancer. 2  Throat cancer that is confined to the surface of the throat or the vocal cords may be treated surgically using endoscopy. 3  Your doctor may insert a hollow endoscope into your throat or voice box and then pass special surgical tools or a laser through the scope.
28,msmarco,_doc,MARCO_8445896,6.194043,Belching AND Sore throat: Causes of All Symptoms. Belching OR Sore throat: 665 causes. Belching: 198 causes. Belching: Introduction. Sore throat: 476 causes. Sore throat: Introduction. Belching and Sore throat and Abdominal pain (8 causes) Belching and Sore throat and Abdominal symptoms (7 causes) Belching and Sore throat and Angina (7 causes) Belching and Sore throat and Heartburn (7 causes) Belching and Sore throat and Nerve symptoms (7 causes) Belching and Sore throat and Pain (7 causes) Belching and Sore throat and Sensations (7 causes) Belching and Sore throat and Swallowing difficulty (7 causes)
29,msmarco,_doc,MARCO_8610846,6.161844,1 Symptoms of throat cancer. 2  Throat cancer can spread. 3  Risk factors of throat cancer.  Diagnosis of throat 1  cancer. Treatment for throat cancer.  Side effects of cancer 1  treatment. Palliative 2  care. Where to get  help. Things to remember.
30,msmarco,_doc,MARCO_3878346,6.0828376,Laryngeal cancer and pharyngeal cancer are two of the most common types of throat cancer. Pharyngeal cancer is broken into three types: 1  Nasopharynx cancer forms in the upper part of the throat. 2  Oropharynx cancer forms in the middle part of the throat.  Hypopharynx cancer forms in the bottom part of the throat.
31,msmarco,_doc,MARCO_7070843,6.071086,"Symptoms of this cancer may depend on where the cancer develops and how it spreads. For example, tumors in the larynx or pharynx may be discovered as a lump in the throat. Cancer in the mouth may cause sores in the mouth or swelling of the jaw. In addition to physical signs of head and neck cancer, these diseases often cause symptoms that are similar to less serious conditions, like the common cold. Changes in voice, headaches, sore throat or a cough may be symptoms of throat cancer."
32,msmarco,_doc,MARCO_7035859,6.0591173,"Throat cancer symptoms. Common throat cancer symptoms may include: 1  Difficulty swallowing, also known as dysphagia. 2  Changes in your voice. 3  Sore throat. 4  Unexplainable weight loss. 5  Swelling of the eyes, jaw, throat or neck. 6  Bleeding in the mouth or through the nose.7  Chronic cough.hroat cancer symptoms. Common throat cancer symptoms may include: 1  Difficulty swallowing, also known as dysphagia. 2  Changes in your voice. 3  Sore throat. 4  Unexplainable weight loss. 5  Swelling of the eyes, jaw, throat or neck. 6  Bleeding in the mouth or through the nose."
33,msmarco,_doc,MARCO_1462317,6.056369,"Also called: Hypopharyngeal cancer, Laryngeal cancer, Laryngopharyngeal cancer, Nasopharyngeal cancer, Oropharyngeal cancer, Pharyngeal cancer. Throat cancer is a type of head and neck cancer. Throat cancer has different names, depending on which part of the throat is affected."
34,msmarco,_doc,MARCO_8452824,6.0562577,"They are linked to some cancers of the mouth and throat, too. Again, although HPVs have been linked to these cancers, most people infected with HPV never develop these cancers. Smoking, which is also linked with these cancers, may work with HPV to increase cancer risk.Other genital infections may also increase the risk that HPV will cause cancer.hey are linked to some cancers of the mouth and throat, too. Again, although HPVs have been linked to these cancers, most people infected with HPV never develop these cancers. Smoking, which is also linked with these cancers, may work with HPV to increase cancer risk."
35,msmarco,_doc,MARCO_7035857,6.048443,Signs and symptoms of laryngeal cancer include a sore throat and ear pain. These and other signs and symptoms may be caused by laryngeal cancer or by other conditions.Check with your doctor if you have any of the following: 1  A sore throat or cough that does not go away. 2  Trouble or pain when swallowing.3  Ear pain.4  A lump in the neck or throat. 5  A change or hoarseness in the voice.hese and other signs and symptoms may be caused by laryngeal cancer or by other conditions. Check with your doctor if you have any of the following: 1  A sore throat or cough that does not go away. 2  Trouble or pain when swallowing. 3  Ear pain. 4  A lump in the neck or throat. 5  A change or hoarseness in the voice.
36,msmarco,_doc,MARCO_3705888,6.0041504,"Types of throat cancer. Throat cancer is a general term that applies to cancer that develops in the throat (pharyngeal cancer) or in the voice box (laryngeal cancer). The throat and the voice box are closely connected, with the voice box located just below the throat."
37,msmarco,_doc,MARCO_3990603,5.986683,"Throat or larynx cancer. Throat cancer is cancer of the vocal cords, larynx (voice box), or other areas of the throat. People who smoke or use tobacco are at risk of developing throat cancer. Drinking too much alcohol over a long time also increases risk. Smoking and drinking alcohol combined lead to an increased risk for throat cancer."
38,msmarco,_doc,MARCO_8441036,5.9726357,"There is some evidence that smoking could cause breast cancer [11-15]. After lung cancer, the upper aerodigestive tract cancers (mouth, upper throat, voice box and gullet) have the highest proportions of cancer cases caused by smoking – population attributable fractions, or PAFs, of more than 6 in 10 [4].obacco is the single biggest cause of cancer. Experts agree that tobacco is the single biggest avoidable cause of cancer in the world [1, 2]. Smoking causes over a quarter (28 per cent) of cancer deaths in the UK and nearly one in five cancer cases [3, 4]."
39,msmarco,_doc,MARCO_1905583,5.9701376,"HPV infection isn’t cancer but can cause changes in the body that lead to cancer. HPV infections usually go away by themselves but having an HPV infection can cause certain kinds of cancer to develop. These include cervical cancer in women, penile cancer in men, and anal cancer in both women and men. HPV can also cause cancer in the back of the throat, including the base of the tongue and tonsils (called oropharyngeal cancer). All of these cancers are caused by HPV infections that did not go away."
40,msmarco,_doc,MARCO_8168665,5.9587092,"Oropharyngeal cancers (cancers of the middle part of the throat, including the soft palate, the base of the tongue, and the tonsils): About 70% of oropharyngeal cancers are caused by HPV. In the United States, more than half of cancers diagnosed in the oropharynx are linked to HPV type 16 . Rarer cancers: HPV causes about 65% of vaginal cancers, 50% of vulvar cancers, and 35% of penile cancers . Most of these are caused by HPV type 16. High-risk HPV types cause approximately 5% of all cancers worldwide ."
41,msmarco,_doc,MARCO_4976187,5.9465094,"It can be difficult to detect throat cancer in its early stages. Common signs and symptoms of throat cancer include: 1  a change in your voice. 2  trouble swallowing. 3  weight loss. 4  sore throat. 5  persistent cough (may cough up blood). 6  swollen lymph nodes in the neck.hese abnormal cells form malignant growths called tumors. Throat cancer refers to cancer of the voice box, the vocal cords, and other parts of the throat, such as the tonsils and the oropharynx. Raise money to cover your cancer treatment costs."
42,msmarco,_doc,MARCO_4348985,5.937133,"Cancers of the Mouth and Throat People who drink and smoke are at higher risk for certain types of cancer, particularly those of the mouth and throat (12–14). Alcohol and tobacco cause approximately 80 percent of cases of cancer of the mouth and throat in men and about 65 percent in women (11,16–18).lcohol and tobacco co-use appears to substantially increase the risk of at least one type of cancer of the esophagus (19). Liver Cancer During the past decade, the incidence of liver cancer has increased dramatically in the United States (20)."
