,_index,_type,_id,_score,_source.body
241,msmarco,_doc,MARCO_8767024,5.02681,"But some kinds of HPV can lead to genital warts or certain types of cancer. 1  Two types of HPV (types 6 and 11) cause most cases of genital warts. 2  At least a dozen types of HPV can sometimes lead to cancer, though two in particular (types 16 and 18) lead to the majority of cancer cases. These are called high-risk HPV. Cervical cancer is most commonly linked to HPV, but HPV can also cause cancer in your vulva, vagina, penis, anus, mouth, and throat."
242,msmarco,_doc,MARCO_1394508,5.02608,A bacterial infection can also cause a sore throat. These types of infections include: 1  strep throat: inflammation of the throat caused by the Streptococcal bacteria. 2  diphtheria: infectious disease that causes throat inflammation.3  whooping cough: disease of the respiratory mucous membrane.hese types of infections include: 1  strep throat: inflammation of the throat caused by the Streptococcal bacteria. 2  diphtheria: infectious disease that causes throat inflammation. 3  whooping cough: disease of the respiratory mucous membrane.
243,msmarco,_doc,MARCO_8591072,5.02608,"Throat infections with bacteria can also cause pharyngitis. Strep throat is the most common bacterial throat infection. It is caused by group A streptococcus bacteria.(For more information on whether this condition is contagious, click Pharyngitis and Sore Throat Causes.These articles also discuss various causes of this throat condition, as well as information on how to prevent spreading the infection.). Advertisement.For more information on whether this condition is contagious, click Pharyngitis and Sore Throat Causes. These articles also discuss various causes of this throat condition, as well as information on how to prevent spreading the infection.)."
244,msmarco,_doc,MARCO_8441038,5.0252905,"Secondhand smoke and breast cancer. Whether SHS increases the risk of breast cancer is still being studied. Both mainstream and sidestream smoke have chemicals that, in high concentrations, cause breast cancer in rodents. Chemicals from tobacco smoke reach breast tissue and can be found in breast milk.One reason the link between SHS and breast cancer risk in human studies is uncertain is because breast cancer risk has not clearly been shown to be increased in active smokers.HS has been linked to lung cancer. There is also some evidence suggesting it might be linked to lymphoma, leukemia, and brain tumors in children, and cancers of the larynx (voice box), pharynx (throat), nasal sinuses, brain, bladder, rectum, stomach, and breast in adults."
245,msmarco,_doc,MARCO_1623817,5.0231185,Symptom Checker. 1  Throat symptoms and Head symptoms (3112 causes) 2  Throat symptoms and Mouth symptoms (3058 causes) 3  Throat symptoms and Nerve symptoms (2569 causes)  Throat symptoms and Respiratory symptoms (2552 1  causes) Throat symptoms and Face symptoms (2518 causes)  Throat symptoms and Sensory symptoms (2182 causes)
246,msmarco,_doc,MARCO_7972827,5.022668,"Options may include: 1  Surgery for early-stage throat cancer. Throat cancer that is confined to the surface of the throat or the vocal cords may be treated surgically using endoscopy. 2  Surgery to remove all or part of the voice box (laryngectomy). For smaller tumors, your doctor may remove the part of your voice box that is affected by cancer, leaving as much of the voice box as possible. Your doctor may be able to preserve your ability to speak and breathe normally."
247,msmarco,_doc,MARCO_5339872,5.01895,"HPV is also associated with several less common cancers, such as vaginal and vulvar cancers in women, and anal and oropharyngeal (back of the throat, including base of tongue and tonsils) cancers in both men and women. HPV can also cause genital warts and warts in the throat."
248,msmarco,_doc,MARCO_2055420,5.0154557,Contents. 1  Neck pain AND Throat pain: Causes of All Symptoms. 2  Neck pain OR Throat pain: 170 causes. 3  Neck pain: 112 causes.  Neck pain: 1  Introduction. Throat pain: 71 causes.  Throat pain: 1  Introduction. Neck pain and Throat pain and Nerve symptoms (13 causes)  Neck pain and Throat pain and Pain (13 causes)
249,msmarco,_doc,MARCO_4595892,5.0154247,"Surgery to the tongue can cause problems with your speech and changes in eating and drinking. Radiotherapy to the head and neck area can cause several side effects including a dry, sore mouth and taste changes. There is information about the side effects of radiotherapy to the mouth in the mouth cancer section.ancers that develop in this part of the tongue come under a group of cancers called mouth (oral) cancer. The base of the tongue is the back third of the tongue. This part is very near your throat (pharynx). Cancers that develop in this part are called oropharyngeal cancers (pronounced oar-o-farin-gee-al)."
250,msmarco,_doc,MARCO_2468846,5.0125217,"In most cases, these infections do not cause symptoms. They can cause genital warts. In a small number of women, certain HPV strains cause changes in the cervix that can become cancerous if not treated. HPV is also linked to cancers of the penis, vagina, anus, vulva, and also to mouth and throat cancers. HPV subtypes 16 and 18 are the causes of most cancers."
251,msmarco,_doc,MARCO_842108,5.0091925,"The terms sore throat, strep throat, and tonsillitis often are used interchangeably, but they don’t mean the same thing. Tonsillitis refers to tonsils that are inflamed. Strep throat is an infection caused by a specific type of bacteria, Streptococcus. When your child has a strep throat, the tonsils are usually very inflamed, and the inflammation may affect the surrounding part of the throat as well. Other causes of sore throats are viruses and may only cause inflammation of the throat around the tonsils and not the tonsils themselves. In infants, toddlers, and preschoolers, the most frequent cause of sore throats is a viral infection."
252,msmarco,_doc,MARCO_7424531,5.0091925,"Strep throat, named for the Streptococcus bacterium that causes the condition, is a particularly severe form of sore throat that is best treated with antibiotics. Strep throat can strike both children and adults, but only about 5%-10% of sore throats are caused by a bacterial infection.trep throat, named for the Streptococcus bacterium that causes the condition, is a particularly severe form of sore throat that is best treated with antibiotics. Strep throat can strike both children and adults, but only about 5%-10% of sore throats are caused by a bacterial infection."
253,msmarco,_doc,MARCO_1904751,5.007254,"1 A small pouch that forms and collects food particles in your throat, often just above your esophagus, leads to difficulty swallowing, gurgling sounds, bad breath, and repeated throat clearing or coughing.  Cancer. Certain cancers and some cancer treatments, such as radiation, can cause difficulty swallowing."
254,msmarco,_doc,MARCO_5066769,5.005394,How You Get Strep Throat. Strep throat is an infection in the throat and tonsils caused by group A Streptococcus bacteria (called group A strep). Group A strep bacteria can also live in a person's nose and throat without causing illness.The bacteria are spread through contact with droplets after an infected person coughs or sneezes.ow You Get Strep Throat. Strep throat is an infection in the throat and tonsils caused by group A Streptococcus bacteria (called group A strep). Group A strep bacteria can also live in a person's nose and throat without causing illness.
255,msmarco,_doc,MARCO_7017766,5.0043373,"HPV-Linked Throat Cancer May Have Telltale Signs. THURSDAY, March 20, 2014 (HealthDay News) -- The first symptoms of throat and mouth cancer -- also known as oropharyngeal cancer -- may differ depending on whether the condition is caused by the human papillomavirus (HPV), a small study suggests."
256,msmarco,_doc,MARCO_712033,5.0040164,1 Find the cause of a sore throat. 2  Most sore throat infections are caused by a virus. 3  A throat culture shows the difference between a bacterial infection and a viral infection. 4  Finding the organism that is causing the infection can guide treatment. Find the cause of a sore throat. 2  Most sore throat infections are caused by a virus. 3  A throat culture shows the difference between a bacterial infection and a viral infection. 4  Finding the organism that is causing the infection can guide treatment.
257,msmarco,_doc,MARCO_5349321,5.0040164,"Viral pharyngitis is a sore throat caused by a virus, and causes throat pain and cold-like symptoms. Acute sinusitis, an inflammation of the sinuses, causes sinus pain and tenderness, facial redness and more. Coxsackie virus infection can cause many cold-like symptoms as well as blisters on the mouth hands and feet. Strep throat is a throat infection causing symptoms including a red sore throat with white patches. Tonsillitis is painful swelling in the tonsils, causing sore throat, red tonsils, pain, fever, and more."
258,msmarco,_doc,MARCO_1394509,5.003395,"Bacteria can also cause a throat infection. This is sometimes called a ‘strep’ throat, after the name of the bacteria that cause it — Streptococcus pyogenes. Bacterial infections or ‘strep’ throat is rare in children younger than 3 years old.About 1 in 3 children aged 3–14 years will have a sore throat caused by S. pyogenes, compared with about 1 in 10 adults.acteria can also cause a throat infection. This is sometimes called a ‘strep’ throat, after the name of the bacteria that cause it — Streptococcus pyogenes. Bacterial infections or ‘strep’ throat is rare in children younger than 3 years old."
259,msmarco,_doc,MARCO_5485077,5.002902,"Symptoms of head and neck cancer. A lump in the neck. Cancers that begin in the head or neck usually spread to lymph nodes in the neck before they spread elsewhere. A lump in the neck that lasts more than two weeks should be seen by a physician as soon as possible.Of course, not all lumps are cancer.But a lump (or lumps) in the neck can be the first sign of cancer of the mouth, throat, voicebox (larynx), thyroid gland, or of certain lymphomas and blood cancers. Such lumps are generally painless and continue to enlarge steadily.Change in the voice. Most cancers in the larynx cause some changes in voice.ymptoms of head and neck cancer. A lump in the neck. Cancers that begin in the head or neck usually spread to lymph nodes in the neck before they spread elsewhere. A lump in the neck that lasts more than two weeks should be seen by a physician as soon as possible."
260,msmarco,_doc,MARCO_2417396,5.002126,Mucositis is swelling inside the mouth and throat that can lead to painful ulcers and mouth sores. Talk with your doctor if you notice pain or other changes in your mouth during cancer treatment. Relieving side effects is an important part of cancer care and treatment. This is called symptom management or palliative care. Causes of mouth sores. Understanding the cause of your mouth sores may help you and your health care team manage this side effect. Several things can cause mouth sores related to cancer and cancer treatment: Chemotherapy. Up to 40% of people receiving chemotherapy experience mouth sores. Radiation therapy to the head and neck area
261,msmarco,_doc,MARCO_3218131,5.001602,"When you have a contagious illness, like the flu or a cold, the sore throat is often accompanied by a runny nose. 1  The sore throat is sometimes caused by postnasal drip, as fluids from your sinuses drip down the back of your throat, causing redness and irritation. 2  The throat feels raw, irritated, and painful.hen you have a contagious illness, like the flu or a cold, the sore throat is often accompanied by a runny nose. 1  The sore throat is sometimes caused by postnasal drip, as fluids from your sinuses drip down the back of your throat, causing redness and irritation. 2  The throat feels raw, irritated, and painful."
262,msmarco,_doc,MARCO_3143715,5.000928,"Most lumps and bumps behind the ears may be due to common causes. However, there are some instances when lumps behind ears could be due to more serious causes. The most worrisome cause of a lump behind ear is cancer. Common symptoms of head and neck cancer are a bump behind the ear, difficulty in swallowing, a sore throat that does not heal and a hoarse voice. Sometimes, cancer of the salivary glands may also cause a bump behind the ear."
263,msmarco,_doc,MARCO_5284909,5.0002174,"Viral pharyngitis is a sore throat caused by a virus, and causes throat pain and cold-like symptoms. Strep throat is a throat infection causing symptoms including a red sore throat with white patches. Tonsillitis is painful swelling in the tonsils, causing sore throat, red tonsils, pain, fever, and more. Laryngitis is an inflammation of the larynx, or voice box, causing hoarseness and loss of voice. A thermal burn of the mouth or tongue can cause pain, blisters, peeling skin, and temporary loss of taste."
264,msmarco,_doc,MARCO_8799351,5.0002174,"More than half of sore throats are caused by viruses (known medically as viral pharyngitis). They are often the same viruses that cause the common cold, flu, a sinus infection (sinusitis), or other upper respiratory tract infections. Throat infections with bacteria can also cause pharyngitis. Strep throat is the most common bacterial throat infection. It is caused by group A streptococcus bacteria. (For more information on whether this condition is contagious, click Pharyngitis and Sore Throat Causes. These articles also discuss various causes of this throat condition, as well as information on how to prevent spreading the infection.)"
265,msmarco,_doc,MARCO_5628564,4.9958906,Strep Throat. Strep throat is a contagious bacterial condition that causes white spots in the throat. This painful condition can cause swollen tonsils with white areas and pus. Red spots on the roof of your mouth or throat can also develop.Strep throat typically causes considerable pain and makes swallowing difficult.Other symptoms include high fever and swollen glands under your jaw.his painful condition can cause swollen tonsils with white areas and pus. Red spots on the roof of your mouth or throat can also develop. Strep throat typically causes considerable pain and makes swallowing difficult. Other symptoms include high fever and swollen glands under your jaw.
266,msmarco,_doc,MARCO_762098,4.9956036,"THURSDAY, March 20, 2014 (HealthDay News) -- The first symptoms of throat and mouth cancer -- also known as oropharyngeal cancer -- may differ depending on whether the condition is caused by the human papillomavirus (HPV), a small study suggests. Oropharyngeal cancer arises in the throat, soft palate, tonsils or base of the tongue."
267,msmarco,_doc,MARCO_8436764,4.9956036,"Lip, tongue, other parts of the mouth, throat, esophagus, stomach and lung are the most common. Smoking can cause, mouth, lung, eye, heart, and all sorts of different types … of cancer. Lung cancer is the biggest risk. You can also get mouth, eye, heart, and a hole in your throat. 1: Lung cancer."
268,msmarco,_doc,MARCO_2267185,4.994355,"Symptoms of cancer of the thyroid. These include a sore throat, a lump in your neck, hoarse voice and a difficulty in swallowing. These symptoms can be indicative of other conditions such as throat infections so do not assume that a sore throat or hoarseness means that you have thyroid cancer. You may have a bacterial or viral throat infection instead."
269,msmarco,_doc,MARCO_6082426,4.994041,"1 Most sore throats are caused by viruses or mechanical causes (such as mouth breathing) and can be treated successfully at home. 2  Sore throat symptoms include pain, burning or scratching sensations at the back of the throat, pain when swallowing, and tenderness in the neck.3  Sore throat symptoms may be accompanied by: Most sore throats are caused by viruses or mechanical causes (such as mouth breathing) and can be treated successfully at home. 2  Sore throat symptoms include pain, burning or scratching sensations at the back of the throat, pain when swallowing, and tenderness in the neck. 3  Sore throat symptoms may be accompanied by:"
270,msmarco,_doc,MARCO_7237560,4.994041,"Sore Throat Home Remedies What Causes a Sore Throat? You can have a sore throat for many reasons. Often, colds and flu cause sore throats. Other causes can include: Allergies ; Mononucleosis ; Smoking ; Strep throat ; Tonsillitis - an infection in the tonsils ; Home remedy treatments for sore throats. Treatment depends on the cause. Some home remedies that may ease the pain of a sore throat include: suck on lozenges, ice chips (do not give lozenges to young children), sore throat sprays; drink lots of liquids, gargling may ease the pain, get plenty of rest, use a clean humidifier or mist vaporizer,"
271,msmarco,_doc,MARCO_3046772,4.992783,"The American Cancer Society estimates that 90 percent of people with oral cancer (cancer affecting the lips, tongue, throat, and mouth) have used tobacco in some form. Likewise, the risk of oral cancer is six times higher among smokers relative to non-smokers. Your individual risk of oral cancer depends on how long you’ve been using tobacco — the longer you use it, the greater your risk. Smoking and Periodontal Disease. “Smoking cigarettes doesn’t cause dental decay, but it does cause periodontal, or gum, disease,” Kilgore explains. “Bone loss is part of periodontal disease."
272,msmarco,_doc,MARCO_7972825,4.9924088,Surgery for early-stage throat cancer. Throat cancer that is confined to the surface of the throat or the vocal cords may be treated surgically using endoscopy. Your doctor may insert a hollow endoscope into your throat or voice box and then pass special surgical tools or a laser through the scope.
273,msmarco,_doc,MARCO_5087193,4.990611,"Your body tries to repair the damage that smoking does to your DNA, but over time smoking can wear down this repair system and lead to cancer (like lung cancer, pancreatic cancer, stomach cancer, and cancers of the mouth, throat, esophagus and sinuses). In fact, one third of all cancer deaths are caused by tobacco."
274,msmarco,_doc,MARCO_102936,4.990464,"Chronic sore throat, believe its due to GERD but afraid of throat cancer. Throat pain seems to be more on the left side with sore neck muscles to. Dr. Roy Arnold Dr. Arnold Prob GERD: Throat cancer would be EXCEEDINGLY rare at age 19."
275,msmarco,_doc,MARCO_7035856,4.9898376,"Depending upon the extent of spread of the cancer, other symptoms can include swelling of nearby tissues, enlarged lymph nodes, trouble breathing, difficulty speaking, neck or throat pain, ear pain, painful swallowing, and headache.Pain or ringing in the ears may occur in some cases.edical Author: Melissa Conrad Stoeppler, STöPPLER. Md throat cancers may not cause any symptoms if they are very small and have not spread at the time of. Diagnosis, sometimes an area of irritation or discoloration on the lining issues of the throat is the only sign of an. abnormality"
276,msmarco,_doc,MARCO_3725762,4.988845,"Cancer of the trachea is a rare form of cancer which accounts for a very small percentage of cancer cases. This is often known as bronchial cancer. There are several types of tracheal cancer, for example ‘squamous cell carcinoma’ that develop within cells that line parts of the body such as the airways and throat.ancer of the trachea is a rare form of cancer which accounts for a very small percentage of cancer cases. This is often known as bronchial cancer. There are several types of tracheal cancer, for example ‘squamous cell carcinoma’ that develop within cells that line parts of the body such as the airways and throat."
277,msmarco,_doc,MARCO_294432,4.988414,"Sore throats can be painful and annoying. Fortunately, most sore throats are caused by a minor illness and go away without medical treatment. Several conditions can cause a sore throat. Sore throats may be caused by a viral illness, such as: 1  The common cold, the most common type of viral infection.2  Infection of the voice box (laryngitis). 3  Mononucleosis (mono, the kissing disease), a viral infection that tends to cause a persistent sore throat. bacterial infection may also cause a sore throat. This can occur from: 1  Strep throat, which usually does not occur with congestion or a cough. 2  An inflammation or infection of the tonsils (tonsillitis) and sometimes the adenoids (adenoiditis). 3  An infection of the tissues around the tonsils (peritonsillar abscess)."
278,msmarco,_doc,MARCO_191049,4.986895,"In 2013 head and neck cancers globally affected more than 4.6 million people (mouth 2.4 million, throat 1.3 million, larynx 0.9 million) and resulted in more than 362,000 deaths (mouth 135,000, throat 139,000, larynx 88,000). Together they are the seventh most frequent cancer and the ninth most frequent cause of death from cancer."
279,msmarco,_doc,MARCO_6914820,4.978836,It can be difficult to detect throat cancer in its early stages. Common signs and symptoms of throat cancer include: a change in your voice; trouble swallowing (dysphagia) weight loss; sore throat; constant need to clear your throat; persistent cough (may cough up blood) swollen lymph nodes in the neck; wheezing; ear pain; hoarseness
280,msmarco,_doc,MARCO_5210531,4.9692726,"Tonsillitis Tonsillitis is painful swelling in the tonsils, causing sore throat, red tonsils, pain, fever, and more. Thyroid cancer Thyroid cancer is cancer of the thyroid gland and can cause a cough, hoarseness, a lump in the neck, and more. Thyroid nodules Thyroid nodules usually don't cause symptoms, but can cause a visible lump, neck pain, hoarseness, and more. Epiglottitis Epiglottitis is a rare, life-threatening illness that keeps air from getting to the lungs."
281,msmarco,_doc,MARCO_7437376,4.9632363,"Back to Top Causes. Pharyngitis is caused by swelling in the back of the throat (pharynx) between the tonsils and the (larynx). Most sore throats are caused by colds or the flu. Coxsackie virus or mononucleosis can also cause sore throat. Bacteria that can cause pharyngitis in some cases. 1  Strep throat is caused by group A streptococcus. 2  Less commonly, bacteria such as corynebacterium, gonorrhea, and chlamydia can cause sore throat."
282,msmarco,_doc,MARCO_2786992,4.9568152,"Without running to conclusion, throat and lung cancer can be the cause for the tickle in throat and the persistent coughing. You need to have a professional heath care provider diagnose the condition to be sure the cause is cancer before treatment can commence."
283,msmarco,_doc,MARCO_6810219,4.946459,"Gardasil is approved for males ages 9 through 26 and Gardasil 9 is approved for use in males ages 9 through 15. The HPV vaccine does not treat or cure an HPV infection in women or men who are already infected by one of these HPV types.PV infection usually causes no symptoms, but can cause genital warts and anal cancer in both women and men. HPV can also cause throat cancer. In women, HPV infection can cause cells in the cervix to grow abnormally. In a small fraction of women, these HPV-induced changes will develop into cervical cancer."
284,msmarco,_doc,MARCO_7035854,4.946253,"Signs and symptoms of throat cancer may include: 1  A cough. 2  Changes in your voice, such as hoarseness or not speaking clearly. 3  Difficulty swallowing.4  Ear pain. 5  A lump or sore that doesn't heal. 6  A sore throat. 7  Weight loss.igns and symptoms of throat cancer may include: 1  A cough. 2  Changes in your voice, such as hoarseness or not speaking clearly. 3  Difficulty swallowing. 4  Ear pain. 5  A lump or sore that doesn't heal. 6  A sore throat."
285,msmarco,_doc,MARCO_1026250,4.9421597,"The sensation of a lump in the throat would often cause a lot of anxiety although anxiety may be the culprit in the first place. However, there are many other possible causes of this annoying disorder. Patients are naturally worried and frequently fear that the lump sensation may be cancer. Fortunately throat cancer is extremely uncommon."
286,msmarco,_doc,MARCO_5990568,4.935296,"Throat cancer symptoms. Some symptoms of throat cancer are specific to certain areas of the body. For instance, changes in your voice may be a sign of laryngeal (voice box) cancer, but would rarely indicate cancer of the pharynx."
287,msmarco,_doc,MARCO_1663365,4.935117,"1 However, if left untreated, the disease can spread throughout the body over the course of many years and cause considerable organ damage. 2  Trichomonas. 3  Trichomonas vaginalis is a microscopic parasite that causes trichomoniasis, a common STD, especially among sexually active young women. One of the most common STDs in the United States, this virus can infect the genital area as well as the mouth and throat. 2  Low-risk types can cause genital warts (condyloma) while high-risk types can cause cervical cancer and other genital cancers. 3  Early detection can reduce the risk of cancer."
288,msmarco,_doc,MARCO_8838764,4.9329166,"There are several possible connections between neck pain and cancer. The illness could manifest itself as a tumor in the neck area, or as metastatic cancer, which is cancer that spreads from another part of the body. Squamous, thyroid, and spinal cancer or leukemia can all be indicated by neck pain. It is possible that neck pain is caused by cancer if it is constant, keeps getting worse, and is not responsive to medication. There may also be a painful lump in the neck, accompanied by a constant sore throat. In order to diagnose a definitive link between neck pain and cancer, a doctor will perform several tests."
289,msmarco,_doc,MARCO_1081857,4.927476,Cancer » Tonsil Cancer » Symptoms and Early Signs. Tonsil cancer symptoms can be seen in any of the three types of tonsils that are present in the throat. This cancer commonly occurs in is palatine tonsils. These are tonsils which are present on both the sides of the throat.
