,_index,_type,_id,_score,_source.body
763,msmarco,_doc,MARCO_5236133,4.8969073,"Siberian tigers, also known as the Amur Tiger, Panthera Tigris altaica are found in the wild (2008) in the Russian Far East and northeastern China, Also they are found in No … rth Korea and were in Siberia some are still there but few. 5 people found this useful.Kodiakcathy.he Siberian tiger lives in the Taiga forests of Russia. 3 people found this useful. Edit. Share to: 1  Myths and Facts About Baby Tigers Tigers are the biggest species of cat in the world. 2  While tigers used to populate much of Asia, there are now less than 3,200 remaining tigers in the wild."
764,msmarco,_doc,MARCO_6063988,4.8969073,"There are at least two subspecies names associated with the Siberian tiger: Panthera Tigris longipilis and Panthera Tigris altaica. Literally, these names mean Panther tiger long-haired and Panther tiger of the Altai Mountains, respectively.hite tigers are a rare albino version of the Bengal tiger, Panthera Tigris Tigris. White Siberian tigers are not a natural occurrence. They are a cross-breeding of Siberian t … igers (Panthera tigris altaica) with white Bengal tigers. 4 people found this useful."
765,msmarco,_doc,MARCO_8590040,4.8969073,"Of all the big cats, the tiger is the largest – and the closest to extinction. As recently as 100 years ago, there were as many as 100,000 wild tigers living in Asia. Today, about 3,200 remain in the wild.The State of the Tiger. The tiger is one of the most iconic animals on earth, but the largest of the big cats is on the brink of extinction.s recently as 100 years ago, there were as many as 100,000 wild tigers living in Asia. Today, about 3,200 remain in the wild. The State of the Tiger. The tiger is one of the most iconic animals on earth, but the largest of the big cats is on the brink of extinction."
766,msmarco,_doc,MARCO_8670390,4.8969073,"The tiger is the largest member of the felid (cat) family. Tigers mainly eat ambar deer, wild pigs, water buffalo and antelope. Tigers are also known to hunt sloth bears, dogs, leopards, crocodiles and pythons as well as monkeys and hares. Old and injured tigers have been known to attack humans and domestic cattle. In the early 1900s, there were around 100,000 tigers throughout their range. Today, an estimated total of around 3,000-4,500 exist in the wild. Below is a breakdown of tiger numbers by subspecies. Bengal tiger: Less than 2,000."
767,msmarco,_doc,MARCO_8725996,4.8969073,"There are also Bengal tigers, which live in India, the South China tigers, Indochinese and Malayan tigers, which live in southeast Asia, and Sumatran tigers, which live in Sumatra (an island in Indonesia, southeast of the Asian mainland). tigers live in jungles in Asian countries such as India, Russia and china They live in throughout eastern Asia in Bangladesh, Bhutan, China, India, Nepal, Cambodia, Laos, Malaysia, Myanmar, Thailand and Vietnam, and Indonesia (Sumatra), a tigers habitat is the forest and the wild Jungles,grasslands and forests are the habitats of a tiger."
768,msmarco,_doc,MARCO_1516373,4.8966866,"The hammerhead sharks are the group of sharks that belong to the Sphyrnidae and are literally known for their flat-stretched heads. Learn some of the imperative hammerhead shark facts for kids including hammerhead sharks diet, habitat, and species. The hammerhead sharks are the group of sharks that belong to the Sphyrnidae and are literally known for their flat-stretched heads. These hammerhead sharks are being put in the genus Sphyrna."
769,msmarco,_doc,MARCO_7016171,4.8966866,"Killer whales sometimes develop a taste for shark livers and will kill white sharks for it, even large whites. well it depends sharks can eat sharks but i dont know what type. but sharks are vicous creatures and they usally win. The whale shark and the basking shark certainly aren't vicious creatures. Only about 5, out of 350, species are known to attack man and even then they don't do it very often."
770,msmarco,_doc,MARCO_2998727,4.895724,"3) Whale … s sharks have the same cartilaginous skeleton structure as other sharks Tthe reason its called WHALE shark is because it is the largest of all the sharks, and as whales are the currently biggest mammals on the earth it only seems appropriate.he only thing it got in common with whales is its  size.  A Whale Shark is a fish and a member of the shark family. It is  called a Whale Shark because the grow to very large size."
771,msmarco,_doc,MARCO_2994906,4.895724,"Pelagic sharks are carnivorous and eat fish, including other sharks on occasion, turtles, seals and penguins. The 3 largest species of pelagic shark – the whale shark, the basking shark and the megamouth shark – are all filter feeders and eat mainly plankton. Reproduction. Most pelagic sharks are viviparous - the eggs are fertilized inside the female's body, and live 'pups' are hatched."
772,msmarco,_doc,MARCO_1144937,4.895012,Tiger Snakes are live bearers and produce from between 10 to 90 young depending on the species and size and age of the Tiger. Their venom is highly neurotoxic. Specific Tiger snake antivenom is the treatment for a bite. Tigers from some areas can be cannibalistic though most Mainland Tigers will not eat other snakes.estern Tiger (Notechis ater occidentalis) It is found in the high rainfall area in the South West of West Australia and some of the adjacent islands. Chappell Island Tiger (Notechis ater serventyi) Although this snake is named after Chappell Island it is found on most of the islands of the Furneaux group.
773,msmarco,_doc,MARCO_8052739,4.895012,"Due to the size and power of the Indochinese tiger, it has no natural predators in its native environment. Humans that hunt the Indochinese tiger and habitat loss are the only threats to the Indochinese tiger. After a gestation period of 3 to 4 months, the female Indochinese tiger gives birth to up to 5 cubs. Newborn Indochinese tiger cubs weigh about 1 kg (2 lb) and are blind and helpless. The mother feeds them milk for about 2 months and then the Indochinese tiger cubs are introduced to meat. Indochinese tiger cubs depend on their mother for the first 18 months and then they start hunting on their own."
774,msmarco,_doc,MARCO_6849756,4.895012,"a female lion is called a lioness and a male tiger is called a tiger. 4 people found this useful. Edit. Share to: 1  All About the Amphibians Known as Waterdogs Waterdogs are the larval form of the tiger salamander, a popular pet of the land-dwelling amphibian species that returns to the water to breed. female Bengal Tiger is called a female Bengal Tiger.      Oh shut up, guy before me. A female Bengal tiger is called a tigress lik … e all other types of female tigers. 2 people found this useful."
775,msmarco,_doc,MARCO_8565082,4.895012,"This type of tiger became extinct in the wild in 1932 when the last two were shot in Mysore Padesh, India. From work done by us at the Institute of Greatly Endangered and Rare Species and our breeding parnter Dr. Jossip Marcan we have brought back from the very edge of extinction the Golden Tabby Tiger. The Golden Tabby tiger is a white tiger with red stripes and a red saddle pattern. It has none of the black coloration of a standard Bengal tiger of a Royal White Bengal tiger. We are very proud to say that since the first birth in 1987 that their are now more than 30 Golden Tabby tigers in existence today."
776,msmarco,_doc,MARCO_4137922,4.8947616,"Joe Chernov and Robin Richards have created an infographic that illustrates the staggering number of sharks killed by humans every year. According to the infographic, sharks killed 12 people last year, but humans kill that many sharks every four seconds, adding up to an estimated total of 100 million sharks annually. Many sharks are killed by 'finning,' a process in which a shark's fins are cut off to be sold for shark fin soup."
777,msmarco,_doc,MARCO_5288615,4.8947616,"It was once believed that all sharks had to swim constantly in order to breathe and could not sleep for more than a few minutes at a time. Oxygen-rich water flows through the gills during movement allowing the shark to breathe. While some species of sharks do need to swim constantly, this is not true for all sharks. Some sharks such as the nurse shark have spiracles that force water across their gills allowing for stationary rest. Sharks do not sleep like humans do, but instead have active and restful periods."
778,msmarco,_doc,MARCO_8724590,4.8947616,"White Shark Diving: White Shark Ventures invites you cage diving with great white sharks in the aptly named Shark Alley , near the fishing village of Gansbaai, South Africa. Sharks are quite possibly the world's most feared animals. From the smallest sand shark to the enormous whale shark, they are sleek, muscled, and some are almost as agile as a dolphin. There is no doubt that they are the most evolved predators in the ocean."
779,msmarco,_doc,MARCO_2861206,4.8928404,"Shark Week The Fastest Shark in the Ocean The shortfin mako shark is the fastest shark in the ocean. This toothy torpedo can swim at speeds of up to 60 mph has a tail like a tuna fish, its favorite prey.01:58.he Fastest Shark in the Ocean. The shortfin mako shark is the fastest shark in the ocean. This toothy torpedo can swim at speeds of up to 60 mph has a tail like a tuna fish, its favorite prey."
780,msmarco,_doc,MARCO_3912995,4.8928404,"Add to that the fact that sharks, as apex predators, are vital to maintaining the balance of our ocean ecosystems and you begin to understand the true value of sharks. Sharks and Ecotourism Sharks are worth more alive than dead! Divers rate sharks as among their top attractions on a dive site. Because of this, sharks bring millions of dollars in ecotourism revenue to coastal communities that can provide both protection for sharks and offer added sustainable tourism infrastructure."
781,msmarco,_doc,MARCO_6116661,4.8928404,"Size: The spined pygmy shark, a deep-sea shark, is one of the smallest at only about 7-8 inches, while the whale shark is the largest shark, and fish, at about 50 feet in length. Lifespan: Although lifespan varies by shark species, most sharks are long-lived and generally tend to live for 20-30 years. Species like the spiny dogfish and the whale shark are believed to live for over 100 years!"
782,msmarco,_doc,MARCO_8068589,4.8928404,"Shark finning. Shark finning refers to the removal of fins from sharks, often while the shark is alive. The sharks are sometimes discarded back to the ocean, still alive but without their fins. Unable to swim effectively, they sink to the bottom of the ocean and die of suffocation or are eaten by other predators. Shark finning at sea enables fishing vessels to increase profitability and increase the number of sharks harvested, as they only have to store and transport the fins, by far the most profitable part o"
783,msmarco,_doc,MARCO_7718383,4.8928404,Meet the Cast. 1  Barbara Corcoran Shark Follow @BarbaraCorcoran. 2  Mark Cuban Shark. 3  Lori Greiner Shark Follow @LoriGreiner. 4  Robert Herjavec Shark Follow @robertherjavec. 5  Daymond John Shark Follow @TheSharkDaymond. 6  Kevin O'Leary Shark Follow @kevinolearytv. 7  Richard Branson Guest Shark Follow @richardbranson.
784,msmarco,_doc,MARCO_7080032,4.8928404,"Where do sharks live? Sharks live in oceans all over the world. Most shark species prefer warmer climates and are often found in the sea around Australia, Florida and Mexico. However, other types of sharks like cold water and live in the icy waters of Alaska and Iceland. How do sharks breathe under water? Sharks are a type of fish which means they can breathe easily under water. They breathe through gills that are located on either side of their bodies. Why do sharks have so many teeth?"
785,msmarco,_doc,MARCO_617325,4.8922567,": a phrase that uses the words like or as to describe someone or something by comparing it with someone or something else that is similar. — compare metaphor. [count]. “She's as fierce as a tiger” is a simile, but “She's a tiger when she's angry” is a metaphor."
786,msmarco,_doc,MARCO_4198798,4.891231,"How big do tiger salamanders get? Tiger salamanders are the largest land-dwelling salamanders. They can grow up to a foot long, though most are between 6-8 inches. How long do tiger salamanders live? Tiger salamanders can live up to 25 years, though most do not reach that age in the wild due to predation and other hazards. Where do tiger salamanders live? Tiger salamanders can be found throughout the state of Minnesota. They live in or near wetlands like marshes, lakes, and ponds. They spend most of their time burrowing under the leaf litter or underground looking for food. In human populated areas, tiger salamanders can sometimes be found in window-wells and waterlines."
787,msmarco,_doc,MARCO_1474371,4.890923,"Frilled sharks are so unusual that the 2 known species, the Frilled Shark and the Southern African Frilled Shark, are placed by some biologists in their own order (as we do, here). Historically, Frilled sharks have been considered a Family within the order of Hexanchiformes, or Cow sharks.ossil evidence dates frilled sharks to 95 million years ago. Some paleontologists suggest it is a living cladodont shark, a shark that existed as long ago as 380 million years."
788,msmarco,_doc,MARCO_4257473,4.890923,"The bull shark (Carcharhinus leucas), also known as the Zambezi shark or, unofficially, as Zambi in Africa and Nicaragua shark in Nicaragua, is a requiem shark commonly found worldwide in warm, shallow waters along coasts and in rivers.he bull shark is a special case in evolutionary history. Some of its closest living relatives do not have the capabilities of osmoregulation. The bull shark's genus, Carcharhinus, is shared by the sand bar shark that is not capable of osmoregulation."
789,msmarco,_doc,MARCO_4668278,4.889009,"The pup (which is what a baby shark is called) will live its life at the top of the ocean's food chain. But before it grows larger, the pup must avoid predators bigger than it is—including other great white sharks. Many baby sharks do not survive their first year. Young great white sharks eat fish (including other sharks) and rays. As it grows, the shark's favorite prey becomes sea mammals, especially sea lions and seals. Sharks count on the element of surprise as they hunt."
790,msmarco,_doc,MARCO_8019974,4.889009,"Answer 3: Typically a shark has two to three working rows of teeth with 20 to 30 teeth in each row, although a whale shark has about 300 teeth in each row. The replacement rate has not been measured in most sharks but normally the teeth seem to be replaced every two weeks. The lemon shark replaces its teeth every 810 days, and the great white shark replaces its teeth about every 100 days for young sharks and about every 230 days for old sharks. (From wikipedia)"
791,msmarco,_doc,MARCO_7455663,4.889009,"15. Shark teeth were recently discovered to contain fluoride. 16. Sharks do not suffer from cavities. 17. The inside of shark and human teeth contains a soft mineral known as dentin. 18. The coating of shark teeth is acid resistant and less water soluble than our teeth. 19. Shark teeth and human teeth are equally as hard. 20. Even though many sharks have sharp teeth that could inflict a wound to humans, sharks should always be treated with respect."
792,msmarco,_doc,MARCO_61473,4.8874645,"Myth: German tanks in general, and Tigers in particular, were impervious to Allied guns. Fact: Tigers were vulnerable to even Shermans armed with 75 mm guns. The longer 76 mm gun (superior in AP performance to the Soviet 85 mm gun, which could handle Tigers just fine) had no problem with Tigers or Panthers.act: The Tiger II was penetrated many times by various weapons in trials. Even the meek 85 mm gun on the T-34-85 was capable of dealing a fatal blow to it at 300 meters. The Wikipedia article for the Tiger II has a very nice photo of a Tiger II with a 17 pounder hole in the front."
793,msmarco,_doc,MARCO_1085404,4.887099,"Bull shark Facts. Bull shark is a type of shark that is best known by its aggressive behavior. This fish can be found in warm, shallow waters of all oceans of the world.Bull sharks can survive in brackish water (mixture of salty and fresh water), but they can be also found in the Amazon and Mississippi rivers and in various lakes.ull shark Facts. Bull shark is a type of shark that is best known by its aggressive behavior. This fish can be found in warm, shallow waters of all oceans of the world."
794,msmarco,_doc,MARCO_706240,4.8851924,"Bull sharks have been found up the Mississippi River as far north as Illinois, and one was found 2,500 miles up the Amazon. Lake Nicaragua is full of bull sharks, known locally as Nicaragua sharks. The Zambezi River in Africa is home to many bull sharks, which are called Zambezi sharks there. After Hurricane Katrina, large numbers of bull sharks were reportedly seen swimming in Lake Pontchartrain. Bull shark moms tend to give birth in coastal lagoons, river mouths, and other estuaries."
795,msmarco,_doc,MARCO_2839322,4.8851924,"Whale sharks are fascinating creatures. The whale shark is one of only three filter-feeding sharks (the other two are the basking and megamouth shark).It is suggested that whale sharks do not reach maturity until they are over 30 years of age and a size of 9 meters.They can live to be over 100 years old.ut there could be whale shark birthing ground on other locations, we just do not know much about the mating and reproductive behaviour of the species. The smallest regularly observed whale sharks are about 2,5 meters in length, and probably around one year old. There is no knowledge where they spend their first year."
796,msmarco,_doc,MARCO_4262807,4.8851924,"Order: Squaliform. Dogfish sharks are the second largest of shark orders with 119 species. Dogfish come in all shapes, sizes, and colors and they live in almost every ocean habitat and depth.This group of sharks are an exercise in extremes.Dogfish are represented by what is thought to be the smallest shark species (Dwarf lantern shark, which only grows to about 6 inches) and some of the largest (Greenland and Sleeper sharks).ogfish come in all shapes, sizes, and colors and they live in almost every ocean habitat and depth. This group of sharks are an exercise in extremes."
797,msmarco,_doc,MARCO_4580646,4.8851924,Tweet. The smallest shark in the world is the Dwarf Lanternshark; a dogfish that lives in the Caribbean Sea. They grow to a maximum of 17 centimeters and eat small fish and shrimp. The next smallest shark in the world is the Pygmy Shark that grows up to 25 centimeters long.These sharks are very closely related.hey grow to a maximum of 17 centimeters and eat small fish and shrimp. The next smallest shark in the world is the Pygmy Shark that grows up to 25 centimeters long. These sharks are very closely related.
798,msmarco,_doc,MARCO_6436296,4.8851924,"Dolphin teeth are more for catching fish than for tearing apart large prey, as sharks' teeth are. And sharks have very tough skins--hard to tear. But dolphins have a hard rostrum--beak--that's perfect for ramming. Sharks can and do kill and eat dolphins, which are highly nutritious for a shark. Dolphins aren't equipped to eat sharks, however, except for Orcas, which while called a whale, are really the largest species of dolphin. For other dolphins, then, they have no reason to kill a shark for food--just for defense--and dolphins have been known to swim off when a shark attacks one member of a pod."
799,msmarco,_doc,MARCO_6763416,4.8851924,"In general, sharks do not eat humans. Despite their scary reputation, sharks rarely ever attack humans and would much rather feed on fish and marine mammals. Only about a dozen of the more than 300 species of sharks have been involved in attacks on humans. Sharks evolved millions of years before humans existed and therefore humans are not part of their normal diets. Sharks are opportunistic feeders, but most sharks primarily feed on smaller fish and invertebrates. Some of the larger shark species prey on seals, sea lions, and other marine mammals."
800,msmarco,_doc,MARCO_617321,4.8844137,"Learner's definition of SIMILE. grammar. : a phrase that uses the words like or as to describe someone or something by comparing it with someone or something else that is similar. — compare metaphor. [count]. “She's as fierce as a tiger” is a simile, but “She's a tiger when she's angry” is a metaphor."
801,msmarco,_doc,MARCO_860800,4.8832893,"There is now a warning system when sharks are seen near the coast. We have a shark watch database we are developing on iNaturaist and have developed recommendations to avoid shark encounters. We can, and we must coexist with this important, and increasingly threatened ocean predators. 5) What is Sharktober? We launched Sharktober and Sharktoberfest celebrations in 2008 to celebrate the return of the white sharks to our Sanctuary offshore, and to educate and motivate the public to protect sharks. The first campaign was to drive support for the now successful California Shark Fin Ban introduced by Sea Stewards (now Shark Stewards)."
802,msmarco,_doc,MARCO_6269374,4.88139,"Page -2- S HARK ★ Read directions thoroughly before starting. ★ This Eyewitness kit is a fascinating, educational, and creative introduction to the world of sharks. Discover what all sharks have in common as well as the differences between the Great White, Thresher, and Hammerhead shark.Cast and paint their bodies for yourself as well as for your friends.Become a shark expert! This Eyewitness kit is a fascinating, educational, and creative introduction to the world of sharks. Discover what all sharks have in common as well as the differences between the Great White, Thresher, and Hammerhead shark. Cast and paint their bodies for yourself as well as for your friends. Become a shark expert!"
803,msmarco,_doc,MARCO_5798987,4.88139,"There are many different species of sharks that range in size from the size of a person's hand to bigger than a bus. The biggest shark is the Whale shark, which can be up to 46 feet (14 m) long. The smallest shark is the Spined Pygmy shark, which, when fully-grown, is only 7-8 inches (18-20 cm) long. Most sharks are intermediate in size, about the same size as people, 5-7 feet (1.5-2.1 m) long. Half of the 350 shark species are under 39 inches (1 m) long."
804,msmarco,_doc,MARCO_8185063,4.88139,"The bull shark, also known as the Zambezi shark in Africa, and Lake Nicaragua shark in Nicaragua, is a requiem shark commonly found worldwide in warm, shallow waters along coasts and in rivers. The bull shark is known for its aggressive nature, predilection for warm shallow water, and presence in brackish and freshwater systems including estuaries and rivers. Bull sharks can thrive in both salt and fresh water and can travel far up rivers. They have been known to travel up the Mississippi River as far as Alton, Illinois, although few freshwater human-shark interactions have been recorded."
805,msmarco,_doc,MARCO_1165471,4.879974,"Tiger Airways is out of action until at least August 1, but if you hold a Tiger ticket for a point after that date, you might well be thinking “I wish I could cancel that ticket and fly with someone a tad more reliable”. Thanks to some stern words to Tiger from the ACCC, that’s now possible for August flights.If you have a flight booked with Tiger in August, you can now cancel it and receive either a full refund or a credit note (our advice: go for the refund).The only condition is if Tiger is reauthorised to fly by CASA, you’ll have to ask for a refund within seven days of that date.hanks to some stern words to Tiger from the ACCC, that’s now possible for August flights. If you have a flight booked with Tiger in August, you can now cancel it and receive either a full refund or a credit note (our advice: go for the refund)."
806,msmarco,_doc,MARCO_1085402,4.879494,"The bull shark (Carcharhinus leucas), also known as the Zambezi shark or, unofficially, as Zambi in Africa and Nicaragua shark in Nicaragua, is a requiem shark commonly found worldwide in warm, shallow waters along coasts and in rivers.he size range of a litter for a female bull shark is around 1 to 13 pups. The average time span for a female bull shark to be pregnant is around 10 to 11 months. The male bull shark is able to begin reproducing around the age of 15 years while the female cannot begin reproducing until the age of 18 years."
807,msmarco,_doc,MARCO_8597883,4.879494,"The red tail shark will be compatible with such fish as gouramis, barbs, danios, rainbows, bala sharks, iridescent sharks, red finned cigar sharks, pictus catfish, swordtails, silver dollars, angels, most loaches and even some types of cichlids.hile the body of this fish is black, the tail of this shark is a striking, bright red. In some cases, the red tail shark's black dorsal and pectoral fins may even be tipped with white. Usually, these white tips will fade as the fish matures, as most of these white tipped red tail sharks are juveniles."
