,_index,_type,_id,_score,_source.body
0,msmarco,_doc,MARCO_673361,12.917553,"Tiger shark Facts. Tiger shark is one of the largest species of sharks on the planet. This animal can be found in the warm, tropical and subtropical waters all over the world. Largest population of tiger sharks lives in Melanesia, Micronesia and Polynesia.Tiger sharks normally spends majority of their time in the deep water.iger sharks are the second most dangerous species of sharks for humans. Unlike great white sharks (which are the most dangerous), tiger sharks will often eat victim after attack. Luckily, encounters between tiger sharks and humans are rare."
1,msmarco,_doc,MARCO_673365,12.730934,"Sometimes; all sharks are predators after all. Most shark species (about 80 percent) have never been known to attack humans. There are four shark species that have always been considered dangerous to humans: great white shark, tiger shark, bull shark and oceanic whitetip shark.17 other species of sharks have also attacked humans. They are considered less dangerous, but can be aggressive if threatened or disturbed.here are four shark species that have always been considered dangerous to humans: great white shark, tiger shark, bull shark and oceanic whitetip shark. 17 other species of sharks have also attacked humans."
2,msmarco,_doc,MARCO_673360,12.707099,"Tiger shark is known as voracious carnivore (meat-eater). Regular prey of tiger shark includes dolphins, fish, turtles, dugongs, sea birds, stingrays, sea snakes …. Tiger sharks are definitely not picky eaters.iger sharks are the second most dangerous species of sharks for humans. Unlike great white sharks (which are the most dangerous), tiger sharks will often eat victim after attack. Luckily, encounters between tiger sharks and humans are rare."
3,msmarco,_doc,MARCO_2442581,11.91622,"Notes Edit. 1  Tiger sharks are arguably the most dangerous enemy in Stranded Deep, due to their relentless aggression and speed of attack. 2  According to the save files, tiger sharks spawn with 200 health. 3  Crude axes are considered to be an effective weapon for hunting tiger sharks. A tiger shark can be killed with exactly 10 hits from an axe. 2  As of v0.03.H2, the spawn chance of a tiger shark has been adjusted from 100% down to 30%. 3  There is a bug currently located in the game: once a tiger shark latches onto the player, it will drag the player back to the island."
4,msmarco,_doc,MARCO_55145,11.525687,"The great white occupies the top slot on the list of ten most dangerous sharks, with the tiger shark coming in a distant second. The remaining seven species on the 10 most dangerous sharks list, in order of their recorded number of unprovoked lethal and non-lethal attacks over the centuries are: 4. The requiem shark (Carcharhinus spp.*) 5. The sand tiger shark (Carcharias tauruss) 6. The blacktip shark (Carcharhinus limbatus)"
5,msmarco,_doc,MARCO_1528877,11.144419,"Dangerous Sea Life. Biting and other aggressive animals. There are about 350 species of sharks, only 30 species could potentially be dangerous to humans and only 12 are reported potentially aggressive and dangerous. To put things in perspective 300 times more drowning are reported than fatal shark attacks. Among the most dangerous to humans are: Great white; Tiger shark; Bull shark; Oceanic White tip"
6,msmarco,_doc,MARCO_7523018,10.8765955,"The most dangerous sharks are the Great White shark, the Tiger shark, the Hammerhead shark, the Mako shark and the Bull shark. On average, there are only about 100 shark attacks each year and only 10 of those result in a human death. You should check it out from their perspective, though! People kill thousands of sharks in a year for sport and for food. Shark skins are used to make products like any other leather would be. Up until the 1950's, shark livers were used as a vitamin A supplement. Shark fin soup and shark steaks are both eaten in many countries (Mako, seen in the top photo, is the most popular in the United States)."
7,msmarco,_doc,MARCO_7934960,10.536636,"Sometimes; all sharks are predators after all. Most shark species (about 80 percent) have never been known to attack humans. There are four shark species that have always been considered dangerous to humans: great white shark, tiger shark, bull shark and oceanic whitetip shark. 17 other species of sharks have also attacked humans."
8,msmarco,_doc,MARCO_1860731,10.536366,"Some of the sharks that inhabit Alabama waters include dangerous and aggressive bull and tiger sharks to the abundant Atlantic sharpnose shark. I learned that tiger sharks will eat just about anything including birds, turtles and even garbage. They have highly developed teeth and can shred most anything."
9,msmarco,_doc,MARCO_7668314,10.295319,"Because of these characteristics, many experts consider bull sharks to be the most dangerous sharks in the world. Historically, they are joined by their more famous cousins, great whites and tiger sharks, as the three species most likely to attack humans. Bull sharks get their name from their short, blunt snout, as well as their pugnacious disposition and a tendency to head-butt their prey before attacking. They are medium-size sharks, with thick, stout bodies and long pectoral fins. They are gray on top and white below, and the fins have dark tips, particularly on young bull sharks. They are found cruising the shallow, warm waters of all the world’s oceans. Fast, agile predators, they will eat almost anything they see, including fish, dolphins, and even other sharks."
10,msmarco,_doc,MARCO_55137,10.251054,"If we go by the official list of dangerous sharks (e.g. from the International Shark Attack File ISAF, an institution which analyzes and collects reports on shark attacks) the white shark (Carcharodon carcharias) ranks first, followed by the tiger shark (Galeocerdo cuvier) and the bull shark (Carcharhinus leucas)."
11,msmarco,_doc,MARCO_3931763,10.216304,"Many scientists agree that since bull sharks often dwell in shallow waters, they may be more dangerous to humans than any other species of shark, and that they, tiger sharks and great white sharks are the three shark species most likely to attack humans.onfidence votes 28. The Bull Shark is found in tropical and subtropical seas around the world, and prefers warm waters. It also lives very close inshore, and often enters fresh water for long periods."
12,msmarco,_doc,MARCO_1528871,10.044309,"Among the most dangerous to humans are: Great white; Tiger shark; Bull shark; Oceanic White tip; Gray sharks (territorial?) Mako; Only a few species consider people as prey. They usually attack mistaking humans for marine animals on which they feed (mammals or sea turtles). Most of the other sharks attack are provoked (feeding, spearfishing, bleeding, etc.) Sharks don’t have many predators."
13,msmarco,_doc,MARCO_5406695,9.8673,"REAL FACTS ABOUT THE SHARK ATTACKS. Of the more than 350 known shark species, only 4 are particularly prone to attack people: the bull shark (which is considered by many experts to be the most dangerous to humans); the great white; the tiger shark; and the hammerhead."
14,msmarco,_doc,MARCO_2278395,9.861446,"Second only to the great white shark in number of recorded attacks on humans, the tiger is considered to be one of the sharks most dangerous to humans, along with the great white, bull shark and the oceanic whitetip shark. Imagine what it's like for a tiny insect to jump and fly as quickly as they do."
15,msmarco,_doc,MARCO_795761,9.80353,"The fish wind up in conservation limbo, since insufficient data is available. Such sharks include the thresher, Java, kitefin, salmon, broadnose sevengill, bigeye sand tiger, narrowmouth catshark, great hammerhead, Argentine angel shark and megamouth, which was only first discovered in 1976.re sharks dangerous or endangered? The answer is both. On the danger side, most sharks are apex predators. This means they exist at the top of the oceanic food chain and possess few, or no, natural enemies."
16,msmarco,_doc,MARCO_4754015,9.761757,"Eating Habits of Tiger Sharks. A tiger shark will eat any type of fish, shark, animal, and small entity it can find in the water. They are very curious by nature and will taste anything that comes their way. The stomachs of tiger sharks have been found with some very unique items inside of them.ating Habits of Tiger Sharks. A tiger shark will eat any type of fish, shark, animal, and small entity it can find in the water. They are very curious by nature and will taste anything that comes their way. The stomachs of tiger sharks have been found with some very unique items inside of them."
17,msmarco,_doc,MARCO_673363,9.584892,"Tiger sharks are some of the largest predators in the ocean and have few species feed on them. Some juvenile tiger sharks, however, fall prey to other sharks. Female tiger sharks gives birth in a nursery, which provides protection during the birthing process and to pups in the absence of parents.iger sharks are some of the largest predators in the ocean and have few species feed on them. Some juvenile tiger sharks, however, fall prey to other sharks. Female tiger sharks gives birth in a nursery, which provides protection during the birthing process and to pups in the absence of parents."
18,msmarco,_doc,MARCO_13258,9.569173,It is considered as the most dangerous for humans because it often attacks on humans. The name tiger is given to this shark because of strips on its body. It is found in all Oceans and especially in warm oceans. The average weight of this species of shark fish is 939 kilograms. The fifth largest or biggest or heaviest shark in the world.
19,msmarco,_doc,MARCO_4754012,9.510679,"There are about 40 species of sharks found in the Hawaiian waters ranging from 8 inches to over 50 feet long. The most common sharks seen around Hawaii are Blacktip Sharks, Reef Blacktip Sharks, Reef Whitetip Sharks, Tiger Sharks, Sandbar Sharks, Galapagos Sharks, Scalloped Hammerhead Sharks, and Gray Reef Sharks.here are about 40 species of sharks found in the Hawaiian waters ranging from 8 inches to over 50 feet long. The most common sharks seen around Hawaii are Blacktip Sharks, Reef Blacktip Sharks, Reef Whitetip Sharks, Tiger Sharks, Sandbar Sharks, Galapagos Sharks, Scalloped Hammerhead Sharks, and Gray Reef Sharks."
20,msmarco,_doc,MARCO_795755,9.469906,"Tiger sharks have also been known to eat other tiger sharks, but they're not the only ones -- a tiger shark's fins are a hot culinary commodity in Asian culture. Shark fins provide the spaghetti-like noodles in shark-fin soup. In Hong Kong, a tureen of shark-fin soup costs $100 [source: McRae ].ea snakes were found 60 percent of the time, and sea turtles were found in 27 percent of the sharks, although only in larger sharks [source: Heithaus ]. But what gets people's attention is the wackier things that have shown up in a tiger shark's stomach."
21,msmarco,_doc,MARCO_795757,9.452261,"However, not everyone is out to get the tiger sharks. Scientists say that predators such as the tiger shark keep the ocean's ecosystem in balance, and in Native Hawaiian belief, tiger sharks are aumakua, or sacred guardian spirits.If you'd like to learn more about tiger sharks, swim over to the links on the next page.ea snakes were found 60 percent of the time, and sea turtles were found in 27 percent of the sharks, although only in larger sharks [source: Heithaus ]. But what gets people's attention is the wackier things that have shown up in a tiger shark's stomach."
22,msmarco,_doc,MARCO_6248022,9.445985,the body of a tiger shark can be around 3 5 meters long which is about 9 8 16 4 feet long some can get even bigger than that for instance one tiger shark was found to be 55 meters long which is about 18 feet long as for weight a tiger shark will usually weigh around 385 635kg which is about 849 1400 poundshe body of a tiger shark can be around 3 5 meters long which is about 9 8 16 4 feet long some can get even bigger than that for instance one tiger shark was found to be 55 meters long which is about 18 feet long as for weight a tiger shark will usually weigh around 385 635kg which is about 849 1400 pounds
23,msmarco,_doc,MARCO_5388267,9.420362,"Sharks found in the Caribbean are the tiger shark, sand tiger shark, and the thresher shark!!ots of sharks can be found near Barbados. There have been alot of recorded attacks. I would suggest not venturing to far out at sea. here are a few types of sharks Great whit … e shark Bull shark Tiger shark Carrabean reef shark Smooth hammerhead sharks and many more."
24,msmarco,_doc,MARCO_1021453,9.396864,"Sand tiger shark. Not to be confused with sand shark, tiger shark, or nurse shark. The sand tiger shark (Carcharias taurus), grey nurse shark, spotted ragged-tooth shark, or blue-nurse sand tiger is a species of shark that inhabits subtropical and temperate waters worldwide."
25,msmarco,_doc,MARCO_4754014,9.303122,"Tiger Shark – Galeocerdo cuvier. Tiger sharks are very large and so they require a considerable amount of wide open space. They enjoy warm water so they are found in the tropic areas of the world as well as some sub tropic locations.ating Habits of Tiger Sharks. A tiger shark will eat any type of fish, shark, animal, and small entity it can find in the water. They are very curious by nature and will taste anything that comes their way. The stomachs of tiger sharks have been found with some very unique items inside of them."
26,msmarco,_doc,MARCO_673357,9.295504,"Tiger sharks are one of the largest carnivores in the ocean. Juveniles have tiger-like stripes, which fade as they grow older. Tiger sharks are blue or green in color with a light yellow or white under-belly.This speices has a large blunt nose on the end of a wedge-shaped head.iger sharks are some of the largest predators in the ocean and have few species feed on them. Some juvenile tiger sharks, however, fall prey to other sharks. Female tiger sharks gives birth in a nursery, which provides protection during the birthing process and to pups in the absence of parents."
27,msmarco,_doc,MARCO_2442577,9.287912,"The Tiger Shark is a type of shark encountered in Stranded Deep. They can be found living in shallow ocean biomes such as the Islands, Sand Plains and Shallows. Tiger sharks can be identified by their dull gray coloration, along with their distinctive stripes that run down the length of their body. A tiger shark can be killed with exactly 10 hits from an axe. 2  As of v0.03.H2, the spawn chance of a tiger shark has been adjusted from 100% down to 30%. 3  There is a bug currently located in the game: once a tiger shark latches onto the player, it will drag the player back to the island."
28,msmarco,_doc,MARCO_673356,9.282505,"CARNIVORES. Almost all sharks are carnivores or meat eaters. They live on a diet of fish and sea mammals (like dolphins and seals) and even such prey as turtles and seagulls.Sharks even eat other sharks.For example, a tiger shark might eat a bull shark, a bull shark might eat a blacktip shark and a blacktip shark might eat a dogfish shark! The teeth of the carnivores are sharp and pointy.hey live on a diet of fish and sea mammals (like dolphins and seals) and even such prey as turtles and seagulls. Sharks even eat other sharks. For example, a tiger shark might eat a bull shark, a bull shark might eat a blacktip shark and a blacktip shark might eat a dogfish shark!"
29,msmarco,_doc,MARCO_7224267,9.210133,"Confidence votes 17.0K. Bethany Hamilton lost her arm to a 14-feet-long tiger shark, which is the world's 2nd most dangerous shark."
30,msmarco,_doc,MARCO_7622400,9.210133,"Other potentially dangerous sharks along our coast are mostly of the genus Carcharhinus: bull sharks, bronze whalers, Galapagos and, in the tropics, the grey reef, silvertip and the tiger."
31,msmarco,_doc,MARCO_5420874,9.177827,"Only a few types of sharks are dangerous to humans. Out of more than 480 shark species, only three are responsible for two-digit numbers of fatal unprovoked attacks on humans: the great white, tiger and bull; however, the oceanic whitetip has probably killed many more castaways, not recorded in the statistics."
32,msmarco,_doc,MARCO_3931759,9.166413,"Tropical sharks include the huge filter-feeding whale shark, the great hammerhead shark, the nurse shark, the tiger shark, and the bull shark, which is found in both the ocean and in fresh water lakes in the tropics.Certain large species, such as the whale shark, range throughout the tropical region all over the world.ropical sharks include the huge filter-feeding whale shark, the great hammerhead shark, the nurse shark, the tiger shark, and the bull shark, which is found in both the ocean and in fresh water lakes in the tropics."
33,msmarco,_doc,MARCO_1021455,9.163258,"Researchers from WCS's New York Aquarium have discovered a nursery ground for the sand tiger shark in Great South Bay, an estuary on Long Island's south shore. The species is not considered dangerous to humans. When you think Long Island, perhaps haven for baby sharks isn't what comes to mind."
34,msmarco,_doc,MARCO_1021448,9.154549,"Researchers from WCS's New York Aquarium have discovered a nursery ground for the sand tiger shark in Great South Bay, an estuary on Long Island's south shore. The species is not considered dangerous to humans. (Julie Larsen Maher) When you think Long Island, perhaps haven for baby sharks isn't what comes to mind."
35,msmarco,_doc,MARCO_4724271,9.118664,The tiger shark will travel a long way for a bite to eat; one study found that the tiger shark swam about 30 miles to 40 miles (48 km to 64 km) a day looking for food [source: Tennesen ].It also doesn't appear that tiger sharks have a pattern of particular feeding places.he tiger shark will travel a long way for a bite to eat; one study found that the tiger shark swam about 30 miles to 40 miles (48 km to 64 km) a day looking for food [source: Tennesen ].
36,msmarco,_doc,MARCO_2442586,9.114858,"1 As of v0.03.H2, the spawn chance of a tiger shark has been adjusted from 100% down to 30%. 2  There is a bug currently located in the game: once a tiger shark latches onto the player, it will drag the player back to the island. A tiger shark can be killed with exactly 10 hits from an axe. 2  As of v0.03.H2, the spawn chance of a tiger shark has been adjusted from 100% down to 30%. 3  There is a bug currently located in the game: once a tiger shark latches onto the player, it will drag the player back to the island."
37,msmarco,_doc,MARCO_2861202,9.111059,"The body of a tiger shark can be around 3-5 meters long which is about 9.8-16.4 feet long. Some can get even bigger than that, for instance one tiger shark was found to be 55 meters long which is about 18 feet long.As for weight, a tiger shark will usually weigh around 385-635kg which is about 849-1400 pounds.he body of a tiger shark can be around 3-5 meters long which is about 9.8-16.4 feet long. Some can get even bigger than that, for instance one tiger shark was found to be 55 meters long which is about 18 feet long."
38,msmarco,_doc,MARCO_4754006,9.111059,"Distribution: Off the Atlantic coast of the United States tiger sharks are found from Cape Cod, Massachusetts, to the Gulf of Mexico and Caribbean Sea. Off the Pacific coast tiger sharks are found from southern California southward.In the western central Pacific, tiger sharks are found in the Hawaiian, Solomon, and Marshall Islands.istribution: Off the Atlantic coast of the United States tiger sharks are found from Cape Cod, Massachusetts, to the Gulf of Mexico and Caribbean Sea. Off the Pacific coast tiger sharks are found from southern California southward."
39,msmarco,_doc,MARCO_795758,9.099699,"Tiger Shark Prey and Predators. As we've mentioned, one of the most interesting things about tiger sharks is its diet. The tiger shark's diet changes as it ages.ea snakes were found 60 percent of the time, and sea turtles were found in 27 percent of the sharks, although only in larger sharks [source: Heithaus ]. But what gets people's attention is the wackier things that have shown up in a tiger shark's stomach."
40,msmarco,_doc,MARCO_3103879,9.075298,"They have several sets of replaceable teeth. Well-known species such as the great white shark, tiger shark, blue shark, mako shark, and the hammerhead shark are apex predators —organisms at the top of their underwater food chain. Many shark populations are threatened by human activities.hey have several sets of replaceable teeth. Well-known species such as the great white shark, tiger shark, blue shark, mako shark, and the hammerhead shark are apex predators —organisms at the top of their underwater food chain. Many shark populations are threatened by human activities."
41,msmarco,_doc,MARCO_673358,9.06724,"Geographic Range. Tiger sharks are found in many subtropical and tropical waters, primarily from 45°N to 32°S. Tiger sharks have been sighted from the eastern coast of North America to the eastern coast of Brazil. This includes the coasts of southern North America, Mexico, and Latin America along the Gulf of Mexico.iger sharks are some of the largest predators in the ocean and have few species feed on them. Some juvenile tiger sharks, however, fall prey to other sharks. Female tiger sharks gives birth in a nursery, which provides protection during the birthing process and to pups in the absence of parents."
42,msmarco,_doc,MARCO_1432531,8.932611,"The tiger markings that are typical of younger tiger sharks may be a way to blend in with the waves near the coast, so that larger predators don't find them. Baby tiger sharks better watch out -- larger tiger sharks have been known to eat them! Read on to find out all the other zany things that tiger sharks eat."
43,msmarco,_doc,MARCO_6248019,8.914014,the body of a great white shark is shaped like a torpedo which helps the shark in achieving such great speeds the body of a great white shark can be around 4 6 6 4 meters long which is about 15 1 21 feet long as for weight great white shark can weigh around 2260 3 300kg which is about 4982 7275 poundshe body of a tiger shark can be around 3 5 meters long which is about 9 8 16 4 feet long some can get even bigger than that for instance one tiger shark was found to be 55 meters long which is about 18 feet long as for weight a tiger shark will usually weigh around 385 635kg which is about 849 1400 pounds
44,msmarco,_doc,MARCO_2978922,8.908997,"The Siberian tigers also known as Panthera tigris are considered as the most dangerous and endangered tiger species of the world with their population of about 5,500 to 7,500 tigers left in the wild and in captivity.iberian tigers are very massive and powerful animals. The Siberian tiger can reach a length of 130 inches (286 centimeters) which makes it the largest of the different tiger variants. The Siberian tiger also has a very broad muzzle compared to other tiger variants, and male Siberian tigers usually have mane."
45,msmarco,_doc,MARCO_6248016,8.906537,a bull shark can swim at speeds of around 25mph which is about 40 2km h the body of a bull shark is around 2 1 3 5 meters long which is about 6 9 11 5 feet longas for weight a bull shark will weigh around 90 230kg which is about 198 507 poundsbull sharks have the ability to live in both fresh water and salt waterhe body of a tiger shark can be around 3 5 meters long which is about 9 8 16 4 feet long some can get even bigger than that for instance one tiger shark was found to be 55 meters long which is about 18 feet long as for weight a tiger shark will usually weigh around 385 635kg which is about 849 1400 pounds
46,msmarco,_doc,MARCO_1432530,8.905624,"Tiger Shark Habits and Habitat. The tiger shark loves warm waters and is found in most tropical and temperate regions. Other than a ready supply of food, tiger sharks don't have a lot of other requirements for their abode. Tiger sharks are found both on the surface and in depths of up to 1,150 feet (350 meters) [source: Knickle ] and they're found in lots of different waters, including river estuaries and harbors. Most often, though, this shark is found in murky waters in coastal areas."
47,msmarco,_doc,MARCO_4754011,8.898029,"The tiger shark (Galeocerdo cuvier) is a species of requiem shark and the only extant member of the genus Galeocerdo. Commonly known as the Sea Tiger, the tiger shark is a relatively large macropredator, capable of attaining a length over 5 m (16 ft).It is found in many tropical and temperate waters, and it is especially common around central Pacific islands.ommonly known as the Sea Tiger, the tiger shark is a relatively large macropredator, capable of attaining a length over 5 m (16 ft)."
48,msmarco,_doc,MARCO_6763412,8.89761,"Blue sharks eat a significant amount of squid, while tiger sharks are known to eat sea turtles. Smooth dogfish sharks eat crabs and lobsters, and hammerhead sharks prefer stingrays. Some sharks that are quick and large enough also hunt sea mammals. Great white sharks, tiger sharks and mako sharks have been known to eat sea lions, seals, dolphins, porpoises and sea birds. They also prey on large fish like mackerel and tuna. The largest shark, the whale shark, doesn't hunt for its food."
49,msmarco,_doc,MARCO_403545,8.886595,"Some experts believe that the lifespan of the Great white sharks is about 30 years but other studies show that they can live up to 40 years. The life expectancy of tiger sharks in the wild is thought to be 28 years in average while some reach up to 50 years.But Just like the other kind, tiger sharks in captivity do not have a longer life span as those in the wild. If they are lucky they can reach 17 to 21 years.he life expectancy of tiger sharks in the wild is thought to be 28 years in average while some reach up to 50 years. But Just like the other kind, tiger sharks in captivity do not have a longer life span as those in the wild."
