,_index,_type,_id,_score,_source.body
216,msmarco,_doc,MARCO_2174104,7.097945,"We bring you the list of some of the biggest sharks ever caught by man. Check out the full list of 8 specimens below. You also might like to check out some amazing shark jumps pictures. 08. Tiger Shark - 1,785 lbs (810 kg)"
217,msmarco,_doc,MARCO_802989,7.095989,The Sand Tiger Shark It is one of the aggressive shark species and their aggressiveness begins right in the uterus. Is give birth to young who develop from eggs within the female shark body. The females have two uteri and that carry many eggs.
218,msmarco,_doc,MARCO_4300103,7.095989,"GrindTV posted about the photo Wednesday, calling the shark-on-shark-on-fish action the Turducken of the sea.. According to ORB LAB, the sand tiger shark was released alive after researchers gave it a small ID tag."
219,msmarco,_doc,MARCO_2288087,7.094035,The name tiger is given to this shark because of strips on its body. It is found in all Oceans and especially in warm oceans. The average weight of this species of shark fish is 939 kilograms. The fifth largest or biggest or heaviest shark in the world.
220,msmarco,_doc,MARCO_4559715,7.094035,"The attack happened so quickly that none of the surfers around her ever saw the shark — believed to be a 14-foot-long tiger shark — or her struggle with it. We're just sitting there and all of a sudden Bethany goes, 'I got attacked by a shark,'  Blanchard recalled."
221,msmarco,_doc,MARCO_4181534,7.092083,"FACT: There is no such shark species with that accepted common name. Some of the species that are often called “sand sharks” by beachgoers include sandbar sharks (Carcharhinus plumbeus), sand tiger sharks (Carcharias taurus), and smooth dogfish (Mustelus canis)."
222,msmarco,_doc,MARCO_3442992,7.092083,"Biggest Sharks Ever Caught (8 photos) The list of some of the biggest sharks ever caught by man. Kevin James Clapson caught this huge 1,785 lb tiger shark off the coast of Ulladulla, Australia on March 28, 2004."
223,msmarco,_doc,MARCO_6474686,7.092083,"Tiger sharks (pictured) are among the 17 species that appear to lack color vision. Sharks may be able to smell blood from miles away, but they probably don't know how red it is: New research suggests sharks are color-blind."
224,msmarco,_doc,MARCO_4322402,7.0881844,"Where is the largest population of sharks in the world? What is the total number of population of the great white shark? The population of great white sharks is somewhere between 2,000 and  5,000. The world's population of tigers is down to 3,000, and the  population of snow leopards is betwee…n 4,000 and 6,500."
225,msmarco,_doc,MARCO_467661,7.0823507,"For those who fancy a more eco-friendly kind of shark film, try Beyond The Reef (1980), about a boy who raises a tiger shark as a pet (don’t try this at home) or Mako: The Jaws Of Death (1976): the story of a man with a telepathic connection to sharks and a vow to destroy anyone who tries to harm them."
226,msmarco,_doc,MARCO_2992550,7.0823507,"2. Mainly large sharks, but in Hawaii the Manta Rays have adapted to the habitat by staying within 3 miles of the shoreline thereby, to some extent, limiting their exposure to predators (like deep water sharks e.g. Tiger Sharks, Hammerheads). Their unmatched maneuverability and speed makes them hard to prey on."
227,msmarco,_doc,MARCO_5106578,7.0823507,"Progress to unlock the most ferocious beasts in the sea: Mako Shark, Hammerhead, Tiger Shark and the almighty Great White.. For the casual gamer, Hungry Shark Evolution couldn't be anymore straightforward-- hunt for food and munch on fish, crabs, turtles, and the occasional unsuspecting swimmer."
228,msmarco,_doc,MARCO_7449213,7.0823507,"Tiger sharks (pictured) are among the 17 species that appear to lack color vision. Sharks may be able to smell blood from miles away, but they probably don't know how red it is: New research suggests sharks are color-blind. The Curious Case of the Bumblebee, the Virus and the Tomato."
229,msmarco,_doc,MARCO_8819653,7.0823507,"Bigger sharks like great whites and tiger sharks eat dolphins. But the biggest dolphin of all, the killer whale can eat them. So it goes both ways, both sharks and dolphins are at the top of the food chain. Instead of one fearing the other think of them as rival gangs. http://mashable.com/2015/01/15/s..."
230,msmarco,_doc,MARCO_7455658,7.08041,"A shark’s tooth shape is dependent upon its diet. For instance, the shortfin mako razor like teeth tear flesh, the tiger shark has piercing teeth to cut flesh, and the zebra shark has dense flattened teeth because it feasts upon mollusks. 13. Whale sharks have 3,000 little teeth that are of little use."
231,msmarco,_doc,MARCO_2174109,7.078471,"We bring you the list of some of the biggest sharks ever caught by man. Check out the full list of 8 specimens below. You also might like to check out some amazing shark jumps pictures. 08. Kevin James Clapson caught this huge 1,785 lb tiger shark off the coast of Ulladulla, Australia on March 28, 2004."
232,msmarco,_doc,MARCO_3000009,7.078471,"Habitat and biology. The Grey Nurse Shark (Carcharias taurus) also known as the sand tiger shark or spotted ragged-tooth shark, is one of four species belonging to the family Odontaspididae. The species has a large, rather stout body and is coloured grey to grey-brown dorsally, with a paler off white under belly."
233,msmarco,_doc,MARCO_1151750,7.077775,"Description. Tigers are the biggest cats in the world, and Amur tigers are the biggest subspecies of tigers. Their coat is golden-orange with dark stripes and some patches of white on the belly, chest, throat, and muzzle. Compared with other species of tigers, Amur tigers have more white in their coat and fewer stripes.escription. Tigers are the biggest cats in the world, and Amur tigers are the biggest subspecies of tigers. Their coat is golden-orange with dark stripes and some patches of white on the belly, chest, throat, and muzzle. Compared with other species of tigers, Amur tigers have more white in their coat and fewer stripes."
234,msmarco,_doc,MARCO_2456352,7.0745983,"Larger sharks, including great whites, tiger sharks and whale sharks, travel more widely and have greater depth range in the water column. Great whites dive deeper than 1km and are seasonal visitors to temperate coastal waters, lured by the likelihood of a feed at seal and sea-lion rookeries and haul-out areas."
235,msmarco,_doc,MARCO_7413617,7.0703287,"There are many species of sharks in the ocean. Sharks are one of the better known predators in the sea. Many sharks have sharp teeth that are used to catch their food. The most dangerous shark is the great white shark, which can grow to over 20 feet long."
236,msmarco,_doc,MARCO_1884808,7.0688047,"In captivity, whale sharks are not comfortable, and in a few cases they have died within days, but at most, they have reached only eight years. Some scientists believe that the life expectancy of the Great White Sharks is around 30 years (Levine, 1988) but other research indicates that they can reach up to 40. The lifespan of Tiger Sharks in the wild is believed to be 27 years in average, although some may live up to 50 years of age."
237,msmarco,_doc,MARCO_5242543,7.0630264,"Lots of animals can breath underwater, sharks, flying fish, turtles, otters. If you want to know specific types, I know a few. Sea Otters River Otters Gold fish Trout … Hammer head shark Rainbow trout Orca White whale Blue whale tiger shark Sunnies Bass Snapper Turtle Paint Turtle Ect."
238,msmarco,_doc,MARCO_855271,7.059184,"The powerful rear teeth allow this species to crush shells with ease, digesting the soft innards and regurgitating the hard parts . In contrast to the common perception of most shark species as formidable, dynamic predators, the Galapagos bullhead shark is relatively docile, and a poor swimmer . Despite its protective dorsal fin spines, this species has been known to be consumed by the much larger, notoriously voracious tiger shark ."
239,msmarco,_doc,MARCO_752346,7.0553493,"Below are the levels of the cash pack cards: 1  Great White Shark Cash Card will cost an American player $20 and £13.49. 2  Bull Shark Cash Card will cost Americans $10 and £6.99 which amounts to $500k for online play. 3  The Tiger Shark Cash Card will run American gamers $5 and £3.49, resulting in $200k for online cash use."
240,msmarco,_doc,MARCO_7449212,7.0553493,"Tiger sharks (pictured) are among the 17 species that appear to lack color vision. Photograph by Brian J. Skerry, National Geographic. Sharks may be able to smell blood from miles away, but they probably don't know how red it is: New research suggests sharks are color-blind. 1  The Curious Case of the Bumblebee, the Virus and the Tomato.  Giant ‘Arrows’ Seen From Space Point to a Vanished World."
241,msmarco,_doc,MARCO_2322019,7.054734,"The blue shark is considered to be one of the most dangerous sharks in the waters. It has been known to attack people, which makes it one of species of shark that people most fear. Blue sharks can grow up to 12 feet long so this is no small shark to be trying to get away from. Due to the speed and the strength of it very few of its prey have a chance of survival."
242,msmarco,_doc,MARCO_688343,7.0527935,"Animal Species:Bull Shark, Carcharhinus leucas Valenciennes, 1839. The Bull Shark is one of the few sharks that are potentially dangerous to people and is probably responsible for most of the shark attacks in and around Sydney Harbour. The species is also the only widely distibuted shark that stays in fresh water for long periods of time to feed and breed."
243,msmarco,_doc,MARCO_4464022,7.0515213,"Actually the sea horse is the slowest animal in the world!!!! it travels .002 km/h. Animals that I think are slower: barnacle, coral, sea squirt, sponge, tube worm.hese large animals are eclipsed in size only slig … htly by the tiger. 4. Great White Shark This shark is an exceptionally large shark found in coastal waters in all major oceans. It can reach lengths of up to 6 metres and can weigh up to 5 tons."
244,msmarco,_doc,MARCO_55138,7.0508547,"The Most Dangerous Beaches for Shark Attacks in the U.S. Let's get this out of the way: shark attacks are extremely rare. The odds that you'll be attacked by a shark are precisely one in 11.5 million, according to the University of Florida's International Shark Attack File. Click Here to see the Complete List of Places You're Most Likely to be Attacked by a Shark in the U.S."
245,msmarco,_doc,MARCO_7477683,7.0508547,1 Many Everyday Activities Are More Dangerous Than Diving With Sharks. 2  Deadly Boating and Driving Accidents Are More Likely Than Deadly Shark Attacks. 3  Even Shark-Related Injuries Are Very Rare. 4  Further Reduce the Risk of a Shark Attack While Diving. 5  The Take-Home Message About Diving With Sharks.
246,msmarco,_doc,MARCO_4754010,7.047701,"World Range & Habitat. Tiger sharks are found worldwide in temperate and tropical seas. Western Atlantic: Massachusetts to Uruguay, Gulf of Mexico, Bahamas, Caribbean. Eastern Atlantic: Iceland and possibly the UK (due to the warm Gulf Stream), Morocco, Canary Islands, possibly the Mediterranean, Senegal to Ivory Coast.iger sharks, Galeocerdo cuvier (Peron péron And lesueur In, lesueur), 1822 are one of the largest sharks in the. world"
247,msmarco,_doc,MARCO_8396588,7.041188,"Are sharks really dangerous? After all, you're more likely to be killed by lightning or faulty wiring on your Christmas tree than by a shark [source: McCarthy]. Death by bee sting occurs far more often than death by shark [source: Burgess]. In the water, you're more apt to drown or be injured by your own surfboard than be hurt by a shark [source: Martin]. Researchers love to throw around statistics like these to redeem sharks."
248,msmarco,_doc,MARCO_2051017,7.035558,"Beauty and strength are what most people admire most about Tiger, the only Cat with a striped coat. The largest living Cat in the world, She possesses both grace and mystery. Because of her reputation as a dangerous foe, people have hunted Tiger to prove their bravery. During the day, Tiger rests in the shade. Sometimes, She likes to lie in a quiet pool of water to escape the heat. (Unlike most cats, Tiger likes swimming.) At dusk, She begins her hunt for food. Using her keen eyesight and hearing, Tiger looks for Deer or Wild Pigs."
249,msmarco,_doc,MARCO_8724513,7.0354104,"1 Jacques-Yves Cousteau says that it is: the only species of shark that is never frightened by the approach of a diver, and they are the most dangerous of all sharks..  Fastest The fastest swimming sharks are the mako sharks and blue sharks, which can even leap out of the water. They are also probably the fastest fish. Estimates of their speed varies; some say that they can swim at about 60 miles per hour (97 kph), while more conservative estimates are about 22 mph (35 kph)."
250,msmarco,_doc,MARCO_4754008,7.0324917,"Size relative to a 6-ft (2-m) man: Tiger sharks are named for the dark, vertical stripes found mainly on juveniles. As these sharks mature, the lines begin to fade and almost disappear. These large, blunt-nosed predators have a duly earned reputation as man-eaters.They are second only to great whites in attacking people.iger sharks are common in tropical and sub-tropical waters throughout the world. Large specimens can grow to as much as 20 to 25 feet (6 to 7.5 meters) in length and weigh more than 1,900 pounds (900 kilograms)."
251,msmarco,_doc,MARCO_752344,7.024931,"Below are the levels of the cash pack cards: 1  Great White Shark Cash Card will cost an American player $20 and £13.49. This will amount to $1.2 million for online cash. 2  Bull Shark Cash Card will cost Americans $10 and £6.99 which amounts to $500k for online play. The Tiger Shark Cash Card will run American gamers $5 and £3.49, resulting in $200k for online cash use. Finally, the minimal denomination is the $3/£1.99 cash pack which gives a player $100k for online cash use."
252,msmarco,_doc,MARCO_4783280,6.8514767,Tigers are infamously dangerous due to their exceptionally sharp intelligence and their acid-spewing claws. However most tiger-related injuries are due to people being being e … aten by the deadly micro-birds that live in the fur of the Tiger. Tigers are snuggly but the micro-birds will eat you.
253,msmarco,_doc,MARCO_1116778,6.8477383,"Sharks-Not Dangerous Unless You Feed Them. One of the most common sharks found on reefs is the Nurse Shark. These shy sharks behave a bit like ostriches -- they will poke their heads in the reef in attempt to hide from divers. They seem to think that if they can't see you, you can't see them!."
254,msmarco,_doc,MARCO_5808010,6.845784,The great hammerhead shark is the largest species of hammerhead shark and one of the few species of hammerhead shark that is potentially dangerous to humans. This is due to the sheer size of the giant hammerhead shark and also because the giant hammerhead is known to have an aggressive temperament.
255,msmarco,_doc,MARCO_1020739,6.843832,"Sharks are the most important predators of bottlenose dolphins along the west coast of Florida. But sharks and dolphins often tolerate one another. They may feed on the same school of fish! About one-third of the Sarasota adult dolphins bear shark-bite scars. So, sharks are dangerous to dolphins."
256,msmarco,_doc,MARCO_5231469,6.843832,"Why are Sharks Endangered. Always assumed to be dangerous man-eaters, not many really care whether sharks exist or near extinction. However, this myth about sharks ought to be dispelled, and the reality of their waning numbers has to be brought to light. Sharks are endangered and a lot of factors are contributing to this process."
257,msmarco,_doc,MARCO_802991,6.8418818,"Bull Shark Great Whites get most of the headlines but Bull Sharks may be the most dangerous shark of them all. It has been recorded in 69 unprovoked attacks on humans but researchers believe the numbers may be higher because of the lack of easily identifiable markings. And unlike most other sharks, it is also known to swim in freshwater."
258,msmarco,_doc,MARCO_6532292,6.836526,The Whale and Basking Shark feed themselves on plankton. no way that would be dangerous. The Whale and Basking Shark feed themselves on plankton. no way that would be dangerous.
259,msmarco,_doc,MARCO_55140,6.8360424,"The 10 Most Dangerous Sharks. This list won't include the biggest shark, the whale shark, which eats by filtering little pieces of plankton out of the water and is thus uninterested in humans. But this list does include the fastest shark, the shortfin mako, which has been clocked at 20 miles (32 kilometers) per hour [source: Allen]."
260,msmarco,_doc,MARCO_4165361,6.8360424,"Below is a list of the Sharks on offer in hungry shark, along with the price of each and some information about why you may want to opt for them: Price: Free. Max Depth: 90 meters. Max Size: 4 meters. Eats: Smaller or less dangerous prey. Tips: The reef shark is the starting shark and therefore is not as strong as the others in the game."
261,msmarco,_doc,MARCO_2704912,6.8306174,13 Contributions. There are many types of hammerhead sharks. (About 7-10 I think..) Usually the Great Hammerhead is the most dangerous type.   _______________________________________________…______________________   No hammerhead sharks are not very dangerous.
262,msmarco,_doc,MARCO_1650874,6.83022,"Mako shark. Mako shark (genus Isurus), any of two species of swift, active, potentially dangerous sharks of the mackerel shark family, Isuridae. The shortfin mako (Isurus oxyrinchus) is found in all tropical and temperate seas, and the longfin mako (I. paucus) is scattered worldwide in tropical seas."
263,msmarco,_doc,MARCO_8148081,6.828283,"Two of the most popular types of sharks in the world are the great white shark and the hammerhead. The great white is well known for being one of the largest and most dangerous sharks to ever exist. The shark in Jaws is also a great white, which brought a lot of notoriety to the great whites. Hammerheads are also popular based on their unique head shape which is shaped like a hammer."
264,msmarco,_doc,MARCO_4137507,6.826293,"Rating Newest Oldest. Best Answer: The polar bear would probably be the most dangerous of the bears, although the grizzly bear is also very dangerous. Kodiak and brown bears are subspecies of the grizzly. Large bears can muscle a tiger from a kill. Small bears may be eaten by tigers."
265,msmarco,_doc,MARCO_802984,6.822483,"CBS News Logo. Five Most Dangerous Sharks to Humans. White Shark The White Shark, more commonly referred to as the Great White, has been reported to be involved in more attacks on humans than any other shark. Fossil remains suggest the Great White dates back to the early Eocene eras, which lasted from about 56 to 34 million years ago."
266,msmarco,_doc,MARCO_8147753,6.822402,A Siberian Tiger is obviously the most dangerous big cat and probably the most dangerous animal as well. They have even been proven to kill brown bears in Russia and they could kill any other big cat. A siberian tiger can kill an african lion in one swipe of its paw. that makes it the strongest. V 81 Comments
267,msmarco,_doc,MARCO_4980387,6.810774,"Difference in Character in Child by Tiger and Most Dangerous Game In Thomas Wolfe’s “The Child by Tiger,” the character Dick Prosser is clearly more credible than General Zaroff in Richard Connell’s “The Most Dangerous Game.” This plausibility is due to each character’s lifestyle, murder motives, and personal morals."
268,msmarco,_doc,MARCO_7668854,6.8070984,"Added by evan&tracy on August 2, 2012 Saved under Experiences, South Pacific Tags: Bora Bora, sharks, snorkeling, snorkeling with sting rays, snorkeling wth sharks, sting rays, swimming, swimming with sharks, swimming with sting rays. When you are young, your parents tell you to avoid dangerous situations. Yet, here we were embarking on an excursion to SWIM with sharks and sting rays in the lagoon of Bora Bora!"
269,msmarco,_doc,MARCO_3593207,6.7820477,"To draw this dangerous shark, you need a white sheet of paper, a lead pencil, a gum eraser and some felt-tips and colored pencils to color in your drawing! Follow step by step our easy indications below !o draw this dangerous shark, you need a white sheet of paper, a lead pencil, a gum eraser and some felt-tips and colored pencils to color in your drawing! Follow step by step our easy indications below !"
270,msmarco,_doc,MARCO_2909892,6.7819967,"Baloo was an Indian Sloth Bear. These bears are dark brown in color, with a whitish snout and a white V marking on their chest. They eat insects. Sloth Bears are almost as dangerous as tigers, and many people in India have been attacked by these easily-angered animals.aloo was an Indian Sloth Bear. These bears are dark brown in color, with a whitish snout and a white V marking on their chest. They eat insects. Sloth Bears are almost as dangerous as tigers, and many people in India have been attacked by these easily-angered animals."
271,msmarco,_doc,MARCO_496459,6.7706003,"Twitter. Exotic animals — lions, tigers, wolves, bears, reptiles, non-human primates — belong in their natural habitat and not in the hands of private individuals as “pets.” By their very nature, these animals are wild and potentially dangerous and, as such, do not adjust well to a captive environment.witter. Exotic animals — lions, tigers, wolves, bears, reptiles, non-human primates — belong in their natural habitat and not in the hands of private individuals as “pets.” By their very nature, these animals are wild and potentially dangerous and, as such, do not adjust well to a captive environment."
272,msmarco,_doc,MARCO_5536321,6.7086067,This is my best game for phone. Now I have Tiger Shark and I want to get Megalodon FAST! But I need to unlock and experience Great White Shark. How can I earn ALOOOT of coins??? Please tell me! Thank you
273,msmarco,_doc,MARCO_2278400,6.706643,"The tiger shark, Galeocerdo cuvier is a species of requiem shark and the only member of the genus Galeocerdo. It is found in many tropical and temperate oceans, and is especially common around central Pacific islands."
274,msmarco,_doc,MARCO_5231475,6.706643,"Sharks are on the brink of extinction with studies reporting their numbers all over the world being lower than those of tigers. This news is anything but good, and unless we ourselves take some measures and find out why sharks are endangered and spread awareness, things could only get worse."
275,msmarco,_doc,MARCO_1930302,6.7046814,"You can already throw dead fish into the water in order to attract sharks. I once left a couple of dead sardines scattered around my island, and about an in-game day later, the waters were infested with tiger sharks, and even a Marlin."
276,msmarco,_doc,MARCO_6370927,6.7046814,"It was an 8-foot tiger shark, one of the most aggressive shark species in Hawaii's waters and the likely culprit for many of the 14 attacks in 2013, eight of which occurred around Maui, near Makena's beaches and elsewhere."
277,msmarco,_doc,MARCO_1211785,6.7007637,"They biologically adjust to which ever water they happen to be in at the time. Some sharks like the great white, tiger and, yes, the bull shark, fall under the category of fish that can survive in all water conditions. 5 people found this useful."
278,msmarco,_doc,MARCO_5321439,6.6988077,Tiger sharks live in tropical and subtropical oceans and sometimes in temperate waters. It is found sometimes in river estuaries and harbors.iger sharks live in tropical and subtropical oceans and sometimes in temperate waters. It is found sometimes in river estuaries and harbors.
279,msmarco,_doc,MARCO_4691235,6.6952667,"Tiger barbs are quite aggressive fish and are very notorious fin nippers! Fish like bottom dwellers or larger fish without longer fins are likely to be successful in the same aquarium as tiger barbs. Larger fish such as: Bala sharks, Parrot cichlids, etc."
280,msmarco,_doc,MARCO_5170141,6.6949015,"Another large shark, capable of growing to a length of over 16 feet, or 5 meters, the Tiger Shark can be found in the Caribbean and other warm waters around the world. They can have a blue to light green colour, combined with a white or light yellow belly."
281,msmarco,_doc,MARCO_6226373,6.6949015,"Tiger sharks are found both on the surface and in depths of up to 1,150 feet (350 meters) [source: Knickle ] and they're found in lots of different waters, including river estuaries and harbors. Most often, though, this shark is found in murky waters in coastal areas."
282,msmarco,_doc,MARCO_467658,6.692951,"Feeding Habits — The tiger shark is one lean, mean, eating machine. Each of its teeth is shaped like those found on a circular saw, with a flat and curved hook at the end. A power saw might not even equal this shark's power, since it can cut through turtle shells with a single bite."
283,msmarco,_doc,MARCO_4061820,6.692951,"Valuable commercial species with marketable flesh, hide, fins, and liver. Recognized by the International Game Fish Association as a big-game fish. Tiger sharks are second only to the Great White shark in the number of attacks on humans worldwide."
284,msmarco,_doc,MARCO_3642815,6.692951,"Old Dumbrella icon. The word Dumbrella is a combination of the words double and umbrella, purposefully spelling dumb to indicate the impractical nature of the item. Before it was made craftable with Shark Gills in the Eye of the Tiger Shark update, the Dumbrella was blue colored."
285,msmarco,_doc,MARCO_655409,6.6910024,"As with other species, tiger sharks in captivity do not live as extensive as in wildlife reaching only 17 to 20 years. Some experts presume that the lifespan of the Great White Sharks is approximately 30 years (Levine, 1988) but other research indicates that they can reach up to 40 years."
