,_index,_type,_id,_score,_source.body
531,msmarco,_doc,MARCO_5033996,5.3528557,"A specific type of soup is being sold in various restaurants in USA and UK for 100–150$ per bowl. It may look like a huge price for a bowl of soup but it’s nothing as compared with the price of the animals which are being killed for it. Business started in ’90s in HongKong, now exports the Shark Fins from 36 million Sharks, from which this soup is being made. The Sharks are captured in the Ocean,..."
532,msmarco,_doc,MARCO_3847701,5.3501143,"Bengal tigers are sometimes called Indian tigers and account for over half of all tigers remaining in the wild. Poaching for tiger parts is their major threat. The Bengal tiger is classified as endangered by the IUCN.Indochinese tigers (Panthera tigris corbetti) are located in Thailand, Cambodia, China, Lao PDR, Myanmar and Vietnam.engal tigers are sometimes called Indian tigers and account for over half of all tigers remaining in the wild. Poaching for tiger parts is their major threat. The Bengal tiger is classified as endangered by the IUCN."
533,msmarco,_doc,MARCO_4950630,5.3490057,"Size of a great white shark compared to a human. Photo credit: Any, CC BY-SA 3.0. Winner: The great white shark might have scarier teeth, but the killer whale is bigger and faster. Killer whales also have an advantage when hunting in big groups. Notable examples of sharks vs. killer whales: Blue Cliffs Beach, Tuatapere, New Zealand – Boxing Day 2011."
534,msmarco,_doc,MARCO_6049204,5.346312,There are many species of Tigers in the world. The ones that are currently alive in the wild are:Siberian TigerBengal TigerIndochinese TigerMalayan TigerSumatran TigerSouth Ch … ina Tiger The extinct species of Tiger are: a.Bali Tiger b.Javan Tiger c.Caspian Tiger.here are many species of Tigers in the world. The ones that are currently alive in the wild are:Siberian TigerBengal TigerIndochinese TigerMalayan TigerSumatran TigerSouth Ch … ina Tiger The extinct species of Tiger are: a. Bali Tiger b. Javan Tiger c. Caspian Tiger.
535,msmarco,_doc,MARCO_6566906,5.3451633,"The coast of South Africa is another shark haven where attacks are more frequent. There were four unprovoked attacks last year, which was on par with the nation’s 10-year average. The number of fatalities, however, was three, compared to an average of just one.et, the risk of a shark attack remains extremely low (about 1 in 11.5 million). There have been just 152 reported fatalities since records began in 1580. By comparison, there have been twice as many deaths from alligators in the U.S. than by sharks."
536,msmarco,_doc,MARCO_853789,5.3444166,"The Siberian tiger (also known as the Amur and the Ussuri tiger) is a large subspecies of tiger, found throughout western and central Asia. The Siberian tiger is the largest species of tiger in the world closely followed by the Bengal tiger, found on the Indian subcontinent.he Siberian tiger is considered to be the largest subspecies of tiger, although recent reports suggest that the Bengal tiger is on average, larger than the Siberian tiger. The Siberian tiger has thick fur to keep it warm during the bitter Siberian winter, that can grow to 4 inches long on its neck and tummy."
537,msmarco,_doc,MARCO_4181538,5.342205,"These young sharks may take several months to hatch. In certain species of sharks, the eggs stay inside the female shark for a period of time before they are laid, this allows the sharks to develop fully and spend less time in the immobile egg cases before they hatch. Types Of Sharks That Lay Eggs. Just a few species of sharks that lay eggs include: Bamboo sharks or carpet sharks. Swell sharks. Cat sharks. Horn (bullhead) sharks."
538,msmarco,_doc,MARCO_1764400,5.340636,"There is another subspecies, the South china tiger which is believed to be extinct with no recent reports of sighting. Bengal Tiger. Here are the differences between a sumatran tiger and a bengal tiger, The Sumatran tiger (Panthera tigris sumatrae) lives in the Indonesian island of Sumatra.It is estimated to have a population of less than 500. The Bengal tiger ((Panthera tigris tigris) lives in India, China, Nepal, Bhutan, Bangladesh and Myanmar with 1706 tigers found in India.umatran Tiger. In appearance, Sumatran tigers are darker with a tan colored coat and their stripes are much closer together than other species including the Bengal tigers. The Sumatran tiger is the last of the “island tiger” subspecies."
539,msmarco,_doc,MARCO_4630844,5.340636,"Siberian tigers live in eastern Russia, Indochinese tigers and Malayan tigers live in southeastern Asia, Bengal tigers live in India, the South China tiger (from southern China), and Sumatran tigers which live on the Indonesian island of Sumatra, southeast of mainland Asia.here are also Bengal tigers, which live in India, the South China tigers, Indochinese and Malayan tigers, which live in southeast Asia, and Sumatran tigers, which live in Sumatra (an island in Indonesia, southeast of the Asian mainland). tigers live in jungles in Asian countries such as India, Russia and china."
540,msmarco,_doc,MARCO_6063984,5.340636,"Siberian Tiger Basic Information. There are a few other names for Siberian Tigers. Their latin name is Panthera Tigris Altaica. There are 3 other non-Latin names, too. The Amur Tiger, Northeast China Tiger, and Manchurian Tiger.The Siberian Tiger looks slightly different from the other tiger sub-spieces.It has a coat that lightens during the winter to help blend in with the snow.here are 3 other non-Latin names, too. The Amur Tiger, Northeast China Tiger, and Manchurian Tiger. The Siberian Tiger looks slightly different from the other tiger sub-spieces. It has a coat that lightens during the winter to help blend in with the snow."
541,msmarco,_doc,MARCO_5035045,5.3345566,How to Draw a Goblin-shark. Start the drawing the Goblin-shark! Step 1. The drawing the Goblin-shark! Step 2.The drawing the Goblin-shark! Step 3.The drawing the Goblin-shark! Step 4. The drawing the Goblin-shark!ow to Draw a Goblin-shark. Start the drawing the Goblin-shark! Step 1. The drawing the Goblin-shark! Step 2. The drawing the Goblin-shark! Step 3. The drawing the Goblin-shark!
542,msmarco,_doc,MARCO_447317,5.3338423,"To aid those efforts, Bhak and his colleagues sequenced the genome of a 9-year-old Amur tiger living in the Everland Zoo in South Korea. The team also acquired DNA from around the world and compared the Amur tiger genome with that of the white Bengal tiger, the African lion, the white African lion and the snow leopard.hose changes, which evolved over tens of millions of years, likely enable the majestic felines to digest and rely solely on meat, Bhak said. Big cats also have several mutations that make for powerful, fast-acting muscles — a necessity when chasing down prey."
543,msmarco,_doc,MARCO_2998721,5.3307543,"Whale vs Shark. Whales are mammals and sharks are fish. When whales give birth to young ones, sharks lay eggs. Unlike the young sharks, young whales are fed milk. The whales raise their young ones whereas sharks do not.Whales have bones whereas the sharks have no bones but only cartilage.hale vs Shark. Whales are mammals and sharks are fish. When whales give birth to young ones, sharks lay eggs. Unlike the young sharks, young whales are fed milk. The whales raise their young ones whereas sharks do not."
544,msmarco,_doc,MARCO_3593202,5.3307543,How to Draw a Goblin-shark. Start the drawing the Goblin-shark! Step 1. The drawing the Goblin-shark! Step 2.The drawing the Goblin-shark! Step 3.The drawing the Goblin-shark! Step 4. The drawing the Goblin-shark!Step 5.tart the drawing the Goblin-shark! Step 1. The drawing the Goblin-shark! Step 2. The drawing the Goblin-shark! Step 3. The drawing the Goblin-shark! Step 4. The drawing the Goblin-shark! Step 5.
545,msmarco,_doc,MARCO_857412,5.3293786,"The Bengal tiger is considered to be the second largest species of tiger, although recent reports suggest that the Bengal tiger is on average, larger than the Siberian tiger. The Bengal tiger has a yellow or light orange coat, with black or dark brown stripes and a white belly.The white tiger is a Bengal tiger that has mutated genes, meaning that it is white in colour with black stripes.Black tigers are known to have black fur with lighter coloured stripes but are even rarer than the white tiger.he Bengal tiger has a yellow or light orange coat, with black or dark brown stripes and a white belly. The white tiger is a Bengal tiger that has mutated genes, meaning that it is white in colour with black stripes."
546,msmarco,_doc,MARCO_4630842,5.3219438,"There are also Bengal tigers, which live in India, the South China tigers, Indochinese and Malayan tigers, which live in southeast Asia, and Sumatran tigers, which live in Sumatra (an island in Indonesia, southeast of the Asian mainland).tigers live in jungles in Asian countries such as India, Russia and china.They live in throughout eastern Asia in Bangladesh, Bhutan, China, India, Nepal, Cambodia, Laos, Malaysia, Myanmar, Thailand and Vietnam, and Indonesia (Sumatra), a tigers habitat is the forest and the wild.here are also Bengal tigers, which live in India, the South China tigers, Indochinese and Malayan tigers, which live in southeast Asia, and Sumatran tigers, which live in Sumatra (an island in Indonesia, southeast of the Asian mainland). tigers live in jungles in Asian countries such as India, Russia and china."
547,msmarco,_doc,MARCO_1474370,5.3213115,"Hexanchiform sharks have a single dorsal fin, either six or seven gill slits (versus the 5 found in all other existing sharks), and no nictitating membranes (protective third eyelids) . The frilled shark, Chlamydoselachus anguineus, is currently one of only two known species of frilled sharks.The southern African frill shark, C. africana, was recently discovered (2009) off southern Angola, Namibia and South Africa.rilled sharks, Chlamydoselachus anguineus (Garman, 1884), aka frill sharks, frill-gilled sharks, Greenland sharks, scaffold sharks, and silk sharks are members of the most ancient frill and cow sharks order, Hexanchiformes."
548,msmarco,_doc,MARCO_736355,5.270612,"Types of Tigers. Overview of tiger subspecies.There are six subspecies of tigers, bengal tiger, siberian tiger, sumatran tiger, malayan tiger, indochinese tiger, south china tiger. The Bengal tiger is found in India as well as Bangladesh and it is known to live both in the heated areas of desert and the grasslands where it is wet and cool."
549,msmarco,_doc,MARCO_7124347,5.270612,"What types of tigers are there? There are six types of tigers called subspecies: Bengal Tiger - This tiger is found in India and Bangladesh. They are the most common type of tiger. Indochinese Tiger - Found in Indochina, these tigers are smaller than the Bengal Tiger and like to live in mountain forests. Malayan Tiger - This tiger is only found at the tip of the Malayan peninsula."
550,msmarco,_doc,MARCO_3595635,5.2629046,"Tiger Color Variations-Tiger Color Morphs. Here you see the three various Tiger Color Variations, or  TIGER Color Morphs . Everyone is familiar with the black striped orange Bengal Tiger and the incredibly beautiful White Tiger. Most have never heard of a third color variation, the GOLDEN TIGER. Golden Tigers are extremely rare, but like the White Tiger, it is just a color variation and not a separate species or sub-species of tiger."
551,msmarco,_doc,MARCO_5408836,5.2590733,"Subspecies: 1  Panthera tigris altaica (Siberian tiger, Amur tiger) 2  Panthera tigris amoyensis (South China tiger) 3  Panthera tigris balica (Bali tiger, Balinese tiger) 4  Panthera tigris corbetti (Corbett's tiger, Indochinese tiger, Indo-Chinese tiger) 5  Panthera tigris jacksoni (Malayan tiger) 6  Panthera tigris sondaica (Javan tiger)"
552,msmarco,_doc,MARCO_377973,5.257163,"The Bengal tiger (also known as the Royal Bengal tiger) is a subspecies of tiger, found across the Indian subcontinent.The Bengal tiger is the national animal of Bangladesh and is considered to be the second largest tiger in the world.he Bengal tiger is considered to be the second largest species of tiger, although recent reports suggest that the Bengal tiger is on average, larger than the Siberian tiger. The Bengal tiger has a yellow or light orange coat, with black or dark brown stripes and a white belly."
553,msmarco,_doc,MARCO_1764405,5.257163,"Both the tigers are same from genetic term as the Bengal tiger is called as Panthera tigris bengalensis and general tiger is also called as Panthera tigris. However, in general the tiger found in Bangladesh, India, Nepal, Bhutan, Myanmar and southern Tibet is called Bengal tiger.irgata) Javan tiger (P. t. sondaica) Basically, there is no difference between 'Bengal tiger' and 'tiger'. Bengal tiger is just a type of tiger. You would use this term rather than just 'tiger' if you wanted to be clear about which subspecies you were talking about, or where it came from."
554,msmarco,_doc,MARCO_1649964,5.2552567,"Distribution of the Tiger. Ever wonder where Tigers live! Well... Most Tigers live in Asia, specifically throughout Southeast Asia, China, Korea and Russia. Tigers like to live in swamps, grasslands,and rain forests.Usually where Tigers live there are trees, bushes, and clumps of tall grass.It shades the Tiger from the sun when it's extremely hot.istribution of the Tiger. Ever wonder where Tigers live! Well... Most Tigers live in Asia, specifically throughout Southeast Asia, China, Korea and Russia. Tigers like to live in swamps, grasslands,and rain forests."
555,msmarco,_doc,MARCO_5236131,5.2552567,"Where Tigers Live. Bengal tigers often live in the dense jungles of Asian countries like India and China, while Siberian tigers are found in Russia. White tigers are generally Bengal tigers born with a genetic defect that prevents the orange pigmentation for which tigers are typically known.he white tiger is not a breed of its own, but actually a type of Bengal tiger. While they are sometimes bred with Siberian tigers as a way of manipulating genetics to produce white tigers in captivity, this breed is extremely rare in the wild."
556,msmarco,_doc,MARCO_5106938,5.2552567,"The tiger is the largest feline in the world, with the tiger growing to around 2.5 metres in length. The tiger is the most powerful of all the big cats, and is native to east and southern Asia.The tiger is feared by most human beings who inhabit settlements within the tiger's territory.he tiger is the largest feline in the world, with the tiger growing to around 2.5 metres in length. The tiger is the most powerful of all the big cats, and is native to east and southern Asia. The tiger is feared by most human beings who inhabit settlements within the tiger's territory."
557,msmarco,_doc,MARCO_3747306,5.2533536,"Siberian tigers live in eastern Russia, Indochinese tigers and Malayan tigers live in southeastern Asia, Bengal tigers live in India, the South China tiger (from southern China), and Sumatran tigers which live on the Indonesian island of Sumatra, southeast of mainland Asia.here are also Bengal tigers, which live in India, the South China tigers, Indochinese and Malayan tigers, which live in southeast Asia, and Sumatran tigers, which live in Sumatra (an island in Indonesia, southeast of the Asian mainland)."
558,msmarco,_doc,MARCO_6149733,5.2533536,"1 For a minimal fee, the tigers will be raised in a facility that is well-equipped to feed and provide health care for the tigers. 2  Depending on the type of tiger, the cost for adoption ranges from $50 to $80 per year. One of the tiger owners that sells tiger cubs raises white tiger cubs that can cost $1,200 to $1,500. 2  Rather than offering tiger cubs for sale, Tiger Haven offers adoption. 3  For a minimal fee, the tigers will be raised in a facility that is well-equipped to feed and provide health care for the tigers."
559,msmarco,_doc,MARCO_2490875,5.2495584,Bengal tigers live in India and are sometimes called Indian tigers. They are the most common tiger and number about half of all wild tigers. Over many centuries they have become an important part of Indian tradition and lore. Tigers live alone and aggressively scent-mark large territories to keep their rivals away.engal tigers live in India and are sometimes called Indian tigers. They are the most common tiger and number about half of all wild tigers. Over many centuries they have become an important part of Indian tradition and lore. Tigers live alone and aggressively scent-mark large territories to keep their rivals away.
560,msmarco,_doc,MARCO_4181530,5.249275,"Types Of Sharks That Lay Eggs. Just a few species of sharks that lay eggs include: Bamboo sharks or carpet sharks; Swell sharks; Cat sharks; Horn (bullhead) sharks; Live Bearing Sharks. The other 60% of shark species give birth to live young, rather than lay eggs. This is known as viviparity. In these species of sharks, the young remain in the mother’s uterus until they are born."
561,msmarco,_doc,MARCO_3015551,5.2457776,"The Bengal tiger is considered to be the second largest species of tiger, although recent reports suggest that the Bengal tiger is on average, larger than the Siberian tiger. The Bengal tiger has a yellow or light orange coat, with black or dark brown stripes and a white belly.The white tiger is a Bengal tiger that has mutated genes, meaning that it is white in colour with black stripes.he Bengal tiger has a yellow or light orange coat, with black or dark brown stripes and a white belly. The white tiger is a Bengal tiger that has mutated genes, meaning that it is white in colour with black stripes."
562,msmarco,_doc,MARCO_4822220,5.2457776,"Black tigers are known to have black fur with lighter coloured stripes but are even rarer than the white tiger. The Bengal tiger is a dominant and carnivorous predator, hunting its prey by stalking it until the Bengal tiger has the opportunity to catch it off guard.Bengal tigers primarily hunt larger mammals including deer, wild boar, cattle and goats.he Bengal tiger is considered to be the second largest species of tiger, although recent reports suggest that the Bengal tiger is on average, larger than the Siberian tiger. The Bengal tiger has a yellow or light orange coat, with black or dark brown stripes and a white belly."
563,msmarco,_doc,MARCO_795760,5.245436,"1 There are many types of small sharks that are no doubt part of the diet of other predatory animals in the ocean. 2  Also sharks have been observed eating other sharks. 3  The Sharks predators are Dolphins, other sharks and people! 4  But people are the worst. There are many types of small sharks that are no doubt part of the diet of other predatory animals in the ocean. 2  Also sharks have been observed eating other sharks. 3  The Sharks predators are Dolphins, other sharks and people! 4  But people are the worst."
564,msmarco,_doc,MARCO_398228,5.243522,"Shark is definitely edible. You should know what kind of shark you have before deciding to cook it up and serve it to people. There are over 350 species of sharks and shark meat can be very salty (just depends on where the shark lives); however, many species are edible.Shark meat is delicious when properly prepared.ou should know what kind of shark you have before deciding to cook it up and serve it to people. There are over 350 species of sharks and shark meat can be very salty (just depends on where the shark lives); however, many species are edible. Shark meat is delicious when properly prepared."
565,msmarco,_doc,MARCO_1294576,5.242011,"All five remaining tiger subspecies are endangered, and many protection programs are in place. Bengal tigers live in India and are sometimes called Indian tigers. They are the most common tiger and number about half of all wild tigers.Over many centuries they have become an important part of Indian tradition and lore. Tigers live alone and aggressively scent-mark large territories to keep their rivals away.ll five remaining tiger subspecies are endangered, and many protection programs are in place. Bengal tigers live in India and are sometimes called Indian tigers. They are the most common tiger and number about half of all wild tigers. Over many centuries they have become an important part of Indian tradition and lore."
566,msmarco,_doc,MARCO_4130156,5.242011,"polar bear, artic fox, and white swan !!! Range and Habitat: The size of a tiger's territory depends on the amount of food available, and usually ranges from about 10 to 30 square miles (26-78 sq. km). Siberian tigers sometimes have really big territories (as large as 120 square miles). Although tigers usually live alone, tiger territories can overlap. A male tiger's territory usually overlaps those of several female tigers. Today only about 5,000–7,000 wild tigers live across Asia. The past and present ranges of the remaining five tiger subspecies are illustrated. The northernmost living tiger, the Amur or Siberian tiger, lives"
567,msmarco,_doc,MARCO_8104911,5.242011,"The diet of tigers like humans depends on the age and physical condition of the tiger. Tigers are strictly carnivorous and only eat high quality meat in large quantity. The di … et of captive tigers are based on what a tiger eats in the wild and this diet usually consists of deer, wild pigs, wild boar, antelope etc. Of course the diet of a wild tiger is determined by the area in which the tiger is occupying. Tigers show preferance for certain prey, usually specias that are equivalent to their own body weight. It depends on the sub species of tiger, the Siberian tiger's usual diet is wild boar, roe,sika, musk, and red deer.."
568,msmarco,_doc,MARCO_8597886,5.2397056,"Bala Shark And Angel Fish in the Bala Shark, Silver Shark forums, part of the Freshwater Sharks category. I am wanting to add 2 Angel fish with my 3 Bala Sharks in my 46 gallon tank. At the moment that is all I have in there. They are less then and inch.ala Shark And Angel Fish in the Bala Shark, Silver Shark forums, part of the Freshwater Sharks category. I am wanting to add 2 Angel fish with my 3 Bala Sharks in my 46 gallon tank. At the moment that is all I have in there. They are less then and inch."
569,msmarco,_doc,MARCO_4660023,5.230227,"Not to be confused with whitetip reef shark. The Oceanic whitetip shark (Carcharhinus longimanus), also known as Brown Milbert's sand bar shark, Brown shark, Nigano shark, Oceanic white-tipped whaler, and Silvertip shark, is a large pelagic requiem shark inhabiting tropical and warm temperate seas.he oceanic whitetip shark, or lesser white shark was described in 1831 by naturalist Rene-René Primevere, primevère lesson who named The shark. Carcharhinus maou it was next Described By Cuban felipe poey in 1861 as. squalus longimanus"
570,msmarco,_doc,MARCO_5804666,5.230227,"Answer: The fastest shark is a Mako Shark, the shark can reach a speed of 45 mph. The Great White Shark attack with a speed of about 30 mph. Answer: It is said that sharks can scent 1 single drop of blood in a 6 miles distance, but I have never heard about documented proofs telling so.nswer: The fastest shark is a Mako Shark, the shark can reach a speed of 45 mph. The Great White Shark attack with a speed of about 30 mph. Answer: It is said that sharks can scent 1 single drop of blood in a 6 miles distance, but I have never heard about documented proofs telling so."
571,msmarco,_doc,MARCO_4137924,5.2264605,"You seriously have no idea how many more sharks are killed by people than people are killed by sharks. By Colin Lecher posted Apr 19th, 2013 at 2:00pm Sharks have been mythologized in our culture as ruthless brutes and hunters, but the truth is humans are way, way more of a threat to sharks than sharks are to us. About 100 million sharks are killed annually, mostly related to finning (when the shark fins are sliced off and sold, often for soup). Marketer Joe Chernov wanted to visually express how the amount of shark attacks that kill people in a year stacks up against the number of people attacks that kill sharks. (It takes four seconds for us to kill the number of sharks that kill us in a year.)"
572,msmarco,_doc,MARCO_2249320,5.2264605,"Blacktip Reef Shark. Blacktip Reef shark are among the most popular Sharks inhabiting the tropical coral reefs of the Indian and Pacific Oceans, because Black Tip Reef Sharks prefer shallow, inshore waters.They are typical in appearance of how humans imagine a shark to look, and can be seen at our big ocean tank!lacktip Reef Shark. Blacktip Reef shark are among the most popular Sharks inhabiting the tropical coral reefs of the Indian and Pacific Oceans, because Black Tip Reef Sharks prefer shallow, inshore waters. They are typical in appearance of how humans imagine a shark to look, and can be seen at our big ocean tank!"
573,msmarco,_doc,MARCO_6527625,5.2264605,"The only known predator of the whale shark is humans.The mouth of the whale shark is massive, reaching a width of approximately 1 meter (over 3 feet). Only 3 shark species (the whale shark, the basking shark, and the megamouth shark) are filter feeders, straining their prey from the water column. The whale shark can reach a length of 40 feet or more and weighs 20 or more tons. The whale shark can have between 300-350 rows of teeth at one time. Females can have up to 300 shark pups at one time! Whale sharks can live up 100 years of age, but don’t become sexually mature until their early 30’s."
