,_index,_type,_id,_score,_source.body
218,msmarco,_doc,MARCO_4254425,4.426168,"A cartoon based on the short story Where are you going, where have you been? by Joyce Carol Oates. Parody, extremly funny,If you have read this story you will love this short film. Also makes fun of those stupid Downloading movies is a crime commercials. cartoon based on the short story Where are you going, where have you been? by Joyce Carol Oates. Parody, extremly funny,If you have read this story you will love this short film. Also makes fun of those stupid Downloading movies is a crime commercials."
219,msmarco,_doc,MARCO_5038566,4.4224777,Most filmed animal hunts are actually many hunts edited together to complete a story. Planet Earth strived to film the entirety of an impala hunt by African wild dogs in the Pole to Pole segment.ost filmed animal hunts are actually many hunts edited together to complete a story. Planet Earth strived to film the entirety of an impala hunt by African wild dogs in the Pole to Pole segment.
220,msmarco,_doc,MARCO_3691766,4.4223475,"1 Mimsy, a word introduced by Lewis Carroll in his poem Jabberwocky. 2  Mimsy Were the Borogoves, a science fiction short story whose title and plot reference the Carroll poem.3  The Last Mimzy, a 2007 feature film based on the above-mentioned short story. Mimsy Were the Borogoves, a science fiction short story whose title and plot reference the Carroll poem. 2  The Last Mimzy, a 2007 feature film based on the above-mentioned short story."
221,msmarco,_doc,MARCO_2687456,4.418643,"Pixar Animation Studios, or simply Pixar, is an American computer animation film studio based in Emeryville, California.oth Finding Nemo and Toy Story 3 are among the 50 highest-grossing films of all time, and all of Pixar's films are among the 50 highest-grossing animated films, with Toy Story 3 being the all-time highest, grossing over $1 billion worldwide. Translations for PIXAR. From our Multilingual Translation Dictionary."
222,msmarco,_doc,MARCO_6900547,4.418643,"Mongol is very much a based off a true story kind of movie. We certainly aren't seeing the true Genghis Khan. The film is riddled with historical inaccuracies, he is captured three times during the film, in reality he was only captured once.However, historical accuracy is not Bodrov's intent.ongol is very much a based off a true story kind of movie. We certainly aren't seeing the true Genghis Khan. The film is riddled with historical inaccuracies, he is captured three times during the film, in reality he was only captured once."
223,msmarco,_doc,MARCO_4507525,4.4147286,"Just because a Stephen King story has been adapted in one medium doesn’t make it off-limits for another, especially in the peak TV year of 2015. The Shining is the most obvious example of a successful film that was mounted on television, and now there’s a development effort to create The Mist as a TV series. But this doesn’t sound like a script re-adaptation of the novella. Rather, The Mist TV series may be something more inspired by the original story than directly based on it, and therefore a story (or set of stories) that can sit alongside Frank Darabont’s excellent film."
224,msmarco,_doc,MARCO_5970689,4.4147286,"The film is based on Salmoni's experience who was an Italian Holocaust survivor whose story inspired the film. Salmoni tells the story of fictional Jewish Italian Guido Orefice (Benigni), who uses his imagination to help his family during their internment in a Nazi concentration camp.his Site Might Help You. RE: Is the movie &quot;Life Is Beautiful&quot; based on a true story? We&#39;ve been watching this in our Grade 9 Language Arts class for a couple of days now and it had such an impact on everyone in the class. We were wondering if this was a true story or not."
225,msmarco,_doc,MARCO_5378420,4.4109945,"AIFF is proud to be hosting the US Premiere of “Sugar Mountain” as the Opening Night film for the 16th annual film festival. This film was the last of its kind produced in Alaska under the former film industry tax incentive program, and features extraordinary scenery of Alaska! Sugar Mountain tells the story of two brothers, down on their luck, who fake a disappearance in the Alaskan wilderness so they’ll have a great survival story to sell, but the hoax turns out to be more real than they planned."
226,msmarco,_doc,MARCO_7156999,4.4109945,"The Illusionist is a 2006 American romantic mystery film written and directed by Neil Burger and starring Edward Norton, Paul Giamatti, and Jessica Biel. It is based loosely on Steven Millhauser's short story, Eisenheim the Illusionist. The film tells the story of Eisenheim, a magician in turn-of-the-century Vienna, who reunites with his childhood love, a woman far above his social standing. The film also depicts a fictionalized version of the Mayerling incident. The film premiered at the 2006"
227,msmarco,_doc,MARCO_6039960,4.4109945,"Knock Knock is the first Eli Roth film that I have ever seen and its almost hard to explain it. This film is so over the top, the story isKnock Knock is the first Eli Roth film that I have ever seen and its almost hard to explain it.This film is so over the top, the story is crazy and so are the performances.It is almost into its so bad its good territory.y the end of Knock Knock with Keanu reeves i wanted to rip my face off and throw it at the girls on screen. If that was the intention of Director Eli Roth, he did a great job. However, I also want the last hour and a half of my life back."
228,msmarco,_doc,MARCO_4147905,4.4109297,"A Christmas Story House, now restored to its movie splendor, is open year round to the public for tours. Directly across the street from the house is the official A Christmas Story House Museum, which features original props, costumes and memorabilia from the film, as well as hundreds of rare behind-the-scenes photos. Christmas Story House, now restored to its movie splendor, is open year round to the public for tours. Directly across the street from the house is the official A Christmas Story House Museum, which features original props, costumes and memorabilia from the film, as well as hundreds of rare behind-the-scenes photos."
229,msmarco,_doc,MARCO_214259,4.4104376,"Scores: Your Score is the total number of Snaps you have sent and received. It appears next to your name in friends' contact lists and vice versa. Chat: Chat is a feature that lets you privately message with friends on Snapchat. Here: Here is a sub-feature within Chat.ending Stories. To send a story, which is basically a snap that exists for 24 hours and can be mass-sent to all your friends, tap the story button from the preview screen. It's right next to the download button. If you send a story, your friends will be able to view it an unlimited number of times in one day."
230,msmarco,_doc,MARCO_3766090,4.4104376,"George Washington’s beloved Mount Vernon began as a one and one-half story farmhouse built in 1735 by his father, Augustine, and received its well-known name during the ownership of his half-brother Lawrence.eorge Washington begins an expansion of Mount Vernon as part of his climb through Virginia society. He raises the one-and-a-half story 1735 house to a full two stories, building the elaborate walnut stair and adding ‘closets’-one story wings-on the north and south sides."
231,msmarco,_doc,MARCO_2823944,4.399577,"There is a vast territory between what we're trying to leave behind, and where we want to go-and we don't have any maps for that territory.. - Charles Eisenstein. Filmed in the fading light on the shores of Northern Scotland, this short film captures Charles Eisenstein in a moment of grief and reflection.The familiar story of the past is crumbling, while the new story has yet to arrive.here is a vast territory between what we're trying to leave behind, and where we want to go-and we don't have any maps for that territory.. - Charles Eisenstein. Filmed in the fading light on the shores of Northern Scotland, this short film captures Charles Eisenstein in a moment of grief and reflection."
232,msmarco,_doc,MARCO_2341993,4.398438,"One in a Million (1935 film), a film starring Dorothy Wilson. One in a Million (1936 film), a film starring Sonja Henie. One in a Million: The Ron LeFlore Story, a 1978 television film. One in a Million (1995 film), a Swedish film by Måns Herngren and Hannes Holm."
233,msmarco,_doc,MARCO_5198550,4.3957853,"The story continues... Taglines. The Karate Kid, Part II is a 1986 film about Mr. Kesuke Miyagi and when he returns to Okinawa with his karate student Daniel LaRusso, and meets an old foe's challenge to a duel to the death.It is the second film in the Karate Kid series.he story continues... Taglines. The Karate Kid, Part II is a 1986 film about Mr. Kesuke Miyagi and when he returns to Okinawa with his karate student Daniel LaRusso, and meets an old foe's challenge to a duel to the death. It is the second film in the Karate Kid series."
234,msmarco,_doc,MARCO_5026244,4.3957853,"Footloose (1984 film). Footloose is a 1984 American musical drama film directed by Herbert Ross. It tells the story of Ren McCormack (Kevin Bacon), an upbeat Chicago teen who moves to a small town in which, as a result of the efforts of a local minister (John Lithgow), dancing and rock music have been banned.n 1999, a musical version of Footloose premiered. Featuring many of the songs from the film, the show has been presented on London's West End, on Broadway, and elsewhere. The musical is generally faithful to the film version, with some slight differences in the story and characters."
235,msmarco,_doc,MARCO_6923521,4.3946013,"Continue reading the main story. Anita Sarkeesian, a feminist cultural critic, has for months received death and rape threats from opponents of her recent work challenging the stereotypes of women in video games. Bomb threats for her public talks are now routine.ontinue reading the main story. Anita Sarkeesian, a feminist cultural critic, has for months received death and rape threats from opponents of her recent work challenging the stereotypes of women in video games. Bomb threats for her public talks are now routine."
236,msmarco,_doc,MARCO_7476785,4.3908024,"4. Now don’t get all defensive-the horror stories you hear that happen to men on deployments are real. Of course we know that not ALL women are unfaithful, and not ALL men are saints who didn’t deserve the bad luck he received in a relationship.But come on.e probably has a negative opinion of women. Now don’t get all defensive-the horror stories you hear that happen to men on deployments are real. Of course we know that not ALL women are unfaithful, and not ALL men are saints who didn’t deserve the bad luck he received in a relationship. But come on."
237,msmarco,_doc,MARCO_3393656,4.3882236,"Film: The Birds. It could be the most terrifying motion picture I have ever made!. — Alfred Hitchcock, tagline. The Birds is a 1963 suspense/horror film directed by Alfred Hitchcock, based on the short story of the same name by Daphne du Maurier.The film's innovative special effects, soundtrack, and apocalyptic theme influenced later revenge of nature disaster films.ilm: The Birds. It could be the most terrifying motion picture I have ever made!. — Alfred Hitchcock, tagline. The Birds is a 1963 suspense/horror film directed by Alfred Hitchcock, based on the short story of the same name by Daphne du Maurier."
238,msmarco,_doc,MARCO_1682869,4.387011,"Exmore is a town in Northampton County on the Eastern Shore of the U.S. state of Virginia. The population was 1,136 at the 2000 census.A popular story is that Exmore received its name because it is the tenth railroad station south of the Delaware state line, so there were X more stations to go.The same website also states another theory behind the town's name—that it was named for Exmoor in Devon, southwest England.he population was 1,136 at the 2000 census. A popular story is that Exmore received its name because it is the tenth railroad station south of the Delaware state line, so there were X more stations to go."
239,msmarco,_doc,MARCO_998855,4.387011,"For one pizza delivery man in Oregon, a terrible tip turned into a heartwarming story. Andrew Schaffer recently received a tiny tip on a $22.67 order. But instead of getting upset, the Portland resident took the $0.33 pizza delivery tip and went on his way.or one pizza delivery man in Oregon, a terrible tip turned into a heartwarming story. Andrew Schaffer recently received a tiny tip on a $22.67 order. But instead of getting upset, the Portland resident took the $0.33 pizza delivery tip and went on his way."
240,msmarco,_doc,MARCO_8460192,4.387011,"In 2008, Harvard MBAs reported record salary and bonus averaging $144,261. Last year, a full five years later, the pay was nearly $6,000 less. It’s a similar story for Stanford MBAs. The Class of 2008 received average salary and bonus of $140,771, also a record, but more than $3,000 less in 2013.ast year, a full five years later, the pay was nearly $6,000 less. It’s a similar story for Stanford MBAs. The Class of 2008 received average salary and bonus of $140,771, also a record, but more than $3,000 less in 2013."
241,msmarco,_doc,MARCO_3502716,4.384539,"Buzz Lightyear is a fictional character in the Toy Story franchise. He is a toy space ranger hero according to the movies and action figure in the Toy Story franchise. Along with Woody, he is one of the two lead characters in all three Toy Story movies.He also appeared in the movie Buzz Lightyear of Star Command: The Adventure Begins and the television series spin-off Buzz Lightyear of Star Command, as well as the two film sequels.long with Woody, he is one of the two lead characters in all three Toy Story movies. He also appeared in the movie Buzz Lightyear of Star Command: The Adventure Begins and the television series spin-off Buzz Lightyear of Star Command, as well as the two film sequels."
242,msmarco,_doc,MARCO_2240712,4.380691,"Charlotte's Web was adapted into an animated feature by Hanna-Barbera Productions and Sagittarius Productions in 1973. Paramount released a direct-to-video sequel, Charlotte's Web 2: Wilbur's Great Adventure, in the U.S. in 2003 (Universal released the film internationally).A live-action film version of E. B. White's original story was released in 2006.aramount released a direct-to-video sequel, Charlotte's Web 2: Wilbur's Great Adventure, in the U.S. in 2003 (Universal released the film internationally). A live-action film version of E. B. White's original story was released in 2006."
243,msmarco,_doc,MARCO_5449130,4.373186,"The Sixth Sense is a 1999 American supernatural thriller film written and directed by M. Night Shyamalan. The film tells the story of Cole Sear (Haley Joel Osment), a troubled, isolated boy who is able to see and talk to the dead, and an equally troubled child psychologist (Bruce Willis) who tries to help him.he Sixth Sense is a 1999 American supernatural thriller film written and directed by M. Night Shyamalan. The film tells the story of Cole Sear (Haley Joel Osment), a troubled, isolated boy who is able to see and talk to the dead, and an equally troubled child psychologist (Bruce Willis) who tries to help him."
244,msmarco,_doc,MARCO_1054774,4.358261,"A Christmas Story is a 1983 American Christmas comedy film directed by Bob Clark and based on Jean Shepherd's semi-fictional anecdotes in his 1966 book In God We Trust: All Others Pay Cash, with some elements from his 1971 book Wanda Hickey's Night of Golden Memories. It stars Melinda Dillon, Darren McGavin, and Peter Billingsley. A seasonal classic in North America, it is shown numerous times on television, usually on the networks owned by the Turner Broadcasting System. Since 1997, a marathon of the film titled 24 Hours of A Christmas Story has aired annually on TNT and/or TBS, comprising twelve consecutive airings of the film on both Christmas Eve and Christmas Day each year. The film earned director Clark two Genie Awards."
245,msmarco,_doc,MARCO_1201185,4.3556557,"The Sun (2010) It was very much part of their love story, which is arguably the central love story of the whole show. Times, Sunday Times (2015) Brokeback Mountain is a tragic love story about two men whose love is destroyed by a society that refuses to recognise difference. Times, Sunday Times (2006) I thought the love story part worked, though. The Sun (2008) She said: 'The film is a love story. The Sun (2012) If the play is part ghost hunt, part historical drama, it is also part love story. Times, Sunday Times (2011) Last night a source close to the couple said: 'This is a tragic love story about two young people who met five years too early. The Sun (2007)"
246,msmarco,_doc,MARCO_6539402,4.3429585,from studies of sex sexual perversions to what it is to be a sperm it showed allen to be a film maker who was overflowing with ideas the title is taken from a book by david reubens but the film has almost nothing to do with the book everything you always wanted to know about sex news stories show allinterview woody allen film by film author jason solomons 5 films and a tv show to watch after take the money and runhe sequence was shot and photos exist but it has never been released another scene was written an old testament spoof about a famous masturbating man was scripted but never filmed the first allen film to use the woody allen font in the title card sequence
247,msmarco,_doc,MARCO_6145624,4.3057356,"The financiers of The Human Centipede did not discover the full nature of the film until it was complete. The film received generally mixed reviews from mainstream film critics, but it won several accolades at international film festivals."
248,msmarco,_doc,MARCO_5951650,4.3055744,"Invasion of the Body Snatchers is a 1956 American black-and-white science fiction film shot and told in Film Noir style, produced by Walter Wanger, directed by Don Siegel, and starring Kevin McCarthy and Dana Wynter.The film was released through Allied Artists Picture Corporation.Daniel Mainwaring adapted the screenplay from Jack Finney 's science fiction novel The Body Snatchers (1954). The story depicts an extraterrestrial invasion that begins in the fictional California town of Santa Mira.nvasion of the Body Snatchers was acknowledged as the ninth best film in the science fiction genre. The film was also placed on AFI's AFI's 100 Years ... 100 Thrills, a list of America's most heart-pounding films. The film was included on Bravo 's 100 Scariest Movie Moments."
249,msmarco,_doc,MARCO_4404151,4.3018255,Up (2009) was also the first computer (or CG)-animated film to be Best Picture-nominated and the first animated film to receive a Best Picture nomination since animated films received their own category in 2001. Winning films in this category are often huge blockbusters.
250,msmarco,_doc,MARCO_4795290,4.301148,"The Grinch, as portrayed by Jim Carrey in Dr. Seuss' How the Grinch Stole Christmas. (2000). While the film itself received mixed reviews, Jim Carrey's portrayal of the Grinch received a generally positive response from film critics."
251,msmarco,_doc,MARCO_3999516,4.2972455,"The final film in the series, The Return of the King, won all of its 11 Academy Awards nominations, tying it with Ben-Hur and Titanic for most Academy Awards received for a film. The series received wide praise for its innovative special and visual effects."
252,msmarco,_doc,MARCO_4493041,4.295297,"“La La Land” scored 14 Oscar nominations, tying the record for most received by a single film. Caption “La La Land” scored 14 Oscar nominations, tying the record for most received by a single film."
253,msmarco,_doc,MARCO_282193,4.2914057,"Coppola stated that The Godfather series is two films and that The Godfather Part III is an epilogue. It received mixed reviews compared with the critical acclaim that the first two films received. It grossed $136,766,062 and was nominated for seven Academy Awards including the Academy Award for Best Picture"
254,msmarco,_doc,MARCO_4797492,4.290814,"Mowgli has been played by many male actors. In the 1942 film adaptation, Mowgli was played Sabu Dastagir. In the 1994 film adaptation he was played by Sean Naegeli as a kid and later throughout the film he was played by Jason Scott Lee. In The Second Jungle Book: Mowgli and Baloo he was played by Jamie Williams.In The Jungle Book: Mowgli's Story he was played by Brandon Baker. Mowgli will be played by Neel Sethi in the new Disney Live action reboot of The Jungle Book (2016 film) which will be released in 3D on April 15, 2016.owgli has been played by many male actors. In the 1942 film adaptation, Mowgli was played Sabu Dastagir. In the 1994 film adaptation he was played by Sean Naegeli as a kid and later throughout the film he was played by Jason Scott Lee. In The Second Jungle Book: Mowgli and Baloo he was played by Jamie Williams."
255,msmarco,_doc,MARCO_6522757,4.289463,"In 1989, Barkin received positive reviews for her roles in films Johnny Handsome and Sea of Love. In 1991, for her leading role in comedy film Switch, Barkin received Golden Globe Award nomination for Best Actress – Motion Picture Comedy or Musical."
256,msmarco,_doc,MARCO_5054448,4.2882,"This film is not a remake of the 1971 film of the same name, but rather a sequel, therefore making it a fourth installment. Jackson's John Shaft character is the nephew of the earlier films' Shaft. The film received generally positive reviews and opened at the number-one position at the box office when it debuted June 16, 2000."
257,msmarco,_doc,MARCO_3173707,4.2875223,"Forrest Gump has received 29 awards from a total of 60 nominations. To name a few, the film has won six Academy Awards, including Best Picture, and three Golden Globes, including Best Motion Picture Drama. You can check all the awards of the film below: List of accolades received by Forrest Gump."
258,msmarco,_doc,MARCO_3369163,4.286261,"On May 11, 2015, A24 Films acquired distribution rights to the film. Remember was screened in the main competition section of the 72nd Venice International Film Festival on September 10, 2015, where it received a 10-minute standing ovation, and also screened at the 2015 Toronto International Film Festival."
259,msmarco,_doc,MARCO_8182059,4.286261,"(film) Black Hawk Down won two Academy Awards for Best Film Editing and Best Sound Mixing at the 74th Academy Awards. Although it was received positively by critics, the film was strongly criticized by a number of groups and military officials. In 2009, an extended cut of the film was released on DVD."
260,msmarco,_doc,MARCO_2801839,4.2855835,Eli Roth's remake of 1970s vigilante thriller Death Wish has received a red band trailer in the style of retro grindhouse films. Eli Roth's remake of 1970s vigilante thriller Death Wish has received a red band trailer in the style of retro grindhouse films.
261,msmarco,_doc,MARCO_3369162,4.2855835,"The film, about an elderly Holocaust survivor with dementia who sets out to kill a Nazi war criminal, received mostly positive reviews and won a few film festival awards. At the 4th Canadian Screen Awards, August received the Award for Best Original Screenplay and Remember was also nominated for Best Motion Picture."
262,msmarco,_doc,MARCO_3173708,4.2855835,"Forrest Gump received numerous other awards such as one win from the Screen Actors Guild Awards in its first year for Tom Hanks in a total of four nominations. The film received three nominations from the MTV Movie Awards, but left empty handed. The film swept the Peoples Choice Awards in its three nominations."
263,msmarco,_doc,MARCO_3154708,4.2836466,"Late in 1997, film producer David Heyman's London offices received a copy of the first book in what would become Rowling's series of seven Harry Potter novels.ate in 1997, film producer David Heyman's London offices received a copy of the first book in what would become Rowling's series of seven Harry Potter novels."
264,msmarco,_doc,MARCO_3920200,4.2823887,"if it has NR(Not Rated)-it means the film hasn't been submitted for a rating. NR is not an official MPAA classification. The film's that have not yet received MPAA classification, but are expected to, are often advertised with the notice This Film Is Not Yet Rated or Rating Pending. http://www.answers.com/topic/mpaa-film-rating-system. October · 1 decade ago."
265,msmarco,_doc,MARCO_6604396,4.2823887,"For one of her film appearances in this decade, in Long Day's Journey Into Night (1962), she received her ninth Oscar nomination. After a five-year absence from films, she then made Guess Who's Coming to Dinner (1967), her last film with Tracy and the last film Tracy ever made; he died just weeks after finishing it. It garnered Hepburn her tenth Oscar nomination and her second win."
266,msmarco,_doc,MARCO_7097824,4.2823887,"Cady McClain Net Worth, Biography & Wiki 2017. Cady was recently received an honorable mention as Best Director by the LA Film Review for her work directing her second short film, The World of Albert Fuh, which also played at the SOHO International Film Festival, and the LA Indie Film Festival."
267,msmarco,_doc,MARCO_7160994,4.279778,"The film's production partners, New Regency and Dune Entertainment, offset financing for the film by paying Tom Cruise a lower advance fee than he normally received. According to the Los Angeles Times, Cruise received eleven million dollars for Knight and Day (2010), not the twenty-plus million dollars he usually receives. See more »."
268,msmarco,_doc,MARCO_1936329,4.278524,"List of films [edit]. This list of films is sorted by the number of Big Five Academy Awards received by each film. Award winners are listed in bold with green background; others listed are nominees who did not win. This list is current as of the 87th Academy Awards ceremony held on February 22, 2015, honoring films of 2014."
