,_index,_type,_id,_score,_source.body
477,msmarco,_doc,MARCO_4959846,3.9837813,"During 1989–1991, Cher refused many roles, like The War of the Roses, Thelma & Louise and The Addams Family for starred in the Richard Benjamin's Mermaids with Bob Hoskins, Winona Ryder, and a then 9-year-old Christina Ricci. The film was a modest success with only $35 million in USA. Cher made cameo appearances in the Robert Altman films The Player (1992) and Prêt-à-Porter (1994). She starred in the poorly received film Faithful (1996) with Ryan O'Neal and Chazz Palminteri, in the role of the betrayed wife."
478,msmarco,_doc,MARCO_7928113,3.9837813,"This article is about the Amanda Bynes film. It is not to be confused with What Women Want. What a Girl Wants is a 2003 American teen comedy film directed by Dennie Gordon and written by Jenny Bicks and Elizabeth Chandler, based on the 1955 play The Reluctant Debutante by William Douglas-Home, the second adaptation for the screen of this work. It stars Amanda Bynes, Colin Firth, Kelly Preston, and Oliver James. The film was released on April 4, 2003, received mixed reviews and grossed $50 million worldwide."
479,msmarco,_doc,MARCO_7493636,3.9837813,"Wesley Wes Studi, born in Tahlequah Oklahoma (70 years old) (born December 17 1947) is an award-winning full-blood Native American actor and film producer from Cherokee Nation Oklahoma near Tahlequah who has won critical acclaim for his portrayal of Native Americans in film.He has appeared in well-received Academy Award-winning films such as Kevin Costner's Dances with Wolves Michael Mann's The Last of the Mohicans (1992) and the Academy Award-nominated films Geronimo: An American Legend ..."
480,msmarco,_doc,MARCO_1269104,3.97999,"Abbasi studied in the United States and returned to Pakistan to pursue his career. He started his career in 2006 as a theatre actor and appeared in several plays such as Bombay Dreams, Phantom of the Opera and Home is Where Your Clothes Are.hile in filmography he made his debut in a short film Glorious Resolve (2010), a direction of Bilal Lashari. In 2013, he appeared in feature films of Pakistani Cinema, Main Hoon Shahid Afridi and Waar for which he received Best Star Debut Male and Best Supporting Actor at 1st ARY Film Awards, respectively."
481,msmarco,_doc,MARCO_3360076,3.97999,"The Rocky Flats Plant was a United States nuclear weapons production facility near Denver, Colorado that operated from 1952 to 1992. It was under the control of the United States Atomic Energy Commission (AEC) until 1977, when the AEC was replaced by the Department of Energy (DOE).ark Circle is a 1982 American documentary film that focuses on the Rocky Flats Plant and its plutonium contamination of the area's environment. The film won the Grand Prize for documentary at the Sundance Film Festival and received a national Emmy Award for Outstanding individual achievement in news and documentary."
482,msmarco,_doc,MARCO_6228976,3.97999,"[prɪˈjaːŋkaː ˈtʃoːpɽaː] ; born 18 July 1982) is an Indian film actress and singer, and the winner of the Miss World pageant of 2000. Through her film career, she has become one of Bollywood's highest-paid actresses and one of the most popular and high-profile celebrities in India.hopra is cited as the world's sexiest Asian woman, as well as one of the most fashionable Indian celebrities, by various media outlets. She has received numerous accolades, including a National Film Award for Best Actress and Filmfare Awards in four categories."
483,msmarco,_doc,MARCO_7124782,3.97999,"The Adventures of Baron Munchausen. The Adventures of Baron Munchausen is a 1988 adventure fantasy film co-written and directed by Terry Gilliam, starring John Neville, Sarah Polley, Eric Idle, Jonathan Pryce, Oliver Reed, and Uma Thurman. The film is based on the tall tales about the 18th-century German nobleman Baron Munchausen and his wartime exploits against the Ottoman Empire. Although the film was a box office bomb, it received positive reviews from critics and was nominated for four Academy Awards: Best Art Direction, Best"
484,msmarco,_doc,MARCO_6220011,3.97999,"The Help received four Academy Award nominations including Best Picture, Best Actress for Davis, and Best Supporting Actress for both Chastain and Spencer, with the latter winning the award. The film also won the Screen Actors Guild Award for Outstanding Performance by a Cast in a Motion Picture.ome of the negative reviews criticized the film for its inability to match the quality of the book. Chris Hewitt of the St. Paul Pioneer Press said about the film: Some adaptations find a fresh, cinematic way to convey a book's spirit but The Help doesn't.. Many critics praised the performances of Davis and Spencer."
485,msmarco,_doc,MARCO_7396871,3.97999,"Casting for ‘Family Feud’ Atlanta audience members now fully booked. FILE A casting company is looking for audience members to watch “Family Feud” episodes filming in downtown Atlanta in March. UPDATE: We received word Thursday that no more audience members are needed for this casting call. If you’ve ever wanted to watch the filming of a “Family Feud” episode, your chance may be here. Rose Locke Casting is looking for audience members for the new season filming in downtown Atlanta this week, a posting on Project Casting shows."
486,msmarco,_doc,MARCO_7427197,3.97999,"Gone with the Wind, at 3 hours and 56 minutes, was the longest film to have won a Best Picture Oscar; it was also the first film in color to win Best Picture.The 1968 movie, War and Peace, was the longest film (431 minutes) to an Academy Award – for best Foreign picture.enry Fonda was first nominated for a Best Actor Oscar in 1941 for his role in The Grapes of Wrath but had to wait 41 years before he finally achieved a win in 1982 for his role in On Golden Pond. At 76, he is the oldest actor yet to have received the Best Actor award."
487,msmarco,_doc,MARCO_314058,3.9724286,"Spy is a 2015 American action comedy spy film written and directed by Paul Feig. Starring Melissa McCarthy, Jason Statham, Rose Byrne, Miranda Hart, Bobby Cannavale, Allison Janney, and Jude Law, the film follows the transformation of desk-bound CIA analyst Susan Cooper into a field agent who attempts to foil the black market sale of a suitcase nuke. Produced by Peter Chernin, Jenno Topping, Feig and Jessie Henderson, the film was theatrically released on June 5, 2015. It received praise from cr"
488,msmarco,_doc,MARCO_7988260,3.9724286,"Jodie Foster is an award-winning American actress best known for her roles in the films Taxi Driver, The Accused and The Silence of the Lambs. Synopsis American actress, director and producer Jodie Foster was born on November 19, 1962, in Los Angeles, California. Foster received an Oscar nomination at age 12 for her role as a child prostitute in Martin Scorsese's film Taxi Driver (1976), and went on to win a Golden Globe (best actress) and Academy Award for The Accused (1988). She then starred in the popular film The Silence of the Lambs (1991)."
489,msmarco,_doc,MARCO_3092022,3.9648955,"Eleanor Coppola is an accomplished documentary filmmaker, artist and costume designer. Eleanor was born in Southern California, and attended UCLA where she received a degree in Applied Design. In 1962, she was invited to Ireland to work on a low-budget independent film, Dementia 13. While serving as Assistant Art Director, she worked with Francis Coppola, who was directing his first feature film. The following year, Francis and Eleanor were married. Eleanor often accompanies Francis “on location” when he is shooting his films. While in the Philippines for the making of Apocalypse Now, she shot the documentary footage for the critically acclaimed, Emmy Award-winning Hearts of Darkness: A Filmmaker’s Apocalypse."
490,msmarco,_doc,MARCO_3360080,3.9573908,"Following World War II, the United States began production of nuclear weapons. The AEC chose the Dow Chemical Company to manage the bomb production facility. A 4 sq mi (10 km 2) site about 15 mi (24 km) northwest of Denver, Colorado on a windy plateau called Rocky Flats was chosen for the facility.ark Circle is a 1982 American documentary film that focuses on the Rocky Flats Plant and its plutonium contamination of the area's environment. The film won the Grand Prize for documentary at the Sundance Film Festival and received a national Emmy Award for Outstanding individual achievement in news and documentary."
491,msmarco,_doc,MARCO_4340026,3.9350443,"Matsumoto City Museum of Art. Received the 2006 National Lifetime Achievement Awards, the Order of the Rising Sun, Gold Rays with Losette and The Praemium Imperiale-Painting-in 2006. In 2008, Documentary film : “Yayoi Kusama, I adore myself released in Japan and also screened at international film festival and museum.Exhibition tour started at Museum Boijmans Van Beuningen in Rotterdam, traveled to Museum of Contemporary Art Sydney in Australia in 2009, City Gallery Wellington in New Zealand.howed large paintings, soft sculptures, and environmental sculptures using mirrors and electric lights. In the latter 1960s, staged many happenings such as body painting festivals, fashion shows and anti-war demonstrations. Launched media-related activities such as film production and newspaper publication."
492,msmarco,_doc,MARCO_2323467,3.9244618,"This is a list of characters from Disney/Pixar's Toy Story franchise which consists of the animated films Toy Story (1995), Toy Story 2 (1999), and Toy Story 3 (2010)."
493,msmarco,_doc,MARCO_4947150,3.922504,"This is a list of characters from Disney/Pixar's Toy Story franchise which consists of the animated films Toy Story (released 1995), Toy Story 2 (1999), and Toy Story 3 (2010)."
494,msmarco,_doc,MARCO_8563744,3.9146914,"In the novel, David Mitchell was able to unfold the story over time by establishing each story arc and then circling back to each story after the post-apocalyptic scene — but that doesn’t work as well on the big screen. In the film, we see the stories happening simultaneously."
495,msmarco,_doc,MARCO_4209288,3.908852,"The True Story of the 1949 Exorcism Case. In 1949, the Devil came to St. Louis.... Or at least, if you believe the stories that have been told for the last fifty-odd years, a reasonable facsimile of him did. This is the story that has been told for three generations and it is the story that has inspired books, films and documentaries."
496,msmarco,_doc,MARCO_1798386,3.9049685,It’s very interesting how the story captures an amazing story but also captures the spirit of the time. The Assassination of Gianni Versace: American Crime Story will premiere in January 2018 on FX. WATCH: Penelope Cruz Channels Donatella Versace While Filming 'American Crime Story' in Miami
497,msmarco,_doc,MARCO_4733284,3.8991573,"The film was so successful it prompted two sequels, Toy Story 2, which was released November 24, 1999 and became an even bigger hit than the original (Toy Story was re-released on a double feature with Toy Story 2 in 3D on October 2, 2009) and Toy Story 3, which was released June 18, 2010."
498,msmarco,_doc,MARCO_1504977,3.8985925,"Greatest Film Franchises-All-Time Top Box-Office Revenue Results: In general terms, film franchises are multi-picture stories, often including some of the same characters from film to film."
499,msmarco,_doc,MARCO_3357473,3.893363,"(July 2010) You've Got a Friend in Me is a song written and first recorded by Randy Newman. Originally written as the theme song for the 1995 Disney/Pixar animated film Toy Story, it has since become the theme song for its sequels, Toy Story 2 (1999) and Toy Story 3 (2010) as well as a musical leitmotif throughout the whole Toy Story franchise."
500,msmarco,_doc,MARCO_3823732,3.8907566,"O'Brien died before The Valley of Gwangi was filmed. A similar film The Beast of Hollow Mountain appeared in 1956, produced by O'Brien and a Mexican film company with the same story. Harryhausen was not involved with the visual effects for that film."
501,msmarco,_doc,MARCO_1132129,3.8810053,Many films started popping up in the 1980’s depicting Polidori’s story but that certainly doesn’t make them the first vampire film ever made. There are actually 22 vampire films noted that took their place in the film world prior to Nosferatu in 1922.
502,msmarco,_doc,MARCO_4009344,3.8790607,Ramrod (film) Ramrod is a 1947 Western film directed by Andre DeToth. This cowboy drama from Hungarian director DeToth was the first of several films based on the stories of Western author Luke Short. DeToth's first Western is often compared to films noir movies released around the same time.
503,msmarco,_doc,MARCO_4799628,3.8790607,Contact (1997 American film) Contact is a 1997 American science fiction drama film directed by Robert Zemeckis. It is a film adaptation of Carl Sagan's 1985 novel of the same name; Sagan and his wife Ann Druyan wrote the story outline for the film.
504,msmarco,_doc,MARCO_5756919,3.8790607,"And watching all 60 films nominated for Oscars this year has reminded me that the films nominated for Best Picture are so not the whole story.The riskier, more daring, more idiosyncratic movies often can only eke out a nomination or two.nd watching all 60 films nominated for Oscars this year has reminded me that the films nominated for Best Picture are so not the whole story."
505,msmarco,_doc,MARCO_5880482,3.87608,"Buster is Andy's pet dachshund, whom he receives as a puppy for his Christmas present at the end of Toy Story, but makes his first full appearance as a grown-up dog in Toy Story 2. Appearances. Toy Story. In Toy Story, Andy receives Buster as a puppy for his Christmas present at the film's resolution. Buster isn't seen, but he can be heard barking, and Andy says, Wow, a puppy!. Both Woody and Buzz exchange worried smiles when they hear Andy say this."
506,msmarco,_doc,MARCO_4606313,3.8751774,"------------------------------------------------------------ ------------... Slapshot Films uploaded, posted and added to Slapshot Films-The Collection 1 year ago. Hi guys, We have a new short film showcasing some brilliant local talent. The Money is a story of choices and betrayal, lies and deceit. We hope you enjoy the film and here's to a bigger and better 2014!"
507,msmarco,_doc,MARCO_2249868,3.8732386,"Walking Tall (2004 film) From Wikipedia, the free encyclopedia. Walking Tall is a 2004 action film. A remake of the 1973 film of the same name, it stars The Rock and Johnny Knoxville. Like the original film, it was based on the real-life story of Sheriff Buford Pusser and utilized many elements from his life."
508,msmarco,_doc,MARCO_8173876,3.8732386,Portrayal in film and television. 1  The 1939 film The Story of Alexander Graham Bell was based on his life and works. 2  The 1992 film The Sound and the Silence was a TV film. 3  Biography aired an episode Alexander Graham Bell: Voice of Invention on 6 August 1996.
509,msmarco,_doc,MARCO_2509947,3.872231,"The press likes to do human-interest stories on women in law enforcement; departments that IWITTS has worked with have received positive print, television, and radio coverage of their efforts to recruit more women through a women-in-policing career fair. Some have also received coverage of the career fair itself."
510,msmarco,_doc,MARCO_8548175,3.872231,"VE Equities, formerly known as the Vella Group, announced that 949 Park Avenue located between 81st and 82nd Streets, has received a Temporary Certificate of Occupancy (TCO). Construction is complete at the eight-story co-op, which has received its temporary certificate of occupancy."
511,msmarco,_doc,MARCO_262582,3.8713012,"Raze (film) Raze is a 2013 action film that was directed by Josh C. Waller. The film premiered on April 21, 2013 at the Tribeca Film Festival and stars Zoë Bell and Rachel Nichols. The story focuses on women forced to fight to death for the twisted entertainment of the wealthy elite."
512,msmarco,_doc,MARCO_8015626,3.8713012,"Answer Wiki. Disney currently has six Star Wars films in the works. Three more are spin-off films. The only one of these that has officially been announced is Rogue One: A Star Wars Story (2016), but there are reports that the other two will be Untitled Han Solo Anthology film (2018) and Untitled Boba Fett Anthology film (TBA)."
513,msmarco,_doc,MARCO_7144715,3.8713012,Ploy is a 2007 Thai film written and directed by Pen-Ek Ratanaruang. The film premiered during the Directors' Fortnight at the 2007 Cannes Film Festival. The drama film stars Thai actress Lalita Panyopas in a story of a middle-aged married couple who question their relationship after seven years.
514,msmarco,_doc,MARCO_3329991,3.8693662,A film editor combines hours of film footage together to make a movie. A film editor is a mechanic who removes the unneeded and fits pieces of film together to make a finished movie. He is a collaborator who works with cinematographers and sound editors to bring sight and sound together. And he is an artist who captures a director's vision and tells a compelling story.
515,msmarco,_doc,MARCO_2510994,3.867433,"$80 million. Bedtime Stories is a 2008 American family-fantasy-comedy film directed by Adam Shankman that stars Adam Sandler (his first appearance in a Disney film). Sandler's production company Happy Madison and Andrew Gunn's company Gunn Films have produced the film, and Walt Disney Pictures distributing it."
516,msmarco,_doc,MARCO_4075866,3.867433,"Dunkirk (2017 film) Dunkirk is an upcoming English-language war film written, co-produced, and directed by Christopher Nolan. Set during World War II, it concerns the Dunkirk evacuation. Nolan said Dunkirk was not a war film but rather a survival story and first and foremost a suspense film, lacking the bloody aspects of combat."
517,msmarco,_doc,MARCO_3667319,3.867433,"It spawned many imitations of its story and style, and homages to specific scenes. Dilwale Dulhania Le Jayenge was one of only three Hindi films in the reference book 1001 Movies You Must See Before You Die, and was placed twelfth on the British Film Institute's list of top Indian films of all time. It is the longest-running film in the history of Indian cinema."
518,msmarco,_doc,MARCO_43709,3.8655014,"With that sort of reader interest, it was inevitable that the Zorro story be made into a film. In fact, there have been many filmed versions, beginning with Douglas Fairbanks Sr.'s portrayal of Zorro in the 1920 silent production The Mark of Zorro. Tyrone Power scored a huge hit with a 1940 remake of that film, and several other Zorro films and serials were also produced over the years."
519,msmarco,_doc,MARCO_4212504,3.8655014,"Hallmark filming The Christmas Spirit in Lebanon, Ohio - Cincinnati News, FOX19-WXIX TV. Hallmark filming movie in Lebanon. You might see film crews if you're heading to Downtown Lebanon. Nicolette Sheridan is there filming a new Hallmark movie, The Christmas Spirit. The Christmas Spirit is the story of Charlotte Hart, played by Sheridan."
520,msmarco,_doc,MARCO_3285435,3.8655014,"Annabelle (film) Annabelle is a 2014 American supernatural horror film directed by John R. Leonetti, produced by James Wan, and written by Gary Dauberman. It is a prequel to 2013's The Conjuring and the second film in The Conjuring franchise. The film was inspired by a story of a doll named Annabelle told by Ed and Lorraine Warren."
521,msmarco,_doc,MARCO_4955172,3.8655014,"For the 1997 remake, see That Darn Cat (1997 film). That Darn Cat! is a 1965 American Walt Disney Productions thriller comedy film starring Hayley Mills (in her last of the six films she made for the Walt Disney Studios) and Dean Jones (starring in his first film for Disney) in a story about bank robbers, a kidnapping and a mischievous cat."
522,msmarco,_doc,MARCO_2235511,3.8644643,"Fitzgerald’s final ten years would continue in pretty much steady decline. His fourth novel, Tender Is The Night, was not well-received upon publication in 1934 (though it has since, like Fitzgerald himself, received critical revival), and he spent much of the decade supporting himself with short stories and attempting to find success as a Hollywood screenwriter, success that would not come."
523,msmarco,_doc,MARCO_1532326,3.8635721,'Property Brothers' filming in Westchester homes. It looks like Property Brothers will be filming in four or five Westchester homes in March. Story Highlights. Exciting news for HGTV fans in the Lower Hudson Valley. It looks like Property Brothers will be filming in four or five Westchester houses this month. Filming at each home will take about seven weeks.
524,msmarco,_doc,MARCO_6541352,3.8635721,"National Lampoon's Vacation (film series) The National Lampoon's Vacation film series is a comedy film series initially based on John Hughes' short story Vacation '58 that was originally published by National Lampoon magazine. The series is distributed by Warner Bros. and consists of seven films, two of which are not sponsored by National Lampoon."
525,msmarco,_doc,MARCO_1653829,3.8616443,"Imperium is a 2016 American thriller film, written and directed by Daniel Ragussis in his feature film debut, from a story by Michael German. The film stars Daniel Radcliffe, Toni Collette, Tracy Letts, Nestor Carbonell, and Sam Trammell. The film was released on August 19, 2016 in a limited release and through video on demand by Lionsgate Premiere."
526,msmarco,_doc,MARCO_5003745,3.8616443,"For the film series, see Sharknado (film series). Sharknado is a 2013 made-for-television Comedy film based on a true story about a waterspout that lifts sharks out of the ocean and deposits them in Los Angeles. It is the first installment in the Sharknado film series. It first aired on the Syfy channel on July 11, 2013, and stars Tara Reid, Ian Ziering, and John Heard."
527,msmarco,_doc,MARCO_7774964,3.8616443,"Loving (2016 film) Loving is a 2016 American historical drama film which tells the story of Richard and Mildred Loving, the plaintiffs in the 1967 U.S. Supreme Court decision Loving v. Virginia, which invalidated state laws prohibiting interracial marriage. The film was produced by Big Beach and Raindog Films, and distributed by Focus Features."
528,msmarco,_doc,MARCO_8089564,3.8616443,"No Escape (2015 film) This is an American action movie filmed in Thailand released by the Weinstein Co.. The film is based on a fictional story of an American family trying to escape a fictitious coup in an unidentified country in South East Asia. Principle actors include, Pierce Brosnan, Lake Bell and owen wilson. List of films set in Thailand"
529,msmarco,_doc,MARCO_7939481,3.8597183,"Released in the United States on September 25, 1987, the film is number 50 on Bravo's 100 Funniest Movies, number 88 on The American Film Institute's (AFI) AFI's 100 Years...100 Passions list of the 100 greatest film love stories, and 46 in Channel 4's 50 Greatest Comedy Films list."
530,msmarco,_doc,MARCO_7944304,3.8597183,"Editor | Director | Producer. Matty Johnson is a film director, producer and screenwriter. In a very prolific career, he is probably best known for his suspense and crime films. He directed successful and popular films such as Grim, Terminally Living, Catwoman and Jaws: Quint's Story and Doggy Daycare The Movie. Themes Johnson's films can fall into two categories, Horror & Crime..."
531,msmarco,_doc,MARCO_8677919,3.8597183,"Tusk (2014 film) Tusk is a 2014 American comedy horror film written and directed by Kevin Smith, based on a story from his SModcast podcast. The film stars Michael Parks, Justin Long, Haley Joel Osment, Génesis Rodríguez, and Johnny Depp. The film is intended to be the first in Smith's planned True North trilogy."
532,msmarco,_doc,MARCO_2083138,3.8596776,"We received submissions from women in their teens through their 50s, within the United States and abroad. And even though everyone had a story about their first time, each of those stories is very different."
533,msmarco,_doc,MARCO_5213377,3.8577943,"David S. Goyer and Christopher Nolan collaborated on the story of the film. The script itself was written by Nolan and his brother Jonathan Nolan. After watching 'The Dark Knight', Goyer stated I can't believe my name is on a movie this good.ith that flashback, The Dark Knight not only becomes the only film in the trilogy where Bruce Wayne does not have a flashback, but also the only film where the content of the flashback references a previous scene within the film's main action."
534,msmarco,_doc,MARCO_7487403,3.8577943,"During filming on the face of the Eiger, English Mountaineer and crew member David Knowles was killed by rock fall. Knowles had made an ascent of the North Face of the Eiger in 1970. Film maker Mike Hoover was supervising the filming on the Face of the Eiger and is credited on the Film as Climbing Advisor. Hoover told the story of the accident in the August 1975 issue of American Cinematographer."
535,msmarco,_doc,MARCO_7413510,3.8570504,"It may seem silly to begin a list of steps on how to write a short story with a tip to “write the story,” but let me explain. There are really two different kinds of stories. There is the art form, “short stories,” which comes complete with characters, plot, description, and style.f you want to hook your reader, it starts with writing the perfect first line. We’ve written a full post about how to write the perfect first line, but here are five quick tips: 1  Like the opening of a film, invite us into the scene. 2  Surprise us. 3  Establish a voice."
