,_index,_type,_id,_score,_source.body
745,msmarco,_doc,MARCO_3838591,3.7675607,"Synopsis. A gut-wrenching, violent psychological crime drama from start to finish, this award-winning film by noted Japanese director Shohei Imamura is based on a true story. Iwao Enokizu (Ken Ogata) is a murderous sociopath who kills two money lenders in a gory opening scene.ynopsis. A gut-wrenching, violent psychological crime drama from start to finish, this award-winning film by noted Japanese director Shohei Imamura is based on a true story. Iwao Enokizu (Ken Ogata) is a murderous sociopath who kills two money lenders in a gory opening scene."
746,msmarco,_doc,MARCO_4229374,3.7675607,"A visit to the sites of a few classic horror films. The story of the Torrence family and the Overlook Hotel is one of the most well-known in horror. While the The Shining is a work of fiction, it was inspired by a very real 105-year-old piece of history that is still open today.Welcome to the Stanley Hotel, set on 160 acres of pristine Colorado land along the dramatic backdrop of the Rocky Mountains.This majestic Georgian complex (founded in 1909 by F.O. visit to the sites of a few classic horror films. The story of the Torrence family and the Overlook Hotel is one of the most well-known in horror. While the The Shining is a work of fiction, it was inspired by a very real 105-year-old piece of history that is still open today."
747,msmarco,_doc,MARCO_2818995,3.7675607,"After filming “Shadow of A Doubt” in Santa Rosa in 1948, Alfred Hitchcock returned to Sonoma County in 1961 to find a remote coastal location for his next project “The Birds.” He chose Bodega Bay, with surrounding bleak treeless hills, quiet fishing harbor and fog.ased on a short story by Daphne DuMaurier, the original story took place in an English seashore village where murderous birds attacked the local villagers. Evan Hunter, who had written “The Blackboard Jungle” and “Last Summer” wrote the screenplay; Alfred Hitchcock financed the film from his successful television show."
748,msmarco,_doc,MARCO_2520459,3.7675607,there s no word on how substantial spidey s role will be in the film and it s kind of hard to guess based on the source material in the civil war comic book spider man is essentially the moral center of the story the character caught in the ideological tug of war between captain america and iron manhere s no word on how substantial spidey s role will be in the film and it s kind of hard to guess based on the source material in the civil war comic book spider man is essentially the moral center of the story the character caught in the ideological tug of war between captain america and iron man
749,msmarco,_doc,MARCO_3230476,3.7675607,"In the Denzel Washington-directed film The Great Debaters, based on a true story, Washington plays teacher and poet Melvin B. Tolson, who led an African-American college debating team during the racially charged 1930s to such success that it was able to compete against all odds with leading white teams at Harvard.n the Denzel Washington-directed film The Great Debaters, based on a true story, Washington plays teacher and poet Melvin B. Tolson, who led an African-American college debating team during the racially charged 1930s to such success that it was able to compete against all odds with leading white teams at Harvard."
750,msmarco,_doc,MARCO_4625694,3.7675607,"From Wikiquote. His whole life was a million-to-one shot. Rocky is a 1976 film that tells a rags-to-riches American Dream story about Rocky Balboa, a slightly dull-witted but good-hearted collection agent for a loan shark in Philadelphia with a penchant for boxing who gets a shot at the world heavyweight title.rom Wikiquote. His whole life was a million-to-one shot. Rocky is a 1976 film that tells a rags-to-riches American Dream story about Rocky Balboa, a slightly dull-witted but good-hearted collection agent for a loan shark in Philadelphia with a penchant for boxing who gets a shot at the world heavyweight title."
751,msmarco,_doc,MARCO_4345794,3.7675607,"Reuters/David McNew. A “cutie” dog has “snagged” the role of Bouton in “Outlander” Season 2. The dog will join the main cast members as the story continues in France. Meanwhile, cast member Tobias Menzies, who plays the dual role of Frank and Jack Randall, recalled what it was like to film Season 1.The producers shared this photo of the dog on the official Twitter page of the Starz television series.he dog will join the main cast members as the story continues in France. Meanwhile, cast member Tobias Menzies, who plays the dual role of Frank and Jack Randall, recalled what it was like to film Season 1."
752,msmarco,_doc,MARCO_5379354,3.7675607,"Johnny Tremain. 33,362 pages on this wiki. Johnny Tremain is a 1957 film made by Walt Disney Productions, based on the 1944 Newbery Medal-winning children's novel of the same name by Esther Forbes, retelling the story of the years in Boston, Massachusetts prior to the outbreak of the American Revolution.It was directed by Robert Stevenson.ohnny Tremain. 33,362 pages on this wiki. Johnny Tremain is a 1957 film made by Walt Disney Productions, based on the 1944 Newbery Medal-winning children's novel of the same name by Esther Forbes, retelling the story of the years in Boston, Massachusetts prior to the outbreak of the American Revolution."
753,msmarco,_doc,MARCO_6313233,3.7675607,"1 User Rating: 4.78 out of 5 (18 ratings). 2  Your Rating: 3  Review: An elegant but tragic example of how a film can be beautifully acted and gorgeously photographed yet still fall victim to a fundamentally flawed screenplay, Clint Eastwood's Changeling has everything going for it as the riveting story builds steam, only to…. User Rating: 4.78 out of 5 (18 ratings). 2  Your Rating: 3  Review: An elegant but tragic example of how a film can be beautifully acted and gorgeously photographed yet still fall victim to a fundamentally flawed screenplay, Clint Eastwood's Changeling has everything going for it as the riveting story builds steam, only to…."
754,msmarco,_doc,MARCO_5956784,3.7675607,"Nolan's inspiration for the film was the Joker's comic book debut in 1940, the 1988 graphic novel The Killing Joke, and the 1996 series The Long Halloween, which retold Two-Face 's origin. The nickname the Dark Knight was first applied to Batman in Batman #1 (1940), in a story written by Bill Finger.olan's inspiration for the film was the Joker's comic book debut in 1940, the 1988 graphic novel The Killing Joke, and the 1996 series The Long Halloween, which retold Two-Face 's origin. The nickname the Dark Knight was first applied to Batman in Batman #1 (1940), in a story written by Bill Finger."
755,msmarco,_doc,MARCO_7379580,3.7675607,"Fourteen years ago The George Lucas Educational Foundation was created to celebrate and encourage innovation in schools. Since then we have discovered many creative educators, business leaders, parents, and others who were making positive changes not only from the top down but also from the bottom up.Since that time we have been telling their stories through our Web site, our documentary films, and Edutopia magazine.VIDEO: 10 Big Ideas for Better Classrooms: Striving to Improve Public Education. Running Time: 19 min.ince then we have discovered many creative educators, business leaders, parents, and others who were making positive changes not only from the top down but also from the bottom up. Since that time we have been telling their stories through our Web site, our documentary films, and Edutopia magazine."
756,msmarco,_doc,MARCO_3353036,3.7669969,"Thirteen Reasons Why is centered around a high school boy who has received a mysterious package in the mail. He eventually decides to open it and discovers he has been sent a series of audiotapes recorded by a classmate, Hannah (and coincidentally, his crush), who has recently committed suicide.As the story continues we come to discover that there are thirteen sides of the tapes to listen to and thirteen students involved.e eventually decides to open it and discovers he has been sent a series of audiotapes recorded by a classmate, Hannah (and coincidentally, his crush), who has recently committed suicide. As the story continues we come to discover that there are thirteen sides of the tapes to listen to and thirteen students involved."
757,msmarco,_doc,MARCO_8156878,3.7669969,"Read about writer and poet Richard Wright, author of the acclaimed works Black Boy and Native Son , at Biography.com. Pioneering African-American writer Richard Wright is best known for the classic texts Black Boy and Native Son. Synopsis African-American writer and poet Richard Wright was born on September 4, 1908, in Roxie, Mississippi, and published his first short story at the age of 16. Later, he found employment with the Federal Writers Project and received critical acclaim for Uncle Tom's Children, a collection of four stories."
758,msmarco,_doc,MARCO_6682857,3.764779,The following are a list of awards and nominations received by the English actor Robert Pattinson. He has received Best Actor award at Strasbourg Film Festival for his performance in How to Be.
759,msmarco,_doc,MARCO_8250916,3.7628136,"In addition to the many awards Damon has received, including Academy Awards and Golden Globe Awards, he received a star on the Hollywood Walk of Fame in 2007 for his work in the film industry."
760,msmarco,_doc,MARCO_2890844,3.760056,"Birdman or (The Unexpected Virtue of Ignorance), commonly known simply as Birdman, is a 2014 American black comedy film directed by Alejandro G. Iñárritu. It was written by Iñárritu, Nicolás Giacobone, Alexander Dinelaris Jr., and Armando Bo. The film stars Michael Keaton with a supporting cast of Zach Galifianakis, Edward Norton, Andrea Riseborough, Amy Ryan, Emma Stone, and Naomi Watts. The story follows Riggan Thomson (Keaton), a faded Hollywood actor best known for playing the superhero Birdman, as he struggles to mount a Broadway adaptation of a short story by Raymond Carver."
761,msmarco,_doc,MARCO_3882114,3.760056,"The film's plot follows the story of Paikea Apirana (Pai) In the book, her name is Kahu, short for Kahutia Te Rangi. The leader should be the first-born grandson – a direct patrilineal descendant of Paikea, aka Kahutia Te Rangi in the book, the Whale Rider – he who rode on top of a whale from Hawaiki.he film's plot follows the story of Paikea Apirana (Pai) In the book, her name is Kahu, short for Kahutia Te Rangi. The leader should be the first-born grandson – a direct patrilineal descendant of Paikea, aka Kahutia Te Rangi in the book, the Whale Rider – he who rode on top of a whale from Hawaiki."
762,msmarco,_doc,MARCO_6666524,3.760056,"Claim: The Amityville Horror is based on a true story. Origins: Some horrors just won't die, and The Amityville Horror is a case in point. The tale of a reportedly demon-infested house in Amityville, New York, became a best-selling novel in 1977 and a hit horror film starring James Brolin and Margot Kidder in 1979.laim: The Amityville Horror is based on a true story. Origins: Some horrors just won't die, and The Amityville Horror is a case in point. The tale of a reportedly demon-infested house in Amityville, New York, became a best-selling novel in 1977 and a hit horror film starring James Brolin and Margot Kidder in 1979."
763,msmarco,_doc,MARCO_6806988,3.760056,Sidney and Halley are in grade 5 at The Linden School. They invented this new way to do long division.Their teacher Beth helped them film and upload this.  1 Highway Blues by New Stories (Google Play • iTunes • eMusic • AmazonMP3). 2  Education. 3  Standard YouTube License.idney and Halley are in grade 5 at The Linden School. They invented this new way to do long division. Their teacher Beth helped them film and upload this.  1 Highway Blues by New Stories (Google Play • iTunes • eMusic • AmazonMP3). 2  Education. 3  Standard YouTube License.
764,msmarco,_doc,MARCO_7506636,3.760056,"Reviews: write review. Made for the Mumbai leg of the 48 Hour Film Project, 2011 in 48 hours Smoking is injurious to health is the story of Ranbir and Gauri.Its an ill timed visit back home that forces Ranbir to revisit his past.Singh Taranjeet. 2 3 4 5 6 7 8 9 10 -/10 X. (awaiting 5 votes). Reviews: write review. Made for the Mumbai leg of the 48 Hour Film Project, 2011 in 48 hours Smoking is injurious to health is the story of Ranbir and Gauri. Its an ill timed visit back home that forces Ranbir to revisit his past."
765,msmarco,_doc,MARCO_7570996,3.758779,"You can read about the story of how fans came to kill Jason Todd in a new online comic by Tony Wolf and Sirgryphon called 1-800-Dead-Robin.. The comic takes a personal yet analytical approach, akin to Scott McCloud's work. You can read it here, via Bleeding Cool.At the end of the ’80s, Batman fans killed Robin.Jason Todd, who replaced the now-grown-up Dick Grayson and became the second Robin, received an ireful response from readers, who abhorred Todd's ersatz aesthetics and personality.Dennis O'Neil came up with the idea of allowing readers to influence the character's fate, and a 900-number was set-up.ou can read it here, via Bleeding Cool. At the end of the ’80s, Batman fans killed Robin. Jason Todd, who replaced the now-grown-up Dick Grayson and became the second Robin, received an ireful response from readers, who abhorred Todd's ersatz aesthetics and personality."
766,msmarco,_doc,MARCO_3605193,3.75497,"Joy received a theatrical release on December 25, 2015, distributed by 20th Century Fox. It received mixed reviews from critics, who praised Lawrence's performance but criticized the writing and pace of the film."
767,msmarco,_doc,MARCO_1706385,3.753014,"Garfield first came to international attention in 2010 with supporting roles in the drama films The Social Network, for which he was highly praised and received Golden Globe and BAFTA nominations, and Never Let Me Go, for which he received a Saturn Award and a BAFTA nomination."
768,msmarco,_doc,MARCO_3238703,3.753014,"Upon release, The Edge received mixed to positive reviews from critics. Based on 47 reviews collected by Rotten Tomatoes, the film received a 60% approval rating from critics, with an average score of 6.4/10."
769,msmarco,_doc,MARCO_3399521,3.7525792,"1 2 3 4 5 6 7 8 9 10 -/10 X. Ratings: 8.5 /10 from 517 users. Reviews: 6 user | 1 critic. THIRD REICH: THE RISE & FALL tells the story of Hitler's Germany through rarely seen films of the people who were there. Immersive and evocative, it takes viewers inside the Germany of the ... 2 3 4 5 6 7 8 9 10 -/10 X. Ratings: 8.5 /10 from 517 users. Reviews: 6 user | 1 critic. THIRD REICH: THE RISE & FALL tells the story of Hitler's Germany through rarely seen films of the people who were there. Immersive and evocative, it takes viewers inside the Germany of the ..."
770,msmarco,_doc,MARCO_3431371,3.7525792,"Results 1 to 5 of 6... Page of 2 [Next 1 items]. Astoria, Oregon-Goonies in the Boonies Goonies Movie Location: Astoria, Oregon is not only the former canning capital of the world but also has a claim to fame as a movie location for many scenes in the 80's kid adventure film The Goonies. [05/26/2010] Complete Story...esults 1 to 5 of 6... Page of 2 [Next 1 items]. Astoria, Oregon-Goonies in the Boonies Goonies Movie Location: Astoria, Oregon is not only the former canning capital of the world but also has a claim to fame as a movie location for many scenes in the 80's kid adventure film The Goonies. [05/26/2010] Complete Story..."
771,msmarco,_doc,MARCO_5864325,3.7525792,"$10 Million. Erin Brockovich net worth and salary: Erin Brockovich-Ellis is an American clerk and environmental activist who has a net worth of $10 million.Erin Brockovich was born on June 22, 1960 in Lawrence, Kansas.Her fight against the energy company PG&E (Pacific Gas and Electric Company) garnered worldwide attention when her story was turned into a 2000 biography film which chronicled her fierce efforts in the case.rin Brockovich was born on June 22, 1960 in Lawrence, Kansas. Her fight against the energy company PG&E (Pacific Gas and Electric Company) garnered worldwide attention when her story was turned into a 2000 biography film which chronicled her fierce efforts in the case."
772,msmarco,_doc,MARCO_8306863,3.75106,List of awards and nominations received by Toni Collette. The following is a list of awards and nominations received by Australian film and television actress Toni Collette. 1 Motion Picture awards 1.1 Academy Awards.
773,msmarco,_doc,MARCO_721078,3.7471576,"The film was nominated for nine Oscars, including Best Picture, and Orson Welles received three nominations, as co-screenwriter (with Joseph L. Mankiewicz), Director, and Actor. The cinematography, editing, music, sound, and art direction also received nods."
774,msmarco,_doc,MARCO_4265954,3.7471576,The standard method used to divide the Earths long natural history into manageable parts? already exists. already exists as an alternate of this question. exists and is an alternate of. Middle of Nowhere has won plenty of awards and received praised from all around the industry. Did you know the film would be so well-received when you read the ...
775,msmarco,_doc,MARCO_3530252,3.7471576,"Eastwood has directed most of his own star vehicles, but he has also directed films in which he did not appear such as Mystic River (2003) and Letters from Iwo Jima (2006), for which he received Academy Award nominations and Changeling (2008), which received Golden Globe Award nominations."
776,msmarco,_doc,MARCO_8228085,3.7452092,"Ordinary People launched the career of Elizabeth McGovern, who received special permission to film while attending Juilliard. 1980 was also a break-out year for Adam Baldwin, who had a small role in Ordinary People while starring in My Bodyguard the same year. Ordinary People received critical acclaim."
777,msmarco,_doc,MARCO_34054,3.7451305,"It stars Amanda Clayton, Edwina Findley, Heather Hemmens, Zulay Henao, and April Parker Jones as the five female leads Alex, Kelly, Marcie, Esperanza and Natalie on their quest to find love in the midst of managing very complex lives.. If Loving You Is Wrong is loosely based on Perry's 2014 film The Single Moms Club.Actress Zulay Henao reprised her movie role of Esperanza, although her story was modified for the TV series. It was officially ordered straight-to-series on January 9, 2014.f Loving You Is Wrong is loosely based on Perry's 2014 film The Single Moms Club. Actress Zulay Henao reprised her movie role of Esperanza, although her story was modified for the TV series."
778,msmarco,_doc,MARCO_2240711,3.7451305,"This article is about the book. For other uses, see Charlotte's Web (disambiguation) . Charlotte's Web is a children's novel by American author E. B. White and illustrated by Garth Williams; it was published in October 15, 1952, by Harper & Brothers.The novel tells the story of a pig named Wilbur and his friendship with a barn spider named Charlotte.When Wilbur is in danger of being slaughtered by the farmer, Charlotte writes messages praising Wilbur (such as Some Pig) in her web in order to persuade the farmer to let him live.aramount released a direct-to-video sequel, Charlotte's Web 2: Wilbur's Great Adventure, in the U.S. in 2003 (Universal released the film internationally). A live-action film version of E. B. White's original story was released in 2006."
779,msmarco,_doc,MARCO_5864324,3.7451305,"Erin Brockovich net worth: $10 Million. Erin Brockovich net worth and salary: Erin Brockovich-Ellis is an American clerk and environmental activist who has a net worth of $10 million. Erin Brockovich was born on June 22, 1960 in Lawrence, Kansas.Her fight against the energy company PG&E (Pacific Gas and Electric Company) garnered worldwide attention when her story was turned into a 2000 biography film which chronicled her fierce efforts in the case.rin Brockovich was born on June 22, 1960 in Lawrence, Kansas. Her fight against the energy company PG&E (Pacific Gas and Electric Company) garnered worldwide attention when her story was turned into a 2000 biography film which chronicled her fierce efforts in the case."
780,msmarco,_doc,MARCO_6068215,3.7451305,"Royal Navy Commander James Bond, CMG, RNVR, is a fictional character created by British journalist and novelist Ian Fleming in 1953.He is the main protagonist of the James Bond series of novels, films, comics and video games.Fleming wrote twelve Bond novels and two short story collections before his death, although the last two books — The Man with the Golden Gun and Octopussy and The Living Daylights — were published posthumously.e is the main protagonist of the James Bond series of novels, films, comics and video games. Fleming wrote twelve Bond novels and two short story collections before his death, although the last two books — The Man with the Golden Gun and Octopussy and The Living Daylights — were published posthumously."
781,msmarco,_doc,MARCO_8274522,3.743171,"Samples mailed from within the United States are typically received within 2-4 weeks; international sample return time can vary. Step 3: Sample received at the lab. You will receive an email when your sample is received at the lab. Once a sample is received, it enters the queue for processing.amples mailed from within the United States are typically received within 2-4 weeks; international sample return time can vary. Step 3: Sample received at the lab. You will receive an email when your sample is received at the lab. Once a sample is received, it enters the queue for processing."
782,msmarco,_doc,MARCO_2536379,3.7377093,"As Indian Summers begins, the stories of promises, secrets, politics, power, sex and love play out as the British Raj begins to falter and a nation opens its eyes to the possibilities of freedom. Filming will take place this summer with the series due to be broadcast on Channel 4 and MASTERPIECE on PBS in 2015.Indian Summers is the first Channel 4 commission from New Pictures. It is a coproduction with MASTERPIECE on PBS in the U.S. It is created and written by Paul Rutman (Vera).s Indian Summers begins, the stories of promises, secrets, politics, power, sex and love play out as the British Raj begins to falter and a nation opens its eyes to the possibilities of freedom. Filming will take place this summer with the series due to be broadcast on Channel 4 and MASTERPIECE on PBS in 2015."
783,msmarco,_doc,MARCO_6715821,3.7377093,"Developed alongside the major motion CG-animated picture coming to theatres in 2016, Ratchet & Clank (PS4) marks the PlayStation 4 debut of PlayStation’s greatest heroes. Join Ratchet, Clank, Captain Qwark and new friends as they battle to save the Solana Galaxy from the evil Chairman Drek.With an hour of new cinematics (including footage from the film), Ratchet & Clank (PS4) takes a deeper look at the characters’ origin stories and modernizes the original gameplay.oin Ratchet, Clank, Captain Qwark and new friends as they battle to save the Solana Galaxy from the evil Chairman Drek. With an hour of new cinematics (including footage from the film), Ratchet & Clank (PS4) takes a deeper look at the characters’ origin stories and modernizes the original gameplay."
784,msmarco,_doc,MARCO_7591935,3.7374349,"Of the prequel trilogy films, The Phantom Menace received three Oscar nominations, while Attack of the Clones and Revenge of the Sith received one nomination each. Star Wars: The Force Awakens has smashed box office records since its release a week ago, with a global box office take of US$529 million."
785,msmarco,_doc,MARCO_1147904,3.7316236,"List of awards and nominations received by Emma Thompson. This is a list of awards and nominations received by actress and screenwriter Emma Thompson. Among her awards, Thompson has won two Oscars, three BAFTAs, two Golden Globes and an Emmy. 1 Film awards 1.1 Academy Awards. 1.2 BAFTA Awards."
786,msmarco,_doc,MARCO_7506637,3.7303157,"1 2 3 4 5 6 7 8 9 10 -/10 X. (awaiting 5 votes). Reviews: write review. Made for the Mumbai leg of the 48 Hour Film Project, 2011 in 48 hours Smoking is injurious to health is the story of Ranbir and Gauri. Its an ill timed visit back home that forces Ranbir to revisit his past.Singh Taranjeet. 2 3 4 5 6 7 8 9 10 -/10 X. (awaiting 5 votes). Reviews: write review. Made for the Mumbai leg of the 48 Hour Film Project, 2011 in 48 hours Smoking is injurious to health is the story of Ranbir and Gauri. Its an ill timed visit back home that forces Ranbir to revisit his past."
787,msmarco,_doc,MARCO_3703502,3.7239156,"'Aladdin' may fly onto Broadway. Aladdin may be the latest Disney musical to fly onto Broadway, according to PerezHilton.com. Alan Menken, the Oscar and Tony-winning composer of the animated film, reportedly says a Broadway run of Aladdin is in the works.Based on the smash-hit 1992 animated film, Aladdin is the story of a street urchin who uses the help of a magic lamp Genie to win the heart of Princess Jasmine.The musical features music by Menken, lyrics by Tim Rice and the late Howard Ashman and a new book by Chad Beguelin (Elf, The Wedding Singer).Menken won an Academy Award for his s core and shared a second Oscar with Rice for the song A Whole New World, sung in the film by Brad Kane and Tony winner Lea Salonga.he musical features music by Menken, lyrics by Tim Rice and the late Howard Ashman and a new book by Chad Beguelin (Elf, The Wedding Singer). Menken won an Academy Award for his s core and shared a second Oscar with Rice for the song A Whole New World, sung in the film by Brad Kane and Tony winner Lea Salonga."
