,_index,_type,_id,_score,_source.body
719,msmarco,_doc,MARCO_7738320,4.672283,- Venetian Bronze In Color. I would have to say this is the biggest color seller for years. Very close to the oil rubbed bronze color. 1 2 3 [NEXT>>] 1644-1VB-P Knob Venetian Bronze Baroque Collection.
720,msmarco,_doc,MARCO_10592,4.671307,"Bronze corydoras. The bronze corydoras (Corydoras aeneus), green corydoras, bronze catfish, lightspot corydoras or wavy catfish is a tropical freshwater fish in the armored catfish (Callichthyidae) family often kept in captivity by fish keepers."
721,msmarco,_doc,MARCO_1338563,4.671307,"Now choose the best coated acoustic guitar strings for you: Acoustic Phosphor Bronze with NANOWEB Coating. Acoustic Phosphor Bronze with NANOWEB Coating. For distinctive Phosphor Bronze tone, full of warmth and sparkle, with the feel more like that of a traditional string."
722,msmarco,_doc,MARCO_1515356,4.671307,The noun BRONZE has 2 senses: 1. an alloy of copper and tin and sometimes other elements; also any copper-base alloy containing other elements in place of tin. 2. a sculpture made of bronze. Familiarity information: BRONZE used as a noun is rare.
723,msmarco,_doc,MARCO_1950938,4.671307,"Finally, additions in bronze might be added such as spears, swords, helmets, jewellery, and diadems, and some statues even had a small bronze disc (meniskoi) suspended over the head to prevent birds from defacing the figure. The other favoured material in Greek sculpture was bronze."
724,msmarco,_doc,MARCO_2248444,4.671307,"Copper and bronze do not contain any iron, and only iron can rust (because rust is defined as iron oxide, a compound of iron and oxygen); so the answer is that steel will rust the fastest and copper and bronze will never 'rust'. But, yes, copper and bronze do tarnish, they do corrode."
725,msmarco,_doc,MARCO_3208396,4.671307,"Bronze is one of the hardest metals to figure out what it is and how to sell it correctly is not much easier. If it has any type of plastic, steel, caulk, or non-bronze attachment you will have a very hard time selling it to Rockaway Recycling for anything except a brass price. Some places that you would be able to find bronze:"
726,msmarco,_doc,MARCO_2579269,4.671307,"Brass is usually made up of copper and zinc. Some alloys are called bronze when they are actually brass, such as commercial bronze which is made from copper and zinc. Other metals may also be added, but if the main addition is tin, it's a bronze, and if the main addition is zinc, it's a brass."
727,msmarco,_doc,MARCO_5914258,4.671307,"IIII love clinique prducts, this is more a of a pink-bronze instead of pink bronze, no brownish gold, it's a different kind bronze, This is not whazt I expected. The colour is nice,a nd this is a differnet lipstick with the newest silver tube and a bamboo like cover-top."
728,msmarco,_doc,MARCO_5918105,4.671307,"Bronze, or bronze-like alloys and mixtures, were used for coins over a longer period. Bronze was especially suitable for use in boat and ship fittings prior to the wide employment of stainless steel owing to its combination of toughness and resistance to salt water corrosion."
729,msmarco,_doc,MARCO_7932009,4.671307,"Our bells are made from pure bell bronze. The words brass and bronze are often used interchangeably, but they are very different metals. Comparatively, brass is a very soft metal. For example, it is used for plumbing fixtures because it is easy to work with and easily tooled. Brass is not as hard as bronze."
730,msmarco,_doc,MARCO_7964852,4.671307,"I suspect you will hear from several people about the comment in the last The E-Sylum about Copper vs Bronze vs Brass, in which Dick Johnson wrote that bronze is copper mixed with zinc. Though these metals do cause numismatists a lot of trouble, he is dead wrong about bronze and zinc."
731,msmarco,_doc,MARCO_992502,4.670332,Bronzer has to stay on the skin for several hours after applied. This is because bronzers continue to penetrate and darken the skin for up to eight hours after application. Remember to do a thorough hand washing after applying a tanning lotion with bronzer to ensure that palms don't turn orange.
732,msmarco,_doc,MARCO_3521758,4.670332,"Unfortunately, there isn’t a “magic solution” to getting out of Bronze. Because Bronze is the lowest tier, there will inevitably be great discrepancies between the skill levels of Bronze players. At this level of play, communication and teamwork skills are usually…lacking…at best."
733,msmarco,_doc,MARCO_3455915,4.670332,"Claudia was able to re-create Paracelsus' time machine and Pete and Myka went back in time to bronze Paracelsus before he could kill the Warehouse 9 Regents and alter history. After he was bronzed, Pete hid the bronzed Paracelsus inside the Warehouse."
734,msmarco,_doc,MARCO_5925963,4.670332,"Bronze is typically 88% copper and 12% tin.[5] Alpha bronze consists of the alpha solid solution of tin in copper. Alpha bronze alloys of 4–5% tin are used to make coins, springs, turbines and blades."
735,msmarco,_doc,MARCO_2755958,4.669358,"Several types of bronze are used, commonly B20 bronze, which is roughly 20% tin, 80% copper, with traces of silver, or the tougher B8 bronze which is made from 8% tin and 92% copper. As the tin content in a bell or cymbal rises, the timbre drops."
736,msmarco,_doc,MARCO_1001587,4.669358,"Vases Vases are a very important accessory for a memorial. Flowers can be secured in a vase instead of leaving them on the ground. Most cemeteries allow vases for Bronze Markers. Vases are made of Bronze, Stainless steel or aluminum. Bronze vases that match the marker material are recommended."
737,msmarco,_doc,MARCO_2085952,4.669358,"It depends on the Bronze Plan in which you enroll as well as your state of residence. For example, in California Bronze Plans have a standardized charge of $60 (or 40% of total cost for HSA Bronze plans) for a primary care visit. In other states, the doctor visit charge is not standardized."
738,msmarco,_doc,MARCO_2533370,4.669358,Bronze can be used for both miniature and monument with different casting technique: lost wax casting and sand casting. The cost of bronze casting lies between of casting aluminum and stainless steel. One of best upside of bronze is it can cast sculpture with the finest details and texture.
739,msmarco,_doc,MARCO_4895261,4.669358,"Greeks used bronze chiefly in the making of the statues. On the other hand, the Romans were chiefly influenced by the Greeks in the use of bronze, but in addition to bronze they used marble and porphyry too in the creation of statues. This is another important difference between the Greek and the Roman statues. Polychrome terracotta was used in the creation of Greek statues."
740,msmarco,_doc,MARCO_6993659,4.669358,"Any alloy, or mixture, of copper and zinc is called brass. Sometimes small amounts of other metals are also included. In ancient times, metalworkers did not know the difference between zinc and tin, which when alloyed with copper makes bronze. As a result, both brass and bronze were for a time believed to be bronze."
741,msmarco,_doc,MARCO_6042293,4.669358,"Bronze David. Made in the 1440’s, by Donatello (1386-1466), Bronze David is one of the most famous sculptures today. It is notable as the first unsupported standing work in bronze cast during the Renaissance period, and the first freestanding nude male sculpture made since antiquity."
742,msmarco,_doc,MARCO_7847118,4.669358,"Headstone Materials: Bronze and Granite. Headstones are always manufactured with the intent to withstand the elements for many years (even centuries). The two most common materials for headstones today are granite and bronze. While most headstones are made of granite, bronze has become quite a popular option for memorial use in recent years."
743,msmarco,_doc,MARCO_7856626,4.669358,"What's that makeup stars wear that makes their cheeks glow? What's the makeup the stars wear that makes their face, or rather their cheeks, so shiny with a nice glow? If it's a bronzer, why is it so pink and shiny? Isn't bronzer supposed to be tan looking? A.B. Replies: Let's get something straight about bronzer."
744,msmarco,_doc,MARCO_2739820,4.668828,"1 Dark Ages (historiography), the period in Europe following the collapse of the Western Roman Empire. 2  European Middle Ages (5th to 15th centuries AD), particularly: 3  European Early Middle Ages.  Migration Period of c. 400 to 800 AD."
745,msmarco,_doc,MARCO_2322559,4.668828,"It began with the collapse of the Western Roman Empire and merged into the Renaissance and the Age of Discovery. The Middle Ages is the middle period of the three traditional divisions of Western history: Antiquity, Medieval period, and Modern period. The Medieval period is itself subdivided into the Early, the High, and the Late Middle Ages."
746,msmarco,_doc,MARCO_640020,4.6683846,"Bronzes are unquestionably the most versatile class of bearing materials, offering a broad range of properties from a wide selection of alloys and compositions. This data sheet describes the most used standard bearing bronzes and is aimed at helping the designer select the right bronze for the job at hand."
747,msmarco,_doc,MARCO_2841138,4.6683846,"Generally, bronze is considered as a copper- tin alloy. Also, copper aluminum alloys and copper silicon alloys are called bronze. Bronze can also be classified based on other alloying elements. Lead, Zinc, Phosphorous, Aluminum, Silicon, and Silver are the additional alloying elements."
748,msmarco,_doc,MARCO_4217615,4.6683846,"So, I'm going to set the record straight and give you the straight scoop on the care and cleaning of bronze sculptures. First, it is important to point out that bronze is a copper alloy (a metal created by the combination of other metals). In the United States the minimum copper content for bronze is 90%."
749,msmarco,_doc,MARCO_1563201,4.6683846,"1 Bronze, on the other hand, is an alloy of copper with another metal, usually tin. 2  Originally, brass and bronze were considered to be distinct alloys, but in modern usage, brass is any copper alloy. 3  You may hear brass cited as a type of bronze or vice versa."
750,msmarco,_doc,MARCO_1570347,4.6683846,"Nineteenth century trivets are primarily made of cast iron. Other old trivets are made from brass, an alloy of copper and zinc, and bronze, an alloy of copper and tin. Bronze trivets were made mostly from about 1850 to 1900. It is very doubtful any bronze trivets were cast in this century."
751,msmarco,_doc,MARCO_2720305,4.6683846,"Luding-Rothenburger is the only athlete to ever win medals in both Winter and Summer Games in the same year. Clara Hughes, Canada—Individual Road Race Cycling bronze and Individual Time Trial Cycling bronze (1996) and 5,000 m Speed Skating bronze (2002)."
752,msmarco,_doc,MARCO_6594773,4.6683846,This craze is the amount of lotions now being sold that contain bronzers. It is not uncommon for a tanning lotion to contain 4 or 5 high end bronzer ingredients. Using lotions that contain a bronzer is a way to get better results from your tanning experience and to greatly increase the length of your tan.
753,msmarco,_doc,MARCO_7738316,4.6683846,"As shown above, the old antique is a solid brown representation of oil-rubbed bronze. Our Venetian bronze, the most recent finish added to the Cliffside line, is also oil-rubbed bronze, but it contains a light wash of copper. On pieces with more detailing or raised edges, the copper is more prominent."
754,msmarco,_doc,MARCO_7180686,4.6683846,"Bronze welding: Due to its low melting point, bronze is used as a filler in heterogenous welding of other metals.http://www.meg.co.uk/courses/21.php. Machine elements: Due to low friction, bronze is used for piston and rotor liners (specially in electric motors) and springs."
755,msmarco,_doc,MARCO_1832172,4.6674123,"Bronze is one of the earliest metals known to man. It is defined as an alloy made of copper and another metal, usually tin. Compositions vary, but most modern bronze is 88% copper and 12% tin. Bronze may also contain manganese, aluminum, nickel, phosphorus, silicon, arsenic, or zinc."
756,msmarco,_doc,MARCO_2085951,4.6674123,"Bronze plan premiums. Bronze plans have the lowest premium rates of the four new types of metal plans since they charge the highest out-of-pocket costs. However, there may be instances where the Silver Plan for one insurance company may charge a lower premium than the Bronze Plan of another insurance company."
757,msmarco,_doc,MARCO_2611069,4.6674123,"Use it with. A classic bronzer with a light texture and natural finish. Terracotta Bronzing Powder creates a natural-looking bronzed look. Warm or enhance your natural complexion with this fine powder, enriched with hydrating ingredients so that it go on seamlessly, never leaving behind any orange coloring, lines, or marks."
758,msmarco,_doc,MARCO_2841134,4.6674123,"Simply put: An alloy of copper and tin is called bronze. An alloy of copper and zinc is called brass. In practice, it is more complicated. For appearance of different brasses and bronzes look here: http://www.metalreference.com/Fo... For composition look here (search for brass or bronze): Page on copper.org."
759,msmarco,_doc,MARCO_5772458,4.6674123,"bronze casting definition, bronze casting meaning | English dictionary. bronze. n any of various hard corrosion-resistant alloys containing copper, tin (2--8 per cent), and phosphorus (0.1--0.4 per cent): used in gears, bearings, cylinder casings, etc."
760,msmarco,_doc,MARCO_5942615,4.6674123,"Bronze is a dark metal made from an alloy of copper and tin. Bronze was one of the earliest and most useful metals discovered by mankind. It was harder than copper, stone or wood and could be made into weapons, containers and tools. Bronze is still widely used today to make statues, door handles and jewelry."
761,msmarco,_doc,MARCO_4203923,4.666889,"The Middle Ages or Medieval period is a stretch of European history that lasted from the 5th until the 15th centuries. It began with the collapse of the Western Roman Empire, and was followed by the Renaissance and the Age of Discovery. The Middle Ages is the middle period of the traditional division of Western history into Classical, Medieval, and Modern periods."
762,msmarco,_doc,MARCO_721133,4.666441,The price of scrap bronze per pound/per ounce is going to vary based on the type of alloy and the state of the market. There are also many scrap companies that buy and sell at different prices. Brass plumping will sell for about $.90 to $1.00 per pound. Some bronze buyers buy bronze at $1.28 per pound.
763,msmarco,_doc,MARCO_992498,4.666441,"A bronzer is a sunless tanning solution that involves a spray-on procedure. Used in tanning salons, it is used in most cosmetic stores depending on the type of bronzer. It is a fast and effective way to get a golden bronze color without staying under the sun for too long or taking the risk of skin damage caused by using a tanning bed."
764,msmarco,_doc,MARCO_2282665,4.666441,"Brass vs. Bronze. Brass and Bronze are metal alloys used extensively in everyday objects. While brass is an alloy of copper and zinc, bronze is an alloy consisting mainly of copper, combined most often with tin, but at times also with other metals. Owing to their properties, these two alloys have various uses. 1 Properties."
765,msmarco,_doc,MARCO_2558396,4.666441,"If you are swaying between cream based bronzers and don't know which one to pick I say go for the Bourjois Bronzing Primer - it is far easier to use, gives a natural hint of colour and gives the user far more bang for their buck in terms of uses. Bourjois Bronzing Primer £9.99/18ml via Superdrug - link."
766,msmarco,_doc,MARCO_3283916,4.666441,"Bronze Family: Leaded Commercial Bronze. C 314 Commercial Bronze is a METALCO standard alloy and finds use in hardware applications, electrical applications, as well as fasteners and industrial applications. Uses include various electrical connectors, screws and nuts, pickling crates, fixtures and racks."
767,msmarco,_doc,MARCO_2875689,4.666441,"Tuned to the same pitch as a violin in a G-D-A-E, the mandolin is played, or chopped, for chordal accompaniment or played with tremolo. To complement both methods, we carry phosphor bronze, 80/20 bronze, stainless steel, silk & steel and silk and bronze wound mandolin strings."
768,msmarco,_doc,MARCO_4728196,4.666441,"Bronze came to Greece slowly around 3000 BC and did not make much difference right away. Those same Dimini people from the Neolithic continued living in Greece, but they slowly started to use a little bronze. Bronze knives and swords were much easier to make and sharper than stone, bone or wood ones."
769,msmarco,_doc,MARCO_4858422,4.666441,"Coming to the materials, bronze and granite headstones are quite popular these days as they are durable and easy to maintain. Some bronze headstones may be available with a bronze flower vase as well. In addition, the headstone can be rectangular, round, or semi-circular. Certain cemeteries have some specifications about aspects like the headstone size, type, color, and even symbols that they allow."
770,msmarco,_doc,MARCO_6756754,4.666441,$0.06/Bead. This beautiful necklace features our 21x28mm Antique Bronze Round Sun Connectors. It also has our 12x9mm glass crystal rondelles along with 10mm purple crazy lace agate and antique bronze beads and findings. 23x15mm Antique Bronze Square Connectors (Pack of 4).
771,msmarco,_doc,MARCO_280653,4.6654706,This is an alloy that can cover both brass and bronze (red silicon brasses and red silicon bronzes). They typically contain 20% zinc and 6% silicon. Red brass has high strength and corrosion resistance and is commonly used for valve stems. Red bronze is very similar but it has lower concentrations of zinc.
772,msmarco,_doc,MARCO_344930,4.6654706,"bronze. 1. An alloy of copper and tin, sometimes with small amounts of other metals. Bronze is harder than brass and is used both in industry and in art.2. An alloy of copper and certain metals other than tin, such as aluminum.ronze. 1. An alloy of copper and tin, sometimes with small amounts of other metals. Bronze is harder than brass and is used both in industry and in art."
773,msmarco,_doc,MARCO_992499,4.6654706,"As you’re applying bronzer, you’ll want to focus on covering the areas of your face that sunlight tends to hit. Do a final dusting of your bronzer on the higher points of your face, such as the bridge of your nose and your chin. Complete the natural glow by applying bronzer to your neck so that it matches the coloring of your face."
774,msmarco,_doc,MARCO_1645726,4.6654706,"To jason1944:<br />. Bell metal IS bronze. That is it's definition.<br />. Bronze is an alloy of copper and tin.<br />. abby1965 has the correct answer:<br />. Bronze (bell metal) is used because it has the best sound,<br />. tone, and resonance as well as multiple harmonics.<br />. The tone and vibrato are gorgeous.<br />."
775,msmarco,_doc,MARCO_1828127,4.6654706,19th Century Grand Tour Bronze Bust of Apollo Belv... Antique Late 19th Century European Classical Greek Sculptures. Bronze. A bronze Grand Tour model of Apollo Belvedere or the Pythian Apollo cast after the Apollo sculpture famously housed at the Vatican.
776,msmarco,_doc,MARCO_2647062,4.6654706,"The first long gallery of the exhibition contains Shang ritual bronze containers, two bronze axes, an enormous bell and a bronze drum. The three- and four-legged cauldrons and cups were designed to heat wines and cereals. The handles and the capped posts on the rims may have been used to lift the vessels from the fire."
777,msmarco,_doc,MARCO_2985185,4.6654706,"Five athletes have won four medals: the USA's Lisa Leslie (four gold), the Soviet Union's Gennadi Volnov (one gold, two silver, one bronze) and Sergei Belov (one gold, three bronze), and Australians Kristi Harrower and Lauren Jackson (both with three silvers and one bronze)."
778,msmarco,_doc,MARCO_4961758,4.6654706,"bronze. 1. An alloy of copper and tin, sometimes with small amounts of other metals. Bronze is harder than brass and is used both in industry and in art.2. An alloy of copper and certain metals other than tin, such as aluminum.. bronze-an alloy of copper and tin and sometimes other elements; also any copper-base alloy containing other elements in place of tin."
779,msmarco,_doc,MARCO_5772457,4.6654706,Definition of bronze. 1  1a : an alloy of copper and tin and sometimes other elementsb : any of various copper-base alloys with little or no tin. 2  2 : a sculpture or artifact of bronze. 3  3 : a moderate yellowish brown. 4  4 : a bronze medal awarded as the third prize in a competition.
780,msmarco,_doc,MARCO_5889907,4.6654706,The Bronze Star Medal is a 1 ½ inch in circumscribing width star made of Bronze. Overlaid in the middle of the star is a 3/16-inch wide bronze star. All rays of both stars come together at their center line. HEROIC OR MERITORIOUS ACHIEVEMENT is engraved on the reverse side.
781,msmarco,_doc,MARCO_7834861,4.6654706,"Bronzer/Powder Brush. Soft, full and rounded, this brush can be used for both compact powder and bronzer. The bristles pick up the perfect amount of colour and distribute flawlessly onto the skin. Load your brush with the powder and shake away any excess before sweeping onto the skin. Pictured: Laura Mercier Bronzer Brush."
782,msmarco,_doc,MARCO_8084621,4.6654706,"The winners of the Men's Super-G Alpine Skiing event in the Sochi 2014 Winter Olympics are Kjetil Jansrud (gold), Andrew Weibrecht (silver), Jan Hudec (bronze), and Bode M … iller (bronze). Two bronze medals were awarded due to a tie."
783,msmarco,_doc,MARCO_7551175,4.6654706,"Shower Fixture Finishes. Showerheads, handles and valve controls come in a many finishes including polished chrome, brushed chrome, polished nickel, brushed nickel, hammered nickel, stainless steel, bronze, brushed bronze, oil-rubbed bronze, polished brass, black and white."
784,msmarco,_doc,MARCO_8335522,4.6649523,"When incomes are broken down by age group, the real pattern emerges: Different age groups at different points in their careers earn different amounts of money, on average. And when you collapse all this information into a single average value, higher earning cohorts, such as the 45-54 age group, pull the average higher."
785,msmarco,_doc,MARCO_1302800,4.6645007,"Ultra Rapid Dark Bronzers feature a special blend of DHA, Cosmetic Bronzers and antioxidants to help promote the ultimate bronze glow in a shorter amount of time. Goji Berry, high in Vitamins A and E, helps calm and moisturize skin while helping fight against free radicals."
786,msmarco,_doc,MARCO_1337872,4.6645007,"Payments and out-of-pocket costs. 1  Bronze plans: lower monthly payments, but higher out-of-pocket costs. 2  Silver plans: monthly payments lower than a gold plan, but more than bronze. Your out-of-pocket costs will be less than a bronze plan, but more than a gold plan, unless you're eligible for cost sharing reduction."
787,msmarco,_doc,MARCO_1839044,4.6645007,"Find out what bronze is made up of with fun facts from dk find as it a mixture two metals, technically known an alloy metal. Difference between brass and bronze youtube. Apr 25, 2017 ancient bronze was usually made up of copper, tin and small amounts noble metals or lead."
788,msmarco,_doc,MARCO_6044391,4.6645007,"When you're shopping at the drugstore, hold the bronzer up to your face and look in a mirror. Celebrity makeup artist Joanna Schlip explains, a bronzer novice should only go two shades darker than her skin tone.. This printed powder is super-sexy, but looks subtle when you wear it. Dolce & Gabbana Animalier Bronzer,"
789,msmarco,_doc,MARCO_7946262,4.6645007,"The bronze David. Donatello's bronze statue of David (circa 1440s) is famous as the first unsupported standing work of bronze cast during the Renaissance, and the first freestanding nude male sculpture made since antiquity. It depicts David with an enigmatic smile, posed with his foot on Goliath's severed head just after defeating the giant."
790,msmarco,_doc,MARCO_7508559,4.6645007,"Bronze Stars on a World War II Campaign Ribbon Each bronze star on the ribbon of a campaign medal or ribbon bar represents a campaign that the wearer served in. When the wearer has been in five campaigns they turn in the four bronze stars & replace it with a silver star, silver represents five c…."
791,msmarco,_doc,MARCO_8491767,4.6645007,"Bronze Award. Welcome to the Girl Scout Bronze Award, the highest honor a Girl Scout Junior can achieve. As you and your team plan and complete your project, you'll meet new people and have the kind of fun that happens when you work with other Girl Scouts to make a difference. Download the. Bronze Award guidelines."
792,msmarco,_doc,MARCO_640011,4.6635323,"The shift from bronze to iron was much more complicated and nuanced. On a purely practical level, bronze makes better weapons than (pure) iron. Bronze has a Vicker's hardness (HV) of about 300, while pure iron is closer to 100HV. Practically speaking, that means that iron weapons are more difficult to keep sharp and are more likely to bend."
793,msmarco,_doc,MARCO_2611067,4.6635323,"The powder’s unique fragrance is a joyful blend of bergamot and mandarin blended with sunny, feminine notes of gardenia—and the woody, vanilla notes create a hint of mystery. A classic bronzer with a light texture and natural finish. Terracotta Bronzing Powder creates a natural-looking bronzed look."
794,msmarco,_doc,MARCO_2611070,4.6635323,"The powder’s unique fragrance is a joyful blend of bergamot and mandarin blended with sunny, feminine notes of gardenia—and the woody, vanilla notes create a hint of mystery. What it is: A classic bronzer with a light texture and natural finish. What it does: Terracotta Bronzing Powder creates a natural-looking bronzed look."
