,_index,_type,_id,_score,_source.body
218,msmarco,_doc,MARCO_4753706,5.3966427,"Let's look at the evidence in Elvis Presley's death. Elvis was found on his bathroom floor, face down in front of the toilet. It was apparent he'd instantly collapsed from a sitting position and there was no sign of a distress struggle or attempt to summon help."
219,msmarco,_doc,MARCO_5273725,5.3946886,"Most of these cloud cores have IR sources, evidence of energy from collapsing protostars (potential energy converted to kinetic energy). Also, where we do find young stars (see below) we find them surrounded by clouds of gas, the leftover dark molecular cloud."
220,msmarco,_doc,MARCO_4425846,5.3927364,"But no evidence exists that flooding destroyed the city, and the city wasn't totally abandoned, Kenoyer says. And, Possehl says, a changing river course doesn't explain the collapse of the entire Indus civilization. Throughout the valley, the culture changed, he says."
221,msmarco,_doc,MARCO_3084725,5.390786,Evidence also indicates that Caracol survived the initial collapse of the Maya civilization. Caracol is located in the foothills of the Maya Mountains about 25 miles south of Xunantunich in Belize's Cayo District. Latitude: 16°45'50.40N/Longitude: 89° 7'8.76.
222,msmarco,_doc,MARCO_4216660,5.390786,"Fall of the Soviet Union. In December of 1991, as the world watched in amazement, the Soviet Union disintegrated into fifteen separate countries. Its collapse was hailed by the west as a victory for freedom, a triumph of democracy over totalitarianism, and evidence of the superiority of capitalism over socialism."
223,msmarco,_doc,MARCO_4713674,5.388838,"There is no evidence of a market collapse or insurance death spiral.”. The second problem is that Ryan doesn’t seem to understand what “insurance” means. Look at that quote again: “The whole idea of Obamacare is … the people who are healthy pay for the people who are sick.” Well, yes."
224,msmarco,_doc,MARCO_7175681,5.388838,We report ultrastructural evidence of epithelial necrosis and alveolar collapse in a patient with usual interstitial pneumonia (UIP). These changes were focal and confined to small areas characterized histologically by aggregates of interstitial fibroblasts embedded within a myxoid stroma (fibroblastic foci).
225,msmarco,_doc,MARCO_8412950,5.3868914,"His book on the topic is self-recommending.) Critics of sweatshops point to the 1,000+ people killed and 2,500+ people injured by the collapse of the Rana Plaza sweatshop in Bangladesh in 2013. This was indeed grotesque, and evidence of the poor conditions that many sweatshop workers have to work in. But what is their next-best alternative?"
226,msmarco,_doc,MARCO_8677850,5.3868914,"Researchers have known for years that the Arctic landscape is being transformed by rising temperatures. Now, scientists are amassing growing evidence that major events precipitated by warming — such as fires and the collapse of slopes caused by melting permafrost — are leading to the loss of tundra in the Arctic."
227,msmarco,_doc,MARCO_2228018,5.384947,"However, bilateral scapholunate advanced collapse being the foremost etiology in our patient group, is not a new pathology, as findings of bilateral SLAC wrist on a prehistoric skeleton from Hassi-el-Abiod site in Malian Sahara provide paleopathological evidence of the existence of this disease 7,000 years ago."
228,msmarco,_doc,MARCO_8089788,5.384947,"That is borne out by all of the major pieces of evidence about the fires. 1  Flames. In the North tower, flames were visible for the duration of the 102 minutes between its jet impact and its explosive collapse. 2  Smoke. The North Tower's fires produced prodigious quantities of smoke. 3  Survivors."
229,msmarco,_doc,MARCO_3261095,5.3810635,"Kick 'em Jenny, a historically active submarine volcano 8 km off the north shore of Grenada, rises 1300 m from the sea floor. Recent bathymetric surveys have shown evidence for a major arcuate collapse structure that was the source of a submarine debris avalanche that traveled more than 15 km to the west."
230,msmarco,_doc,MARCO_4727426,5.3810635,"After the 1987 collapse of his empire, he said he had been betrayed by other televangelists. Naturally, Bakker adds variations on these themes in his tell- all memoir, “I Was Wrong.” But one of its most intriguing details is evidence of yet another conspiracy that he doesn’t want to discuss. Note this angry passage in Bakker’s remarks as he resigned as PTL’s president."
231,msmarco,_doc,MARCO_3444351,5.3791246,New survey evidence that we collected in Argentina during the early stages of the country’s presidential election sheds light on the political calculus underlying the peso’s recent collapse. In the summer of 2015 we fielded a series of survey questions in the nationally representative Argentine Panel Election Study.
232,msmarco,_doc,MARCO_1369562,5.3771877,"Minoan Culture Survived Ancient Volcano, Evidence Shows. Published: November 28, 1989. A LONGSTANDING theory of archeology, linking a devastating volcanic eruption to the sudden collapse of the Minoan civilization at its peak of splendor, has apparently been demolished by new excavations on a tiny island off the north coast of Crete."
233,msmarco,_doc,MARCO_1800422,5.3771877,"There is evidence to indicate the Big Bang may have resulted from another, earlier universe collapsing in on itself, rather than from expanding from a point on infinitely hot and dense material. Instead, the universe appears to be going through constant phases of expansion (as it is at present) and contraction in a never-ending cycle. This theory of universe formation, known as the Big Bounce, was first proposed almost a century ago."
234,msmarco,_doc,MARCO_8410415,5.3771877,"ii. Electromagnetic Pulse: Effects on the U.S. Power Grid iii Figure 1. Areas of Probable Power System Collapse. In addition to causing the immediate damage and failure of transformers, there is also evidence that GIC may be responsible for the onset of long-term damage to transformers and other key power grid assets."
235,msmarco,_doc,MARCO_6177640,5.3713875,"A bronchoscopy is a test that allows doctors to examine your airways. An instrument called a bronchoscope is threaded through your nose and down your throat to reach your lungs.ronchoscopy can be used to diagnose lung disease, tumors, chronic cough, or an infection. Your doctor may order a bronchoscopy if you have an abnormal chest X-ray or CT scan that shows evidence of an infection, a tumor, or a collapsed lung."
236,msmarco,_doc,MARCO_941991,5.3675303,A bedside IVC ultrasound was performed to assess volume status in setting of dehydration. The IVC was identified in longitudinal access. The IVC was flat with over 50% collapse with respirophasic measurements. There was evidence of volume depletion and fluid tolerance. A bedside IVC ultrasound was performed to assess volume status in setting of fluid overload. The IVC was identified in longitudinal access.
237,msmarco,_doc,MARCO_1261960,5.3636804,"Times, Sunday Times (2016)Firefighters' rescue efforts were hampered by the collapse of the roof and widespread clutter inside the building. Times, Sunday Times (2016)That was another line that often hampered flirting. Times, Sunday Times (2008)Photograph the evidence and win a hamper of organic food. Times, Sunday Times (2007)The search has been hampered by a lack of fuel for a rescue helicopter."
238,msmarco,_doc,MARCO_6177645,5.3636804,"Bronchoscopy Procedure. Once you are relaxed, your doctor will insert the bronchoscope (a thin, flexible tube) into your nose. The bronchoscope passes from your nose down to your throat until it reaches your bronchi. The bronchi are the airways in your lungs.ronchoscopy can be used to diagnose lung disease, tumors, chronic cough, or an infection. Your doctor may order a bronchoscopy if you have an abnormal chest X-ray or CT scan that shows evidence of an infection, a tumor, or a collapsed lung."
239,msmarco,_doc,MARCO_6896371,5.3636804,Right upper lobe collapse with mucus plugging in the right upper lobe bronchus and its branches. There is no evidence of invasion into the pulmonary vessels. The previously demonstrated right lower lobe nodule is more pronounced with adjacent atelectasis and patchy ground glass opacity. Further non obstructive mucus plugging is seen within the left upper lobe bronchus. There is left basal band atelectasis.
240,msmarco,_doc,MARCO_7608640,5.362809,"to give an appearance of bronze to, by a coating of bronze powder, or by other means; to make of the color of bronze; as, to bronze plaster casts; to bronze coins or medals Bronze (noun) to make hard or unfeeling; to brazen"
241,msmarco,_doc,MARCO_2496442,5.359838,"The Indus Valley Civilization was an ancient civilization located in what is Pakistan and northwest India today, on the fertile flood plain of the Indus River and its vicinity. Evidence of religious practices in this area date back approximately to 5500 BCE.his was a large migration and used to be seen as an invasion, which was thought to be the reason for the collapse of the Indus Valley Civilization, but this hypothesis is not unanimously accepted today. Thus, the Indus Valley Civilization came to an end."
242,msmarco,_doc,MARCO_349732,5.3550115,"Door Corner. Bronze has been the most popular over the last few years, such as Oil Rubbed Bronze and Venetian Bronze. Bronze usually provides a greater contrast, as many homes have white interior doors. Satin and Brushed Nickel is nearly as popular as Bronze, and will probably stick around as a trend longer than Bronze."
243,msmarco,_doc,MARCO_7403992,5.354041,"Bronze sculpture. Bronze is the most popular metal for cast metal sculptures; a cast bronze sculpture is often called simply a bronze. It can be used for statues, singly or in groups, reliefs, and small statuettes and figurines, as well as bronze elements to be fitted to other objects such as furniture. It is often gilded to give gilt-bronze or ormolu."
244,msmarco,_doc,MARCO_3365800,5.348355,"Seamounts and hot spots. Seamounts are individual volcanoes on the ocean floor. They are distinct from the plate-boundary volcanic system of the mid-ocean ridges, because seamounts tend to be circular or conical.A circular collapse caldera is often centered at the summit, evidence of a magma chamber within the volcano.eamounts and hot spots. Seamounts are individual volcanoes on the ocean floor. They are distinct from the plate-boundary volcanic system of the mid-ocean ridges, because seamounts tend to be circular or conical."
245,msmarco,_doc,MARCO_3874536,5.348355,"Despite the evidence of a national catastrophe, support for unemployment relief remained sketchy until FDR introduced the New Deal in 1933. ---- Selected Quotes ----. Quotes regarding Unemployment Statistics during the Great Depression.By Jimmy Carter.hare. Unemployment statistics for the Great Depression show a remarkable collapse in the labor market in just a few years, with recovery that did not take place until the onset of World War II created an industrial demand that brought the economy back to prosperity."
246,msmarco,_doc,MARCO_5948558,5.3482385,"Bronze skin. Bronze skin: Introduction. Bronze skin: Bronzed skin that is seen best at pressure points such as elbows and knees. See detailed information below for a list of 19 causes of Bronze skin, Symptom Checker, including diseases and drug side effect causes. » Review Causes of Bronze skin: Causes | Symptom Checker »."
247,msmarco,_doc,MARCO_7608642,5.347275,"Webster Dictionary(0.00 / 0 votes)Rate this definition: 1  Bronze(adj) an alloy of copper and tin, to which small proportions of other metals, especially zinc, are sometimes added. 2  Bronze(adj) a statue, bust, etc., cast in bronze. 3  Bronze(adj) a yellowish or reddish brown, the color of bronze; also, a pigment or powder for imitating bronze."
248,msmarco,_doc,MARCO_2608560,5.3445415,There is new evidence that the pesticide may be responsible and we want the Environmental Protection Acency to BAN its use in the United States. read petition letter +. A pesticide approved by the Environmental Protection Agency is contributing to Honey Bee Colony Collapse Disorder (CCD).lothianidin is marketed as Poncho by Bayer Crop Science. The chemical was approved for U.S. use in 2003 and German use in 2004. German government researchers have concluded that a bestselling Bayer pesticide is responsible for the recent massive die-off of honeybees across the country.
249,msmarco,_doc,MARCO_5320733,5.3445415,"Historical archaeology examines records from the past that include diaries; court, census, and tax records; deeds; maps; and photographs. Through combining the use of documentation and archaeological evidence, archaeologists gain a better understanding of the past and human behavior. Why is Archaeology Important? The goal of archaeology is to understand how and why human behavior has changed over time. Archaeologists search for patterns in the evolution of significant cultural events such as the development of farming, the emergence of cities, or the collapse of major civilizations for clues of why these events occurred."
250,msmarco,_doc,MARCO_8725984,5.3445415,"Sharmin Akter, who was a quality inspector at New Wave Styles Ltd, survived the Rana Plaza collapse-but her mother did not. My entire year went by looking for my mother's body. My entire year went by looking for my mother's body or a tiny piece of evidence that will tell me what happened to her. I did not lose hope. I spent days going to different hospitals, government offices and the DNA lab trying to find clues. Then finally two months ago I learned where she was finally laid to rest."
251,msmarco,_doc,MARCO_2503280,5.341511,Noun. 1. silicon bronze-a bronze with 2-3% silicon that is resistant to corrosion. bronze-an alloy of copper and tin and sometimes other elements; also any copper-base alloy containing other elements in place of tin.1  Facebook.oun. 1. silicon bronze-a bronze with 2-3% silicon that is resistant to corrosion. bronze-an alloy of copper and tin and sometimes other elements; also any copper-base alloy containing other elements in place of tin.
252,msmarco,_doc,MARCO_1601191,5.3407354,"By the time of the 1985 rise to power of Mikhail Gorbachev, the Soviet Union’s last leader, the country was in a situation of severe stagnation, with deep economic and political problems which sorely needed to be addressed and overcome.Recognizing this, Gorbachev introduced a two-tiered policy of reform.all of the Soviet Union. In December of 1991, as the world watched in amazement, the Soviet Union disintegrated into fifteen separate countries. Its collapse was hailed by the west as a victory for freedom, a triumph of democracy over totalitarianism, and evidence of the superiority of capitalism over socialism."
253,msmarco,_doc,MARCO_7151355,5.3407354,"One theory suggested that a nomadic, Indo-European tribe called the Aryans invaded and conquered the Indus Valley Civilization, though more recent evidence tends to contradict this claim. Many scholars believe that the collapse of the Indus Valley Civilization was caused by climate change. Trade, writing, and seals all but disappeared from the area. Many believe that the decline of the Harappan civilization was a result of Aryan invasions from the north. This theory seems logical because the Aryans came to power in the Ganges Valley shortly after the Indus demise of the Indus Valley Civilization."
254,msmarco,_doc,MARCO_3399037,5.336937,"What is a Notice of Disagreement (NOD)? A Notice of Disagreement (NOD) is what you file when you disagree with the Veterans Administration’s decision. You have the option to have your appeal processed by the Decision Review Officer, or the Traditional Appeal Process. We highly suggest you contact a veterans disability benefits lawyer regarding how to file a Notice of Disagreement. How long do I have to appeal my denial? You have one year to appeal your denial. During that time you will need to be compiling evidence and getting the documents needed to prove your veterans disability benefits appeal. If you have let your appeal period collapse, you have the option to re-apply."
255,msmarco,_doc,MARCO_7508510,5.3338776,"616 US10A Satin bronze, blackened, satin relieved, clear coated Brass, Bronze. “” US11 SAME AS ABOVE Brass, Bronze. 618 US14 Bright nickel plated, clear coated Brass, Bronze Polished Nickel. 619 US15 Satin nickel plated, clear coat Brass, Bronze Brushed/Satin Nickel. 620 US15A Satin nickel plated, blackened, satin relieved, clear coated Brass, Bronze Antique Nickel."
256,msmarco,_doc,MARCO_6207214,5.3331456,- if there is evidence of arthritic change in the lunate fossa and/or proximal involvement of the head of the capitate; Proximal Row Carpectomy. Four-Corner Arthrodesis Versus Proximal Row Carpectomy: A Retrospective Study With a Mean Follow-Up of 17 Years. Proximal row carpectomy: a multicenter study. proximal row carpectomy may not be appropriate for Kienboeck kienböck disease since lunate collapse damages the joint surfaces of the capitate and; - Radius: - technique dorsal longitudinal approach thru the third; - compartment lunate fossa and head of the capitate were inspected for degenerative. changes
257,msmarco,_doc,MARCO_6014058,5.331978,"There are many different bronze alloys, but typically modern bronze is 88% copper and 12% tin. Alpha bronze consists of the alpha solid solution of tin in copper. Alpha bronze alloys of 4–5% tin are used to make coins, springs, turbines and blades.hey are commonly used in architectural applications. Bismuth bronze is a bronze alloy with a composition of 52% copper, 30% nickel, 12% zinc, 5% lead, and 1% bismuth. It is able to hold a good polish and so is sometimes used in light reflectors and mirrors."
258,msmarco,_doc,MARCO_3206856,5.331041,"Dangers of a Collapsed Trachea. Dogs with a tracheal collapse may live a long life without medical intervention. Airflow into the body is restricted, so dogs will pant excessively or gasp for air.Dogs will not be as active as normal and the lack of oxygen can strain the heart and lungs. collapsed trachea is rarely an issue in younger dogs. Most dogs with tracheal health issues develop problems around six or seven years of age. When a dog's trachea collapses, there are a number of symptoms. They include:"
259,msmarco,_doc,MARCO_4277607,5.3300824,"A bronze is an alloy of copper and other metals, most often tin, but also aluminium and silicon. 1  Aluminium bronzes are alloys of copper and aluminium.2  The content of aluminium ranges mostly between 5-11%. 3  Iron, nickel, manganese and silicon are sometimes added. bronze is an alloy of copper and other metals, most often tin, but also aluminium and silicon. 1  Aluminium bronzes are alloys of copper and aluminium. 2  Bell metal. 3  Phosphor bronze. 4  Nickel bronzes, e.g. nickel silver and cupronickel. 5  Speculum metal. 6  UNS C69100."
260,msmarco,_doc,MARCO_7532593,5.3263016,In recent years there has been a craze in the tanning industry. This craze is the amount of lotions now being sold that contain bronzers. It is not uncommon for a tanning lotion to contain 4 or 5 high end bronzer ingredients.Using lotions that contain a bronzer is a way to get better results from your tanning experience and to greatly increase the length of your tan. There are three main types of bronzers. Each gives a slightly different result.n recent years there has been a craze in the tanning industry. This craze is the amount of lotions now being sold that contain bronzers. It is not uncommon for a tanning lotion to contain 4 or 5 high end bronzer ingredients.
261,msmarco,_doc,MARCO_1581146,5.322535,"Beachfront Bronzer kyoumans 2015-06-15T18:29:47+00:00. PURCHASE NOW. Beachfront Bronzer is a bronzing palette which adds a warm glow to any skin tone! Baked on terra cotta tiles, this bronzer compact delivers a matte or shimmer summer flush to forehead, cheeks, or anywhere you fancy a little bit of color!You can also use Beachfront Bronzer to contour your face. Each compact includes a shimmer and matte side that perfectly complement each other.ou can apply Beachfront Bronzer using our Powder Puff Brush any where you feel you need a sun-kissed glow! Some people love to dust this on their eyelids as well for a no-fuss way to add some color to their lids."
262,msmarco,_doc,MARCO_2001966,5.305036,The Bronze Age made life easier for people even though it soon became one of the metals that was used less extensively. Bronze was the first metal that was worked with by many people; copper was not since it was not as durable. Bronze started the science of working with metal.
263,msmarco,_doc,MARCO_2499422,5.3011184,"But it might be logical for it to be gold-plated, as it has to do with the sun. If one were to take something of bronze and coat it with a thin layer of gold somehow (maybe just by hammering thin strips of gold around it; I don't suppose any other techniques were around in the bronze age), would that stop the bronze corroding?"
264,msmarco,_doc,MARCO_4675124,5.2962666,Definition of CIST. : a neolithic or Bronze Age burial chamber typically lined with stone.ADVERTISEMENT. a neolithic or Bronze Age burial chamber typically lined with stone. ADVERTISEMENT.
265,msmarco,_doc,MARCO_801591,5.295256,Schlage Oil Rubbed Bronze: Out of the box Schlage’s oil rubbed bronze looks like a poweder coat or painted brown finish. It has kind of a flat paint texture. The oil rubbed bronze finish is designed to age.
266,msmarco,_doc,MARCO_8646338,5.295256,"Many historians and archaeologists believe that the Minoans, through their ships and Mediterranean trade empire, were highly involved in the Bronze Age's important tin trade (tin being used for manufacture of bronze). The decline of Minoan civilization and the decline in use of bronze tools seem to be correlated."
267,msmarco,_doc,MARCO_2896150,5.2948947,expand/collapse Skin Cancer Information expand/collapse Actinic Keratosis (AK) expand/collapse Treatments for Actinic Keratosis. expand/collapse Actinic Keratosis Warning Signs and Images. expand/collapse What Causes Actinic Keratosis? expand/collapse Why You Should Be Concerned. expand/collapse Ask the Experts.
268,msmarco,_doc,MARCO_7105497,5.294305,"Bronze Age Civilization on the Greek Mainland Bronze Age Civilizations- The Mycenaeans The Mycenaeans are named after the city-state of Mycenae, a palace city and one of the most powerful of the Mycenaean city-states."
269,msmarco,_doc,MARCO_1832174,5.2913575,"Copper is an element, bronze is an alloyed metal containing copper plus one or more additional elements to harden the copper. Traditional Bronze (think literally Bronze Age tools and sculptures) is an alloy of Copper and Tin. Tin by itself is brittle, and copper by itself is soft."
270,msmarco,_doc,MARCO_7964854,5.2913575,"Bronze is an ancient alloy of copper and another metallic element, tin --- not zinc. The Bronze Age was named for the widespread use of this alloy in ancient times, both in Europe and Asia. Coins and objects made bronze, when new, are reddish brown or chocolate brown in color."
271,msmarco,_doc,MARCO_7716915,5.2913575,"Shang Bronzes. Bronze Age art (as opposed to weaponry) began in China around 1700-1500 BCE, as bronze became a widespread substitute for jade, horn, ivory, and stone, in the crafting of high-status objects like ceremonial, ritualistic and feasting vessels."
272,msmarco,_doc,MARCO_8825339,5.2913575,"Confidence votes 2.6K. Bronze is a alloy of copper and tin, but it may also contain phosphorus, manganese, silicon and aluminium. Bronze use was most prominant in the bronze age, where as the name suggests it was used to create nearly all the tools, weapons and luxury items that humans needed at the time."
273,msmarco,_doc,MARCO_6100740,5.290387,"There is no clear consensus on the date for the beginning of the Bronze Age in Great Britain and Ireland. Some sources give a date as late as 2000 BC, while others set 2200 BC as the demarcation between the Neolithic and the Bronze Age."
274,msmarco,_doc,MARCO_7424522,5.290387,"At the end of the century, a British expedition excavated the important Bronze Age town of Phylakopi on Melos. When Crete eventually became independent of Turkish rule in 1898, attention was turned to Bronze Age sites there."
275,msmarco,_doc,MARCO_4728201,5.288431,"The Bronze Age is the second principal period of the three-age Stone-Bronze-Iron system, as proposed in modern times by Christian Juergensen Jürgensen, thomsen for classifying and studying ancient. societies"
276,msmarco,_doc,MARCO_59775,5.2874665,"2300 BC Europe (About 2300 BC) The Bronze Age starts about 2300 BC in Europe. Few tools are made in the beginning, but by 1200 BC bronze has replaced all stone tools. 2000 BC Britain (About 2000 BC) Bronze starts to be worked in Britain."
277,msmarco,_doc,MARCO_2841130,5.2874665,"Bronze is a durable material that ages well. Bronze is a metal alloy produced by blending copper and tin. It can contain between 2% and 20% tin. Other metals, such as iron or pewter, can also be blended with bronze to make them sturdier or to change their color. It is a sturdy, durable metal and is much harder than brass."
278,msmarco,_doc,MARCO_396201,5.286477,The Minoans were a Bronze Age civilization that flourished on the Greek Aegean island of Crete from around 3000 to 1100 BCE.he Minoans were a Bronze Age civilization that flourished on the Greek Aegean island of Crete from around 3000 to 1100 BCE.
279,msmarco,_doc,MARCO_1046042,5.286477,"…to a legendary Greek artist, Daedalus, who is connected in legend both to Bronze Age Crete and to the earliest period of Archaic sculpture in post-Bronze Age Greece. The legends about Daedalus recognize him both as a man and as a mythical embodiment."
