,_index,_type,_id,_score,_source.body
446,msmarco,_doc,MARCO_2558403,4.952809,"What Is a Bronzer? Bronzer is a powder or liquid makeup product applied to the face to give the skin a naturally sun-kissed glow. Bronzers are typically brown and warm-toned. Whether your skin is fair or dark, your bronzer should be one to two shades darker than your natural skin tone."
447,msmarco,_doc,MARCO_7738315,4.952809,"This is especially true when it comes to bronze finishes. Color and other aesthetic qualities of bronze finishes can vary among manufacturers. Most manufactures offer kitchen and bathroom faucets in oil rubbed bronze. Today's oil rubbed bronze faucets is typically black in color, however, this was not always the case."
448,msmarco,_doc,MARCO_7124908,4.952654,"The Trachea (also known as the wind pipe) has cartilage rings on it. This prevents the pipe collapsing on itself. If the trachea did collapse, it would disallow us from breath … ing. Also the trachea might collapse and damage the esophagus (also known as the food pipe) which is behind it.he rings of cartilage strengthen the trachea so that it does not collapse, but remains open so that air can get through it. If It didn't it would collapse in on itself and yo … u would be unable to breathe. 14 people found this useful."
449,msmarco,_doc,MARCO_7447311,4.952654,1 Collapse and Leg pain and Abdominal symptoms (2 causes). 2  Collapse and Leg pain and Abnormal blood test symptoms (2 causes). 3  Collapse and Leg pain and Adrenal gland symptoms (2 causes). 4  Collapse and Leg pain and Back pain (2 causes). 5  Collapse and Leg pain and Back symptoms (2 causes).
450,msmarco,_doc,MARCO_2558401,4.9518375,"The Bourjois Bronzing Primer is a bronzing product but with a difference, unlike the Bourjois Bronze BB Cream this doesn't just add a hint of colour to the skin but actually primes the skin too should you want to apply foundation and/or powder on top. Bourjois also claim that this little bronze pot mattifies the skin and evens out the skin tone."
451,msmarco,_doc,MARCO_2967456,4.9508667,Bronze Wyatt Earp Statue. Ht.32 in. L.31 in. W.17 in. Different word describing our product: life size Statue bronze Statue bronze Statue bronze Figurine Wyatt Statue Wyatt Figurine Cowboy Statue Cowboy Figurine.
452,msmarco,_doc,MARCO_1515353,4.9508667,"Although at one time bronze was any alloy consisting of copper with tin and brass was an alloy of copper with zinc, modern usage has blurred the lines between brass and bronze. Now, copper alloys generally are called brass, with bronze sometimes considered a type of brass. Bronze usually is a golden hard, brittle metal."
453,msmarco,_doc,MARCO_2533371,4.9508667,"Brass is a metal that consists of both copper and zinc. Bronze is a metal that consists of copper and tin. Bronze is the most popular metal for cast metal sculptures or bronze sculptures. Common bronze alloys often have the unusual and very desirable property of expanding slightly just before they set, thus filling the finest details of a mold."
454,msmarco,_doc,MARCO_4772890,4.9507365,"The Trachea (also known as the wind pipe) has cartilage rings on it. This prevents the pipe collapsing on itself. If the trachea did collapse, it would disallow us from breath … ing. Also the trachea might collapse and damage the esophagus (also known as the food pipe) which is behind it.he rings of cartilage strengthen the trachea so that it does not collapse, but remains open so that air can get through it. If It didn't it would collapse in on itself and yo … u would be unable to breathe. + 13 others found this useful. Ansho Yigezu-Ergetu."
455,msmarco,_doc,MARCO_5006242,4.9498973,"He had a helmet of bronze on his head, and he was armed with a coat of mail, and the weight of the coat was five thousand shekels of bronze. 6 And he had bronze armor on his legs, and a javelin of bronze slung between his shoulders. The shaft of his spear was like a weaver’s beam, and his spear’s head weighed six hundred shekels of iron."
456,msmarco,_doc,MARCO_7874760,4.9498973,"When the Romans first started using coins, they made coins from valuable metals such as bronze, gold and silver. The Romans first produced bronze... Ancient Roman coins were made from various materials. When the Romans first started using coins, they made coins from valuable metals such as bronze, gold and silver. The Romans first produced bronze..."
457,msmarco,_doc,MARCO_4217613,4.948929,"So, what I am going to describe here only applies to quality bronze sculptures and statues. The very last step in creating a bronze sculpture is to apply a coat of wax. This is usually done when the metal is still warm and allows for the wax to enter the pores of the bronze. The wax acts as a barrier to the air and humidity that can cause the bronze to oxidize and turn green."
458,msmarco,_doc,MARCO_7447307,4.9488225,1 Leg pain: Introduction. 2  Collapse and Leg pain and Abdominal pain (2 causes). 3  Collapse and Leg pain and Abdominal symptoms (2 causes). 4  Collapse and Leg pain and Abnormal blood test symptoms (2 causes). 5  Collapse and Leg pain and Adrenal gland symptoms (2 causes). 6  Collapse and Leg pain and Back pain (2 causes).
459,msmarco,_doc,MARCO_298823,4.9479613,"Bronze is the most popular metal for top-quality bells, particularly bell metal, which is about 23% tin. Nearly all professional cymbals are made from a bronze alloy. The alloy used in drum kit cymbal bronze is unique in the desired balance of durability and timbre. Phosphor bronze is also used in guitar and piano strings. Sculptures and statues:"
460,msmarco,_doc,MARCO_1409239,4.9479613,Dragon Doctor (Bronze): Have 4 dragons in a great shape in Story mode. Perfectionist (Bronze): Have a dragon with 20 points in a characteristic in Story mode. Ultimate Customization (Bronze): Unlock all customizations of a dragon family. Perfect (Bronze): Win 50 fights without being injured in 1 Player Arcade mode.
461,msmarco,_doc,MARCO_1839037,4.9479613,"Bronze is an alloy consisting primarily of copper, commonly with about 12bronze that consists copper the addition other ingredients. Aluminum bronzes, containing up to 16 percent aluminum and small amounts of implements artwork made bronze, which is an alloy copper, tin, and, while brass copper zinc, bronze consisting naval brasses had 39."
462,msmarco,_doc,MARCO_5079933,4.9479613,franklin mint bronze coins. Follow franklin mint bronze coins to get e-mail alerts and updates on your eBay Feed. Unfollow franklin mint bronze coins to stop getting updates on your eBay Feed. Yay! You're now following franklin mint bronze coins in your eBay Feed.
463,msmarco,_doc,MARCO_7224862,4.9479613,"Cry Havoc (Bronze): Manually deploy War Assets on a territory for the first time. Discerning Taste (Bronze): Equip your first Symbol, Paint Pattern and Color Swatch on any Hero. Dishonorable Discharge (Bronze): Complete the Knight Chapter. Do it for the Honor! (Bronze): Complete 50 Honorable Kills in 4v4 PvP matches."
464,msmarco,_doc,MARCO_5978369,4.946995,"Bronze is typically 60% copper and 40% tin. Alpha bronze consists of the alpha solid solution of tin in copper. Alpha bronze alloys of 4-5% tin are used to make coins, springs, turbines and blades. Commercial bronze (otherwise known as brass) is 90% copper and 10% zinc, and contains no tin."
465,msmarco,_doc,MARCO_978989,4.946029,"Bronze Alloys. Bearing Bronze Alloys. Bearing Bronze Alloys are general purpose bearing alloy possessing good anti-friction properties, ample strength and hardness, adequate ductility and excellent machinability. Bearing Bronze Alloys are for general utility bearings and bushings and which are highly resistant to impact, wear and corrosion."
466,msmarco,_doc,MARCO_6272565,4.946029,"Floor Cleanout, Round, 4 Pipe Dia. (In.), Overall Diameter 5-1/2 In., 3/4 Height (In.), Lid Secured Scoriated Nickel Bronze Cover, Material of Construction Nickel Bronze, Color/Finish Nickel Bronze, Includes Secured Scioriated Nickel Bronze Cover and Frame with Anchor Lugs."
467,msmarco,_doc,MARCO_7208812,4.946029,1 Litigation is a custom bronze statue of two Fighting Buffalo Bulls (American Bison) was created for the briefing room of a law office. It is available as a limited edition bronze statue. Commission a custom wildlife bronze sculpture direct from the artist. Stan Watts is sculptor and owner of Atlas Bronze Casting Foundry.
468,msmarco,_doc,MARCO_640013,4.945064,"Nearly all professional cymbals are made from bronze, which gives a desirable balance of durability and timbre. Several types of bronze are used, commonly B20 bronze, which is roughly 20% tin, 80% copper, with traces of silver, or the tougher B8 bronze which is made from 8% tin and 92% copper. As the tin content in a bell or cymbal rises, the timbre drops."
469,msmarco,_doc,MARCO_164285,4.945006,"Collapsed and normal lung. In a collapsed lung, air from the lung leaks into the chest cavity. The example shown is a complete left pneumothorax. A pneumothorax (noo-moe-THOR-aks) is a collapsed lung. A pneumothorax occurs when air leaks into the space between your lung and chest wall. This air pushes on the outside of your lung and makes it collapse. In most cases, only a portion of the lung collapses. A pneumothorax can be caused by a blunt or penetrating chest injury, certain medical procedures, or damage from underlying lung disease."
470,msmarco,_doc,MARCO_232212,4.9441004,WWII Army Bronze Star Medal-The Bronze Star medal was awarded to soldiers who demonstrated heroism in battle against an enemy of the United States. The medal consists of a bronze star with a small star on its center. The example shown here is of WWII vintage. The presentation box is blue and has the words Bronze Star medal written on the lid. The box is hinged at the back.
471,msmarco,_doc,MARCO_640019,4.9431376,"Bronze is an alloy of copper and usually tin as the main additive that is much harder and more brittle than brass. The term “bronze” is sometimes used interchangeably for different types of copper alloys, but the most common typically refers to a mix of about 90% copper and 10% tin in its “pure” form. Common additives to bronze include phosphorous to harden bronze and lead to make bronze more castable."
472,msmarco,_doc,MARCO_8121499,4.9431376,"Iranian Hadi Saei (2 gold, 1 bronze), American Steven López (2 gold, 1 bronze), South Korean Hwang Kyung-Seon (2 gold, 1 bronze) and Mexican María del Rosario Espinoza (1 gold, 1 silver, 1 bronze) share the most medals in Taekwondo with three."
473,msmarco,_doc,MARCO_2675003,4.9421754,"One of the first alloys made by humans was bronze, which is made by mixing the metals tin and copper. Bronze was an extremely useful alloy to the ancients, because it is much stronger and harder than either of its components. Steel was another common alloy.ne of the first alloys made by humans was bronze, which is made by mixing the metals tin and copper. Bronze was an extremely useful alloy to the ancients, because it is much stronger and harder than either of its components. Steel was another common alloy."
474,msmarco,_doc,MARCO_6889764,4.9421754,"Confidence votes 34.6K. The Bronze Star Medal is awarded for Heroic or meritorious achievement or service.. While there is no complete list compiled of Bronze Stars awarded during Vietnam, medals awarded may be looked up on the National Archives website. You can search by name and several other ways on the site linked below. Number of Bronze Stars awarded (Source: National Archives): 1  Bronze Star for Service 26,215."
475,msmarco,_doc,MARCO_4891041,4.9421754,"If your loved one s headstone is an upright monument and there is room on either side of the granite base, then there is a chance you could add cemetery vases to hold flowers.We also have in-ground cemetery vase units for flat grave markers.ronze Cemetery Vases These vases are specially made to go with bronze grave markers. Bronze vases are cast from rich memorial bronze and normally available in a variety of bronze finishes."
476,msmarco,_doc,MARCO_6272560,4.9421754,"Floor Cleanout, Round, 6 Pipe Dia. (In.), Overall Diameter 7-1/2 In., 3/4 Height (In.), Lid Secured Scoriated Nickel Bronze Cover, Material of Construction Nickel Bronze, Color/Finish Nickel Bronze, Includes Secured Scioriated Nickel Bronze Cover and Frame with Anchor Lugs. Floor Cleanout, Round, 6 Pipe Dia."
477,msmarco,_doc,MARCO_1158659,4.9412036,"DEFINITION of 'Economic Collapse '. A complete breakdown of a national, regional or territorial economy. An economic collapse is essentially a severe version of an economic depression, where an economy is in complete distress for months, years or possibly even decades.A total economic collapse is characterized by economic depression, civil unrest and highly increased poverty levels.he Great Depression in the United States is a prime example of an economic collapse. The 1929 stock market crash brought on a collapse that lasted for many years and saw high levels of poverty."
478,msmarco,_doc,MARCO_344928,4.940254,Definition of BRONZE for Kids. 1. : an alloy of copper and tin and sometimes other elements. 2. : a yellowish brown color. 3. : a medal made of bronze given to the third place winner in a competition.ull Definition of BRONZE. 1. a: an alloy of copper and tin and sometimes other elements b: any of various copper-base alloys with little or no tin. 2. : a sculpture or artifact of bronze. 3. : a moderate yellowish brown. 4.
479,msmarco,_doc,MARCO_1109718,4.940254,"Self-Lubricating Powdered Metal Bearings, Bars, Plates and Discs. Self-lubricating powdered metal bearings, bars, plates and discs from Reliable Bronze offer wear-resistance, corrosive resistance and come in a wide range of sizes. We also stock and use these materials to manufacture parts: aluminum bronze, phosphor bronze, phosphor bronze alloy and many other high quality materials used in industry."
480,msmarco,_doc,MARCO_3068782,4.940254,"Although, at one time, bronze was any alloy consisting of copper with tin and brass was an alloy of copper with zinc, modern usage has blurred the lines between brass and bronze. 1  Now, copper alloys generally are called brass, with bronze sometimes considered a type of brass. To avoid confusion, museums and historical texts typically use the inclusive term copper alloy.. In science and engineering, bronze and brass are defined according to their element composition."
481,msmarco,_doc,MARCO_5079928,4.940254,1976 Bronze Franklin Mint Silver Coin is sold at Franklin Mint Silver Coin.com fopr $3. This is for a 45mm size coin. 1976 The Franklin Bicentennial Medal Bronze $77. Franklin Mint States of the Union Series Solid Bronze –$129.95. I also found out from a website Iguide.Net where in it says that sets were mostly issued in bronze and most collectors do not want this. They still go after silver since it never loses its value.
482,msmarco,_doc,MARCO_4961759,4.940254,"When an alloy is called Bronze, it usually means the alloy of copper and tin. When two words are used to name an alloy, and one of the words is Bronze, this means that the alloy is made mostly from copper.The other word tells us what other metal was combined with copper to make this alloy.hen an alloy is called Bronze, it usually means the alloy of copper and tin. When two words are used to name an alloy, and one of the words is Bronze, this means that the alloy is made mostly from copper."
483,msmarco,_doc,MARCO_7533349,4.940254,"Alloys of tin are also important, such as soft solder, pewter, bronze and phosphor bronze. The most important tin salt used is tin (II) chloride which is used as a reducing agent and as a mordant.Tin salts sprayed onto glass are used to produce electrically conductive coatings.lloys of tin are also important, such as soft solder, pewter, bronze and phosphor bronze. The most important tin salt used is tin (II) chloride which is used as a reducing agent and as a mordant."
484,msmarco,_doc,MARCO_3320673,4.938337,Made in the U.S.A. We offer both Cast Bronze and bronze finished aluminum. Cast Bronze emblems mounted on 21” rod to hold one 12” x 18” flag mounted on 3/8” staff. Please see our fabulous pricing on quantity buys! Bronze Finished Aluminum emblems mounted on 21” rod to hold one 12” x 18” flag mounted on 3/8” staff.
485,msmarco,_doc,MARCO_3813217,4.938337,"Traditionally, materials like marble, granite, and fieldstone are used to make headstones to memorialize the dead. Manufacturers may use concrete, wood, bronze, sandstone, limestone, iron, and other similar materials, too. Granite and bronze, in particular, are the most popular these days.n fact, certain memorial parks and cemeteries allow only bronze grave markers and headstones. These headstones often have a granite base. Both these materials are easy to maintain. Bronze is a copper alloy traditionally used to make tools and weapons."
486,msmarco,_doc,MARCO_6014057,4.938337,"It is because the cube exists in the bronze, which is the secondary matter, that it (the bronze cube) is potentially The Thinker. The secondary matter (the bronze) is the source of the thing's potentiality to be another sculpture. Hence, matter is openness to form.e wishes to impose that form on the secondary matter. The matter (bronze), which is actually a cube, is in potentiality to a new form, namely The Thinker. It is not actually The Thinker yet, only potentially is it The Thinker. The artist, who is the agent cause, begins his work and a few days later we have The Thinker."
487,msmarco,_doc,MARCO_6044392,4.938337,"Use bronzer where the sun naturally tans your face such as the bridge of your nose, cheeks and chin. Rub the cream bronzer on in circular motions, blending the color in well with your natural skin tone. Add cream bronzer to your neck so your neck and face match in color. Create a faux glow on the rest of your body by applying the bronzer to your shoulders and chest. This works especially well if you’re wearing a strapless or low cut top."
488,msmarco,_doc,MARCO_7437919,4.938337,"Basically, brass is copper and zinc, while bronze is copper and tin. More metals or metalloids can be added, creating things like silicon bronze, but that is the general distinction-tin or zinc.As you know, zinc corrodes rather quickly in the marine environment, as in sacrificial zinc..asically, brass is copper and zinc, while bronze is copper and tin. More metals or metalloids can be added, creating things like silicon bronze, but that is the general distinction-tin or zinc."
489,msmarco,_doc,MARCO_4277600,4.936423,"1 The term “bronze” is sometimes used interchangeably for different types of copper alloys, but the most common typically refers to a mix of about 90% copper and 10% tin in its “pure” form. 2  Common additives to bronze include phosphorous to harden bronze and lead to make bronze more castable.opper, brass, and bronze alloys are non-ferrous metals with excellent electrical and thermal conductivity as well as good corrosion resistance, ductility, and strength."
490,msmarco,_doc,MARCO_7376505,4.936423,Our cast bronze Memorial Plaques shown on this page are available in many sizes to fit your requirements. All are cast of the highest quality bronze and finished with a baked on polyurethane coating to assure they will continue to retain their 'like new' look for many years.ur cast bronze Memorial Plaques shown on this page are available in many sizes to fit your requirements. All are cast of the highest quality bronze and finished with a baked on polyurethane coating to assure they will continue to retain their 'like new' look for many years.
491,msmarco,_doc,MARCO_2561866,4.9345126,"Both cost-effective and fashionable, bronze has been used to create jewelry since ancient times. Brass is mainly a mixture of copper and tin and radiates a lovely warm brownish-copper glow. Brass items also generally contain nickel and aluminum, so those with sensitivity to nickel may find brass jewelry difficult to wear. Items made with bronze are usually exquisitely detailed. One drawback to bronze is its propensity to change color. A coating of oil can usually prevent bronze from turning."
492,msmarco,_doc,MARCO_4814555,4.9345126,"Commercial bronze (90% copper and 10% zinc) and architectural bronze (57% copper, 3% lead, 40% zinc) are more properly regarded as brass alloys because they contain zinc as the main alloying ingredient. They are commonly used in architectural applications. Bismuth bronze is a bronze alloy with a composition of 52% copper, 30% nickel, 12% zinc, 5% lead, and 1% bismuth. It is able to hold a good polish and so is sometimes used in light reflectors and mirrors."
493,msmarco,_doc,MARCO_2897560,4.9326057,"The Bronze Star Medal, unofficially the Bronze Star, is a United States decoration awarded to members of the United States Armed Forces for either heroic achievement, heroic service, meritorious achievement, or meritorious service in a combat zone.he Bronze Star Medal, unofficially the Bronze Star, is a United States decoration awarded to members of the United States Armed Forces for either heroic achievement, heroic service, meritorious achievement, or meritorious service in a combat zone."
494,msmarco,_doc,MARCO_2503283,4.9326057,"Silicon Bronze C65500. Farmer’s Copper Ltd. inventories a large amount of Silicon Bronze C65500 in plate, sheet, rod, pipe, and fittings. It’s high-strength, corrosion resistance, and resilience and formability makes silicon bronze among the most widely used copper alloys.C655 is corrosion resistant against most acids, alkalies, salts and organic chemicals.t’s high-strength, corrosion resistance, and resilience and formability makes silicon bronze among the most widely used copper alloys."
495,msmarco,_doc,MARCO_4961756,4.9326057,"Brass and Bronze are metal alloys used extensively in everyday objects. While brass is an alloy of copper and zinc, bronze is an alloy consisting mainly of copper, combined most often with tin, but at times also with other metals.Owing to their properties, these two alloys have various uses.rass and Bronze are metal alloys used extensively in everyday objects. While brass is an alloy of copper and zinc, bronze is an alloy consisting mainly of copper, combined most often with tin, but at times also with other metals. Owing to their properties, these two alloys have various uses."
496,msmarco,_doc,MARCO_5145681,4.9326057,Clawfoot Bathtub Drains & Accessories. Oil Rubbed Bronze; Polished Brass; Polished Chrome; Satin Nickel; Clawfoot Bathtub Faucets. Oil Rubbed Bronze; Polished Brass; Polished Chrome; Satin Nickel; Clawfoot Tub Faucet Packages; Kitchen Faucets. Oil Rubbed Bronze; Polished Brass; Polished Chrome; Satin Nickel; Roman Tub Faucets. Oil Rubbed Bronze; Polished Brass; Polished Chrome
497,msmarco,_doc,MARCO_6014059,4.9326057,"They are commonly used in architectural applications. Bismuth bronze is a bronze alloy with a composition of 52% copper, 30% nickel, 12% zinc, 5% lead, and 1% bismuth. It is able to hold a good polish and so is sometimes used in light reflectors and mirrors.hey are commonly used in architectural applications. Bismuth bronze is a bronze alloy with a composition of 52% copper, 30% nickel, 12% zinc, 5% lead, and 1% bismuth. It is able to hold a good polish and so is sometimes used in light reflectors and mirrors."
498,msmarco,_doc,MARCO_7376503,4.9326057,"Mostly from renown, Elberton, Georgia, the supplier for the stone used for many of the famous monuments in Washington, DC.. 4. About Our Bronze Grave Markers - Our bronze grave marker is a flat memorial set on a granite base.The design, name and dates are all cast onto the plaque as a relief sculpture. 5.ostly from renown, Elberton, Georgia, the supplier for the stone used for many of the famous monuments in Washington, DC.. 4. About Our Bronze Grave Markers - Our bronze grave marker is a flat memorial set on a granite base."
499,msmarco,_doc,MARCO_1864625,4.931761,"A collapse of the lung, also called pneumothorax, occurs when air that normally circulates within the lung leaks into the space between the lung and the chest wall, pushing the lung down or causing it to collapse. This causes the affected section of the lung to shut down.In most cases, only a portion of the lung collapses, leaving the rest of the lung intact. A severe lung collapse can cause low blood oxygen levels, respiratory failure, cardiac arrest, and shock.urgery. If an air leak from the lung is the underlying cause of the collapse, surgery may be necessary to repair the leak. Your doctors will make two small incisions in your chest and insert a fiber optic camera into one of them to view the lung."
500,msmarco,_doc,MARCO_2583970,4.930703,"The best tanning lotions with tinglers. 1  Millennium Insanely Black Hot Tingle Tanning Bed Lotion w/ Bronzer. 2  Designer Skin Ruby Hot Tingle Bronzer Indoor Tanning Bed Lotion. 3  Ed Hardy Obnoxious Extreme Bronzer Tingle Tanning Lotion. 4  Supre Snooki Hot Skinny Sizzling Super Dark Maximizer. 5  Jwoww Mad Hot Tingle Bronzer, Tanning Lotion."
501,msmarco,_doc,MARCO_6155537,4.930703,"The Bronze variety is stately and imposing in appearance. The standard weight for young toms is 25 pounds and for young hens is 16 pounds. Since, however, the Standard Bronze has not been selected for production attributes, including weight gain for years; so many birds may be smaller than the standard.or this reason, most Broad Breasted Bronze turkeys have been artificially inseminated since the 1960s. Beginning in the 1960s the Broad Breasted Bronze was replaced by the Broad Breasted White turkey. Processors favored the white-feathered variety because it produced a cleaner looking carcass."
