,_index,_type,_id,_score,_source.body
700,msmarco,_doc,MARCO_2782867,3.9149432,"Furthermore, the lawsuit alleges, American Home Shield denies claims because of minimal uncleanness, even if outside factors were the cause of the appliance's breakdown. Plaintiffs allege contractors were given a bonus for denying legitimate claims. The lawsuit claims breach of contract and fraudulent misrepresentation."
701,msmarco,_doc,MARCO_4119324,3.9149432,"The main factor behind the Finnish Civil War was World War I; the Russian Empire collapsed under the pressures of the war, leading to the February and October Revolutions in 1917. The breakdown caused a large power vacuum and subsequent power struggle in Eastern Europe."
702,msmarco,_doc,MARCO_7500339,3.9149432,"But after the police have gone home, you’ll have to deal with the tragedy. Contact Aftermath and we’ll visit the site and provide a written assessment of treatment and costs for the crime scene. Here’s a breakdown of what factors go into crime scene cleanup costs."
703,msmarco,_doc,MARCO_8602386,3.9149432,"Cancer has many factors that causes excessive fatigue, such as: 1  weight loss, 2  breakdown of the tissues with release of energy, 3  hormonal imbalances, 4  depression and anxiety, which by themselves can cause fatigue, 5  sleep disruption can also lead to sleepiness and fatigue,"
704,msmarco,_doc,MARCO_3993827,3.9129968,"Select other relevant tax factors (Age related tax allowances, head of household tax allowance, tax-deferred retirement plan, cafeteria etc) Click Calculate to see your tax, Medicare and take-home breakdown - Federal Tax made Simple"
705,msmarco,_doc,MARCO_4754125,3.9129968,"There are several factors that go into making a great slip resistant work shoe. The distinguishing features of a slip resistant shoe are the outsole design, tread pattern, and material used in the outsole. Here’s a breakdown of what separates a slip resistant shoe from a regular shoe. Material."
706,msmarco,_doc,MARCO_4755107,3.9129968,"Pricing Breakdown. Factors that influence the cost of dentures may include the area in which you live, your dentist, the type of dentures you require, and the quality of dentures you select. Full dentures are designed to replace an entire set of teeth, either the upper jaw, the lower jaw, or the entire mouth."
707,msmarco,_doc,MARCO_7136368,3.9129968,"Beneath the weight of skin and fat, the muscles can stretch and sag over time. The loss of skin elasticity can also contribute to a sagging facial appearance. Factors such as sun damage and smoking -- in addition to age -- can contribute to the breakdown of the collagen needed to maintain skin elasticity."
708,msmarco,_doc,MARCO_7367479,3.9129968,"The Fresher, the Better. Time is the most important factor when it comes to the nutrient breakdown of fruits and vegetables. You can slow down the process of nutrient depletion by your storage methods, but getting produce fresh to begin with is very important. Try finding markets that sell locally grown produce."
709,msmarco,_doc,MARCO_487567,3.9110522,Storm Surge is the common name for what meteorologists and call Meteorological Residual. Source: http://www.nhc.noaa.gov/HAW2/english/surge/surge_big.jpg. This illustration shows a visual breakdown of the factors affecting a surge event. Source: http://geology.com/articles/storm-surge.shtml.
710,msmarco,_doc,MARCO_384511,3.9110522,The amount of time it takes to get rhabdomyolysis varies depending  on various factors. This is a gradual process which causes  breakdown of muscle fibres and as such the le … vel of strain on the  muscles will be the main determinant on how long it takes to get  it.E. ê 1 person found this. useful
711,msmarco,_doc,MARCO_3816026,3.9110522,"If additions are less than losses, soil organic matter becomes depleted. When the system is in balance and additions equal losses, the quantity of soil organic matter does not change appreciably over time. In general, any factor that affects soil microbial activity also affects breakdown of soil organic matter."
712,msmarco,_doc,MARCO_8602390,3.9110522,"Cancer has many factors that causes excessive fatigue, such as: weight loss, breakdown of the tissues with release of energy, hormonal imbalances, depression and anxiety, which by themselves can cause fatigue, sleep disruption can also lead to sleepiness and fatigue, cancer treatments, such as radiation and chemotherapy can also cause extreme fatigue."
713,msmarco,_doc,MARCO_4433644,3.9103332,"Leaders such as Martin Luther King, Jr. , Booker T. Washington, and Rosa Parks paved the way for non-violent protests which led to changes in the law. When most people talk about the Civil Rights Movement they are talking about the protests in the 1950s and 1960s that led to the Civil Rights Act of 1964.Background.eaders such as Martin Luther King, Jr. , Booker T. Washington, and Rosa Parks paved the way for non-violent protests which led to changes in the law. When most people talk about the Civil Rights Movement they are talking about the protests in the 1950s and 1960s that led to the Civil Rights Act of 1964. Background."
714,msmarco,_doc,MARCO_337377,3.9091096,"Causes and Risk Factors. Gout is caused by high blood levels of uric acid, a waste formed from the breakdown of purines. These chemical compounds help make up RNA and DNA and are used to form the compounds of uric acids. They are found naturally in our bodies, as well as in all meats, fish and poultry."
715,msmarco,_doc,MARCO_966123,3.9091096,ATN does not rapidly improve following the administration of large-volume intravenous fluid. Treatment for Acute Tubular Necrosis (ATN) Management relies on aggressive treatment of the factors that precipitated ATN. One exception is the treatment of ATN associated with the breakdown of muscle fibers caused by a crush injury.
716,msmarco,_doc,MARCO_3269670,3.9091096,"Mechanical (physical) weathering is the breakdown of rock into smaller particles due to such factors as freezing and thawing, release of pressure, water absorption, salt crystal formation, landmass uplift, expansion and contraction from the sun or fire, plant root growth, actions of animals, abrasio…."
717,msmarco,_doc,MARCO_5250977,3.9091096,Once the CP stores are depleted the body resorts to stored glucose for ATP. The breakdown of glucose or glycogen in anaerobic conditions results in the production of lactate and hydrogen ions. The accumulation of hydrogen ions is the limiting factor causing fatigue in runs of 300 metres to 800 metres.
718,msmarco,_doc,MARCO_2922858,3.9084415,"A sea breeze or onshore breeze is a gentle wind blowing from sea toward land, that develops over bodies of water near land due to differences in air pressure created by their different heat capacity. It is a common occurrence along coasts during the morning as solar radiation heats the land more quickly than the water. A land breeze or offshore breeze, blowing from land to sea, is the reverse effect, caused by land cooling more quickly than water in the evening. The sea breeze dissipates and the wind flows from the land towards the sea. Both are important factors in coastal regions' prevailing winds."
719,msmarco,_doc,MARCO_1027940,3.9082816,Arabian Sea is in Indian Ocean. Most of the trade between east and west is done through Indian Ocean. Pakistan through Arabian Sea is linked with the Muslims Countries of Persian Gulf.All of them are rich in oil. In Karachi Bin Qasim and Gwader are important seaports of Pakistan.akistan through Arabian Sea is linked with the Muslims Countries of Persian Gulf. All of them are rich in oil. In Karachi Bin Qasim and Gwader are important seaports of Pakistan.
720,msmarco,_doc,MARCO_3416236,3.9071689,Protein payoff: 20 g per serving. This powerful protein combines the best of both worlds in protein supplementation through a natural blend of casein and whey proteins. Using a combination powder allows whey to trigger muscle building stimulation while casein inhibits factors that lead to muscle breakdown.
721,msmarco,_doc,MARCO_2926850,3.9071689,"Mechanical weathering is the physical breakdown of rock by environmental factors. This process is always at work and there are a number of different types of mechanical weathering. Thermal expansion is the tendency for minerals to expand and contract based on temperature. Rapid temperature fluctuations, such as day-night cycles, cause rocks to expand and contract."
722,msmarco,_doc,MARCO_4533444,3.9071689,Review Your Credit Scores. You can get two free credit scores each month using Credit.com’s free Credit Report Card. You will also get an easy-to-understand breakdown of the factors impacting your credit scores. Checking your own score this way doesn’t cost anything and it doesn’t affect your score.
723,msmarco,_doc,MARCO_6579695,3.9071689,Congenital Adrenal Hyperplasia: Symptoms and Treatment Congenital adrenal hyperplasia is a health condition that refers to a group of multiple autosomal recessive diseases. The diseases are triggered by gene mutations that affect the biochemical breakdown of cholesterol into cortisol. The trigger factor is adrenal gland abnormality or steroidogenesis.
724,msmarco,_doc,MARCO_811815,3.9052296,"Serving Size: 1 NLEA serving (126 g) * Percentage breakdown of calories from carbs, protein, fat and alcohol. Note USDA factors are used in calculating certain foods and do not necessarily follow the 4-4-9 method. Percentages may not always add up to 100. Source: USDA Nutrient Database."
725,msmarco,_doc,MARCO_477318,3.9052296,"The cause of caries is bacterial breakdown of the hard tissues of the teeth (enamel, dentin and cementum). This occurs due to acid made from food debris or sugar on the tooth surface. Simple sugars in food are these bacteria's primary energy source and thus a diet high in simple sugar is a risk factor."
726,msmarco,_doc,MARCO_3856803,3.9052296,"The price to completely outfit a kitchen is extremely difficult because it depends on so many factors: the size of your kitchen, the style of cabinets, and the doors and accessories you select. According to Ikea, the average cost of a complete kitchen is about $5,000. But you could pay less or far more depending on the features and options you select. Here is a breakdown of the approximate prices ranges for individual components:"
727,msmarco,_doc,MARCO_2401645,3.9044466,"The Location of Knossos Mediterranean Sea. Knossos is located on the northern coast of Crete, in fertile lowlands near present-day Iraklion. Knossos is approximately five kilometers inland in the Kairatos river valley, and is hidden from the sea by low hills (Roberts, 1979). Knossos is close enough to the sea to realize how easily it would have been to import and export via ships. There is evidence that Knossos traded with mainland Greece, which is not an incredible distance from Crete."
728,msmarco,_doc,MARCO_6221641,3.9037392,"Asia Minor, a peninsula also called Anatolia, comprises most of the Asian part of modern Turkey and the Armenian highland. Most people there today speak Turkish.The seas surrounding Asia Minor are the Black Sea, the Aegean Sea and the Mediterranean Sea. Because Asia Minor is between Christian Europe and Asia, many different cultures have lived there. Remnants (small parts) of these cultures are there today.ost people there today speak Turkish. The seas surrounding Asia Minor are the Black Sea, the Aegean Sea and the Mediterranean Sea. Because Asia Minor is between Christian Europe and Asia, many different cultures have lived there."
729,msmarco,_doc,MARCO_2252657,3.9032927,"Natural Factors GarlicRich™ Super Strength Garlic Concentrate Description. GarlicRich odor controlled softgels support the immune and cardiovascular system. The enteric coated softgels formulated for maximum bioavailability, delays the breakdown of Alliin into Allicin and subsequent beneficial compounds until the softgel reaches the small intestine."
730,msmarco,_doc,MARCO_3443119,3.9032927,"Monsoon 2015 forecast - Tucson News Now. Monsoon 2015 forecast. TUCSON, AZ (Tucson News Now) - Monsoon 2015 is looking like it could be a good one. That is IF we can tap into the moisture from what is forecast to be an active tropical season off the west coast of Mexico. Below is a breakdown of the factors that influence the monsoon, plus if they have a good or bad impact this year."
731,msmarco,_doc,MARCO_3566261,3.9032927,"The dollar limits increase yearly. The following table shows the Medicare benefit breakdown (including the donut hole) for 2009. For 2010, the total TrOOP increased to $4,550 before catastrophic coverage began.  1 Total drug spend represents the actual cost of the drugs purchased, factoring in any Medicare discounts."
732,msmarco,_doc,MARCO_6889233,3.9032927,Here’s a breakdown of how these factors play a role in your determining your car’s junk value: Location – Where you live plays a huge role in what you’re able to receive for a junk car. Your proximity to a salvage yard and regional price of scrap play a role in how much you can receive for your vehicle.
733,msmarco,_doc,MARCO_8030668,3.9032927,"There are five main factors that go into FICO scores, and they each have a different effect on your score. Here’s the breakdown: Payment history (35% of the FICO score) Debt/amounts owed (30%) Age of credit history (15%) New credit/inquiries (10%) Mix of accounts/types of credit (10%)"
734,msmarco,_doc,MARCO_8229490,3.9032927,Villi in the small intestine absorbs nutrients and completes the breakdown of food. Factors of its structure that help it function include . Large surface area (provides more surface area for exchange to take place) Thin wall (reduces the distance that materials need to move) Moist (assists the transport of materials across the exchange surface)
735,msmarco,_doc,MARCO_8792329,3.9032927,"presence of certain genetic or acquired defects leading to abnormal clot formation. Reasons for the clot formation and breakdown processes be unbalanced toward to. abnormal clot formation include vessel injuryblood , venous stasis (lack of movement. of the blood in the veins), andclotting disorders. These three factors make up. Virchow’s triad."
736,msmarco,_doc,MARCO_942415,3.9013577,The overall reaction sequence for triglyceride synthesis is of more than esoteric interest because the synthesis and deposition of triglyceride in adipose tissue and muscle is a major factor in regulating energy metabolism in mammals.he synthesis and breakdown of triglycerides in adipose tissue and muscle is a crucial element of energy metabolism because it ensures that adequate fuel is available during starvation.
737,msmarco,_doc,MARCO_2270661,3.9013577,"Lesson Summary. Let's review. Mechanical weathering is the physical breakdown of rock by environmental factors. This process is always at work and there are a number of different types of mechanical weathering. Thermal expansion is the tendency for minerals to expand and contract based on temperature. Rapid temperature fluctuations, such as day-night cycles, cause rocks to expand and contract."
738,msmarco,_doc,MARCO_1207018,3.9013577,Carbon vs Fiberglass. The vast majority of fibers used in composites are carbon fiber and fiberglass. The choice of whether to use carbon or fiberglass in your application depends on many factors.Below is a breakdown of the most important carbon and fiberglass characteristics.arbon vs Fiberglass. The vast majority of fibers used in composites are carbon fiber and fiberglass. The choice of whether to use carbon or fiberglass in your application depends on many factors.
739,msmarco,_doc,MARCO_8130128,3.9013577,"Laser Skin Resurfacing Price Breakdown. The cost of laser skin resurfacing will involve several factors. The laser skin resurfacing cost that is initially quoted tends to be the surgeon’s fee, but you will likely have to pay facility costs as well. The procedure may be performed in a surgeon’s office, an outpatient surgical facility, or a hospital."
740,msmarco,_doc,MARCO_1027941,3.9006188,Confidence votes 15. Arabian Sea is in Indian Ocean. Most of the trade between east and west is done through Indian Ocean. Pakistan through Arabian Sea is linked with the Muslims Countries of Persian Gulf. All of them are rich in oil. In Karachi Bin Qasim and Gwader are important seaports of Pakistan.akistan through Arabian Sea is linked with the Muslims Countries of Persian Gulf. All of them are rich in oil. In Karachi Bin Qasim and Gwader are important seaports of Pakistan.
741,msmarco,_doc,MARCO_2309473,3.9006188,"Carthage, a city in Africa, was also growing. Rome and Carthage fought over who would control trade in the Mediterranean Sea. There were 3 separate wars fought. Carthage was a great sea power and defeated the Romans at sea; Rome was a great land power and beat the Carthaginians on land. Rome won the first war and Carthage gave up Sicily to Rome. Rome won the second war and made Carthage give up its army and pay tribute to Rome."
742,msmarco,_doc,MARCO_3771449,3.899424,"Estrogen: ↓ effects of PTH at the bone and ↑ effects of PTH at the kidney  ↓ bone breakdown and ↑ renal calcium reuptake. Following menopause (↑ FSH, ↑ LH, and ↓ estradiol) , loss of estrogen is a significant factor in increasing calcium loss and increasing the tendency to osteoporosis."
743,msmarco,_doc,MARCO_5567852,3.899424,"How Much Does it Cost to Remodel a Master Bath? The cost of a master bathroom remodel can vary widely depending on a lot of factors. For the most part, contractors tell clients that the labor costs of the remodel will hover around twice the cost of the materials. Below, you will find a basic breakdown of the needs and associated costs for a small and large master bathroom remodel."
744,msmarco,_doc,MARCO_8122836,3.899424,"What Are the Four Stages of Human Decomposition? Human decomposition is a natural process involving the breakdown of tissues after death. While the rate of human decomposition varies due to several factors, including weather, temperature, moisture, pH and oxygen levels, cause of death, and body position, all human bodies follow the same four stages of human decomposition."
745,msmarco,_doc,MARCO_2488042,3.8981137,"A car's trade-in value is the amount of money an auto dealer is willing to take off the purchase price of a new or used car in trade for your existing car. The trade-in amount is based on a number of factors, including the make and model of the car, its age, and its condition at the time of trade."
746,msmarco,_doc,MARCO_2899328,3.897493,"updated July 3, 2015. The cost of braces can vary widely, depending on a number of factors. The experience of the orthodontist you choose, the area of the country where you live, the degree of correction needed for your teeth, and other important considerations will help determine the final cost. However, on average, patients should expect braces to cost between $4,000 and $10,000. Braces Pricing Breakdown."
747,msmarco,_doc,MARCO_7779708,3.8970125,"The Silk Road or network of trade routes across the Asian continent connected East, South, and Western Asia with the Mediterranean world, as well as North and Northeast Africa … and Europe. It encouraged development by opening the lands through trade.2 people found this useful.xum was located just south of Kush on a high plateau. Today the countries of Ethiopia and Eritrea are located here. Axum … had access to the Red Sea. By 50 CE, traders, using the Silk Road, came to Axum for its salt, gold, and gems."
748,msmarco,_doc,MARCO_4290211,3.8962064,"Japan is a country of over three thousand islands extending along the Pacific coast of Asia. Its location is on the Pacific Ring of Fire.There is the sea of Japan to the West, … the sea of Okhotsk to the North, The yellow sea to the East and the East China sea to the South but The Pacific ocean feeds all of them.5 people found this useful. Tanner Peterson.31 Contributions.ts location is on the Pacific Ring of Fire.There is the sea of Japan to the West, … the sea of Okhotsk to the North, The yellow sea to the East and the East China sea to the South but The Pacific ocean feeds all of them. 5 people found this useful. Tanner Peterson. 31 Contributions."
749,msmarco,_doc,MARCO_2743457,3.8957653,"Nitrofurantoin, sold under the trade name Macrobid among others, is an antibiotic used to treat bladder infections. It is not effective for kidney infections. It is taken by mouth.Common side effects include nausea, loss of appetite, diarrhea, and headaches. Rarely numbness, lung problems, or liver problems may occur.ts current uses include the treatment of uncomplicated UTIs and prophylaxis against UTIs in people prone to recurrent UTIs. Increasing bacterial antibiotic resistance to other commonly used agents, such as fluoroquinolones and trimethoprim/sulfamethoxazole, has led to increased interest in using nitrofurantoin."
750,msmarco,_doc,MARCO_3132256,3.8955631,"The cost of dentures varies considerably, according to geographical location, the dentist, and type of dentures. Pricing Breakdown. Factors that influence the cost of dentures may include the area in which you live, your dentist, the type of dentures you require, and the quality of dentures you select. Full dentures are designed to replace an entire set of teeth, either the upper jaw, the lower jaw, or the entire mouth."
751,msmarco,_doc,MARCO_4904303,3.8955631,Hydrogen ions. The breakdown of glucose or glycogen produces lactate and hydrogen ions (H+). If insufficient oxygen is available to the working muscles then hydrogen ion concentrations increase and the blood and muscle become acidic.o what causes this sensation of fatigue? The reason has to do with several factors including the availability of fuel for the muscles and the mechanism of hydrogen ions and calcium in muscle cell action.
752,msmarco,_doc,MARCO_8294788,3.8955631,"To measure THC in the body, drug screenings actually measure carboxy-THC, a breakdown metabolite of marijuana. And that process is also affected by a number of factors. Says Armentano: “The body’s excretion of carboxy-THC is influenced by the subject’s metabolic rate, percentage of body fat, and is also likely moderated by stress levels and diet.”"
753,msmarco,_doc,MARCO_626785,3.8953555,"Trading turret. A trading turret or dealer board is a specialized telephony key system that is generally used by financial traders on their trading desks. Trading has progressed from floor trading through phone trading to electronic trading during the later half of the twentieth century with phone trading having dominated during the 1980s and 1990s. Although most trading volume is now done via electronic trading platforms, some phone trading persists and trading turrets are common on trading desks of investment"
754,msmarco,_doc,MARCO_2490161,3.8944323,"Malta is an Island, Malta Islands is the largest of the three major islands that constitute the Maltese archipelago and Republic of Malta.Malta is in the middle of the Medite … rranean Sea directly south of Italy and north of Libya. 20 people found this useful.alta is a Member State of the European Union (EU) ; which is strategically located within the Mediterranean Sea. This strategic position has consistently allowed Malta to ec … lectically develop as an important International Trading Post."
755,msmarco,_doc,MARCO_6462543,3.8936357,"In its 2010 survey, the average yearly income of sonographers was $68,821 or $33.09 per hour. The ASRT provides a further breakdown by position, with staff sonographers earning $31.85 per hour, and supervisors averaging $38.29 per hour. Experience is also a factor. Sonographers with two years' experience or less averaged $26.89 per hour, while those with six to 10 years' experience earned $29.73 per hour."
756,msmarco,_doc,MARCO_7851551,3.8936357,"The following is a breakdown of the average social worker salaries in all 50 states and for several different specializations, courtesy of the Bureau of Labor Statistics. Social worker salaries can vary widely depending on several factors, including your specialization, state and qualifications. Qualifications can range from the number of years spent as a social worker, whether or not you have a Masters of Social Work and what types of special certifications you might hold."
757,msmarco,_doc,MARCO_8559461,3.8936357,"Watch Louis & Siggy breakdown how to differentiate between SNELL DOT & ECE motorcycle helmet ratings. Helmet safety ratings are important factors to consider when choosing the best motorcycle helmet for you. At Jafrum, all of our motorcycle helmets at least meet DOT standards and we also carry SNELL & ECE helmets as well. So whatever standard you require, Jafrum.com carries the perfect helmet for you."
758,msmarco,_doc,MARCO_1202844,3.892985,"This species is also sold under the trade names Chilean Seabass in the USA and Canada; Merluza negra in Argentina, Peru and Uruguay; Legine australe in France; Mero in Japan and Spain, and Bacalao de profundidad in Chile.he name Chilean Seabass was invented by a fish wholesaler named Lee Lantz in 1977. He was looking for a name that would make it attractive to the American market. He considered Pacific sea bass and South American sea bass before settling on Chilean sea bass."
759,msmarco,_doc,MARCO_8437490,3.892985,"The hawksbill sea turtle (Eretmochelys imbricata) is a critically endangered sea turtle belonging to the family Cheloniidae.It is the only extant species in the genus Eretmochelys. The species has a worldwide distribution, with Atlantic and Indo-Pacific subspecies — E. i. imbricata and E. i. bissa, respectively.he species (along with the entire family Cheloniidae) has been listed on Appendix I of the Convention on International Trade in Endangered Species. It is illegal to import or export turtle products, or to kill, capture, or harass hawksbill sea turtles."
