,_index,_type,_id,_score,_source.body
239,msmarco,_doc,MARCO_6426419,4.4820175,"4. Best Response. You've already chosen the best response. The location of Constantinople made it grow wealthy and prosperous because it is in between the Aegean and Black Sea. Also, it lies between the trade routes of Europe and Asia.The two seas provided safe shelter for ships to pass through and fro.. Best Response. You've already chosen the best response. The location of Constantinople made it grow wealthy and prosperous because it is in between the Aegean and Black Sea. Also, it lies between the trade routes of Europe and Asia."
240,msmarco,_doc,MARCO_3731853,4.4814916,"Presenting the Work Breakdown Structure. A work breakdown structure is typically presented in the form of an organization chart-like structure. It can be presented as a list, idea map or outline form as well.n many cases, a work breakdown structure is the first transition of organizational goals into real work that people can actually perform. It helps to provide clarity of the scope for the project and breaks down the scope into whole work units. A work breakdown structure is deliverable-oriented."
241,msmarco,_doc,MARCO_169801,4.478213,"Answers. Best Answer: A venues cost are the breakdown of material and square footage. Without knowing if you want Italian marble brought over or merely painted concrete, without knowing if you are planning on a hall to hold 100 people or 1000 people, it would be impossible to answer this.That's like saying how much is a house.nswers. Best Answer: A venues cost are the breakdown of material and square footage. Without knowing if you want Italian marble brought over or merely painted concrete, without knowing if you are planning on a hall to hold 100 people or 1000 people, it would be impossible to answer this."
242,msmarco,_doc,MARCO_5237237,4.4774685,"On 18th April 1791 Wilberforce introduced a bill to abolish the slave trade. Wilberforce was supported by William Pitt, William Smith, Charles Fox, Richard Brinsley Sheridan, William Grenville and Henry Brougham.The opposition was led by Lord John Russell and Colonel Banastre Tarleton, the MP for Liverpool.n 1807 Thomas Clarkson published his book History of the Abolition of the African Slave Trade. He dedicated it to the nine of the twelve members of Lord Grenville's Cabinet who supported the Abolition of the Slave Trade Act and to the memories of William Pitt and Charles Fox."
243,msmarco,_doc,MARCO_8007932,4.47003,"The fees are £9 for Basic Breakdown Cover, £24 for vehicle cover and cover for you, £33 for cover for two people and £42 for family cover. There is a fee of £9 each for National Recovery, At Home and Onward Travel. If paying monthly, these fees will be split across your monthly instalments.e're the UK's largest breakdown organisation – which means we fix more breakdowns at the roadside than anyone else. There's no charge for labour at the roadside, and more than 95% of our breakdown cover reviews recommend us."
244,msmarco,_doc,MARCO_2232907,4.4592466,"Threatened is one level short from being Endangered.   Historically, sea otters numbered between several hundred th…ousand to more than a million. But due to the fur trade, worldwide numbers plummeted down to a total of 1000-2000 in the early 1900s. As of 2006, the three-year running average is approximately 2,750 southern sea otters off the coast of California. There are between 64,600 and 77,300 northern sea otters residing in Alaska, Canada and Washington. There are approximately 15,000 in Russia and less than a dozen in Japan. Convention on International Trade in Endangered Species of Wild Fauna and Flora, an international treaty with 172 member countries."
245,msmarco,_doc,MARCO_2846663,4.4563413,LED Strip Lights | LED Light Fixtures | LED Modules | LED Power | LED Dimmers | LED Color Controls | DMX Controls | LED Channels. Indoor LED Strips | Outdoor LED Strips | Color Changing LED Strips | Color Chasing LED Strips | 12V LED Strips | 24V LED Strips.
246,msmarco,_doc,MARCO_2559022,4.446895,"In addition to the hormonal changes caused by menopause, age causes breakdown in muscle tissue. Genetic factors are also thought to play a role. All of these factors contribute to the build up of fatty tissue around your waist."
247,msmarco,_doc,MARCO_4485980,4.446895,"Longshot vs Longstrike. With 2 major sniper rifles on the market, it may be difficult to choose between one or the other. We all have our own preferences, which will surely play as a factor in which blaster you decide to get. To make things easier, here is a breakdown of those factors you may be keen for. Contents."
248,msmarco,_doc,MARCO_4607137,4.4400845,1823 - Ashley Fur Trading Company attack. Ashley Fur Trading Company attack by Arikara 1823. Arikara Indians attack a fur trading party led by a General Ashley. Twelve of the fur traders were killed and eleven wounded.This fight is one of the first fights between Indians and whites in South Dakota.News of the attack on the Ashley party resulted in the launching of a punitive expedition against the Arikaras.The expedition was under the command of Col. Henry Leavenworth. The troops consisted of six companies of the 6th U.S. Infantry and several groups of fur traders.ews of the attack on the Ashley party resulted in the launching of a punitive expedition against the Arikaras. The expedition was under the command of Col. Henry Leavenworth. The troops consisted of six companies of the 6th U.S. Infantry and several groups of fur traders.
249,msmarco,_doc,MARCO_1539504,4.4371247,"Many factors can and do increase the rate of chemical reactions. The most obvious is an increase in temperature, although too large an increase can breakdown the reactan … ts. Other factors include catalysts, enzymes, pressure, concentration of reactants, surface area and other forms of energy (UV is an example)."
250,msmarco,_doc,MARCO_6940178,4.436035,"People with excess thyroid production are often in a catabolic state as excess thyroid hormone can cause muscle protein breakdown mainly mediated by increasing UPP activity (21). Additionally, low level of plasma insulin triggers protein breakdown in muscle through activation of the UPP (6, 7).As you know, insulin is an anti-catabolic hormone and suppresses protein breakdown.eople with excess thyroid production are often in a catabolic state as excess thyroid hormone can cause muscle protein breakdown mainly mediated by increasing UPP activity (21). Additionally, low level of plasma insulin triggers protein breakdown in muscle through activation of the UPP (6, 7)."
251,msmarco,_doc,MARCO_79510,4.43323,"Factors influencing the fear of crime include the psychology of risk perception, circulating representations of the risk of victimization (chiefly via interpersonal communication and the mass media), public perceptions of neighborhood stability and breakdown, the influence of neighbourhood context, and broader factors where anxieties about crime ..."
252,msmarco,_doc,MARCO_5286477,4.4312854,Cost Factors Of Snow Removal. There are some important cost factors to consider when budgeting for a snow removal service. Below is a breakdown of what goes into the overall cost for a snow plowing service: Driveway Size. The size of your driveway will greatly affect the overall cost of your snow removal.
253,msmarco,_doc,MARCO_1236021,4.429777,"Trade Names: Neupogen®, Granix®, Zarxio® Other Names: G-CSF, granulocyte-colony stimulating factor. Chemocare.com uses generic names in all descriptions of drugs. Neupogen, Granix and Zarxio are trade names for filgrastim. Granulocyte - colony stimulating factor (G-CSF) is another name for filgrastim. In some cases, health care professionals may use the trade name Neupogen, Granix or Zarxio when referring to the generic drug name filgrastim. Drug type: Filgrastim is a biologic response modifier. It is classified as a colony stimulating factor and a hematopoietic agent."
254,msmarco,_doc,MARCO_1885799,4.4276037,"International trade is, in principle, not different from domestic trade as the motivation and the behavior of parties involved in a trade do not change fundamentally regardless of whether trade is across a border or not.hus international trade is mostly restricted to trade in goods and services, and only to a lesser extent to trade in capital, labor or other factors of production."
255,msmarco,_doc,MARCO_5676394,4.421591,"However, your credit score has a lot more significance if you know how the credit reporting agencies calculate this number. Here's a breakdown on how credit bureaus go about calculating your credit score, the factors that are considered, and the percentage that each factor is given in calculating your final score: 1  Payment history: 35%. 2  The moral of this story is to pay your bills on time."
256,msmarco,_doc,MARCO_7625661,4.4208536,"While there are too many people in some areas of the continent, there are too few in others. To a large extent, this peculiarity has been a function of such factors as the slave trade, ethnic wars, migratory movements and indiscriminate balkanisation of Africa by colonial powers.hile there are too many people in some areas of the continent, there are too few in others. To a large extent, this peculiarity has been a function of such factors as the slave trade, ethnic wars, migratory movements and indiscriminate balkanisation of Africa by colonial powers."
257,msmarco,_doc,MARCO_7200553,4.418347,"The following are the major differences between domestic trade and international trade:-. 1.Mobility in Factor Of Production. Domestic Trade: Free to move around factors of production like land, labor, capital and labor capital and entrepreneurship from one state to another within the same country. International Trade: Quite restricted."
258,msmarco,_doc,MARCO_5007189,4.4103174,"The beginnings of the Hanseatic League, however, cannot simply be explained by the trade network that developed between Westphalia and the Baltic Sea. An equally important trade route, connecting Cologne with England and Denmark, started to grow.he densification of trade in the Hanseatic area was accompanied by the specialization of the Hanse merchants. They focused increasingly on certain types of goods or regions, be it trade in cloth, salt or grain or trade with England or Bergen."
259,msmarco,_doc,MARCO_3200249,4.4093914,"Dubbed “sea parrots” as well as “clowns of the sea,” Atlantic puffins sport large, brightly-colored beaks on their substantially-sized heads. Crisp black and white markings on their plumage, as well as superior diving capabilities, have led people to compare the northern seabirds to penguins."
260,msmarco,_doc,MARCO_3127914,4.4093494,Are bulbs with more leds brighter than bulbs with less?The number of leds is not the determining factor of bulb brightness. Different types of leds vary greatly in size and light output. The most accurate indicators of the brightness of LED bulbs are the measured lumens or lux. Lumens measure the total amount of light output from a bulb. Lux measures how bright the light is on a surface at a specified distance.
261,msmarco,_doc,MARCO_6776137,4.406475,"InvestorWords.com - Online Investing Glossary. An agreement between states, regions, or countries, to reduce barriers to trade between the participating regions. The most well known trade bloc is NAFTA, between the United States, Canada, and Mexico. Some opponents of trade blocs believe that such agreements are detrimental to global free trade. “ The neighboring countries had a definitive trade bloc well established to keep commerce flowing across the narrow sea to everyone."
262,msmarco,_doc,MARCO_3368809,4.39088,"3 Prevention and Treatment of Nephropathy: Managing the adverse effects associated with CNI toxicity can be challenging. Systemic hypertension is the primary adverse effect associated with renal artery constriction and activation of RAAS.p regulation of transforming growth factor beta (TGB-F), a growth factor is also thought to have important implications in chronic CNI toxicity. TGB-F decreases the breakdown and encourages the production of extracellular matrix proteins, which ultimately promotes interstitial fibrosis."
263,msmarco,_doc,MARCO_4594316,4.3784585,"Aegean Sea-an arm of the Mediterranean between Greece and Turkey; a main trade route for the ancient civilizations of Crete and Greece and Rome and Persia. Aegean. Aegean island-an island in the Aegean Sea. Lemnos, Limnos-a Greek island in the northern Aegean Sea; famous for a reddish-brown clay that has medicinal properties. Mediterranean, Mediterranean Sea-the largest inland sea; between Europe and Africa and Asia. 1  Facebook."
264,msmarco,_doc,MARCO_7450732,4.3770857,Sea water will flood the rift valleys and they will eventually become seas like the Red Sea. Oceanic rift zones Oceanic rift zones occur deep in ocean basins where two oceanic plates are separating. These rift zones were not discovered until the middle of the last century. The discovery of rift zones led to the understanding of how continental drift could occur on our planet that had been proposed by Alfred Wegener earlier in the 20th Century.
265,msmarco,_doc,MARCO_785037,4.3719225,"Thermage® Price Breakdown. Thermage ® cost is markedly less than the cost of other, more invasive facial rejuvenation therapies. In the United States, the average cost of a Thermage ® skin tightening treatment is between $1,000 and $5000, while a traditional facelift can cost as much as $10,000.A number of issues factor into the cost of Thermage® treatment, including:n the United States, the average cost of a Thermage ® skin tightening treatment is between $1,000 and $5000, while a traditional facelift can cost as much as $10,000. A number of issues factor into the cost of Thermage® treatment, including:"
266,msmarco,_doc,MARCO_3688078,4.3719225,"Social Work Salaries. The following is a breakdown of the average social worker salaries in all 50 states and for several different specializations, courtesy of the Bureau of Labor Statistics.Social worker salaries can vary widely depending on several factors, including your specialization, state and qualifications.Qualifications can range from the number of years spent as a social worker, whether or not you have a Masters of Social Work and what types of special certifications you might hold.ocial worker salaries can vary widely depending on several factors, including your specialization, state and qualifications. Qualifications can range from the number of years spent as a social worker, whether or not you have a Masters of Social Work and what types of special certifications you might hold."
267,msmarco,_doc,MARCO_7632537,4.3719225,"Other factors that will determine the chimney cleaning cost is how often you use your fireplace. If you use the fireplace often, then you may need to have the chimney cleaned more than once a year. If you occasionally use the fireplace, then once a year cleaning is appropriate.The type of creosote buildup can also play a factor in the cost of cleaning.Creosote is formed from the type of wood you burn in your fireplace and the moisture that is in the wood. The average chimney cleaning cost is quite reasonable and we strive to keep our prices low and quality high.For a detailed cost breakdown click here Chimney Cleaning Cost.hile each chimney is different and the cost would be different, the first thing is to have the chimney inspected first. The inspection will determine if there is any repairs that need to be done to the chimney. It will also determine how thick the creosote."
268,msmarco,_doc,MARCO_6727689,4.37081,"Information About Sea Turtles: Conservation Strategies. To truly protect sea turtles around the world, many different countries and cultures must cooperate and share responsibility. International laws and agreements, research, and the work of dedicated organizations and individuals each must play a part.f sea turtles were going extinct because of geological or climatic changes, there would be very little we could do to help. Some immediate goals for protecting sea turtles include: * Crack down on illegal international trade in sea turtles and their products by enforcing laws and agreements."
269,msmarco,_doc,MARCO_3725746,4.3686037,Through Hole RGB LEDs Ultraviolet LEDs Red LEDs Green LEDs Blue LEDs White LEDs High Powered LEDs and COB LEDs Surface Mount Device (SMD) SMD 5050 SMD 5630 SMD 2835 Pre Wired LEDs and LED Bolts Panel Indicator Lights BA9s LED Bulbs Component LED Accessories Resistors Drivers Lenses and Mounts Bare Circuit Boards.
270,msmarco,_doc,MARCO_2290752,4.3683925,"As of January 31, 2007, we reserved approximately $1,510,000 for allowances for customer chargebacks and trade discounts. We terminated our Factoring Agreement on July 31, 2007. For shipments subsequent to July 31, 2007, we have assumed the credit risk for all of our trade receivables.s of January 31, 2007, we reserved approximately $1,510,000 for allowances for customer chargebacks and trade discounts. We terminated our Factoring Agreement on July 31, 2007. For shipments subsequent to July 31, 2007, we have assumed the credit risk for all of our trade receivables."
271,msmarco,_doc,MARCO_3363634,4.364302,"Wow-- It finally happened! Facebook is now a publicly traded company. This site was created in May of 2011 to provide readers a breakdown of Facebook's top shareholders while it was privately-held. Now that shares are in the public markets, ownership will become significantly more expansive."
272,msmarco,_doc,MARCO_4424311,4.364302,Many traders prefer to trade with Ichimoku once they learn to see the trend in a new way with Ichimoku. This article is a complete breakdown of the components of the indicator as well as how you can turn this indicator into a trend following system. Patience is a high virtue.
273,msmarco,_doc,MARCO_3000403,4.3632364,"The success of the first two Oasis-class ships led Royal Caribbean Cruises to order a third ship of the type in December 2012. Harmony of the Seas was floated out on 19 June 2015, began her first sea trials on 10 March 2016, and was delivered to Royal Caribbean on 12 May 2016. After a construction time of 32 months, the ship first set sail on 15 May 2016 from the STX France docks in Saint-Nazaire, viewed by some 70,000 people."
274,msmarco,_doc,MARCO_1960805,4.362346,"Government Response to the Great Depression. The outbreak of the Great Depression in the fall of 1929 caused much economic hardship in Newfoundland and Labrador. Most damaging was a breakdown in world trade, which caused the country’s revenue to plummet."
275,msmarco,_doc,MARCO_2939365,4.3591614,"OPENCities – Lesson 2: Why do people migrate?Worksheet Task 1 Read this quotation and discuss the questions:“.... it is impossible to separate the globalisation of trade and capital from the global movement of people.” (The Economist, 2002)1.orksheet Task 9 Read the text and then write the push & full factors in the right columns. Why do people migrate? There are lots of reasons for people to move from one place to another. There are factors that make some people’s countries unattractive, and there are factors that make other places attractive."
276,msmarco,_doc,MARCO_552954,4.356885,"The American Society of Plastic Surgeons (ASPS) has reported that the average cost for liposuction in 2011 was $2,984. The average minimum cost during 2011 was $2,667, while the maximum cost was $3,038.This is the national average, and there are several factors that can affect the particular prices in any area.Following is a breakdown of typical liposuction costs by body area: 1  Upper & Lower Abdominal Liposuction (both upper and lower) $4,000-$9,000. 2  Lower Abdominal Liposuction (lower only) $2,500-$5,000.3  Arm Liposuction (upper and lower) $2,000-$6,000.he average minimum cost during 2011 was $2,667, while the maximum cost was $3,038. This is the national average, and there are several factors that can affect the particular prices in any area."
277,msmarco,_doc,MARCO_6992068,4.3545413,"The Direct Cremation is the most simple of cremation options and least costly. For a breakdown of all the costs and services we offer, please download our General Price List below. Download Pricelist. The Federal Trade Commission requires the services and prices we charge to be displayed in the manner below."
278,msmarco,_doc,MARCO_1245577,4.352595,"The chart on this page features a breakdown of the total annual pay for Karl A. Roessner , Chief Executive Officer at E TRADE FINANCIAL CORP as reported in their proxy statements. Total Cash Compensation information is comprised of yearly Base Pay and Bonuses."
279,msmarco,_doc,MARCO_2611117,4.352595,Category Breakdown. Overview. Global Payments Inc. (globalpaymentsinc.com) is one of the largest credit card processors in the payment processing industry and has been in business since the 1960s. It’s also one of the few merchant account providers to be publicly traded on the New York Stock Exchange (NYSE: GPN).
280,msmarco,_doc,MARCO_6538084,4.350342,breakdown voltage. (electricity). The voltage measured at a specified current in the electrical breakdown region of a semiconductor diode. Also known as Zener voltage. The voltage at which an electrical breakdown occurs in a dielectric. The voltage at which an electrical breakdown occurs in a gas. Also known as breakdown potential; sparking potential; sparking voltage.
281,msmarco,_doc,MARCO_5568636,4.348707,"By contrast, the National Mining Association, a trade group, counted 195,494 coal-mining jobs in 2012. The breakdown: miners (including contractors): 137,650; support activities: 6,930; transportation: 50,914. That’s nearly 53,000 more than Whitehouse’s solar jobs number."
282,msmarco,_doc,MARCO_7518107,4.3467665,"We already got a preview of the Arrow/Flash two-part crossover event, with details including a famous rogue (Captain Boomerang) being involved, and Arrow and Flash butting heads (and trading blows) at some point. Today, however, we have the full breakdown – courtesy of some new episode synopses released by WBTV."
283,msmarco,_doc,MARCO_7450338,4.3448277,"If you’re looking for low prices, shoulder season — the time between peak and low season — is a great option, but it may come with trade-offs like rainy weather or fewer wildlife sightings. Check out our breakdown of the best time to cruise based on destination, weather, and price:"
284,msmarco,_doc,MARCO_455472,4.3445444,We help you to save on the cost of multi car breakdown cover so you don't pay any more than you need to on your dual car breakdown policy.This is a list of breakdown insurance companies that offer personal cover. You can visit each insurer's website to view policy details and get quotes.How our site works.e help you to save on the cost of multi car breakdown cover so you don't pay any more than you need to on your dual car breakdown policy.
285,msmarco,_doc,MARCO_7680161,4.3434606,"Irish people originate from the MIDDLE EAST: Celtic DNA shows farming led to a 'wave of immigrants' entering Ireland 4,000 years ago. The set of traits that make Celtic people so distinct may have been established 4,000 years ago, due to an influx of people from the Black Sea and the Middle East."
286,msmarco,_doc,MARCO_689751,4.3428316,"Like Weeds of the Sea, ‘Brown Tide’ Algae Exploit Nutrient-Rich Coastlines. A new study led by Lamont-Doherty graduate student Kyle Frischkorn shows how ‘brown tide’ algae thrive in waters that are murky and low in inorganic nutrients. The sea-grass beds of Long Island’s Great South Bay once teemed with shellfish. Clams, scallops and oysters filtered nutrients from the water and flushed money through the local economy. But three decades after the algae that cause brown tides first appeared here, much of the sea grass and the bounty it used to provide is gone."
287,msmarco,_doc,MARCO_7423748,4.339022,"Crew of the RMS Titanic. 1  RMS Titanic's four surviving officers: Fifth Officer Harold Lowe, Second Officer Charles Lightoller, Fourth Officer Joseph Boxhall, and Third Officer Herbert Pitman, seated. 2  Breakdown of casualties according to the British Board of Trade report (click for detail)."
288,msmarco,_doc,MARCO_5571211,4.338781,UNLIMITED NCLEX TEST PREP ACCESS. 1  NCLEX Style Question Breakdown Safe Effective Care Environment. 2  NCLEX Style Question Breakdown Safety Infection Control. 3  NCLEX Style Question Breakdown Delegation. 4  NCLEX Style Question Breakdown Health Promotion Maintenance. 5  NCLEX Style Question Breakdown Reduction of Risk Potential.
289,msmarco,_doc,MARCO_8047908,4.338781,"Equipment Breakdown Rider Improve your commercial lines package the easy way, with Equipment Breakdown Insurance The Equipment Breakdown Rider is an endorsement for commercial lines package policies, available to a number of Property and Casualty insurers in Canada. It is an easy way for brokers to include equipment breakdown insurance in the commercial lines packages with these insurers. What's Covered? Nearly everything that is mechanical, electrical or under pressure can be insured for loss due to breakdown."
290,msmarco,_doc,MARCO_4186309,4.337091,"Simvastatin, marketed under the trade name Zocor among others, is a lipid-lowering medication. It is used along with exercise, diet, and weight loss to decrease elevated lipid (fat) levels. It is also used to decrease the risk of heart problems in those at high risk. It is taken by mouth. Serious side effects may include muscle breakdown, liver problems, and increased blood sugar levels."
