,_index,_type,_id,_score,_source.body
0,msmarco,_doc,MARCO_2762270,6.7694926,"Trade, Commerce and Crafts. The Phoenicians, appeared on the scene with an established maritime tradition, and the technology to build ships with a keeled hull. This allowed them to sail the open seas, and as a result, the Phoenicians developed a flourishing sea trade. In addition to these exports and imports, the Phoenicians also conducted an important transit trade, especially in the manufactured goods of Egypt and Babylonia (Herodotus, i, 1). From the lands of the Euphrates and Tigris regular trade routes led to the Mediterranean."
1,msmarco,_doc,MARCO_5338685,6.5214634,"In terms of picture quality, OLED TVs are superior to LED/LCD TVs in nearly every way. But picture quality isn’t the only consideration at play. Let’s do a point-by-point breakdown of how OLED and LED TVs stack up against each other. Black Level – Winner: OLED. A display’s ability to produce deep, dark blacks is arguably the most important factor in achieving excellent picture quality."
2,msmarco,_doc,MARCO_6327863,6.409894,"Cost breakdown for standard 20 light system with LED fixtures: The following is a more general breakdown of all the elements in a functional outdoor lighting system. The only thing missing here is the cost of a time clock that turns lights on and off at the hours you choose. 1  Fixtures: $1800. 2  Wire: $200.3  Transformer: $200.4  LED Bulbs: $900. 5  Misc. 6  Labor: $600. 7  Total: $3,800.00.he only thing missing here is the cost of a time clock that turns lights on and off at the hours you choose. 1  Fixtures: $1800. 2  Wire: $200. 3  Transformer: $200. 4  LED Bulbs: $900. 5  Misc. 6  Labor: $600. 7  Total: $3,800.00."
3,msmarco,_doc,MARCO_8398768,6.363759,"Protein, carb and fat guide. Protein – eat 75 to 175 grams of protein per day Most people should eat between 0.5 to 1 gram of protein per pound of ideal body weight. Eating protein helps prevent the breakdown of muscle so your weight loss is fat, not muscle.In one study where dieters doubled their protein intake, they experienced a reduced appetite and consumed fewer calories, which ultimately led to significant weight loss.ating protein helps prevent the breakdown of muscle so your weight loss is fat, not muscle. In one study where dieters doubled their protein intake, they experienced a reduced appetite and consumed fewer calories, which ultimately led to significant weight loss."
4,msmarco,_doc,MARCO_5055393,6.3017654,"All these factors led to declining world trade, high unemployment, and plummeting living standards in many countries. In 1944, the Bretton Woods Agreement established a new international monetary system. The creation of the International Monetary Fund (IMF) and the World Bank were two of its most enduring legacies.The World Bank and the IMF, often called the Bretton Woods Institutions, are twin intergovernmental pillars supporting the structure of the world’s economic and financial order.ll these factors led to declining world trade, high unemployment, and plummeting living standards in many countries. In 1944, the Bretton Woods Agreement established a new international monetary system. The creation of the International Monetary Fund (IMF) and the World Bank were two of its most enduring legacies."
5,msmarco,_doc,MARCO_2606575,6.055712,Examples from the Web for trade balance Expand. Historical Examples. The trade balance inclined to the disadvantage of Norway whose sole article of export at that time was dried fish. There is no great excess of trade balance at any season in favour of Germany or France and against England. Over the greater part of the world the rate of exchange on London is an indication simply of the trade balance. It is on cotton that the United States has depended for the payment of its trade balance to Europe. A breakdown of the trade balance by all four trading areas was available only for the 1965-70 period.
6,msmarco,_doc,MARCO_3036833,5.8888993,"The early Chinese people knew there were other tribes of people to the north. But they did not know there were other ancient civilizations in other parts of the world. The Chinese were isolated by their many natural barriers. To the east and south, China borders two seas-the China Sea and the Yellow Sea.Although these bodies of water provided food and water routes for trade, both seas are located in the Pacific Ocean.he Chinese were isolated by their many natural barriers. To the east and south, China borders two seas-the China Sea and the Yellow Sea. Although these bodies of water provided food and water routes for trade, both seas are located in the Pacific Ocean."
7,msmarco,_doc,MARCO_4825917,5.7421,"In an internal, or dispositional, attribution, people infer that an event or a person’s behavior is due to personal factors such as traits, abilities, or feelings. In an external, or situational, attribution, people infer that a person’s behavior is due to situational factors.Example: Maria’s car breaks down on the freeway. If she believes the breakdown happened because of her ignorance about cars, she is making an internal attribution.n an internal, or dispositional, attribution, people infer that an event or a person’s behavior is due to personal factors such as traits, abilities, or feelings. In an external, or situational, attribution, people infer that a person’s behavior is due to situational factors."
8,msmarco,_doc,MARCO_3252400,5.7201004,"These factors are the difference between the cheap £99 per year breakdown cover and the £300+ a year courier breakdown cover. If you add up all of these expenses, and work out a cost per mile over an average 80,000 miles per year, it comes in around 83p.More Courier Costs; But there are two very important costs that aren't included in the list.The first is time.The time of the driver/owner, i.e his wages.hese factors are the difference between the cheap £99 per year breakdown cover and the £300+ a year courier breakdown cover. If you add up all of these expenses, and work out a cost per mile over an average 80,000 miles per year, it comes in around 83p."
9,msmarco,_doc,MARCO_2862168,5.5902467,"Tweet. The Ottoman Empire joined the Central Powers to form the Triple Alliance with the signing of the August 1914 Turco-German Alliance. Turkey formally entered World War I on October 28, 1914, with the bombing of Russian Black Sea ports.The Triple Entente, or Allied Powers, declared war on the Ottoman Empire on November 4.Two major factors led to Ottoman involvement on the side of the Central Powers: German pressure and the opportunism of Turkish minister of war Enver Pasha.he Triple Entente, or Allied Powers, declared war on the Ottoman Empire on November 4. Two major factors led to Ottoman involvement on the side of the Central Powers: German pressure and the opportunism of Turkish minister of war Enver Pasha."
10,msmarco,_doc,MARCO_2862169,5.579156,"The Ottoman Empire Enters WWI on the side of the Central Powers. The Ottoman Empire joined the Central Powers to form the Triple Alliance with the signing of the August 1914 Turco-German Alliance.Turkey formally entered World War I on 28 October 1914 with the bombing of Russian Black Sea ports. The Triple Entente, or Allied Powers, declared war on the Ottoman Empire on November 4.Two major factors led to Ottoman involvement on the side of the Central Powers: German pressure and the opportunism of Turkish minister of war Enver Pasha.he Triple Entente, or Allied Powers, declared war on the Ottoman Empire on November 4. Two major factors led to Ottoman involvement on the side of the Central Powers: German pressure and the opportunism of Turkish minister of war Enver Pasha."
11,msmarco,_doc,MARCO_1021623,5.5698533,"Knowing what are the best football cards to buy can be tough for some collectors, especially when there are so many to choose from. Here is a breakdown of today’s top football cards of 2015 and rookie cards of today’s hottest players. These are currently the hottest or most searched football cards in the industry. Follow the links to find out what the best rookie cards of each player and their current values. Each card has a breakdown of their most valuable trading cards as well as their most popular traded cards."
12,msmarco,_doc,MARCO_3715084,5.5698533,But not all hype is created equal. One position inevitably dominates the national headlines: Quarterback. Dissatisfied fans and media alike clamor for their team to trade up for that year's stud QBs. This year's buzz is all about trading up to the No. 2 slot to pick RGIII. Lost in all the excitement is a breakdown of where starting QBs were actually drafted. This article provides that breakdown by examining the draft position of starting QBs for the 2011 season as well as the most successful QBs over the last few years.
13,msmarco,_doc,MARCO_5410107,5.565652,"Compare Sealy, TX Demographics To Other Cities. Sealy population breakdown by race. In Sealy, 35.3% of people are of Hispanic or Latino origin. Please note: Hispanics may be of any race, so also are included in any/all of the applicable race categories above."
14,msmarco,_doc,MARCO_1710134,5.5299397,"d) An un-protected PDF copy of the Union Trade Wage Breakdown sheet for each trade being submitted. The processing of any Change Orders will be contingent upon prior receipt and approval of the PROJECT. LABOR RATE SUMMARY sheet and a LABOR RATE sheet for each trade, for each Journeyman, Foreman. and General Foreman. The LABOR RATE sheets shall be submitted for all trade work to be either self-. performed by the contractor or for ALL tiers of subcontracted work, in accordance with Article 15 of the U-M."
15,msmarco,_doc,MARCO_1385919,5.5206327,"The physical characteristics of the deep sea are abiotic factors that deep sea life must contend with to survive. Light, pressure, temperature, oxygen and food have all led to the fascinating adaptions of deep sea life used to see, feel, feed, reproduce, move, and avoid being eaten by predators."
16,msmarco,_doc,MARCO_5156482,5.509911,"Amerigo Vespucci was an Italian explorer who first discovered that the West Indies and Brazil were not part of Asia as initally thought, but rather a whole new continent. The new continent was named America, which is believed to be derived from his first name. Vasco da Gama (1460-1524) Nationality: Portuguese Known For: First European to reach India by sea Vasco da Gama commanded the very first ships that sailed nonstop from Europe to India. This voyage also made him the first European to get to India by sea. His finding of this route led to great increases in trade and boosted the Portuguese economy. Francisco Pizarro (1471-1541)"
17,msmarco,_doc,MARCO_2835471,5.4866323,"While the main driver of Honduras' breakdown in law and order has been the drug trade, another factor has been the rampant corruption and the weakness of the institutions of state. It is little surprise, then, that the security crisis is dominating the campaign trail for next Sunday's presidential elections."
18,msmarco,_doc,MARCO_2044780,5.4464417,"Here's a breakdown of how a typical modern LED works: 1  Before any light is emitted, electricity must first pass through an LED driver. 2  The diode, which is the most simple type of semiconductor, glows when electricity passes through it. 3  Picture that warm, inviting, uniform glow of a traditional table lamp."
19,msmarco,_doc,MARCO_566350,5.4457903,Cost breakdown for standard 20 light system with LED fixtures: The following is a more general breakdown of all the elements in a functional outdoor lighting system. The only thing missing here is the cost of a time clock that turns lights on and off at the hours you choose. 1  Fixtures: $1800. 2  Wire: $200.3  Transformer: $200.he only thing missing here is the cost of a time clock that turns lights on and off at the hours you choose. 1  Fixtures: $1800. 2  Wire: $200. 3  Transformer: $200.
20,msmarco,_doc,MARCO_1068878,5.4451876,"2. Failure Probabilities interlayer breakdown is unlikely to be the dominant failure mechanism since it provides a safety factor of 15 above the maximum IPC standard for internal conductors (30,000 V/mm vs. 2,000 V/mm).Dielectric breakdown is measured parallel to the lamination direction.. Failure Probabilities interlayer breakdown is unlikely to be the dominant failure mechanism since it provides a safety factor of 15 above the maximum IPC standard for internal conductors (30,000 V/mm vs. 2,000 V/mm)."
21,msmarco,_doc,MARCO_3946424,5.444499,"B. Prohibition led to the 18th Amendment, which made Prohibition the law of the land. C. Prohibition led to the passage of the Pure Food and Drug Act. D. Prohibition addressed individual behavior rather than that of corporations or... show more A. Prohibition treated alcohol as a moral breakdown in society."
22,msmarco,_doc,MARCO_2601049,5.4406767,Non-clastic sedimentary rocks form from the precipitation (Precipitation is the separating of a solid from a solution) of minerals from ocean water or from the breakdown of the shells and bones of sea creatures.Sea animals such as coral produce calcium carbonate solutions that harden to form rock.on-clastic sedimentary rocks form from the precipitation (Precipitation is the separating of a solid from a solution) of minerals from ocean water or from the breakdown of the shells and bones of sea creatures.
23,msmarco,_doc,MARCO_711630,5.436849,"With the breakdown of Rome's control of Britain it became possible for the Angles, Saxons and Jutes from across the North Sea who had been raiding the coast of Britain for a hundred years to increase their pressure. Instead of raiding and then withdrawing, by about 450 A.D they were beginning to settle here.ith the breakdown of Rome's control of Britain it became possible for the Angles, Saxons and Jutes from across the North Sea who had been raiding the coast of Britain for a hundred years to increase their pressure. Instead of raiding and then withdrawing, by about 450 A.D they were beginning to settle here."
24,msmarco,_doc,MARCO_2567199,5.4296174,"The first victim was a schoolmaster in the village of Yambuku in the north of the country. The disease got its name from the nearby Ebola River, a tributary of the Congo River. That first outbreak infected at least 318 people and killed 88 per cent of the people affected.he Ebola outbreak in West Africa is by a long way the worst ever. It has infected at least 8,000, killed more than 3,000 and has led to the breakdown of the healthcare systems of entire states in the worst affected countries: Guinea, Liberia and Sierra Leone."
25,msmarco,_doc,MARCO_5218373,5.409849,"According to our research, 2,371 student-athletes were awarded FBS scholarships. Florida led the way with 336 student-athletes from Sunshine State schools being given scholarships. Texas was right behind with 330 players, followed by California with 224 players, Georgia with 210 and Ohio with 121. IMG Academy in Florida led all schools with 15 FBS signees, followed closely by fellow Floridian St. Thomas Aquinas with 13. Below is the state-by-state breakdown."
26,msmarco,_doc,MARCO_3581778,5.4022303,"The intention of the provisional government was the organization of elections to the Russian Constituent Assembly and its convention. The government was initially composed of the Kadet coalition led by Prince Georgy Lvov, which was replaced by the Socialist coalition led by Alexander Kerensky.t the same time the Russian Emperor Nicholas II abdicated in favor of the Grand Duke Michael who agreed that he would accept after the decision of Russian Constituent Assembly. The Provisional Government was unable to make decisive policy decisions due to political factionalism and a breakdown of state structures."
27,msmarco,_doc,MARCO_1044302,5.398432,"Arthritis in the hands is the most common type of arthritis. It occurs as a result of the breakdown of the cartilage that support the bone structure. Since we use our hands and fingers in most activities, arthritis in the hands can be a cause of discomfort and uneasiness.Swollen fingers, joint inflammation, stiffness and pain are some of the symptoms of hand arthritis.Advancements in the medical field have led to the development of many methods for controlling the various arthritis symptoms.wollen fingers, joint inflammation, stiffness and pain are some of the symptoms of hand arthritis. Advancements in the medical field have led to the development of many methods for controlling the various arthritis symptoms."
28,msmarco,_doc,MARCO_167794,5.3911533,The Manila-Acapulco Transpacific Trade Route. Spain's exploration and colonization of the Americas as well as the Philippines and Mariana Islands in the Western Pacific led to the development of a transpacific trade route between Asia and the Americas which was dominated by Spain for three centuries.he Manila-Acapulco Transpacific Trade Route. Spain's exploration and colonization of the Americas as well as the Philippines and Mariana Islands in the Western Pacific led to the development of a transpacific trade route between Asia and the Americas which was dominated by Spain for three centuries.
29,msmarco,_doc,MARCO_1571304,5.379757,"To be sure, many more policymakers today acknowledge the benefits of free trade than when Congress passed the Tariff Act of 1930 (the Smoot-Hawley Act). The devastation wrought by these protectionist tariffs led successive U.S. administrations to support free trade after World War II.o be sure, many more policymakers today acknowledge the benefits of free trade than when Congress passed the Tariff Act of 1930 (the Smoot-Hawley Act). The devastation wrought by these protectionist tariffs led successive U.S. administrations to support free trade after World War II."
30,msmarco,_doc,MARCO_2922343,5.377513,"In the Middle Ages, the Volga trade route connected Northern Europe and Northwestern Russia with the Caspian Sea, via the Volga River. The Rus used this route to trade with Muslim countries on the southern shores of the Caspian Sea, sometimes penetrating as far as Baghdad.n the Middle Ages, the Volga trade route connected Northern Europe and Northwestern Russia with the Caspian Sea, via the Volga River. The Rus used this route to trade with Muslim countries on the southern shores of the Caspian Sea, sometimes penetrating as far as Baghdad."
31,msmarco,_doc,MARCO_6426422,5.376479,"The location of Constantinople made it grow wealthy and prosperous because it is in between the Aegean and Black Sea. Also, it lies between the trade routes of Europe and Asia … .The two seas provided safe shelter for ships to pass through and fro. 5 people found this useful.he location of Constantinople made it grow wealthy and prosperous because it is in between the Aegean and Black Sea. Also, it lies between the trade routes of Europe and Asia … . The two seas provided safe shelter for ships to pass through and fro. 5 people found this useful."
32,msmarco,_doc,MARCO_2164134,5.3285074,"The controlling factors are the rate of weathering and erosion, or the breakdown of surface rocks, and the rate of deposition, compaction, and cementation. What factors control the rate of change in the formation of sedimentary rocks? The controlling factors are the rate of movement and the placement of a rock in high temperatures and pressure. What factors control the rate of change in the formation of metamorphic rocks? The amount of time it takes for a rock to move from Earth’s surface and completely melt and the amount of time the rock remains melted as magma are controlling factors of the rate of change of igneous rocks. What factors control the rate of change in the formation of igneous rocks?"
33,msmarco,_doc,MARCO_487574,5.3220205,"Storm surge is the most dangerous phenomenon associated with hurricanes. Figures vary, but it is responsible for between 70% and 90% of the death and damage attributed to hurricanes. Storm Surge is a large rise in sea level caused by severe weather conditions. Source: http://www.nhc.noaa.gov/HAW2/english/surge/surge_big.jpg. This illustration shows a visual breakdown of the factors affecting a surge event."
34,msmarco,_doc,MARCO_2022518,5.297293,"A major factor was that Portugal, which led the way in African exploration, trade, and conquest, had a relatively small population and limited resources, and by the sixteenth century shifted most of its energies from Africa to Asia, where until the seventeenth century it dominated the lucrative trade in spices."
35,msmarco,_doc,MARCO_1885797,5.2824974,"Thus international trade is mostly restricted to trade in goods and services, and only to a lesser extent to trade in capital, labor or other factors of production.Trade in goods and services can serve as a substitute for trade in factors of production.hus international trade is mostly restricted to trade in goods and services, and only to a lesser extent to trade in capital, labor or other factors of production."
36,msmarco,_doc,MARCO_4607817,5.2813387,"There are three important assets a broker can offer any new investor. The first and most important is an easy-to-use website and platform. After all, what good is trading online if you can’t figure out how to perform research or place an order? Second, a robust offering of educational content (see the “Education” section for a full breakdown) is always beneficial. Third is having access to virtual trading for practice and honing the art of trading."
37,msmarco,_doc,MARCO_2962713,5.2633643,"Earlier we discussed how stress and anxiety contribute to a nervous breakdown. It is also common for depression to to be a factor in a nervous breakdown, sometimes in the lead up to the nervous breakdown but more commonly following the nervous breakdown. Depression isn't just a psychological condition."
38,msmarco,_doc,MARCO_2288074,5.258561,"Several factors led to the new deal, one of those factors is the great depression. Another factor is the bad job President Hoover did as president. Several factors led to the new deal, one of those factors is the great depression. Another factor is the bad job President Hoover did as president."
39,msmarco,_doc,MARCO_396165,5.2582912,"Ancient Rome and Trade. Trade was vital to Ancient Rome. The empire cost a vast sum of money to run and trade brought in much of that money. The population of the city of Rome was one million and such a vast population required all manner of things brought back via trade.The Roman Empire was criss-crossed with trade routes.There were sea routes that covered the Mediterranean and Black Seas and numerous land routes using the roads built by the Romans.here was only one currency used and there were no complicating customs dues. Trade was also encouraged by many years of peace within the Empire. Trade was vital to the success of the Empire. When the Empire collapsed, trade throughout the lands that had once made up the Roman Empire, also collapsed."
40,msmarco,_doc,MARCO_6693391,5.2560534,"The Mediterranean Sea is connected to the Atlantic Ocean via the narrow Strait of Gibraltar between Spain and Morocco. This area is only about 14 miles (22 km) wide. The Mediterranean Sea is known for being an important historic trade and a strong factor in the development of the region around it.istory of the Mediterranean Sea. The region around the Mediterranean Sea has a long history that dates back to ancient times. For example, Stone Age tools have been discovered by archeologists along its shores and it is believed that the Egyptians began sailing on it by 3000 B.C.E."
41,msmarco,_doc,MARCO_7525867,5.235565,"The Hawaiian green sea turtle, also known as the honu, symbolizes good luck, endurance and long life. Green sea turtles are seen as navigators who can always find their way... The Hawaiian green sea turtle, also known as the honu, symbolizes good luck, endurance and long life. Green sea turtles are seen as navigators who can always find their way home. Because of the sacred status of turtles in ancient Hawaii, only members of the royal family were allowed to eat them. According to many Hawaiian legends, a green sea turtle led the first Polynesian settlers to Hawaii. The green sea turtle is also considered a guardian spirit, or aumakua, who can change shape at will. The Hawaiian god of the sea, Kanaloa, commonly assumed the shape of a sea turtle. Learn more about Symbolism"
42,msmarco,_doc,MARCO_2933222,5.230688,"6 posts • Page 1 of 1. Reefer breakdown-Having a claims issue.. Re: Reefer breakdown-Having a claims issue.. Re: Reefer breakdown-Having a claims issue.. Re: Reefer breakdown-Having a claims issue.. Re: Reefer breakdown-Having a claims issue.. Re: Reefer breakdown-Having a claims issue..by meytai » Tue Nov 03, 2009 7:41 pm. I am having a problem currently with a client, who happens to be my mom's husband, who purchased a cargo policy with the reefer breakdown endorsement about a year and a half ago.. well he was carrying an expensive load.. posts • Page 1 of 1. Reefer breakdown-Having a claims issue.. Re: Reefer breakdown-Having a claims issue.. Re: Reefer breakdown-Having a claims issue.. Re: Reefer breakdown-Having a claims issue.. Re: Reefer breakdown-Having a claims issue.. Re: Reefer breakdown-Having a claims issue.."
43,msmarco,_doc,MARCO_4991377,5.220634,"Opperhoofd is a Dutch word (pl. Opperhoofden) which literally means 'supreme chief'. In this VOC context, the word is a gubernatorial title, comparable to the English Chief factor, for the chief executive officer of a Dutch factory in the sense of trading post, as led by a factor, i.e. agent."
