,_index,_type,_id,_score,_source.body
490,msmarco,_doc,MARCO_3587648,4.1073294,What they mean is that mitochondria get the energy out of glucose in respiration: they use this energy to make a wonderful chemical called ATP. Cells need energy for other processes such as the synthesis of proteins from amino-acids and the replication of DNA.This energy usually comes from the breakdown of glucose; though fats and proteins can also be used a sources of energy. Glucose is a stable chemical: it does not just breakdown releasing energy.ells need energy for other processes such as the synthesis of proteins from amino-acids and the replication of DNA. This energy usually comes from the breakdown of glucose; though fats and proteins can also be used a sources of energy. Glucose is a stable chemical: it does not just breakdown releasing energy.
491,msmarco,_doc,MARCO_4617639,4.1066575,"The answer is yes. LED’s do emit visible light, which will fade clothing a little bit, but because clothing is faded mostly by UV light, something LEDs don’t emit, they will fade clothing much less than standard lighting.As well as the lack of UV light, LEDs don’t emit any heat either, another factor in the fading of clothing.he answer is yes. LED’s do emit visible light, which will fade clothing a little bit, but because clothing is faded mostly by UV light, something LEDs don’t emit, they will fade clothing much less than standard lighting."
492,msmarco,_doc,MARCO_426387,4.105533,"Abel Janszoon Tasman was a Dutch seafarer and explorer. He joined the Dutch East India Company in 1634, and soon after this, he was ordered to explore the south-east waters i … n order to find a new sea trade route to Chile in South America.bel Janszoon Tasman was a Dutch seafarer and explorer. He joined the Dutch East India Company in 1634, and soon after this, he was ordered to explore the south-east waters i … n order to find a new sea trade route to Chile in South America."
493,msmarco,_doc,MARCO_3804980,4.105533,El Ni o is an unusual warming of the tropical Pacific Ocean that occurs irregularly at about 3-6 year intervals in response to large scale weakenings of the trade winds that normally blow westward from South America toward Asia.t the onset of El Ni o conditions the trade winds slacken across much of the basin. The eastward tilt of the sea surface is then unbalanced and a series of ocean responses occur over a half-year period that lead to a more nearly flattened sea surface with less east-west contrast in temperatures and upper layer depths.
494,msmarco,_doc,MARCO_3946494,4.105533,"Failaka is believed to be the place described as the Garden of Eden in the Babylonian Gilgamesh epic. Failaka was founded in the third millennium BC by Dilmun, an important trading society based on the Persian Gulf as a sea lane connection between Mesopotamia and the Indus Valley civilizations of Pakistan and India.ailaka is believed to be the place described as the Garden of Eden in the Babylonian Gilgamesh epic. Failaka was founded in the third millennium BC by Dilmun, an important trading society based on the Persian Gulf as a sea lane connection between Mesopotamia and the Indus Valley civilizations of Pakistan and India."
495,msmarco,_doc,MARCO_6553205,4.105533,"A galley is a type of ship propelled by rowers that originated in the eastern Mediterranean Sea and was used for warfare, trade and piracy from the first millennium BC. Galleys dominated naval warfare in the Mediterranean from the 8th century BC until development of advanced sailing warships in the 17th century. galley is a type of ship propelled by rowers that originated in the eastern Mediterranean Sea and was used for warfare, trade and piracy from the first millennium BC. Galleys dominated naval warfare in the Mediterranean from the 8th century BC until development of advanced sailing warships in the 17th century."
496,msmarco,_doc,MARCO_6267778,4.105533,"Cephalopods are of considerable economic importance to humans. Many species of squid and octopus are eaten. Nautilus shells are often used decoratively, and the internal shell of a cuttlefish, or cuttle bone, is sold in the pet trade as a calcium source for birds.Giant cephalopods such as squid and octopuses are also a great source of sea-monster folklore.any species of squid and octopus are eaten. Nautilus shells are often used decoratively, and the internal shell of a cuttlefish, or cuttle bone, is sold in the pet trade as a calcium source for birds. Giant cephalopods such as squid and octopuses are also a great source of sea-monster folklore."
497,msmarco,_doc,MARCO_7581016,4.105533,The canal cuts across the Isthmus of Panama and is a key conduit for international maritime trade. There are locks at each end to lift ships up to Gatun Lake (85 feet (26 m) above sea-level).President Obama visited Miraflores Locks visitors center.he Panama Canal (Spanish: Canal de Panama) panamá is a-48 (mile.77 1) km ship canal In panama that connects The Atlantic (ocean via The Caribbean) sea to The Pacific. Ocean the canal cuts across The isthmus Of panama and is a key conduit for international maritime. trade
498,msmarco,_doc,MARCO_1465446,4.105105,"Crenation is the contraction of a cell after exposure to a hypertonic solution, due to the loss of water through osmosis. Hemolysis is the breakdown of red blood cells.17 people found this useful.renation is the contraction of a cell after exposure to a hypertonic solution, due to the loss of water through osmosis. Hemolysis is the breakdown of red blood cells. 17 people found this useful."
499,msmarco,_doc,MARCO_5193144,4.105105,"Dissociative disorders (DD) are conditions that involve disruptions or breakdowns of memory, awareness, identity, or perception. People with dissociative disorders use dissociation, a defense mechanism, pathologically and involuntarily.issociative disorders (DD) are conditions that involve disruptions or breakdowns of memory, awareness, identity, or perception. People with dissociative disorders use dissociation, a defense mechanism, pathologically and involuntarily."
500,msmarco,_doc,MARCO_269626,4.1035485,"CPK is also called creatine kinase or CK. Doctors may check CPK when there’s concern for muscle damage or breakdown: 1  In a rare condition called rhabdomyolysis, extreme muscle breakdown floods the blood with CPK and other chemicals in muscle cells.2  Some of these are toxic to the kidneys, making the condition dangerous.PK is also called creatine kinase or CK. Doctors may check CPK when there’s concern for muscle damage or breakdown: 1  In a rare condition called rhabdomyolysis, extreme muscle breakdown floods the blood with CPK and other chemicals in muscle cells."
501,msmarco,_doc,MARCO_1068879,4.1035485,"Due to hydrodynamics breakdown in liquids seems to be more complicated: using two spheres in the gap between the electrodes additional pressure is exerted by the non-linear field strength. Electrical breakdown occurs within a gas (or mixture of gases, such as air) when the dielectric strength of the gas is exceeded.Regions of high electrical stress can cause nearby gas to partially ionize and begin conducting.ue to hydrodynamics breakdown in liquids seems to be more complicated: using two spheres in the gap between the electrodes additional pressure is exerted by the non-linear field strength. Electrical breakdown occurs within a gas (or mixture of gases, such as air) when the dielectric strength of the gas is exceeded."
502,msmarco,_doc,MARCO_8007930,4.1035485,"We have sourced this number to save you time. There’s now no need for you to search the internet for the AA Breakdown Recovery contact number. You can call this AA Breakdown emergency number 24 hours a day, 7 days a week on 0843 850 2243.It will get you straight through to the correct team. If for any reason you experience any problems with this number, please drop us an email. This will let us correct it.e have sourced this number to save you time. There’s now no need for you to search the internet for the AA Breakdown Recovery contact number. You can call this AA Breakdown emergency number 24 hours a day, 7 days a week on 0843 850 2243."
503,msmarco,_doc,MARCO_7406992,4.1035485,"Gas Engineer. I am currently recruiting for a Gas Service & Breakdown Engineer to work in the Central London area. The Gas Engineer will be required to visit private customer's properties and carry out various aspects of Boiler services and maintenance, Breakdowns and fault finding and provide Gas safety certificates. am currently recruiting for a Gas Service & Breakdown Engineer to work in the Central London area. The Gas Engineer will be required to visit private customer's properties and carry out various aspects of Boiler services and maintenance, Breakdowns and fault finding and provide Gas safety certificates."
504,msmarco,_doc,MARCO_5124212,4.1032,"While the Vikings had the runic alphabet, they didn’t have written history. Thus, we don’t know exactly why the Vikings began raiding in A.D. 793.Scholars have many theories about the reasons why the Scandinavians began leaving home on extensive raids, trading missions, explorations and settlement, which include: population pressures and not enough good farmland.ost scholars today agree that the population pressure theory doesn’t hold weight. As the Viking Age raids and trading brought more wealth into Scandinavian, the growing prosperity might have led to greater population growth. But a burgeoning population probably wasn’t a cause of the Viking Age."
505,msmarco,_doc,MARCO_7673137,4.1011376,BBB rating is based on 13 factors. Get the details about the factors considered. Factors that raised Trading Places Real Estate LLC's rating include: 1  Length of time business has been operating.2  No complaints filed with BBB.actors that raised Trading Places Real Estate LLC's rating include: 1  Length of time business has been operating. 2  No complaints filed with BBB.
506,msmarco,_doc,MARCO_5171145,4.100587,The sharp rise in population at the start of the Archaic period led the settlement of new towns and the expansion of the older population centers within poleis. Increases in the population also led to the establishment of colonies along the Mediterranean and Black Sea coasts that began about 800 BC.
507,msmarco,_doc,MARCO_3854896,4.099782,"- Glycogenolysis – breakdown of glycogen (polysaccharide) into glucose molecules (monosaccharide). - Glycolysis-the breakdown of glucose into pyruvate by cells for the production of ATP. Blood Glucose Regulation-Glucose, glucagon, and insulin levels over a 24-hour period.Insulin-Glucagon Summary. Fed-state metabolism under the influence of insulin promotes glucose metabolism by cells. Glycogenolysis – breakdown of glycogen (polysaccharide) into glucose molecules (monosaccharide). - Glycolysis-the breakdown of glucose into pyruvate by cells for the production of ATP. Blood Glucose Regulation-Glucose, glucagon, and insulin levels over a 24-hour period. Insulin-Glucagon Summary."
508,msmarco,_doc,MARCO_3136861,4.099327,"But remember, this is just the average cost not a target for what you should splash out – many people end up spending less (or more). Breakdown: How wedding costs add up Source: Brides Magazine. There are cheaper ways to plan your wedding.ut remember, this is just the average cost not a target for what you should splash out – many people end up spending less (or more). Breakdown: How wedding costs add up Source: Brides Magazine. There are cheaper ways to plan your wedding."
509,msmarco,_doc,MARCO_1241667,4.0986404,"Columbus's voyages led to the widespread knowledge that a new continent existed west of Europe and east of Asia. This breakthrough in geographical science led to the exploration and colonization of the New World by Spain and other European sea powers, and is sometimes cited as the start of the modern era."
510,msmarco,_doc,MARCO_4309322,4.0986404,"Harvesting of the area's sea otter pelts led to the near extinction of the animal in the following century and led to wars with and enslavement of the natives for over 150 years. As part of the Alaska Purchase by the United States in 1867, Kodiak became a commercial fishing center which continues to this day."
511,msmarco,_doc,MARCO_2580909,4.0979714,"The canal cuts across the Isthmus of Panama and is a key conduit for international maritime trade. There are locks at each end to lift ships up to Gatun Lake, an artificial lake created to reduce the amount of excavation work required for the canal, 26 metres (85 ft) above sea level.he canal cuts across the Isthmus of Panama and is a key conduit for international maritime trade. There are locks at each end to lift ships up to Gatun Lake, an artificial lake created to reduce the amount of excavation work required for the canal, 26 metres (85 ft) above sea level."
512,msmarco,_doc,MARCO_5271008,4.0979714,"DEFINITION of 'Brent Blend'. A type of sweet crude oil that is used as a benchmark for the prices of other crude oils. Brent blend is most often found in parts of the North Sea off the coast of the U.K. and Norway.Brent blend makes up more than half of the world's globally traded supply of crude oil, which is why it makes an obvious choice for the benchmark of crude oil. Next Up.rent blend is most often found in parts of the North Sea off the coast of the U.K. and Norway. Brent blend makes up more than half of the world's globally traded supply of crude oil, which is why it makes an obvious choice for the benchmark of crude oil. Next Up."
513,msmarco,_doc,MARCO_3414211,4.0954847,"Test drives ». Roadside Assistance is the main reason people join AAA and why they renew year after year. Not just for major breakdowns, either. Lock your keys in the car or get a flat and we’ll be there, day or night throughout the U.S. and Canada.est drives ». Roadside Assistance is the main reason people join AAA and why they renew year after year. Not just for major breakdowns, either. Lock your keys in the car or get a flat and we’ll be there, day or night throughout the U.S. and Canada."
514,msmarco,_doc,MARCO_1885794,4.0935946,"International trade is the exchange of capital, goods, and services across international borders or territories, which could involve the activities of the government and individual. In most countries, such trade represents a significant share of gross domestic product (GDP).hus international trade is mostly restricted to trade in goods and services, and only to a lesser extent to trade in capital, labor or other factors of production."
515,msmarco,_doc,MARCO_4741358,4.092606,Related Searches for led microwave bulb: bulb led bulb handy bulb e27 led bulb e14 led bulb g9 led bulb e27 bulb a19 led bulb e11 led bulb 12w led bulb smart bulb lifx bulb insta bulb b22 bulb 10w led bulb More...
516,msmarco,_doc,MARCO_2389704,4.0904384,Growth of the Byzantine Empire ● Constantinople = modern day Istanbul ○ A city split in two by the Sea of Marmora○ Capital city of the Eastern Roman/Byzantine Empire○ Built by Constantinople I to help maintain the Eastern Roman Empire■ Rome was too far away to deal with punishments and trade and overall governence.rowth of the Byzantine Empire ● Constantinople = modern day Istanbul ○ A city split in two by the Sea of Marmora○ Capital city of the Eastern Roman/Byzantine Empire○ Built by Constantinople I to help maintain the Eastern Roman Empire■ Rome was too far away to deal with punishments and trade and overall governence.
517,msmarco,_doc,MARCO_1885798,4.089737,"International trade is also a branch of economics, which, together with international finance, forms the larger branch called international economics. Trading is a value-added function: it is the economic process by which a product finds its market, in which specific risks are to be borne by the trader.hus international trade is mostly restricted to trade in goods and services, and only to a lesser extent to trade in capital, labor or other factors of production."
518,msmarco,_doc,MARCO_4065337,4.0892997,"Whether a person is in trade will depend on the specific circumstances of the seller and the offer. Many factors can be relevant to whether a person is in trade, including whether they: 1  regularly or habitually offer to sell goods or services online.2  make, buy or obtain goods with the intention of selling them.3  are GST registered.4  have staff or assistants to help manage their sales.any factors can be relevant to whether a person is in trade, including whether they: 1  regularly or habitually offer to sell goods or services online. 2  make, buy or obtain goods with the intention of selling them. 3  are GST registered. 4  have staff or assistants to help manage their sales."
519,msmarco,_doc,MARCO_3882092,4.088567,"The study includes a detailed breakdown of costs along gender, racial and ethnic lines, and also includes a breakdown of costs on a state-by-state basis. The total estimated cost of diagnosed diabetes in 2012 is $245 billion, including $176 billion in direct medical costs and $69 billion in reduced productivity.The largest components of medical expenditures are: 1  hospital inpatient care (43% of the total medical cost),he study includes a detailed breakdown of costs along gender, racial and ethnic lines, and also includes a breakdown of costs on a state-by-state basis. The total estimated cost of diagnosed diabetes in 2012 is $245 billion, including $176 billion in direct medical costs and $69 billion in reduced productivity."
520,msmarco,_doc,MARCO_6163274,4.0882187,"The first Dutch expedition to Indonesia was in 1595. This was led by Cornelius de Houtman. In 1596 the Dutch expedition had made contact with the Portuguese and Indonesians. Then at the start of the century in 1602, the Dutch East India Company was established.Another name for the Dutch East India Company is the Vereenigde Oost-Indische Compagnie more commonly known as the VOC. The VOC was made to protect trade in the Indian Ocean and to assist in war of independence from Spain.hen at the start of the century in 1602, the Dutch East India Company was established. Another name for the Dutch East India Company is the Vereenigde Oost-Indische Compagnie more commonly known as the VOC. The VOC was made to protect trade in the Indian Ocean and to assist in war of independence from Spain."
521,msmarco,_doc,MARCO_3114541,4.0840015,"After that, the casting process is very much like it is for adults. Casting directors are looking for people who fit the character breakdown and who--if playing members of a family--look as though they could actually be related to one another.If the actor is talented and within the scope of what the producers of the project are looking for, the actor will usually land a callback.asting directors are looking for people who fit the character breakdown and who--if playing members of a family--look as though they could actually be related to one another. If the actor is talented and within the scope of what the producers of the project are looking for, the actor will usually land a callback."
522,msmarco,_doc,MARCO_5736116,4.0840015,"And some studies found that two or more cups of coffee a day can increase the risk of heart disease in people with a specific — and fairly common — genetic mutation that slows the breakdown of caffeine in the body.So, how quickly you metabolize coffee may affect your health risk.nd some studies found that two or more cups of coffee a day can increase the risk of heart disease in people with a specific — and fairly common — genetic mutation that slows the breakdown of caffeine in the body."
523,msmarco,_doc,MARCO_8555308,4.0840015,"Nowadays, people are getting more & more involved in Music & for them, it has become a part of their daily life. Their mind has become so saddled with tension, & tempo of life is so fast that they seem to accept high blood pressure & nervous breakdown as the unavoidable side effects of modern civilization.owadays, people are getting more & more involved in Music & for them, it has become a part of their daily life. Their mind has become so saddled with tension, & tempo of life is so fast that they seem to accept high blood pressure & nervous breakdown as the unavoidable side effects of modern civilization."
524,msmarco,_doc,MARCO_4645489,4.0830364,"If you need Led Lighting or Lighting or even Led in WA, look no further. www.hotfrog.com.au showcases more than 107 Led Lighting businesses across WA. To find more related businesses and to filter by locality, use the left navigation menu.ED Lighting, Industrial LEDs, Commercial LEDs, LED lights perth, LED Lighting Perth, WA. With more than three decades of experience in the lighting and electrical industries, the team at Passive Lighting deliver inform…. led lights Leds Lighting Products Lighting And Electrical."
525,msmarco,_doc,MARCO_5958109,4.082934,"(Mathew 11:23). Capernaum, nestled on the northern shores of the Sea of Galilee, was a small, prosperous town due to fishing, trade and agriculture. Capernaum is called Kfar Nahum in Hebrew, meaning Nahum s village. It is best known as the birthplace of Peter.John, Andrew and James also lived here, as well as the tax collector Matthew. Jesus came to Capernaum after he had a confrontation in his synagogue in Nazareth, his boyhood home.Mathew 11:23). Capernaum, nestled on the northern shores of the Sea of Galilee, was a small, prosperous town due to fishing, trade and agriculture. Capernaum is called Kfar Nahum in Hebrew, meaning Nahum s village. It is best known as the birthplace of Peter."
526,msmarco,_doc,MARCO_8528849,4.082934,"Current job listings. 1  Area Sales Manager-General Trade Thailand. 2  CD Executive-Pull for GMA, North Luzon, South Luzon, Visayas, and Mindanao Philippines. 3  SEA R&D Senior Site Master Plans Manager (ADECCO CONTRACT 3 YEARS) Thailand.urrent job listings. 1  Area Sales Manager-General Trade Thailand. 2  CD Executive-Pull for GMA, North Luzon, South Luzon, Visayas, and Mindanao Philippines. 3  SEA R&D Senior Site Master Plans Manager (ADECCO CONTRACT 3 YEARS) Thailand."
527,msmarco,_doc,MARCO_6769275,4.0820446,"Historians' estimates of the effects of the slave trade range widely, from those who see the trade as fundamental to the problems that blighted Africa both then and later, to those who see it as only a marginal factor in Africa's historical development. Nevertheless, it is possible to make a number of observations.ome historians of the slave trade are keen to stress the ways in which the trade had significant economic effects in the home countries. However, historians of European industrialisation have often given little attention to the contribution of the slave trade, although there are exceptions."
528,msmarco,_doc,MARCO_166285,4.0811596,"Osteoporosis is bone thinning, a condition common to many women after menopause with the waning of estrogen production. The female hormone estrogen keeps calcium in bones and maintains their strength. Without it, bones become brittle and fragile. Backbones collapse, giving a woman a stooped posture.Fractures are common, especially hip fractures. Osteoporosis affects many bones. With Paget's bone disease, there is an imbalance in the daily process of bone breakdown and buildup. The breakdown process runs amok, and the rebuilding process is at a loss to catch up.When it does, it turns out an inferior product.ackbones collapse, giving a woman a stooped posture. Fractures are common, especially hip fractures. Osteoporosis affects many bones. With Paget's bone disease, there is an imbalance in the daily process of bone breakdown and buildup. The breakdown process runs amok, and the rebuilding process is at a loss to catch up."
529,msmarco,_doc,MARCO_3352030,4.0801883,Movement disorders originate deep within the central nervous system. They are triggered by changes to specific regions of the brain or nervous system controlling movement. People with a movement disorder suffer from a breakdown in the normal flow of neurological messages and this leads to involuntary muscle movement.hey are triggered by changes to specific regions of the brain or nervous system controlling movement. People with a movement disorder suffer from a breakdown in the normal flow of neurological messages and this leads to involuntary muscle movement.
530,msmarco,_doc,MARCO_3244210,4.0773387,"If your product is RGB color changing, you will use the same method to calculate the capacity needed from your RGB color controller. As you view our selection of LED power supplies, you will see that we stock dry location and wet location transformers.Choose the type that suits your installation.lexible LED strips have different power requirements depending upon the density of the LEDs on the strips. This is a general guide that applies to flexible LED strips employing 5050 LEDs. By density, we mean the number of LEDs per meter. We will address 30 LED per meter and 60 LED per meter flexible LED strip here."
531,msmarco,_doc,MARCO_3392632,4.076382,"In some people with lactate dehydrogenase-A deficiency, high-intensity exercise or other strenuous activity leads to the breakdown of muscle tissue (rhabdomyolysis). The destruction of muscle tissue releases a protein called myoglobin, which is processed by the kidneys and released in the urine (myoglobinuria).n some people with lactate dehydrogenase-A deficiency, high-intensity exercise or other strenuous activity leads to the breakdown of muscle tissue (rhabdomyolysis). The destruction of muscle tissue releases a protein called myoglobin, which is processed by the kidneys and released in the urine (myoglobinuria)."
