,_index,_type,_id,_score,_source.body
0,msmarco,_doc,MARCO_7424521,10.865472,"In the Archaeology Odyssey article “When Civilization Collapsed: Death of the Bronze Age,” William H. Stiebing describes the Late Bronze Age collapse: It was a cataclysm of immense proportions: Near the end of the 13th century B.C.E., the great Bronze Age civilizations of the Aegean and Near East suddenly collapsed. In the latter part of the Late Bronze Age (c. 1400–1200 B.C.E.), Mycenaean civilization flourished in Greece and Crete."
1,msmarco,_doc,MARCO_7424525,10.304508,"A 12th-century inscription describes Ramesses III’s defeat of the Sea Peoples. The Sea Peoples, a range of groups including the Philistines, led raids on the Eastern Mediterranean during the period of the Bronze Age collapse and are often cited as the reason for the collapse."
2,msmarco,_doc,MARCO_1832179,10.022869,"At the end of the Bronze Age, the tin needed to make bronze could no longer be acquired With the collapse of the Bronze Age around 1200 B.C.E., trade networks fell apart. This had many consequences for Bronze Age civilizations. One of the most catastrophic was that they could no longer acquire the tin they needed to make bronze. Differences Between Iron and Bronze"
3,msmarco,_doc,MARCO_2739821,9.790781,"1 Irish Dark Age, a period of apparent economic and cultural stagnation in late pre-historic Ireland, lasting from c. 100 BC to c. 300 AD. 2  Bronze Age collapse (c. 1200 BC)  Greek Dark Ages (c. 1100 BC – 750 BC), a period in the history of Ancient Greece and Anatolia after the Bronze Age collapse."
4,msmarco,_doc,MARCO_3367674,8.947973,"With the mysterious end of the Mycenaean civilization during the Bronze Age Collapse around 1200 BCE (possibly through earthquake, invasion or in-fighting) came the so-called Dark Ages and it would be many centuries before Greek culture would finally regain the heights of the late Bronze Age."
5,msmarco,_doc,MARCO_1866119,8.907314,"The history of Greece went through these stages: 1  Mycenaean culture (c.1600–c.1100 BC) was an early Greek culture during the Bronze Age, on the Greek mainland and on Crete. 2  The bronze age collapse or Greek dark ages (c.1100–c.750 BC). 3  The archaic period (c.750–c.500 BC)."
6,msmarco,_doc,MARCO_4397248,8.65635,"On Crete, however, the Mycenean invasion of around 1400 BC spelled the end of the Minoan civilization. Mycenaean Greece is the Late Helladic Bronze Age civilization of Ancient Greece. It lasted from the arrival of the Greeks in the Aegean around 1600 BC to the collapse of their Bronze Age civilization around 1100 BC."
7,msmarco,_doc,MARCO_7820059,8.463544,"the iron age was between BC 700 and AD 300 Classically, the Iron Age is taken to begin in the 12th century BC Bronze Age collapse in the ancient Near East, ancient India (with… the post-Rigvedic Vedic civilization), ancient Iran, and ancient Greece (with the Greek Dark Ages)."
8,msmarco,_doc,MARCO_8045974,8.44463,"Factors influencing the growth of tourism. The following image depicts factors influencing the growth of tourism. Image credits © Manoj Patil. Important factors that affect the development of tourism are as follows: Environmental factors : Good climate, Beautiful scenery, etc. Socio-economic factors : Accessibility, Accommodation, Amenities, Ancillary services, etc. Historical and cultural factors, Religious factors and; Other factors. Now let's discuss above factors affecting the growth of tourism. 1. Environmental factors. Two main environmental factors that have led to the growth of tourism: 1  Good climate : Good climate is one of the most important features of attraction for any tourist place. Pleasant climate with warmth and ample of sunshine attracts tourists who come from the temperate and colder regions."
9,msmarco,_doc,MARCO_6395544,8.331196,There is no denial that it was the single biggest cause which led to the economic collapse of China and brought famine across the country. There were many factors of the Great Leap Forward that were of a major importance to the cause of the famine:...here is no denial that it was the single biggest cause which led to the economic collapse of China and brought famine across the country. There were many factors of the Great Leap Forward that were of a major importance to the cause of the famine:...
10,msmarco,_doc,MARCO_6832868,8.27952,"If your small business engages in ethical financial practices, it will be more profitable in the long-run than a small business that does not. Lack of ethics in finance is one of the primary factors that led to the fall of Wall Street and the near collapse of the U.S. economy in September and October of 2008.f your small business engages in ethical financial practices, it will be more profitable in the long-run than a small business that does not. Lack of ethics in finance is one of the primary factors that led to the fall of Wall Street and the near collapse of the U.S. economy in September and October of 2008."
11,msmarco,_doc,MARCO_4746972,8.251447,"The Mycenaean civilization transpired during the late Bronze Age or the late Helladic period around 1600 B.C. Excavations at Mycenae were undertaken by Heinrich Schliemann only to be found that during this period, the Helladic culture in mainland Greece was altered though the influence from the Minoans in Crete, and the collapse of this civilization was brought about by the Dorian invasion, although there are several other theories that have been attributed towards the collapse of the ..."
12,msmarco,_doc,MARCO_4158313,8.211101,"Mycenaean Greece perished with the collapse of Bronze-Age culture in the eastern Mediterranean. Various theories have been proposed for the end of this civilization, among them the Dorian invasion or activities connected to the “ Sea People ”.he Late Helladic period is further divided into LHI, LHII, both of which coincide with the early period of Mycenaean Greece (c. 1650–1425 BC), and LHIII (c. 1425–1050 BC), the period of expansion, decline and collapse of the Mycenaean civilization."
13,msmarco,_doc,MARCO_4832515,8.199002,"Ancient Greece was a civilization belonging to a period of Greek history from the Greek Dark Ages of the 13th–9th centuries BC to the end of antiquity. Immediately following this period was the beginning of the Early Middle Ages and the Byzantine era. Roughly three centuries after the Late Bronze Age collapse of Mycenaean Greece, Greek urban poleis began to form in the 8th century BC, ushering in the period of Archaic Greece and colonization of the Mediterranean Basin. This was followed by ..."
14,msmarco,_doc,MARCO_1866121,7.994273,"The Greek Dark Ages (~1100 BC–750 BC), or Bronze Age collapse, is a period in the history of Ancient Greece and Anatolia from which there are no records, and few archaeological remains. The Greeks learned about the alphabet from another ancient people, the Phoenicians."
15,msmarco,_doc,MARCO_4595074,7.9908624,"The potential for structural collapse in a building on fire can be predicted by a building’s susceptibility to a variety of factors, including fire dynamics and behavior, fire exposure and extension, environmental impact, fire suppression activities, and building age, deterioration and occupancy use factors."
16,msmarco,_doc,MARCO_6034707,7.9884195,"The two events have traditionally been causally linked, but this is by no means certain. With the Bronze Age collapse, Greece entered into a period of obscurity or 'dark age'. The so-called Mycenaean civilization culminated in this period, which features in the famous epics of Homer, the Iliad and the Odyssey."
17,msmarco,_doc,MARCO_4285163,7.9825773,"Linear B, found mainly in the palace archives at Knossos, Cydonia, Pylos, Thebes and Mycenae, disappeared with the fall of Mycenaean civilization during the Late Bronze Age collapse. The succeeding period, known as the Greek Dark Ages, provides no evidence of the use of writing."
18,msmarco,_doc,MARCO_6100746,7.968021,Generally its agreed it started around 3000BC and ended at various time for various regions: Near East: 1200BC. South Asia: 1200BC. Europe: 600BC. China: 700BC. It was followed by the Iron Age (with some transitional periods like the Bronze Age Collapse in the Near East). Views · View Upvotes.
19,msmarco,_doc,MARCO_7621163,7.9543476,"Societal collapse - Causes of collapse. 1  Common factors that may contribute to societal collapse are economical, environmental, social and cultural, and disruptions in one domain sometimes cascade into others."
20,msmarco,_doc,MARCO_1384638,7.919052,"Assyria was a major Mesopotamian kingdom and empire of the ancient Near East and the Levant. It existed as a state from perhaps as early as the 25th century BC in the form of the Assur city-state, until its collapse between 612 BC and 609 BC, spanning the Early to Middle Bronze Age through to the late Iron Age. From the end of the seventh century BC to the mid-seventh century AD, it survived as a geopolitical entity, for the most part ruled by foreign powers, although a number of Neo-Assyrian st"
21,msmarco,_doc,MARCO_7424524,7.643209,"Special Feature: Read “City by City: Death of the Bronze Age” as it appeared in the September/October 2001 issue of Archaeology Odyssey below. Read William H. Stiebing, Jr.’s full article “When Civilization Collapsed: Death of the Bronze Age” in the BAS Library."
22,msmarco,_doc,MARCO_1325268,7.6099596,"This lecture covers the history of Mesopotamia from the disintegration of the Sumerian Empire to the great Bronze Age collapse. We'll explore the destructive force of the Elamites and the Hittites as well as the imperial ambitions of the Babylonians, the Mittani and the Assyrians."
23,msmarco,_doc,MARCO_2176120,7.6099596,"It's now thought likely that the droughts at around that time were partly responsible for the collapse not only of the Indus Valley Civilisation, but also of the ancient Akkadian Empire, Old Kingdom Egypt and possibly Early Bronze Age civilizations in Greece."
24,msmarco,_doc,MARCO_5763727,7.6099596,"The Mycenaean civilization flourished during the period roughly between 1600 BC, when Helladic culture was transformed under influences from Minoan Crete, and 1100 BC, when it perished with the collapse of Bronze-Age civilization in the eastern Mediterranean."
25,msmarco,_doc,MARCO_3329065,7.6070256,Coordinator: Prof Irene Lemos. The period between the collapse of the Bronze Age civilisations of Crete and mainland Greece and the society based on city states ('poleis') which emerges from the earliest Greek historical sources is a complex one.
26,msmarco,_doc,MARCO_3665055,7.6011662,"The history of Europe covers the peoples inhabiting the European continent from prehistory to the present. Some of the best-known civilizations of prehistoric Europe were the Minoan and the Mycenaean, which flourished during the Bronze Age until they collapsed in a short period of time around 1200 BC."
27,msmarco,_doc,MARCO_3573417,7.598241,"The history of Europe covers the peoples inhabiting the European continent from after prehistoric times to the present. Some of the best-known civilizations of prehistoric Europe were the Minoan and the Mycenaean, which flourished during the Bronze Age until they collapsed in a short period of time around 1200 BC."
28,msmarco,_doc,MARCO_4158312,7.5633564,"Mycenaean Greece refers to the last phase of the Bronze Age in Ancient Greece (c. 1600–1100 BCE).he Late Helladic period is further divided into LHI, LHII, both of which coincide with the early period of Mycenaean Greece (c. 1650–1425 BC), and LHIII (c. 1425–1050 BC), the period of expansion, decline and collapse of the Mycenaean civilization."
29,msmarco,_doc,MARCO_2562629,7.5403237,"The history of Europe covers the peoples inhabiting the European continent from after prehistoric times to the present. Some of the best-known civilizations of prehistoric Europe were the Minoan and the Mycenaean, which flourished during the Bronze Age until they collapsed in a short period of time around 1200 BC.he period known as classical antiquity began with the emergence of the city-states of Ancient Greece. Greek influence reached its zenith under the expansive empire of Alexander the Great, spreading throughout Asia."
30,msmarco,_doc,MARCO_1278175,7.534593,History of Ancient Greece. 1  The Minoans 9:05. 2  History of the Alphabet: From Cuneiform to Greek Writing 7:08. 3  Bronze Age Greece: Schliemann's Quest for Troy 6:39. 4  From Mycenae's Collapse to Greek Colonization 9:15. 5  Greek Myth and Religion 17:21. 6  Greek City-States and Governments 10:54. 7  Women of Greece 4:34.
31,msmarco,_doc,MARCO_8258848,7.5339127,"Common factors that may contribute to societal collapse are economical, environmental, social and cultural, and disruptions in one domain sometimes cascade into others. In some cases a natural disaster (e.g. tsunami, earthquake, massive fire or climate change) may precipitate a collapse."
32,msmarco,_doc,MARCO_4158311,7.5288734,"The Mycenaean civilization flourished during the period roughly between 1600 BC, when Helladic culture was transformed under influences from Minoan Crete, and 1100 BC, when it perished with the collapse of Bronze-Age civilization in the eastern Mediterranean.ot only did the Mycenaeans defeat the Minoans, but according to later Hellenic legend they twice defeated Troy, a powerful city-state that rivaled Mycenae in power. Because the only evidence for the conquests is Homer's Iliad and other texts steeped in mythology, the existence of Troy and the Trojan War is uncertain."
33,msmarco,_doc,MARCO_3833654,7.5231647,"The history of Europe covers the peoples inhabiting the European continent from after prehistoric times to the present. Some of the best-known civilizations of prehistoric Europe were the Minoan and the Mycenaean, which flourished during the Bronze Age until they collapsed in a short period of time around 1200 BC.y the mid-19th century, the Ottoman Empire had declined enough to become a target for the others (see History of the Balkans). This instigated the Crimean War in 1854 and began a tenser period of minor clashes among the globe-spanning empires of Europe that eventually set the stage for the First World War."
34,msmarco,_doc,MARCO_6455700,7.5194426,"The Bronze Age lasted until the beginning of the Iron Age.    The Bronze Age did not occur all at once in every place. Some cultures never had a Bronze Age at all, jumping directly from mixed copper and stone tools and ornaments (a Chalcolithic Period) to using and/or producing iron tools. Timeline of the Bronze Age The Bronze Age is the middle era of the three early phases in the development of civilization: the Stone Age, the Bronze Age, and the Iron Age."
35,msmarco,_doc,MARCO_2675270,7.5174665,"The history of Europe covers the peoples inhabiting the European continent from after prehistoric times to the present. Some of the best-known civilizations of prehistoric Europe were the Minoan and the Mycenaean, which flourished during the Bronze Age until they collapsed in a short period of time around 1200 BC.n one side were Germany, Austria-Hungary, the Ottoman Empire and Bulgaria (the Central Powers / Triple Alliance), while on the other side stood Serbia and the Triple Entente – the coalition of France, Britain and Russia, which were joined by Italy in 1915, Romania in 1916 and by the United States in 1917."
36,msmarco,_doc,MARCO_7251320,7.3084817,"The availability of bronze led to more advanced tool and weapon making, and with better weapons, armies could better conquer neighboring societies (and plunder their tin and copper resources). Early-Middle Bronze Age (2700-1600 BCE) bronze rat-tang dagger blade from Cyprus."
37,msmarco,_doc,MARCO_658251,7.214747,"This has led some researchers to consider intrauterine viral infection during the winter as a risk factor. The same link, however, is found for major mood disorders, like bipolar disorder. Environmental Factors & Schizophrenia Risk. Environmental factors and stress are thought to trigger the onset of schizophrenia. For example, moving, troubled relationships, problems at work, or substance abuse may aggravate the constellation of risk factors and lead to psychosis."
38,msmarco,_doc,MARCO_3411960,7.204315,The Carolingian Empire covered much of the Western and Central Europe but it collapsed in less than hundred years after the death of Charlemagne in 814.Several factors led to the fall of the Carolingian Empire.he Carolingian Empire covered much of the Western and Central Europe but it collapsed in less than hundred years after the death of Charlemagne in 814.
39,msmarco,_doc,MARCO_8077384,7.1981487,"Explain what is Electronic Product Environmental Assessment Tool (EPEAT). Answer : Electronic Product Environmental Assessment Tool (EPEAT) is a system that enables purchasers to evaluate, compare, and select electronic products based on a total of 51 environmental criteria. Products are ranked in EPEAT according to three tiers of environmental performance: bronze, silver, and gold. Individual purchasers as well as corporate purchasers of computers, printers, scanners, and multifunction devices can use the EPEAT Web site (www.epeat.net) to screen manufacturers and ..."
40,msmarco,_doc,MARCO_3411958,7.1955814,Fall of the Carolingian Empire. The Carolingian Empire covered much of the Western and Central Europe but it collapsed in less than hundred years after the death of Charlemagne in 814. Several factors led to the fall of the Carolingian Empire.he Carolingian Empire covered much of the Western and Central Europe but it collapsed in less than hundred years after the death of Charlemagne in 814.
41,msmarco,_doc,MARCO_396171,7.143707,"By the end of the 1st century AD, the Roman Empire was already the greatest empire of the ancient world. However, at the end of the 5th century AD, various economic factors and ceaseless pressure from barbarian peoples on the frontiers of the empire led to its eventual collapse in western Europe.he formation of the Roman Empire began under the Roman Republic, but was formed mostly by the early Roman emperors, and is often thought of as belonging particularly to the imperial dynasties who held power in Rome after the collapse of the old Republican constitution."
42,msmarco,_doc,MARCO_6286321,7.004687,"The age at which puberty begins varies between individuals; usually, puberty begins between 10 and 13 years of age. The age at which puberty begins is affected by both genetic factors and by environmental factors such as nutritional state and social circumstances.he age at which puberty begins varies between individuals; usually, puberty begins between 10 and 13 years of age. The age at which puberty begins is affected by both genetic factors and by environmental factors such as nutritional state and social circumstances."
43,msmarco,_doc,MARCO_6395535,6.9988832,"Introduction. The Great Chinese Famine was the period in China during 1959-1961, in which poor economic policies produced the largest famine in human history.It can be clearly seen that massive agricultural policy changes during the “Great Leap Forward” were the key factor in causing the famine.here is no denial that it was the single biggest cause which led to the economic collapse of China and brought famine across the country. There were many factors of the Great Leap Forward that were of a major importance to the cause of the famine:..."
44,msmarco,_doc,MARCO_6455698,6.9890995,"STONE, BRONZE, and IRON. The terms stone age, bronze age, and iron age are three classic divisions of history based on the chief material used for tools and weapons at different stages in the history of man. These ages were first used as classifications for dating artifacts found in Europe.TONE, BRONZE, and IRON. The terms stone age, bronze age, and iron age are three classic divisions of history based on the chief material used for tools and weapons at different stages in the history of man. These ages were first used as classifications for dating artifacts found in Europe."
45,msmarco,_doc,MARCO_5705102,6.977217,"The others, now replaced, were destroyed when the tower collapsed in 1902. From the belfry loggia there is a spectacular bird’s eye view of the city and the lagoon. Against the base of the campanile is the balcony built by Jacopo Sansovino between 1537 and 1549 and decorated with marbles and bronzes ."
46,msmarco,_doc,MARCO_6473978,6.9717607,"Spinacia oleracea. White Rust (fungus – Albugo occidentalis): White rust is the major disease of spinach in Texas. White, blister-like pustules form on the lower side of the leaf. In advanced stages, the white lesions form on the upper side of the leaf.Generally, the upper surface will only be chlorotic.Plants infected with the white rust fungus are weak and collapse quickly if environmental conditions are favorable for disease development.n advanced stages, the white lesions form on the upper side of the leaf. Generally, the upper surface will only be chlorotic. Plants infected with the white rust fungus are weak and collapse quickly if environmental conditions are favorable for disease development."
47,msmarco,_doc,MARCO_8191962,6.9558682,"More: Snowboarding. Olympic bronze medalist Mark McMorris suffered several injuries including a fractured jaw, fractured left arm, ruptured spleen, stable pelvic fracture, rib fractures and a collapsed left lung during a backcountry snowboarding trip Saturday, according to Canada Snowboard. McMorris underwent surgery to control bleeding from the spleen on Saturday."
48,msmarco,_doc,MARCO_1305008,6.95253,"So-called sustainable or green design refers to the planned use of environmental technology in constructing new buildings that have minimal environmental impact. Environmental science also deals with diverse topics related to human and environmental health, such as waste management, toxicology, and wildlife protection.asic economic factors are often a spur to advances in environmental technology. This is due in part to the fact that cost-saving solutions are usually the most efficient. Cost increases of fuels such as gasoline, for instance, have led to technology aimed at reducing fuel consumption."
49,msmarco,_doc,MARCO_6954075,6.937297,"There are two types of environmental factors: internal environmental factors and external environmental factors. Internal environmental factors are events that occur within an organization. Generally speaking, internal environmental factors are easier to control than external environmental factors. External environmental factors are events that take place outside of the organization and are harder to predict and control."
50,msmarco,_doc,MARCO_7428779,6.929022,"1 Gōkei (吭景, Mawscape): Senbonzakura has Senbonzakura Kageyoshi surround his opponent in a whirling sphere of blade petals, which is inescapable and grows smaller over time. 2  Eventually, the sphere collapses in on itself, crushing Senbonzakura's opponent in a flash of bright light.anpakutō Abilities. Sword Manifestation: Senbonzakura can manifest his sword form at will. It takes the form of a katana with a simple, open-framed cross-guard, a bronze guard, and a lavender hilt. Senbonzakura releases his Shikai."
51,msmarco,_doc,MARCO_7877977,6.9250813,"During the 3rd millennium BCE, however, the Bronze Age began in Europe, bringing with it a new medium for art. The increased efficiency of bronze tools also meant an increase in productivity, which led to a surplus — the first step in the creation of a class of artisans."
52,msmarco,_doc,MARCO_137099,6.9163136,"Investors and collectors continue to be intrigued by this ancient metal that was first discovered in the Middle East around the year 9000 BC. Copper, of course, led to the Bronze Age once the ancients understood how to fashion bronze from copper and tin. In terms of investment, copper has enjoyed significant upswings."
53,msmarco,_doc,MARCO_5375204,6.9010205,bronze outdoor flood lights dusk to dawn outdoor wall lantern white led flood light outdoor flood lights white led motion flood lights led outdoor lanterns led outdoor flood lights.
54,msmarco,_doc,MARCO_8024431,6.854675,"Historical Examples. 1  Until, however, we get into the Bronze Age, there has been no trace of a stop-ridge. The Bronze Age in Ireland George Coffey. 2  The rapiers belong to the middle and later portions of the Bronze Age. The Bronze Age in Ireland George Coffey. 3  We are thus able to form a true conception of the Bronze Age."
55,msmarco,_doc,MARCO_2556914,6.805129,"Nervous breakdown is a term that the public uses to characterize a range of mental illnesses, but generally it describes the experience of snapping under immense pressure, mental collapse or mental and physical exhaustion. Nervous breakdown is not a clinical term.he diagnosis that most closely resembles what the public calls a nervous breakdown is major depression. Depressive episodes may be caused by genetic and biological factors and are often triggered by social and environmental circumstances."
56,msmarco,_doc,MARCO_6604889,6.6961412,"The period began with the first stone tools, about 2.7 million years ago. Some groups of people were still in the stone age into the 20th century. They also killed animals for food and clothing. The time after the Stone Age is the Bronze Age, named after the metal bronze.The Stone Age ended when people discovered the art of smelting (making metals).ome groups of people were still in the stone age into the 20th century. They also killed animals for food and clothing. The time after the Stone Age is the Bronze Age, named after the metal bronze. The Stone Age ended when people discovered the art of smelting (making metals)."
