,_index,_type,_id,_score,_source.body
498,msmarco,_doc,MARCO_59775,5.2874665,"2300 BC Europe (About 2300 BC) The Bronze Age starts about 2300 BC in Europe. Few tools are made in the beginning, but by 1200 BC bronze has replaced all stone tools. 2000 BC Britain (About 2000 BC) Bronze starts to be worked in Britain."
499,msmarco,_doc,MARCO_2841130,5.2874665,"Bronze is a durable material that ages well. Bronze is a metal alloy produced by blending copper and tin. It can contain between 2% and 20% tin. Other metals, such as iron or pewter, can also be blended with bronze to make them sturdier or to change their color. It is a sturdy, durable metal and is much harder than brass."
500,msmarco,_doc,MARCO_396201,5.286477,The Minoans were a Bronze Age civilization that flourished on the Greek Aegean island of Crete from around 3000 to 1100 BCE.he Minoans were a Bronze Age civilization that flourished on the Greek Aegean island of Crete from around 3000 to 1100 BCE.
501,msmarco,_doc,MARCO_1046042,5.286477,"…to a legendary Greek artist, Daedalus, who is connected in legend both to Bronze Age Crete and to the earliest period of Archaic sculpture in post-Bronze Age Greece. The legends about Daedalus recognize him both as a man and as a mythical embodiment."
502,msmarco,_doc,MARCO_2001969,5.286477,"The Bronze Age was the result of a short period known as the copper age; this is because bronze is a form of copper mixed with tin. Many metal workers used a 90% copper to 10% tin ration when smelting their product (Martin, 14)."
503,msmarco,_doc,MARCO_3367681,5.286477,"The Minoans are what archaeologists have named the people who lived during the early part of the prehistoric Bronze Age of Greece. Bronze Age Greek civilizations are split by tradition into the Greek mainland (or Helladic culture), and the Greek islands (the Cycladic)."
504,msmarco,_doc,MARCO_6184443,5.286477,Definition of HENGE. : a circular Bronze Age structure (as of wood) with a surrounding bank and ditch found in England. ADVERTISEMENT. a circular Bronze Age structure (as of wood) with a surrounding bank and ditch found in England. ADVERTISEMENT.
505,msmarco,_doc,MARCO_8065674,5.286477,"A Bronze Age Spindle Whorl from Tipperary, Ireland (image from irisharchaeology.ie) In Neolithic times, the spindle whorls are made stone. At least those that have survived are. By the bronze age we begin to see a mix of stone and baked clay whorls."
506,msmarco,_doc,MARCO_7251319,5.2855234,"Regardless of where it originated, bronze metallurgy soon overtook copper in many parts of the globe, thus ushering in the Bronze Age. (In parts of the world that lacked deposits of tin, copper was used alone or alloyed with other metals until iron was introduced.) The smelting process for bronze made with arsenic would have produced poisonous fumes."
507,msmarco,_doc,MARCO_2711463,5.2852926,"The age at which puberty begins varies between individuals; usually, puberty begins between 10 and 13 years of age. The age at which puberty begins is affected by both genetic factors and by environmental factors such as nutritional state and social circumstances."
508,msmarco,_doc,MARCO_869896,5.284525,"The Greek Bronze Age or the Early Helladic Era started around 2800 BC and lasted till 1050 BC in Crete while in the Aegean islands it started in 3000 BC. The Bronze Age in Greece is divided into periods such as Helladic I, II."
509,msmarco,_doc,MARCO_2001967,5.284525,"The Bronze Age refers to a period of time in prehistoric societies where metallurgy had advanced to the point of making bronze — an alloy of tin and copper — from natural ores, but not yet to the point of the systematic production of iron (the Iron Age)."
510,msmarco,_doc,MARCO_2628815,5.2825747,"Later, when iron tools spread, the Bronze Age ended and the Iron Age started. A reason for iron replacing bronze is that tin ore, a rock in which tin may be found, is much more rare than iron ore. Copper tools were not useful because they were too soft."
511,msmarco,_doc,MARCO_1670031,5.2825747,Hand tools have been used by humans since the stone age when stones were used for hammering and cutting. During the bronze age tools were made by casting the copper and tin alloys that the period is named after in clay moulds. Bronze tools were sharper and harder than those made of stone.
512,msmarco,_doc,MARCO_6863189,5.2825747,"How did a cosmopolitan civilization develop during the Late Bronze Age, and what forms did it take? The Late Bronze Age saw the rise of new powers and major cultural transformations. Through Assyrian and Hittite expansion, Mesopotamian culture developed and extended further."
513,msmarco,_doc,MARCO_1778044,5.2806263,"Thera is the ancient name for both the island of Santorini in the Greek Cyclades and the name of the volcano which famously erupted on the island in the middle Bronze Age and covered Akrotiri, the most important settlement, in pumice and volcanic ash, thereby perfectly preserving the Bronze Age town."
514,msmarco,_doc,MARCO_1834126,5.2806263,"Copper was first used in coins and ornaments starting about 8000 B.C., and at about 5500 B.C., copper tools helped civilization emerge from the Stone Age. The discovery that copper alloyed with tin produces bronze marked the beginning of the Bronze Age at about 3000 B.C."
515,msmarco,_doc,MARCO_59771,5.27868,"As a specialist in Bronze Age metalwork, I’ve been invited to the British Museum (London) to examine and write a report on two new hoards of metalwork from the British Late Bronze Age (c. 1300-600 cal. BC) that have recently been found."
516,msmarco,_doc,MARCO_23729,5.27868,"A region of western Asia, in what is now Iraq, known as the “cradle of civilization.” Western writing first developed there, done with sticks on clay tablets. Agricultural organization on a large scale also began in Mesopotamia, along with work in bronze and iron (see Bronze Age and Iron Age)."
517,msmarco,_doc,MARCO_4182968,5.276735,"Add fieldnotes. Knossos is the largest Bronze Age settlement on the island of Crete, and it also can lay claim to one of the most advanced civilizations of Europe of that era.dd fieldnotes. Knossos is the largest Bronze Age settlement on the island of Crete, and it also can lay claim to one of the most advanced civilizations of Europe of that era."
518,msmarco,_doc,MARCO_1224018,5.276735,"Some report that copper is the first metal to be mined and crafted by humans. Whether this is or is not the case, there is evidence of civilizations using copper as far back as 10,000 years. For cultures to advance from the Stone Age to the Bronze Age it was copper that they needed. Bronze has 2 parts copper and one part tin, not silver or gold."
519,msmarco,_doc,MARCO_2508148,5.276735,"In Ancient Egypt the Bronze Age begins in the Protodynastic period, c. 3150 BC. The archaic early Bronze Age of Egypt, known as the Early Dynastic Period of Egypt, immediately follows the unification of Lower and Upper Egypt, c. 3100 BC."
520,msmarco,_doc,MARCO_2628814,5.276735,"These 10 animal facts will amaze you. The Bronze Age refers to a period of time in prehistoric societies where metallurgy had advanced to the point of making bronze — an alloy of tin and copper — from natural ores, but not yet to the point of the systematic production of iron (the Iron Age)."
521,msmarco,_doc,MARCO_7424526,5.276735,"10 most extreme places on Earth. The Bronze Age refers to a period of time in prehistoric societies where metallurgy had advanced to the point of making bronze — an alloy of tin and copper — from natural ores, but not yet to the point of the systematic production of iron (the Iron Age)."
522,msmarco,_doc,MARCO_7808993,5.276699,"The Kali yuga (Iron Age), Dwapara yuga (Bronze Age), Treta yuga (Silver Age) and Satya yuga (Golden Age) correspond to the four Greek ages. Similar beliefs occur in the ancient Middle East and throughout the ancient world, as well."
523,msmarco,_doc,MARCO_4728195,5.274792,The Oxus civilization was a Bronze Age Central Asian culture dated to ca. 2300–1700 BC and centered on the upper Amu Darya (Oxus). In the Early Bronze Age the culture of the Kopet Dag oases and Altyn-Depe developed a proto-urban society.
524,msmarco,_doc,MARCO_5260347,5.274792,"Archaeologists Discover Bronze Remains of Iron Age Chariot in the UK. Oct. 14, 2014 — Archaeologists in the UK have discovered the decorated bronze remains of an Iron Age chariot. The rare set of decorated chariot fittings appear to have been buried as a religious offering."
525,msmarco,_doc,MARCO_937904,5.2709126,"In December 2014, researchers found the earliest known case of lung or prostate cancer in a 4,500 year old Siberian skeleton, dating to the early Bronze Age. 4,500-year-old skeleton of Siberian Bronze Age man, identified as having one of the oldest cases of cancer, discovered in 2014."
526,msmarco,_doc,MARCO_4328970,5.2709126,"Around 100,000 years ago, the territory of modern Baku and Absheron was savanna with rich flora and fauna. Traces of human settlement go back to the Stone age. From the Bronze age there have been rock carvings discovered near Bayil, and a bronze figure of a small fish discovered in the territory of the Old City."
527,msmarco,_doc,MARCO_5340851,5.2709126,"The Chinese Bronze Age had begun by 1700 B.C. in the kingdom of the Shang dynasty along the banks of the Yellow River in northern China. At times the Shang kings ruled even larger areas. Contrary to common notions about the Chinese, the Bronze Age Chinese did not drink tea or eat rice."
528,msmarco,_doc,MARCO_7251317,5.2709126,"In Mesopotamia, the Mesopotamian Bronze Age began about 3500 BC and ended with the Kassite period (c. 1500BC – c. 1155 BC). The usual tripartite division into an Early, Middle and Late Bronze Age is not used. Instead, a division primarily based on art-historical and historical characteristics is more common."
529,msmarco,_doc,MARCO_7598285,5.270871,The Tollund Man was alive during the Iron Age. The Iron Age lasted from approximately 500 B.C. until 800 A.D. The name Iron Age is connected with the fact that after the end of the Bronze Age a method for extracting iron was discovered. The Tollund Man was alive during the first part of the Iron Age.
530,msmarco,_doc,MARCO_4918725,5.2700605,"In a shear slump the top portion of the concrete shears off and slips sideways. In a collapse slump the concrete collapses completely. Only a true slump is of any use in the test. If a shear or collapse slump is achieved, a fresh sample should be taken and the test repeated.A collapse slump will generally mean that the mix is too wet or that it is a high workability mix, for which the flow test (see separate entry) is more appropriate.n a shear slump the top portion of the concrete shears off and slips sideways. In a collapse slump the concrete collapses completely. Only a true slump is of any use in the test. If a shear or collapse slump is achieved, a fresh sample should be taken and the test repeated."
531,msmarco,_doc,MARCO_2856222,5.2689757,"Trending Now. Answers. Best Answer: The civilization that took root on the mainland is called Mycenaean after the first major archaeological site where this culture was identified. The Mycenaeans, an Indo-European group, were the first speakers of the Greek language. They may have entered Greece at the end of the early Bronze Age; in the middle Bronze Age, or in the Neolithic period."
532,msmarco,_doc,MARCO_7640649,5.2689757,Assorted References. 1  Anatolia (in Anatolian art and architecture: Middle Bronze Age) (in Anatolia: Middle Bronze Age) 2  Assyria (in Mesopotamian art and architecture: Architecture) 3  Egypt (in hieroglyphic writing: Invention and uses of hieroglyphic writing) 4  history (in sigillography: Seals in antiquity)
533,msmarco,_doc,MARCO_6064908,5.268932,"the ice age came first. That was a period about 20 thousand years ago when the world froze over. it's what we'd call prehistory. The stone age is part of the three ancient periods of human development, the stone age, the bronze age and the iron age respectively, named after the materials people discovered and used."
534,msmarco,_doc,MARCO_790159,5.2670407,The Schlage Flair Aged Bronze Dummy Lever doesn?t The Schlage Flair Aged Bronze Dummy Lever doesn?t turn and is commonly used as a decorative pull for doors that don?t require latching. The elegant Flair lever?s ornate details are reminiscent of a paper scroll.
535,msmarco,_doc,MARCO_6908324,5.265189,"Definition of PEST. PEST Analysis is abbreviation of “Political, Economic, Social, & Technological analysis and it allows companies to make a framework of macro-environmental factors for the purpose of designing effective environmental strategies.efinition of PEST. PEST Analysis is abbreviation of “Political, Economic, Social, & Technological analysis and it allows companies to make a framework of macro-environmental factors for the purpose of designing effective environmental strategies."
536,msmarco,_doc,MARCO_396195,5.265107,"The Minoan Civilization was a civilization that arose on Crete during the Bronze Age. It is believed to have been the first civilization in the European Continent.From 2700 BC to 1450 BC the Minoan Civilization flourished, not only on the island of Crete, as it affected the nearby islands, too.he Minoan Civilization was a civilization that arose on Crete during the Bronze Age. It is believed to have been the first civilization in the European Continent."
537,msmarco,_doc,MARCO_6100739,5.2631755,"Large areas of land were covered by forest, so it was much easier to transport goods by river. By the start of the Bronze Age, people in Britain had learned to tame horses. Then, around 1000BC, they learned to make carts with wheels. Some farmers travelled on horseback or used wooden carts, pulled by horses or oxen. The first war chariots appeared at the end of the Bronze Age."
538,msmarco,_doc,MARCO_1406582,5.261361,"[tɛʁwaʁ] from terre, land) is the set of all environmental factors that affect a crop 's epigenetic qualities, when the crop is grown in a specific habitat. Collectively, these environmental characteristics are said to have a character; terroir refers also to this character.tɛʁwaʁ] from terre, land) is the set of all environmental factors that affect a crop 's epigenetic qualities, when the crop is grown in a specific habitat. Collectively, these environmental characteristics are said to have a character; terroir refers also to this character."
539,msmarco,_doc,MARCO_1543938,5.261246,"The Minoan civilization flourished in the middle Bronze Age on the Mediterranean island of Crete from ca. 2000 BCE until ca. 1500 BCE and, with their unique... The Minoan civilization flourished in the middle Bronze Age on the Mediterranean island of Crete from ca. 2000 BCE until ca. 1500 BCE and, with their unique art and architecture, the Minoans made a significant..."
540,msmarco,_doc,MARCO_2344861,5.259319,"Bronze Age Indus civilization thrived on seasonal monsoon-fed waters A recent study revealed that people of the Bronze Age Indus Valley civilisation relied on seasonal monsoon flooding and the rich, water-trapping clays of the old river valley, rather than – in contrary to popular belief – on major glacier-fed rivers."
541,msmarco,_doc,MARCO_4745034,5.259319,"Mesopotamia in Culture Expand. Mesopotamia [(mes-uh-puh-tay-mee-uh)] A region of western Asia, in what is now Iraq, known as the “cradle of civilization.” Western writing first developed there, done with sticks on clay tablets. Agricultural organization on a large scale also began in Mesopotamia, along with work in bronze and iron (see Bronze Age and Iron Age)."
542,msmarco,_doc,MARCO_6184439,5.259319,"Origin of HENGE. back-formation from Stonehenge, an assemblage of upright Bronze Age monuments on Salisbury Plain, near Salisbury, England. This word doesn't usually appear in our free dictionary, but the definition from our premium Unabridged Dictionary is offered here on a limited basis. a circular Bronze Age structure (as of wood) with a surrounding bank and ditch found in England. ADVERTISEMENT."
543,msmarco,_doc,MARCO_2288074,5.258561,"Several factors led to the new deal, one of those factors is the great depression. Another factor is the bad job President Hoover did as president. Several factors led to the new deal, one of those factors is the great depression. Another factor is the bad job President Hoover did as president."
544,msmarco,_doc,MARCO_2600637,5.2573924,"Mycenae was a fortified late Bronze Age city located between two hills on the Argolid plain of the Peloponnese, Greece.The acropolis today dates from between the 14th and 13th century BCE when the Mycenaean civilization was at its peak of power, influence and artistic expression.ycenae was a fortified late Bronze Age city located between two hills on the Argolid plain of the Peloponnese, Greece."
545,msmarco,_doc,MARCO_410810,5.256617,"Manage the Aging Process. Skin aging is caused by intrinsic, chronological aging, and extrinsic, environmental aging. Both intrinsic and extrinsic factors contribute to visible signs of aging including the appearance of loss of radiance and firmness, as well as visible signs of wrinkles, laxity, and uneven skin tone. Try A Complimentary Sample Of Our Award-Winning. Anti-Aging Cream, Triple Lipid Restore 2:4:2."
546,msmarco,_doc,MARCO_2600636,5.255469,"by Mark Cartwright. Mycenae was a fortified late Bronze Age city located between two hills on the Argolid plain of the Peloponnese, Greece. The acropolis today dates from between the 14th and 13th century BCE when the Mycenaean civilization was at its peak of power, influence and artistic expression.ycenae was a fortified late Bronze Age city located between two hills on the Argolid plain of the Peloponnese, Greece."
547,msmarco,_doc,MARCO_8044201,5.255469,"Bronze Age. 1  5,300 years ago: (3300 BC): Bronze Age begins in the Near East Newgrange is built in Ireland. 2  5,300–5,000 years ago (3300-3000 BC): Saflieni phase in Maltese prehistory. 3  5,200 years ago: (3200 BC): Writing is invented in Sumer, triggering the beginning of history."
548,msmarco,_doc,MARCO_4170587,5.2546096,"As we age, ________ factors seem to have increasing influence on intelligence scores, and the influence of environmental factors seem to diminish. genetic. J. McVicker Hunt tried to help children raised in a destitute Iranian orphanage by using language-fostering games and other environmental enrichments."
549,msmarco,_doc,MARCO_6604892,5.253488,"Chronology of the Stone Age. The Stone Age begins with the first production of stone implements and ends with the first use of bronze. Since the chronological limits of the Stone Age are based on technological development rather than actual date ranges, its length varies in different areas of the world.aleolithic or Old Stone Age: from the first production of stone artefacts, about 2.5 million years ago, to the end of the last Ice Age, about 9,600 BCE."
550,msmarco,_doc,MARCO_7195252,5.251687,"Symptoms typically come on gradually, begin in young adulthood, and last a long time. The causes of schizophrenia include environmental and genetic factors. Possible environmental factors include being raised in a city, cannabis use during adolescence, certain infections, parental age and poor nutrition during pregnancy."
551,msmarco,_doc,MARCO_2600639,5.2516265,"Ancient Mycenae is located in the Southern region of Greece between Corinth and Argos. It was a part of the Late Hellenic III period, which was also during the Bronze Age which was from roughly 1550 to 1100 BCE (Taylour 20).ncient Mycenae is located in the Southern region of Greece between Corinth and Argos. It was a part of the Late Hellenic III period, which was also during the Bronze Age which was from roughly 1550 to 1100 BCE (Taylour 20)."
552,msmarco,_doc,MARCO_6184441,5.2516265,"henge. n. A Neolithic or Bronze Age structure found in the British Isles, consisting of a large circular earthwork often enclosing an arrangement of standing stones, wooden posts, mounds, or burial pits.. A Neolithic or Bronze Age structure found in the British Isles, consisting of a large circular earthwork often enclosing an arrangement of standing stones, wooden posts, mounds, or burial pits."
553,msmarco,_doc,MARCO_7611628,5.2516265,"See all results for Schlage Thumb Locks. 1  Schlage Z-Wave Connect Camelot Touchscreen Deadbolt with Built-In Alarm, Works with Amazon Alexa via SmartThings... 2  Schlage FE595 CAM 716 ACC Camelot Keypad Entry with Flex-Lock and Accent Levers, Aged Bronze. 3  Schlage B60N716 Deadbolt, Keyed 1 Side, Aged Bronze."
554,msmarco,_doc,MARCO_2634304,5.2496457,"by Christopher Tanis and Ashley Cotter-Cairns. The fourth part in our series of most expensive comic books by era focuses on the so-called Copper Age. If you missed the previous episodes, use these links: Top 20 Golden Age Comics | Top 20 Silver Age Comics | Top 20 Bronze Age Comics | Top 20 Modern Age Comics. (Article continues below)."
555,msmarco,_doc,MARCO_3741683,5.247791,"The original meaning of the word remains unknown, but it seems that there is a strong connection with the mythic king of Crete, Minos, during the bronze-age Minoan civilization which flourished in Crete and in the Aegean islands (2000-1470 BC).he original meaning of the word remains unknown, but it seems that there is a strong connection with the mythic king of Crete, Minos, during the bronze-age Minoan civilization which flourished in Crete and in the Aegean islands (2000-1470 BC)."
556,msmarco,_doc,MARCO_4182965,5.247791,"General Information on Knossos. Knossos is the largest Bronze Age archaeological site of Crete, probably the ceremonial and political centre of the Minoan civilization and culture.It is larger, more complex, and more flamboyant than any of the other palaces known to us, and it is located about twenty minutes south of the port town of Heraklion.eneral Information on Knossos. Knossos is the largest Bronze Age archaeological site of Crete, probably the ceremonial and political centre of the Minoan civilization and culture."
557,msmarco,_doc,MARCO_5289873,5.247791,"Who discovered gold? Gold has been in use by humans as far back as the Chalcolithic or Bronze Age. While there is no clear cut answer to this question, gold has been in use by humans as far back as the Chalcolithic or Bronze Age. Early artisans of the time period used gold to fashion jewelry and other adornments. Golden artifacts have been found in the Balkans that predate the Christian Era by four millennia. Throughout history, gold has had a rich history that has taken it through ancient Egypt, Greece, Rome and Africa."
558,msmarco,_doc,MARCO_7948096,5.247791,"Inhabited since the Paleolithic period (50000 - 17000 BC), Jordan's history didn't truly begin until the Bronze Age (3200 - 1950 BC) when permanent villages and forts were constructed. Civilization further spread during increased migrations to the Middle East at the dawn of the Middle Bronze Age (1950 - 1550 BC). Then, during the first and second century, the ancient kingdoms of the Nabatean Petra, Edom, Ammon, and Moab thrived across Jordan."
559,msmarco,_doc,MARCO_7899847,5.247061,"Pewter was probably first made in the Bronze Age (between 2000 and 500 BC). Pewter and bronze are related alloys; pewter is mostly tin, with a small amount of copper (and other ingredients), while bronze is an alloy made up primarily of copper, with a small amount of tin.ewter is a splendid metal with its own merits and qualities that make it a fine precious metal for both decorative and practical applications. Pewter historically was an alloy of *tin and lead (up to 50% Pb). It became popular in kitchen ware such as plates, mugs, and utensils."
560,msmarco,_doc,MARCO_2501104,5.2439637,"The Minoan Civilization was a Bronze Age civilization that arose in Crete and flourished almost 5000 years ago, until it was destroyed in 1450BC. The Minoans were enigmatic people; educated, warriors and merchants, artists, and experienced sailors.Their maritime empire was vast.he Minoan Civilization was a Bronze Age civilization that arose in Crete and flourished almost 5000 years ago, until it was destroyed in 1450BC. The Minoans were enigmatic people; educated, warriors and merchants, artists, and experienced sailors."
561,msmarco,_doc,MARCO_2445293,5.2439637,"The Neolithic Period began in different parts of the world at different times, the first being around 10,200 BCE in the Middle East, and lasted until the development of metal tools between 4,500 and 2,000 BCE.The Neolithic is the last part of the Stone Age, and was replaced by Bronze Age and use of bronze tools.he Neolithic Period began in different parts of the world at different times, the first being around 10,200 BCE in the Middle East, and lasted until the development of metal tools between 4,500 and 2,000 BCE."
562,msmarco,_doc,MARCO_3618052,5.2439637,"Introduction. Chemistry has shaped our past. Our understanding of what air is, our understanding of atoms, our understanding of how matter changes is all related to chemistry and all of these ideas an more have shaped our past.Just think about the Bronze Age or how money is made or jewelry or steel or chemicals in our homes.ur understanding of what air is, our understanding of atoms, our understanding of how matter changes is all related to chemistry and all of these ideas an more have shaped our past. Just think about the Bronze Age or how money is made or jewelry or steel or chemicals in our homes."
