,_index,_type,_id,_score,_source.body
768,msmarco,_doc,MARCO_5831355,4.9592347,"Salary of an environmental lawyer. It is very difficult to say what the average salary is for any lawyer, especially environmental lawyers… First, understand that geography places a significant factor in any lawyer salary.he Career of an Environmental Lawyer: Day to Day Work of an Environmental Lawyer. As previously discussed there are three main types of work for environmental lawyers, 1) Regulatory work, 2) Transactional Work, and 3) Litigation Work. Let’s take a look at each type."
769,msmarco,_doc,MARCO_4380683,4.958514,"Genotype + environment → phenotype. 1  Not all phenotypes are affected by environmental factors. 2  Blood type, tongue rolling etc. are determined solely by genotype and are not changed due to other factors. 3  Poor diet is an example of an environmental factor which can affect a person’s phenotypic expression. 4  E.g.."
770,msmarco,_doc,MARCO_1338557,4.9576797,"We also have their Clapton's Choice Phos Bronze acoustic guitar strings, endorsed by guitar legend Eric Clapton. From Curt Mangan, we offer phosphor bronze, 80/20 bronze and coated phosphor bronze strings."
771,msmarco,_doc,MARCO_8164339,4.9576797,"Bronzor is based on a 銅鏡 dōkyō, or bronze mirror. Name origin. Bronzor is a combination of bronze and mirror. Dohmirror is a combination of 銅鏡 dōkyō (steel mirror) and mirror. In other languages"
772,msmarco,_doc,MARCO_1784786,4.9567037,"While bronze casting was invented at the begin of the 2nd millennium BCE, the Shang period with the cultures of Erligang, Panlongcheng, Yin, and others, was the first time when bronze casting was industrialized and bronze tools and ritual bronze vessels were produced in royal workshops."
773,msmarco,_doc,MARCO_4814551,4.9567037,Ancient Brass or Bronze. and out of whose hills thou mayest dig brass.. Brass or Bronze. In the Bible bronze is the Hebrew word nechoshet and the Greek word chalchos.. During Bible times bronze was an alloy of copper and tin and was used to an enormous extent.
774,msmarco,_doc,MARCO_4721331,4.9567037,"Choose a translucent bronzer that will give your skin a bit of a glow without looking unnatural. Avoid bronzers that are too sparkly or too matte. To choose the right shade for you, hold the bronzer up to your face as you look in a mirror. The bronzer should only be one or two shades darker than your skin tone."
775,msmarco,_doc,MARCO_6787630,4.9567037,Bronze is the color of the alloy bronze. The first recorded use of bronze as a color name in English was in 1753. The color bronze means third place after gold (first place) and silver (second place) in awards such as the Olympic medals for the Olympic Games.
776,msmarco,_doc,MARCO_1515352,4.9557285,"Bronze is one of the earliest metals known to man. Here is a look at the chemical composition and properties of bronze. Answer: Bronze is an alloy made of copper and another metal, usually tin. Compositions vary, but most modern bronze is 88% copper and 12% tin."
777,msmarco,_doc,MARCO_5978365,4.9557285,"If you mix other metals with copper, you get bronze and brass. Bronze is a mixture of about 90% copper and 10% tin. It’s darker than copper, and the color is less warm. In fact, bronze turns green when it oxidizes. Dark bronze can look almost chocolatey."
778,msmarco,_doc,MARCO_640014,4.9547544,"As with the weapons, bronze is lighter than stone, and you can make statues in different poses with bronze than you can with stone. To get these bronze statues, the artists invented lost-wax casting. By 900 AD, Ife and Hausa people in West Africa were also using bronze alongside of iron."
779,msmarco,_doc,MARCO_354814,4.9547544,"At that time, bronze represented power, wealth, and luxury. By looking at the way bronze was used by the Shang, it is clear that only those with any degree of power in the kingdom had access to using bronze objects. Shang bronzes fall into two categories: weapons or ceremonial vessels for food and wine."
780,msmarco,_doc,MARCO_297140,4.9547544,A number of ceremonial bronze vessels with inscriptions date from the Shang period; the workmanship on the bronzes attests to a high level of civilization. The products of bronze was mainly used by the noble families and the emperoers and loyal members. They seemed the bronze as a sign that have higher social position.
781,msmarco,_doc,MARCO_2289847,4.9547544,"Bronzer makeup is similar to blush, but its difference is instead of giving off a pinkish/reddish glow, bronzer will make your skin look sun-kissed/tanned. Here's an article that might help you in case you'd like to try out the charms of bronzer makeup soon: How To Apply Bronzer."
782,msmarco,_doc,MARCO_3208392,4.9547544,"Bronze is a great metal to scrap, and is always worth more then brass, but less then copper. Bronze generally consists of 90 percent copper and 10 percent zinc. There are multiple other types of metals that may look like bronze, but unless you have it completely clean, it will be a hard item to sell as bronze."
783,msmarco,_doc,MARCO_5948561,4.9547544,"Don't forget to apply and blend bronzer down your neck. And if your hair is up in a ponytail, you should also put a little around your ears, says Barose. Now that you've got the know-how, all you need to do is find the best bronzer for you. SEE NEXT PAGE: Best Bronzer No. 15: Benefit Hoola Matte Bronzer, $29."
784,msmarco,_doc,MARCO_2844390,4.95438,"During this time, many people notice changes in their bodies as they age. Senescence, or biological aging, is the breakdown of the physical body as people grow older. Some elements of biological aging are common in most or all of the population, but people also age differently. In addition to genetics, environmental factors can also affect senescence, including nutrition, stress, exercise, and substance abuse."
785,msmarco,_doc,MARCO_8807691,4.953781,"The Spartan swords were made up of iron  blade, the Kopis were also made up of iron and the shields were  made out of wood with an outer layer of bronze. Ancient greek weapons were made of copper or bronze. Bronze is an alloy of copper and tin. The very first weapon in Greece was copper then bronze."
786,msmarco,_doc,MARCO_801586,4.952809,"There are many different bronze alloys, but typically modern bronze is 88% copper and 12% tin. Alpha bronze consists of the alpha solid solution of tin in copper. Alpha bronze alloys of 4–5% tin are used to make coins, springs, turbines and blades."
787,msmarco,_doc,MARCO_1640419,4.952809,"The Bronze Star and The Bronze Battle Star. I have received several inquiries recently from family members of 398th veterans asking if I had any information regarding the Bronze Star decoration. It has come to my attention that the Bronze Star appears on many service records for 398th vets, and here is where the confusion begins."
788,msmarco,_doc,MARCO_2558403,4.952809,"What Is a Bronzer? Bronzer is a powder or liquid makeup product applied to the face to give the skin a naturally sun-kissed glow. Bronzers are typically brown and warm-toned. Whether your skin is fair or dark, your bronzer should be one to two shades darker than your natural skin tone."
789,msmarco,_doc,MARCO_7738315,4.952809,"This is especially true when it comes to bronze finishes. Color and other aesthetic qualities of bronze finishes can vary among manufacturers. Most manufactures offer kitchen and bathroom faucets in oil rubbed bronze. Today's oil rubbed bronze faucets is typically black in color, however, this was not always the case."
790,msmarco,_doc,MARCO_7124908,4.952654,"The Trachea (also known as the wind pipe) has cartilage rings on it. This prevents the pipe collapsing on itself. If the trachea did collapse, it would disallow us from breath … ing. Also the trachea might collapse and damage the esophagus (also known as the food pipe) which is behind it.he rings of cartilage strengthen the trachea so that it does not collapse, but remains open so that air can get through it. If It didn't it would collapse in on itself and yo … u would be unable to breathe. 14 people found this useful."
791,msmarco,_doc,MARCO_7447311,4.952654,1 Collapse and Leg pain and Abdominal symptoms (2 causes). 2  Collapse and Leg pain and Abnormal blood test symptoms (2 causes). 3  Collapse and Leg pain and Adrenal gland symptoms (2 causes). 4  Collapse and Leg pain and Back pain (2 causes). 5  Collapse and Leg pain and Back symptoms (2 causes).
792,msmarco,_doc,MARCO_6949512,4.9524045,Common factors associated with increased risk of child maltreatment are often categorized as follows: Parent or caregiver factors. Child factors. Family factors. Community and environmental factors. Risk factors for recurrence of child abuse and neglect.
793,msmarco,_doc,MARCO_2558401,4.9518375,"The Bourjois Bronzing Primer is a bronzing product but with a difference, unlike the Bourjois Bronze BB Cream this doesn't just add a hint of colour to the skin but actually primes the skin too should you want to apply foundation and/or powder on top. Bourjois also claim that this little bronze pot mattifies the skin and evens out the skin tone."
794,msmarco,_doc,MARCO_2967456,4.9508667,Bronze Wyatt Earp Statue. Ht.32 in. L.31 in. W.17 in. Different word describing our product: life size Statue bronze Statue bronze Statue bronze Figurine Wyatt Statue Wyatt Figurine Cowboy Statue Cowboy Figurine.
795,msmarco,_doc,MARCO_1515353,4.9508667,"Although at one time bronze was any alloy consisting of copper with tin and brass was an alloy of copper with zinc, modern usage has blurred the lines between brass and bronze. Now, copper alloys generally are called brass, with bronze sometimes considered a type of brass. Bronze usually is a golden hard, brittle metal."
796,msmarco,_doc,MARCO_2533371,4.9508667,"Brass is a metal that consists of both copper and zinc. Bronze is a metal that consists of copper and tin. Bronze is the most popular metal for cast metal sculptures or bronze sculptures. Common bronze alloys often have the unusual and very desirable property of expanding slightly just before they set, thus filling the finest details of a mold."
797,msmarco,_doc,MARCO_4772890,4.9507365,"The Trachea (also known as the wind pipe) has cartilage rings on it. This prevents the pipe collapsing on itself. If the trachea did collapse, it would disallow us from breath … ing. Also the trachea might collapse and damage the esophagus (also known as the food pipe) which is behind it.he rings of cartilage strengthen the trachea so that it does not collapse, but remains open so that air can get through it. If It didn't it would collapse in on itself and yo … u would be unable to breathe. + 13 others found this useful. Ansho Yigezu-Ergetu."
798,msmarco,_doc,MARCO_6071665,4.950454,B) a push factor changing to a pull factor. C) a pull factor changing to a push factor. D) forced migration changing to voluntary migration. E) an economic migration factor changing to an environmental migration factor.
799,msmarco,_doc,MARCO_5006242,4.9498973,"He had a helmet of bronze on his head, and he was armed with a coat of mail, and the weight of the coat was five thousand shekels of bronze. 6 And he had bronze armor on his legs, and a javelin of bronze slung between his shoulders. The shaft of his spear was like a weaver’s beam, and his spear’s head weighed six hundred shekels of iron."
800,msmarco,_doc,MARCO_7874760,4.9498973,"When the Romans first started using coins, they made coins from valuable metals such as bronze, gold and silver. The Romans first produced bronze... Ancient Roman coins were made from various materials. When the Romans first started using coins, they made coins from valuable metals such as bronze, gold and silver. The Romans first produced bronze..."
801,msmarco,_doc,MARCO_4217613,4.948929,"So, what I am going to describe here only applies to quality bronze sculptures and statues. The very last step in creating a bronze sculpture is to apply a coat of wax. This is usually done when the metal is still warm and allows for the wax to enter the pores of the bronze. The wax acts as a barrier to the air and humidity that can cause the bronze to oxidize and turn green."
802,msmarco,_doc,MARCO_7447307,4.9488225,1 Leg pain: Introduction. 2  Collapse and Leg pain and Abdominal pain (2 causes). 3  Collapse and Leg pain and Abdominal symptoms (2 causes). 4  Collapse and Leg pain and Abnormal blood test symptoms (2 causes). 5  Collapse and Leg pain and Adrenal gland symptoms (2 causes). 6  Collapse and Leg pain and Back pain (2 causes).
803,msmarco,_doc,MARCO_298823,4.9479613,"Bronze is the most popular metal for top-quality bells, particularly bell metal, which is about 23% tin. Nearly all professional cymbals are made from a bronze alloy. The alloy used in drum kit cymbal bronze is unique in the desired balance of durability and timbre. Phosphor bronze is also used in guitar and piano strings. Sculptures and statues:"
804,msmarco,_doc,MARCO_1409239,4.9479613,Dragon Doctor (Bronze): Have 4 dragons in a great shape in Story mode. Perfectionist (Bronze): Have a dragon with 20 points in a characteristic in Story mode. Ultimate Customization (Bronze): Unlock all customizations of a dragon family. Perfect (Bronze): Win 50 fights without being injured in 1 Player Arcade mode.
805,msmarco,_doc,MARCO_1839037,4.9479613,"Bronze is an alloy consisting primarily of copper, commonly with about 12bronze that consists copper the addition other ingredients. Aluminum bronzes, containing up to 16 percent aluminum and small amounts of implements artwork made bronze, which is an alloy copper, tin, and, while brass copper zinc, bronze consisting naval brasses had 39."
806,msmarco,_doc,MARCO_5079933,4.9479613,franklin mint bronze coins. Follow franklin mint bronze coins to get e-mail alerts and updates on your eBay Feed. Unfollow franklin mint bronze coins to stop getting updates on your eBay Feed. Yay! You're now following franklin mint bronze coins in your eBay Feed.
807,msmarco,_doc,MARCO_7224862,4.9479613,"Cry Havoc (Bronze): Manually deploy War Assets on a territory for the first time. Discerning Taste (Bronze): Equip your first Symbol, Paint Pattern and Color Swatch on any Hero. Dishonorable Discharge (Bronze): Complete the Knight Chapter. Do it for the Honor! (Bronze): Complete 50 Honorable Kills in 4v4 PvP matches."
808,msmarco,_doc,MARCO_4958413,4.9476433,"Pacific Dynasty International, Inc. DBA: PDI Green Technology, Inc. specializes in LED products that belong to the “Green Generation”. These products are energy efficient = long term cost and maintenance savings, and are environmentally friendly.We provide high quality products.DI Green Technology is the only MBE Authorized Distributor of North Texas for LSI-Industries inc. a publicly-owned 100% US vertical manufacturer of LED display and lights. LSI is an Energy Star Partner, its products have Lighting Facts labels from DOE and are ONCOR approved."
809,msmarco,_doc,MARCO_5978369,4.946995,"Bronze is typically 60% copper and 40% tin. Alpha bronze consists of the alpha solid solution of tin in copper. Alpha bronze alloys of 4-5% tin are used to make coins, springs, turbines and blades. Commercial bronze (otherwise known as brass) is 90% copper and 10% zinc, and contains no tin."
810,msmarco,_doc,MARCO_1862921,4.9469314,"What causes cleft lip and cleft palate? The exact cause of cleft lip and cleft palate is not completely understood. Cleft lip and/or cleft palate are caused by multiple genes inherited from both parents, as well as environmental factors that scientists do not yet fully understand. When a combination of genes and environmental factors cause a condition, the inheritance is called multifactorial (many factors contribute to the cause)."
811,msmarco,_doc,MARCO_978989,4.946029,"Bronze Alloys. Bearing Bronze Alloys. Bearing Bronze Alloys are general purpose bearing alloy possessing good anti-friction properties, ample strength and hardness, adequate ductility and excellent machinability. Bearing Bronze Alloys are for general utility bearings and bushings and which are highly resistant to impact, wear and corrosion."
812,msmarco,_doc,MARCO_6272565,4.946029,"Floor Cleanout, Round, 4 Pipe Dia. (In.), Overall Diameter 5-1/2 In., 3/4 Height (In.), Lid Secured Scoriated Nickel Bronze Cover, Material of Construction Nickel Bronze, Color/Finish Nickel Bronze, Includes Secured Scioriated Nickel Bronze Cover and Frame with Anchor Lugs."
813,msmarco,_doc,MARCO_7208812,4.946029,1 Litigation is a custom bronze statue of two Fighting Buffalo Bulls (American Bison) was created for the briefing room of a law office. It is available as a limited edition bronze statue. Commission a custom wildlife bronze sculpture direct from the artist. Stan Watts is sculptor and owner of Atlas Bronze Casting Foundry.
814,msmarco,_doc,MARCO_640013,4.945064,"Nearly all professional cymbals are made from bronze, which gives a desirable balance of durability and timbre. Several types of bronze are used, commonly B20 bronze, which is roughly 20% tin, 80% copper, with traces of silver, or the tougher B8 bronze which is made from 8% tin and 92% copper. As the tin content in a bell or cymbal rises, the timbre drops."
815,msmarco,_doc,MARCO_8082403,4.9450073,"Causes of Spina Bifida. A type of neural tube defect, spina bifida occurs when the neural tube that creates the spinal cord does not completely close during development. The causes of spina bifida include genetic factors and environmental factors. Unlike other genetic disorders, spina bifida occurs without any prior family history of the condition. Rather, it is the combination of the parents’ genes and environmental factors that cause the condition."
816,msmarco,_doc,MARCO_7863783,4.9450073,"climate data for any destination ● this site in Dutch ● weather news ● contact. Climate. The climate is determined by the average environmental factors (temperature, precipitation, sunshine) of a certain area based on data measured over a longer (usually 30 years) period of time. The same environmental factors of a shorter period of time is considered the weather. The climate is influenced by a number of factors."
817,msmarco,_doc,MARCO_164285,4.945006,"Collapsed and normal lung. In a collapsed lung, air from the lung leaks into the chest cavity. The example shown is a complete left pneumothorax. A pneumothorax (noo-moe-THOR-aks) is a collapsed lung. A pneumothorax occurs when air leaks into the space between your lung and chest wall. This air pushes on the outside of your lung and makes it collapse. In most cases, only a portion of the lung collapses. A pneumothorax can be caused by a blunt or penetrating chest injury, certain medical procedures, or damage from underlying lung disease."
818,msmarco,_doc,MARCO_232212,4.9441004,WWII Army Bronze Star Medal-The Bronze Star medal was awarded to soldiers who demonstrated heroism in battle against an enemy of the United States. The medal consists of a bronze star with a small star on its center. The example shown here is of WWII vintage. The presentation box is blue and has the words Bronze Star medal written on the lid. The box is hinged at the back.
819,msmarco,_doc,MARCO_2401204,4.9439454,"The incidence of cancer and cancer types are influenced by many factors such as age, gender, race, local environmental factors, diet, and genetics. Consequently, the incidence of cancer and cancer types vary depending on these variable factors. Cancer is a leading cause of death worldwide."
820,msmarco,_doc,MARCO_3646969,4.9438515,"Photo 3 of 8. The Environmental Protection Agency was formed in December 1970 after President Nixon submitted a plan to Congress calling for the creation of the agency.Before the EPA was created, our nation had no central authority overseeing the protection of the environment.The EPA writes and enforces rules governing human health and the environment and is currently led by Administrator Lisa Jackson.efore the EPA was created, our nation had no central authority overseeing the protection of the environment. The EPA writes and enforces rules governing human health and the environment and is currently led by Administrator Lisa Jackson."
821,msmarco,_doc,MARCO_6351700,4.9438515,"The pineal gland or epiphysis synthesizes and secretes melatonin, a structurally simple hormone that communicates information about environmental lighting to various parts of the body.Ultimately, melatonin has the ability to entrain biological rhythms and has important effects on reproductive function of many animals.The light-transducing ability of the pineal gland has led some to call the pineal the third eye.ltimately, melatonin has the ability to entrain biological rhythms and has important effects on reproductive function of many animals. The light-transducing ability of the pineal gland has led some to call the pineal the third eye."
822,msmarco,_doc,MARCO_640019,4.9431376,"Bronze is an alloy of copper and usually tin as the main additive that is much harder and more brittle than brass. The term “bronze” is sometimes used interchangeably for different types of copper alloys, but the most common typically refers to a mix of about 90% copper and 10% tin in its “pure” form. Common additives to bronze include phosphorous to harden bronze and lead to make bronze more castable."
823,msmarco,_doc,MARCO_8121499,4.9431376,"Iranian Hadi Saei (2 gold, 1 bronze), American Steven López (2 gold, 1 bronze), South Korean Hwang Kyung-Seon (2 gold, 1 bronze) and Mexican María del Rosario Espinoza (1 gold, 1 silver, 1 bronze) share the most medals in Taekwondo with three."
824,msmarco,_doc,MARCO_2675003,4.9421754,"One of the first alloys made by humans was bronze, which is made by mixing the metals tin and copper. Bronze was an extremely useful alloy to the ancients, because it is much stronger and harder than either of its components. Steel was another common alloy.ne of the first alloys made by humans was bronze, which is made by mixing the metals tin and copper. Bronze was an extremely useful alloy to the ancients, because it is much stronger and harder than either of its components. Steel was another common alloy."
825,msmarco,_doc,MARCO_6889764,4.9421754,"Confidence votes 34.6K. The Bronze Star Medal is awarded for Heroic or meritorious achievement or service.. While there is no complete list compiled of Bronze Stars awarded during Vietnam, medals awarded may be looked up on the National Archives website. You can search by name and several other ways on the site linked below. Number of Bronze Stars awarded (Source: National Archives): 1  Bronze Star for Service 26,215."
826,msmarco,_doc,MARCO_4891041,4.9421754,"If your loved one s headstone is an upright monument and there is room on either side of the granite base, then there is a chance you could add cemetery vases to hold flowers.We also have in-ground cemetery vase units for flat grave markers.ronze Cemetery Vases These vases are specially made to go with bronze grave markers. Bronze vases are cast from rich memorial bronze and normally available in a variety of bronze finishes."
827,msmarco,_doc,MARCO_6272560,4.9421754,"Floor Cleanout, Round, 6 Pipe Dia. (In.), Overall Diameter 7-1/2 In., 3/4 Height (In.), Lid Secured Scoriated Nickel Bronze Cover, Material of Construction Nickel Bronze, Color/Finish Nickel Bronze, Includes Secured Scioriated Nickel Bronze Cover and Frame with Anchor Lugs. Floor Cleanout, Round, 6 Pipe Dia."
828,msmarco,_doc,MARCO_1158659,4.9412036,"DEFINITION of 'Economic Collapse '. A complete breakdown of a national, regional or territorial economy. An economic collapse is essentially a severe version of an economic depression, where an economy is in complete distress for months, years or possibly even decades.A total economic collapse is characterized by economic depression, civil unrest and highly increased poverty levels.he Great Depression in the United States is a prime example of an economic collapse. The 1929 stock market crash brought on a collapse that lasted for many years and saw high levels of poverty."
829,msmarco,_doc,MARCO_2248676,4.9411645,An environmental factor whose effects on a population change as population density changes. Density-independent Factor An environmental factor that affects the size of a population but is not influenced by changes in population density. r-selection population Traits that contribute to a high population growth rate. k-selection population Traits that maximize the chance of surviving in an environment where the number of individuals is near the carrying capacity of the environment.
830,msmarco,_doc,MARCO_6908326,4.9411645,"Francis Aguilar is referred to as the originator of this tool. He talked about ETPS – Economic, Technological, Political, and Social– as the four important factors for Scanning the Business Environment. Later Legal and Environmental factors were also added by some analysts and thus evolved the term PESTLE Analysis.xc.hu. Originally known as PEST Analysis, this is a macro environmental framework used to understand the impact of the external factors on the organization and is used as strategic analytical technique."
831,msmarco,_doc,MARCO_8045978,4.940731,"Important factors that affect the development of tourism are as follows: 1  Environmental factors : Good climate, Beautiful scenery, etc. 2  Socio-economic factors : Accessibility, Accommodation, Amenities, Ancillary services, etc. 3  Historical and cultural factors, 4  Religious factors and. 5  Other factors."
