,_index,_type,_id,_score,_source.body
215,msmarco,_doc,MARCO_7517575,5.721553,"The exact causes of autism spectrum disorder (ASD) are unknown, although it is thought that several complex genetic and environmental factors are involved.The causes of ASD can be described in two ways:1  Primary ASD (also known as idiopathic ASD) – where no underlying factors can be identified to explain why ASD has developed. 2  Secondary ASD – where an underlying medical condition or environmental factor thought to increase the risk of ASD is identified.he causes of ASD can be described in two ways: 1  Primary ASD (also known as idiopathic ASD) – where no underlying factors can be identified to explain why ASD has developed. 2  Secondary ASD – where an underlying medical condition or environmental factor thought to increase the risk of ASD is identified."
216,msmarco,_doc,MARCO_4961755,5.7189794,"Bronze is one of the earliest metals known to man. Here is a look at the chemical composition and properties of bronze. Answer: Bronze is an alloy made of copper and another metal, usually tin. Compositions vary, but most modern bronze is 88% copper and 12% tin.Although at one time bronze was any alloy consisting of copper with tin and brass was an alloy of copper with zinc, modern usage has blurred the lines between brass and bronze.Now, copper alloys generally are called brass, with bronze sometimes considered a type of brass. Bronze usually is a golden hard, brittle metal.nswer: Bronze is an alloy made of copper and another metal, usually tin. Compositions vary, but most modern bronze is 88% copper and 12% tin."
217,msmarco,_doc,MARCO_132896,5.718532,"Human impact on the environment or anthropogenic impact on the environment includes changes to biophysical environments and ecosystems, biodiversity, and natural resources caused directly or indirectly by humans, including global warming, environmental degradation (such as ocean acidification), mass extinction and biodiversity loss, ecological crises, and ecological collapse."
218,msmarco,_doc,MARCO_5960328,5.716595,"Rio de Janeiro governor declares state of financial emergency ahead of Olympics. Emergency measures needed to avoid ‘a total collapse in public security, health, education, transport and environmental management’. This article is 10 months old. Jonathan Watts in Rio de Janeiro."
219,msmarco,_doc,MARCO_8543315,5.716595,"Depletion of government-owned forests has turned them into deserts, and millions of acres of grazing and farm land in the northern Chinese plains were made alkaline and unproductive during the Great Leap Forward. Central and Eastern Europe . With Communism’s collapse, word has begun to seep out about Eastern Europe’s environmental disasters."
220,msmarco,_doc,MARCO_7728315,5.7146597,"Nomads, Territorial States, and Microsocieties, 2000–1200 BCE. Chapter Summary. Around 2000 BCE, a subsistence crisis gripped much of Afro-Eurasia, and the large riverine states collapsed. Natural resources and soil fertility diminished, and an environmental warming cycle undermined the ability of marginal lands to produce crops."
221,msmarco,_doc,MARCO_1246199,5.714132,"Causes of autism spectrum disorder. The exact causes of autism spectrum disorder (ASD) are unknown, although it is thought that several complex genetic and environmental factors are involved. The causes of ASD can be described in two ways:1  Primary ASD (also known as idiopathic ASD) – where no underlying factors can be identified to explain why ASD has developed. 2  Secondary ASD – where an underlying medical condition or environmental factor thought to increase the risk of ASD is identified.he causes of ASD can be described in two ways: 1  Primary ASD (also known as idiopathic ASD) – where no underlying factors can be identified to explain why ASD has developed. 2  Secondary ASD – where an underlying medical condition or environmental factor thought to increase the risk of ASD is identified."
222,msmarco,_doc,MARCO_4006401,5.7088656,"The environmental impact of the coal industry includes issues such as land use, waste management, water and air pollution, caused by the coal mining, processing and the use of its products.istorically, coal mining has been a very dangerous activity and the list of historical coal mining disasters is a long one. Underground mining hazards include suffocation, gas poisoning, roof collapse and gas explosions."
223,msmarco,_doc,MARCO_5960327,5.7088656,"Rio de Janeiro governor declares state of financial emergency ahead of Olympics. Forty-nine days before the opening of the Olympics, the governor of Rio de Janeiro has declared a state of financial emergency and begged for federal support to avoid a “total collapse in public security, health, education, transport and environmental management”."
224,msmarco,_doc,MARCO_8119887,5.7088656,"Generally, environmental and engineering problems fall into the following classes or types: 1  Infrastructure (highways and bridges) 2  Groundwater (exploration and contaminant mapping) 3  Geohazards (earthquake mitigation and collapse structure mapping) 4  Urban (utility mapping, underground storage tank location) 5  Geologic Mapping. 6  Archeology."
225,msmarco,_doc,MARCO_6025159,5.7050123,"It turns out that the genetically modified mosquitoes could be released into the U.S. environment as early as January of 2012. A private firm plans to initiate the release of the GE mosquitoes in the Florida Keys.f Florida and the US approves Oxitec’s planned release of these genetically modified mosquitoes, we will become that much closer to future genetic modification of living creatures as well as the potential collapse of environmental and human health."
226,msmarco,_doc,MARCO_8143968,5.7030883,": a life-threatening condition characterized by cessation of sweating with inadequate elimination of body heat, extremely high temperature, rapid pulse, hot dry skin, flaccid muscles, delirium, collapse, and coma and resulting from prolonged exposure to high environmental temperature which causes a dysfunction of the temperature-regulating mechanism of the body — see sunstroke — compare heat exhaustion"
227,msmarco,_doc,MARCO_8113692,5.7030883,"Because of this, it is important to monitor and manage corrosion to avoid structural collapse. What Is the Rate of Corrosion? The rate of corrosion is the speed at which any given metal deteriorates in a specific environment. The rate, or speed, is dependent upon environmental conditions as well as the type, and condition, of the metal. Corrosion rates in the US are normally calculated using mpy (Mils per year). In other words, the corrosion rate is based on the number of millimeters (thousandths of an inch) it penetrates each year."
228,msmarco,_doc,MARCO_7768600,5.693323,"Tweet Reddit. ... There are several factors that affect reaction rate, and these are the following. Nature of Reactants. What factors influence the rate of chemical ... are the most important environmental factors that directly affect the rate of ...respiration-amount of ... This study of chemical reactions is called Chemical Kinetics, and it identifies the factors that influence the rates of chemical reactions.weet Reddit. ... There are several factors that affect reaction rate, and these are the following. Nature of Reactants. What factors influence the rate of chemical ... are the most important environmental factors that directly affect the rate of ..."
229,msmarco,_doc,MARCO_2850260,5.6877623,"While the most common material to be used for sheet pile is steel sheet pile. Sheet pile is act as a temporary supportive wall that been driven into a slope or excavation to support the soft soils collapse from higher ground to lower ground. Sheet Pile Applications. Sheet piling can be applied in many common environmental applications, sheet piles are wisely used in the following fields of application : * Retaining walls * Bridge abutments * Tunnels * Pumping station * Water treatment plants ..."
230,msmarco,_doc,MARCO_298829,5.6854343,"Bronze was still used during the Iron Age, but the weaker iron was found to be sufficiently strong for many applications. As iron working improved, iron became both cheaper and stronger, eclipsing bronze in Europe by the early to mid-Middle Ages. Properties. With the exception of steel, bronze is"
231,msmarco,_doc,MARCO_318144,5.6776447,"Tin mining began early in the Bronze Age, as bronze is a copper-tin alloy.in extraction and use can be dated to the beginnings of the Bronze Age around 3000 BCE, when it was observed that copper objects formed of polymetallic ores with different metal contents had different physical properties."
232,msmarco,_doc,MARCO_6292071,5.676441,"Dog collapsed trachea is often the cause of obstruction of the airway and coughing in a dog. The direct cause is not known, but there are several factors that may contribute to the cause. Most commonly, the cause is likely abnormal synthesis of the cartilage in the trachea.og collapsed trachea is often the cause of obstruction of the airway and coughing in a dog. The direct cause is not known, but there are several factors that may contribute to the cause. Most commonly, the cause is likely abnormal synthesis of the cartilage in the trachea."
233,msmarco,_doc,MARCO_6025161,5.6763444,"The mosquitoes are genetically modified with a gene designed to kill them unless given an antibiotic known as tetracycline. Offspring of the GM mosquitoes will receive this same lethal gene which will kill the offspring before it can ever reach adulthood.As more genetically modified mosquitoes mate with wild mosquitoes, the idea is that more and more offspring will be produced with the lethal gene, thereby reducing the mosquito population.f Florida and the US approves Oxitec’s planned release of these genetically modified mosquitoes, we will become that much closer to future genetic modification of living creatures as well as the potential collapse of environmental and human health."
234,msmarco,_doc,MARCO_3562259,5.669885,"The Bronze Age (About 3700 BC to about 500 BC) The Bronze Age starts at different areas of the world at different times. The knowledge of how to mix the copper and tin moves slowly from place to place, plus many areas have no tin and/or copper to make the new metal. 3769 BC. Bronze is already in use at this time."
235,msmarco,_doc,MARCO_6968697,5.669885,"Among these primitive trumpets the following may be noted: 1  The ancient Nordic lur was made of bronze and dates back to the Late Bronze Age (1000–500 BCE). 2  The Celtic carnyx was also made of bronze, and was used as an instrument of war during the Iron Age (c. 300 BCE – 200 CE)."
236,msmarco,_doc,MARCO_6137529,5.666813,"No matter what first sparked the U.S. environmental movement or when it actually began, it's safe to say that environmentalism has become a powerful force in American culture and politics.he book awakened many people in the United States and elsewhere to the potential environmental and health hazards of using powerful chemicals in agriculture and led to a ban on DDT. Still others might point to May 28, 1892 as the day when the U.S. environmental movement began."
237,msmarco,_doc,MARCO_5891806,5.6498823,"The earliest attested reference to the European myth of the Ages of Man 500 BC-350 BC appears in the late 6th century BC works of the Greek poet Hesiod's Works and Days (109-126). Hesiod, a deteriorationist, identifies the Golden Age, the Silver Age, the Bronze Age, the Heroic Age, and the Iron Age. With the exception of the Heroic Age, each succeeding age was worse than the one that went before."
238,msmarco,_doc,MARCO_3683450,5.6487427,Darwin's theories led to the development of the literary school of in which characters are portrayed as being subject to natural and environmental forces? Darwin's theories led to the development of the literary school of  Naturalism in which characters are portrayed as being subject to  natural and environmental forces.
239,msmarco,_doc,MARCO_59778,5.6487007,"Bronze is made when copper is heated and mixed with tin, creating a stronger metal than copper. Date Event 3700 BC The Bronze Age (About 3700 BC to about 500 BC) The Bronze Age starts at different areas of the world at different times. The knowledge of how to mix the copper and tin moves slowly from place to place, plus many areas have no tin and/or copper to make the new metal. 3769 BC."
240,msmarco,_doc,MARCO_5326835,5.6462517,What CDC Is Doing. 1  Impact in Guatemala expanded expanded. 2  HIV/AIDS collapsed collapsed. 3  Global Disease Detection (GDD) collapsed collapsed. 4  International Emerging Infections Program (IEIP) collapsed collapsed. 5  Influenza collapsed collapsed. 6  Field Epidemiology Training Program (FETP) collapsed collapsed.
241,msmarco,_doc,MARCO_4399504,5.6424775,"breaking point. 1. Literally, the point at which an object or machine ceases to function or falls apart. Don't put anything else on that chair—it's wobbling and looks to be close to the breaking point. Based on that terrible noise, it sounds like your car is at the breaking point. 2. By extension, the point at which an overworked or overburdened person, system, organization, etc., fails, give ups, or collapses. I was already fed up with my husband's lazy, selfish ways, but his refusal to come with me to my mother's funeral was the breaking point. With governmental resources already strained to the breaking point, any sort of environmental disaster would likely be catastrophic. See also: breaking, point. breaking point . 1. Lit. the point at which something will break. The mule's back was strained to the breaking point with masses of bundles and straw. 2."
242,msmarco,_doc,MARCO_8033753,5.6424775,Weather Related (2) Aviation Disasters (20) Helicopter Accident (2) Takeoff Accident (7) Landing Accident (4) Mid-Air Accident (3) Fire (8) Wildfire (10) Commercial Fire (4) Sea Disaster (5) Cruise Ship Accident (2) Migrant Boat Accident (7) Explosion (1) Animal Accident (4) Environmental (2) Spill (4) Structure Collapse (1) Highway Disaster (2) Bus Accident (4) Health Disaster (9) Rescue (1) Railroad Disasters (10) Train Collision (3) Derail (10) Flood (1) Earthquake (1) Volcano (1) Utility ...
243,msmarco,_doc,MARCO_7608643,5.640576,"bronze(Noun) A natural or man-made alloy of copper, usually of tin, but also with one or more other metals. bronze(Noun) A work of art made of bronze, especially a sculpture. bronze(Noun) A bronze medal. bronze(Verb) To plate with bronze. My mother bronzed my first pair of baby shoes."
244,msmarco,_doc,MARCO_7608638,5.6347733,"Princeton's WordNet (1.00 / 1 vote) Rate this definition: bronze (noun) an alloy of copper and tin and sometimes other elements; also any copper-base alloy containing other elements in place of tin. bronze (adj) a sculpture made of bronze. bronze, bronzy (adj) of the color of bronze. bronze (verb) made from or consisting of bronze. bronze (verb)"
245,msmarco,_doc,MARCO_3062924,5.6334333,"Chou (also called Zhou, pronounced joe) Dynasty. About 1100 BCE to 250 BCE. After Xia times, first the Shang family and then the Chou family ruled ancient China. This was the Bronze Age of ancient China.The first ruling family was the Shang. The Shang are famous for their use of bronze, chopsticks, jade, silk, spices, oracle bones, and a system of writing. The kingship was very odd.fter Xia times, first the Shang family and then the Chou family ruled ancient China. This was the Bronze Age of ancient China."
246,msmarco,_doc,MARCO_8688014,5.6327367,An LED light bulb is a solid-state lighting (SSL) device that fits in standard screw-in connections but uses LEDs (light-emitting diodes) to produce light. LED light bulbs are a more environmentally-friendly alternative to incandescent bulbs. LED bulbs use a semiconductor device that emits visible light when an electric current passes through it. That property is known as elecroluminescence.
247,msmarco,_doc,MARCO_6619142,5.6313086,"Kichler Lighting 15800AZT Ripley LED 12-volt Path and Spread Landscape Light, Textured Architectural Bronze Finish. by Kichler Lighting. $ 193 20 Prime."
248,msmarco,_doc,MARCO_2327650,5.6258435,"Full scale excavations at Anyang began in 1928, and what has been revealed in the following decades is a major capital city of the Shang Dynasty (1554 B.C.to 1045 B.C.). Anyang was the last capital of the Shang Dynasty, and easily the most important Bronze Age site in east Asia.Since 1928, Chinese archaeologists have unearthed extensive architectural foundations, tombs, chariots, thousands of bronze vessels, almost uncountable ceramics, and about 150,000 oracle bones.nyang was the last capital of the Shang Dynasty, and easily the most important Bronze Age site in east Asia."
249,msmarco,_doc,MARCO_925727,5.625435,"While completing his Bachelor's degree in Studio Art at the University of California at San Diego (UCSD) in the mid '90s, Justin's interest in bronze sculpture led him to work for Moon Space Art Casting Foundry."
250,msmarco,_doc,MARCO_3327920,5.625435,"Capitol Lighting has a variety of LED products and fixtures besides Torchiere Lamps. But Torchiere Lamp products come in various styles and colors, at varying heights and with a mix of finishes, from bronze to black to white to copper and beyond."
251,msmarco,_doc,MARCO_5905909,5.623481,"InchLight Under Cabinet Lighting. These 120 volt LED under cabinet fixtures provide versatile lighting and require no external power supply, transformer or driver!. Available in five lengths and three finishes (white, nickel, or bronze)"
252,msmarco,_doc,MARCO_2652863,5.620412,"For jewelry, bronze is an affordable metal with a warm, rich color. Bronze is an alloy that consists of a mixture of copper and tin, approximately 90% copper and 10% tin. Producing bronze is a less toxic process than producing brass. Brass is a combination of copper and zinc, and the manufacturing process often produces zinc oxide which is toxic. Our natural bronze styles are solid bronze. Our silver plated bronze and gold plated bronze both have a solid core of bronze that is then plated in fine silver or in gold."
253,msmarco,_doc,MARCO_2617401,5.619686,"Vancouver led the country with the highest average starting salaries for Software, Mechanical, Electrical, Chemical, Industrial, Environmental, Design, and Civil Engineers.Calgary had the highest average starting salaries for Manufacturing Engineers with a median of $66,901.ancouver led the country with the highest average starting salaries for Software, Mechanical, Electrical, Chemical, Industrial, Environmental, Design, and Civil Engineers."
254,msmarco,_doc,MARCO_1111047,5.6185412,"Environmental factors. 1  Cancer is a complex disease, which means it is influenced by environmental and lifestyle factors as well as genetic factors. 2  Environmental exposures can include factors such as UV light, chemicals (for example in cigarette smoke) and radiation."
255,msmarco,_doc,MARCO_3895555,5.618282,"Best Wishes. Smelting of copper first began about 5000 B.C. in various places in the Near East and was widespread by 3000 B.C. The Bronze age in Europe did not begin until about 2000 B.C. The Bronze Age was characterized by the first use of metal tools in human civilization. First copper, then bronze, and even later, iron, were utilized as materials for making tools and consumer goods. First, however, the thinkers and creators of this era had to discover smelting, which is the extraction of metal from an ore through the use of heat. Since copper was essentially a soft and malleable metal, they then had to discover the art of alloying two metals together to create a new and harder metal."
256,msmarco,_doc,MARCO_4961760,5.616617,"There are many different bronze alloys, but typically modern bronze is 88% copper and 12% tin. Alpha bronze consists of the alpha solid solution of tin in copper. Alpha bronze alloys of 4–5% tin are used to make coins, springs, turbines and blades.here are many different bronze alloys, but typically modern bronze is 88% copper and 12% tin. Alpha bronze consists of the alpha solid solution of tin in copper. Alpha bronze alloys of 4–5% tin are used to make coins, springs, turbines and blades."
257,msmarco,_doc,MARCO_4867497,5.615844,"Globalization and Its Impact on the Environment. Globalization has helped in the immense growth in international trade and finance. It has made countries to work more closely with each other and has led to several innovations in science and technology.However, it has contributed to environmental degradation as well. Let us try to know about globalization and its impact on the environment.t has made countries to work more closely with each other and has led to several innovations in science and technology. However, it has contributed to environmental degradation as well. Let us try to know about globalization and its impact on the environment."
258,msmarco,_doc,MARCO_7932007,5.6128364,"Both are alloys and both contain a lot of copper - but that is where the similarities end. Comparatively, brass is a very soft metal. For example, it is used for plumbing fixtures because it is easy to work with and easily tooled. Brass is not as hard as bronze. Brass is also prone to corrosion, so most plumbing fixtures are coated with another metal such as chrome to make it more durable. You will find that a brass bell does not sound as pure as a bronze bell. Brass bells have kind of a clangy or brassy sound to them. Bronze on the other hand is very hard and can last forever. In fact, there are several grades of bronze. A type called admiralty bronze was used for cannons and is used for propellers on boats. Bell Bronze is the purest type of bronze in the bronze family."
259,msmarco,_doc,MARCO_5680127,5.607917,Coach K was the USA head coach in 1990 when he led the Americans to a bronze medal at the World Championships and a silver medal at the Goodwill Games in Seattle. He also paced Team USA to a silver medal at the 1987 World University Games and was a special assistant to Bob Knight at the 1984 Olympics.
260,msmarco,_doc,MARCO_1169474,5.6077447,"The age at which puberty begins varies between individuals; usually, puberty begins between 10 and 13 years of age. The age at which puberty begins is affected by both genetic factors and by environmental factors such as nutritional state and social circumstances.he average age at which the onset of puberty occurs has dropped significantly since the 1840s. This was dubbed 'the secular trend' by J. M. Tanner. In every decade from 1840 to 1950 there was a drop of four months in the average age of menarche among Western European females."
261,msmarco,_doc,MARCO_6130017,5.6040444,"Charging Bull. Charging Bull, which is sometimes referred to as the Wall Street Bull or the Bowling Green Bull, is a bronze sculpture that stands in Bowling Green in the Financial District in Manhattan, New York City. Originally guerrilla art, installed unofficially by Arturo Di Modica, its popularity led to it being a permanent feature."
262,msmarco,_doc,MARCO_3741682,5.6032443,"The Minoans-The First European Civilization. The Minoan civilization existed on Crete. It was the first European civilization. About 2,500 BC a sophisticated society grew up on the island of Crete. By about 1,950 BC the inhabitants had invented a form of writing using hieroglyphs.This writing is called linear A. The Minoans were a bronze age civilization.(They made tools and weapons from bronze). Their civilization was at its height from about 1700 BC to 1500 BC. However Minoan culture declined after 1450 BC. We are not sure why but they may have been conquered by Mycenaens from mainland Greece.bout 2,500 BC a sophisticated society grew up on the island of Crete. By about 1,950 BC the inhabitants had invented a form of writing using hieroglyphs. This writing is called linear A. The Minoans were a bronze age civilization."
263,msmarco,_doc,MARCO_3462367,5.6009407,"The causes of schizophrenia include environmental and genetic factors. Possible environmental factors include being raised in a city, cannabis use, certain infections, parental age, and poor nutrition during pregnancy. Genetic factors include a variety of common and rare genetic variants."
264,msmarco,_doc,MARCO_3922827,5.600547,"The lifetime toll of pesticides. I'm Bob Hirshon and this is Science Update. Farmers who work with pesticides, even without major mishaps, have a greater risk of neurological problems.That's according to a study of nearly 19,000 farmers, led by epidemiologist Freya Kamel of the National Institute of Environmental Health Sciences.armers who work with pesticides, even without major mishaps, have a greater risk of neurological problems. That's according to a study of nearly 19,000 farmers, led by epidemiologist Freya Kamel of the National Institute of Environmental Health Sciences."
265,msmarco,_doc,MARCO_829120,5.59825,"The ancient origins of Vietnam's literature, language and culture, and the country itself, began in the north along the fringes of the Red River Delta. The legendary Hong Bang Dynasty, the first ruling state of Vietnam, popped up around 2879 BC, and the development of wet rice cultivation and bronze casting led to the formation of the Dong Sun culture some 800 years later."
266,msmarco,_doc,MARCO_7892467,5.59825,Here is my thoughts on why (bear in mind i have no evidence to support this and this is all purely hypothetical): here are my points. 1  Something else came in that replaced the Khopesh. 2  Tactics changed and the Khopesh was no longer used. Archaeologists have not found a single Khopesh that had an edge on it. This has led some to think they were never used in battle (Unlikely it is an amazing piece of design) however bronze is easily recycled so perhaps all the battle Khopesh were melted down. hence something changed in the inventory
