,_index,_type,_id,_score,_source.body
699,msmarco,_doc,MARCO_6405401,4.962007,"Identify the aspects of your life that you consider mundane, and then ‘routinize’ those aspects as much as possible. In short, make fewer decisions. There’s just one way to radically change your behavior: radically change your environment.—Dr. B.J. Fogg, Director of Stanford Persuasive Lab. If you use a big spoon, you’ll eat more.our environment can also be tweaked to make certain tasks more difficult or easier to do. As Stanford psychologist B.J. Fogg is so fond of saying, tough habits stick when you can simplify the behavior: Goals are harmful unless they guide you to make specific behaviors easier to do."
700,msmarco,_doc,MARCO_6165527,4.962007,"Biography [edit]. Rosenhan received his Bachelor of Arts degree from Yeshiva University. At Columbia University in 1953 he earned his master's degree, and five years later his Ph.D in psychology. Rosenhan was a leading expert on psychology and the law.He was a pioneer in the application of psychological methods to the practice of trial law process, including jury selection and jury consultation.rofessor Rosenhan held a joint appointment with the Stanford University Department of Psychology and later became professor emeritus at Stanford University. He died on February 6, 2012, at the age of 82."
701,msmarco,_doc,MARCO_8460192,4.962007,"In 2008, Harvard MBAs reported record salary and bonus averaging $144,261. Last year, a full five years later, the pay was nearly $6,000 less. It’s a similar story for Stanford MBAs. The Class of 2008 received average salary and bonus of $140,771, also a record, but more than $3,000 less in 2013.ast year, a full five years later, the pay was nearly $6,000 less. It’s a similar story for Stanford MBAs. The Class of 2008 received average salary and bonus of $140,771, also a record, but more than $3,000 less in 2013."
702,msmarco,_doc,MARCO_8794686,4.962007,"In 1988, Engelbart and his daughter Christina launched the Bootstrap Institute – later known as The Doug Engelbart Institute – to promote his vision, especially at Stanford University; this effort did result in some DARPA funding to modernize the user interface of Augment.n 1988, Engelbart and his daughter Christina launched the Bootstrap Institute – later known as The Doug Engelbart Institute – to promote his vision, especially at Stanford University; this effort did result in some DARPA funding to modernize the user interface of Augment."
703,msmarco,_doc,MARCO_8794680,4.962007,"Doug Engelbart invented the computer mouse in the early 1960s in his research lab at Stanford Research Institute (now SRI International). The first prototype was built in 1964, the patent application for this X-Y position indicator for a display system was filed in 1967, and US Patent 3,541,541 was awarded in 1970.n the Web 8a. 1  MouseSite-the definitive website on the Mouse hosted by Stanford University, especially their Photos of the First Mouse page. 2  They also curate video of the 1968 demo and other significant archives from Doug Engelbart's work."
704,msmarco,_doc,MARCO_3808497,4.9585257,Noun. 1. double-blind experiment-an experimental procedure in which neither the subjects of the experiment nor the persons administering the experiment know the critical aspects of the experiment; a double-blind procedure is used to guard against both experimenter bias and placebo effects.oun. 1. double-blind experiment-an experimental procedure in which neither the subjects of the experiment nor the persons administering the experiment know the critical aspects of the experiment; a double-blind procedure is used to guard against both experimenter bias and placebo effects.
705,msmarco,_doc,MARCO_794211,4.958226,"You can't get into a good college without lots of lab science. To be safe, it's best to plan for four years of high-school science, with at least two of them being lab science. If you're aiming for MIT or Stanford (or the equivalent), make that three or four years of lab science.This means you should plan to take your first lab science course in your ninth grade year.o be safe, it's best to plan for four years of high-school science, with at least two of them being lab science. If you're aiming for MIT or Stanford (or the equivalent), make that three or four years of lab science."
706,msmarco,_doc,MARCO_3976781,4.958226,"The CubeSat program began in 1999 as a collaboration between California Polytechnic State University and Stanford University. The goal was to design a standard for picosatellites, tiny Earth-orbiting boxes usually with a volume of about 61 cubic inches (1 liter) and a mass of about 2.9 lbs.(1.33 kilograms).he CubeSat program began in 1999 as a collaboration between California Polytechnic State University and Stanford University. The goal was to design a standard for picosatellites, tiny Earth-orbiting boxes usually with a volume of about 61 cubic inches (1 liter) and a mass of about 2.9 lbs."
707,msmarco,_doc,MARCO_3652046,4.958226,"A new Stanford study says yes. Many of you may be familiar with Lumosity (it even has its own commercial on TV now). It's a San Francisco-based company that provides an online brain training program, where subscribers play nearly 40 different games to improve attention, flexibility, memory and problem solving. new Stanford study says yes. Many of you may be familiar with Lumosity (it even has its own commercial on TV now). It's a San Francisco-based company that provides an online brain training program, where subscribers play nearly 40 different games to improve attention, flexibility, memory and problem solving."
708,msmarco,_doc,MARCO_5620883,4.958226,"According to FinAid.org, the average cost of master’s degree for students is between $30,000 and $120,000. The cost varies depending on the university and the master’s program itself. The cost varies by program as well.The average cost of an MBA, for example, is $40,000. At most universities, this is what master’s degree graduates will pay. Some institutions have programs for less, and MBA programs at Harvard or Stanford could cost in excess of $120,000.he cost varies by program as well. The average cost of an MBA, for example, is $40,000. At most universities, this is what master’s degree graduates will pay. Some institutions have programs for less, and MBA programs at Harvard or Stanford could cost in excess of $120,000."
709,msmarco,_doc,MARCO_7126114,4.958226,"The website allows you to make a gift or pledge payment in a variety of ways. Or call us with your credit card information toll-free at 866.543.0243 (outside the U.S. please call 650.724.0627), Monday through Friday, 8 a.m. to 5 p.m. Pacific Time. You can also mail a check made out to Stanford University. Please include a note telling us how to direct your gift and send it to: Development Services P.O. Box 20466 Stanford, CA 94309-0466. For information about making a stock gift, visit our appreciated securities transfer page or call the gift securities team at 650.721.1917."
710,msmarco,_doc,MARCO_6859830,4.958226,"Zetetic Posts: 54Registered User Junior Member. December 2007 edited July 2010 in Law School. Even though I look at rankings with a grain of salt, I found it curious that Yale's acceptance rate is 6.8% (ranked #1), Harvard's 12.6% (#2), and Stanford's 8.6% (#3).etetic Posts: 54Registered User Junior Member. December 2007 edited July 2010 in Law School. Even though I look at rankings with a grain of salt, I found it curious that Yale's acceptance rate is 6.8% (ranked #1), Harvard's 12.6% (#2), and Stanford's 8.6% (#3)."
711,msmarco,_doc,MARCO_6108706,4.958226,"According to FinAid.org, the average cost of master’s degree for students is between $30,000 and $120,000. The cost varies depending on the university and the master’s program itself. The cost varies by program as well.The average cost of an MBA, for example, is $40,000. At most universities, this is what master’s degree graduates will pay. Some institutions have programs for less, and MBA programs at Harvard or Stanford could cost in excess of $120,000.he average cost of an MBA, for example, is $40,000. At most universities, this is what master’s degree graduates will pay. Some institutions have programs for less, and MBA programs at Harvard or Stanford could cost in excess of $120,000."
712,msmarco,_doc,MARCO_5943215,4.958226,"A top 2% mark in recognised IQ test qualifies you for entry to Mensa. IQ tests accepted by Mensa include the Cattell III B, Culture Fair, Ravens Advanced Matrices, Ravens Standard Matrices, Wechsler Scales and Stanford Binet (this list is not exhaustive). top 2% mark in recognised IQ test qualifies you for entry to Mensa. IQ tests accepted by Mensa include the Cattell III B, Culture Fair, Ravens Advanced Matrices, Ravens Standard Matrices, Wechsler Scales and Stanford Binet (this list is not exhaustive)."
713,msmarco,_doc,MARCO_6168817,4.956608,• EXPERIMENTER BIAS (noun). The noun EXPERIMENTER BIAS has 1 sense: 1. (psychology) bias introduced by an experimenter whose expectations about the outcome of the experiment can be subtly communicated to the participants in the experiment. Familiarity information: EXPERIMENTER BIAS used as a noun is very rare.he noun EXPERIMENTER BIAS has 1 sense: 1. (psychology) bias introduced by an experimenter whose expectations about the outcome of the experiment can be subtly communicated to the participants in the experiment.
714,msmarco,_doc,MARCO_637525,4.9544597,Malia – elder sister to 13-year-old Sasha Obama – is set to start at college next autumn and was recently spotted touring New York University. She has also visited Columbia University – her father’s alma mater – along with Stanford University and the University of California in Berkeley.alia – elder sister to 13-year-old Sasha Obama – is set to start at college next autumn and was recently spotted touring New York University. She has also visited Columbia University – her father’s alma mater – along with Stanford University and the University of California in Berkeley.
715,msmarco,_doc,MARCO_2325057,4.9544597,"In 2008, Harvard MBAs reported record salary and bonus averaging $144,261. Last year, a full five years later, the pay was nearly $6,000 less. It’s a similar story for Stanford MBAs. The Class of 2008 received average salary and bonus of $140,771, also a record, but more than $3,000 less in 2013.Truth be told, Harvard and Stanford pay hit an artificial ceiling in 2008.ven worse, perhaps, average salaries and bonuses for the graduates of what are generally considered the two best business schools in the world were significantly lower than they were five years ago in 2008. THE GREAT RECESSION HELPED TO RESET MBA PAY."
716,msmarco,_doc,MARCO_5616747,4.9544597,"Issue No. 7, Summer 2006. We are happy to announce that the long awaited Down Syndrome Clinic at Stanford will open its doors on July 11th. The clinic is located in the Lucile Packard Children’s hospital. To make an appointment, please call the clinical coordinator at (650) 723-6858, extension 1.For more information visit our clinic web page.e are happy to announce that the long awaited Down Syndrome Clinic at Stanford will open its doors on July 11th. The clinic is located in the Lucile Packard Children’s hospital. To make an appointment, please call the clinical coordinator at (650) 723-6858, extension 1."
717,msmarco,_doc,MARCO_4525374,4.9544597,"2010 – 2019. Stanford computer models project a dramatic spike in extreme seasonal temperatures during the period 2010 - 2019. “The Stanford team also forecast a dramatic spike in extreme seasonal temperatures during the current decade [2010 – 2019].Temperatures equaling the hottest season on record from 1951 to 1999 could occur four times between now [2010] and 2019 over much of the U.S., according to the researchers.limate experts predict that there is a 50% chance that the average temperature of the world will increase by 5° Celsius (11°F). A 5° Celsius change is the difference between our world today and the world during the last ice age."
718,msmarco,_doc,MARCO_4783532,4.9544597,"An Indian GMAT based college, a European 1 year program and a full scale, 2 year course in the USA, albeit one of the pricier ones. No prizes for guessing, but think on the lines of ISB, INSEAD, Stanford, Stern, Columbia, Harvard and the likes.Most of the information is taken from the school websites. So here’s the math on how we’ve worked out how much an MBA can cost for 1 year and 2 year programs.n Indian GMAT based college, a European 1 year program and a full scale, 2 year course in the USA, albeit one of the pricier ones. No prizes for guessing, but think on the lines of ISB, INSEAD, Stanford, Stern, Columbia, Harvard and the likes."
719,msmarco,_doc,MARCO_4785229,4.9544597,"Soviet leader Joseph Stalin also attended the Potsdam Conference but did not sign the Declaration, since the Soviet Union did not enter the war against Japan until August 8, 1945. Document Excerpts with Questions From Japan’s Decision to Surrender, by Robert J.C. Butow (Stanford University Press, 1954).oviet leader Joseph Stalin also attended the Potsdam Conference but did not sign the Declaration, since the Soviet Union did not enter the war against Japan until August 8, 1945. Document Excerpts with Questions From Japan’s Decision to Surrender, by Robert J.C. Butow (Stanford University Press, 1954)."
720,msmarco,_doc,MARCO_5885741,4.9544597,"According to the Bureau of Labor Statistics, the 2010 median income for professors was $62,050 per year. The lowest 10 percent earned less than $30,720, and the top 10 percent earned more than $130,510.Professors at Ivy League universities and top-tier private colleges, such as New York University, Duke, Northwestern, and Stanford, occupied the top of the pay scale.he lowest 10 percent earned less than $30,720, and the top 10 percent earned more than $130,510. Professors at Ivy League universities and top-tier private colleges, such as New York University, Duke, Northwestern, and Stanford, occupied the top of the pay scale."
721,msmarco,_doc,MARCO_8726466,4.9544597,"This quantitative MRI study reports measurement of corpus callosum area taken from midsagittal brain images in 51 healthy men and 41 healthy women, spanning the adult age range (22 to 71 years).Men had larger brains and corpora callosa than women, but callosal size did not correlate with age in either sex.ex differences in corpus callosum size: relationship to age and intracranial size. Sullivan EV(1), Rosenbloom MJ, Desmond JE, Pfefferbaum A. Author information: (1)Department of Psychiatry and Behavioral Sciences, Stanford University School of Medicine, Stanford, CA, USA."
722,msmarco,_doc,MARCO_3671680,4.9527836,"Make It Rain Experiment: Here is a great experiment on making rain. In this experiment, kids learn about condensation. What’s In The Rain Experiment: Here is an experiment that lets kids see what’s in the rain. It shows kids that there are particles in the air and when it rains they get to see them up close. Make A Rain Gauge Experiment: Here is an experiment that allows a kids to make their very own rain gauge. See A Raindrop Experiment: Here is an experiment that allows you to see a raindrop. In this experiment, kids will preserve raindrops, so they can measure to see how big they really are."
723,msmarco,_doc,MARCO_6416038,4.950877,Lightning Experiment: Here is a great experiment that allows kids to make lightning in their mouth. It's a great way for them to understand how lightning works. Lightning Experiment: Here is a great experiment that allows the kids to make lightning.All you need is a balloon and a light bulb! Lightning Experiment: Here is another great experiment that allows the kids to make lightning.ightning Experiment: Here is a great experiment that allows the kids to make lightning. All you need is a balloon and a light bulb! Lightning Experiment: Here is another great experiment that allows the kids to make lightning.
724,msmarco,_doc,MARCO_639723,4.9507074,"This is a tough question. A handful of schools require you to report ALL Tests during ALL dates. Stanford is one of these. I personally went to my school's office and asked that my ACT scores not be put on my transcript, so that I could forget about them and colleges would never know.(I am the opposite of you; high SAT, low ACT).I'm applying and not sending ACT scores to any schools I am seriously considering. If you don't make a special request at your school's office, your scores are probably on your transcript, allowing universities to KNOW you have taken ACT/SAT.his is a tough question. A handful of schools require you to report ALL Tests during ALL dates. Stanford is one of these. I personally went to my school's office and asked that my ACT scores not be put on my transcript, so that I could forget about them and colleges would never know."
725,msmarco,_doc,MARCO_3360489,4.9507074,"Frank W. Chen. ​ Frank W. Chen is one of California's premier lawyers. He was born in Taipei, Taiwan, and came to the United States in 1968 at the age of 4. He received his undergraduate degree in Economics from Stanford University in 1985, and his law degree from UCLA School of Law in 1988.He has been practicing law in California for the past twenty-seven years.e was born in Taipei, Taiwan, and came to the United States in 1968 at the age of 4. He received his undergraduate degree in Economics from Stanford University in 1985, and his law degree from UCLA School of Law in 1988. He has been practicing law in California for the past twenty-seven years."
726,msmarco,_doc,MARCO_5848411,4.9507074,"This year, Stanford is telling applicants that the estimated cost of its two-year, full-time MBA program is a whopping $185,054, a new record. That is some $18,242 more than Stanford said it would cost an MBA student only two years ago, when Columbia was the school with the most expensive MBA program in the world. At that time, Columbia estimated that the cost to attend its MBA program was $168,307, while third-place Stanford’s price tag was $166,812. In just two years, Stanford’s estimated cost of the degree has risen by 10.9%, though the estimate includes a $4,000 global study trip. Harvard Business School, Stanford’s No. 1 rival, now costs over $20,000 less in estimated charges, even though it is in pricey Boston."
727,msmarco,_doc,MARCO_7835554,4.9507074,"Recombinant DNA Technology. Recombinant DNA Technology. All organisms on Earth evolved from a common ancestor, so all organisms use DNA as their molecule of heredity. At the chemical level, DNA is the same whether it is taken from a microscopic bacterium or a blue whale.As a result, DNA from different organisms can be “cut and pasted” together, resulting in “recombinant DNA”. The first recombinant DNA molecule was produced in 1972 by Stanford researcher Paul Berg.f the DNA from the different sources is cut with the same restriction enzyme, the cut ends can be joined together and then sealed into a continuous DNA strand by the enzyme ligase. In 1973, the first organism to contain recombinant DNA was engineered by Herb Boyer (UCSF) and Stanley Cohen (Stanford University)."
728,msmarco,_doc,MARCO_6240787,4.946969,"Pell Grants and other Grant Aid. 53% of Stanford University students received grant aid in 2013/2014. The average total aid amount was $39,299. 14 percent of students received aid in the form of Pell Grants from the U.S. Federal Government. The average Pell Grant awarded for 2013/2014 was $4,214.ell Grants and other Grant Aid. 53% of Stanford University students received grant aid in 2013/2014. The average total aid amount was $39,299. 14 percent of students received aid in the form of Pell Grants from the U.S. Federal Government. The average Pell Grant awarded for 2013/2014 was $4,214."
729,msmarco,_doc,MARCO_690223,4.943245,"Tuition for Stanford University is $44,184 for the 2014/2015 academic year. This is 75% more expensive than the national average private non-profit four year college tuition of $25,229.Stanford University is one of the 100 most expensive colleges in the America, coming in 94th on our Expensive 100 Ranking.The cost is $23,550 and 114% more expensive than the average California tuition of $20,634 for 4 year colleges.Tuition ranks 172nd in California amongst 4 year colleges for affordability and is the 10th most expensive 4 year college in the state.Price does not vary by residence.he cost is $23,550 and 114% more expensive than the average California tuition of $20,634 for 4 year colleges. Tuition ranks 172nd in California amongst 4 year colleges for affordability and is the 10th most expensive 4 year college in the state. Price does not vary by residence."
730,msmarco,_doc,MARCO_211459,4.943245,"It can also add influence to a resume with a master’s degree from a prestigious institution if not already there at the bachelor’s degree level, so the investment pays off in the long run. According to FinAid.org, the average cost of master’s degree for students is between $30,000 and $120,000.The cost varies depending on the university and the master’s program itself. The cost varies by program as well.The average cost of an MBA, for example, is $40,000. At most universities, this is what master’s degree graduates will pay. Some institutions have programs for less, and MBA programs at Harvard or Stanford could cost in excess of $120,000.he average cost of an MBA, for example, is $40,000. At most universities, this is what master’s degree graduates will pay. Some institutions have programs for less, and MBA programs at Harvard or Stanford could cost in excess of $120,000."
731,msmarco,_doc,MARCO_5007074,4.943245,"Raquel Welch. by ethnic on. Birth Name: Jo Raquel Tejada. Place of Birth: Chicago, Illinois, USA. Date of Birth: September 5, 1940. Ethnicity: *Bolivian (father) *English (mother). Raquel Welch is an American actress and singer.Her father, Armando Carlos Tejada Urquizo, was from La Paz, Bolivia, Her mother, Josephine Sarah Hall, had English ancestry.aquel’s maternal grandparents were Emery Stanford Hall, an architect (the son of Justin Smith Hall and Sarah Mehitable Stanford), and Clara Louise Adams (the daughter of Joseph Warren Adams and Josephine H. Merrill). Sources: Genealogies of Raquel Welch (focusing on her father’s side) – http://famouskin.com."
732,msmarco,_doc,MARCO_5093209,4.943245,"IQ stands for intelligence quotient. A person's IQ score is computed by dividing a person's mental age by their chronological age and multiplying by 100. So if a 7 year old takes an IQ test and scores the mental age of a 7 year old; 7/7=1 times 100= an IQ of 100.Thus an average IQ would be 100.If a 10 year old scored the mental age of a 5 year old; 5/10= .5 times 100= an IQ of 50 (not so hot).f a five year old took his test, and had the mental age of a three year old, then the school would work harder with him to raise his intelligence. Louis Terman, a Stanford professor, brought this idea to the United States and created the Stanford-Binet IQ test."
733,msmarco,_doc,MARCO_8244172,4.943245,"Those figures are according to a Poets & Quants report compiling the highest and lowest base salaries of 2015 MBA graduates, based on business school employment records. The highest reported MBA starting compensation came in at a whopping $467,000, more than 50 percent higher than the next highest base salary last year. The sum went to a private equity employee who graduated from Columbia Business School, whose graduates last year saw a median salary of $125,000. Another Columbia graduate took a $320,000 per year starting salary in consumer products. Meanwhile, a Stanford MBA saw the lowest reported compensation. The graduate had a base salary of $18,000 at a non-profit organization in Europe, according to Poets & Quants. Last year's Stanford graduates working in non-profits enjoyed median starting salaries of $100,000."
734,msmarco,_doc,MARCO_248586,4.939534,the google self driving car commonly abbreviated as sdc is a project by google x that involves developing technology for autonomous cars mainly electric carsthe software powering google s cars is called google chauffeurlettering on the side of each car identifies it as a self driving car the project is currently being led by google engineer sebastian thrun former director of the stanford artificial intelligence laboratory and co inventor of google street viewhe software powering google s cars is called google chauffeur lettering on the side of each car identifies it as a self driving car the project is currently being led by google engineer sebastian thrun former director of the stanford artificial intelligence laboratory and co inventor of google street view
735,msmarco,_doc,MARCO_2456601,4.939534,"Offensive linemen, tight ends and placekickers took to the weight room for bench press and the field for the 40-yard dash, but the third group of arrivals are now getting their measurements underway. That includes defensive linemen and linebackers.There are definitely some notable measurements thus far when it comes to the linebackers. Alabama's Adrian Hubbard comes in at 6'6 and 257 pounds, both of which are tops among the position.The biggest hands go to Stanford's Trent Murphy, as he's the only one to eclipse 11 inches at 11 1/8. Below, we've got the full list of measurements for linebackers at the combine:labama's Adrian Hubbard comes in at 6'6 and 257 pounds, both of which are tops among the position. The biggest hands go to Stanford's Trent Murphy, as he's the only one to eclipse 11 inches at 11 1/8. Below, we've got the full list of measurements for linebackers at the combine:"
