,_index,_type,_id,_score,_source.body
542,msmarco,_doc,MARCO_5342844,4.9830604,"Oprah Winfrey: “Align Your Personality With Your Purpose”. The former talk show star offers career and life advice at Stanford Graduate School of Business. April 25, 2014|by Deborah Petersen. Your life is the greatest teacher, shared Oprah Winfrey during her talk at Stanford GSB. | Toni Gauthier."
543,msmarco,_doc,MARCO_5401317,4.9830604,"Recent Updates. 1  The Hoover Institution, Stanford University. If you’re looking to grade public education in California, pass-fail probably isn’t the way to go but make sure to leave plenty of room in the “comments” section of your report card. 2  The Hoover Institution, Stanford University."
544,msmarco,_doc,MARCO_6554907,4.9830604,"Dr. Karl G. Sylvester graduated from the Thomas Jefferson University, Jefferson Medical College in 1992. He works in Stanford, CA and specializes in Pediatric Surgery. Dr. Sylvester is affiliated with Lucile Packard Childrens Hospital, Santa Clara Valley Health Hospital System and Stanford Health Care."
545,msmarco,_doc,MARCO_6960265,4.9830604,"exists and is an alternate of . In January 1996, two PhD students from Stanford University named Larry Page and Sergey Brin created Google as a research project. In January 1996, two PhD students from Stanford University named Larry Page and Sergey Brin created Google as a research project."
546,msmarco,_doc,MARCO_5670133,4.9830604,"At the Stanford Center for Inherited Cardiovascular Disease, we specialize in the care of patients and families with genetic disorders of the heart and blood vessels.Our care extends from the youngest to the oldest members of your family.t the Stanford Center for Inherited Cardiovascular Disease, we specialize in the care of patients and families with genetic disorders of the heart and blood vessels."
547,msmarco,_doc,MARCO_2749867,4.982094,"The Stanford MBA Program is a two-year, full-time residential general management program that helps you develop your vision and the skills to achieve it. 2017-18 Admission. Stay tuned for updates. The deadlines have passed for 2016-17 admission to the Stanford MBA Program, but check back soon for updates about next year's deadlines and process."
548,msmarco,_doc,MARCO_4230513,4.982094,"Mouse History In Photos. The first computer mouse was invented and developed by Dougles Englebart during the 60′ and was patented on November 17, 1970. Douglas was working at the Stanford Research Institute, a think tank sponsored by Stanford University. He originally named the mouse as a “X-Y Position Indicator for a Display System “."
549,msmarco,_doc,MARCO_6447596,4.982094,"The owners awarded the sites of two Super Bowls, December 14: Super Bowl XIX, to be played on January 20, 1985, to Stanford University Stadium in Stanford, California, with San Francisco as host team; and Super Bowl XX, to be played on January 26, 1986, to the Louisiana Superdome in New Orleans."
550,msmarco,_doc,MARCO_6061522,4.982094,"Stanford is a village in McLean County, Illinois, United States. The population was 670 at the 2000 census. It is part of the Bloomington–Normal Metropolitan Statistical Area. Stanford is located at 40°26′2″N 89°13′20″W / 40.43389°N 89.22222°W / 40.43389; -89.22222 (40.433969, -89.222255)."
551,msmarco,_doc,MARCO_6114225,4.982094,"Beyond the Ivies: Stanford University received 5,950 Single Choice Early Action applications compared to 5,566 Single Choice Early Action applications for the Class of 2014 – that’s a 7% increase. Stanford expects to accept 760 SCEA applicants for a targeted freshman class of about 1,700 students."
552,msmarco,_doc,MARCO_614411,4.981128,"Today’s Campus. Stanford University is located on 8,180 acres in the center of the San Francisco Peninsula. Stanford is a self-sustaining community featuring 49 miles of roads, two separate water systems, three dams, three open water reservoirs, 88 miles of water mains and a post office."
553,msmarco,_doc,MARCO_764758,4.981128,"Bipolar disorder patients die prematurely from a wide range of causes, from heart disease to the flu, a Swedish population study showed. But that grim trend might be eased by increased access to primary care providers, Casey Crump, MD, PhD, of Stanford University in Stanford, Calif., and colleagues reported online in JAMA Psychiatry."
554,msmarco,_doc,MARCO_257075,4.981128,"Stanford University GPA, SAT Scores and ACT Scores for Accepted, Rejected, and Waitlisted Students. Data courtesy of Cappex. Calculate Your Chances of Getting In with this free tool from Cappex. Stanford University is one of the most selective colleges in the country. In the graph above, you can see that the blue and green dots representing accepted students are concentrated in the upper right corner."
555,msmarco,_doc,MARCO_1345706,4.981128,"Stanford Football: Cajuste 17-yard TD catch. Stanford's quarterback Kevin Hogan finds Devon Cajuste in the end zone with 10 seconds left in the first half. Hogan finished with 279 yards passing and two touchdowns as the Cardinal pulled off the upset, 41-31. Current Playlist: Latest Videos."
556,msmarco,_doc,MARCO_1647427,4.981128,"The Stanford interdisciplinary program in Public Policy has offered a strong undergraduate major since 1980. In 2006, the Faculty Senate granted the Public Policy Program approval for a graduate program, which included an M.P.P. (a two-year professional degree) and an M.A. in Public Policy (a one-year degree). Both master’s programs were initially open only to Stanford graduate students."
557,msmarco,_doc,MARCO_5602916,4.981128,"California Governor Leland Stanford represented the Central Pacific Railroad, and the president of the Union Pacific Railroad, Thomas C. Durant, represented his side. When the time came to drive the golden stake into the ground to officially christen the railroad, Governor Stanford missed hitting the spike with the sledgehammer on his first attempt, before connecting on his second try."
558,msmarco,_doc,MARCO_6954142,4.981128,"State wise list of Top Universities in USA. Top 10 Universities and Colleges in USA. Stanford University was founded in 1885 by Jane and Leland Stanford in memory of their only child. The University's pristine campus, one of the largest in the United States, is located in California’s suburban Bay Area some 30 miles from San Francisco."
559,msmarco,_doc,MARCO_6034307,4.981128,"Description. The Stanford-Binet intelligence scale is a direct descendent of the Binet-Simon scale, the first intelligence scale created in 1905 by psychologist Alfred Binet and Dr. Theophilus Simon.he Stanford-Binet intelligence scale is used as a tool in school placement, in determining the presence of a learning disability or a developmental delay, and in tracking intellectual development."
560,msmarco,_doc,MARCO_6274870,4.981128,"So for example getting a 150 on both verbal and quant sections of the GRE will most likely not make any impression on the admissions committee at Stanford. The average GRE scores for Engineering department at Stanford is 167 on quant, 161 on verbal and a 4.5 on the analytical writing section. Most of these top schools do not state the minimum or average GRE scores that they are looking for in an applicant."
561,msmarco,_doc,MARCO_7905028,4.981128,"Related News. 1  Imaging study discovers brain development differences in kids with Fragile X syndrome Fragile X syndrome is the most common known cause of inherited intellectual disability and autism. 2  Fragile X, Down syndromes linked to faulty brain communication, Stanford researcher finds STANFORD, Calif."
562,msmarco,_doc,MARCO_7813753,4.981128,"Exit onto Sand Hill Road and follow the signs for Stanford University. Heading east, drive approximately 3 miles to the Stanford Shopping Center. Turn right onto Arboretum Road (Nordstrom is on your right). Stay on Arboretum until it ends, then turn right onto Galvez Street. Move to the left lane and continue past the stadium."
563,msmarco,_doc,MARCO_6828308,4.981128,"Includes Ivy League, plus Massachusetts Institute of Technology (MIT) and Stanford university matriculation (estimate) ranking of college preparatory secondary schools in the United States, plus individual school profiles and reviews. ¹HYMPS = Harvard University, Yale University, MIT, Princeton University and Stanford University. Methodology."
564,msmarco,_doc,MARCO_7287769,4.981128,Careers Thank you for your interest in careers with Stanford Marine Group. We are committed to be the workplace of choice in our industry and to offer equal opportunities to all applicants to become members at SMG’s family as well as to build a future full of growth and development. Please check the Careers sections of Stanford Marine and Grandweld Shipyards for vacancies and for details regarding application.
565,msmarco,_doc,MARCO_7244786,4.981128,"Bill Ong Hing, Making and Remaking Asian America Through Immigration Policy, 1850-1990 (Stanford: Stanford University Press, 1993), 32-33. 1  Roger Daniels, The Politics of Prejudice: The Anti-Japanese Movement in California and the Struggle for Japanese Exclusion (Berkeley: University of California Press, 1977), 99."
566,msmarco,_doc,MARCO_7603140,4.981128,"SoFi was founded in 2011 by Mike Cagney, Dan Macklin, James Finnigan, and Ian Brady, four students who met at the Stanford Graduate School of Business. The founders hoped SoFi could provide more affordable options for those taking on debt to fund their education. The company’s inaugural loan program was a $2 million pilot at Stanford."
567,msmarco,_doc,MARCO_38570,4.9801636,"1 Oregon Ducks vs. Stanford Cardinal: 2013 NCAA football live stream & TV schedule Examiner The biggest Pac-12 NCAA football 2013 game of the year is here, as the Oregon Ducks vs. Stanford Cardinal meet in a live stream, TV schedule game that’s courtesy of a Nov. 7 ESPN report."
568,msmarco,_doc,MARCO_1345703,4.9801636,"Stanford Football: Cajuste 17-yard TD catch. Stanford's quarterback Kevin Hogan finds Devon Cajuste in the end zone with 10 seconds left in the first half. Hogan finished with 279 yards passing and two touchdowns as the Cardinal pulled off the upset, 41-31. Sept. 19, 2015 (0:28)"
569,msmarco,_doc,MARCO_3448862,4.9801636,"Alma Mater: Stanford University. Current work: Leading the 100 Year Starship, a government-funded project to plan the next 100 years of interstellar travel. Growing up in the southside of Chicago, Mae Jemison was always curious about space. After graduating from Stanford University, she became a medical doctor and worked in Liberia and Sierra Leone as the Peace Corps medical officer."
570,msmarco,_doc,MARCO_4482394,4.9801636,"STANFORD UNIVERSITY, Palo Alto, Calif. — Entrepreneurs flocked to Stanford today to hear Mark Zuckerberg, the T-shirt wearing chief executive of Facebook, open up about the company’s early days. Since the social networking giant’s initial public offering in May, this is one of only a handful of public appearances he’s made."
571,msmarco,_doc,MARCO_4428235,4.9801636,"Born July 23, 1936 in Sacramento, California. Married Mary Davis, June 29, 1963; Children: Justin Anthony, Gregory Davis, and Kristin Marie. Stanford University, 1954-57; London School of Economics, 1957-58; Stanford University, B.A., 1958; Harvard Law School, LL.B., 1961."
572,msmarco,_doc,MARCO_4452534,4.9801636,"The Stanford-Binet (SB) - the best and most popular intelligence test is a Cognitive ability assessment used to measure intelligence (IQ). The Stanford-Binet measures five factors of cognitive ability: Fluid Reasoning, Knowledge, Quantitative Reasoning, Visual-Spatial Processing, and Working Memory. Each of these factors is tested in two separate domains, verbal and nonverbal."
573,msmarco,_doc,MARCO_4267896,4.9801636,"The first mouse. The first computer mouse was invented in 1963 by Douglas Engelbart at the Stanford Research Institute and was presented during a live public demonstration on December 9, 1968.This was the public debut of the computer mouse.he first computer mouse was invented in 1963 by Douglas Engelbart at the Stanford Research Institute and was presented during a live public demonstration on December 9, 1968."
574,msmarco,_doc,MARCO_7455886,4.9801636,"Stanford's 120th Commencement Weekend, which is scheduled for June 10-12, will feature a Commencement address by Felipe Calderón Hinojosa, president of Mexico; a Class Day lecture by Rob Reich, associate professor of political science at Stanford; and a Baccalaureate address by the Rev. Gail E. Bowman, chaplain at Dillard University in New Orleans."
575,msmarco,_doc,MARCO_7281653,4.9801636,"Indivisible Stanford is a new campus group founded by Law School students to mobilize against the Trump administration (JORDAN PAYNE/The Stanford Daily). Indivisible Stanford’s plans include meeting with U.S. Congresswoman Anna Eshoo and becoming involved with Swing Left, an organization dedicated to swinging seats in competitive congressional districts from red to blue."
576,msmarco,_doc,MARCO_5711255,4.98009,"Carbon dioxide is also another important factor in photosynthesis. In this experiment, water does not contain a lot of carbon dioxide, extra carbon dioxide has to be added to the water in this experiment.I think if we add baking soda to water, elodea will definitely produce more CO2.arbon dioxide is also another important factor in photosynthesis. In this experiment, water does not contain a lot of carbon dioxide, extra carbon dioxide has to be added to the water in this experiment. I think if we add baking soda to water, elodea will definitely produce more CO2."
577,msmarco,_doc,MARCO_3260801,4.9791994,"Stanford TOEFL Requirements for Undergraduates. Stanford does not require a TOEFL score for international undergraduate applicants, however, they recommend one. If English is not your native language, we recommend, but do not require, the Test of English as a Foreign Language (TOEFL). The TOEFL cannot replace the SAT or ACT Plus Writing. On another page, they “ strongly recommend ” that non-native speakers take the TOEFL."
578,msmarco,_doc,MARCO_2420161,4.9791994,"Effect of magnesium sulfate exposure on term neonates. M B Greenberg, A A Penn, K R Whitaker, E A Kogut, Y Y El-Sayed, A B Caughey and D J Lyell. 1  1 Department of Obstetrics & Gynecology, Lucile Packard Children's Hospital at Stanford University, Stanford, CA, USA."
579,msmarco,_doc,MARCO_3360912,4.9791994,"Stanford-area historical tornado activity is near Kentucky state average. It is 23% greater than the overall U.S. average. On 4/3/1974, a category F4 (max. wind speeds 207-260 mph) tornado 15.7 miles away from the Stanford city center killed 7 people and injured 28 people."
580,msmarco,_doc,MARCO_3302624,4.9791994,1 South Acadian Thruway south (turns into Stanford Drive) 2  Stanford Drive right lane merges into West Lakeshore Drive. 3  West Lakeshore Drive to LSU campus (turns into South Stadium Road)  South Stadium Road to LSU Public Safety Building (located across the street from Tiger Stadium)
581,msmarco,_doc,MARCO_3902742,4.9791994,"Did Tim Tebow win the Heisman twice? How many winning Super Bowl quarterbacks were Heisman Trophy winners? Jim Plunkett, Oakland Raiders and Stanford The last Heisman winning QB that started and won a Super Bowl was Jim Plunkett who won the Heisman in 1970 (Stanford) and won Supe…r Bowls XV and XVIII with the Raiders."
582,msmarco,_doc,MARCO_4375632,4.9791994,"Question 4 How fast do gulls fly? According to a Stanford research team who investigated how fast birds in general fly; “For example, a gull whose most efficient loiter airspeed was 22 mph (35 kph) could fly at anything between 15 and 28 mph (24 and 45 kph) without increasing its metabolic rate more than 15 percent.”. Stanford University Report."
583,msmarco,_doc,MARCO_5170532,4.9791994,"Comments. Stanford 41, USC 31—Final. Led by three touchdowns from Remound Wright, the Stanford Cardinal upset the No. 6 USC Trojans 41-31 during a Pac-12 showdown at the Coliseum. Kevin Hogan shredded the USC defense for 279 yards and two touchdowns, while Christian McCaffrey added 115 yards on the ground."
584,msmarco,_doc,MARCO_5214194,4.9791994,"R&DE Student Housing Senior Director, Imogen Hinds, welcomes you home! R&DE Student Housing and Residence Staff are here to help with life at Stanford. Student Housing at Stanford provides many styles of homes for its diverse student body. New Graduate Housing. Updates and links for new housing project in Escondido Village."
585,msmarco,_doc,MARCO_6274868,4.9791994,GMAT — Instruct Pearson VUE to send scores directly to the “Stanford MBA Program” (school code L9R-KW-09). GRE — Instruct ETS to send your scores directly to “Stanford University” (school code 4704). Please note that specifying a department will delay the processing of your test scores.
586,msmarco,_doc,MARCO_4371394,4.9782367,"Stanford President Marc Tessier-Lavigne made the following comments at the Faculty Senate meeting on Thursday, March 9, 2017. President’s comments at Faculty Senate meeting of Feb. 23, 2017. Stanford President Marc Tessier-Lavigne made the following comments at the Faculty Senate meeting on Thursday, Feb. 23, 2017."
587,msmarco,_doc,MARCO_5901462,4.9782367,"On the Wechsler test, the IQ score reflects where a person falls in the normal distribution of IQ scores. Therefore, this score, like the original Stanford-Binet IQ score, is a relative score, indicating how the test taker’s score compares to the scores of other people. Most current intelligence tests, including the revised versions of the Stanford-Binet, now have scoring systems based on the normal distribution."
588,msmarco,_doc,MARCO_6240781,4.9782367,"According to our research engine: Tuition at the Stanford University School of Medicine is approximately $49,892 for in-state tuition. In-state fees are $893.In-state health insurance is $3,600.Out-of-state tuition is $49,892.Out-of-state fees are $893.ccording to our research engine: Tuition at the Stanford University School of Medicine is approximately $49,892 for in-state tuition. In-state fees are $893."
589,msmarco,_doc,MARCO_514902,4.9772744,Stanford Montana shared Wild West Hoopfest's photo. Stanford Montana shared Wild West Hoopfest's event. Registrations are coming in for the Wild West Hoopfest! Make sure to get registered soon before team spaces run out! Early registration closes March 10th and the last day to register is March 20th. Visit www.wildwesthoopfest.com for forms and/or online registration - Thank you!
590,msmarco,_doc,MARCO_682900,4.9772744,"Harvard accepted about 6% of applicants last year, turning down hundreds if not thousands of perfect 4.0 students and students with perfect SAT scores. You need high scores and test grades to apply, but while perfect won't get you in not-quite-perfect won't keep you out.est Answer: You need a special achievement. My girlfriend said she got into Stanford because she could benchpress well with her legs. (no joke) Stanford seems to like admitting golfers. Go out and be politically active or something. Start a foundation."
591,msmarco,_doc,MARCO_28253,4.9772744,"Reply to Stanford by June 1st. If you get notified that you were accepted, well, for starters, congratulations! Secondly, let them know by June 1st of your decision. The sooner you do, the sooner you can get started on living arrangements and financial aid.nform them you're looking to go to Stanford so they can get you on the right track as soon as possible. They'll be able to suggest classes and tell you what you need to do to get started. 1  Keep your career goals in mind when it comes to choosing classes."
592,msmarco,_doc,MARCO_9824,4.9772744,"The student-faculty ratio at Stanford University is 4:1, and the school has 71.3 percent of its classes with fewer than 20 students. The most popular majors at Stanford University include: Engineering, Multi/Interdisciplinary Studies, Social Sciences, Computer and Information Sciences and Support Services and Biological and Biomedical Sciences. The average freshman retention rate, an indicator of student satisfaction, is 98 percent."
593,msmarco,_doc,MARCO_100197,4.9772744,"For parking near the Stanford Visitor Center see the Visitor Information Services Map. For all campus parking see the Parking and Circulation / Campus Map. Parking options (Near the Stanford Visitor Center) Visitor Center Lot (L-95) Galvez Street, between Nelson Road and Campus Drive (Visitor Parking Permit Vending Machine) Varsity Lot (L-97)"
594,msmarco,_doc,MARCO_257074,4.9772744,"Search form. Admission. Stanford students come from across the United States and throughout the world, representing diverse perspectives, experiences, backgrounds and cultures. U.S. undergraduate applicants are admitted on a need-blind basis, and the university offers substantial financial aid to help families manage the costs. Once here, Stanford students discover extraordinary freedom of opportunity — to explore, to collaborate and to challenge themselves."
595,msmarco,_doc,MARCO_2759554,4.9772744,"Stanford research: The meaningful life is a road worth traveling. A Stanford research project explored the key differences between lives of happiness and meaningfulness. While the two are similar, dramatic differences exist – and one should not underestimate the power of meaningfulness. The quest for meaning is a key part of what makes us human, the researchers concluded. Social psychologist Jennifer Aaker studies happiness and meaningfulness in life."
596,msmarco,_doc,MARCO_1253698,4.9772744,"AGE Scans Main Street, Stanford KY. AGE Engineering Services provides rich 3D scan data for the Bluebird in Stanford, KY. AGE is continuing to utilize ground breaking technology to capture massive amounts of high quality survey data with our new ground based scanner. Click either of the photos above to view the 3d scan in Google Chrome."
597,msmarco,_doc,MARCO_1100658,4.9772744,"Quick definition: visual rhetoric is a form of communication that uses images to create meaning or construct an argument. Here's an example: Many prospective college students visit university websites when trying to decide on a shortlist of colleges that they will apply to.ou may have visited the Stanford website for this very reason, probably looking at the Introduction to Stanford created for prospective students. This in itself is a deftly crafted piece of visual rhetoric."
598,msmarco,_doc,MARCO_3519643,4.9772744,"Synopsis. Dr. Sally Ride studied at Stanford University before beating out 1,000 other applicants for a spot in NASA's astronaut program. After rigorous training, Ride joined the Challenger shuttle mission on June 18, 1983, and became the first American woman in space. Born on May 26, 1951, Sally Ride grew up in Los Angeles and went to Stanford University, where she was a double major in physics and English."
599,msmarco,_doc,MARCO_4247082,4.9772744,"Sally Stanford Ranch - Sausalito Cottage Cottage, 2 bedroom, 1 bath. The Sausalito Cottage is located one hour north of San Francisco nestled on a 20 acre private ranch off of Scenic Hwy 12 in Kenwood, CA. Our late Aunt, Sally Stanford, purchased the ranch in 1961 as a quiet retreat from the hustle and bustle of San Francisco."
600,msmarco,_doc,MARCO_5093215,4.9772744,Interpreting IQ Test Results. Average scores for the Wechsler and Stanford-Binet tests are between 90 and 110. A score below 70 indicates mental retardation. Those who score over 165 are considered geniuses.nterpreting IQ Test Results. Average scores for the Wechsler and Stanford-Binet tests are between 90 and 110. A score below 70 indicates mental retardation. Those who score over 165 are considered geniuses.
601,msmarco,_doc,MARCO_5908354,4.9772744,"Colleges/universities with over 2000 students nearest to Palo Alto: 1  Stanford University (about 3 miles; Stanford, CA; Full-time enrollment: 14,410) 2  Foothill College (about 5 miles; Los Altos Hills, CA; FT enrollment: 9,635) 3  Canada College (about 8 miles; Redwood City, CA; FT enrollment: 3,446)"
602,msmarco,_doc,MARCO_6172741,4.9772744,"According to Stanford University, the average sleep requirement for college students is well over eight hours, and the majority of students would fall within the range of this value plus or minus one hour..Unfortunately, not everyone has that much time to dedicate to sleep on a consistent nightly basis.ccording to Stanford University, the average sleep requirement for college students is well over eight hours, and the majority of students would fall within the range of this value plus or minus one hour.."
603,msmarco,_doc,MARCO_6696411,4.9772744,"Birth, Residence, and Family. Born July 23, 1936 in Sacramento, California. Married Mary Davis, June 29, 1963; Children: Justin Anthony, Gregory Davis, and Kristin Marie. Stanford University, 1954-57; London School of Economics, 1957-58; Stanford University, B.A., 1958; Harvard Law School, LL.B., 1961."
604,msmarco,_doc,MARCO_6274874,4.9772744,Use the following school codes to ensure proper delivery of your official test scores. 1  GMAT — Instruct Pearson VUE to send scores directly to the “Stanford MBA Program” (school code L9R-KW-09). 2  GRE — Instruct ETS to send your scores directly to “Stanford University” (school code 4704).
605,msmarco,_doc,MARCO_7996014,4.9772744,"STANFORD, Calif. (AP) — Stanford hired University of Alabama at Birmingham coach Jerod Haase as its new basketball coach Friday, a week and a half after firing eighth-year coach Johnny Dawkins. Athletic director Bernard Muir is determined to return the Cardinal to being a regular NCAA Tournament contender as the program was under longtime coach Mike Montgomery over nearly two decades."
