,_index,_type,_id,_score,_source.body
0,msmarco,_doc,MARCO_4247682,9.807889,"1 Quiet Rage: The Stanford Prison Experiment (1992), is a documentary about the experiment, made available via the Stanford Prison Experiment website. 2  The documentary was written by Zimbardo and directed and produced by Ken Musen. The Experiment (2010), is a film released by Inferno Distribution which is an English-language remake of the 2001 film Das Experiment. 2  Prison School (first published February 7, 2011) is a Japanese serialized manga that heavily references the Stanford Prison Experiment as the inspiration for Kate's revenge plot."
1,msmarco,_doc,MARCO_6311069,9.675688,"The Real Lesson of the Stanford Prison Experiment. A scene from “The Stanford Prison Experiment,” a new movie inspired by the famous but widely misunderstood study.Credit PHOTOGRAPH COURTESY SPENCER SHWETZ/SUNDANCE INSTITUTE. On the morning of August 17, 1971, nine young men in the Palo Alto area received visits from local police officers.he Stanford Prison Experiment is cited as evidence of the atavistic impulses that lurk within us all; it’s said to show that, with a little nudge, we could all become tyrants. And yet the lessons of the Stanford Prison Experiment aren’t so clear-cut. From the beginning, the study has been haunted by ambiguity."
2,msmarco,_doc,MARCO_4247674,9.62401,"The Stanford prison experiment (SPE) was a study of the psychological effects of becoming a prisoner or prison guard. The experiment was conducted at Stanford University on August 14–20, 1971, by a team of researchers led by psychology professor Philip Zimbardo. The Experiment (2010), is a film released by Inferno Distribution which is an English-language remake of the 2001 film Das Experiment. 2  Prison School (first published February 7, 2011) is a Japanese serialized manga that heavily references the Stanford Prison Experiment as the inspiration for Kate's revenge plot."
3,msmarco,_doc,MARCO_4768625,9.462393,"The Implications of the Stanford Prison Experiment - The Implications of the Stanford Prison Experiment In 1971 Dr Philip Zimbardo conducted an experiment in the basement of Stanford University. This involved imprisoning nine volunteers in a mock up of Stanford prison, which was policed by nine guards (more volunteers)."
4,msmarco,_doc,MARCO_6311064,9.415605,"The Stanford prison experiment (SPE) was a study of the psychological effects of becoming a prisoner or prison guard. The experiment was conducted at Stanford University on August 14–20, 1971, by a team of researchers led by psychology professor Philip Zimbardo.sychologists Alex Haslam and Steve Reicher conducted the BBC Prison Study in 2002 and was published in 2006. This was a partial replication of the Stanford prison experiment conducted with the assistance of the BBC, which broadcast events in the study in a documentary series called The Experiment."
5,msmarco,_doc,MARCO_4247681,9.220757,"The Stanford prison experiment was in part a response to the Milgram experiment at Yale beginning in 1961 and published in 1963. The Third Wave was a 1967 recreation of Nazi Party dynamics by high school teacher Ron Jones in Palo Alto, California. The Experiment (2010), is a film released by Inferno Distribution which is an English-language remake of the 2001 film Das Experiment. 2  Prison School (first published February 7, 2011) is a Japanese serialized manga that heavily references the Stanford Prison Experiment as the inspiration for Kate's revenge plot."
6,msmarco,_doc,MARCO_1055289,9.16999,"A study of prisoners and guards in a simulated prison. Naval Research Review, 30, 4-17. Further Information Zimbardo Zimbardo Prison Experiment Stanford Prison Simulation The Stanford Prison Experiment How to cite this article: McLeod, S. A. (2008). Zimbardo-Stanford Prison Experiment."
7,msmarco,_doc,MARCO_6311073,9.129662,"They were willing participants in the Stanford Prison Experiment, one of the most controversial studies in the history of social psychology. (It’s the subject of a new film of the same name—a drama, not a documentary—starring Billy Crudup, of “Almost Famous,” as the lead investigator, Philip Zimbardo.he Stanford Prison Experiment is cited as evidence of the atavistic impulses that lurk within us all; it’s said to show that, with a little nudge, we could all become tyrants. And yet the lessons of the Stanford Prison Experiment aren’t so clear-cut. From the beginning, the study has been haunted by ambiguity."
8,msmarco,_doc,MARCO_4768629,9.056648,"Reviewing Zimbardo’s Experiment - “The Stanford Prison Experiment” by Philip G. Zimbardo was written to explain the results of the Stanford prison experiment. Zimbardo while trying to gain support for his conclusions of the experiment, demonstrated many errors in his writing, and in his own experiment."
9,msmarco,_doc,MARCO_4247677,9.027647,"Report Abuse. The Stanford prison experiment was a study of the psychological effects of becoming a prisoner or prison guard. The experiment was conducted in 1971 by a team of researchers led by psychologist Philip Zimbardo at Stanford University. have recently been learning about the famous prison experiment by Phillip Zimbardo and although I understand everything that happened, I am slightly unsure as to what the actual purpose of the experiment was. Could somebody please help let me know. Add your answer. Source."
10,msmarco,_doc,MARCO_4247676,9.025576,The Stanford Prison Experiment (SPE) took place in 1971. Young men were divided into the roles of Prisoner and Guard and put in a prison-like environment in the basement of the Psychology Department at Stanford University. The study was meant to last two weeks.he Stanford Prison Experiment (SPE) took place in 1971. Young men were divided into the roles of Prisoner and Guard and put in a prison-like environment in the basement of the Psychology Department at Stanford University. The study was meant to last two weeks.
11,msmarco,_doc,MARCO_6311067,9.008545,"The Stanford prison experiment was in part a response to the Milgram experiment at Yale beginning in 1961 and published in 1963. The Third Wave was a 1967 recreation of Nazi Party dynamics by high school teacher Ron Jones in Palo Alto, California.sychologists Alex Haslam and Steve Reicher conducted the BBC Prison Study in 2002 and was published in 2006. This was a partial replication of the Stanford prison experiment conducted with the assistance of the BBC, which broadcast events in the study in a documentary series called The Experiment."
12,msmarco,_doc,MARCO_6311066,8.991581,"A study of prisoners and guards in a simulated prison. Naval Research Review, 30, 4-17. Further Information Zimbardo Zimbardo Prison Experiment Stanford Prison Simulation The Stanford Prison Experiment How to cite this article: McLeod, S. A. (2008). Zimbardo-Stanford Prison Experiment.by Saul McLeod published 2008. Aim: To investigate how readily people would conform to the roles of guard and prisoner in a role-playing exercise that simulated prison life.hen they were blindfolded and driven to the psychology department of Stanford University, where Zimbardo had had the basement set out as a prison, with barred doors and windows, bare walls and small cells. Here the deindividuation process began."
13,msmarco,_doc,MARCO_4975326,8.78623,"Quiet Rage: The Stanford Prison Experiment (1992), is a documentary about the experiment, made available via the Stanford Prison Experiment website. The documentary was written by Zimbardo and directed and produced by Ken Musen."
14,msmarco,_doc,MARCO_4247680,8.758991,"The Stanford Prison Experiment (SPE) by Phil Zimbardo has been for me an example of the astonishing things that we humans are capable of.I guess as an example of human gullibility, I had not been skeptical about the experiment, which lacks quite a few scientific markers (aside from its ethical problems).he Stanford Prison Experiment (SPE) by Phil Zimbardo has been for me an example of the astonishing things that we humans are capable of."
15,msmarco,_doc,MARCO_6311065,8.751277,"The Stanford Prison Experiment was conducted by Professor Philip Zimbardo at Stanford University in 1971 and was designed to explore the psychological impact of the prison environment on prisoners and prison guards.ut despite overwhelming evidence pointing to the immorality of the experiment, it was not until Zimbardo’s girlfriend of the time, graduate student Christine Maslach, expressed concerns about the conditions inside the prison that the experiment was aborted."
16,msmarco,_doc,MARCO_4247678,8.712511,"A study of prisoners and guards in a simulated prison. Naval Research Review, 30, 4-17. Further Information Zimbardo Zimbardo Prison Experiment Stanford Prison Simulation The Stanford Prison Experiment How to cite this article: McLeod, S. A. (2008). Zimbardo-Stanford Prison Experiment.by Saul McLeod published 2008. Aim: To investigate how readily people would conform to the roles of guard and prisoner in a role-playing exercise that simulated prison life.imbardo (1973) was interested in finding out whether the brutality reported among guards in American prisons was due to the sadistic personalities of the guards (i.e. dispositional) or had more to do with the prison environment (i.e. situational)."
17,msmarco,_doc,MARCO_3111378,8.553246,"Social psychology conducts its experiments both inside and outside of the laboratory. One notable social psychology experiment is the Stanford prison experiment conducted by Philip Zimbardo in 1971, although the extremity of this field experiment is not prototypical of the field.Another notable study is the Stanley Milgram obedience experiment, often known as the Milgram experiment.n the latter half of the 20th century, the phrase experimental psychology had shifted in meaning due to the expansion of psychology as a discipline and the growth in the size and number of its sub-disciplines."
18,msmarco,_doc,MARCO_7288734,8.391764,"Plaque Dedicated to the Location of the Stanford Prison Experiment The Stanford prison experiment ( SPE ) was an attempt to investigate the psychological effects of perceived power, focusing on the struggle between prisoners and prison officers ."
19,msmarco,_doc,MARCO_16325,8.366215,"Social psychologists use experimental methods, both within and outside the laboratory, in an attempt to understand human social interaction. Two widely cited experiments in social psychology experiment are the Stanford prison experiment conducted by Philip Zimbardo in 1971 and the Milgram obedience experiment by Stanley Milgram."
20,msmarco,_doc,MARCO_7288729,8.362331,"In an October 2008 episode of the NBC television show Life, Detectives Crews and Reese investigated a murder that took place at a prison experiment loosely modeled on the Stanford Prison Experiment. The 2010 film The Experiment is an English-language remake of the 2001 film Das Experiment."
21,msmarco,_doc,MARCO_6311068,8.299319,"Jake’s post includes the five videos (about 50 minutes total) and some background on the experiment and Dr. Zimbardo, whom Jake was once a TA for back at Stanford. In the experiment, students were randomly divided into “guards” and “prisoners” and forced to work or live in a makeshift prison for two weeks.The participants adopted their respective roles so easily, with such shocking and destructive outcomes, that the experiment was halted over one week early.hen a scandal like Abu Ghraib occurs, a natural reaction is to point fingers and blame the individual, assuring ourselves that this is just the work of a few bad seeds. The Prison Experiment clearly demonstrates, however, that it isn’t something unique to the abusive guard that makes him so."
22,msmarco,_doc,MARCO_1508161,8.0705185,Outline a research study of deindividuation (5) - Zimbardo Stanford prison experiment. - In this study Zimbardo was investigating the role of anonymity and dehumanisation in deindividuation. - Zimbardo carried out the experiment by creating a prison role play assigning guards and prisoners. - The experiment stopped after just six days due to guards treating prisoners in a brutal manner.
23,msmarco,_doc,MARCO_5214178,8.0589695,"Elephant toothpaste reaction Elephant's toothpaste is a foamy substance caused by the rapid decomposition of hydrogen peroxide by using potassium iodide as a catalyst. How rapidly the reaction proceeds will depend on the concentration of hydrogen peroxide. Because it requires only a small number of ingredients and makes a volcano of foam, this is a popular experiment for children to perform in school or at parties; the experiment is also known as the marshmallow experiment, but is unrelated to the psychological Stanford"
24,msmarco,_doc,MARCO_4247683,8.051307,"Zimbardo and his team set out to test the idea that the inherent personality traits of prisoners and guards were key to understanding abusive prison situations. The Stanford experiment ended on August 20, 1971, only 6 days after it began instead of the 14 it was supposed to have lasted. have recently been learning about the famous prison experiment by Phillip Zimbardo and although I understand everything that happened, I am slightly unsure as to what the actual purpose of the experiment was. Could somebody please help let me know. Add your answer. Source."
25,msmarco,_doc,MARCO_3242718,7.738756,"Zimbardo's Career and Research. Philip Zimbardo is perhaps best known for the Stanford Prison Experiment, conducted in the basement of the Stanford University psychology department in 1971."
26,msmarco,_doc,MARCO_3111774,7.7367907,"This six-year project proved Stanford's hypothesis, and incidentally, a bet Stanford had wagered to that effect .This incident prompted Muybridges to take to the lecture circuit with a film of his experiment.."
27,msmarco,_doc,MARCO_5302985,7.734827,The Stanford Prison Experiment was conducted by Professor Philip Zimbardo at Stanford University in 1971 and was designed to explore the psychological impact of the prison environment on prisoners and prison guards.
28,msmarco,_doc,MARCO_7288732,7.7172403,"The Stanford prison experiment was an attempt to investigate the psychological effects of perceived power, focusing on the struggle between prisoners and prison officers. It was conducted at Stanford University between August 14–20, 1971, by a research group led by psychology professor Philip Zimbardo using ..."
29,msmarco,_doc,MARCO_5302987,7.7150407,"I recently was asked to give a lecture on the Stanford Prison Experiment to an undergraduate course, so I read a bit more on it. The experiment is typically used to demonstrate the power of the situation."
30,msmarco,_doc,MARCO_7288730,7.7094736,"The Stanford prison experiment (SPE) was an attempt to investigate the psychological effects of perceived power, focusing on the struggle between prisoners and prison officers. It was conducted at Stanford University between August 14–20, 1971, by a research group led by psychology professor Philip Zimbardo using college students. [1]"
31,msmarco,_doc,MARCO_3192208,7.703264,"Forty years ago today, the Stanford Prison Experiment began — arguably history’s most notorious and controversial psychology experiment, which gleaned powerful and unsettling insights into human nature."
32,msmarco,_doc,MARCO_4696038,7.699354,"A gruelling yet compelling watch, what makes Das Experiment even more powerful, is the fact that it is based on actual events. Known as the Stanford Prison Experiment, this was concocted as a study of the psychological ramifications of becoming a prisoner or guard. 24. Kill List."
33,msmarco,_doc,MARCO_3367206,7.6935034,"Experiment Details: In 1977, a social psychology professor at Stanford University named Lee Ross conducted an experiment that, in lay terms, focuses on how people can incorrectly conclude that others think the same way they do, or form a “false consensus” about the beliefs and preferences of others."
34,msmarco,_doc,MARCO_6990447,7.6935034,"Another very famous psychological experiment on humans was so-called Stanford Prison Experiment, which was conducted in 1971 by the American psychologist Philip Zimbardo and was a study of a human response to restrictions of freedom in terms of prison life and an influence of a person’s social role."
35,msmarco,_doc,MARCO_5160655,7.6787033,"Eadweard Muybridge. Known as the 'father of the motion picture', Eadweard Muybridge's early photographic experiments laid the foundation for modern cinema, with his study, The Horse In Motion (1882), regarded by many as the first ever moving picture. capable and successful commercial photographer, Eadweard began to consider rapid motion photography in 1872 when approached by Californian racehorse owner, Leland Stanford. Stanford had reputedly laid a wager on the contentious issue of whether a galloping horse was ever airborne."
36,msmarco,_doc,MARCO_5302981,7.052215,Right from the start of the Stanford Prison Experiment there were ethical issues at stake. The participants were not given all the facts about what exactly they were signing and consent forms were not properly completed.
37,msmarco,_doc,MARCO_3192207,7.044364,"Hypothesis. Philip Zimbardo, the head of the Stanford prison experiment research team, hypothesized that inherent personality traits are primarily responsible for abusive behavior that takes place prison environments."
38,msmarco,_doc,MARCO_8470192,7.042406,Situational and dispositional factors-lesson 1. Based on preexisting knowledge of Milgram's obedience study and Zimbardo's Stanford Prison Experiment. I am trying to expose them to some of the ideas and then have them reach an understanding of social psychology.
39,msmarco,_doc,MARCO_1055288,7.04045,"Zimbardo (1973) had intended that the experiment should run for a fortnight, but on the sixth day it was terminated. Christina Maslach, a recent Stanford Ph.D. brought in to conduct interviews with the guards and prisoners, strongly objected when she saw the prisoners being abused by the guards."
40,msmarco,_doc,MARCO_2574155,7.038496,"We’re just now starting to scientifically distinguish heroism from these other concepts and zero in on what makes a hero. My work on heroism follows 35 years of research in which I studied the psychology of evil, including my work on the infamous Stanford Prison Experiment."
41,msmarco,_doc,MARCO_3503327,7.036544,"Philip Zimbardo, a Stanford psychologist, reported in 1969 on some experiments testing the broken-window theory. He arranged to have an automobile without license plates parked with its hood up on a street in the Bronx and a comparable automobile on a street in Palo Alto, California."
42,msmarco,_doc,MARCO_4768627,7.036544,"From the Stanford prison experiment, I found it very interesting to know that how easy humans can turn evil because they are given the power. It shows the human sinful nature. The lesson that I learnt is Power tends to corrupt. We think that if we are given the power, we are in control of everything."
43,msmarco,_doc,MARCO_2033983,7.0345936,What we know from the Stanford Prison Experiment is there are a set of social psychological variables that can make ordinary people do things they never could imagine doing. – Dr. Philip Zimbardo It’s pretty obvious that people behave differently […]. Read more.
44,msmarco,_doc,MARCO_4975328,7.0345936,"He became known for his 1971 Stanford prison experiment and has since authored various introductory psychology books, textbooks for college students, and other notable works, including The Lucifer Effect, The Time Paradox and The Time Cure. He is also the founder and president of the Heroic Imagination Project."
45,msmarco,_doc,MARCO_4975327,7.0345936,"Philip Zimbardo. Philip Zimbardo was the leader of the notorious 1971 Stanford Prison Experiment — and an expert witness at Abu Ghraib. His book The Lucifer Effect explores the nature of evil; now, in his new work, he studies the nature of heroism."
46,msmarco,_doc,MARCO_2300639,7.032645,"After confirming the reality using objects hidden in envelopes and identifying physical characteristics at locations a few hundred kilometres away, a participant in the study at Stanford by the name of Ingo Swann (2) suggested carrying out an experiment to remote view the planet Jupiter(2)."
47,msmarco,_doc,MARCO_3242719,7.032645,Philip Zimbardo Biography. Psychology. Philip Zimbardo is an influential psychologist best-known for his 1971 Stanford prison experiment. Many psychology students may also be familiar with his psychology textbooks and the Discovering Psychology video series often used in high school and psychology classrooms.
48,msmarco,_doc,MARCO_4768630,7.032645,"The Stanford Prison Experiment inspired me the first time I read about it. At the time, I was in my early 20s, beginning a lengthy term inside the United States Penitentiary in Atlanta. By then I had made a commitment to reconcile with society for the bad decisions I made as a young man. I sold cocaine."
49,msmarco,_doc,MARCO_4768626,7.028754,"The son of a Stanford engineering professor, Eshelman was a student at Chapman University at the time of the experiment. He was the prison's most abusive guard, patterning himself after the sadistic prison warden (portrayed by Strother Martin) in the movie Cool Hand Luke. Today he owns a mortgage business in Saratoga."
50,msmarco,_doc,MARCO_7764806,7.028754,"Print Page. Studying effectively is not a matter of chance. Educators and psychologists have researched study methods for years. Some of the best studies come from the top universities: Stanford, Indiana, and Chicago where precise experiments with student groups have shed light on the most effective study methods."
51,msmarco,_doc,MARCO_4975325,7.0268116,"Philip Zimbardo. Philip Zimbardo's largest contribution to the field of psychology was to the area of social psychology. He is most famous for his 1971 Stanford Prison Experiment which showed the dramatic consequences of putting normal, healthy students in a mock prison. Philip was the first member of his family to attend college."
52,msmarco,_doc,MARCO_4975323,7.024871,"Philip Zimbardo knows evil inside and out. He led the infamous Stanford Prison Experiment of 1971 and was an expert witness at Abu Ghraib, privy to graphic unseen images. At TED2008, Zimbardo explains how easy it is for the good to turn evil, and on the flip side, for inspiration to lead people to heroism."
53,msmarco,_doc,MARCO_7764808,7.024871,"Ten Study Methods That Work. Studying effectively is not a matter of chance. Educators and psychologists have researched study methods for years. Some of the best studies come from the top universities: Stanford, Indiana, and Chicago where precise experiments with student groups have shed light on the most effective study methods."
54,msmarco,_doc,MARCO_2081054,7.0190597,"Bobo Doll Experiment. Bandura (1961) conducted a study to investigate if social behaviors (i.e. aggression) can be acquired by observation and imitation. Sample. Bandura, Ross and Ross (1961) tested 36 boys and 36 girls from the Stanford University Nursery School aged between 3 to 6 years old."
55,msmarco,_doc,MARCO_6376161,7.0190597,"If you’re not up to date on your Snapchat trivia, now is the time: 1  Snapchat’s co-founders Evan Spiegel and Bobby Murphy first worked together while attending Stanford University on a website for students called Future Freshman in 2010. Spiegel told the Palisadian Post in August 2013: “We would experiment and fail."
56,msmarco,_doc,MARCO_3391895,7.0171266,Behavioral Psychology; Biological Psychology; Body Language Interpretation; Cognitive Psychology; Developmental Psychology; Dream Interpretation; Freudian Psychology; Memory & Memory Techniques; Role Playing: Stanford Prison Experiment; Authoritarian Personality; Memory: Levels of Processing; Cold Reading: Psychology of Fortune Telling; Stages of Sleep
57,msmarco,_doc,MARCO_3391892,7.015195,Biological Psychology; Body Language Interpretation; Cognitive Psychology; Developmental Psychology; Dream Interpretation; Freudian Psychology; Memory & Memory Techniques; Role Playing: Stanford Prison Experiment; Authoritarian Personality; Memory: Levels of Processing; Cold Reading: Psychology of Fortune Telling; Stages of Sleep; Personality Psychology; Why Do We Forget?
58,msmarco,_doc,MARCO_5302988,7.0113378,"Interpersonal dynamics in a simulated prison. International Journal of Criminology & Penology, 1(1), 69-97. Zimbardo, P. G. (1973). On the ethics of intervention in human psychological research: With special reference to the Stanford prison experiment. Cognition, 2(2), 243-256. doi: 10.1016/0010-0277(72)90014-5."
59,msmarco,_doc,MARCO_4827676,7.007488,"By that definition, then, altruism is heroism light—it doesn’t always involve a serious risk. Compassion is a virtue that may lead to heroism, but we don’t know that it does. We’re just now starting to scientifically distinguish heroism from these other concepts and zero in on what makes a hero. My work on heroism follows 35 years of research in which I studied the psychology of evil, including my work on the infamous Stanford Prison Experiment."
60,msmarco,_doc,MARCO_6265678,6.9807444,"Harry Frederick Harlow (October 31, 1905 – December 6, 1981) was an American psychologist best known for his maternal-separation, dependency needs, and social isolation experiments on rhesus monkeys, which manifested the importance of caregiving and companionship in social and cognitive development.r. Harry Harlow came to the University of Wisconsin-Madison in 1930 after obtaining his doctorate under the guidance of several distinguished researchers, including Calvin Stone and Lewis Terman, at Stanford University. Dr. Harlow began his career with nonhuman primate research."
