,_index,_type,_id,_score,_source.body
237,msmarco,_doc,MARCO_1137543,5.357713,"This adapted test, first published in 1916, was called the Stanford-Binet Intelligence Scale and soon became the standard intelligence test used in the U.S. The Stanford-Binet intelligence test used a single number, known as the intelligence quotient (or IQ), to represent an individual's score on the test. This score was calculated by dividing the test taker's mental age by their chronological age, and then multiplying this number by 100. For example, a child with a mental age of 12 and a chronological age of 10 would have an IQ of 120 (12 /10 x 100). The Stanford-Binet remains a popular assessment tool today, despite going through a number of revisions over the years since its inception."
238,msmarco,_doc,MARCO_3160571,5.357713,"Stanford linguists seek to identify the elusive California accent. With the Voices of California project, Stanford linguistics professors and students aim to discover and document the diversity of California English. By Ed King.The Humanities at Stanford. Brandon Conlan of Redding, Calif., doesn't think he has an accent. A trip to Florida a few years ago confirmed his opinion.Friends there said he had the standard TV accent, which to them meant that he didn't have a distinguishable way of speaking.randon Conlan of Redding, Calif., doesn't think he has an accent. A trip to Florida a few years ago confirmed his opinion. Friends there said he had the standard TV accent, which to them meant that he didn't have a distinguishable way of speaking."
239,msmarco,_doc,MARCO_6240780,5.357713,"Tuition for Stanford University is $44,184 for the 2014/2015 academic year. This is 75% more expensive than the national average private non-profit four year college tuition of $25,229.Stanford University is one of the 100 most expensive colleges in the America, coming in 94th on our Expensive 100 Ranking.ell Grants and other Grant Aid. 53% of Stanford University students received grant aid in 2013/2014. The average total aid amount was $39,299. 14 percent of students received aid in the form of Pell Grants from the U.S. Federal Government. The average Pell Grant awarded for 2013/2014 was $4,214."
240,msmarco,_doc,MARCO_6240789,5.357713,"Tuition (based on 8 unit enrollment). $7,856 Students must enroll in a minimum of 3 units. All international students with a Stanford-sponsored I-20 must enroll in a minimum of 8 units. See the Tuition by Units Chart below for a full breakdown of unit costs.$9,570. Document Fee. $100 One-time mandatory fee charged to all students (except students who are returning to Stanford and have previously paid the Document Fee).ee the Tuition by Units Chart below for a full breakdown of unit costs. $9,570. Document Fee. $100 One-time mandatory fee charged to all students (except students who are returning to Stanford and have previously paid the Document Fee)."
241,msmarco,_doc,MARCO_7996200,5.3427877,"Latest news from Stanford, CA collected exclusively by city-data.com from local newspapers, TV, and radio stations. Ancestries: European (2.8%), Russian (2.8%), German (2.3%), Italian (1.9%), Polish (1.9%), Irish (1.7%). Current Local Time: PST time zone. Elevation: 95 feet. Land area: 2.75 square miles. Population density: 5,030 people per square mile (average). For population 25 years and over in Stanford: High school or higher: 99.3%; Bachelor's degree or higher: 95.0%; Graduate or professional degree: 59.7%; Unemployed: 14.1%; Mean travel time to work (commute): 13.8 minutes; For population 15 years and over in Stanford CDP: Never married: 80.1%; Now married: 18.5%"
242,msmarco,_doc,MARCO_4987899,5.3422966,Virginia Tobacco History | keywordslanding.net. Why was tobacco important to the ... The Clarksville Tobacco Market was so large and important that ... decided to experiment with cultivating tobacco in Jamestown.Lesson objectives are the first step ... understand why tobacco was such an important crop to the ...he Clarksville Tobacco Market was so large and important that ... decided to experiment with cultivating tobacco in Jamestown. Lesson objectives are the first step ... understand why tobacco was such an important crop to the ...
243,msmarco,_doc,MARCO_3861453,5.339091,"Smule is an American mobile app developer headquartered in San Francisco.The company specializes in developing social music-making applications for iOS, Android, and Amazon.com Kindle Fire. The company was founded in 2008 by Jeff Smith and Stanford assistant professor Ge Wang.Wang commented that the goal of the apps was to draw users in and by the time they realize they're making music, 'it's too late — they're already having fun.'. In December 2011, Smule acquired fellow music app developer Khush.On July 31, 2013, Wang stepped down from his role at Smule to return to Stanford full time.he company specializes in developing social music-making applications for iOS, Android, and Amazon.com Kindle Fire. The company was founded in 2008 by Jeff Smith and Stanford assistant professor Ge Wang."
244,msmarco,_doc,MARCO_4987895,5.332695,Jamestown was the first permanent English settlement in North America. It is America’s birthplace. Why was tobacco important to the ... The Clarksville Tobacco Market was so large and important that ...decided to experiment with cultivating tobacco in Jamestown.Lesson objectives are the first step ... understand why tobacco was such an important crop to the ...he Clarksville Tobacco Market was so large and important that ... decided to experiment with cultivating tobacco in Jamestown. Lesson objectives are the first step ... understand why tobacco was such an important crop to the ...
245,msmarco,_doc,MARCO_1601396,5.2570977,Section 1 Development of the Atomic Theory Key Concept Scientists have done experiments that have revealed important clues about the structure of atoms.What You Will Learn • There have been different models of the atom over time.• The atomic theory has changed as scientists have experimented and dis covered new information about the atom. Why It Matters Scientific ideas change as new data are gathered.This is an important characteristic of science.hat You Will Learn • There have been different models of the atom over time. • The atomic theory has changed as scientists have experimented and dis covered new information about the atom. Why It Matters Scientific ideas change as new data are gathered. This is an important characteristic of science.
246,msmarco,_doc,MARCO_4848864,5.247075,"Six sites along the LHC's circumference gather data for different experiments. Some of these experiments overlap, and scientists will be trying to be the first to uncover important new information. The purpose of the Large Hadron Collider is to increase our knowledge about the universe.While the discoveries scientists will make could lead to practical applications down the road, that's not the reason hundreds of scientists and engineers built the LHC. It's a machine built to further our understanding.ix sites along the LHC's circumference gather data for different experiments. Some of these experiments overlap, and scientists will be trying to be the first to uncover important new information. The purpose of the Large Hadron Collider is to increase our knowledge about the universe."
247,msmarco,_doc,MARCO_846633,5.2088494,"Two Parts: Completing the Pre-Experiment Part of the Lab Write Up Completing the Post-Experiment Part of the Lab Write Up. A lab write up is a clear, detailed outline of your experiment. It is used to describe and analyze the procedures followed and data collected.It contains many important elements, such as a hypothesis, materials lists, and raw data, and follows a specific format.Ad.his takes you through a step by step procedure of the lab. Once again, this allows someone to replicate your experiment. Make sure to outline any precautions that should be taken when performing the experiment. 1  Detail all variables in the experiment."
248,msmarco,_doc,MARCO_6168821,5.139723,"One of 2 errors. (a) errors from the experimenter, (b) the bias from effects of the participants. See experimenter bias-experimenter expectancy effect. EXPERIMENTER EFFECT: The experimenter effect deals with errors in experiments.. No related posts.a) errors from the experimenter, (b) the bias from effects of the participants. See experimenter bias-experimenter expectancy effect. EXPERIMENTER EFFECT: The experimenter effect deals with errors in experiments.. No related posts."
249,msmarco,_doc,MARCO_6416039,5.1225963,Thunderstorm Experiment: Here is a great experiment that shows kids how our weather works. It teaches them how thunderstorms are formed! Lightning Experiment: Here is a great experiment that allows kids to make lightning in their mouth.It's a great way for them to understand how lightning works. Lightning Experiment: Here is a great experiment that allows the kids to make lightning.All you need is a balloon and a light bulb! Lightning Experiment: Here is another great experiment that allows the kids to make lightning.ightning Experiment: Here is a great experiment that allows the kids to make lightning. All you need is a balloon and a light bulb! Lightning Experiment: Here is another great experiment that allows the kids to make lightning.
250,msmarco,_doc,MARCO_3303050,5.1207404,"The most important criterion for admission to a Stanford Engineering graduate program is merit -- superior academic achievement and the potential to make a contribution to technology, business or society as a whole."
251,msmarco,_doc,MARCO_6796338,5.116811,"Yes, you will have to take EOC tests for those classes, but the more the merrier! If your school only offers a few, take them. This is important because Stanford weighs certain classes against others. The more AP classes you have -- and if you get good grades in them -- the more impressive your application will be."
252,msmarco,_doc,MARCO_1875250,5.114849,"STANFORD -- When someone close to us dies, we've been told, it's important to let our feelings out. If you bottle up your emotions, your grief will spill out later as severe depression, according to Freud and a host of more recent authors on coping with death."
253,msmarco,_doc,MARCO_3144748,5.110931,"Each school has different requirements for standardized testing. Most schools require the SAT or ACT, and many also require SAT subject tests. You must take either the SAT or ACT to submit an application to Stanford. More importantly, you need to do well to have a strong application."
254,msmarco,_doc,MARCO_6961092,5.108975,"This was the most important of many groups opposed to the imperialist actions of the United States under McKinley. This group was composed of a variety of prominent people to include the presidents of Stanford and Harvard universities, philosophers, writers, industrial giants and labor leaders."
255,msmarco,_doc,MARCO_1365740,5.1050687,"In general, your child’s GPA is the most important factor when applying to college. Your child cannot get into a Harvard, Stanford, or Yale with a 2.0 unweighted GPA. But your child’s GPA is also just the baseline. Every student applying to competitive universities already has a high GPA."
256,msmarco,_doc,MARCO_6909484,5.1050687,"It is important to note that while people often talk about average, low and genius IQs, there is no single IQ test. Many different tests are in use today including the Stanford-Binet, the Wechsler Adult Intelligence Scale and the Woodcock-Johnson Tests of Cognitive Abilities."
257,msmarco,_doc,MARCO_2307996,5.104024,Experiments are vital to the advancement of science. One important type of experiment is known as the true experiment. A true experiment is one in which the experimenter has worked to control all of the variables except the one that is being studied.
258,msmarco,_doc,MARCO_6820791,5.1031184,"What's Hot! Bill Burnett and Dave Evans. Burnett is the executive director of the Design Program at Stanford University, and Evans is an adjunct lecturer there, and their thinking has contributed to the creation of the Apple mouse, the laptop computer, and more. Now they apply their experience to something else important: your life."
259,msmarco,_doc,MARCO_6987890,5.1031184,"Folic acid works during the early stages of pregnancy, so that's why it's important to make sure you're getting enough folic acid even before you get pregnant. Do this the cycle before you start trying, says Paula Hillard, MD, a professor of obstetrics and gynecology at Stanford University."
260,msmarco,_doc,MARCO_8621707,5.1031184,"It is important to note that this is the observed total, and the actual total of kills that includes hunts at which no human observer was present may be one-third greater. During this time the chimpanzees may have killed more than 10 % of the entire colobus population within their hunting range (Stanford et al. 1994)."
261,msmarco,_doc,MARCO_7471758,5.0933957,"First, it is important to understand what an assault weapon isn't. The terms assault weapon and assault rifle are often confused. According to Bruce H. Kobayashi and Joseph E. Olson, writing in the Stanford Law and Policy Review: Prior to 1989, the term assault weapon did not exist in the lexicon of firearms."
262,msmarco,_doc,MARCO_6796343,5.087585,"If you want to get in, the first thing to look at is the acceptance rate. This tells you how competitive the school is and how serious their requirements are. The acceptance rate at Stanford is 6%. For every 100 applicants, only 6 are admitted. This means the school is extremely selective. Meeting their GPA requirements and SAT/ACT requirements is very important to getting past their first round of filters and proving your academic preparation."
263,msmarco,_doc,MARCO_7196229,5.087585,"As the person leading the financial aid program for Stanford, she noted that the Profile does a better job than the FAFSA of assessing a family’s true financial strength, and it was important for College Board to make the move, like the FAFSA, to give students concrete aid information as part of the admissions process earlier than the current format does."
264,msmarco,_doc,MARCO_4674078,5.085652,"Modeling Signal Attenuation in IEEE 802.11 Wireless LANs - Vol. 1 Daniel B. Faria dbfaria@cs.stanford.edu Computer Science Department Stanford University Abstract Path loss models are used to approximate signal atten-uation as a function of the distance between transmit-ters and receivers, being an important building block"
265,msmarco,_doc,MARCO_7017738,5.085652,"The main types of tests (with very superior score in parentheses) are: Wechsler (130+) Stanford-Binet (145+) - this is the most widely used test. Woodcock-Johnson (131+) Anything below average (100) is considered the beginning stages of mentally challenged. One thing you should that is very important about any IQ test: when you take one, you will be give a raw score (what you actually scored on the test) but it doesn't mean much."
266,msmarco,_doc,MARCO_4818653,5.0837197,"Freedom Financial Network is a growing group of over 1200 employees – known internally as “The Freedom Family.” We’re energetic, smart & compassionate but--most importantly--we're all about helping our customers with meaningful financial solutions. Freedom was founded in 2002 by Stanford Business School graduates Andrew Housser and Brad Stroh."
267,msmarco,_doc,MARCO_2389734,5.079863,"Vital and indispensable, this HarperBusiness Essentials edition of The Intelligent Investor is the most important book you will ever read on how to reach your financial goals. frequent commentator on television and radio, Zweig is also a popular public speaker who has addressed the American Association of Individual Investors, the Aspen Institute, the CFA Institute, the Morningstar Investment Conference, and university audiences at Harvard, Stanford, and Oxford."
268,msmarco,_doc,MARCO_7127793,5.076013,"As the Stanford Faculty Senate begins a series of celebrations of the fiftieth anniversary of its founding, voting has begun for the 51st Senate. The Senate plays an important role in University governance, giving voice to faculty concerns regarding diverse aspects of academic life, including research, teaching, admissions, and hiring. It is a truly democratic body, with all Academic Council members eligible to vote, and to be elected."
269,msmarco,_doc,MARCO_4264927,5.068335,"SNCC redirects here. For other uses, see SNCC (disambiguation) . The Student Nonviolent Coordinating Committee (SNCC, often pronounced snick: /ˈsnɪk/) was one of the most important organizations of the American Civil Rights Movement in the 1960s. Interviews with civil rights workers from the Student Nonviolent Coordinating Committee (SNCC) . 2  Stanford University Project South oral history collection. 3  Microfilming Corp. of America. 4  1975."
270,msmarco,_doc,MARCO_2624740,5.0606875,"All Scores. The college wants you to send all your scores from every time you took the test (i.e., they don’t want you to use College Board’s Score Choice option). Important note: an “All scores” school may still superscore – the College Board doesn’t report this, but we do (see below). For example, Stanford superscores and requires that you send all your scores.But here’s their official policy: “Applicants must self-report and submit all SAT scores and all ACT scores."
271,msmarco,_doc,MARCO_315316,5.056874,"My guest today is Milton Friedman. Milton is a senior research fellow at Stanford University's Hoover Institution, the 1976 Nobel Laureate in Economics and a hero to millions in the United States and around the world for his insights and actions on behalf of economics and liberty.ilton Friedman: I think it had a great deal of effect. I think what was most important was a chapter in the Monetary History that dealt with the Great Depression. The difficulty of having people understand monetary theory is very simple—the central banks are good at press relations."
272,msmarco,_doc,MARCO_3177490,5.0530677,"The trick is to find the proper balance by not under or oversleeping. According to Stanford University, the average sleep requirement for college students is well over eight hours, and the majority of students would fall within the range of this value plus or minus one hour..Unfortunately, not everyone has that much time to dedicate to sleep on a consistent nightly basis.o one really needs to be sleeping more than 9 hours a night. It is important to find the proper balance of sleep because studies show that people who sleep 8 hours or more, or less than 6.5 hours, don't live as long as those who get between 6.5 and 7.5 a night."
273,msmarco,_doc,MARCO_4783528,5.0530677,"As with the other GMAT and MBA related posts on our blog, use this to build your own MBA costs calculator that cover all the important accounting heads from MBA tuition fees and the cost of living (which can vary substantially in India, USA, UK, Australia, Canada, Germany).n Indian GMAT based college, a European 1 year program and a full scale, 2 year course in the USA, albeit one of the pricier ones. No prizes for guessing, but think on the lines of ISB, INSEAD, Stanford, Stern, Columbia, Harvard and the likes."
274,msmarco,_doc,MARCO_5616738,5.0454783,"Basal forebrain cholinergic neurons (BFCNs) are a group of brain cells that are important for attention, learning and memory functions. BFCNs receive input from a protein produced in the hippocampus, called nerve growth factor (NGF).NGF plays a vital role in the well-being of BFCNs.e are happy to announce that the long awaited Down Syndrome Clinic at Stanford will open its doors on July 11th. The clinic is located in the Lucile Packard Children’s hospital. To make an appointment, please call the clinical coordinator at (650) 723-6858, extension 1."
275,msmarco,_doc,MARCO_1167394,5.0212007,"Absorption science is fun and easy to set up for kids! Water science experiments make great hands on play learning activities too! Quick water science experiments are perfect anytime! Another favorite water absorption science experiment uses a variety of household materials to teat absorption! Today we explored sponges for water absorption but also added in a little math too! 25 Classic Science Experiments are a must see. This quick and easy absorption science experiment is part of our A-Z STEM science for kids month. Science, technology, engineering, and math are so important for children to explore even at an early age!"
276,msmarco,_doc,MARCO_7285077,5.0075355,"Leland Stanford was a politician, industrialist and tycoon. He wasalso the founder of Stanford University."
277,msmarco,_doc,MARCO_4319040,5.006545,Stanford 125 Stanford is celebrating 125 years of impact in people's lives and around the world.
278,msmarco,_doc,MARCO_7996207,5.005555,"© Stanford University. Stanford, California 94305. Copyright Complaints Trademark Notice"
279,msmarco,_doc,MARCO_4510190,5.0045667,Stanford Facts and the Annual Report are published each year to provide current information and statistics about the university. You can also read about Stanford's history.
280,msmarco,_doc,MARCO_6281659,5.0045667,"The Apple Store is located in Stanford Shopping Center, at 379 Stanford Shopping Center in Palo Alto."
281,msmarco,_doc,MARCO_8382356,5.003579,"Apparently, she is already attending Stanford. And she is 19. Source: What is it like attending Stanford University with Jennifer Gates (Bill Gates' daughter)?"
282,msmarco,_doc,MARCO_4319034,5.0025926,Back-to-back champs. Stanford women's golf team scored a victory over USC in the 54-hole Stanford Intercollegiate.
283,msmarco,_doc,MARCO_4510194,5.0025926,Stanford University struggled financially after Leland Stanford's death in 1893 and again after much of the campus was damaged by the 1906 San Francisco earthquake.
284,msmarco,_doc,MARCO_7287773,5.0025926,"Stanford, LLC, Fredericksburg, Virginia. 151 likes. Stanford recognizes that the most complex thing to organize in business is simplicity. Our task has..."
285,msmarco,_doc,MARCO_2745257,5.0016065,Stanford Children's Health. Stanford Children’s Health is the only network in the area—and one of the few in the country—exclusively dedicated to pediatric and obstetric care.
286,msmarco,_doc,MARCO_4192768,5.0016065,"So far only Stanford and Yale provide Single Choice Early Action, I believe (meaning it's nonbinding, but you can only apply to one school early-only Stanford or Yale, in other words)."
287,msmarco,_doc,MARCO_4470552,5.0016065,"Stanford cardiologist, Dr. Michael Fowler, on Heart Failure - Duration: 3:26. Stanford Health Care 2,034 views"
288,msmarco,_doc,MARCO_5401315,5.000622,"Hoover Institution, Stanford, California. 321K likes. Founded in 1919, the Hoover Institution, within Stanford University, is a public policy research... Jump to"
289,msmarco,_doc,MARCO_5422175,5.000622,"Hoover Tower, viewed from the west. Hoover Tower is a 285 feet (87 m) structure on the campus of Stanford University in Stanford, California."
290,msmarco,_doc,MARCO_5881573,5.000622,"The Stanford Memorial Church is one of the major landmarks on Stanford's campus. It's in the Main Quad, across from the Oval, and I passed by it almost a thousand times while I was a student. It's iconic, and it's beautiful."
291,msmarco,_doc,MARCO_7813755,5.000622,"We are sorry that we cannot give you any hint on where Stanford is located on the map. Just play the game and give it a try! If you want to know, how to play the Stanford Map Game, then we can help you."
292,msmarco,_doc,MARCO_4471846,4.999638,"According to this photo and caption from the The Stanford Review, he supported the Stanford University administration ... in opposition to sit-in demonstrators [protesting the Vietnam War]. http://stanfordreview.org/articl..."
293,msmarco,_doc,MARCO_5645512,4.999638,Stanford Achievement Test. The Stanford Achievement Test is a standardized test used to measure academic knowledge of elementary and secondary school students in the United States.
294,msmarco,_doc,MARCO_7285076,4.999638,"Leland Stanford was a politician, industrialist and tycoon. He was also the founder of Stanford University. He was the US Senator of California from March 4, 1885 â?? June 21, 1893."
295,msmarco,_doc,MARCO_1537362,4.9986553,Answers.com WikiAnswers® Categories Jobs & Education Education Colleges and Universities US Colleges and Universities Stanford University How many national championships has Stanford University won?
296,msmarco,_doc,MARCO_3318819,4.9986553,"There is no official mascot at Stanford University. The Tree, which is a member of the Stanford Band, is representative of El Palo Alto, the Redwood tree which is the logo of the city of Palo Alto."
297,msmarco,_doc,MARCO_4247080,4.9986553,"Meridian at Stanford Ranch Area Info. Meridian at Stanford Ranch is located in Placer County, the 95765 ZIP Code, and the Rocklin Unified attendance zone."
298,msmarco,_doc,MARCO_5214200,4.9986553,"For each Stanford advanced degree, there is an approved course of study that meets University and department requirements. The University's general requirements, applicable to all graduate degrees at Stanford, are described below."
299,msmarco,_doc,MARCO_6903615,4.9986553,"Stanford has also become a pipeline to brand-name tech companies, which offer graduates starting salaries up to $500,000. Stanford took second place on our main list. 5."
300,msmarco,_doc,MARCO_6928161,4.9986553,The Law School at Stanford University has an application deadline of February 1. The full-time program application fee at the Law School at Stanford University is $100.
301,msmarco,_doc,MARCO_7372763,4.9986553,The senior living community is not sponsored by or otherwise affiliated with Stanford University. Stanford's sole relationship with Vi at Palo Alto is as ground lessor of the land on which the community is located.
