,_index,_type,_id,_score,_source.body
0,msmarco,_doc,MARCO_6534580,7.2574353,"A column-oriented DBMS is a database management system that stores data tables by column rather than by row. Practical use of a column store versus a row store differs little in the relational DBMS world. Both columnar and row databases can use traditional database query languages like SQL to load data and perform queries. Both row and columnar databases can become the backbone in a system to serve data for common extract, transform, load and data visualization tools. However, by storing data in"
1,msmarco,_doc,MARCO_2122054,7.2465982,"The data structures used by NoSQL databases (e.g. key-value, graph, or document) differ slightly from those used by default in relational databases, making some operations faster in NoSQL and others faster in relational databases.ometimes the data structures used by NoSQL databases are also viewed as more flexible than relational database tables. NoSQL databases are increasingly used in big data and real-time web applications. NoSQL systems are also sometimes called Not only SQL to emphasize that they may support SQL-like query languages."
2,msmarco,_doc,MARCO_7129462,6.6529126,"A: DBMS is short for Database Management System. This refers to a collection of applications that facilitate the extraction, modification and storage of data within a database. The database management system acts as the interface between end users and the database itself, thus making sure data is constantly organized and accessible by other applications and users. A DBMS is made up of three major components, the database schema that is responsible for defining the logical structure of the database, the database engine that facilitates data access and the data itself. There are several types of database management systems, from small ones that run on PCs to large ones than run on data servers."
3,msmarco,_doc,MARCO_4541647,6.2389793,"Relational databases are powerful because they require few assumptions about how data is related or how it will be extracted from the database. As a result, the same database can be viewed in many different ways. An important feature of relational systems is that a single database can be spread across several tables. This differs from flat-file databases, in which each database is self-contained in a single table. Almost all full-scale database systems are RDBMS's."
4,msmarco,_doc,MARCO_1230585,6.22478,"If you want REAL ones, go to a high class bookstore, where they'll sell them for around 40 RMB. That's still not bad. If it's from a supermarket, then I think it should be real though. Although, covers of DVDs may differ from country to country. If it has spelling mistakes, it's fake."
5,msmarco,_doc,MARCO_6461598,6.1206264,"But the slightly different worries may also be due to differing retirement finances. The oldest baby boomers are much more likely to have a traditional pension than younger ones (49 percent versus 37 percent, MetLife found). The youngest boomers are more likely to own a 401(k) (71 percent versus 54 percent). And few 401(k) owners haven’t recently worried about how to make that money last in retirement."
6,msmarco,_doc,MARCO_6255394,6.0800786,offline or traditional weight watchers is a bit expensive than its online version due to involvement of infrastructure manpower etc cost of traditional weight watchers is about $ 10 a week however this cost is likely to differ as per your state of residencehowever the difference is within the range of a couple of dollars on an average the cost of offline program is about $ 39 95however the members have to pay an additional one time sign up fee members can then get an access to various online and offline services by weight watchersffline or traditional weight watchers is a bit expensive than its online version due to involvement of infrastructure manpower etc cost of traditional weight watchers is about $ 10 a week however this cost is likely to differ as per your state of residence
7,msmarco,_doc,MARCO_3934319,6.028113,"TIMESTAMP WITH LOCAL TIME ZONE Datatype. TIMESTAMP WITH LOCAL TIME ZONE is another variant of TIMESTAMP. It differs from TIMESTAMP WITH TIME ZONE as follows: data stored in the database is normalized to the database time zone, and the time zone offset is not stored as part of the column data."
8,msmarco,_doc,MARCO_5234695,6.0008087,"The result of their appearance, most commonly is seen in tightening of the uterus muscles. Often these contractions are called false contractions because differ from the real ones, when the time for the childbirth has come."
9,msmarco,_doc,MARCO_7242060,5.943429,"Real Time Operating System (RTOS) On hearing this term many of the programmers and computer enthusiasts think differently. It differs from the general purpose OS, RTOS is a real time OS working with real time constraints as power, time and efficient usage of memory. Most of the embedded systems are bound to real time constraints and it is achieved using real time system."
10,msmarco,_doc,MARCO_2651128,5.922927,"A DNA database or DNA databank is a database of DNA profiles. A DNA database can be used in the analysis of genetic diseases, genetic fingerprinting for criminology, or genetic genealogy. DNA databases may be public or private, but the largest ones are national DNA databases. When a match is made from a national DNA database to link a crime scene to an offender who has provided a DNA sample to a database that link is often referred to as a cold hit."
11,msmarco,_doc,MARCO_7037331,5.9076304,"A DNA database or DNA databank is a database of DNA profiles. A DNA database can be used in the analysis of genetic diseases, genetic fingerprinting for criminology, or genetic genealogy. DNA databases may be public or private, but the largest ones are national DNA databases.he Australian national DNA database is called the National Criminal Investigation DNA Database (NCIDD). By the start of 2013, it contained 718,462 DNA profiles. The database uses 9 STR locations and a sex gene for analysis."
12,msmarco,_doc,MARCO_7289038,5.9076304,"DNA database. A DNA database or DNA databank is a database of DNA profiles which can be used in the analysis of genetic diseases, genetic fingerprinting for criminology, or genetic genealogy. DNA databases may be public or private, but the largest ones are national DNA databases. When a match is made from a national DNA database to link a crime scene to a person whose DNA profile is stored on a database, that link is often referred to as a cold hit. A cold hit is of particular value in linking a specific pers"
13,msmarco,_doc,MARCO_8780514,5.9068727,"TIMESTAMP WITH LOCAL TIME ZONE is another variant of TIMESTAMP. It differs from TIMESTAMP WITH TIME ZONE as follows: data stored in the database is normalized to the database time zone, and the time zone offset is not stored as part of the column data."
14,msmarco,_doc,MARCO_7181456,5.808926,"No prepurchase of a license is needed. Kinetica is a GPU-accelerated, in-memory analytics database that delivers truly real-time response to queries on large, complex and streaming data sets: 100x faster performance than traditional databases. Kinetica's fully distributed architecture and simplified data structures lead to more predictable scale out. In-database analytics via user-defined functions (UDFs) open the way for converged AI and BI workloads accelerated by GPUs. Kinetica comes with native geospatial and visualization pipeline for interactive location-based analytics. Organiz ations use Kinetica to simultaneously ingest, explore, analyze and visualize data within milliseconds to make critical decisions and find efficiencies, lower cost, generate new revenue, and improve customer experience."
15,msmarco,_doc,MARCO_3777212,5.808532,"Each plant is unique, and the production processes used by plants in your assignment are likely to differ in detail from the ones we present in this module. There are a wide variety of products produced and a number of different activities conducted by regulated establishments.ach plant is unique, and the production processes used by plants in your assignment are likely to differ in detail from the ones we present in this module. There are a wide variety of products produced and a number of different activities conducted by regulated establishments."
16,msmarco,_doc,MARCO_1369008,5.7993646,"DNA database. A DNA database or DNA databank is a database of DNA profiles. A DNA database can be used in the analysis of genetic diseases, genetic fingerprinting for criminology, or genetic genealogy. DNA databases may be public or private, but the largest ones are national DNA databases."
17,msmarco,_doc,MARCO_2405361,5.789466,"Answer: Most Windows PCs allow you access the BIOS settings before the boot sequence completes. The good news is all you have to do is press and hold down a specific key on your keyboard. The bad news is that there is no standard key and it differs depending on the manufacturer of your computer.While there is no universal key used to access the BIOS, below are some of the most common ones: 1  F2.he good news is all you have to do is press and hold down a specific key on your keyboard. The bad news is that there is no standard key and it differs depending on the manufacturer of your computer. While there is no universal key used to access the BIOS, below are some of the most common ones:"
18,msmarco,_doc,MARCO_6809346,5.789466,"Gamelans differ in size, function and musical style. There are small gamelans like the four person Balinese gender wayang which accompany shadow puppet plays, and large ones-the Javenese court gamelans may have forty people-and everything in between. Gamelans are treated with great respect.amelans differ in size, function and musical style. There are small gamelans like the four person Balinese gender wayang which accompany shadow puppet plays, and large ones-the Javenese court gamelans may have forty people-and everything in between. Gamelans are treated with great respect."
19,msmarco,_doc,MARCO_2729752,5.7780776,"You need to create a database then replace the files with your old ones. 1  Create a new database in BCM, using the File, Data File Management menu and choose Add, then choose Business Contact Manager Database. 2  Name it the same as your old database. Create a new database in BCM, using the File, Data File Management menu and choose Add, then choose Business Contact Manager Database."
20,msmarco,_doc,MARCO_1361291,5.7705803,"Although, the salaries in private sector are higher than the government sector but government sector jobs are more secured. Government gives the starting salary of Rs 10K per month and for experienced ones they provide the maximum salary of Rs 50K per month.In private sector, salary differs according to the organisations. Freshers start their career through internship with minimum salary/stipend of Rs 8K.overnment gives the starting salary of Rs 10K per month and for experienced ones they provide the maximum salary of Rs 50K per month. In private sector, salary differs according to the organisations. Freshers start their career through internship with minimum salary/stipend of Rs 8K."
21,msmarco,_doc,MARCO_3295198,5.7705803,"Small dogs don't always digest faster or slower than big dogs. Brand X Pictures/Brand X Pictures/Getty Images. Dog digestion doesn't differ. Big dogs and small ones digest food at the same rate. The fact is, your dog's digestion times are more likely to be influenced by what you feed him than by his size.mall dogs don't always digest faster or slower than big dogs. Brand X Pictures/Brand X Pictures/Getty Images. Dog digestion doesn't differ. Big dogs and small ones digest food at the same rate. The fact is, your dog's digestion times are more likely to be influenced by what you feed him than by his size."
22,msmarco,_doc,MARCO_1250684,5.763076,"Donburi (, also romanized as Domburi) is a general term for bowl. However, it also popularly refers to a bowl of cooked rice with some other food served on top of it.There exist a variety of donburi dishes, differing in their toppings.Some of the most popular ones are listed below: Oyakodon (Oyako Donburi) Mother and Child Donburi The name of this popular donburi dish comes from its two main ingredients, chicken and egg.Rarely, you may also encounter an Oyakodon featuring salmon and ikura (salmon eggs), instead.onburi (, also romanized as Domburi) is a general term for bowl. However, it also popularly refers to a bowl of cooked rice with some other food served on top of it. There exist a variety of donburi dishes, differing in their toppings. Some of the most popular ones are listed below:"
23,msmarco,_doc,MARCO_4589054,5.755599,"How To: Install ATV Hand Grips. Replacement grips offer many advantages over their stock counterparts, the biggest of which is added rider control. Hard compound stock grips become slick and ones hand can slip off the bars over rough terrain or when attempting to tackle a motocross jump.Softer compounds add differing grip patterns offer major advantages over stock and while they tend to wear faster, they are inexpensive and as you will see a snap to install.ard compound stock grips become slick and ones hand can slip off the bars over rough terrain or when attempting to tackle a motocross jump. Softer compounds add differing grip patterns offer major advantages over stock and while they tend to wear faster, they are inexpensive and as you will see a snap to install."
24,msmarco,_doc,MARCO_2122057,5.7467394,Sometimes the data structures used by NoSQL databases are also viewed as more flexible than relational database tables. NoSQL databases are increasingly used in big data and real-time web applications. NoSQL systems are also sometimes called Not only SQL to emphasize that they may support SQL-like query languages.ometimes the data structures used by NoSQL databases are also viewed as more flexible than relational database tables. NoSQL databases are increasingly used in big data and real-time web applications. NoSQL systems are also sometimes called Not only SQL to emphasize that they may support SQL-like query languages.
25,msmarco,_doc,MARCO_7477080,5.7325983,"Definition - What does Database Server mean? The term database server may refer to both hardware and software used to run a database, according to the context. As software, a database server is the back-end portion of a database application, following the traditional client-server model. This back-end portion is sometimes called the instance. It may also refer to the physical computer used to host the database. When mentioned in this context, the database server is typically a dedicated higher-end computer that hosts the database. Note that the database server is independent of the database architecture."
26,msmarco,_doc,MARCO_4433252,5.711996,"Relationship Cardinality Constraints in Relational Database Design. INTRODUCTION. Database modelling is a complex task that involves conceiving, understanding, structuring and describing real universes of discourse (UD) through the definition of schemata using abstraction processes and data models. Traditionally, three phases are identified in database design: conceptual, logical and physical design."
27,msmarco,_doc,MARCO_3078963,5.71024,"Overview. All ivy are not ivy. Scientifically speaking, ivy consists of 15 plants from the genus Hedera. Of these 15 plants, only English ivy (Hedera helix) is included in the American Society for the Prevention of Cruelty to Animals' (ASPCA) database as being toxic to cats.The other 14 are not listed in the database at all (as either toxic or nontoxic).However, many other ivy plants, or ones that are called ivy but not part of the Hedera genus, are included. Some of these plants are toxic while others are not.he other 14 are not listed in the database at all (as either toxic or nontoxic). However, many other ivy plants, or ones that are called ivy but not part of the Hedera genus, are included. Some of these plants are toxic while others are not."
28,msmarco,_doc,MARCO_7840803,5.7029104,"Concurrency is the ability of a database to allow multiple users to affect multiple transactions. This is one of the main properties that separates a database from other forms of data storage like spreadsheets. The ability to offer concurrency is unique to databases. Spreadsheets or other flat file means of storage are often compared to databases, but they differ in this one important regard."
29,msmarco,_doc,MARCO_3445893,5.668169,"The Pro Evolution Soccer 2016 database was exported from PES 2016 version 1.00.00. The PES 2016 database on PES Master includes more than 500 teams and 14,000 players.All PES 2016 attributes and player index cards are accurate, while Overall ratings can differ from the actual ingame values.ll PES 2016 attributes and player index cards are accurate, while Overall ratings can differ from the actual ingame values."
30,msmarco,_doc,MARCO_6717221,5.659528,There is a slight difference between two parallel lines and two coincident lines. Parallel lines have space between them while coincident don't. Parallel lines do not have points in common while coincident ones have ALL points in common!!! When you consider the mathematical form #y=ax+b# for your lines you have: 1) Parallel lines differs only in the real number #b# and have the same #a# (slope).
31,msmarco,_doc,MARCO_2650486,5.654348,"The font may also be different to that of real cards. The picture on the left shows the text of a fake card compared to that of a real one on the right.Back: the backs of fake cards may seem blurry, washed out or a differing colour to those of real cards.The card on the left is fake, and the one on the right is real.he font may also be different to that of real cards. The picture on the left shows the text of a fake card compared to that of a real one on the right.Back: the backs of fake cards may seem blurry, washed out or a differing colour to those of real cards."
32,msmarco,_doc,MARCO_6305487,5.6249785,"Truffles taste very powerfully of mushrooms. The taste is usually described as earthy and even meaty. White truffles have a subtler, slightly floral taste. Truffles are extremely expensive, and Brillat-Savarin points out that eating them in tiny quantities is pointless.ou can get a pretty good idea of what they taste like from truffle oil, sprinkled on eggs or potatoes. The real ones are rather nicer than that, but say twice as nice for 50 times as much. Then again, Mr. Brillat-Savarin begs to differ, Let no one ever confess that he dined where truffles were not."
33,msmarco,_doc,MARCO_1276752,5.619251,"The EC2 Instance Life Cycle. Working with virtual infrastructure is not a whole lot different than using real hardware, but it’s easy to get confused when things are different. In this article I’ll take a look at the life cycle of Amazon EC2 instances and how it differs from the traditional life cycle of real computers. Update January 2010: This article has been updated to incorporate new options introduced by the Boot-from-EBS feature. The Life Cycle of “Real” Computers."
34,msmarco,_doc,MARCO_2266372,5.6190634,"For example, the phrase INTEGER DEFAULT 3.5 is not valid and returns an error. For DateTime data types, Teradata Database performs an implicit conversion if the default value specified in a CREATE/ALTER TABLE statement differs from the data type of the column.For example, the following statement is valid: CREATE TABLE tab1 (F1 INT, F2 TIMESTAMP(0) DEFAULT CURRENT_DATE);or example, the phrase INTEGER DEFAULT 3.5 is not valid and returns an error. For DateTime data types, Teradata Database performs an implicit conversion if the default value specified in a CREATE/ALTER TABLE statement differs from the data type of the column. For example, the following statement is valid:"
35,msmarco,_doc,MARCO_6305489,5.61355,"Best Answer: for that you need to actually taste a truffle. I suggest that you visit an upscale food store-if there's a Whole Foods convinient to you go there-and buy some Truffle Oil - this will be expensive but it keeps pretty well. Try the oil on a piece of baguette (the long crusty french bread loave).ou can get a pretty good idea of what they taste like from truffle oil, sprinkled on eggs or potatoes. The real ones are rather nicer than that, but say twice as nice for 50 times as much. Then again, Mr. Brillat-Savarin begs to differ, Let no one ever confess that he dined where truffles were not."
36,msmarco,_doc,MARCO_2610653,5.6023483,"Each person experiences depression in his or her own way -- and because of this, experts recommend practicing empathy with loved ones who may be struggling. Symptoms differ, causes differ, treatments differ, Greden explains. Jobs, relationships, families -- everything gets changed by this illness.."
37,msmarco,_doc,MARCO_8584713,5.573795,"A fever is usually diagnosed using a thermometer. A variety of different thermometers are available, including traditional glass and mercury ones used for oral or rectal temperature readings and more sophisticated electronic ones that can be inserted in the ear to quickly register the body's temperature. fever is usually diagnosed using a thermometer. A variety of different thermometers are available, including traditional glass and mercury ones used for oral or rectal temperature readings and more sophisticated electronic ones that can be inserted in the ear to quickly register the body's temperature."
38,msmarco,_doc,MARCO_1149464,5.4916935,"ILO Global Wage Database. This database includes data at the national level from 1995 to 2013 for: Minimum wages, nominal average wages, real average wages and real average wage growth.LO Global Wage Database. This database includes data at the national level from 1995 to 2013 for: Minimum wages, nominal average wages, real average wages and real average wage growth."
39,msmarco,_doc,MARCO_6781214,5.490142,"Traditional mass for a gold bar is 400 troy ounces (12.4Kg) at 99.5% purity. So, $632,820 USD for a 12.4Kg bar of 99.5% purity. The ones I mention above are the bigger ones like you see in the movies. This is what governments and banks trade with. It's unlikely a regular person would ever see a real one of these."
40,msmarco,_doc,MARCO_7771163,5.4785714,"Real Estate License. You must obtain a license from the state's real estate licensing agency to act as a real estate agent, salesperson or broker in any state. Each state establishes its requirements for who can become an agent, and while specifics differ, there are general requirements you typically have to meet.eal Estate License. You must obtain a license from the state's real estate licensing agency to act as a real estate agent, salesperson or broker in any state. Each state establishes its requirements for who can become an agent, and while specifics differ, there are general requirements you typically have to meet."
41,msmarco,_doc,MARCO_5186286,5.4721556,"Publisher's Description. From ALikeT Software: Everyone Piano is a computer keyboard simulating piano software, it can use the general computer keyboard to play the world famous piano music.With powerful timbre database, Everyone Piano's tone is lifelike and real-time.Even on onboard sound card, Everyone Piano can reach real-time musical performance, meantime it also simulates the footplate of the piano.ith powerful timbre database, Everyone Piano's tone is lifelike and real-time. Even on onboard sound card, Everyone Piano can reach real-time musical performance, meantime it also simulates the footplate of the piano."
42,msmarco,_doc,MARCO_5853896,5.464696,"A Roth IRA differs from traditional IRA in tax breaks; unlike the deductible contribution to a traditional IRA, a Roth IRA contribution is never deductible. Rather Roth IRA offers tax-exempt on withdrawal from the plan during retirement.ou can set up a traditional IRA at any time and make contributions to a traditional IRA if you were under age 70 1/2 at the end of the tax year and you (or your spouse, if you file joint return) received taxable compensation, such as wages, salaries, commissions, tips, bonuses, or net income from self–employment."
43,msmarco,_doc,MARCO_6843197,5.4487867,"The data structures used by NoSQL databases (e.g. key-value, graph, or document) differ slightly from those used by default in relational databases, making some operations faster in NoSQL and others faster in relational databases."
44,msmarco,_doc,MARCO_1149463,5.4387603,"ILO Global Wage Database. Data underlying the Global Wage Report are accessible at: /ilostat/GWR. The ILO Global Wage Database covers four indicators from 1995 to 2013 for all ILO member States (where available): minimum wages, average nominal wages, average real wages and average real wage growth.LO Global Wage Database. Data underlying the Global Wage Report are accessible at: /ilostat/GWR. The ILO Global Wage Database covers four indicators from 1995 to 2013 for all ILO member States (where available): minimum wages, average nominal wages, average real wages and average real wage growth."
45,msmarco,_doc,MARCO_5245181,5.432335,What it is and why it matters. Digital marketing is the promotion of products or brands via one or more forms of electronic media and differs from traditional marketing in that it involves the use of channels and methods that enable an organization to analyze marketing campaigns and understand what is working and what isn’t – typically in real time.
