,_index,_type,_id,_score,_source.body
488,msmarco,_doc,MARCO_6326403,4.2391734,"Instead of storing information to your computer's hard drive or other local storage device, you save it to a remote database. The Internet provides the connection between your computer and the database. On the surface, cloud storage has several advantages over traditional data storage."
489,msmarco,_doc,MARCO_4239107,4.237485,Introduction. In this article I am going to explain how to restore a database backup in SQL Server 2012. In SQL Server 2012 we can take database backups using the Enterprise Manager. We use a backup database and restore the database when our database becomes corrupted or crashes.Steps to restore database backup using Enterprise Manager in SQL ...e use a backup database and restore the database when our database becomes corrupted or crashes. Steps to restore database backup using Enterprise Manager in SQL Server 2012 Step 1: Start SQL Server 2012: Step 3: The Restore dialog box appears to restore the database backup:
490,msmarco,_doc,MARCO_8640061,4.237485,"DBMS is the abbreviated form of DataBase Management System. Database management system is a computer software component introduced during 1960’s. It is used for controlling various databases in the desktop computer or server. It was also termed as Navigational Database Management System. During 1970’s RDBMS or Relational database management system came into existence. We’ll see about RDBMS later in this article. Database management system is the means of controlling databases either in the hard disk in a desktop system or on a network. Database management system is used for creating database, maintained database and provides the means of using the database."
491,msmarco,_doc,MARCO_3552456,4.235825,1 Go to the land registry office – they can tell you if there is a lien on your home. 2  There may be a nominal fee. 3  Your real estate lawyer can also perform a search in the POLARIS land registry database to see if a lien has been registered.os. 1  Go to the land registry office – they can tell you if there is a lien on your home. 2  There may be a nominal fee. 3  Your real estate lawyer can also perform a search in the POLARIS land registry database to see if a lien has been registered.
492,msmarco,_doc,MARCO_4989108,4.235825,"Zillow Group is an online real estate database company that was founded in 2006 and created by Rich Barton and Lloyd Frink, former Microsoft executives and founders of Microsoft spin-off Expedia.Spencer Rascoff is the current CEO of Zillow, Inc.illow Group is an online real estate database company that was founded in 2006 and created by Rich Barton and Lloyd Frink, former Microsoft executives and founders of Microsoft spin-off Expedia."
493,msmarco,_doc,MARCO_775385,4.2342753,background 1 rtk real time kinematic a proven method of positioning in real time at the cm level invented in the early 1990 s rtk makes gps gnss a very efficient tool for some tasks such as construction staking machine control topographic surveys and many others where precise real time positioning is valuable traditional rtk is a single baseline solution between a base station and a rover unit
494,msmarco,_doc,MARCO_7958366,4.2312627,"With changes in family structure such as divorce, single-parenting, or remarriage, a question many struggle with is how such changes affect children. Any family form that differs from the traditional two-parent, biological family is assumed to place children at risk.Such changes require some adjustment time; however, it is inaccurate to assume that stepchildren have more problems than other children because of parental remarriage.iven the current state of research on children in stepfamilies, it would be premature to suggest that no differences exist between these children and children living in first-marriage families. On the other hand, we cannot assume that all children in stepfamilies will have problems."
495,msmarco,_doc,MARCO_4173520,4.2294126,"Traditionally, when you create a standalone Oracle database without ASM, you need to configure Linux to auto-start it with the server reboot. When you use the ASM, the Grid Infrastructure service will take care of this. Try rebooting the VM machine, login as grid, and check the status of the database."
496,msmarco,_doc,MARCO_2480509,4.2294126,"How to Auto-Fill in Access. In its 2013 edition, Microsoft Access -- a database management tool that's part of the Microsoft Office suite -- focuses on apps, enabling you to create interactive Web apps for data entry alongside traditional desktop databases."
497,msmarco,_doc,MARCO_4625596,4.2294126,"Classified as a NoSQL database, MongoDB eschews the traditional table-based relational database structure in favor of JSON-like documents with dynamic schemas (MongoDB calls the format BSON), making the integration of data in certain types of applications easier and faster."
498,msmarco,_doc,MARCO_350928,4.227466,"If some or all tenants store and use a large amount of data, tenant databases may grow large enough to justify devoting an entire server to a single database that serves a single tenant. The scalability challenges in this scenario are similar to those facing architects of traditional single-tenant applications."
499,msmarco,_doc,MARCO_5584986,4.2258554,"You are doing everything right by using a to_date function and specifying the time. The time is there in the database. The trouble is just that when you select a column of DATE datatype from the database, the default format mask doesn't show the time.If you issue a. alter session set nls_date_format = 'dd/MON/yyyy hh24:mi:ss'.ou are doing everything right by using a to_date function and specifying the time. The time is there in the database. The trouble is just that when you select a column of DATE datatype from the database, the default format mask doesn't show the time."
500,msmarco,_doc,MARCO_3046478,4.2255754,"You don't ever have to take money out of your account. If you do take money out, it can be done at any time and in any amount once you pass the age of 59 1/2 and the account has been open at least five years.If you keep working past the age of 70 1/2, you can continue to contribute to your Roth IRA.he answer differs if you hold the tax-deferred traditional IRA or the tax-free Roth IRA. In both cases, the minimum age from which you can take distributions without penalty is 59 1/2. If someone leaves you an IRA, the rules are more complicated and depend on the decedent's age."
501,msmarco,_doc,MARCO_8546526,4.2255754,"The drum kit is usually played seated on a drum stool or throne. The drum kit differs in general from those traditional instruments that produce melody or chords/pitch per se: even though drums are often placed musically alongside others that do, such as the piano or stringed instruments. The snare drum often does not match the kit, for example being a metal or plain wood shell in a kit where the other drums are in a matching finish. 2  Drummers tend to spend more time playing the snare and cymbals than the other drums. 3  Thin and/or bell-metal cymbals are easily broken by poor technique."
502,msmarco,_doc,MARCO_5455822,4.2255216,"Databases including Medline, Embase, AMED and Chinese Biomedical Database were searched to identify randomized controlled trials published between 1998 and 2009 that compared traditional body acupuncture on acupoints with sham acupuncture controls on irrelevant acupoints or non-acupoints with the same needling depth."
503,msmarco,_doc,MARCO_2491177,4.2243857,This article provides guidance for the prevention of SQL Injection in your web application and explains how SQL Injection is done. SQL Injection is nothing but a combination of a SQL Query that can through user input from your website and execution of the query in your back-end database. I will give an example of the SQL injection. SQL Injection is just like an injection. In real life we use injection to take blood from our body or to insert a liquid into our body. SQL Injection is like a real-life injection. Using SQL Injection you can get important information or you can insert some information into the database.
504,msmarco,_doc,MARCO_2480513,4.223579,"How to Auto-Fill in Access. March 31, 2015. In its 2013 edition, Microsoft Access -- a database management tool that's part of the Microsoft Office suite -- focuses on apps, enabling you to create interactive Web apps for data entry alongside traditional desktop databases."
505,msmarco,_doc,MARCO_4032492,4.221638,"These services have their own citation formats based on the year of the case, an abbreviation indicating the computer service (or a specific database of that computer service), and an identification number; citations to online databases also usually include the case's docket number and the specific date when it was decided (due to the preference for citation to traditional printed resources)."
506,msmarco,_doc,MARCO_7873422,4.221638,"Columnar database is a concept rather a particular architecture/implementation. In other words, there isn't one particular description on how these databases work; indeed, several are build upon traditional, row-oriented, DBMS, simply storing the info in tables with one (or rather often two) columns (and adding the necessary layer to access the columnar data in an easy fashion)."
507,msmarco,_doc,MARCO_206306,4.217762,"Step 2: Get exon/intron sequence information about your gene. You can usually find your gene of interest in a genomic database. PLEASE NOTE: The mouse sequence in these databases is from a C57BL/6J mouse because this is the. mouse strain whose genome was sequenced. Traditionally, mouse targeting has been done in the 129Sv. background, which can be quite different at some loci."
508,msmarco,_doc,MARCO_4684972,4.217255,"Gatineau, QC Real Estate Agents. If you are looking to buy or sell a home in Gatineau, a real estate agent can help. A realtor can help you sell your home, buy a home and will guide you throughout the entire home buying or home selling process. Browse our real estate agent database to find and contact one of our Gatineau area real estate agents or brokers."
509,msmarco,_doc,MARCO_5768147,4.216494,"India Standard Time (IST) is 5:30 hours ahead of Coordinated Universal Time (UTC). This time zone is in use during standard time in: Asia. India Standard Time is a half-hour time zone. Its local time differs by 30 minutes instead of the normal whole hour. This time zone is often called Indian Time. See full time zone map. Email Time Zone Indicator: +0530. An email sent from someone in the India Standard Time (IST) time zone will have the time zone listed as +0530 in the headers of the email. (However, +0530 does not have to be in India Standard Time, as other time zones could have the same UTC offset)."
510,msmarco,_doc,MARCO_512560,4.215827,Page 6. Client-server model is the traditional model of. information systems. It is the dominant model for existing mobile databases. The server can become a single point of failure and. performance bottleneck. Even storing data on a cluster of machines to backup. central database might cause performance bottleneck.
511,msmarco,_doc,MARCO_4393367,4.215827,"Database File Layout. This section describes the storage format at the level of files and directories. Traditionally, the configuration and data files used by a database cluster are stored together within the cluster's data directory, commonly referred to as PGDATA (after the name of the environment variable that can be used to define it). A common location for PGDATA is /var/lib/pgsql/data."
512,msmarco,_doc,MARCO_1387099,4.2142334,"You don't ever have to take money out of your account. If you do take money out, it can be done at any time and in any amount once you pass the age of 59 1/2 and the account has been open at least five years.If you keep working past the age of 70 1/2, you can continue to contribute to your Roth IRA.he age at which you must begin taking withdrawals from your individual retirement arrangement depends on the type of IRA. The answer differs if you hold the tax-deferred traditional IRA or the tax-free Roth IRA. In both cases, the minimum age from which you can take distributions without penalty is 59 1/2."
513,msmarco,_doc,MARCO_6550933,4.2142334,"The age at which you must begin taking withdrawals from your individual retirement arrangement depends on the type of IRA. The answer differs if you hold the tax-deferred traditional IRA or the tax-free Roth IRA. In both cases, the minimum age from which you can take distributions without penalty is 59 1/2.If someone leaves you an IRA, the rules are more complicated and depend on the decedent's age.f you do take money out, it can be done at any time and in any amount once you pass the age of 59 1/2 and the account has been open at least five years. If you keep working past the age of 70 1/2, you can continue to contribute to your Roth IRA."
514,msmarco,_doc,MARCO_7201804,4.2119684,"Note, however, that a significant (e.g. 20%) rise in creatinine while eGFR is >60 may still be important as it will usually reflect a real change in GFR. Values can differ between laboratories. Creatinine measurements can differ significantly between laboratories depending on the methods used to measure it."
515,msmarco,_doc,MARCO_1781558,4.209234,"MLS is an acronym for Multiple Listing Service, which is a private database created, maintained and paid for by real estate professionals to help their clients buy and sell property. MLS ® Systems are the source of IDX listing data and can serve one association or board or multiple associations or boards.LS is an acronym for Multiple Listing Service, which is a private database created, maintained and paid for by real estate professionals to help their clients buy and sell property. MLS ® Systems are the source of IDX listing data and can serve one association or board or multiple associations or boards."
516,msmarco,_doc,MARCO_1214315,4.209234,"In Taylor County the first “real property” records were recorded in the county clerk’s office in the 1870s. To date there are over 4 million images of documents requiring approximately 4 terabytes of computer database. In 2012, the clerk’s office recorded over 29,000 different documents.n Taylor County the first “real property” records were recorded in the county clerk’s office in the 1870s. To date there are over 4 million images of documents requiring approximately 4 terabytes of computer database. In 2012, the clerk’s office recorded over 29,000 different documents."
517,msmarco,_doc,MARCO_507829,4.205622,Thank you for visiting our website! Below you will be able to find the answer to Fats Domino's real name crossword clue. Our site contains over 2.8 million crossword clues in which you can find whatever clue you are looking for. Since you landed on this page then you would like to know the answer to Fats Domino's real name . Without losing anymore time here is the answer for the above mentioned crossword clue: We found 1 possible solution in our database matching the query Fats Domino's real name
518,msmarco,_doc,MARCO_2012322,4.204541,English <-> Chinese-Traditional Online Dictionary - a Bilingual Dictionary from ECTACO. Welcome to the ECTACO English - Chinese-Traditional Online Dictionary! Please be our guest here as we invite you to experience what our comprehensive language databases can do for you.
519,msmarco,_doc,MARCO_4887783,4.204255,"While Structured Query Language is arguably easier to use than traditional computer programming languages, it is also considered to be a very powerful and often complex technology. SQL has many uses. For example, it can be used to insert or change information in database tables. It can also be used to remove that data.0 most extreme places on Earth. Structured Query Language (SQL) is a computer programming language used to manipulate information in relational database management systems (RDBMS)."
520,msmarco,_doc,MARCO_6592724,4.204255,"I am a non-traditional student (parent or older adult). There are many scholarship search databases online that include scholarships for adult students. Search The Sallie Mae Fund's free database of scholarships worth over $16 billion, to find scholarships for high school, college, graduate, and adult students. Try also searching on the Web with key words as study abroad or international scholarships.."
521,msmarco,_doc,MARCO_715131,4.201701,"Wiktionary (0.00 / 0 votes) Rate this definition: entity (Noun). That which has a distinct existence as an individual unit. Often used for organisations which have no physical form.entity (Noun). An existent something that has the properties of being real, and having a real existence.entity (Noun). Anything about which information or data can be stored in a database; in particular, an organized array or set of individual elements or parts. entity (Noun). The state or quality of being or existence.The group successfully maintains its tribal entity.nything about which information or data can be stored in a database; in particular, an organized array or set of individual elements or parts. entity (Noun). The state or quality of being or existence. The group successfully maintains its tribal entity."
522,msmarco,_doc,MARCO_2452541,4.200631,"Tenrox's best functional area is traditional project management. Of the 465 project management solutions in our database that offer traditional PM capabilities, it ranks about average. Tenrox's best functional area is task management."
523,msmarco,_doc,MARCO_3125014,4.2004128,"1 Because DNA fingerprinting has been used to identify bodies, such as military personnel killed in action or crime victims, DNA databases (much like fingerprint databases) have been developed. 2  DNA fingerprinting is more accurate than traditional fingerprints, dental records, blood type, or ID tags for this purpose.NA fingerprinting is done to: 1  Find out who a person's parents or siblings are. 2  This test also may be used to identify the parents of babies who were switched at birth."
524,msmarco,_doc,MARCO_4714243,4.2004128,"For example, if you store your data on a cloud storage system, you'll be able to get to that data from any location that has Internet access. You wouldn't need to carry around a physical storage device or use the same computer to save and retrieve your information.nstead of storing information to your computer's hard drive or other local storage device, you save it to a remote database. The Internet provides the connection between your computer and the database. On the surface, cloud storage has several advantages over traditional data storage."
525,msmarco,_doc,MARCO_5189433,4.2004128,"Virtuoso Universal Server is a middleware and database engine hybrid that combines the functionality of a traditional RDBMS, ORDBMS, virtual database, RDF, XML, free-text, web application server and file server functionality in a single system. NOT NULL – Within the definition of a table, Virtuoso allows data to contain a NULL value. 2  This NULL value is not really a value at all and is considered an absence of value."
526,msmarco,_doc,MARCO_8767474,4.1995153,"Here come the winter months... Farming Simulator 15 Gold Edition Discussion Topic. « on: June 20, 2015, 06:11:37 pm ». So I thought it might be a good time to create a topic surrounding what everyone's hopes are for the Gold Edition-coming later this year-are.ot sure if this would be every ones choice, but MF heritage would be a massive thumbs up for me, to see some real MF's 135 etc: in game as a Gold edition, and this is exactly what it would be GOLD to me, to see some real MF 135 heritage farm equipment you can really have a good time with."
527,msmarco,_doc,MARCO_8267955,4.1941967,Below are eight ways to find foreclosure listings: 1. Foreclosure real estate agent Find a real estate agent who specializes in foreclosed properties. Go to Zillow’s Professional Directory and search for agents in your area who have foreclosure experience.Your agent will be able to guide you to foreclosure property listings on the Multiple Listing Service (MLS) – a database to which consumers do not have direct access. 2.o to Zillow’s Professional Directory and search for agents in your area who have foreclosure experience. Your agent will be able to guide you to foreclosure property listings on the Multiple Listing Service (MLS) – a database to which consumers do not have direct access. 2.
528,msmarco,_doc,MARCO_2433946,4.1928334,My other degrees were earned at traditional schools. Walden's standards were just as rigorous as any traditional university. The program was research intense. Most of my courses required that I research two questions each week using both the course texts and the university library's databases. My weekly papers were 4 -5 pages long.
529,msmarco,_doc,MARCO_4503114,4.1927495,"The map of Quaternary faults and folds of Ecuador was compiled on an overlay using the Ecuador geologic map as a base; the faults were digitized at a scale of 1:1,250,000.he fault and fold data will be released in several forms. This open-file report constitutes a traditional hard-copy catalog (database and map) for Ecuador. The Ecuador data will eventually be part of a larger relational computer database for the Western Hemisphere that should be available on the World Wide Web (WWW)."
530,msmarco,_doc,MARCO_7440643,4.1927495,"The first issue to answer is the origin of the term unstructured data. The term originated from database technicians who were unable to store data in traditional tables, and retrieve those data with SQL (Structured Query Language).herefore, a sequence is established for unstructured data, structured data, highly structured data, and complex structured data. That sequence seems to be well received. Terms like poly-structured data and multi-structured data have been used, but with reference to database management systems."
531,msmarco,_doc,MARCO_1365827,4.191677,"A Japanese sword (日本刀, nihontō) is one of several types of traditionally made swords from Japan.There are many types of Japanese swords that differ by size, shape, field of application and method of manufacture. Some of the more commonly known types of Japanese swords are the katana, wakizashi, and tachi.he production of swords in Japan is divided into specific time periods: jokoto (ancient swords, until around 900 A.D.), koto (old swords from around 900–1596), shinto (new swords 1596–1780), shinshinto (new new swords 1781–1876), gendaito (modern swords 1876–1945), and shinsakuto (newly made swords 1953–present)."
532,msmarco,_doc,MARCO_3448275,4.1905117,"Track the location of a cell number using our reverse phone directory. (Real Phone Lookup does not use GPS or Wi-Fi tracking to find a cell phone's current location-search records come from public databases and directories.). Real Phone Lookup. Find out who's calling!f you happen to miss a text or call from an unknown number, use Real Phone Lookup to find out who is calling! If you are getting prank calls or anonymous calls use Real Phone Lookup to help track them down and report any suspicious activity."
533,msmarco,_doc,MARCO_8411054,4.1905117,"In SQL, a view is a virtual table based on the result-set of an SQL statement. A view contains rows and columns, just like a real table. The fields in a view are fields from one or more real tables in the database.You can add SQL functions, WHERE, and JOIN statements to a view and present the data as if the data were coming from one single table.n SQL, a view is a virtual table based on the result-set of an SQL statement. A view contains rows and columns, just like a real table. The fields in a view are fields from one or more real tables in the database."
534,msmarco,_doc,MARCO_2166462,4.1862564,"A Line Operations Safety Audit (LOSA) is a formal process that requires expert and highly trained observers to observe operations in real-time and to collect safety-related data on environmental conditions, operational complexity, and human performance.ine Operations Safety Audit Data Exchange (LOSADE): LOSADE is a benchmarking database that can be used to see how you are doing compared to other, similar operators. Operators that implement our LOSA software are automatically included in the LOSADE database. (available for Flight Operation LOSA's only at this time)."
535,msmarco,_doc,MARCO_8150957,4.18359,"Welcome! On this page you can find the current local time in Saskatoon, Canada. And in any city available in our database. If you want to know how much time is in another city, accurate to a second, select it in the drop-down list below. Real exact time is displayed online. Our server of the most exact local time is available round-the-clock and provides also additional information: date, time zone, day of the week, time of day, weather, neighboring cities, sunrise and sunset and much more."
536,msmarco,_doc,MARCO_5239981,4.18313,"a big data strategy for their businesses in order to capture market opportunities and/or prevent reputational damage. ‘In simple terms, big data refers to data sets that can’t be handled easily through traditional methods such as dedicated servers driving a traditional database or data warehouse structure"
537,msmarco,_doc,MARCO_6179516,4.182912,"confabulation. unconscious filling in of gaps in memory with fabricated facts and experiences, commonly associated with organic pathology. It differs from lying in that the patient has no intention to deceive and believes the fabricated memories to be real.onfabulation. unconscious filling in of gaps in memory with fabricated facts and experiences, commonly associated with organic pathology. It differs from lying in that the patient has no intention to deceive and believes the fabricated memories to be real."
