,_index,_type,_id,_score,_source.body
698,msmarco,_doc,MARCO_5777686,4.0511584,"Also search our listings for Salida Open Houses, Newest Salida Listings and Salida Homes with Price Reductions now. Finding the right home is no picnic. Looking through the homes for sale in Salida, CO, prioritizing what features are most important, considering the viability of differing locations, prices and options. Finding the right real estate in Salida is hard, and that's not even mentioning the financial and legal aspects that are included in buying real estate."
699,msmarco,_doc,MARCO_1734924,4.0507617,"The actual colors shown differ, but many of the designs are based on the traditional scheme of red, orange, yellow, green, blue, indigo and violet, or some more modern division of the rainbow spectrum (often excluding indigo, and sometimes including cyan instead)."
700,msmarco,_doc,MARCO_1134164,4.0507617,"Biology students have traditionally dissected frogs, because their anatomy is surprisingly similar to human anatomy. On each screen where there is a difference between human and frog anatomy, you will see the icon to the right and can learn how we differ from frogs."
701,msmarco,_doc,MARCO_3376209,4.0507617,"The variable intensity and continuous nature of the exercise places stress on both the aerobic and anaerobic systems. It differs from traditional interval training in that it is unstructured; intensity and/or speed varies, as the athlete wishes."
702,msmarco,_doc,MARCO_2878174,4.0507617,"A technocracy differs from a traditional democracy in that individuals elected to a leadership role are chosen through a process that emphasizes their relevant skills and proven performance, as opposed to whether or not they fit the majority interests of a population."
703,msmarco,_doc,MARCO_4292672,4.0507617,Nuclear medicine tests differ from most other imaging modalities in that diagnostic tests primarily show the physiological function of the system being investigated as opposed to traditional anatomical imaging such as CT or MRI.
704,msmarco,_doc,MARCO_4585167,4.0507617,"35,36 One might, however, argue that MRT differs from traditional cloning in that the mitochondrial donor is only supplying an extremely small amount of DNA (37 genes out the over 20,000 genes in the human genome) to the embryo."
705,msmarco,_doc,MARCO_5634891,4.0507617,A special type of power of attorney that is used frequently is the durable power of attorney. A durable power of attorney differs from a traditional power of attorney in that it continues the agency relationship beyond the incapacity of the principal.
706,msmarco,_doc,MARCO_7448972,4.0507617,"When the individual begins to receive distributions from a Traditional IRA, the income is treated as ordinary income and may be subjected to income tax. This differs from the Roth IRA, which can offer tax-free distributions."
707,msmarco,_doc,MARCO_1349691,4.049317,"Power Query enables you to specify your native database query in the SQL Statement box while connecting to a database. In this example, we will import data from a SQL Server database using the native database query. The procedure is similar for the rest of the databases supported by Power Query. 1  Connect to a SQL Server database using Power Query. 2  In the Microsoft SQL Database dialog box: Specify the Server and Database to connect to from where you want to import data using native database query."
708,msmarco,_doc,MARCO_5087387,4.049317,"In SQL Server Management Studio, in Object Explorer, expand Databases, right-click a database, point to Tasks, and then click Copy Database. From the Select a Source Server page, specify the server with the database to move or copy, and to enter login information.ote. Database users can continue to access the database during the transfer. From the Select Database page, select the database or databases you want to move or copy from the source server to the destination server. See Limitations and Restrictions in the 'Before You Begin' section of this topic."
709,msmarco,_doc,MARCO_157020,4.048802,"Activity-based costing provides a more accurate view of product cost, but companies typically use it as a supplemental costing system. The allocation bases used in activity-based costing differ from those used in traditional costing."
710,msmarco,_doc,MARCO_341972,4.048802,"Article Sections. Traditional clinical review articles, also known as updates, differ from systematic reviews and meta-analyses. Updates selectively review the medical literature while discussing a topic broadly."
711,msmarco,_doc,MARCO_3120465,4.048802,"Many people ask exactly how a direct cremation service differs from a traditional funeral service that is followed by cremation. A direct cremation is the least expensive option, and is not openly available from many funeral directors."
712,msmarco,_doc,MARCO_7343109,4.048802,DEFINITION of 'Health Maintenance Organization-HMO'. An organization that provides health coverage with providers under contract. A Health Maintenance Organization (HMO) differs from traditional health insurance by the contracts it has with its providers.
713,msmarco,_doc,MARCO_6907659,4.048802,"Of course all Bavarians understand and most speak standard German. However, in southern Bavaria, outside of Munich, Bavarian or Swabian is the native language of many, which can differ dramatically from standard German. In the north Franconian is the traditional language."
714,msmarco,_doc,MARCO_1563181,4.046844,"The type of modern cheesecake that has an uncooked, cream-cheese filling on a cookie-crumb base is an American invention that differs greatly from English cheesecakes, which traditionally include dried fruits and spices and are baked in the oven."
715,msmarco,_doc,MARCO_1817840,4.046844,"ABC analyses costs from the perspective of the how much a particular activity costs, and. the amount of resources consumed by the end product of the activity. Using activity. based costing differs from traditional cost accounting in that the focus is on the activities."
716,msmarco,_doc,MARCO_6094340,4.046844,"The states which use familial searches differ in when they allow such searches. Some states allow traditional DNA searches (for a full match) to include partial match information in reported results, when an explicit familial search has not been requested."
717,msmarco,_doc,MARCO_7432897,4.046844,"Gallery: Inside the Tesla Model S. Tesla's mall stores differ from traditional auto dealerships in a number of other ways, too. For one, you won't be able to haggle over the price. The salespeople themselves won't be typical auto salespeople, either."
718,msmarco,_doc,MARCO_6944666,4.0458803,"For APOs and DPOs, either the Army or Air Force provides personnel. For FPOs, the Navy does the job. At each APO, FPO, or DPO, there is an equivalent to a-real-honest-to-goodness-Post Office staffed by members of the respective branch of service. While the layout of each APO/FPO/DPO varies by location, suffice it to say they look and operate just like a real Post Office. In fact, they have to, since we are talking about U.S. Mail. Each APO/FPO/DPO address holder has a mail lock box in which their mail is slotted. Since parcels can't fit in these boxes, delivery or notification slips, just like real ones, are put in the boxes whenever a parcel arrives."
719,msmarco,_doc,MARCO_3575060,4.0455146,"Replication is the process of copying a database to another server, and then keeping the two copies in sync, so that they behave as near as possible. Replication copies data or changes of data from one database to an another.Accessing the first database or the second, it does not matter because they are the same, i.e. they are in sync. Replication is not limited to two databases, any number of database can take place into the replication model.eplication copies data or changes of data from one database to an another. Accessing the first database or the second, it does not matter because they are the same, i.e. they are in sync. Replication is not limited to two databases, any number of database can take place into the replication model."
720,msmarco,_doc,MARCO_5070632,4.0455146,"MPP Databases. MPP database searches are performed by each processor on the computers where segments of the database are stored. MPP databases can be expanded by adding new CPUs. MPP databases are a form of linear scalable database or parallel database. Spreading data across more systems in thinner slices results in faster database searches. Performance of an MPP system is linear, increasing roughly in proportion to the number of nodes. MPP nodes are managed as a single computer. SQL originated as a means of processing data across MPP databases."
721,msmarco,_doc,MARCO_8070224,4.0455146,Conclusion. In this article you have seen the steps to attach a database in SQL Server. You can use Database Detach and Attach option to temporarily remove a database from an instance of SQL Server or to move the database file to a new location.ight click Databases Attach… option from the drop down list as shown in the snippet below. 3. In Attach Databases dialog box click on Add… button as shown in the snippet below. 4. In Locate Database Files dialog box select the .MDF file of the database and click OK to return to Attach Database dialog box.
722,msmarco,_doc,MARCO_1134165,4.044888,"Human anatomy comparisons. Biology students have traditionally dissected frogs, because their anatomy is surprisingly similar to human anatomy. On each screen where there is a difference between human and frog anatomy, you will see the icon to the right and can learn how we differ from frogs."
723,msmarco,_doc,MARCO_3833023,4.044888,"Native American religions are the spiritual practices of the indigenous peoples of the Americas. Traditional Native American ceremonial ways can vary widely, and are based on the differing histories and beliefs of individual tribes, clans and bands."
724,msmarco,_doc,MARCO_3866808,4.044888,"Answer Wiki. A rheostat is nothing more than a variable resistor. Traditionally, a rheostat differs from a potentiometer in having only two terminals, one connected to the wiper and one to an end of the resistive element, but since a potentiometer (with three terminals) can also be used as a rheostat, that distinction is often overlooked."
725,msmarco,_doc,MARCO_4851697,4.044888,"How does Herbert's use of echo in his poemHeaven differ from that of the myth? Through the use of Echo, George Herbert transcends both the traditional meaning of... What is a diamond poem about heaven and hell? Diamond poem about heaven & hell: Birth Ecstatic, hopeful Encouraging,..."
726,msmarco,_doc,MARCO_4519352,4.044888,"Every day at Software Advice, we hear the same handful of questions about what SaaS is, exactly, and how SaaS differs from the traditional software model. So, we thought it’d be helpful to put together a guide of the 10 most frequently asked questions about SaaS."
727,msmarco,_doc,MARCO_4226774,4.044888,"Sometimes referred to as garlic bologna, this sausage differs from traditional bologna due to various seasonings, most typically garlic being added to the recipe. Although referred to as German bologna elsewhere, it is usually called Fleischwurst in Germany and Extrawurst in Austria."
728,msmarco,_doc,MARCO_4881574,4.044888,"Paraguay differs significantly even from other multilingual Latin American nations like neighboring Bolivia, where a majority of the population is indigenous. Languages like Quechua and Aymara are spoken by different groups there, but rarely by people of mixed ancestry or the traditional elite."
729,msmarco,_doc,MARCO_5397726,4.044888,"The Belfast Quarters refer to a number of distinctive cultural zones within the city of Belfast, Northern Ireland, whose identities have been developed as a spur to tourism and urban regeneration. These quarters differ from the traditional districts into which Belfast is divided."
730,msmarco,_doc,MARCO_6625335,4.044888,"The average salary for instructors of specific traditional martial arts might differ from the average salary for martial arts instructors in general. For example, Salarylist.com lists the average salary of a karate instructor as $26,679 per year as of 2012."
731,msmarco,_doc,MARCO_8100422,4.044888,"The term niche market on the internet differs from the definition of niche market in the traditional marketing, since in the latter, a niche market is defined on the basis of similarities regarding geographic, demographic, psychological, social market and behaviour of a group."
732,msmarco,_doc,MARCO_8409561,4.044888,They differ significantly from traditional drugs used to treat rheumatoid arthritis in that they target specific components of the immune system instead of broadly affecting many areas of the immune system. Biologics may be used alone but are commonly given along with other rheumatoid arthritis medications.
733,msmarco,_doc,MARCO_8643084,4.044888,"Contribution amounts for Traditional and Roth IRA’s are the same; however, the age limits differ. IRA contribution rules may vary from year to year. You should periodically check both the contribution rules and the income rules to ensure your eligibility to participate and contribute."
734,msmarco,_doc,MARCO_7965407,4.044767,The real goal of economic growth is to accomplish major improvements in the population’s standard of living; expanding existing markets & business and at the same time opening new ones. Real economic growth in the country also means sharing with one’s neighbor.
735,msmarco,_doc,MARCO_3495463,4.0436187,"Because a public library stores books, we could also say that a library is a database of books. But strictly defined, databases are computer structures that save, organize, protect, and deliver data. A system that contains databases is called a database management system, or DBM. The typical diagram representation for a database is a cylinder. Types of Databases. The simplest form of databases is a text database. When data is organized in a text file in rows and columns, it can be used to store, organize, protect, and retrieve data. Saving a list of names in a file, starting with first name and followed by last name, would be a simple database."
736,msmarco,_doc,MARCO_5795333,4.0436187,The multitenant option introduced in Oracle Database 12c allows a single container database (CDB) to host multiple separate pluggable databases (PDB). This article demonstrates how to startup and shutdown container databases (CDB) and pluggable databases (PDB).1  Container Database (CDB). 2  Pluggable Database (PDB).LTER PLUGGABLE DATABASE. The ALTER PLUGGABLE DATABASE command can be used from the CDB or the PDB. The following commands are available to open and close the current PDB when connected to the PDB as a privileged user. Some examples are shown below.
737,msmarco,_doc,MARCO_751713,4.042934,"In a typical class action, a plaintiff sues a defendant or a number of defendants on behalf of a group, or class, of absent parties. This differs from a traditional lawsuit, where one party sues another party for redress of a wrong, and all of the parties are present in court."
738,msmarco,_doc,MARCO_2543025,4.042934,"This branch of hypnosis differs significantly from the traditional schools of hypnotherapy-drawing influence from a range of theories such as positive psychology, neuroscience, evolutionary psychology and NLP, and combining them so that they fall in line with the personal goals and values of the client."
739,msmarco,_doc,MARCO_1296882,4.042934,Health Maintenance Organization - HMO. A health maintenance organization (HMO) is an organization that provides health coverage with providers under contract. A Health Maintenance Organization (HMO) differs from traditional health insurance by the contracts it has with its providers.
740,msmarco,_doc,MARCO_1296880,4.042934,What is a 'Health Maintenance Organization - HMO'. A health maintenance organization (HMO) is an organization that provides health coverage with providers under contract. A Health Maintenance Organization (HMO) differs from traditional health insurance by the contracts it has with its providers.
741,msmarco,_doc,MARCO_3230799,4.042934,"Traditional cultures didn’t (and don’t) feed their young babies infant cereal. Among the few cultures who fed their babies a gruel of grains, their practice radically differed from what we do today. First, they only introduced the gruel after the baby was more than a year old."
742,msmarco,_doc,MARCO_4394749,4.042934,"Buying a house or renting an apartment aren't the only living arrangements available in the marketplace. Housing cooperatives provide an alternative to the traditional methods of acquiring a primary residence. In this article, we'll explain what a cooperative is and how it differs from other housing options."
743,msmarco,_doc,MARCO_4771672,4.042934,"Are all Keyless Ignition Systems the same? Keyless Ignition Systems differ across models. Push buttons are most common, but there are also rocker-type switches that must be flipped, and rotary switches that must be rotated similar to the traditional ignition switch that is turned with a key."
744,msmarco,_doc,MARCO_5543050,4.042934,"Here's what's the same. There's no doubt about it: If you're serious about saving for retirement, one of the best ways to do it is through an IRA account. Traditional and Roth IRAs differ in key ways, but they have plenty in common too. We've highlighted the biggest strengths of these powerful retirement-saving tools."
745,msmarco,_doc,MARCO_6669282,4.042934,The Pinhole Surgical Technique is a breakthrough alternative to gum graft surgery that reverses gum recession using a minimally invasive approach. Please take a look at the video above to see how PST is performed and also how it differs from traditional gum grafts.
746,msmarco,_doc,MARCO_6090090,4.042934,I'm very interested in the holistic side of health but am not sure what career options are out there for me if I pursue the holistic nursing track. Can I be a travel nurse? How does holistic nursing differ from the traditional hospital nurse? I just want to know my options before I travel that road.
747,msmarco,_doc,MARCO_6749975,4.042934,"Hybrid material. Hybrid materials are composites consisting of two constituents at the nanometer or molecular level. Commonly one of these compounds is inorganic and the other one organic in nature. Thus, they differ from traditional composites where the constituents are at the macroscopic (micrometer to millimeter) level."
748,msmarco,_doc,MARCO_7687834,4.042934,Freebase (0.00 / 0 votes) Rate this definition: Microblogging. Microblogging is a broadcast medium that exists in the form of blogging. A microblog differs from a traditional blog in that its content is typically smaller in both actual and aggregated file size.
749,msmarco,_doc,MARCO_8560268,4.042934,"Which Specialties Could I Pursue as a Holistic Health Practitioner? Holistic health practices differ from conventional, or Western, medicine. Careers in alternative medicine, however, may also blend Western and non-traditional medicine; this is called complementary or integrative medicine."
750,msmarco,_doc,MARCO_479639,4.040982,"In its production, capocollo is first lightly seasoned often with red and sometimes white wine, garlic, and a variety of herbs and spices that differ depending on region. The meat is then salted (and was traditionally massaged) and stuffed into a natural casing, and hung for up to six months to cure."
751,msmarco,_doc,MARCO_1016442,4.040982,"The apparent availability of gig jobs and the flexibility they seem to provide workers are. frequently touted features of the gig economy. However, to the extent that gig-economy workers. are viewed as independent contractors, gig jobs differ from traditional employment in notable. ways."
752,msmarco,_doc,MARCO_2270990,4.040982,This wording has been the text of the Equal Rights Amendment since 1943. (See Question 3.) The text of the ERA bill (H.J. Res. 52) introduced in the House of Representatives in the 114th Congress (2015-2016) differs slightly from the traditional wording.
753,msmarco,_doc,MARCO_2273436,4.040982,"In Italy, traditional music differs from region to region and is heavily influenced by its historical past. In the northern region of Italy, for example, music has strong Celtic influences, while the southern half of the country has hints of Greek and Arabic influences."
754,msmarco,_doc,MARCO_2322230,4.040982,"Both bread types consist of the basic ingredients of wheat flour, water, yeast and salt. They differ in that the traditional baguette never varies from the basics. It always uses all-purpose white flour, but a miche can be a combination of white, whole-wheat and rye flours."
755,msmarco,_doc,MARCO_5614033,4.040982,"A fun, competitive and team-oriented environment will motivate call center agents. Jupiterimages/Brand X Pictures/Getty Images. A call center environment can be challenging to manage because it differs significantly from the traditional office environment."
756,msmarco,_doc,MARCO_5110178,4.040982,"See Reproduction (plant). Land plants have been traditionally divided into “bryophytes” and vascular plants (tracheophytes). These differ in the relative role of the sporophyte, which is subordinate and permanently attached to the gametophyte in “bryophytes” but dominant and independent in vascular plants."
757,msmarco,_doc,MARCO_5023037,4.040982,"APT attacks differ from traditional web application threats, in that: 1  They’re significantly more complex.  They’re not hit and run attacks—once a network is infiltrated, the perpetrator remains in order to attain as much information as possible."
758,msmarco,_doc,MARCO_6948871,4.040982,"It was created by Julian Jones, Jake Michie, Julian Murphy and Johnny Capps based on the Arthurian legends of the mythical wizard Merlin and his relationship with Prince Arthur, but differs from traditional versions of the legend in many ways, especially the characters."
759,msmarco,_doc,MARCO_7913763,4.040982,"(XP). Extreme Programming (XP) is a software engineering methodology, the most prominent of several agile software development methodologies. Like other agile methodologies, Extreme Programming differs from traditional methodologies primarily in placing a higher value on adaptability than on predictability."
760,msmarco,_doc,MARCO_7332434,4.040982,"The capoeira term for what is more generally known as a cartwheel. It differs a bit from the traditional cartwheel because of their different intentions. An au, aú in its base, form is performed very, slowly with arms and legs bent in order to keep a low target. profile"
761,msmarco,_doc,MARCO_7440585,4.040982,There are two major styles of punctuation in English: American or traditional punctuation; and British or logical punctuation. These two styles differ mainly in the way in which they handle quotation marks. The Oxford comma is the use of a comma for the penultimate item in a list.
762,msmarco,_doc,MARCO_8587512,4.040982,"It is often seen a hybrid role and combined with other often related areas of responsibility such as business process and change management. The role differs from that of an IT Director or traditional IT Manager by virtue of having Board level accountability, often accompanied with a wide influence over internal issues."
763,msmarco,_doc,MARCO_1671784,4.039838,"Data in the base tables of the data dictionary is necessary for Oracle Database to function. Therefore, only Oracle Database should write or change data dictionary information. Oracle Database provides scripts to modify the data dictionary tables when a database is upgraded or downgraded.During database operation, Oracle Database reads the data dictionary to ascertain that schema objects exist and that users have proper access to them.he views of the data dictionary serve as a reference for all database users. Access the data dictionary views with SQL statements. Some views are accessible to all Oracle Database users, and others are intended for database administrators only."
764,msmarco,_doc,MARCO_2104824,4.039838,"Select File Maintenance from the Databases menu.2. Select Restore from the secondary menu. The File Maintenance – Restore screen displays.3. To restore one or more databases, click Restore selected databases and select each database to restore.4. To restore all of your databases, click Restore All or Select All .5.elect File Maintenance from the Databases menu.2. Select Backup from the secondary menu. The File Maintenance – Backup screen displays.3. To back up one or more databases, click Backup selected databases and select each database to back up.4."
765,msmarco,_doc,MARCO_2104827,4.039838,"Select File Maintenance from the Databases menu.2. Select Backup from the secondary menu. The File Maintenance – Backup screen displays.3. To back up one or more databases, click Backup selected databases and select each database to back up.4.To back up all of your databases, click Backup All or Select All .5.elect File Maintenance from the Databases menu.2. Select Backup from the secondary menu. The File Maintenance – Backup screen displays.3. To back up one or more databases, click Backup selected databases and select each database to back up.4."
