,_index,_type,_id,_score,_source.body
243,msmarco,_doc,MARCO_3289733,4.5641108,top 10 facts about the world aficionados of mexican cuisine may consider the chalupa to be a favorite meal item this tostada platter consists of a deep fried corn based dough filled with the diner s choice of foods common ingredients include ground beef beans or shredded chicken and vegetableshe garnacha is smaller fried corn tortilla and usually features fillings similar to those used to fill tacos american chalupas differ from the traditional mexican creations they typically feature a deep fried flat bread which is chewier and thicker than a traditional chalupa
244,msmarco,_doc,MARCO_5548654,4.5634627,"Personalized health review for White Castle Traditional Bun. There are 70 calories in White Castle Traditional Bun. Get all the ingredients, nutrition facts, and allergy information for White Castle Traditional Bun and more than 300,000 other foods in FoodFacts.com food database."
245,msmarco,_doc,MARCO_5260981,4.562956,"By Timothy Dyck Among the Web-based databases, Caspio Bridge stands out for its efforts to look and act like traditional database software. It's written in Dynamic HTML and run locally by the Web browser. The application downloads blocks of code when each of its various functions is accessed for the first time.he toolbar and buttons on the main Caspio Bridge Explorer window let you create and edit the two basic objects in the softwaretables and DataPages (which Caspio Bridge calls database entry and search forms)as well as configure security settings."
246,msmarco,_doc,MARCO_425980,4.5624886,"Adaptive Bioengineering products differ from assistive ones in that they actually change the living organisms.rom my understanding, biotechnology is the use of technology on living and nonliving organisms while bioengineering is more in the creating, designing, and modifying the tech … nology that is involved in such process."
247,msmarco,_doc,MARCO_1075379,4.5624886,"page 1 of 2. Mitosis and meiosis are similar processes in that they both result in the separation of existing cells into new ones. They differ, however, in their specific processes as well as in their products. The reason for these differences lies in the difference in the class of cells that each process creates."
248,msmarco,_doc,MARCO_3775266,4.5624886,"Some studies suggest that the symptoms may be more severe among pregnant women [11]. The onset of symptoms may differ depending on the location of the tumor, for example an extradural cavernous hemangioma behaves differently from the intramedullary ones, as well as from an extradural one in the spine [12] [13]."
249,msmarco,_doc,MARCO_8150691,4.5624886,"Colors differ in the dual monitor. Check this out Color Calibration 101 (codinghorror), it should help! But I would recommend to buy a display calibration device (absolutely useful when using dual display)! The good ones are pretty expensive, you can share it with friends to afford the price."
250,msmarco,_doc,MARCO_6094346,4.5615163,"Familial vs. Traditional DNA Search. Traditional DNA searches look for an exact match to a DNA sample. With a traditional DNA search, authorities can see whether crime scene DNA matches the DNA of anyone whose DNA has been collected in an array of state and federal DNA databases."
251,msmarco,_doc,MARCO_990187,4.5605383,"Other Similar FunTrivia Questions & Answers. What do the stars, one large one and four smaller ones, on the Chinese flag represent? The flag of the mayor of New York City differs from the city flag only in that it includes five blue five-pointed stars."
252,msmarco,_doc,MARCO_4311769,4.5605383,Everyone knows that life insurance pays out when the named person dies. The idea is to protect loved ones from a sudden loss of financial support. But there are three basic types of life insurance that differ in their details. 1  Term. 2  Whole.  Universal.
253,msmarco,_doc,MARCO_2388709,4.55859,Any conscious emotional state such as anxiety or excitement consists of two components: a primary reaction of the central nervous system and an intellectual interpretation of these physiological responses. The physiological state we label as communication anxiety does not differ from ones we label rage or excitement.
254,msmarco,_doc,MARCO_1989414,4.55859,"Create, store and share important documents that your loved ones might need. Find out more about Everplans ». Within Hinduism there are a number of sects, subsects, and regional variations with differing beliefs. Generally, Hindus believe that life and death are part of the concept of samsara, or rebirth."
255,msmarco,_doc,MARCO_3659029,4.55859,"Only the males have antlers, massive flattened ones averaging 160cm across and 20kg in weight. These antlers have as many as 30 TINES (or spikes), the shape differing from animal to animal. A young moose's first pair of antlers grow from two tiny bumps on their head that they have had from birth."
256,msmarco,_doc,MARCO_6997803,4.55859,"Europeans don't love ANY American food. Odd though it may seem, 500 million people with 36 different languages (and I'm just talking the EU's official ones) differ just the teeniest bit from each other. Some like overcooked dead cow: others prefer bistecca alla fiorentina."
257,msmarco,_doc,MARCO_821279,4.5566435,"Old Ones – name encompassing all gods and goddess. Old Religion – used to refer to Witchcraft, Paganism, and/or Wicca (lots of differing opinions here as to its correctness). once-born – non-Wiccan (derogatory). Ostara – Spring Equinox Sabbat."
258,msmarco,_doc,MARCO_4105048,4.5566435,"Animated Films are ones in which individual drawings, paintings, or illustrations are photographed frame by frame (stop-frame cinematography). Usually, each frame differs slightly from the one preceding it, giving the illusion of movement when frames are projected in rapid succession at 24 frames per second."
259,msmarco,_doc,MARCO_5226083,4.5566435,"Ming Tsai, an American restaurateur, television personality and celebrity chef of fusion cuisine, prefers to call him a Chinese. It differs on people perspective to define ones ethnicity but the fact is he is a second generation Chinese American. So, one can always feel free to advocate about his ethnicity."
260,msmarco,_doc,MARCO_911041,4.554699,"The epistropheus apparently bore two hypapophyses, as in Varanus; the posterior one lay relatively far forward. The eighth, ninth and tenth vertebrae differ somewhat from the preceding ones by their breadth. Instead of rectangular outlines they show a more square shape. Also these three vertebrae are provided with needle-shaped cervical ribs."
261,msmarco,_doc,MARCO_3694961,4.554699,"Plant life cycles differ from animal ones by adding a phase (the haploid gametophyte) after meiosis and before the production of gametes. Many protists and fungi have a haploid dominated life cycle. The dominant phase is haploid, while the diploid phase is only a few cells (often only the single celled zygote, as in Chlamydomonas )."
262,msmarco,_doc,MARCO_1040843,4.554699,"Vaccine names are often abbreviated. Here are some common ones. California Immunization. Registry (CAIR2) codes may differ for certain vaccines. Use this chart as a reference.*. Vaccine Acronyms & Abbreviations for Providers. California Department of Public Health, Immunization Branch IMM-895 (1/17) www.eziz.org."
263,msmarco,_doc,MARCO_1811818,4.554699,"The measurements parallel earlier ones on the hooded rat. The eyes of the mouse and rat differ mainly in size, by a linear scale factor of 1.9–2.0, and only slightly in refractive index. Thus refraction, chromatic aberration, and retinal illumination are easily compared in the two species."
264,msmarco,_doc,MARCO_5896092,4.554699,At Personal-Touch our staff of caring professionals will explain the options and help tailor the best care possible for you and your loved ones. Contact a location near you and allow us to help you. Personal-Touch offers the following services: Range and scope of services may differ at each location.
265,msmarco,_doc,MARCO_6372585,4.5527563,"Reasons for Rules. Establishing a set of household rules helps kids understand which behaviors are acceptable, and which ones are off limits. Rules teach kids how to deal with their emotions and how to treat others with respect. A list of household rules can also help kids understand how rules differ in different environments."
266,msmarco,_doc,MARCO_7191773,4.5527563,"Leonardo da Vinci (1452-1519) himself described sfumato as a blending of colours without lines or borders, in the manner of smoke. It is as if a veil of smoke has been placed between the painting and the viewer, toning down the bright areas and lightening the dark ones, so as to produce a soft, imperceptible transition between the differing tones."
267,msmarco,_doc,MARCO_4284519,4.5508156,", Teacher and author of statistics textbooks and other stuff. 1  Here are two examples of correlations from psychology. 2  Example 1: SAT I scores as predictors of college GPA. < 3 Note that the SATs are undergoing modifications, and correlations for current versions will differ from the ones reported on this web site>."
268,msmarco,_doc,MARCO_8049040,4.5508156,"Rewards Points: 1,092. A hot tub or spa is a seperate definition from a permanently installed pool or in ground pool. They are the only ones required to have a #6 bond. If a hottub requires a #6, then a hydromassage bathtub would as well and as far as I know, they do not. I have heard that a hydromassage differs because it is filled and drained between uses, but can find no reference to that."
269,msmarco,_doc,MARCO_7557470,4.5508156,"1. Gel manicures differ from acrylic ones. Acrylic nails are made with a powder dipped in solvent. They're essentially used to lengthen the nail or provide a stronger top layer over the natural nail, explains Miss Pop. Sometimes they come in colors, but usually they're clear or natural-toned."
270,msmarco,_doc,MARCO_4019313,4.548877,"Mitosis and meiosis are similar processes in that they both result in the separation of existing cells into new ones. They differ, however, in their specific processes as well as in their products. The reason for these differences lies in the difference in the class of cells that each process creates. Mitosis is responsible for reproducing somatic cells and meiosis is responsible for reproducing germ cells."
271,msmarco,_doc,MARCO_5325867,4.548877,"I'd say the flaw in this is that dark siders are the only ones seeking power enough to become that powerful. Craving such power is antithetical to the light side. I'd also say that the light and dark side have differing kinds of power. Dark has a more conventional raw, physical and dominating kind of power. Death, destruction, physical immortality."
272,msmarco,_doc,MARCO_7793552,4.548877,updated may 09 2016 the study of personality is one of the major topics of interest within psychology numerous personality theories exist and most of the major ones fall in to one of four major perspectives each of these perspectives on personality attempts to describe different patterns in personality including how these patterns form and how people differ on an individual level
273,msmarco,_doc,MARCO_2952405,4.5450044,"Cost Accounting Standards. Cost Accounting Standards (popularly known as CAS) are a set of 19 standards and rules promulgated by the United States Government for use in determining costs on negotiated procurements. CAS differs from the Federal Acquisition Regulation (FAR) in that FAR applies to substantially all contractors, whereas CAS applies primarily to the larger ones."
274,msmarco,_doc,MARCO_4852462,4.5450044,"Treatment for a brain tumor differs depending on several factors: a person's age, general health, and the size, location, and type of tumor. You and your loved ones will have many questions about brain cancer, the treatment, side effects, and the long-term outlook. Your health care team is the best source of this information. Don't hesitate to ask."
275,msmarco,_doc,MARCO_6882103,4.5450044,"Most migraine headaches last about 4 hours, but severe ones can last up to a week. How often they happen differs for everyone, but it’s common to get two to four headaches per month. Some people may get migraine headaches every few days, while others get them once or twice a year. Types of Migraine Headaches The terms for two types of migraine headaches refer to the symptoms that signal when one is about to start, called an aura."
276,msmarco,_doc,MARCO_8699010,4.5450044,"Raw Scallop Calories. Because scallops differ in size, they vary in their calorie content. However, a standard 6-ounce serving of raw scallops contains 118 calories, with the majority of these calories coming from protein. A serving of two large scallops, or a serving of 5 small ones contains an average of 21 calories."
277,msmarco,_doc,MARCO_2662012,4.543071,Print PDF. The property that describes a liquid’s thickness or thinness is called viscosity; high viscosity (thick) liquids differ from low-viscosity (thin) ones. You will also use the particle theory to explain some behaviours and properties of fluids—liquids and gases. A fluid is any substance that flows. The particle theory can explain why some substances flow while others do not.
278,msmarco,_doc,MARCO_2196227,4.5415964,"The thickness of sheet metal is commonly specified by a traditional, non-linear measure known as its gauge. The larger the gauge number, the thinner the metal. Commonly used steel sheet metal ranges from 30 gauge to about 7 gauge.Gauge differs between ferrous (iron based) metals and nonferrous metals such as aluminum or copper; copper thickness, for example is measured in ounces (and represents the thickness of 1 ounce of copper rolled out to an area of 1 square foot).he thickness of sheet metal is commonly specified by a traditional, non-linear measure known as its gauge. The larger the gauge number, the thinner the metal. Commonly used steel sheet metal ranges from 30 gauge to about 7 gauge."
279,msmarco,_doc,MARCO_2576374,4.5411396,"Freud's psychoanalytic perspective focuses on unconscious influences. Psychology. The study of personality is one of the major topics of interest within psychology. Numerous personality theories exist and most of the major ones fall in to one of four major perspectives. Each of these perspectives on personality attempts to describe different patterns in personality, including how these patterns form and how people differ on an individual level."
280,msmarco,_doc,MARCO_6524745,4.5411396,Well this goldfish question “How Long Do Goldfish Live” is one I’ve been asked many many times. The lifespan of a goldfish differs greatly as it all depends on how well people take care of their goldfish. If people provide proper goldfish care they should live a long healthy life. The true fact of the matter is that we are the ones truly responsible for how long goldfish live for.
281,msmarco,_doc,MARCO_7677209,4.5411396,"‘But that's not what my interlocutors, particularly the German ones, really want.’ ‘This is the response I wrote to one of my interlocutors in the comments.’ ‘The researchers constructed hypothetical conversations that differed in terms of their interlocutors, place, and topic.’ ‘All of these narratives unfold partly as dialogues with what seem to be sympathetic but ineffectual interlocutors, perhaps lawyers.’ ‘This is why the current engagement between my interlocutors and myself is particularly valuable.’"
282,msmarco,_doc,MARCO_6114398,4.5392103,"Secure the studs to both the top and bottom plates of the wall before you hang the drywall, using a wrench. Ensure they are plumb. Space the metal studs 16 inches apart as measured from the centers of the faces.nce you get the hang of driving the screws, you've met the final challenge. No other aspect of installing drywall on metal studs differs from installing it on wooden ones, including taping and finishing."
283,msmarco,_doc,MARCO_6843291,4.5392103,"Algae: Protists with Chloroplasts. The algae are a polyphyletic and paraphyletic group of organisms. They are defined in differing ways, but are usually considered to be the photosynthetic organisms excepting plants.lgae are distinguished on a number of different characteristics. The most important ones are: 1  the colour of the plastids (more correctly the combination of photosynthetic pigments that are present in the plastid). 2  the presence of flagella (and if so how many, how do they insert in the cell and how do they beat)."
284,msmarco,_doc,MARCO_4156123,4.537282,"You've got coconut, buttercream, vanilla, and sugar. We use macaroon coconut, though. You don't want the consistency to be stringy.. This differs from other Irish potatoes, most notably the handmade kind, in having a longer shelf life due in part to the absence of cream cheese. A lot of these other ones you can only keep for two or three weeks. Because of the cream cheese, you've gotta refrigerate them, Lamparelli says."
285,msmarco,_doc,MARCO_5308010,4.537282,"Dizziness & Nausea in an Ear Infection. Inner ear infections differ from middle ear infections. Middle ear infections are the ones children typically get that affect the eardrum. When you get an ear infection that inflames the inner ear, you can become dizzy and nauseous. Other difficulties connected with inner ear infections are vertigo, balance problems, vision problems and hearing problems."
286,msmarco,_doc,MARCO_4181242,4.5334325,"Railroad police or railway police (called Bahnpolizei in Germany, Austria and the German-speaking parts of Switzerland) are persons responsible for the protection of railroad (or railway) properties, facilities and personnel as well as public rail transit systems. Their exact roles differs from country to country.n the United States and Canada, railroad police are employed by the major Class I railroads, as well as some smaller ones."
287,msmarco,_doc,MARCO_3855887,4.5334325,"Enzymes differ from most other catalysts by being much more specific. Enzyme activity can be affected by other molecules: inhibitors are molecules that decrease enzyme activity, and activators are molecules that increase activity.Many drugs and poisons are enzyme inhibitors.n important function of enzymes is in the digestive systems of animals. Enzymes such as amylases and proteases break down large molecules (starch or proteins, respectively) into smaller ones, so they can be absorbed by the intestines."
288,msmarco,_doc,MARCO_5809560,4.5334325,"Best Answer: Bigotry is when somebody thinks that all their own personal beliefs are the only right ones and no one else's counts. When someone is totally devoted to his own prejudies especially when one regards or treats the members of a different group with hatred and intolerance. bigot is a person who is intolerant of opinions, lifestyles or identities differing from his or her own. richard dawkins is not a racist either. jesse jackson is a racist. sixteenfire · 7 years ago. Thumbs up. 1. Thumbs down."
289,msmarco,_doc,MARCO_7560037,4.5334325,"Personally, I beg to differ with this revered tome of culinary knowledge. Firstly, because I believe the people in question prefer “Roma” or “Romani” to “gypsy,” and second in that the Roma people aren’t the only ones who eat hedgehogs. Hedgehogs are delicious, and everyone should try them at least once…even vegetarians can fall in love with their tender flesh and rich buttery flavor."
290,msmarco,_doc,MARCO_1760038,4.5303774,"10,804 Contributions. Pacific Time is 3 hours behind Eastern Time. Eastern Time is 3 hours ahead of Pacific Time. The mainland U.S. has four time zones (Alaska and Hawaii each have their own time z … ones, which makes a total of 6 different time zones for the U.S.).From west to east, the mainland U.S.'s time zones are: Pacific Time, Mountain Time, Central Time and Eastern Time.Each is one hour later than the last.astern Time is 3 hours ahead of Pacific Time. The mainland U.S. has four time zones (Alaska and Hawaii each have their own time z … ones, which makes a total of 6 different time zones for the U.S.)."
291,msmarco,_doc,MARCO_649950,4.5295897,"Marble countertops differ from granite and quartz in their pricing. Marble countertops are the least expensive option. These countertops are known for their exceptional heat resistance. However, they are more porous than granite or quartz and are more prone to stains and scratches. This means that you should be careful when placing glasses on marble, especially ones containing juice, wine or coffee. Foods and liquids that contain acidic substances can dull the polish and ruin your countertop."
292,msmarco,_doc,MARCO_2491940,4.5295897,"Edit Page Last Edit: 6 months ago. Bloodborne differs from past Souls games in that Weapons can shape the course of Character Origins, and the ones you use and master will define what kind of hunter you area.ighting enemies is more fast paced in Bloodborne than it is in any of the other Souls game. One thing Bloodborne adds to the combat aside from speed is a new kind of weapon, one that can change mid-battle, that can affect the way you use it and the way it effects enemies."
293,msmarco,_doc,MARCO_1632425,4.5295897,"Declare an Impasse During the Collective Bargaining Process Key Points. An impasse is determined when the employer and union reach a point during the collective bargaining process when both parties are reasonable in assuming that further negotiations would be pointless. Once the employer reaches an impasse, it is permitted to implement changes to the terms and conditions of employment that are consistent with the previous proposals to the unions. However, an employer cannot offer greater benefits or ones that differ than those presented during negotiations."
294,msmarco,_doc,MARCO_1064922,4.5295897,"Angiogenesis by normal endothelial cells and metastasis by tumor cells are functionally similar but differ in their regulation. A group of coordinated cellular processes is responsible for metastasis. Furthermore, it is now clear that negative regulatory processes may be just as important as positive ones. Some genetic changes result in an imbalance of growth regulation, leading to uncontrolled proliferation. However, unrestrained growth does not, by itself, result in invasion and metastasis. The latter phenotype may therefore require additional genetic changes."
295,msmarco,_doc,MARCO_5107317,4.5295897,"Surprisingly, most states don't have any minimum age requirements. The ones that do range from age 6 (a recommendation in Kansas) to 14 (required in Illinois). The most common ages, among the states that have a recommendation or legal requirement, are age 8, 10, and 12. Note that city and county laws within each state might also differ. Also, even if there aren't any laws for home alone children in your area, basic guidelines can help you decide if your kid is ready:"
296,msmarco,_doc,MARCO_6365262,4.5295897,"This differs from other Irish potatoes, most notably the handmade kind, in having a longer shelf life due in part to the absence of cream cheese. A lot of these other ones you can only keep for two or three weeks. Because of the cream cheese, you've gotta refrigerate them, Lamparelli says. His recipe calls for the blended mixture to be wrapped in Korjinte cinnamon, after which they last unrefrigerated for up to six months. They never actually last that long, though, Lamparelli tells me with a smile."
297,msmarco,_doc,MARCO_1034489,4.5290184,"An Entity Relationship Diagram shows entities (tables) in a database and relationships between tables within that database. For a good database design it is essential to have an Entity Relationship Diagram. You can design or model your database visually before you write a single line of database code.You draw entities (tables), add attributes (columns) and create relationships between those entities. When you are ready with the data model, DeZign for Databases generates the database you designed.DeZign for Databases can generate the SQL to create the database or it can generate the database directly.ou draw entities (tables), add attributes (columns) and create relationships between those entities. When you are ready with the data model, DeZign for Databases generates the database you designed. DeZign for Databases can generate the SQL to create the database or it can generate the database directly."
298,msmarco,_doc,MARCO_2405363,4.525755,"You also can check your computer's manual or the manufacturer's website for the specific key used to access the BIOS. If holding the key does not work, you can try rapidly tapping the key while the startup screen is displayed.You can also hold down the space bar during the startup process.he good news is all you have to do is press and hold down a specific key on your keyboard. The bad news is that there is no standard key and it differs depending on the manufacturer of your computer. While there is no universal key used to access the BIOS, below are some of the most common ones:"
299,msmarco,_doc,MARCO_3777211,4.525755,"After completing this module, participants will be able to describe the characteristics of the regulated industry, the processes used, and manufacturing principles related to the meat industry. INTRODUCTION. The purpose of this module is to give you a brief introduction to the meat industry.ach plant is unique, and the production processes used by plants in your assignment are likely to differ in detail from the ones we present in this module. There are a wide variety of products produced and a number of different activities conducted by regulated establishments."
