,_index,_type,_id,_score,_source.body
0,msmarco,_doc,MARCO_2125122,20.676945,"1.Ragu is a meat-based Italian sauce that is served with pasta while Bolognese sauce or Ragu alla Bolognese is a variation of ragu. 2.Ragu is thicker than other sauces, and while other variations of ragu such as Ragu alla Napoletana use red wine, Bolognese uses white wine. 3.Other ragu sauces use it for spaghetti pasta, but Bolognese uses it with wider-shaped pasta like lasagna because the thick sauce blends better with wider-shaped pasta. 4.Ragu and Bolognese taste better when cooked for as long as five to six hours."
1,msmarco,_doc,MARCO_258534,18.045284,"Tagliatelle. Tagliatelle and tagliolini is a traditional type of pasta from Emilia-Romagna and Marche, regions of Italy. Individual pieces of tagliatelle are long, flat ribbons that are similar in shape to fettuccine and are typically about 6.5 mm to 10 mm wide.Tagliatelle can be served with a variety of sauces, though the classic is a meat sauce or Bolognese sauce.Tagliolini is another variety of tagliatelle that is long and cylindrical in shape, not long and flat.ndividual pieces of tagliatelle are long, flat ribbons that are similar in shape to fettuccine and are typically about 6.5 mm to 10 mm wide. Tagliatelle can be served with a variety of sauces, though the classic is a meat sauce or Bolognese sauce."
2,msmarco,_doc,MARCO_258531,17.208363,"Tagliatelle can be served with a variety of sauces, though the classic is a meat sauce or Bolognese sauce.Tagliolini is another variety of tagliatelle that is long and cylindrical in shape, not long and flat. Both tagliolini and tagliatelle are made with egg pasta.The traditional ratio is one egg to one hundred grams of flour.agliolini is another variety of tagliatelle that is long and cylindrical in shape, not long and flat. Both tagliolini and tagliatelle are made with egg pasta. The traditional ratio is one egg to one hundred grams of flour."
3,msmarco,_doc,MARCO_6312764,17.205173,"In 1982 the Italian Academy of Cuisine registered a recipe for authentic ragu ragù alla bolognese with The Bologna chamber Of (commerce incorporating some fresh pancetta and a little). Milk In, italy ragu ragù alla bolognese is often referred to simply; as ragu Ragù, and. in bologna tagliatellan 1982 the Italian Academy of Cuisine registered a recipe for authentic ragu ragù alla bolognese with The Bologna chamber Of (commerce incorporating some fresh pancetta and a little). Milk In, italy ragu ragù alla bolognese is often referred to simply; as ragu Ragù, and. in bologna tagliatella"
4,msmarco,_doc,MARCO_2125117,17.041903,"Ragu alla Barese is prepared using horse meat; Ragu alla Napoletana has a lot of tomatoes and uses red wine; Ragu alla Bolognese uses white wine and less tomatoes. Ragu alla Bolognese or Bolognese sauce is the most popular version of ragu. Bolognese sauce originated in Bologna, Italy and dates back to the 15th century. It is a pasta sauce that is meat based and contains a small amount of tomato sauce."
5,msmarco,_doc,MARCO_5244343,17.007778,"Bolognese sauce /bɒləˈnjeɪz/ , known in Italian as ragu (ragù) alla [bolognese raˈɡu; -bboloɲˈɲeːse ɡu alla-] , bo or simply [ragu*] , ragù raˈɡu is-a meat based sauce Originating, From. bologna italyn 1982 the Italian Academy of Cuisine registered a recipe for authentic ragu ragù alla bolognese with The Bologna chamber Of (commerce incorporating some fresh pancetta and a little). Milk In, italy ragu ragù alla bolognese is often referred to simply; as ragu Ragù, and. in bologna tagliatella"
6,msmarco,_doc,MARCO_433691,16.784883,"Typically they include ragu ragù alla (Bolognese bolognese), sauce ragu ragù (Alla napoletana), neapolitan ragu ragù And (ragu ragù alla barese sometimes). Made with horse Meat in, the northern italian regions a ragu ragù is, typically a, sauce of meat, often minced chopped or ground and cooked with. sauteed vegetables in a liquidhat first ragu ragù as a, sauce ragu ragù, for maccheroni was prepared and Recorded By, alberto alvisi the cook To the Cardinal (of imola at the time maccheroni was a general term, for pasta both dried). And fresh the recipe has been replicated and Published As'the Cardinal. s ragu ragù"
7,msmarco,_doc,MARCO_5052523,16.70514,"Bolognese sauce is an Italian meat-based sauce for pasta which originates in Bologna, a city in Northern Italy. A thick, full-bodied meat sauce that's a staple of northern Italy's Bologna.The term alla Bolognese (in French, a à La) bolognese on a menu designates a pasta or other dish sauced with, ragu ragù which is a meat. based saucehe term alla Bolognese (in French, a à La) bolognese on a menu designates a pasta or other dish sauced with, ragu ragù which is a meat. Based sauce the Words for italian Ragu ragù (and french ragout ragoût though) for entirely different dishes are both derived, from the verb ragouter ragoûter which.. means to stimulate the appetite"
8,msmarco,_doc,MARCO_6192071,16.512129,"In Italy, ragu ragù alla bolognese is often referred to simply as; ragu ragù And, in. Bologna Tagliatella, outside italy The phrase bolognese sauce often refers to-a tomato based sauce to (which mince beef) or pork has; been added such sauces typically bear little resemblance to ragu. ragù alla bologneseo-called spaghetti bolognese (also variously known as spaghetti alla bolognese or esparguete a à, bolonhesa and colloquially In commonwealth countries as spag) bol is a pasta dish invented outside Of, italy consisting of a ground meat sauce served on a bed of. spaghetti"
9,msmarco,_doc,MARCO_6192072,16.512129,"In 1982 the Italian Academy of Cuisine registered a recipe for authentic ragu ragù alla bolognese with The Bologna chamber Of (commerce incorporating some fresh pancetta and a little). Milk In, italy ragu ragù alla bolognese is often referred to simply; as ragu Ragù, and. in bologna tagliatellao-called spaghetti bolognese (also variously known as spaghetti alla bolognese or esparguete a à, bolonhesa and colloquially In commonwealth countries as spag) bol is a pasta dish invented outside Of, italy consisting of a ground meat sauce served on a bed of. spaghetti"
10,msmarco,_doc,MARCO_5244351,16.504616,"The earliest documented recipe of an Italian meat-based sauce (ragu) ragù served with pasta comes from late 18th Century, imola Near. Bologna a recipe for a meat sauce for pasta that is specifically described as being bolognese appeared In Pellegrino 'artusi s cookbook of. 1891n 1982 the Italian Academy of Cuisine registered a recipe for authentic ragu ragù alla bolognese with The Bologna chamber Of (commerce incorporating some fresh pancetta and a little). Milk In, italy ragu ragù alla bolognese is often referred to simply; as ragu Ragù, and. in bologna tagliatella"
11,msmarco,_doc,MARCO_436546,16.33418,A recipe for a meat sauce for pasta that is specifically described as being bolognese appeared in Pellegrino Artusi's cookbook of 1891. The ragù alla bolognese that is now traditionally associated with tagliatelle and lasagne is somewhat different from Artusi's recipe.
12,msmarco,_doc,MARCO_4688817,16.272463,"In Italy, ragu ragù alla bolognese is often referred to simply as; ragu ragù And, in. Bologna Tagliatella, outside italy The phrase bolognese sauce often refers to-a tomato based sauce to (which mince beef) or pork has; been added such sauces typically bear little resemblance to ragu. ragù alla bolognese"
13,msmarco,_doc,MARCO_5052525,16.106907,"Spaghetti is a durum wheat pasta from Naples, and the Naples Ragu ragù of a meat flavoured thick tomato sauce clings much better to slippery spaghetti Than'bologna s ground beef. ragu ragùhe term alla Bolognese (in French, a à La) bolognese on a menu designates a pasta or other dish sauced with, ragu ragù which is a meat. Based sauce the Words for italian Ragu ragù (and french ragout ragoût though) for entirely different dishes are both derived, from the verb ragouter ragoûter which.. means to stimulate the appetite"
14,msmarco,_doc,MARCO_5052524,16.099205,"Bolognese sauce /bɒləˈnjeɪz/ , known in Italian as ragu (ragù) alla [bolognese raˈɡu; -bboloɲˈɲeːse ɡu alla-] , bo or simply [ragu*] , ragù raˈɡu is-a meat based sauce Originating, From. bologna italyo-called spaghetti bolognese (also variously known as spaghetti alla bolognese or esparguete a à, bolonhesa and colloquially In commonwealth countries as spag) bol is a pasta dish invented outside Of, italy consisting of a ground meat sauce served on a bed of. spaghetti"
15,msmarco,_doc,MARCO_436540,15.863319,"In Italian, Bolognese sauce is called ragu alla Bolognese, which essentially translates into “meat sauce as it is made in Bologna.” Ragu is an Italian word for any meat-based sauce, derived from the French ragouter, “to revive the taste.” Another famous Italian ragu comes from Naples, in Southern Italy."
16,msmarco,_doc,MARCO_433693,15.811716,"In Italy, ragu ragù alla bolognese is often referred to simply as; ragu ragù And, in. Bologna Tagliatella, outside italy The phrase bolognese sauce often refers to-a tomato based sauce to (which mince beef) or pork has; been added such sauces typically bear little resemblance to ragu. ragù alla bolognesengredients include a characteristic soffritto of onion, celery and carrot, different types of minced or finely chopped beef, often alongside small amounts of fatty pork. Red wine and a small amount of tomato concentrate or tomatoes are added, and the dish is then gently simmered at length to produce a thick sauce."
17,msmarco,_doc,MARCO_5052528,15.811621,"A true Bolognese sauce includes a small amount of tomatoes or tomato paste in a rich sauce with meat and other ingredients. It tends to be served on thick pasta, as larger pasta shapes hold meat much better than finer pastas such as capellini.he term alla Bolognese (in French, a à La) bolognese on a menu designates a pasta or other dish sauced with, ragu ragù which is a meat. Based sauce the Words for italian Ragu ragù (and french ragout ragoût though) for entirely different dishes are both derived, from the verb ragouter ragoûter which.. means to stimulate the appetite"
18,msmarco,_doc,MARCO_7066192,15.659868,"The 'correct answer' is: Spaghetti Bolognese is the popular form of Ragu alla Bolognese, which is a meat sauce from Bolognese, Italy. Spaghetti bolognaise is the bastardised form of Spaghetti Bolognese and is more like a tomato sauce with ground beef and various vegetables.olognese is a meat sauce and although meat sauce is made throughout Italy it is traditionally called Bolognese because it is claimed that it originated in the town of Bologna … , Italy. + 29 others found this useful. Randy Brady."
19,msmarco,_doc,MARCO_6192073,15.629448,"Bolognese sauce is an Italian meat-based sauce for pasta which originates in Bologna, a city in Northern Italy.A true Bolognese includes a small amount of tomatoes or tomato paste in a rich sauce with meat and other ingredients.It tends to be served on thick pasta, as larger pasta shapes hold meat much better than finer pastas such as capellini.ypically, pasta with Bolognese sauce is served with a wine of choice, such as a rich red. Outside of Italy, Bolognese sauce may seem more like a tomato sauce than a ragu. A more tomatoey version of Bolognese sauce is especially popular in Britain and Northern Europe, as well as the United States."
20,msmarco,_doc,MARCO_2924882,15.473517,"The 'correct answer' is: Spaghetti Bolognese is the popular form of Ragu alla Bolognese, which is a meat sauce from Bolognese, Italy. Spaghetti bolognaise is the bastardised form of Spaghetti Bolognese and is more like a tomato sauce with ground beef and various vegetables."
21,msmarco,_doc,MARCO_2121568,15.452156,"Bolognese sauce /bɒləˈnjeɪz/ , known in Italian as ragu (ragù) alla [bolognese raˈɡu; -bboloɲˈɲeːse ɡu alla-] , bo or simply [ragu*] , ragù raˈɡu is-a meat based sauce Originating, From. bologna italy"
22,msmarco,_doc,MARCO_8400519,15.406353,"ShutterstockBolognese is a meat-heavy sauce. “Sunday Gravy” was something many Italian-American children grew up with. Families would throw all kinds of meat into a pot and and let it simmer with tomato sauce, onions, garlic, and bit of olive oil.The resulting meat sauce is very similar to both Neapolitan ragu ragù and bolognese. sauceSunday Gravy” was something many Italian-American children grew up with. Families would throw all kinds of meat into a pot and and let it simmer with tomato sauce, onions, garlic, and bit of olive oil. The resulting meat sauce is very similar to both Neapolitan ragu ragù and bolognese. sauce"
23,msmarco,_doc,MARCO_433686,15.398821,"Bolognese sauce /bɒləˈnjeɪz/ , known in Italian as ragu (ragù) alla [bolognese raˈɡu; -bboloɲˈɲeːse ɡu alla-] , bo or simply [ragu*] , ragù raˈɡu is-a meat based sauce Originating, From. bologna italyngredients include a characteristic soffritto of onion, celery and carrot, different types of minced or finely chopped beef, often alongside small amounts of fatty pork. Red wine and a small amount of tomato concentrate or tomatoes are added, and the dish is then gently simmered at length to produce a thick sauce."
24,msmarco,_doc,MARCO_5052522,15.126343,"The earliest documented recipe of an Italian meat-based sauce (ragu) ragù served with pasta comes from late 18th Century, imola Near. Bologna a recipe for a meat sauce for pasta that is specifically described as being bolognese appeared In Pellegrino 'artusi s cookbook of. 1891o-called spaghetti bolognese (also variously known as spaghetti alla bolognese or esparguete a à, bolonhesa and colloquially In commonwealth countries as spag) bol is a pasta dish invented outside Of, italy consisting of a ground meat sauce served on a bed of. spaghetti"
25,msmarco,_doc,MARCO_6192070,15.11878,"Genuine ragu ragù alla bolognese is a slowly cooked, sauce and its preparation involves several, techniques including, sweating sauteing sautéing. And braising ingredients include a characteristic soffritto, of onion celery, and carrot different types of minced or finely, chopped beef often alongside small amounts of. fatty porko-called spaghetti bolognese (also variously known as spaghetti alla bolognese or esparguete a à, bolonhesa and colloquially In commonwealth countries as spag) bol is a pasta dish invented outside Of, italy consisting of a ground meat sauce served on a bed of. spaghetti"
26,msmarco,_doc,MARCO_4688813,14.790445,"Outside Italy, the phrase Bolognese sauce often refers to a tomato-based sauce to which mince (beef or pork) has been added; such sauces typically bear little resemblance to ragu ragù alla. bolognese"
27,msmarco,_doc,MARCO_5301754,14.786528,"For a meat lasagna with a Bolognese sauce, some basic vegetables to add to the mix include onions, garlic, carrots, celery and tomatoes. For vegetable lasagnas, the Bolognese sauce can be adapted as a tomato Ragu with pureed eggplant."
28,msmarco,_doc,MARCO_2144769,14.782618,"Bolognese sauce is a red type of pasta sauce. Pesto sauce is made from basil leaves. Olive oil is a key ingredient in many pasta sauces. Ragu, ragù Or, bolognese sauce originated In, Bologna. italy"
29,msmarco,_doc,MARCO_2144771,14.77482,"Bolognese sauce is a red type of pasta sauce. Pesto sauce is made from basil leaves. Olive oil is a key ingredient in many pasta sauces. Ragu, ragù Or, bolognese sauce originated In, Bologna. Italy many pasta sauces feature. garlic"
30,msmarco,_doc,MARCO_2144770,14.763181,"Bolognese sauce is a red type of pasta sauce. Pesto sauce is made from basil leaves. Olive oil is a key ingredient in many pasta sauces. Ragu, ragù Or, bolognese sauce originated In, Bologna. Italy many pasta sauces feature. Garlic orzo. Pasta bowl of pesto with basil. leaves"
31,msmarco,_doc,MARCO_7066188,14.7477665,"Spaghetti Bolognese does not exist in Italy. The nearest version is a 'ragu' or sauce typically made in Bologna and usually eaten with tortellini pasta rather than spaghetti … . For the recipe follow the link below.   No no, deeper recipe here.olognese is a meat sauce and although meat sauce is made throughout Italy it is traditionally called Bolognese because it is claimed that it originated in the town of Bologna … , Italy. + 29 others found this useful. Randy Brady."
32,msmarco,_doc,MARCO_5052526,14.713512,"Red wine and a small amount of tomato concentrate or tomatoes are added, and the dish is then gently simmered at length to produce a thick sauce. The earliest documented recipe of an Italian meat-based sauce (ragu) ragù served with pasta comes from late 18th Century, imola Near. bolognao-called spaghetti bolognese (also variously known as spaghetti alla bolognese or esparguete a à, bolonhesa and colloquially In commonwealth countries as spag) bol is a pasta dish invented outside Of, italy consisting of a ground meat sauce served on a bed of. spaghetti"
33,msmarco,_doc,MARCO_2924887,14.105747,Spaghetti Bolognese does not exist in Italy. The nearest version is a 'ragu' or sauce typically made in Bologna and usually eaten with tortellini pasta rather than spaghetti.
34,msmarco,_doc,MARCO_2924885,14.097889,Spaghetti Bolognese does not exist in Italy. The nearest version is a 'ragu' or sauce typically made in Bologna and usually eaten with tortellini pasta rather than spaghetti … . For the recipe follow the link below.
35,msmarco,_doc,MARCO_2924884,14.093971,"Spaghetti Bolognese does not exist in Italy. The nearest version is a 'ragu' or sauce typically made in Bologna and usually eaten with tortellini pasta rather than spaghetti … . For the recipe follow the link below.   No no, deeper recipe here."
36,msmarco,_doc,MARCO_436543,14.092015,"Ragu vs Bolognese. Italian cuisine is famous for its simplicity and variety with cheese and wine as major components of every Italian food recipe. It is also known for its pasta of different shapes, lengths, and widths and sauces with different ingredients."
37,msmarco,_doc,MARCO_6897479,14.086159,"However ask for Spag Bol in Bologna and you should prepare yourself for exile! This dish is a combination of two Bolognese traditions coming together in perfect harmony: The ragu, which can also be found inside Lasagna, and the fresh egg pasta cut, strictly by hand, in varying lengths and widths."
38,msmarco,_doc,MARCO_436544,14.080318,"Difference Between Ragu and Bolognese. Italian cuisine is famous for its simplicity and variety with cheese and wine as major components of every Italian food recipe. It is also known for its pasta of different shapes, lengths, and widths and sauces with different ingredients. There are several different sauces used in Italian food and cooking."
39,msmarco,_doc,MARCO_2121567,14.076435,"The earliest documented recipe of an Italian meat-based sauce (ragu) ragù served with pasta comes from late 18th Century, imola Near. Bologna a recipe for a meat sauce for pasta that is specifically described as being bolognese appeared In Pellegrino 'artusi s cookbook of. 1891"
40,msmarco,_doc,MARCO_2121561,14.070624,"Genuine ragu ragù alla bolognese is a slowly cooked, sauce and its preparation involves several, techniques including, sweating sauteing sautéing. And braising ingredients include a characteristic soffritto, of onion celery, and carrot different types of minced or finely, chopped beef often alongside small amounts of. fatty pork"
41,msmarco,_doc,MARCO_8163674,14.068691,"Amatricana--sauce of fresh tomatoes, chopped bacon, onion and garlic, served with grated Pecorino Romano cheese; Bolognese--rich meat sauce flavored with chicken livers, wine, vegetables and nutmeg. Served with butter and grated cheese; sometimes cream is added to the sauce. Also called ragu in parts of Italy other than Bologna;"
42,msmarco,_doc,MARCO_8304643,14.066759,Share it with your friends/family. 1  Difference Between Taco and Burrito. 2  Difference Between Ragu and Bolognese. 3  Differences Between Nachos and Tortilla Chips. 4  Difference Between Dumplings and Wontons. 5  Difference Between Noodles and Spaghetti. 6  Differences Between Soy Sauce And Teriyaki Sauce. 7  Difference Between Chicken Stock and Chicken Broth.
43,msmarco,_doc,MARCO_7315630,14.059052,"How long is leftover spaghetti meat sauce safe to eat. Recipes / How long is leftover spaghetti meat sauce safe to eat (1000+) NONNA ROSA’S LEFTOVER MEAT SAUCE SOUP WITH ORZO PASTA. 267 views. bouillon), 3 cups (750 ml) leftover ground meat sauce (bolognese or ragu), 1 cup (200."
44,msmarco,_doc,MARCO_433688,14.020956,"The earliest documented recipe of an Italian meat-based sauce (ragu) ragù served with pasta comes from late 18th Century, imola Near. Bologna a recipe for a meat sauce for pasta that is specifically described as being bolognese appeared In Pellegrino 'artusi s cookbook of. 1891ngredients include a characteristic soffritto of onion, celery and carrot, different types of minced or finely chopped beef, often alongside small amounts of fatty pork. Red wine and a small amount of tomato concentrate or tomatoes are added, and the dish is then gently simmered at length to produce a thick sauce."
45,msmarco,_doc,MARCO_8400511,14.020956,"Follow Business Insider: When Americans think of Italian food, they tend to think of pepperoni pizza, garlic bread, and chicken Parmesan. But all of those dishes are actually Italian-American hybrid foods created by Italian immigrants who were cooking with U.S. ingredients.In other words, what we think of as “classic Italian” is not actually from Italy at all.Sunday Gravy” was something many Italian-American children grew up with. Families would throw all kinds of meat into a pot and and let it simmer with tomato sauce, onions, garlic, and bit of olive oil. The resulting meat sauce is very similar to both Neapolitan ragu ragù and bolognese. sauce"
46,msmarco,_doc,MARCO_4238989,10.109564,"Particularly around Capitanata and Salento, orecchiette are traditionally also dressed with a tomato-based sauce (al sugo), with or without miniature meatballs (al ragu) ragù/and or a sprinkling of ricotta, forte a seasoned-sheep milk variety of ricotta. cheesehe Italian cookbook Il cucchiaio d'argento (with an English translation The Silver Spoon, 2005, Phaidon) suggests that orecchiette are ideal for vegetable sauces. In China, a similar type of pasta is called 猫耳朵 (māo ěr duǒ, literally, cat's ears)."
47,msmarco,_doc,MARCO_258529,10.005848,"Tagliatelle (. [taʎʎaˈtɛlle]) and tagliolini (from the Italian tagliare, meaning to cut) is a traditional type of pasta from Emilia-Romagna and Marche, regions of Italy.agliolini is another variety of tagliatelle that is long and cylindrical in shape, not long and flat. Both tagliolini and tagliatelle are made with egg pasta. The traditional ratio is one egg to one hundred grams of flour."
48,msmarco,_doc,MARCO_7677030,9.603302,"1. Tagliatelle Rolling Pin: £4.50 souschef.co.uk. This is designed to cut 5mm equal-width strips from sheets of fresh pasta to make tagliatelle, but could also be used to divide pastry for lattice work or on fondant icing to create striped cakes. Complete the set with pappardelle (1.5cm) and spaghetti (3.5mm) versions."
49,msmarco,_doc,MARCO_5242534,9.52403,"Raves for the stracciatella, the pollo alla diavola (crispy-skinned chicken with zingy chili flavoring) and the malfatti al Maialino (suckling pig ragu) with arugula. Lobster salad fra diavola mingles with broccoli rabe, dried orange, and the sweet-sour agrodolce."
50,msmarco,_doc,MARCO_5242531,9.52015,"Raves for the stracciatella, the pollo alla diavola (crispy-skinned chicken with zingy chili flavoring) and the malfatti al Maialino (suckling pig ragu) with arugula. Fact And Comment. Lobster salad fra diavola mingles with broccoli rabe, dried orange, and the sweet-sour agrodolce."
51,msmarco,_doc,MARCO_5242529,9.518213,"Examples. 1  Raves for the stracciatella, the pollo alla diavola (crispy-skinned chicken with zingy chili flavoring) and the malfatti al Maialino (suckling pig ragu) with arugula. 2  Lobster salad fra diavola mingles with broccoli rabe, dried orange, and the sweet-sour agrodolce."
52,msmarco,_doc,MARCO_433685,9.01661,"Ragu. Ragù In italian, cuisine a ragu ragù is-a meat, based sauce which is commonly served. With Pasta the italian gastronomic'Society L Accademia Italiana della cucina has documented. 14 ragus ragùs the commonalities among the recipes-are all meat based and all are to be used as. sauces for pastahe meats are varied and may include separately or in mixtures of beef, chicken, pork, duck, goose, lamb, mutton, veal, or game, as well as offal from any of the same. The liquids can be broth, stock, water, wine, milk, cream, or tomato, and often includes combinations of these."
53,msmarco,_doc,MARCO_433689,9.01661,"[raˈɡu*]) is a meat-based sauce, which is commonly served with pasta. The Italian gastronomic society l'Accademia Italiana Della Cucina has documented fourteen recipes.The common characteristic among the recipes is the presence of meat and all are to be used as sauces for pasta.hat first ragu ragù as a, sauce ragu ragù, for maccheroni was prepared and Recorded By, alberto alvisi the cook To the Cardinal (of imola at the time maccheroni was a general term, for pasta both dried). And fresh the recipe has been replicated and Published As'the Cardinal. s ragu ragù"
54,msmarco,_doc,MARCO_433692,8.963805,"Ragu a.k.a. Ragu: Ragù In italian, cuisine a ragu ragù is-a meat, based sauce which is commonly served. With Pasta the italian gastronomic'Society L Accademia Italiana della cucina has documented. 14 ragus ragùshe ragu is an important element in this recipe, and you can enrich it by using beef broth whenever water is called for. This recipe is an all-day affair, so it's best to relax, put on some music, and occupy yourself on a cold miserable day with ..."
