,_index,_type,_id,_score,_source.body
752,msmarco,_doc,MARCO_5854201,3.8300152,"average speed Chattanooga,TN-Huntsville,AL driving time Chattanooga,TN-Huntsville,AL recommended break Chattanooga,TN-Huntsville,AL fuel consumption Chattanooga,TN-Huntsville,AL fuel price Chattanooga,TN-Huntsville,AL. Adjustment of fuel consumption and fuel price for Chattanooga,TN-Huntsville,AL. You can modify the values ​​corresponding to the average consumption value of your vehicle, fuel prices could be as well modified with any desired value."
753,msmarco,_doc,MARCO_5568376,3.8300152,"1 mol N 2 In the equation below, how many moles of Aluminum are needed to form 3.7 moles of Al 2 O 3? 4Al + 3O 2 → 2Al 2 O 3 Work from moles of Al 2 O 3 to? mol 3.7 mol moles of Al. Use dimensional analysis and begin with the number you were 3.7 mol Al 2 O 3 4 mol Al = 7.4 mol Al given in the problem."
754,msmarco,_doc,MARCO_332437,3.828116,"Wahhabi Islam has been called the predominant feature of Saudi culture. Saudi Arabia is sometimes called the Land of the Two Holy Mosques in reference to Al-Masjid al-Haram (in Mecca), and Al-Masjid an-Nabawi (in Medina), the two holiest places in Islam.ahhabi Islam has been called the predominant feature of Saudi culture. Saudi Arabia is sometimes called the Land of the Two Holy Mosques in reference to Al-Masjid al-Haram (in Mecca), and Al-Masjid an-Nabawi (in Medina), the two holiest places in Islam."
755,msmarco,_doc,MARCO_8106729,3.828116,"References. 1  Garcia M, Jamal A, Ward EM, et al. 2  Castellsague X, Diaz M, de Sanjose S, et al. 3  Garland SM, Hernandez-Avila M, Wheeler CM, et al. 4  Paavonen J, Jenkins D, Bosch FX, et al. 5  Winer RL, Lee SK, Hughes JP, et al. 6  Munoz N, Bosch FX, de Sanjose S, et al. 7  ACOG Practice Bulletin."
756,msmarco,_doc,MARCO_1404596,3.82622,"In the Middle East on the beautiful Arabian Gulf. The UAE is made up of seven different emirates, Abu Dhabi, Ajman, Dubai, Fujairah, Ras Al Khaimah, Sharjah and Umm Al Quwain, with Abu Dhabi the largest.Burj Al Arab at sunset.n the Middle East on the beautiful Arabian Gulf. The UAE is made up of seven different emirates, Abu Dhabi, Ajman, Dubai, Fujairah, Ras Al Khaimah, Sharjah and Umm Al Quwain, with Abu Dhabi the largest. Burj Al Arab at sunset."
757,msmarco,_doc,MARCO_3618906,3.82622,"Rear Admiral Albert 'Al' Calavicci is the project observer at Quantum Leap, who appears to Samuel Beckett as a hologram. The part of Al is played by veteran stage and film/TV actor Dean Stockwell, who won a Golden Globe Award in 1990 for his supporting role as Al. Al Calavicci was born June 15, 1934. His father worked in construction and was of Italian descent and his mother was of Russian heritage. Al had a younger sister named Trudy, who suffered from Downs syndrome. Al also had an uncle named Stawpah, who was a coal miner."
758,msmarco,_doc,MARCO_5725200,3.82622,"Eid-al-Fitr (Eid al-Fitr, Eid ul-Fitr, Id-Ul-Fitr, Eid) is the first day of the Islamic month of Shawwal. It marks the end of Ramadan, which is a month of fasting and prayer. Many Muslims attend communal prayers, listen to a khutba (sermon) and give zakat al-fitr (charity in the form of food) during Eid al-Fitr. Many Muslims dress in fine clothing and children receive gifts on Eid al-Fitr. Many Muslims dress in fine clothing and children receive gifts on Eid al-Fitr."
759,msmarco,_doc,MARCO_7375057,3.82622,"Next, hold the &quot;AL&quot; button and press the &quot;MINUTE&quot; button to set the minute, release the &quot;AL&quot; button when you are finished. You may press the &quot;AL&quot; button to view the current alarm time setting.ext, hold the &quot;AL&quot; button and press the &quot;MINUTE&quot; button to set the minute, release the &quot;AL&quot; button when you are finished. You may press the &quot;AL&quot; button to view the current alarm time setting."
760,msmarco,_doc,MARCO_7491332,3.82622,"Address Phone Number; Emergency: Birmingham, AL: 911: Non-Emergency: Birmingham, AL: 205-328-9311: Community Services: Birmingham, AL . 205-933-4175: Crimestoppers: 2200 8th Avenue North Birmingham, AL 35203: 205-254-7777: Central Headquarters: 1710 1st Avenue North Birmingham, AL 35203: 205-254-1700: City Jail: 425 6th Avenue South Birmingham, AL 35205: 205-254-6369: North Precinct"
761,msmarco,_doc,MARCO_3672186,3.8224394,"* Together with No. 2, Briggs et al. v. Elliott et al., on appeal from the United States District Court for the Eastern District of South Carolina, argued December 9-10, 1952, reargued December 7-8, 1953; No. 4, Davis et al. v. County School Board of Prince Edward County, Virginia, et al., on appeal from the United States District Court for the Eastern District of Virginia, argued December 10, 1952, reargued December 7-8, 1953, and No. 10, Gebhart et al. v. Belton et al., on certiorari to ..."
762,msmarco,_doc,MARCO_1218285,3.8224394,"The total value of the letters of Bismillah al-Rahman al-Rahim, according to the standard Abjadi system of numerology, is 786. This number has therefore acquired a significance in folk Islam and Near Eastern folk magic.A recommendation of reciting the basmala 786 times in sequence is recorded in Al-Buni.he total value of the letters of Bismillah al-Rahman al-Rahim, according to the standard Abjadi system of numerology, is 786. This number has therefore acquired a significance in folk Islam and Near Eastern folk magic. A recommendation of reciting the basmala 786 times in sequence is recorded in Al-Buni."
763,msmarco,_doc,MARCO_3207006,3.8224394,"Family [edit]. Al-Gilani was born around 1077 in Persia. Al-Gilani's father, Abu Salih Musa al-Hasani, was a descendant of Hasan ibn Ali, (Imam Hasan). Hasan was the eldest son of Ali and Fatimah.Ali was Muhammad 's son-in-law and also cousin and Fatima was Muhammad 's daughter.amily [edit]. Al-Gilani was born around 1077 in Persia. Al-Gilani's father, Abu Salih Musa al-Hasani, was a descendant of Hasan ibn Ali, (Imam Hasan). Hasan was the eldest son of Ali and Fatimah."
764,msmarco,_doc,MARCO_5796882,3.8224394,This will help you estimate how much time you will spend driving from Al Doha street-Al Qusais-Dubai-United Arab Emirates to dafza metro station.Need all the information above in a single view to plan your travel? Check how to Travel from Al Doha street-Al Qusais-Dubai-United Arab Emirates to dafza metro station.IP: Click on each item below to automatically ZOOM the map to the see detailed directions above! * Note: Driving directions from Al Doha street-Al Qusais-Dubai-United Arab Emirates to dafza metro station are as given by Google Maps.
765,msmarco,_doc,MARCO_7925602,3.8224394,"The content of this page was created by users. It has not been screened or verified by IMDb staff. There may be more photos available for this character. To select more photos to be displayed in this character's gallery, click the Edit Photos link. While much is known about the real Al Capone, the... See more ». Capone / Dead Al Capone / Ghost of Al Capone / L' acteur qui joue Al Capone / Owl Capone / Singing Al Capone / Young Al Capone. Edit Credits. There may be more credits available for this character. To edit the credits displayed or to add more credits to this character's filmography, click the Edit Credits link."
766,msmarco,_doc,MARCO_7518699,3.8224394,"Medical issues and anabolic steroids 185 Alterations in serum lipids, elevations in blood pressure and an increased risk of thrombosis are additional cardiovascular changes often associated with anabolic steroid use (Cohen et al., 1986; Costill et al., 1984; Dhar et al., 2005; Kuipers et al., 1991; Laroche, 1990).owever, recent literature has suggested that the medical issues associated with anabolic steroids may be somewhat overstated (Berning et al., 2004; Sturmi and Diorio, 1998; Street et al., 1996) considering that many of the side effects associated with anabolic steroid abuse are reversible upon cessation."
767,msmarco,_doc,MARCO_8669611,3.8224394,"The Kaaba (Arabic: الكعبة‎‎ al-Kaʿbah IPA: [alˈkaʕba], The Cube), also referred as Al Kaaba Al Musharrafah (The Holy Kaaba), is a building at the center of Islam's most sacred mosque, Al-Masjid al-Haram, in Mecca, al-Hejaz, Saudi Arabia. It is the most sacred site in Islam. It is considered the House of Allah (God) and has a similar role to the Tabernacle and Holy of Holies in Judaism. Wherever they are in the world, Muslims are expected to face the Kaaba when performing salat (prayer)."
768,msmarco,_doc,MARCO_116102,3.818673,"Pharmacy Technician Birmingham, AL Salary. Pharmacy Technician Birmingham, AL average salary is $60,076, median salary is $50,000 with a salary range from $20,625 to $359,840.Pharmacy Technician Birmingham, AL salaries are collected from government agencies and companies. Each salary is associated with a real job position.Pharmacy Technician Birmingham, AL salary statistics is not exclusive and is for reference only.They are presented as is and updated regularly.harmacy Technician Birmingham, AL salaries are collected from government agencies and companies. Each salary is associated with a real job position. Pharmacy Technician Birmingham, AL salary statistics is not exclusive and is for reference only. They are presented as is and updated regularly."
769,msmarco,_doc,MARCO_2026760,3.818673,"Sheikh Mohammed is the third of Sheikh Rashid bin Saeed Al Maktoum 's four sons (members of Dubai's ruling Al Maktoum family and descendants of the House of Al-Falasi, of which he is the tribal leader).His mother is Sheikha Latifa bint Hamdan al-Nahyan (daughter of Sheikh Hamdan bin Zaid al-Nahyan, Ruler of Abu Dhabi).heikh Mohammed has been known for his charitable donations. On 19 May 2007, he announced plans to give US$10 billion to set up the Mohammed bin Rashid Al Maktoum Foundation, an educational foundation in the Middle East."
770,msmarco,_doc,MARCO_4947887,3.818673,"Use the word and between the authors' names within the text and use the ampersand in the parentheses. (Kernis, Cornell, Sun, Berry, & Harlow, 1993). In subsequent citations, only use the first author's last name followed by et al. in the signal phrase or in parentheses. (Kernis et al., 1993). In et al. , et should not be followed by a period. Six or More Authors: Use the first author's name followed by et al. in the signal phrase or in parentheses. Harris et al. (2001) argued... (Harris et al., 2001). Unknown Author: If the work does not have an author, cite the source by its title in the signal phrase or use the first word or two in the parentheses. Titles of books and reports are italicized or underlined; titles of articles, chapters, and web pages are in quotation marks."
771,msmarco,_doc,MARCO_4682673,3.8149207,"The β and γ phases are obtained by annealing the most stable α-Al 2 S 3 phase at several hundred degrees Celsius. Compressing aluminium sulfide to 2–65 kbar results in the δ phase where vacancies are arranged in a superlattice of tetragonal symmetry.t higher temperature, the Al(III) centers become randomized to give a defect wurtzite  structure. And at still higher temperatures stabilize the γ-Al 2 S 3 forms, with a structure akin to γ-Al 2 O 3. Molecular derivatives of Al 2 S 3 are not known. Mixed Al-S-Cl compounds are however known."
772,msmarco,_doc,MARCO_5796883,3.8149207,Presented below are road directions from Al Doha street-Al Qusais-Dubai-United Arab Emirates to dafza metro station on Google Map. TIP: Click on each item below to automatically ZOOM the map to the see detailed directions above!* Note: Driving directions from Al Doha street-Al Qusais-Dubai-United Arab Emirates to dafza metro station are as given by Google Maps.IP: Click on each item below to automatically ZOOM the map to the see detailed directions above! * Note: Driving directions from Al Doha street-Al Qusais-Dubai-United Arab Emirates to dafza metro station are as given by Google Maps.
773,msmarco,_doc,MARCO_5701115,3.8149207,"Filaggrin is degraded to release amino acids in the stratum corneum and FLG mutations lead to reduction in photo-absorbing amino acids, specifically urocanic acid (UCA), a chromophore for UVB that may protect against photodamage (de Fine Olivarius et al., 1996; Mildner et al., 2010; Barresi et al., 2011).ilaggrin is degraded to release amino acids in the stratum corneum and FLG mutations lead to reduction in photo-absorbing amino acids, specifically urocanic acid (UCA), a chromophore for UVB that may protect against photodamage (de Fine Olivarius et al., 1996; Mildner et al., 2010; Barresi et al., 2011)."
774,msmarco,_doc,MARCO_3026863,3.8111823,"Native To: Thought to be native to eastern Asia (Polunin & Huxley 1987). Date of U.S. Introduction: Early 1800's (Robbins et al.1951, Mariani et al. 2010). Means of Introduction: Introduced for erosion control (Mariani et al.2010). Impacts: Crowds out native plants species; reduces wildlife habitat; contributes to higher fire frequency and intensity; and modifies river hydrology (Giessow et al.010). Means of Introduction: Introduced for erosion control (Mariani et al. 2010). Impacts: Crowds out native plants species; reduces wildlife habitat; contributes to higher fire frequency and intensity; and modifies river hydrology (Giessow et al."
775,msmarco,_doc,MARCO_5699623,3.8111823,"Best Answer: Pretty close by, should have no problem getting there. Good luck! 1: Start out going SOUTH on BAY CIR toward AL-180 / CANAL RD. 0.1 miles Map 2: Turn RIGHT onto AL-180 / CANAL RD. 0.4 miles Map 3: Turn LEFT onto AL-161 / ORANGE BEACH BLVD. 1.4 miles Map 4: Go STRAIGHT. 0.2 miles Map 5: Turn RIGHT onto AL-182 / PERDIDO BEACH BLVD. Continue to follow AL-182. 7.1 miles Map 6: End at Gulf Shores, AL US Map Total Est. Time: 22 minutes Total Est."
776,msmarco,_doc,MARCO_4178453,3.807458,"Salat is the obligatory Muslim prayers, performed five times each day by Muslims. It is the second Pillar of Islam.God ordered Muslims to pray at five set times of day: 1  Salat al-fajr: dawn, before sunrise.2  Salat al-zuhr: midday, after the sun passes its highest. 3  Salat al-'asr: the late part of the afternoon.alat is the obligatory Muslim prayers, performed five times each day by Muslims. It is the second Pillar of Islam. God ordered Muslims to pray at five set times of day: 1  Salat al-fajr: dawn, before sunrise. 2  Salat al-zuhr: midday, after the sun passes its highest. 3  Salat al-'asr: the late part of the afternoon."
777,msmarco,_doc,MARCO_1871111,3.807458,"jefferson davis community college brewton, al 36427 220 alco dr. federal school code: 001021 jefferson state community college birmingham, al 35215 2601 carson road federal school code: 001022 judson college marion, al 36756 302 bibb street federal school code: 001023 lawson state community college birmingham, al 35221 3060 wilson road s.w. federal school code: 001059 lawson state community college - besse bessemer, al 35021 1100 ninth avenue, southwest federal school code: 005704 lurleen b wallace community college andalusia, al 36420"
778,msmarco,_doc,MARCO_5545036,3.8037472,"Abdul Jalil (Arabic: عبد الجليل ‎) is a Muslim male given name, also used by Christians, and in modern usage, surname. It is built from the Arabic words Abd, al-and Jalil.The name means servant of the Exalted, Al-Jalīl being one of the names of God in the Qur'an, which give rise to the Muslim theophoric names.The letter a of the al-is unstressed, and can be transliterated by almost any vowel, often by e. So the first part can appear as Abdel, Abdul or Abd-al.he name means servant of the Exalted, Al-Jalīl being one of the names of God in the Qur'an, which give rise to the Muslim theophoric names. The letter a of the al-is unstressed, and can be transliterated by almost any vowel, often by e. So the first part can appear as Abdel, Abdul or Abd-al."
779,msmarco,_doc,MARCO_5769212,3.8037472,"yesterday. $1.99update. There are 102 Regular gas price reports in the past 5 days in Montgomery, AL. The average Regular gas price in Montgomery, AL is $2.05, which is $0.74 lower than U.S. national average Regular gas price $2.79.The lowest Regular gas price is $1.69 of Entec located at 1024 Ann St, Montgomery, AL 36107.1.99update. There are 102 Regular gas price reports in the past 5 days in Montgomery, AL. The average Regular gas price in Montgomery, AL is $2.05, which is $0.74 lower than U.S. national average Regular gas price $2.79. The lowest Regular gas price is $1.69 of Entec located at 1024 Ann St, Montgomery, AL 36107."
780,msmarco,_doc,MARCO_5788868,3.8037472,"For example, kitaab (كتاب) means book and al kitaab (الكتاب) means “the book”. It can also mean “of the”: for example, lawn al kitaab (لون الكتاب) means “the colour of the book”. In names Al is generally used to identify the origin, profession or character trait of the bearer of the name or his family. person’s profession or that of his father or grandfather is also frequently used as a last name, such as Yakoub Al Jarrah – Jacob the Surgeon. Occasionally, Al is used with character traits to form a last name. For instance, Salim Al Dhaki (سليم الذكي) would mean Salim the smart one."
781,msmarco,_doc,MARCO_6795678,3.8037472,Dom Al: Dominating airline (sources: available travel agency distribution system and estimates for remainder) Al 1: Airline leg1 Pax Share: Market share. Al 2: Airline leg2 Fare: Average fare. Orig: Origin airport Est.: Indication if average fare is estimated based on regression technique. Stop #1: Connection airport Revenue: Average fare times Reported + Est. Passenger and revenue figures are per month and directional. Quarterly data and annualised data are also available. Fare and revenue values can be displayed in US Dollars or in Euros. Sale Dom Al Al 1 Al 2 Orig Stop #1 Dest Pax Pax Share Fare Est.
782,msmarco,_doc,MARCO_4542060,3.8000505,"Abu Bakr al-Baghdadi is the nom de guerre of an individual who has had various names and epithets attributed to him, including Abu Du'a, (أبو دعاء ʾabū duʿāʾ), Al-Shabah (the phantom), and Abu Bakr al-Baghdadi al-Husseini al-Hashimi al-Qurashi (أبو بكر البغدادي الحسيني الهاشمي القرشي, ʾabū bakri l-baḡdādī l-ḥusaynī l-hāšimī l-qura"
783,msmarco,_doc,MARCO_245468,3.7963672,"Moon Lake School 5866 E River Rd Mentone, AL 35984 (256) 634-4113 Mary Lance, Principal. Plainview School 76 Chavies Rd Rainsville, AL 35986 (256) 638-3510 Tony Richards, Principal. Ruhama School 3371 CO Rd. 81 Ft. Payne, AL 35967 (256) 845-3377 Jordan Phillips, Principal. Sylvania School 133 2nd Street N. Sylvania, AL 35988 (256) 638-2030 Westley King, Principal. DeKalb County Career Tech School 409 Main Street E Rainsville, AL 35986 (256) 638-4421 Jonathan Phillips, Director. Valley Head School 235 1st Ave Valley Head, AL 35989"
784,msmarco,_doc,MARCO_3272062,3.7963672,"How long is the drive from Birmingham, AL to Destin, FL? The total driving time is 4 hours, 9 minutes.Your trip begins in Birmingham, Alabama. It ends in Destin, Florida. If you're planning a road trip, you might be interested in seeing the total driving distance from Birmingham, AL to Destin, FL.You can also calculate the cost to drive from Birmingham, AL to Destin, FL based on current local gas prices and an estimate of your car's best gas mileage.If you're meeting a friend, you might be interested in finding the city that is halfway between Birmingham, AL and Destin, FL.ou can also calculate the cost to drive from Birmingham, AL to Destin, FL based on current local gas prices and an estimate of your car's best gas mileage. If you're meeting a friend, you might be interested in finding the city that is halfway between Birmingham, AL and Destin, FL."
785,msmarco,_doc,MARCO_5115742,3.7963672,"Chemistry-AQA GCE Mark Scheme 2010 June series 5 Qu Part Sub Part Marking Guidance Mark Comments 2 a Cross between the Na cross and the Mg cross 1 2 Al(g) b Al + (g) + e–Al(g) e–  Al + (g) Al(g) + e–  +Al (g) + 2e– if other state symbols on e 2 One mark for state symbols consequential on getting equation correct.hemistry-AQA GCE Mark Scheme 2010 June series. 4 1 d i Coordinate/ dative (covalent) (Lone) pair of electrons/ both electrons (on F -) Donated from F / fluoride or donated to the BF 3 1 1 1If wrong CE = 0/3 but if ‘covalent’ or left top line blank, mark on."
786,msmarco,_doc,MARCO_6958966,3.7911878,2. Balance the electrons by finding the common multiple and multiply the half reactions accordingly. The common multiple of the electrons is 6 so . Oxidation: 2 x (Al --> Al 3+ + 3e-)
787,msmarco,_doc,MARCO_3897977,3.789041,October 2012. Recherche et Innovation. ©© LL’’OOrrééaall © L’Oréal -© L’Oréal --- Reproduction is prohibitedReproduction is prohibited. without the prior written agreement of L’Oréal. ©© LL’’OOrrééaall --. Preservatives on the EU positive list. Cosmetic Preservatives are regulated in the current. EU Directive by a Positive list (Annex VI). 58 preservatives listed. Recherche et Innovation. ©© LL’’OOrrééaall © L’Oréal -© L’Oréal --- Reproduction is prohibitedReproduction is prohibited. without the prior written agreement of L’Oréal.
788,msmarco,_doc,MARCO_7710641,3.7853198,"The four most common elements in the crust are. O, Si, Al, Fe. Common minerals will make use of these elements: Si + O makes quartz. Al + Si + O + K/Na/Ca makes feldspar."
789,msmarco,_doc,MARCO_1531078,3.7822948,"Choung et al (2003) reported it was the second most common cause of vertigo in children (25.5%) after migraine (30.9%). Ravid et al (2003) had similar results (16% vs 39%). Balatsouras et al (2007) reported BPV in 16.7%, and migraine in 20.4%."
790,msmarco,_doc,MARCO_68465,3.7817683,1 (color) red; red colour o color; (EEUU). calentar al rojo vivo to make red-hot; la atmosfera atmósfera esta está al rojo vivo the atmosphere; is electric la emocion emoción esta está al rojo vivo excitement; is at fever pitch un semaforo semáforo. en (rojo). a red light 2 maquillaje (Politica) política; (Red) (espana españa Durante La guerra civil Y) Con. franco (republican) 1; color red red colour; (O). color eeuu calentar al rojo vivo to-make; red hot la atmosfera atmósfera esta está al rojo vivo; the atmosphere is electric la emocion emoción esta está al rojo; vivo excitement is at fever pitch un. semaforo semáforo en rojo a red light
791,msmarco,_doc,MARCO_6982404,3.7784035,"BRAF mutations are found in all melanoma subtypes but are the most common in melanomas derived from skin without chronic sun-induced damage (Curtin et al. 2005; Maldonado et al. 2003). In this category of melanoma, BRAF mutations are found in ~59% of samples (Curtin et al. 2005)."
792,msmarco,_doc,MARCO_768788,3.7750278,"Definition. The Common Disease-Common Variant Hypothesis (CDCVH) is a hypothesis that proposes if a disease that is heritable is common in the population (a prevalence greater than 1–5%), then the genetic contributors – specific variations in the genetic code – will also be common in the population.he CDCVH is based on evidence from evolutionary theory, specifically that all humans today descended from a small population of roughly 10,000 individuals in Africa a relatively short time ago, approximately 100,000 years ago."
793,msmarco,_doc,MARCO_5300722,3.7750278,"The U.S. is a common law country. In all states except Louisiana, which is based on Napoleonic code, the common law of England was adopted as the general law of the state, or varied by statute. Today almost all common law has been enacted into statutes with modern variations by all the states.ommon law is based on precedent (legal principles developed in earlier case law) instead of statutory laws. It is the traditional law of an area or region created by judges when deciding individual disputes or cases. Common law changes over time."
794,msmarco,_doc,MARCO_68468,3.774548,3 (Politica) política; (Red) (espana españa Durante La guerra civil Y) Con. franco (republican) 1; color red red colour; (O). color eeuu calentar al rojo vivo to-make; red hot la atmosfera atmósfera esta está al rojo vivo; the atmosphere is electric la emocion emoción esta está al rojo; vivo excitement is at fever pitch un. semaforo semáforo en rojo a red light (Politica) política; (Red) (espana españa Durante La guerra civil Y) Con. franco (republican) 1; color red red colour; (O). color eeuu calentar al rojo vivo to-make; red hot la atmosfera atmósfera esta está al rojo vivo; the atmosphere is electric la emocion emoción esta está al rojo; vivo excitement is at fever pitch un. semaforo semáforo en rojo a red light
795,msmarco,_doc,MARCO_2091288,3.774548,Arabic grammar (Arabic: النحو العربي ‎ an-naḥw al-‘arabī or قواعد اللغة العربية qawā‘id al-lughah al-‘arabīyah) is the grammar of the Arabic language. Arabic is a Semitic language and its grammar has many similarities with the grammar of other Semitic languages.rabic grammar (Arabic: النحو العربي ‎ an-naḥw al-‘arabī or قواعد اللغة العربية qawā‘id al-lughah al-‘arabīyah) is the grammar of the Arabic language. Arabic is a Semitic language and its grammar has many similarities with the grammar of other Semitic languages.
796,msmarco,_doc,MARCO_7651487,3.7745202,"Command hallucinations are high-risk, distressing and relatively common symptoms of schizophrenia (Beck-Sander et al, 1997; Shawyer et al, 2003). Shawyer et al (2003) find a median prevalence of 53% and median prevalence of compliance of 31%. There are few treatment approaches and none tested systematically."
