,_index,_type,_id,_score,_source.body
258,msmarco,_doc,MARCO_5988246,6.700351,"A number of traditional Belgian dishes use beer as an ingredient. One is carbonade, a stew of beef cooked in beer, similar to boeuf bourguignon. The beer used is typically the regional speciality: lambic in Brussels, De Koninck in Antwerp, so that the taste of the dish varies.hough Belgium has many distinctive national dishes, many internationally-popular foods like hamburgers and spaghetti bolognese are also popular in Belgium, and most of what Belgians eat is also eaten in neighbouring countries."
259,msmarco,_doc,MARCO_8037085,6.700351,Calories in Similar Recipes. 1  Calories in Chicken Kabobs. 2  Calories in Southwest Succotash. 3  Calories in Spaghetti with Zesty Bolognese. 4  Calories in Zesty Shrimp and Pasta. 5  Calories in Lime Grilled Chicken. 6  Calories in Ms Lynn's Whole Wheat Seafood Pasta Salad. 7  Calories in Italian Chicken and Vegetable Bake. 8  Calories in Southwest Succotash.
260,msmarco,_doc,MARCO_8809008,6.700351,"For other uses, see Lamborghini (disambiguation). Automobili Lamborghini S.p.A. (Italian: [lamborˈɡiːni]) is an Italian brand and manufacturer of luxury sports cars and SUVs based in Sant'Agata Bolognese, Italy. The company is owned by the Volkswagen Group through its subsidiary Audi. Ferruccio Lamborghini, an Italian manufacturing magnate, founded Automobili Ferruccio Lamborghini S.p.A. in 1963 to compete with established marques, including Ferrari."
261,msmarco,_doc,MARCO_2134270,6.698434,1 2 Construct the lasagna by layering 4 noodles over the sauce. 2  Top with another 2 cups Bolognese sauce and spread it evenly to the edges of the dish; cover with 1/4 (3 ounces) of the sliced provolone cheese. 3  Spread 1 cup of the bechamel béchamel sauce in a thin layer and top with/1 4 cup of the Grated-Parmigiano reggiano.  cheese
262,msmarco,_doc,MARCO_3040531,6.698434,All hotels in Santa Monica (36) All reviews tasting menu lobster bolognese egg caviar amuse bouche truffles four course menu razor clams spot prawns prime beef foie gras white truffle wagyu dover sole prix fixe fine dining dining experience carte blanche menu michelin restaurants french laundry health insurance.
263,msmarco,_doc,MARCO_4672929,6.698434,"Report Abuse. You can freeze the Bolognese in a ziplock bag. Make sure it is not hot to freeze it, the condensation will form and make it have freezer burn. Also, the air must be squeezed out or you will have the freezer burn problem. The homemade pasta will freeze well, as long as the noodles are covered in sauce.ait until it's cold (or at least room temperature) then put it in a container you can seal and then freeze it. It's a good idea to write the contents and date on a label so you remember what's in there and how long it's been frozen."
264,msmarco,_doc,MARCO_8163676,6.698434,"Aglio e olio-- garlic, olive oil and parsley; Alfredo-- butter, cream and freshly grated cheese served with fettuccine; Amatricana-- sauce of fresh tomatoes, chopped bacon, onion and garlic, served with grated Pecorino Romano cheese; Bolognese-- rich meat sauce flavored with chicken livers, wine, vegetables and nutmeg. Served with butter and grated cheese; sometimes cream is added to the sauce."
265,msmarco,_doc,MARCO_1240595,6.69652,"Ingredient Specific Calorie Information From Our Recipes: 1  Calories In Spag Bol Calories: 395, Fat: 25g, Carbs: 17g, Protein: 24g, Fiber: 1g. 2  Calories In Basic Bolognese Recipe for Spag Bol, Chilli, Meatballs and Veggie version too. 3  Calories In PR's Spag aux Clams Calories: 152, Fat: 7g, Carbs: 10g, Protein: 14g, Fiber: 1g."
266,msmarco,_doc,MARCO_8701154,6.69652,"Women Medics Earn Respect in Combat. 1 / 1 Show Caption + Hide Caption – Combat medics Spcs. Aimee Collver and Vanessa Bolognese, 25th Infantry Division, pull security during a mission in Amerli, Iraq, July 11. KIRKUK, Iraq (American Forces Press Service, Aug. 28, 2007) - Temperatures exceeded 115 degrees during the recent five-hour mission in Amerli."
267,msmarco,_doc,MARCO_2806212,6.6946096,"Linguine is a classic Italian pasta that is said to be originally from the Campania region of the country. The term can be spelled linguine or linguini. The Italian translation is “little tongues.” This type of pasta is now popular in dishes all over the world. The linguini pasta is wide, flat, and thin. Some types have the thickness of spaghetti, with a wider noodle. Classically, linguine is known as a type of pasta that often goes with seafood or other lighter fare, while the Bolognese or other types of red meat sauces are often paired with spaghetti noodles."
268,msmarco,_doc,MARCO_4552339,6.6946096,"Lamborghini. Automobili Lamborghini S.p.A. is an Italian manufacturer of luxury sportscars which is part of Volkswagen Group through its subsidiary Audi. Lamborghini's production facility and headquarters are located in Sant'Agata Bolognese, Italy. In 2011, Lamborghini's 831 employees produced 1,711 vehicles. Manufacturing magnate Ferruccio Lamborghini founded Automobili Ferruccio Lamborghini S.p.A. in 1963 with the objective of producing a refined grand touring car to compete with offerings from established marques such as Ferrari."
269,msmarco,_doc,MARCO_5124668,6.6946096,"spaghetti. 1  pasta in the form of long, thin strings, cooked by boiling or steaming and served with a sauce. 2  Elec. an insulating tubing somewhat resembling macaroni, used for sheathing a bare wire or several insulated wires.uncountable). 1  A type of pasta made in the shape of long thin strings. 2  A dish that has spaghetti as a main part of it, such as spaghetti bolognese. 3  Informally, any type of pasta. 4  Electrical insulating tubing. 5  Anything tangled or confusing."
270,msmarco,_doc,MARCO_5721722,6.6946096,"Automobili Lamborghini S.p.A. is an Italian brand and manufacturer of luxury supercars, sports cars and SUVs based in Sant'Agata Bolognese, Italy. The company is owned by the Volkswagen Group through its subsidiary Audi. Ferruccio Lamborghini, an Italian manufacturing magnate, founded Automobili Ferruccio Lamborghini S.p.A. in 1963 to compete with established marques, including Ferrari. The company gained wide acclaim in 1966 for the Miura sports coupé, which established rear mid-engine ..."
271,msmarco,_doc,MARCO_3805425,6.6927032,"2016 Lamborghini Huracán LP580-2: Bolognese Boogaloo. Less power, less weight, fewer driven wheels. Six years ago, Lamborghini put a stripe on a special-edition Gallardo and named it in honor of Valentino Balboni, the company’s longtime test driver. While toiling away over the sticker package, Lambo’s engineers also yanked the front differential and slightly detuned the car, creating the rear-wheel-drive Gallardo LP550-2."
272,msmarco,_doc,MARCO_2884457,6.6927032,"Tips. 1  How long does homemade meat sauce (including Bolognese sauce) last in the fridge or freezer? 2  To maximize the shelf life of cooked meat sauce for safety and quality, refrigerate the meat sauce promptly in covered airtight containers. 3  Properly stored, cooked meat sauce will last for 3 to 4 days in the refrigerator. To further extend the shelf life of cooked meat sauce, freeze it; freeze in covered airtight containers or heavy-duty freezer bags."
273,msmarco,_doc,MARCO_4373399,6.6927032,"TVP can be made from soy flour or concentrate, containing 50% and 70% soy protein, respectively; they have a mild beany flavor. Both require rehydration before use, sometimes with flavoring added in the same step.sing TVP, one can make vegetarian or vegan versions of traditionally meat-based dishes, such as chili con carne, spaghetti bolognese, sloppy joes, tacos, burgers, or burritos. Soy protein can also be used as a low cost/high nutrition extender in comminuted meat and poultry products, and in tuna salads."
274,msmarco,_doc,MARCO_6763192,6.6927032,“French toast”: synonyms and related words: 1  baked beans. 2  balti. 3  bobotie. 4  bolognese. 5  bubble and squeak. 6  felafel. 7  fish and chips. 8  fondue. 9  fricassee. 10  fry-up. 11  omelette. 12  paella. 13  pakora. 14  pate. 15  pilau. 16  steak tartare. 17  stew. 18  stir-fry. 19  stroganoff. 20  sushi.
275,msmarco,_doc,MARCO_212612,6.6908,"Answer by GeordieSteve. Confidence votes 7.5K. Bologna is the capital city of Emilia-Romagna, in the Po Valley of northern Italy Home to the oldest university in the Western world, University of Bologna, founded in 1088, Bologna is one of the most developed cities in Italy.ologna often ranks as one of the top cities, in terms of quality of life in Italy Bologna is a very important railway and motorway hub in Italy. Bologna is renowned for its culinary tradition. It has given its name to the well-known Bolognese sauce, a meat based pasta sauce."
276,msmarco,_doc,MARCO_1044169,6.6908,CVB: Centraal Veevoederbureau (Netherlands) CVB: Crown Vic Boys (car club; various locations) CVB: Chrysanthemum Virus B: CVB: Chorionic Villus Biopsy: CVB: Circolo Veterinario Bolognese: CVB: Chosen Vans Brotherhood (gaming clan) CVB: Constant Volume Balloon: CVB: Constrained Vapor Bubble: CVB: Care Value Base: CVB: Chariton Valley Beef: CVB: Camden Volunteer Bureau (UK) CVB
277,msmarco,_doc,MARCO_1240591,6.687005,"Calories, Fat, Protein, Fiber, & Carbs In Spaghetti Bolognaise; Calories, Fat, Protein, Fiber, & Carbs In Spaghettios; Calories, Fat, Protein, Fiber, & Carbs In Lean Cuisine Spagetti; Calories, Fat, Protein, Fiber, & Carbs In Spagetti Pasta; Ingredient Specific Calorie Information From Our Recipes: Calories In Spag Bol Calories: 395, Fat: 25g, Carbs: 17g, Protein: 24g, Fiber: 1g Calories In Basic Bolognese Recipe for Spag Bol, Chilli, Meatballs and Veggie version too."
278,msmarco,_doc,MARCO_1653670,6.687005,"They can be served with a variety of sauces, though the classic is a meat sauce or Bolognese sauce. Trofie-Thin twisted pasta. Orecchiette-s a type of pasta native to Apulia, whose shape resembles a small ear (in Italian, ear is orecchio). In the Taranto area it is still called by the synonym chiancarelle.raditionally served with an Amatriciana or other tomato-based southern Italian sauces. Capellini-is a very thin variety of Italian pasta. Like spaghetti, it is rod-shaped, in the form of long strands. It is slightly thinner than vermicelli and slightly thicker than angel hair pasta."
279,msmarco,_doc,MARCO_4373391,6.687005,"Textured or texturized vegetable protein (TVP), also known as textured soy protein (TSP), soy meat, or soya chunks is a defatted soy flour product, a by-product of extracting soybean oil. It is often used as a meat analogue or meat extender.sing TVP, one can make vegetarian or vegan versions of traditionally meat-based dishes, such as chili con carne, spaghetti bolognese, sloppy joes, tacos, burgers, or burritos. Soy protein can also be used as a low cost/high nutrition extender in comminuted meat and poultry products, and in tuna salads."
280,msmarco,_doc,MARCO_5244347,6.687005,"Combine Bolognese sauce and remaining 1 cup broth in a large saucepan over medium heat, and heat until sauce is warmed through. Meanwhile, if you made the bechamel béchamel ahead of, time heat in a medium saucepan over low heat just until warmed (through you'don t want to let it). boilring sauce to a boil, reduce heat, and simmer, whisking often, until the consistency of cream, 8–10 minutes; add nutmeg and season with salt. Remove from heat, transfer to a medium bowl, and press plastic wrap directly onto surface; let cool slightly."
281,msmarco,_doc,MARCO_8599555,6.687005,"Mortadella Bologna IGP from Italy. Mortadella (. [mortaˈdɛl:a]) is a large Italian sausage or cold cut (salume [saˈluːme]) made of finely hashed or ground, heat-cured pork, which incorporates at least 15% small cubes of pork fat (principally the hard fat from the neck of the pig).Mortadella is a product of Bologna, Italy.ortadella originated in Bologna, the capital of Emilia-Romagna; elsewhere in Italy it may be made either in the Bolognese manner or in a distinctively local style. The mortadella of Prato is a Tuscan speciality flavoured with pounded garlic."
282,msmarco,_doc,MARCO_4373392,6.683224,"TVP is usually made from high (50%) soy protein soy flour or concentrate, but can also be made from cotton seeds, wheat, and oats. It is extruded into various shapes (chunks, flakes, nuggets, grains, and strips) and sizes, exiting the nozzle while still hot and expanding as it does so.sing TVP, one can make vegetarian or vegan versions of traditionally meat-based dishes, such as chili con carne, spaghetti bolognese, sloppy joes, tacos, burgers, or burritos. Soy protein can also be used as a low cost/high nutrition extender in comminuted meat and poultry products, and in tuna salads."
283,msmarco,_doc,MARCO_4373396,6.6794577,"Textured vegetable protein was invented by the agricultural commodities and food processing company Archer Daniels Midland in the 1960s; the company owns the TVP name as a registered trademark. Archer Daniels Midland had developed a textured soy protein isolate made with an extruder in the shape of rods or tubes.sing TVP, one can make vegetarian or vegan versions of traditionally meat-based dishes, such as chili con carne, spaghetti bolognese, sloppy joes, tacos, burgers, or burritos. Soy protein can also be used as a low cost/high nutrition extender in comminuted meat and poultry products, and in tuna salads."
284,msmarco,_doc,MARCO_4788369,6.6794577,"Fry your onions very slowly with garlic and mixed herbs. Then add your mince and brown, if you have a bit of red wine, chuck it in now and let the alcohol evaporate. Put in a tin of tomatoes (or two if you're using a big portion of mince).Lots of puree is necessary-half a tube, a tablespoon of sugar and an oxo cube.You could add some diced pancetta with the onions instead of the oxo but you have to be careful about salt. Cook this slowly for about an hour.y basic bolognese recipe is as follows: Fry onion and carrot (also sometimes celery), add mince to brown. Add ton chopped tomatoes, some tomato pur e and a good tsp or so of mixed herbs."
285,msmarco,_doc,MARCO_5244350,6.6794577,"Reheat the sauces. Combine Bolognese sauce and remaining 1 cup broth in a large saucepan over medium heat, and heat until sauce is warmed through. Meanwhile, if you made the bechamel béchamel ahead of, time heat in a medium saucepan over low heat just until warmed (through you’don t want to let it). boilulse onion, carrot, and celery in a food processor until finely chopped. Heat oil in a large heavy pot over medium heat. Add beef, pork, pancetta, and vegetables; cook, breaking up meat with a spoon, until moisture is almost completely evaporated and meat is well browned, 25–30 minutes; season with salt and pepper."
286,msmarco,_doc,MARCO_493144,6.1508408,"There is a LOT of variation in the descriptions of the internal iliac artery branches among different sources — almost as much variation as there is in the arteries themselves. ​ 1 The Thieme Atlas of Anatomy, 2nd Ed (Gilroy et al. 2  Clinically Oriented Anatomy, 7th Ed (Moore et al. 3  Gray’s Anatomy, 40th Ed (Standring et al."
287,msmarco,_doc,MARCO_1271187,6.0551,"Casey is a common variation of the Irish Gaelic cathasaigh/cathaiseach, meaning vigilant or watchful. At least six different septs used this name, primarily in the Counties of Cork and Dublin.People with the surname Casey include: 1  Adam Casey (born 1986), Australian soccer player.2  Al Casey (disambiguation).asey is a common variation of the Irish Gaelic cathasaigh/cathaiseach, meaning vigilant or watchful. At least six different septs used this name, primarily in the Counties of Cork and Dublin. People with the surname Casey include:"
288,msmarco,_doc,MARCO_6500036,6.0058627,"Our current knowledge of mtDNA variation of taurine cattle in Eurasia is based on studies of European and Near Eastern breeds (Loftus et al., 1994; Bradley et al., 1996; Troy et al., 2001). In recent years, a few East Asian breeds have also been examined (Mannen et al., 2004; Lai et al., 2006)."
289,msmarco,_doc,MARCO_1698235,5.73942,"[ 3 syll. a-li-ka, al-ika ] The baby girl name Alika is pronounced as ahL IY-Kaa †. Alika is used predominantly in the Hawaiian language. It is derived from Germanic and African-Ibo origins. From African-Ibo roots, its meaning is most beautiful; she who drives out beautiful women.This is derived from the longer name Alikecopeleabola. In addition, Alika is a variation (Hawaiian) of Alice.lika has 17 variations. Variations of Alika include Aleeka, Aleka, Alica, Alicca, Alicka, Alikah, Alike, Alikee, Aliki, Aliqua, Alique, Alliki, Alycca, Alycka, and Alyka. The diminutives Lika and Liki are other English variations. Alika is rare as a baby girl name."
290,msmarco,_doc,MARCO_5550054,5.72908,"In this lesson they introduce the morning greeting Sabah Al-Khair, which was a phrase I learned during my first month of study. Although, it is only now that I realize I’ve been pronouncing it wrong.I’ve been pronouncing it as /kair/ instead of /xair.Maybe it isn’t wrong, but only a regional variation to say /kair/.n this lesson they introduce the morning greeting Sabah Al-Khair, which was a phrase I learned during my first month of study. Although, it is only now that I realize I’ve been pronouncing it wrong. I’ve been pronouncing it as /kair/ instead of /xair. Maybe it isn’t wrong, but only a regional variation to say /kair/."
291,msmarco,_doc,MARCO_8336243,5.7215185,"[ syll. a-ra-lyn, ar-al-yn ] The baby girl name Aralyn is pronounced AA RAHLihN †. Aralyn is of English-American origin. Aralyn is a variation of Aaralyn (English).Aralyn is not frequently used as a baby girl name. It is not listed in the top 1000. Baby names that sound like Aralyn include Aralenn, Aralenne, Aralynne, Orseline, Aaralynn, and Aralynn. syll. a-ra-lyn, ar-al-yn ] The baby girl name Aralyn is pronounced AA RAHLihN †. Aralyn is of English-American origin. Aralyn is a variation of Aaralyn (English)."
292,msmarco,_doc,MARCO_8552722,5.5171556,"Most macrosomic newborns are born to women with a low risk of having a big baby (Heiskanen et al 2006, Walsh et al 2007). Your midwife or doctor will consider you low risk if you are not diabetic, for example (Alberico et al 2014). In reality, much of the variation in birth weights remains unexplained."
293,msmarco,_doc,MARCO_3054336,5.513212,Magali's language of origin is Provencal provençal And Old. Greek it is predominantly used in The english And french. Languages magali is a variant spelling Of (Magalie english And). French magali is also a variation Of (Margaret english And). scottishagali is also a variation of Margaret (English and Scottish). Magali is also a variation (French) of Marguerite (English and French). Magali is an irregularly used baby girl name. It is not listed in the top 1000.
294,msmarco,_doc,MARCO_2482698,5.4997725,"The Loyalists of Massachusetts James H. Stark. Archaic use of 'an' before 'h' retained; for example 'an humble' Pg 50 et al. The Perambulations of a Bee and a Butterfly Elizabeth Sandham. Prior work on the muscles of the leg of birds has been reviewed by Hudson and Hudson, et al. . Variation in the Muscles and Nerves of the Leg in E. Bruce Holmes. Its chiefs (Hoffmann, Poe, et al.) are classed by critics as realists."
295,msmarco,_doc,MARCO_6994088,5.4997725,"Beer guide to breweries, brewpubs, bars, stores, events and festivals, and recent visits in the Montreal montréal. (area). Alphabetical The montreal montréal area includes the, following cities towns: And, Variations, Anjou, Laval, Longueuil, Montreal Montreal montréal verdun, lists are weighted and take the number of. visits into consideration"
296,msmarco,_doc,MARCO_8339482,5.4882674,"Abstract. More than a third of the European pool of human mitochondrial DNA (mtDNA) is fragmented into a number of subclades of haplogroup (hg) H, the most frequent hg throughout western Eurasia.he hg H encompasses over 40% of the total mtDNA variation in most of Europe. Its frequency declines toward the East and South, but in the Near East, the Caucasus and Central Asia, its frequency is still as high as 10–30% (Metspalu et al. 1999; Richards et al. 2000; Tambets et al."
297,msmarco,_doc,MARCO_6320662,5.1630588,"The majority of depressed patients exhibit positive mood variation (PMV) which is a pattern of diurnal variation whereby dysphoric mood is worse in the morning than the evening (Bouhuys, 1991 ; Stallone et al., 1973)."
298,msmarco,_doc,MARCO_515744,5.155231,"Taylor et al. (1986) compared cattle of 25 different beef and dairy breeds has described that weight accounts for 88% of the variation in feed intake within a given breed, but only 14-33% of the variation observed from one breed to another."
299,msmarco,_doc,MARCO_7589951,5.143546,"There is a LOT of variation in the descriptions of the internal iliac artery branches among different sources — almost as much variation as there is in the arteries themselves. ​The Thieme Atlas of Anatomy, 2nd Ed (Gilroy et al. 2009), Table 19.1 on p. 254, includes the inferior vesical artery for both sexes."
300,msmarco,_doc,MARCO_493147,5.1416054,"There is a LOT of variation in the descriptions of the internal iliac artery branches among different sources — almost as much variation as there is in the arteries themselves. ​ 1 The Thieme Atlas of Anatomy, 2nd Ed (Gilroy et al. 2009), Table 19.1 on p. 254, includes the inferior vesical artery for both sexes."
301,msmarco,_doc,MARCO_6260592,5.131708,"Tags: al qaeda black flags,isis flag,jihadist flags,symbols of jihad flags,testtube daily,the meaning of the black flags of jihad,black flags of jihad,flag of the eagle.SIS, Al Qaeda, and other Jihadist groups all seem to have the same variations of the same flag. What do these Black Flags ..."
302,msmarco,_doc,MARCO_7766163,5.127832,"Some papers suggest that rapidly progressive forms of the disease may be distinguished by particularly low levels of CSF Aβ42 and particularly high levels of tau and phosphorylated tau, although variations among labs make it hard to set absolute cutoff values (see Snider et al., 2009 and Wallin et al., 2010)."
303,msmarco,_doc,MARCO_1967027,5.1201024,"While most research on the relationship between ecosystem diversity and stability has focused on species richness, it is variation in species composition that provides the mechanistic basis to explain the relationship between species richness and ecosystem functioning. wealth of research into the relationships among diversity, stability, and ecosystem functioning has been conducted in recent years (reviewed by Balvanera et al. 2006, Hooper et al. 2005)."
304,msmarco,_doc,MARCO_310511,5.1165447,"[ 1 syll. al-les, all-es ] The baby girl name Alles is pronounced as EY LZ †. The origin of Alles is the Germanic language. Alles is a variation of Alice. Alles is also a variation of the name Alison (English, French, and Scottish). Alles is an uncommon baby girl name. It is not listed within the top 1000. In 2012, among the family of girl names directly related to Alles, Alice was the most popular."
305,msmarco,_doc,MARCO_6281407,5.116249,"The pharmaceutical industry is another frontier for the use of GMOs. In 1986, human growth hormone was the first protein pharmaceutical made in plants (Barta et al ., 1986), and in 1989, the first antibody was produced (Hiatt et al ., 1989).roponents of the use of GMOs believe that, with adequate research, these organisms can be safely commercialized. There are many experimental variations for expression and control of engineered genes that can be applied to minimize potential risks."
306,msmarco,_doc,MARCO_2088711,5.1028194,"References. 1  1. Alaluf S, Atkins D, Barrett K, Blount M, Carter N, et al. (2002a) Ethnic variation in melanin content and composition in photoexposed and photoprotected human skin. 2  2. Alaluf S, Atkins D, Barrett K, Blount M, Carter N, et al. (2002b) The impact of epidermal melanin on objective measurements of human skin colour."
307,msmarco,_doc,MARCO_2561050,5.1021194,"INTERNATIONAL EGG PASTEURIZATION MANUAL 5 When measuring samples from different lots of the same sample,viscosities varied as much as 50% above and 40% below valuesshown with 20% variation being more common. Scalzo et al.(1970) reported similar results when using a capillary viscometer(Table 3)."
308,msmarco,_doc,MARCO_3054332,5.101278,"[ 3 syll. ma-ga-li, mag-ali ] The baby girl name Magali is pronounced as M AA-Gaa-Liy- †. Magali's language of origin is Provencal provençal And Old. Greek it is predominantly used in The english And french. Languages magali is a variant spelling Of (Magalie english And). frenchagali is also a variation of Margaret (English and Scottish). Magali is also a variation (French) of Marguerite (English and French). Magali is an irregularly used baby girl name. It is not listed in the top 1000."
309,msmarco,_doc,MARCO_3374396,5.098999,"[bog] Bamako capital district. Estimated 40,000–70,000 people with moderate to severe hearing loss in Mali (Nyst et al 2012). Status: 6a (Vigorous). Alternate Names: LaSiMa, Langue des signes bambara, Langue des signes malienne, Malian Sign Language. Dialects: Lexical variation within Bamako and between Bamako and other parts of Mali, currently being assessed (Nyst et al 2012). Classification: Sign language."
