,_index,_type,_id,_score,_source.body
506,msmarco,_doc,MARCO_4949041,4.0340195,"Genetic variation. Without genetic variation, some of the basic mechanisms of evolutionary change cannot operate. There are three primary sources of genetic variation, which we will learn more about: 1  Mutations are changes in the DNA.2  Gene flow is any movement of genes from one population to another and is an important source of genetic variation. 3  Sex can introduce new gene combinations into a population.ithout genetic variation, some of the basic mechanisms of evolutionary change cannot operate. There are three primary sources of genetic variation, which we will learn more about:"
507,msmarco,_doc,MARCO_2752576,4.032113,"Jace is used predominantly in the English language and it is derived from Old Greek origins. Jace is a variation of the name Jason (English). Jace is also a variation of the name Jayce (English). Jace is also a variation of the name Jayson (English).Jace is a popular baby name for boys, and it is also viewed as trendy.ace is a variation of the name Jason (English). Jace is also a variation of the name Jayce (English). Jace is also a variation of the name Jayson (English). Jace is a popular baby name for boys, and it is also viewed as trendy."
508,msmarco,_doc,MARCO_7822148,4.032113,"Since variation and quality go hand-in-hand, we require objective measures of variation. The standard deviation is a statistic that describes the amount of variation in a measured process characteristic. Specifically, it computes how much an individual measurement should be expected to deviate from the mean on average.ince variation and quality go hand-in-hand, we require objective measures of variation. The standard deviation is a statistic that describes the amount of variation in a measured process characteristic. Specifically, it computes how much an individual measurement should be expected to deviate from the mean on average."
509,msmarco,_doc,MARCO_6202533,4.03021,Definition of DIRECT VARIATION. 1. : mathematical relationship between two variables that can be expressed by an equation in which one variable is equal to a constant times the other. 2.: an equation or function expressing direct variation — compare inverse variation.See direct variation defined for kids.ADVERTISEMENT. mathematical relationship between two variables that can be expressed by an equation in which one variable is equal to a constant times the other. 2. : an equation or function expressing direct variation — compare inverse variation. See direct variation defined for kids.
510,msmarco,_doc,MARCO_773195,4.026415,"By Regina Bailey. Definition: In genetic variation, the genes of organisms within a population change. Gene alleles determine distinct traits that can be passed on from parents to offspring. Gene variation is important to the process of natural selection.The genetic variations that arise in a population happen by chance, but the process of natural selection does not. Natural selection is the result of the interactions between genetic variations in a population and the environment.The environment determines which variations are more favorable.enetic variation occurs mainly through DNA mutation, gene flow (movement of genes from one population to another) and sexual reproduction."
511,msmarco,_doc,MARCO_569063,4.026415,"1. the act or process of varying: prices subject to variation. 2. an instance of this: a variation in quality. 3. amount of change: a temperature variation of 20°. 4. a different form of something. 5. the transformation of a musical theme with changes or elaborations in harmony, rhythm, and melody.. the act or process of varying: prices subject to variation. 2. an instance of this: a variation in quality. 3. amount of change: a temperature variation of 20°. 4. a different form of something. 5. the transformation of a musical theme with changes or elaborations in harmony, rhythm, and melody."
512,msmarco,_doc,MARCO_6202539,4.026415,"var•i•a•tion. 1. the act or process of varying: prices subject to variation. 2. an instance of this: a variation in quality. 3. amount of change: a temperature variation of 20°. 4. a different form of something.5. the transformation of a musical theme with changes or elaborations in harmony, rhythm, and melody.ar•i•a•tion. 1. the act or process of varying: prices subject to variation. 2. an instance of this: a variation in quality. 3. amount of change: a temperature variation of 20°. 4. a different form of something."
513,msmarco,_doc,MARCO_3538300,4.023153,"Besides temperature, soil moisture is another important factor affecting the rate of soil respiration (Singh and Gupta, 1977, Davidson et al., 1998, Gulledge and Schimel, 2000 and Xu and Qi, 2001a).owever, it has been a common practice in several most commonly used ecosystem models that temperature sensitivity of soil respiration is treated as invariant (e.g. Heimann et al., 1989, Raich et al., 1991, Running and Hunt, 1993 and Potter et al., 1993)."
514,msmarco,_doc,MARCO_6202534,4.0226345,"In the following equation y varies directly with x, and k is called the constant of variation: Another form of variation is the inverse variation which works when there is a relationship between two variables in which the product is a constant.When one variable increases the other decreases in proportion so that the product is unchanged.hen we have a variation where one quantity varies as the product of two or more other quantities we have what is called joint variation: Videolesson: State whether each equation represents a direct, inverse or joint variation: xy=7 y=xz x/y=4. 1  Pre-Algebra. 2  Algebra 1. 3  Algebra 2. 4  Geometry. 5  Sat."
515,msmarco,_doc,MARCO_8664731,4.0193324,"Wage by Gender for Common Jobs. 1  Showing data for Dallas, Bibb, Marengo, Hale, Sumter, Perry & Greene Counties PUMA, AL. 2  Showing data for Dallas, Bibb, Marengo, Hale, Sumter, Perry & Greene Counties PUMA, AL. 3  The closest comparable wage GINI for Sumter County, AL is from Dallas, Bibb, Marengo, Hale, Sumter, Perry & Greene Counties PUMA, AL."
516,msmarco,_doc,MARCO_7059781,4.0151157,"Kaira is used predominantly in the English language. Its origin is Italian, Old Greek, and Old Persian. Kaira is a variation (English) of the name Cara (English, German, and Italian). Kaira is also a variation of the name Katherine (English). Kaira is also a variation of the name Kyra (English and German).Kaira is an irregularly used baby girl name.It is not listed in the top 1000. In 2012, among the family of girl names directly linked to Kaira, Katherine was the most popular.ts origin is Italian, Old Greek, and Old Persian. Kaira is a variation (English) of the name Cara (English, German, and Italian). Kaira is also a variation of the name Katherine (English). Kaira is also a variation of the name Kyra (English and German)."
517,msmarco,_doc,MARCO_6440604,4.0117135,"Surnames that begin with al often refer to the place where someone's ancestors were born. In these cases, the last name generally ends with the letter i, which turns the name of a place into a description of a person. Arabic surnames can also combine the definite article with the name of a profession. Sometimes the al- gets smushed in with the rest of the word. The anglicized name Abdul has a similar derivation. It comes from a pair of prefixes—abd, meaning servant of and the definite article al-. A common construction for Arabic names combines abd, al-, and one of the names of God."
518,msmarco,_doc,MARCO_6706901,4.0079145,"Back pain is common in pregnancy. Somewhere between a half and three quarters of pregnant women have it at some stage (Bastiaenen et al 2008, Chang et al 2011, Ostgaard et al 1991, 1994, Wu et al 2004) .However, there is plenty you can do to ease the discomfort and prevent it from turning into a long-term problem.f you do have back pain while you're pregnant, try not to worry about it affecting your experience of birth. With the right treatment, it's rare for back pain to cause difficulties in labour. Some women who had back pain before they became pregnant even find it eases as their pregnancy progresses."
519,msmarco,_doc,MARCO_2343329,4.0076528,"Ric Silver has filed DMCA-based takedown notices to YouTube users who posted videos of people performing the 18 step dance variation. There are several variations of The Electric, like The Freeze (16 step), Cowboy Motion (24 step), Cowboy Boogie (24 step) and what will be known as The Electric Slide 2 (18 step).Variations must from now on all carry the listing a variation of 'The Electric' choreographed by Richard Silver.ic Silver has filed DMCA-based takedown notices to YouTube users who posted videos of people performing the 18 step dance variation. There are several variations of The Electric, like The Freeze (16 step), Cowboy Motion (24 step), Cowboy Boogie (24 step) and what will be known as The Electric Slide 2 (18 step)."
520,msmarco,_doc,MARCO_5009434,4.0052648,"Brewton, AL Other Information. 1  Located in ESCAMBIA County, Alabama. 2  Brewton, AL is also known as: 3  DAMASCUS, AL.  DIXONVILLE, 1  AL. EAST BREWTON, 2  AL. KEEGO, 3  AL. WALLACE,  AL."
521,msmarco,_doc,MARCO_7027136,4.0004077,Overall there are 18 primary newspapers and periodicals within Egypt. 1  Some of these include: 2  Akhbar al-Adab 3  . Akher Sa'a 4  . Al-Ahali 5  . Al-Ahram al-Arabit. 6  Al-Ahram Hebdo. 7  Al-Gumhuriya. 8  Al-Shaab.
522,msmarco,_doc,MARCO_2054649,3.9984717,"Population Full. 315,500 in Egypt (2002). Location. Bedouin regions along Mediterranean coast, west to Libya border, Al Buhayrah, Al Iskandariyah, and Matruh governorates; also in western oases, Al Wadi al Jadid, Al Qahirah, Al Fayyum, Bani Suwayf, and Al Minya governorates."
523,msmarco,_doc,MARCO_5360030,3.9983842,"Shewhart concluded that while every process displays variation, some processes display variation that is natural to the process (common sources of variation)- these processes were described as 'in (statistical) control'."
524,msmarco,_doc,MARCO_2762384,3.9975052,"Weather for Abbeville, AL - Abbeville, AL Weather, Current Weather in Abbeville, AL. Local weather report for Abbeville, AL, Local Abbeville, AL weather. Forecast for Abbeville, Alabama, Abbeville, AL weather forecast. Find your local Abbeville weather forecast. Abbeville, AL weather conditions."
525,msmarco,_doc,MARCO_6951240,3.996562,"Ileana's origin is Old French, Latin, Old Greek, and Hebrew, and its use, English, Romanian, Hungarian, and Spanish. Ileana is a variation of Aileen (English, Gaelic, German, Irish, and Scottish). Ileana is also a variation (English) of Eileen (English, Irish, and Gaelic).Ileana is also a variation (English and Romanian) of Eliana (English, German, Hebrew, Italian, Portuguese, and Spanish). Ileana is also a variation (English, Hungarian, and Romanian) of Helen (English).Ileana is also a variation of Ilana (English, Hebrew, and Hungarian).Ileana is also a variation (Spanish) of Ilene (English, Greek, and Irish). Ileana is not popular as a baby girl name. It is not listed within the top 1000.In 2012, within the family of girl names directly related to Ileana, Eliana was the most regularly used.leana is not popular as a baby girl name. It is not listed within the top 1000. In 2012, within the family of girl names directly related to Ileana, Eliana was the most regularly used."
526,msmarco,_doc,MARCO_884303,3.9946108,"This page provides all possible meanings and translations of the word et al. et al., et al, et alii, et aliae, et alia(adverb) and others ('et al.' is used as an abbreviation of `et alii' (masculine plural) or `et aliae' (feminine plural) or `et alia' (neuter plural) when referring to a number of people) the data reported by Smith et al.. et al., et al, et alibi(adverb) and elsewhere (used when referring to other occurrences in a text)"
527,msmarco,_doc,MARCO_4773340,3.9936478,"Arabic, Western Egyptian Bedawi Spoken. [ayl] Bedouin regions along Mediterranean coast, west to Libya border, Al Buhayrah, Al Iskandariyah, and Matruh governorates; also in western oases, Al Wadi al Jadid, Al Qahirah, Al Fayyum, Bani Suwayf, and Al Minya governorates. 315,500 in Egypt (2002). Status: 6a (Vigorous)."
528,msmarco,_doc,MARCO_4093229,3.9926858,1. et al-and others ('et al.' is used as an abbreviation of `et alii' (masculine plural) or `et aliae' (feminine plural) or `et alia' (neuter plural) when referring to a number of people); the data reported by Smith et al.. et al.t al-and others ('et al.' is used as an abbreviation of `et alii' (masculine plural) or `et aliae' (feminine plural) or `et alia' (neuter plural) when referring to a number of people); the data reported by Smith et al.. et al.
529,msmarco,_doc,MARCO_5600125,3.9926858,"Provinces in Kuwait : The six provinces of the country are as follows : Al-Asimah or Al-Kuwait : Al-Asimah or Al-Kuwait covers an area of 200 sq. km. and is inhabited by approximately 262,000 people. Al-Kuwait has three ports: Ash Shuwaykh, Mina Al Ahmadi, and Kuwait City. Kuwait City handles all international flights to and from Kuwait. Al-Ahmadi :"
530,msmarco,_doc,MARCO_4269010,3.9924932,Fey Spelling Variations. The Middle Ages saw a great number of spelling variations for surnames common to the Irish landscape. One reason for these variations is the fact that surnames were not rigidly fixed by this period.
531,msmarco,_doc,MARCO_8123075,3.9907646,"References. 1  Zhang C, et al. 2  Nago N, et al. 3  Zhang X, et al. 4  Boscarino JA, et al. 5  Li L, et al. 6  Stone NJ, et al. 7  Lopez-Jimenez F (expert opinion). 8  Goldstein L. The complex relationship between cholesterol and brain hemorrhage. 9  Parsaik AJ, et al."
532,msmarco,_doc,MARCO_4060685,3.989029,"Scientific name: Apis mellifera scutellata Lepeletier (Ellis and Ellis 2008; Sheppard and Smith 2000) Common names: Africanized honeybee, African honey bee, killer bee. Selected Resources. Native To: Originally from Africa; first hybridized in South America (Hall et al. 2014) Date of U.S. Introduction: 1990, first found in southern Texas (Hall et al. Means of Introduction: Imported and bred with European honey bees to increase honey production (Hall et al. Impact: More aggressive than European honeybees; negative impact on honey production industry (Hall et al."
533,msmarco,_doc,MARCO_1427545,3.988847,"Overview of Amphibian Diseases. Disease has been implicated as a factor in the decline of amphibian populations worldwide (Blaustein et al. 1994b, Laurance et al. 1996, Berger et al.1998, Daszak 2000, Kiesecker et al.verview of Amphibian Diseases. Disease has been implicated as a factor in the decline of amphibian populations worldwide (Blaustein et al. 1994b, Laurance et al. 1996, Berger et al. 1998, Daszak 2000, Kiesecker et al."
534,msmarco,_doc,MARCO_3471587,3.9872131,Clan affiliation by spelling variation. 1  Muir/Mure/Moore - more common in Clan Campbell. 2  Moir/Moire - more common in Clan Gordon. 3  Moore - more common in Clan Leslie. 4  More - more common in Clan Grant. 5  Langmoore/Longmuir - more common in Clan Boyd.
535,msmarco,_doc,MARCO_4093230,3.9869332,"1. et al. - and others ('et al.' is used as an abbreviation of `et alii' (masculine plural) or `et aliae' (feminine plural) or `et alia' (neuter plural) when referring to a number of people); the data reported by Smith et al..et al, et alia, et aliae, et alii. and others ('et al.' is used as an abbreviation of `et alii' (masculine plural) or `et aliae' (feminine plural) or `et alia' (neuter plural) when referring to a number of people); the data reported by Smith et al.. et al, et alia, et aliae, et alii."
536,msmarco,_doc,MARCO_1409669,3.9869332,"References. 1  Your guide to lowering your cholesterol with TLC. 2  Mozaffarian D, et al. 3  Lifestyle changes and cholesterol. 4  Fish 101. 5  Tangney CC, et al. 6  Sikand G, et al. 7  Whitehead A, et al. 8  Gylling H, et al. 9  An avocado a day may keep bad cholesterol at bay. 10  Wang L, et al. 11  Pal S, et al."
537,msmarco,_doc,MARCO_2070671,3.9869332,"Weather for Frisco City, AL - Frisco City, AL 36445 Weather, Current Weather in Frisco City, AL. Local weather report for Frisco City, AL, Local Frisco City, AL 36445 weather. Forecast for Frisco City, Alabama, Frisco City, AL weather forecast. Find your local Frisco City weather forecast. Frisco City, AL weather conditions."
538,msmarco,_doc,MARCO_143406,3.985023,"Hoover, Alabama Maps is your home page for any search about Hoover AL: accommodation, restaurants, tours, attractions, activities, jobs and more The map of Hoover AL enables you to safely navigate to, from and through Hoover AL. More, the satellite view of Hoover AL lets you see full topographic details around your actual location or virtually explore the streets of Hoover AL from your home. Use your GPS sensor to get directions in Hoover AL or to find a specific place in Hoover AL."
539,msmarco,_doc,MARCO_7142487,3.985023,Alternative searches for Yawm al-Din: 1  Search for Synonyms for Yawm al-Din. 2  Search for Anagrams for Yawm al-Din. 3  Quotes containing the term Yawm al-Din. 4  Search for Phrases containing the term Yawm al-Din. 5  Search for Poems containing the term Yawm al-Din. 6  Search for Scripts containing the term Yawm al-Din.
540,msmarco,_doc,MARCO_1355629,3.9846654,"Variation that is inherent in the process itself is called common variation.Common. variation is often referred to as random variation and may be the result of the type of equip-. ment used to complete a process, for example. As the title of this technical note implies, this material requires an understanding of very."
541,msmarco,_doc,MARCO_8122829,3.9831164,"References. 1  Lorea Baroja M1, et al. 2  Vujic G1, et al. 3  Beerepoot MA1, et al. 4  Walter J1, Britton RA, Roos S. Host-microbial symbiosis in the vertebrate gastrointestinal tract and the Lactobacillus reuteri paradigm. 5  Shahani KM, Ayebo AD. 6  Singh VP1, et al. 7  Candela M1, et al. 8  Gopal PK1, et al. 9  Abrahamsson TR1, et al."
542,msmarco,_doc,MARCO_8673386,3.9831164,"Athens AL Real Estate & Homes for Sale. 1  1503 Pinedale Street Athens, AL 35611. 2  108 Barbara Street Athens, AL 35611. 3  19155 Elkton Road Athens, AL 35611. 4  1113 North Jefferson Street N Athens, AL 35611. 5  17424 Holland Heights Athens, AL 35611. 6  21101 Bean Road Athens, AL 35614."
543,msmarco,_doc,MARCO_7386129,3.9812136,Camp Abu Naji / FOB Garry Owen (Al Amarah) Camp Adder also known as Tallil Air Base and Ali Air Base located in Nasiriyah. Camp Al Adala / Camp Justice / Camp Bonzai (Kadhamiyah / Baghdad) Camp Al Amal / Camp Hope (Baghdad) Camp Al Asad (Al Asad Air Base) Camp Al-Hurya Al-Awal / Camp Freedom I / Camp Warhorse (Baqubah Air Field)
544,msmarco,_doc,MARCO_1331047,3.980763,"Sound was what guided spelling in the Middle Ages, so one person's name was often recorded under several variations during a single lifetime. Spelling variations were common, even among the names of the most literate people. Known variations of the Steele family name include Steele, Steill, Steel, Steal and others."
545,msmarco,_doc,MARCO_3613018,3.980763,"Control charts attempt to distinguish between two types of process variation: 1  Common cause variation, which is intrinsic to the process and will always be present. 2  Special cause variation, which stems from external sources and indicates that the process is out of statistical control."
546,msmarco,_doc,MARCO_1221941,3.9802518,The most common variation of the sope involves simply adding chicken and is widely known as a sope de pollo. Sopes topped with beef are also a common variation and are typically slightly larger than sopes de pollo.
547,msmarco,_doc,MARCO_4971083,3.979314,"huntsville, al: dino ferrante, md 119 longwood dr huntsville, al: the center for colon and digestive disease p c 119 longwood drive huntsville, al: thomas p short, md 119 longwood drive huntsville, al: lourdes c corman, md 301 governors drive huntsville, al: bobby johnson, md 201 sivley rd huntsville, al: c a goetsch, md 119 longwood drive huntsville, al"
548,msmarco,_doc,MARCO_3883883,3.9774184,"Zip Code 35173 is located in the state of Alabama in the Birmingham metro area. Zip code 35173 is primarily located in Jefferson County. Portions of 35173 are also located in Saint Clair County. The official US Postal Service name for 35173 is TRUSSVILLE, Alabama. Portions of zip code 35173 are contained within or border the city limits of Trussville, AL, Argo, AL, Moody, AL, Leeds, AL, Clay, AL, Birmingham, AL, and Margaret, AL. The area code for zip code 35173 is 205."
549,msmarco,_doc,MARCO_3486748,3.9774184,9) Rod Carew - 1967 AL RoY for the Twins and 1977 AL MVP for the Twins. 10) Fred Lynn - won both the 1975 AL RoY and MVP for the Red Sox. 11) Thurman Munson - 1970 AL MVP for the Yankees and 1976 AL MVP for the Yankees. 12) Andre Dawson - 1977 NL RoY for the Expos and 1987 NL MVP for the Cubs. 13) Cal Ripken Jr. - 1982 AL RoY for the Orioles and 1983 and 1991 AL MVP for the Orioles.
550,msmarco,_doc,MARCO_4971077,3.9774184,"huntsville, al: the center for colon and digestive disease p c 119 longwood drive huntsville, al: thomas p short, md 119 longwood drive huntsville, al: lourdes c corman, md 301 governors drive huntsville, al: bobby johnson, md 201 sivley rd huntsville, al: c a goetsch, md 119 longwood drive huntsville, al: jatinder k sachdev, md 8151 whitesburg dr huntsville, al"
551,msmarco,_doc,MARCO_4971086,3.9774184,"huntsville, al: physician professional fee component 101 sivley rd huntsville, al: dino ferrante, md 119 longwood dr huntsville, al: the center for colon and digestive disease p c 119 longwood drive huntsville, al: thomas p short, md 119 longwood drive huntsville, al: lourdes c corman, md 301 governors drive huntsville, al: bobby johnson, md 201 sivley rd huntsville, al"
552,msmarco,_doc,MARCO_6870233,3.9774184,"It is noteworthy that in the ethical writings of the Sufis Al-Kusajri and Al-Harawi there are sections which treat of the same subjects as those treated in the Ḥovot ha-Lebabot and which bear the same titles: e.g., Bab al-Tawakkul; Bab al-Taubah; Bab al-Muḥasabah; Bab al-Tawaḍu'; Bab al-Zuhd.ractitioners of Sufism hold that in its early stages of development Sufism effectively referred to nothing more than the internalization of Islam. According to one perspective, it is directly from the Qur'an, constantly recited, meditated, and experienced, that Sufism proceeded, in its origin and its development."
553,msmarco,_doc,MARCO_7386126,3.9774184,Camps. 1  Camp Abu Naji / FOB Garry Owen (Al Amarah) 2  Camp Adder also known as Tallil Air Base and Ali Air Base located in Nasiriyah. 3  Camp Al Adala / Camp Justice / Camp Bonzai (Kadhamiyah / Baghdad)  Camp Al Amal / Camp Hope 1  (Baghdad) Camp Al Asad (Al Asad Air Base)  Camp Al-Hurya Al-Awal / Camp Freedom I / Camp Warhorse (Baqubah Air Field)
554,msmarco,_doc,MARCO_7492750,3.9774184,"Epidemiology and Surveillance. 1  Hampton LM, Garrison L, Kattan J, et al. 2  Garrison LE, Kunz JM, Cooley LA, et al. 3  Quinn C, Demirjian A, Lucas C, et al.  Dooling KL, Toews KA, Hicks LA, et 1  al. Beer KD, Gargano JW, Roberts VA, et 2  al. Beer KD, Gargano JW, Roberts VA, et  al. Demirjian A, Lucas CE, Garrison LE, 1  et al.  CDC."
555,msmarco,_doc,MARCO_2295023,3.9763455,"Mohammed is the most common first name in the world. According to the sixth edition of The Columbia Encyclopedia (2000), Muhammad is probably the most common given name in the world, including variations. It is estimated that more than 15 million people in the world bear the name Muhammad. Some variations:"
556,msmarco,_doc,MARCO_8827224,3.9740474,"For many mums-to-be a dash to the bathroom to be sick is one of the first signs of pregnancy. During early pregnancy, up to nine out of 10 women will feel sick or be sick, at some point (Einarson et al 2013, NICE 2013) .So if you spend your early weeks of pregnancy feeling anything but blooming, you’re not alone.Morning sickness is the most common symptom of pregnancy (Einarson et al 2013) . How bad the sickness is varies from woman to woman.orning sickness usually starts in early pregnancy and peaks at about nine weeks of pregnancy (Niebyl et al 2010) . It usually improves toward the end of the first trimester, and clears up completely for many women by 16 weeks to 20 weeks of pregnancy (NHS Choices 2015, NICE 2013, Niebyl et al 2010) ."
557,msmarco,_doc,MARCO_2404210,3.9736376,"References. 1  Fuster V, Rydén LE, Cannom DS, et al. 2  Miyasaka Y, Barnes ME, Gersh BJ, et al. 3  Lin HJ, Wolf PA, Kelly-Hayes M, et al. 4  Healey J, Connolly SJ, Gold MR, et al. 5  Zoll PM, Linenthal AJ, Gibson W, et al. 6  Lown B, Amarasingham R, Neuman J, et al. 7  Lown B, Perlroth MG, Kaidbey S, et al., “Cardioversion” of atrial fibrillation."
558,msmarco,_doc,MARCO_4199930,3.9736376,Hotels nearNearby Cities Auburn AL Hotels 5 miles SW Valley AL Hotels 19 miles NE Smiths AL Hotels 19 miles east Lanett AL Hotels 20 miles NE West Point GA Hotels 21 miles NE Tuskegee AL Hotels 23 miles SW Phenix City AL Hotels 26 miles SE Columbus GA Hotels 28 miles SE Seale AL Hotels 28 miles SE. HotelGuides.com.
559,msmarco,_doc,MARCO_3272064,3.9736376,"More trip calculations. 1  driving distance from Jacksonville, FL to Birmingham, AL. 2  cost to drive from Jacksonville, FL to Birmingham, AL. 3  reverse driving time from Birmingham, AL to Jacksonville, FL. 4  halfway between Jacksonville, FL and Birmingham, AL.ore trip calculations. 1  driving distance from Jacksonville, FL to Birmingham, AL. 2  cost to drive from Jacksonville, FL to Birmingham, AL. 3  reverse driving time from Birmingham, AL to Jacksonville, FL. 4  halfway between Jacksonville, FL and Birmingham, AL."
