,_index,_type,_id,_score,_source.body
235,msmarco,_doc,MARCO_2913415,7.0220575,"Notes: Emilia is a name with Latin origins. The meaning of the name Emilia is to strive, to excel, or to rival. Emilia originally comes from the name Aemilia. Common variations of the name include Amelia, Emelia, Emily, Amilya, Emiliana, and Amilia. Common nicknames include Emma, Em, Emmy, Mia, Millie, and Mellie.milia originally comes from the name Aemilia. Common variations of the name include Amelia, Emelia, Emily, Amilya, Emiliana, and Amilia. Common nicknames include Emma, Em, Emmy, Mia, Millie, and Mellie."
236,msmarco,_doc,MARCO_4492425,7.008862,"The Grand Rapids Child Discovery Center is inspired by the Reggio Emilia philosophy of education that originated in Northern Italy. The GRCDC does not intend to duplicate this philosophy because the children, families and teachers of Grand Rapids, MI offer a different culture, location and perspective.The Reggio Emilia philosophy is an approach to teaching, learning and advocacy for children.In its most basic form, it is a way of observing what children know, are curious about and what challenges them.he GRCDC does not intend to duplicate this philosophy because the children, families and teachers of Grand Rapids, MI offer a different culture, location and perspective. The Reggio Emilia philosophy is an approach to teaching, learning and advocacy for children."
237,msmarco,_doc,MARCO_2678938,6.6537347,Are Emilia Clarke and Johnny Knoxville dating? That's what some fans think based on her latest Instagram activity. Are Emilia Clarke and Johnny Knoxville dating?
238,msmarco,_doc,MARCO_6484134,6.6537347,"Meaning: The Italian name Emilia means-a form of Amelia, Emily.Rating:eaning: The Italian name Emilia means-a form of Amelia, Emily. Rating:"
239,msmarco,_doc,MARCO_3609913,6.6527505,"Desdemona is killed by Othello, Iago kills Emilia (his wife) as Emilia reveals that Desdemona has been falsely accused of adultery and then Othello kills himself rather than live with what he has done."
240,msmarco,_doc,MARCO_8027288,6.6527505,"Emilia me gusta mucho, pero no tengo la tripa para pedirle que salga conmigo. I like Emilia very much, but I don't have the guts to ask her out on a date."
241,msmarco,_doc,MARCO_5869556,6.650786,"Key Elements of The Reggio Emilia Program. Additional key elements of the Reggio Emilia model are the cooperation and collaboration between staff members in each school and throughout the system (Gandini, 1993)."
242,msmarco,_doc,MARCO_4767105,6.646868,"'Game of Thrones' Emilia Clarke talks Dany's harsh break-up with [spoiler] Theirs was a deep, passionate celibate romance: Daenerys Targaryen (Emilia Clarke) and Ser Jorah Mormont (Iain Glen)."
243,msmarco,_doc,MARCO_4668938,6.645891,"What is Reggio Emilia? Broadly speaking, Reggio Emilia is an approach to early childhood learning named after the town where it originated in Italy. Founder Loris Malaguzzi believed children were in need of a more holistic kind of education after World War II."
244,msmarco,_doc,MARCO_4204082,6.64394,"Emilia Clarke. British actress Emilia Clarke was born in London and grew up in Berkshire, England. Her father is a theatre sound engineer and her mother is a businesswoman. Her father was working on a theatre production of Show Boat and her mother took her along to the performance."
245,msmarco,_doc,MARCO_2969077,6.6419926,"Over the weekend, Terminator Genisys grossed $28.7 million to take the third spot at the box office, behind Jurassic World and Inside Out. FYI: Emilia is wearing Dior. 10+ pictures inside of Emilia Clarke and Arnold Schwarzenegger hitting the Terminator Genisys premiere in Japan…."
246,msmarco,_doc,MARCO_3956493,6.640049,"Emilia Clarke. This is the latest accepted revision, reviewed on 13 April 2017. Emilia Clarke (born 23 October 1986) is an English actress. Brought up in Berkshire, she first gained an interest in acting as a child after seeing the musical Show Boat, on which her father was working as a sound engineer."
247,msmarco,_doc,MARCO_2969074,6.640049,"10+ pictures inside of Emilia Clarke and Arnold Schwarzenegger hitting the Terminator Genisys premiere in Japan…. Emilia Clarke is red hot while attending the premiere of her new film Terminator Genisys held at the Roppongi Hills Arena on Monday (July 6) in Tokyo, Japan."
248,msmarco,_doc,MARCO_2558190,6.640049,"Montano, Graziano, and Iago come into the room. Iago attempts to silence Emilia, who realizes what Iago has done. At first, Othello insists that Iago has told the truth, citing the handkerchief as evidence. Once Emilia tells him how she found the handkerchief and gave it to Iago, Othello is crushed and begins to weep."
249,msmarco,_doc,MARCO_1232007,6.638109,The names Aceto Balsamico Tradizionale di Modena (Traditional Balsamic Vinegar of Modena) and Aceto Balsamico Tradizionale di Reggio Emilia (Traditional Balsamic Vinegar of Reggio Emilia) are protected by both the Italian Denominazione di origine protetta and the European Union's Protected Designation of Origin.
250,msmarco,_doc,MARCO_8605566,6.638109,"Act 4, Scene 3, Page 2. Enter OTHELLO, LODOVICO, DESDEMONA, EMILIA and attendants. OTHELLO, LODOVICO, DESDEMONA and EMILIA enter, with attendants. I do beseech you, sir, trouble yourself no further. Please, sir, don’t trouble yourself. Oh, pardon me, ’twill do me good to walk."
251,msmarco,_doc,MARCO_1784851,6.6371408,"Emilia /emil-ia/ [4 sylls.] as a girls' name is of Latin origin, and the meaning of Emilia is rival; laborious; eager. From the Roman clan name Aemilius. See Amelia.Kreatif forms: Emicia, Emiliaeu, Euemilia.milia is a very prominent first name for women (#773 out of 4276, Top 18%) but an unusual surname for all people."
252,msmarco,_doc,MARCO_1757350,6.6371408,"The Tunnel: Sabotage Adds Emilia Fox & Others to Cast. LONDON: Emilia Fox (Silent Witness), Clarke Peters (The Wire), Paul Schneider (Parks and Recreation) and William Ash (Shameless) have joined the cast of the Sky original drama The Tunnel: Sabotage. The content you are trying to access is only available to members."
253,msmarco,_doc,MARCO_7286818,6.6342406,"Emilia Clarke, Actress: Game of Thrones. British actress Emilia Clarke was born in London and grew up in Berkshire, England. Her father is a theatre sound engineer and her mother is a businesswoman. Her father was working on a theatre production of Show Boat and her mother took her along to the performance. This is when, at the age of 3, her passion for drama began. From 2000 to 2005, ..."
254,msmarco,_doc,MARCO_1679275,6.633276,"Origin of the name Amelia: An English variant of the Germanic Amalia, which is derived from amal (work). Alternatively, it may be a variant of Emilia (rival). From A World of Baby Names by Teresa Norman.rigin of the name Amelia: An English variant of the Germanic Amalia, which is derived from amal (work). Alternatively, it may be a variant of Emilia (rival). From A World of Baby Names by Teresa Norman."
255,msmarco,_doc,MARCO_4492420,6.632312,"The Reggio Emilia Approach is an innovative and inspiring approach to early childhood education which values the child as strong, capable and resilient; rich with wonder and knowledge.utside of the town of Reggio Emilia, all schools and preschools (and home schools) are Reggio-inspired, using an adaptation of the approach specific to the needs of their community. This is important, as each student, teacher, parent, community, and town are different."
256,msmarco,_doc,MARCO_3995400,6.6303873,"Me Before You (2016) Me Before You – Emilia Clarke, Sam Claflin Movie. About: A girl in a small town forms an unlikely bond with a recently-paralyzed man she’s taking care of. Cast: Emilia Clarke, Sam Claflin, Jenna Coleman, Matthew Lewis, Brendan Coyle, Lily Travers, Verity Marshall. Trailer Song: Oh Honey: Take All the Time You Need."
257,msmarco,_doc,MARCO_3855353,6.6284657,Children: Louise Juliana ORANGE-NASSAU ; Emilia de NASSAU ; Justinus von NASSAU ; Frederic Henry (K.G.) (Prince) of ORANGE ; Maurice de NASSAU (Stadholder/Prince) of ORANGE ; Catherine Belgica (Princess) of ORANGE ; Charlotte Brabantina (Princess) van NASSAU ; Elisabeth von NASSAU ; Emilia Secunda Antwerpina von NASSAU-ORANIEN ; Philip William ( ...
258,msmarco,_doc,MARCO_4492426,6.6284657,"Broadly speaking, Reggio Emilia is an approach to early childhood learning named after the town where it originated in Italy. Founder Loris Malaguzzi believed children were in need of a more holistic kind of education after World War II.roadly speaking, Reggio Emilia is an approach to early childhood learning named after the town where it originated in Italy. Founder Loris Malaguzzi believed children were in need of a more holistic kind of education after World War II."
259,msmarco,_doc,MARCO_6930941,6.6265483,"The Province of Modena, in line with the best of Emilian traditions, is a lterritory defined by flavors, nature and its love for motors. Its Capital, Modena, is a city with an important past; to begin with, it was built along the ancient Via Emilia, and it seems to be Etruscan in origins.he streets of Modena are rather tighly-knit, consequence of the construction of buildings and streets along canals that once flowed in the heart of the city. An example is Corso Canal Grande, one of the most characteristic streets, crossed by the Via Emilia, with its residential buildings."
260,msmarco,_doc,MARCO_1784856,6.6246343,"Emilia has its origins in the Latin language. It is used largely in English, Hungarian, Italian, Finnish, German, Polish, Portuguese, Romanian, Scandinavian, and Spanish. It is derived from the word aemulus which is of the meaning 'imitating, rivaling'. An old form of the name is Aemilia (Latin).milia is popular as a baby girl name, and it is also regarded as trendy. The name has been rising in popularity since the 1980s. At the recent peak of its usage in 2012, 0.063% of baby girls were named Emilia."
261,msmarco,_doc,MARCO_1259340,6.6246343,"Lena Headey & Emilia Clarke talk ‘Game Of Thrones’ Season 4. Emilia Clarke, Richard Plepler, Peter Dinklage, David Benioff, D.B. Weiss, Lena Headey, Jack Gleeson and Michael Lombardo attend the ‘Game Of Thrones’ Season 4 New York premiere at Avery Fisher Hall, Lincoln Center on March 18, 2014 in New York City."
262,msmarco,_doc,MARCO_3431057,6.6246343,"A character who contrasts and parallels the main character in a play or story. Laertes, in Hamlet, is a foil for the main character; in Othello, Emilia and Bianca are foils for Desdemona. Foreshadowing. Hints of what is to come in the action of a play or a story. character who contrasts and parallels the main character in a play or story. Laertes, in Hamlet, is a foil for the main character; in Othello, Emilia and Bianca are foils for Desdemona. Foreshadowing. Hints of what is to come in the action of a play or a story."
263,msmarco,_doc,MARCO_1807839,6.622724,"Meaning & History. Variant of AMALIA, though it is sometimes confused with EMILIA, which has a different origin. The name became popular in England after the German House of Hanover came to the British throne in the 18th century-it was borne by daughters of George II and George III.eaning & History. Variant of AMALIA, though it is sometimes confused with EMILIA, which has a different origin. The name became popular in England after the German House of Hanover came to the British throne in the 18th century-it was borne by daughters of George II and George III."
264,msmarco,_doc,MARCO_3852146,6.622724,"Act IV, Scene III. Othello tells Desdemona to go to bed, and dismiss Emilia for the night, that he will come to her shortly. As Desdemona and Emilia converse, it is clear that Desdemona is beside herself with anguish because of Othello's mistrust.enice's military hero, the middle-aged Othello, a black Moor, has secretly eloped with the much younger Desdemona, the daughter of Venetian senator Brabantio. Desdemona, a lady who moves in the best social circles in Venice, has fallen in love with Othello's hero-general persona."
265,msmarco,_doc,MARCO_2913416,6.622724,"The meaning of the name Emilia is to strive, to excel, or to rival. Emilia originally comes from the name Aemilia. Common variations of the name include Amelia, Emelia, Emily, Amilya, Emiliana, and Amilia.Common nicknames include Emma, Em, Emmy, Mia, Millie, and Mellie.milia originally comes from the name Aemilia. Common variations of the name include Amelia, Emelia, Emily, Amilya, Emiliana, and Amilia. Common nicknames include Emma, Em, Emmy, Mia, Millie, and Mellie."
266,msmarco,_doc,MARCO_4568972,6.6208177,"Amelia is a name with Latin origins. The meaning of the name Amelia is to strive, to excel, or to rival. Amelia originally comes from the name Aemilia.Common variations of the name include Emilia, Amilya, and Amilia.Amelie is the French version of the name Amelia.otes: Amelia is a name with Latin origins. The meaning of the name Amelia is to strive, to excel, or to rival. Amelia originally comes from the name Aemilia. Common variations of the name include Emilia, Amilya, and Amilia. Amelie is the French version of the name Amelia."
267,msmarco,_doc,MARCO_7849733,6.6208177,"Emilia is a variant spelling of Emily. Emily is derived from Aemilia, the Latin feminine form of the Roman family name Aemilius. The name Aemilius was in turn derived from the Latin word aemulus meaning rival.Emilia has the diminutives (nicknames) Emmie, Emmy.mily is derived from Aemilia, the Latin feminine form of the Roman family name Aemilius. The name Aemilius was in turn derived from the Latin word aemulus meaning rival. Emilia has the diminutives (nicknames) Emmie, Emmy."
268,msmarco,_doc,MARCO_1807837,6.6189146,"Amelia is a name with Latin origins. The meaning of the name Amelia is to strive, to excel, or to rival. Amelia originally comes from the name Aemilia. Common variations of the name include Emilia, Amilya, and Amilia.Amelie is the French version of the name Amelia.Common nicknames include Amy, Mia, Millie, Melie, and Ames.melia originally comes from the name Aemilia. Common variations of the name include Emilia, Amilya, and Amilia. Amelie is the French version of the name Amelia. Common nicknames include Amy, Mia, Millie, Melie, and Ames."
269,msmarco,_doc,MARCO_2913419,6.6189146,"See Amelia’s name page for more detail. Emelia developed as an alternate spelling of Amelia. Most etymologists agree that Amelia and Emelia are more related to Amalia (meaning “work, industrious”) rather than Aemilia (from the Latin meaning “rival”) which gave us the names Emilia, Emilie and Emily.ou should consider if you prefer the “industrious” meaning or the “rival” one. It’s the difference between Emelia and Emilia. Popularity of the Girl Name Emelia. You need Adobe Flash Player 6 (or above) to view the charts."
270,msmarco,_doc,MARCO_4568973,6.6189146,"Notes: Amelia is a name with Latin origins. The meaning of the name Amelia is to strive, to excel, or to rival. Amelia originally comes from the name Aemilia. Common variations of the name include Emilia, Amilya, and Amilia. Amelie is the French version of the name Amelia.otes: Amelia is a name with Latin origins. The meaning of the name Amelia is to strive, to excel, or to rival. Amelia originally comes from the name Aemilia. Common variations of the name include Emilia, Amilya, and Amilia. Amelie is the French version of the name Amelia."
271,msmarco,_doc,MARCO_1784854,6.6170154,"Etymology & Historical Origin-Emilia. Emilia is the Italian and Spanish form of Emily, which is derived from the Latin name “Aemilia”, a female version of the Old Roman family name, “Aemilius” (probably from the Latin “aemulus” meaning ‘rival’).milia is the Italian and Spanish form of Emily, which is derived from the Latin name “Aemilia”, a female version of the Old Roman family name, “Aemilius” (probably from the Latin “aemulus” meaning ‘rival’)."
272,msmarco,_doc,MARCO_1516422,6.6170154,"A Emilia Klapp, Nutrition & Dietetics, answered. Symptoms of a chromium deficiency include a craving for sweets, depression, a decrease in the body’s ability to metabolize glucose and fats, an inhibition in the body’s production of protein, and an increased production of too much cholesterol and triglycerides. Emilia Klapp, Nutrition & Dietetics, answered. Symptoms of a chromium deficiency include a craving for sweets, depression, a decrease in the body’s ability to metabolize glucose and fats, an inhibition in the body’s production of protein, and an increased production of too much cholesterol and triglycerides."
273,msmarco,_doc,MARCO_3412295,6.6170154,Jon Snow (played by Kit Harington) in season four of 'Game of Thrones.'. Jon Snow (played by Kit Harington) in season four of 'Game of Thrones.'. Daenerys Targaryen (played by Emilia Clarke) in season four of 'Game of Thrones.'. Daenerys Targaryen (played by Emilia Clarke) in season four of 'Game of Thrones.'. Samwell Tarly (played by John Bradley) in season four of 'Game of Thrones.'. Samwell Tarly (played by John Bradley) in season four of 'Game of Thrones.'.
274,msmarco,_doc,MARCO_5842924,6.6170154,"'Star Wars': Emilia Clarke Cast in Han Solo Stand-Alone Movie. Clarke’s role will round out a dynamic cast of characters that Han and Chewie will encounter on their adventures.. Games of Thrones actress Emilia Clarke has been cast in the upcoming stand-alone Han Solo film, according to the official Star Wars website. StarWars.com is excited to announce that Clarke, known for her stirring portrayal of Daenerys Targaryen in HBO's Game of Thrones, will join the upcoming untitled Han Solo Star Wars movie."
275,msmarco,_doc,MARCO_1679271,6.6151195,"Amelia /ame-lia/ [4 sylls.] as a girls' name is pronounced a-MEEL-yah. It is of Latin and Old German origin, and the meaning of Amelia is rival, eager work. Blend of two medieval names: the Latin Emilia (see Emily) and the Latin German Amalia, meaning work.An 18th-century Princess Amelia brought the name to Britain.lend of two medieval names: the Latin Emilia (see Emily) and the Latin German Amalia, meaning work. An 18th-century Princess Amelia brought the name to Britain."
276,msmarco,_doc,MARCO_2913422,6.6151195,"It is of Latin and Old German origin, and the meaning of Amelia is rival, eager work. Blend of two medieval names: the Latin Emilia (see Emily) and the Latin German Amalia, meaning work. An 18th-century Princess Amelia brought the name to Britain.t is of Latin and Old German origin, and the meaning of Amelia is rival, eager work. Blend of two medieval names: the Latin Emilia (see Emily) and the Latin German Amalia, meaning work. An 18th-century Princess Amelia brought the name to Britain."
277,msmarco,_doc,MARCO_1464996,6.60382,"Amelia /ame-lia/ [4 sylls.] as a girls' name is pronounced a-MEEL-yah. It is of Latin and Old German origin, and the meaning of Amelia is rival, eager work. Blend of two medieval names: the Latin Emilia (see Emily) and the Latin German Amalia, meaning work.An 18th-century Princess Amelia brought the name to Britain.melia /ame-lia/ [4 sylls.] as a girls' name is pronounced a-MEEL-yah. It is of Latin and Old German origin, and the meaning of Amelia is rival, eager work. Blend of two medieval names: the Latin Emilia (see Emily) and the Latin German Amalia, meaning work."
278,msmarco,_doc,MARCO_7711766,6.60382,"Emily /emi-ly/ [3 sylls.] as a girls' name is pronounced EM-i-ee. It is of Latin origin, and the meaning of Emily is rival; laborious; eager.Feminine of Emil, from the Latin name Aemilia, feminine form of the old Roman surname Aemilius (probably from aemulus).Literary: the form Emelye was used in the 14th century by Chaucer's The Knight's Tale , which was a translation of Emilia, the form in Chaucer's source, Boccaccio's Teseida.eminine of Emil, from the Latin name Aemilia, feminine form of the old Roman surname Aemilius (probably from aemulus). Literary: the form Emelye was used in the 14th century by Chaucer's The Knight's Tale , which was a translation of Emilia, the form in Chaucer's source, Boccaccio's Teseida."
279,msmarco,_doc,MARCO_498772,6.466417,"A Emilia Klapp , Nutrition & Dietetics, answered. Although they appear big and plump, strawberries contain 85% water. So one cup (about eight berries) contains barely 42 calories, making strawberries a super food to reduce and maintain weight."
280,msmarco,_doc,MARCO_1407058,6.456693,"Riunite 750 d'Oro Moscato* Muscat Blanc A Petits Grains,Trebbiano from Emilia. Food pairing A fruity and aromatic wine, Riunite Trebbiano Moscato is a perfect companion for today's spicy cuisines, especially Tex-Mex, Indian, Thai and Chinese Szechuan cuisine."
281,msmarco,_doc,MARCO_1407057,6.4547544,"Riunite Moscato D Oro 750ML Muscat Blanc A Petits Grains,Trebbiano from Emilia. Food pairing A fruity and aromatic wine, Riunite Trebbiano Moscato is a perfect companion for today's spicy cuisines, especially Tex-Mex, Indian, Thai and Chinese Szechuan cuisine."
282,msmarco,_doc,MARCO_8784979,6.4393106,"A Emilia Klapp , Nutrition & Dietetics, answered. Lycopene, which is found in tomatoes and tomato products, absorbs in the body best when it is heated, combined with fats, or combined with other antioxidant foods. Try these tips: Eat tomato sauce, tomato paste, or tomato soup, all of which are good heated sources of lycopene. Eat fresh tomatoes with olive oil, an ideal fat for absorption."
283,msmarco,_doc,MARCO_1757343,5.968769,Emilia Fox and The Wire's Clarke Peters join The Tunnel: Sabotage - get a first look.
284,msmarco,_doc,MARCO_274170,5.9638257,"Arnold Schwarzenegger, Emilia Clarke and Jai Courtney star in Terminator: Genisys, the fifth installment of the ‘Terminator’ franchise."
285,msmarco,_doc,MARCO_574353,5.96284,"Besides their films, albums, and TV shows, celebrities often become known for their crazy diet and fitness plans—ahem, Emilia Clarke and Chris Hemsworth."
286,msmarco,_doc,MARCO_1303052,5.96284,Raw Power (band) Raw Power is an Italian hardcore punk band from Reggio Emilia. They were formed in 1981 and are still active today.
287,msmarco,_doc,MARCO_5427666,5.96284,Othello tells Iago to have Emilia watch Desdemona when she is with Cassio. Iago appears to retreat from his accusations and suggests that Othello leave the matter alone.
288,msmarco,_doc,MARCO_7725881,5.9618554,The origin of tortellini is obscure although many legends lay claim to the origins of it. A strong local tradition has it that this dish was born in Castelfranco Emilia (province of Modena).
289,msmarco,_doc,MARCO_7549345,5.9618554,"Emilia Clarke plays the formidable Mother of Dragons in HBO's Game of Thrones, but a little-known fact about the British actress is that she's also pretty darn hilarious."
290,msmarco,_doc,MARCO_2969076,5.9608717,"She was portrayed by Linda Hamilton in The Terminator and Terminator 2: Judgment Day, by Lena Headey in Terminator: The Sarah Connor Chronicles, and by Emilia Clarke in Terminator Genisys."
291,msmarco,_doc,MARCO_7328381,5.9608717,"According to Emilia, events do not cause jealousy; jealousy causes events and further jealousy. slide 5 of 5 Now all your friends will be jealous of your knowledge of Othello, by William Shakespeare."
292,msmarco,_doc,MARCO_7549348,5.9608717,Ha ha ha :). Finally after a lot of waiting (and pushing!) Emilia Tommasina is here. And we love her to pieces! She is absolutely wonderful in every way and we are so happy that she has joined our little family!
293,msmarco,_doc,MARCO_274169,5.959889,Kyle Reese (Courtney) is sent back in time by John Connor (Jason Clarke) to protect John’s mother Sarah (Emilia Clarke) as she is hunted by the Terminator.
294,msmarco,_doc,MARCO_1833753,5.959889,"See ratings and reviews for Dr. Emilia Sordillo, Infectious Disease Specialist in New York, New York. View contact info, specialties, education history, and more."
295,msmarco,_doc,MARCO_4748309,5.959889,"In Central Europe, Mia is a pet form for Amalia, Amelia, Emilia, Emily and Mary (given name) The name is also occasionally used as a spelling variant of the name Maya."
296,msmarco,_doc,MARCO_5330918,5.959889,"The fifth installment in the Terminator franchise, the film stars Arnold Schwarzenegger, reprising his role as the eponymous character, along with Jason Clarke, Emilia Clarke, and Jai Courtney."
297,msmarco,_doc,MARCO_5869557,5.959889,"Although the Reggio Emilia program is the most recent example of the project approach in early education, the methods have been a part of educational experiences since at least the 1920s and the work of John Dewey."
298,msmarco,_doc,MARCO_8823206,5.959889,"Blanche and Portia full story - Upstairs Downstairs (lesbian interest) Alex Kingston/Emilia Fox - Duration: 14:13. frenisback 410,459 views"
299,msmarco,_doc,MARCO_399521,5.958907,"Origin of the name Amelia: An English variant of the Germanic Amalia, which is derived from amal (work). Alternatively, it may be a variant of Emilia (rival). From A World of Baby Names by Teresa Norman."
300,msmarco,_doc,MARCO_2969073,5.958907,"Emilia Clarke is red hot while attending the premiere of her new film Terminator Genisys held at the Roppongi Hills Arena on Monday (July 6) in Tokyo, Japan."
301,msmarco,_doc,MARCO_3857240,5.958907,"Desdemona is the only named character in Cinthio's tale, with his few other characters identified only as the Moor, the Squadron Leader, the Ensign, and the Ensign's Wife (corresponding to the play's Othello, Cassio, Iago and Emilia)."
302,msmarco,_doc,MARCO_7039834,5.958907,"Origin of the name Amelie: An English variant of the Germanic Amalia, which is derived from amal (work). Alternatively, it may be a variant of Emilia (rival). From A World of Baby Names by Teresa Norman."
