,_index,_type,_id,_score,_source.body
760,msmarco,_doc,MARCO_3193885,3.1627991,"In A Nutshell. Ode to a Nightingale is one of the most famous – probably the most famous – of John Keats 's Great Odes, which also include  Ode on a Grecian Urn  and . To Autumn ..The ode is a traditional Greek form that usually celebrates the person or object to which it is dedicated.de to a Nightingale is one of the most famous – probably the most famous – of John Keats 's Great Odes, which also include  Ode on a Grecian Urn  and ."
761,msmarco,_doc,MARCO_3763927,3.1627991,1 Robert De Niro. 2  Although he is on the famous male actors from the '80s list he is much more famous than that. 3  Starting with The Godfather in the '70s De Niro has portrayed each role with individuality. 4  Michael Douglas. Although he is on the famous male actors from the '80s list he is much more famous than that. 2  Starting with The Godfather in the '70s De Niro has portrayed each role with individuality. 3  Michael Douglas.
762,msmarco,_doc,MARCO_5148840,3.1627991,"Perhaps the most famous woman of the twentieth century is a small, frail-looking nun by the name of Agnes Gonxha Bojaxhiu, who became much better known to the world simply as Mother Theresa.s Anne Bolyne more famous than any of Henry VIIIs other wives? Khadija is someone who, frankly, hardly anyone has ever heard of (this is FAMOUS women, not important women) and how you can think Helen of Troy is THE most famous woman ever is beyond me. Lady Godiva hardly knows fame outside of England."
763,msmarco,_doc,MARCO_6215297,3.1627991,"Build London's famous Tower Bridge! Stretching over the River Thames since 1894, the famous Tower Bridge of London, England is one of the most recognizable landmarks in the world.Now you can add this timeless classic to your LEGO world buildings collection!uild London's famous Tower Bridge! Stretching over the River Thames since 1894, the famous Tower Bridge of London, England is one of the most recognizable landmarks in the world."
764,msmarco,_doc,MARCO_8592916,3.1627991,"Nobelium can be seen as one of these. Some would argue that Alfred Nobel was a famous scientist. It's true that he was technically a chemist, but I challenge anyone to come up with a scientific discovery that Nobel is famous for. Born in Stockholm in 1833, Nobel was the son of an engineer.obelium can be seen as one of these. Some would argue that Alfred Nobel was a famous scientist. It's true that he was technically a chemist, but I challenge anyone to come up with a scientific discovery that Nobel is famous for. Born in Stockholm in 1833, Nobel was the son of an engineer."
765,msmarco,_doc,MARCO_2128088,3.160878,Recent. 1  10 Major Achievements of The Ancient Aztec Civilization. 2  10 Most Famous Works of American Writer Ernest Hemingway. 3  10 Most Famous Spanish Artists And Their Masterpieces. 4  Archimedes | 10 Facts On The Ancient Greek Mathematician. 5  10 Most Famous Elegies By Renowned Poets. 6  10 Most Famous Paintings of the Realism Art Movement.
766,msmarco,_doc,MARCO_4473859,3.160878,Guilin is China's most picturesque region and has long been one of the world's most famous travel destinations. It's breathtaking scenery has attracted many famous poets and artists for thousands of years.Artists are able to find inspiration from the Karst mountains and the unsurpassed beauty of the Li River.uilin is China's most picturesque region and has long been one of the world's most famous travel destinations. It's breathtaking scenery has attracted many famous poets and artists for thousands of years.
767,msmarco,_doc,MARCO_6256546,3.160878,The name Roger is a Teutonic baby name. In Teutonic the meaning of the name Roger is: Famous fighter. American Meaning: The name Roger is an American baby name.In American the meaning of the name Roger is: Famous fighter.n Teutonic the meaning of the name Roger is: Famous fighter. American Meaning: The name Roger is an American baby name. In American the meaning of the name Roger is: Famous fighter.
768,msmarco,_doc,MARCO_7325797,3.160878,"Famous people with depression. Depression is a serious illness that can happen to anyone, even people who seem to have it all. Here are 20 famous people, whether actors, singers, or athletes, who have struggled with depression, including postpartum depression and bipolar disorder. Famous people with depression. Depression is a serious illness that can happen to anyone, even people who seem to have it all. Here are 20 famous people, whether actors, singers, or athletes, who have struggled with depression, including postpartum depression and bipolar disorder. 1 of 22."
769,msmarco,_doc,MARCO_864594,3.1589603,"An island landform is land that is completely surrounded by water. It can be any. type of land. The island can also be surrounded different types of water such as a sea, ocean, river and lake. There are a lot of famous islands in the world. One of the most famous island landforms are the Hawaii islands.ype of land. The island can also be surrounded different types of water such as a sea, ocean, river and lake. There are a lot of famous islands in the world. One of the most famous island landforms are the Hawaii islands."
770,msmarco,_doc,MARCO_4112937,3.1589603,Total Poets: 8. A List of Famous Welsh Poets includes Poems and Biographical information of the most Famous Welsh Poets.Read and Enjoy Poetry by Welsh Poets.See also: Poets by Nationality | Contemporary Welsh Poets. List of Famous Welsh Poets includes Poems and Biographical information of the most Famous Welsh Poets. Read and Enjoy Poetry by Welsh Poets. See also: Poets by Nationality | Contemporary Welsh Poets.
771,msmarco,_doc,MARCO_1056876,3.1589603,"Egyptians were famous for much of their architecture but they were definitely most famous for their pyramids, and the phenomena of how they were constructed. Pyramids can be defined as large structures with four triangular sides that meet in a point at the top, directly over the center of the pyramid's square base.gyptians were famous for much of their architecture but they were definitely most famous for their pyramids, and the phenomena of how they were constructed. Pyramids can be defined as large structures with four triangular sides that meet in a point at the top, directly over the center of the pyramid's square base."
772,msmarco,_doc,MARCO_1667574,3.1589603,"Famous Dog Names : All Names From “A – B”. It’s fun to use famous dog names when naming your own dog. With canine stars from TV, Movies, Politics, Books and Comic Strips, there are more than 400 exciting possibilities. Maybe your dog will make the list, too! What makes a dog famous? Maybe they have been in the public light as a U.S. President’s dog, as a famous movie dog or as a popular comic strip star."
773,msmarco,_doc,MARCO_1905411,3.1589603,"Maybe Al Gore is more famous than Obama because of his connection to global warming. The President of the United States is the most famous person in the world. The 2009 most famous would be the new President of the United States, Barack Hussein Obama. However, this is usually true of contemporary politicians in the media. Other famous people are Bill Gates, Queen Elizabeth of England, Warren Buffet, Richard Branson, Paul McCartney, Pope Benedict, and the late Michael Jackson."
774,msmarco,_doc,MARCO_2783176,3.1589603,"George Dewey Occupation Military Leader Birth Date December 26, 1837 Death Date January 16, 1917 Education US Naval Academy Place of Birth Montpelier, Vermont Place of Death Washington, D.C. Cite This Page; IN THESE GROUPS. Famous Union Figures; Famous People Named Dewey; Famous People Born in United States; Famous People Who Served in the Navy"
775,msmarco,_doc,MARCO_4078004,3.1589603,"1 Visit Wayanad which is a famous Hill Resorts in North Kerala. 2  Wayanad is the name of a District. 3  There are many famous Travel Spots in Wayanad. 4  Wayanad is known for its spices, waterfalls and Wildlife. Visit Wayanad which is a famous Hill Resorts in North Kerala. 2  Wayanad is the name of a District. 3  There are many famous Travel Spots in Wayanad. 4  Wayanad is known for its spices, waterfalls and Wildlife."
776,msmarco,_doc,MARCO_4604123,3.1589603,Hatfield and McCoy Feud Sites. The Hatfield-McCoy Feud is the most famous feud in American history. It occurred in southern West Virginia and eastern Kentucky. Dozens of books and movies have been made about this world famous conflict.he Hatfield-McCoy Feud is the most famous feud in American history. It occurred in southern West Virginia and eastern Kentucky. Dozens of books and movies have been made about this world famous conflict.
777,msmarco,_doc,MARCO_5167516,3.1589603,"Who is a famous person from Switzerland? Some famous people who are from Switzerland include Kat Graham,  Marthe Keller, Carlos Leal, and Christianne Hirt.hat is famous to one person may be less well known to another. Famous mountains include: Jungfrau (4158 metres), along with its two accompanying peaks, … the Moench (mönch 4107) metres And (eiger 3970) Metres (titlis 3238) Metres Monte (rosa 4634) Metres (matterhorn 4478). metres"
778,msmarco,_doc,MARCO_6227552,3.1589603,"Share to: 1  5 Famous California Inventors California is the most populous state in the entire country. 2  It is home to famous landmarks like the Golden Gate Bridge, Alcatraz, and Yosemite National Park. 5 Famous California Inventors California is the most populous state in the entire country. 2  It is home to famous landmarks like the Golden Gate Bridge, Alcatraz, and Yosemite National Park. 3  While sunny Cal…."
779,msmarco,_doc,MARCO_6801440,3.1589603,wolf names have been used for centuries in different countries throughout the world many of these names have been adopted by people as strong identifications of themselves to the worldi ve listed below some of the most famous and not so famous wolf names and their meaningssome are male wolf names some are female and some can be interchanged between the twoany of these names have been adopted by people as strong identifications of themselves to the world i ve listed below some of the most famous and not so famous wolf names and their meanings some are male wolf names some are female and some can be interchanged between the two
780,msmarco,_doc,MARCO_7588884,3.1589603,"List of celebrities whose children committed suicide, with photos. Many of these children were known for their famous parent's celebrity status, though their deaths are tragedies no matter the circumstances. Famous children can have a hard time establishing names for themselves to the media.ist of celebrities whose children committed suicide, with photos. Many of these children were known for their famous parent's celebrity status, though their deaths are tragedies no matter the circumstances. Famous children can have a hard time establishing names for themselves to the media."
781,msmarco,_doc,MARCO_2421333,3.1570466,"As the most famous party island in Spain, Ibiza attracts partying a ridiculous amount of tourists every summer. From June to September, this small Spanish island is home to the world’s famous DJs and the best parties ever.s the most famous party island in Spain, Ibiza attracts partying a ridiculous amount of tourists every summer. From June to September, this small Spanish island is home to the world’s famous DJs and the best parties ever."
782,msmarco,_doc,MARCO_3848053,3.1570466,"advertisement. Julius Caesar was such a famous and important leader in ancient Rome that they named a month after him-July, for Julius Caesar. Julius Caesar was an able administrator and a famous general. He wrote new laws and changed and improved how to rule provinces of the empire.The Roman Republic was in trouble.ulius Caesar was such a famous and important leader in ancient Rome that they named a month after him-July, for Julius Caesar. Julius Caesar was an able administrator and a famous general."
783,msmarco,_doc,MARCO_5072264,3.1570466,"Surtsey is only the most famous, or one of the most famous, of the islands known to have emerged from below the sea surface in living memory. For example, on September 24, 2013, an earthquake caused the birth of a new mud island off Pakistan’s southern coast.urtsey is only the most famous, or one of the most famous, of the islands known to have emerged from below the sea surface in living memory. For example, on September 24, 2013, an earthquake caused the birth of a new mud island off Pakistan’s southern coast."
784,msmarco,_doc,MARCO_6801438,3.1570466,200 wolf names and meanings wolf names have been used for centuries in different countries throughout the world for association with power and status many wolf names meanings of these names have been adopted by people as strong identifications of themselves to the world they live in and are apart ofaha has listed below some of the most famous and maybe not so famous wolf names and their meaningsany wolf names meanings of these names have been adopted by people as strong identifications of themselves to the world they live in and are apart of aha has listed below some of the most famous and maybe not so famous wolf names and their meanings
785,msmarco,_doc,MARCO_6227548,3.1570466,"1 5 Famous California Inventors California is the most populous state in the entire country. 2  It is home to famous landmarks like the Golden Gate Bridge, Alcatraz, and Yosemite National Park.3  While sunny Cal…. 5 Famous California Inventors California is the most populous state in the entire country. 2  It is home to famous landmarks like the Golden Gate Bridge, Alcatraz, and Yosemite National Park. 3  While sunny Cal…."
786,msmarco,_doc,MARCO_6099091,3.1570466,"Sir Isaac Newton was famous for his 3 laws of motion. Isaac Newton is famous because he explained gravity. He found how gravity works and now because of Isaac Newton we all know about gravity, and can explain the meaning.e also figured out why a rainbow is made. Isaac Newton was well known the three laws of motion. He was also know for the math genius he was. sir Isaac Newton was famous for many things, but his moat famous were the 3 laws of motion, explaining gravity, and the light spectrum."
787,msmarco,_doc,MARCO_1739223,3.1551363,"Origin of the name Luis: Derived from the Old French Loeis, which is from the Old High German Hluodowig (famous in war), a compound name composed from the elements hluod (famous) and wīg (war, strife).From A World of Baby Names by Teresa Norman.Buy the book.erived from the Old French Loeis, which is from the Old High German Hluodowig (famous in war), a compound name composed from the elements hluod (famous) and wīg (war, strife)."
788,msmarco,_doc,MARCO_2372718,3.1551363,"The names of some famous persons by the name Norval (or its variants) are: Norval Crawford White, born on 12 June, a famous architect.Norval Crawford White 's background: An American architect, architectural historian and professor. Norval Baptie, born on 18 March, a famous athlete.orval Alexander Horner, born on 21 August, a famous politician. Norval Alexander Horner's background: A Saskatchewan politician and former member of the Canadian House of Commons."
789,msmarco,_doc,MARCO_5148839,3.1551363,"While most famous historical figures have traditionally been men, there are a few women who managed to reach the rarified air of either notoriety or power usually reserved for their testosterone-prone contemporaries; which, considering the patriarchal nature of society for the last ten thousand years, is no small feat.s Anne Bolyne more famous than any of Henry VIIIs other wives? Khadija is someone who, frankly, hardly anyone has ever heard of (this is FAMOUS women, not important women) and how you can think Helen of Troy is THE most famous woman ever is beyond me. Lady Godiva hardly knows fame outside of England."
790,msmarco,_doc,MARCO_6801439,3.1551363,by buddy january 30 2011 wolf names have been used for centuries in different countries throughout the world many of these names have been adopted by people as strong identifications of themselves to the world i ve listed below some of the most famous and not so famous wolf names and their meaningssome are male wolf names some are female and some can be interchanged between the twoany of these names have been adopted by people as strong identifications of themselves to the world i ve listed below some of the most famous and not so famous wolf names and their meanings some are male wolf names some are female and some can be interchanged between the two
791,msmarco,_doc,MARCO_6099094,3.1551363,"Isaac Newton was well known the three laws of motion. He was also know for the math genius he was. sir Isaac Newton was famous for many things, but his moat famous were the 3 laws of motion, explaining gravity, and the light spectrum.He discovered gravity.saac Newton was well known the three laws of motion. He was also know for the math genius he was. sir Isaac Newton was famous for many things, but his moat famous were the 3 laws of motion, explaining gravity, and the light spectrum. He discovered gravity."
792,msmarco,_doc,MARCO_6127199,3.1551363,"The temple is topped with a concrete dome with a central opening: the oculus. Almost two thousand years after it was built, the Pantheon’s famous dome is still the largest unreinforced concrete dome in the world. Most Famous Domes: The Pantheon in Rome (source: wiki). 10.lmost two thousand years after it was built, the Pantheon’s famous dome is still the largest unreinforced concrete dome in the world. Most Famous Domes: The Pantheon in Rome (source: wiki). 10."
793,msmarco,_doc,MARCO_6716830,3.1551363,The name Louis is a Teutonic baby name. In Teutonic the meaning of the name Louis is: Famous in war. American Meaning: The name Louis is an American baby name. In American the meaning of the name Louis is: Famous in war.he name Louis is a Teutonic baby name. In Teutonic the meaning of the name Louis is: Famous in war. American Meaning: The name Louis is an American baby name. In American the meaning of the name Louis is: Famous in war.
794,msmarco,_doc,MARCO_7816498,3.1551363,"Chimta: Tongs Chutney: Fresh relishes made with fruits, vegetables, and herbs. Curry: To Indians, the term curry means gravy or sauce, Curries are what made Indian cuisine famous all over the world, the most famous of all is the Chicken Curry.himta: Tongs Chutney: Fresh relishes made with fruits, vegetables, and herbs. Curry: To Indians, the term curry means gravy or sauce, Curries are what made Indian cuisine famous all over the world, the most famous of all is the Chicken Curry."
795,msmarco,_doc,MARCO_6823936,3.1551363,Natural Way To Get Rid Of Eye Floaters. In 2003 HUL came back positive and negative effects only one eye amblyopia is also good for promoting or advertising. Here are some of the famous forts of Goa. Goa is famous for inaccurately filled patients.atural Way To Get Rid Of Eye Floaters. In 2003 HUL came back positive and negative effects only one eye amblyopia is also good for promoting or advertising. Here are some of the famous forts of Goa. Goa is famous for inaccurately filled patients.
796,msmarco,_doc,MARCO_1410804,3.1532297,"Once the tallest structure in the world, the Eiffel Tower is probably Europe's best known landmark and Paris's most famous symbol. You couldn't possibly visit Paris without seeing the Eiffel Tower. Even if you do not want to visit this world famous structure, you will see its top from all over Paris.nce the tallest structure in the world, the Eiffel Tower is probably Europe's best known landmark and Paris's most famous symbol. You couldn't possibly visit Paris without seeing the Eiffel Tower. Even if you do not want to visit this world famous structure, you will see its top from all over Paris."
797,msmarco,_doc,MARCO_1874610,3.1532297,"← click this button to start analysis. Check which famous writer you write like with this statistical analysis tool, which analyzes your word choice and writing style and compares them with those of the famous writers.Any text in English will do: your latest blog post, journal entry, comment, chapter of your unfinished book, etc. click this button to start analysis. Check which famous writer you write like with this statistical analysis tool, which analyzes your word choice and writing style and compares them with those of the famous writers."
798,msmarco,_doc,MARCO_3763924,3.1532297,"Facebook Twitter Stumble Google+ Save. There have been many famous British actors to come to Hollywood and make a name for themselves, so here's a comprehensive list of the 10 best famous British actors.With movie franchises like “James Bond” and “Harry Potter,” many of these British actors have taken their place as Hollywood stars. 1  Daniel Day-Lewis.here have been many famous British actors to come to Hollywood and make a name for themselves, so here's a comprehensive list of the 10 best famous British actors."
799,msmarco,_doc,MARCO_4593217,3.1532297,"This feature is not available right now. Please try again later. IZ's version of the famous song Somewhere Over the Rainbow / What a Wonderful World, a song previously made famous by Judy Garland / Luis Armstrong, became extremely popular after his tragic death.Birth name: Israel Ka'ano'i Kamakawiwo'ole.lease try again later. IZ's version of the famous song Somewhere Over the Rainbow / What a Wonderful World, a song previously made famous by Judy Garland / Luis Armstrong, became extremely popular after his tragic death."
800,msmarco,_doc,MARCO_6204355,3.1532297,"In English, the name Robin means-famous brilliance. Other origins for the name Robin include-English, German.The name Robin is a unisex name and can be used for a boy or girl name (male or female).English Name Meaning-famous brilliance.nglish name. In English, the name Robin means-famous brilliance. Other origins for the name Robin include-English, German.The name Robin is a unisex name and can be used for a boy or girl name (male or female). English Name Meaning-famous brilliance."
801,msmarco,_doc,MARCO_6057946,3.1532297,"Famous Renaissance Artwork. List of famous Renaissance artwork, listed alphabetically with photos when available. The Renaissance movement was an awakening in the world of art, producing new types of paintings and sculptures that the world had never seen before.This is a list of the most popular Renaissance art pieces, so art enthusiasts will likely recognize the names of the famous artists who created these pieces.his is a list of the most popular Renaissance art pieces, so art enthusiasts will likely recognize the names of the famous artists who created these pieces."
802,msmarco,_doc,MARCO_6292590,3.1532297,"Rio de Janeiro, Brazil is home to the world's most famous Carnival and what many people consider to be the world's biggest and best party. The basis of Rio's Carnival are the samba schools, which are social clubs named after the famous Brazilian samba dance.io de Janeiro, Brazil is home to the world's most famous Carnival and what many people consider to be the world's biggest and best party. The basis of Rio's Carnival are the samba schools, which are social clubs named after the famous Brazilian samba dance."
803,msmarco,_doc,MARCO_8080206,3.1532297,"Some of his most famous paintings hung in the Silver Slipper Casino in Las Vegas. Georges Rouault, Pablo Picasso. Other famous clown painters including Leighton Jones (link below)who painted Emmett Kelly and Red Skelton who did a number of clowns including his character, Freddie the Freeloader. Another famous clown painter was Julian Ritter who painted numerous clowns starting in the late 40's through the 60s. Some of his most famous paintings hung in the Silver Slipper Casino in Las Vegas."
804,msmarco,_doc,MARCO_7777541,3.1532297,"In 1962 they were very famous in Liverpool; they had to wear disguises to go out during the day. They became nationally famous in the UK shortly after the release of their second single, Please Please Me, on January 11, 1963. It became a #1 hit in England. Europe soon followed, then America the next year with I Want To Hold Your Hand. The Beatles hit international fame by 1964, when they conquered America. In 1962 they were very famous in Liverpool; they had to wear disguises to go out during the day. They became nationally famous in the UK shortly after the release of their second single, Please Please Me, on January 11, 1963."
805,msmarco,_doc,MARCO_6945687,3.1532297,"List of notable or famous mathematicians from India, with bios and photos, including the top mathematicians born in India and even some popular mathematicians who immigrated to India.If you're trying to find out the names of famous Indian mathematicians then this list is the perfect resource for you.ist of notable or famous mathematicians from India, with bios and photos, including the top mathematicians born in India and even some popular mathematicians who immigrated to India. If you're trying to find out the names of famous Indian mathematicians then this list is the perfect resource for you."
806,msmarco,_doc,MARCO_956234,3.151327,"Origin of the name Louis: Derived from the Old French Loeis, which is from the Old High German Hluodowig (famous in war), a compound name composed from the elements hluod (famous) and wīg (war, strife).Var: Lewis, Luis.From A World of Baby Names by Teresa Norman.rigin of the name Louis: Derived from the Old French Loeis, which is from the Old High German Hluodowig (famous in war), a compound name composed from the elements hluod (famous) and wīg (war, strife)."
