,_index,_type,_id,_score,_source.body
514,msmarco,_doc,MARCO_3433603,5.925136,"Emilia Clarke is a British actress. She was born in London and grew up in Berkshire, England.Her father is a theatre sound engineer and her mother is a businesswoman. Her father was working on a theatre production of Show Boat and her mother took her along to the performance.This is when, at the age of 3, her passion for drama began.he was born in London and grew up in Berkshire, England. Her father is a theatre sound engineer and her mother is a businesswoman. Her father was working on a theatre production of Show Boat and her mother took her along to the performance. This is when, at the age of 3, her passion for drama began."
515,msmarco,_doc,MARCO_3433602,5.925136,"Daenerys Targaryen, known as Daenerys Stormborn and Dany, is one of the last confirmed members of House Targaryen, along with her brother Viserys, and she is one of the major POV characters in A Song of Ice and Fire.In the television adaptation Game of Thrones, Daenerys is played by Emilia Clarke. Game of Thrones. While Daenerys and her brother stay at the mansion of Illyrio Mopatis in Pentos, Illyrio arranges a marriage between Dany and the powerful Dothraki warlord Khal Drogo. In return, Drogo is to provide Viserys with ten thousand warriors for his campaign to retake the Iron Throne."
516,msmarco,_doc,MARCO_3554411,5.925136,"Iago’s function in William Shakespeare’s Othello is truly evil. His ability to find and exploit the weaknesses of the other characters makes him an expert in human nature. The personality traits in which Othello, Cassio, Rodergio, Desdemona and Emilia have in common are their innocence and gullibility.ith great skill, Iago is able to arrange a conversation between Cassio and Bianca so that Othello thinks Cassio is discussing his wife. Thus Iago has planted a shadow of doubt in Othello’s mind, therefore achieving his evil plan in the destruction of the innocent Desdemona."
517,msmarco,_doc,MARCO_4412105,5.925136,"'Game of Thrones': First photos of Dany's epic pyramid throne room. Now that Dany has conquered the city of Meereen, she’s getting a new house. A very big house. An 800-foot pyramid, in fact. Atop this pyramid is a throne room. You won’t see this set for another two weeks on HBO’s Game of Thrones, but EW has a sneak peek below. The throne room is a huge step up and major turning point for Daenerys Targaryen (Emilia Clarke), who has spent each season in transit, often living in tents."
518,msmarco,_doc,MARCO_1784849,5.9232407,"Origin of the name Emilia: Feminine form of Emil, derived from the Latin Aemilius, an old Roman family name probably derived from aemulus (rival, trying to equal or excel, emulating) There are some who thing Emilio is of Germanic origin and derive it from the element amal (work).acebook Twitter Google+ Email. Feminine form of Emil, derived from the Latin Aemilius, an old Roman family name probably derived from aemulus (rival, trying to equal or excel, emulating) There are some who thing Emilio is of Germanic origin and derive it from the element amal (work)."
519,msmarco,_doc,MARCO_2156567,5.9232407,"In May and June 1914, other Mme. Baum advertisements claimed that she now had a shampoo dryer and hair straightening comb, said to have been patented on April 1, 1914. U.S. Patent 1,096,666 for a heated hair drying comb – but not a hair straightening comb – is credited to Emilia Baum and was granted on May 12, 1914. In May 1915, the Humania Hair Company of New York marketed a straightening comb made of solid brass for 89 cents. That same month, Wolf Brothers of Indianapolis advertised its hair straightening comb and alcohol heater comb for $1.00."
520,msmarco,_doc,MARCO_3433605,5.9232407,"―Ser Jorah Mormont to Daenerys Targaryen. Daenerys Targaryen, sometimes called Dany by her brother Viserys, is a major character in the first, second, third, fourth, fifth, and sixth seasons.She is played by starring cast member Emilia Clarke, and debuts in the series premiere.itles. Daenerys actually is the second member of the Targaryen dynasty to bear her name. The first Daenerys was the sister of King Daeron II, who lived a century before Daenerys Stormborn. The first Daenerys wed into House Martell as part of the marriage-alliance which united Dorne into the Targaryen realm."
521,msmarco,_doc,MARCO_6021319,5.9232407,"She will star as Sarah Connor in the 2015 movie Terminator Genisys. Emilia Clarke has a net worth of $3 million. Kit Harington as Jon Snow: Game of Thrones is Harrington's first major screen role as he was a stage actor before that.He won a Young Hollywood Award for Actor of the Year in 2013. Kit Harrington has a net worth of $4 million.he show has even passed The Sopranos to become the most popular HBO series of all time. Game of Thrones also has the highest IMDB rating of any TV show ever, with 9.5/10 (it's actually tied with Breaking Bad)."
522,msmarco,_doc,MARCO_8234065,5.9232407,"Slavonic origin, Czech and Slavic use: It is derived literally from the word mila which is of the meaning 'pleasant, dear'. It represents the transferred use of the vocabulary word as a given name. In addition, Mila is a contracted form (African, Czech, English, Polish, Russian, Slavic, Spanish, and Swahili) of Emilia.lavonic origin, Czech and Slavic use: It is derived literally from the word mila which is of the meaning 'pleasant, dear'. It represents the transferred use of the vocabulary word as a given name. In addition, Mila is a contracted form (African, Czech, English, Polish, Russian, Slavic, Spanish, and Swahili) of Emilia."
523,msmarco,_doc,MARCO_1801704,5.91946,"Emily /emi-ly/ [3 sylls.] as a girls' name is pronounced EM-i-ee. It is of Latin origin, and the meaning of Emily is rival; laborious; eager.Feminine of Emil, from the Latin name Aemilia, feminine form of the old Roman surname Aemilius (probably from aemulus).Literary: the form Emelye was used in the 14th century by Chaucer's The Knight's Tale , which was a translation of Emilia, the form in Chaucer's source, Boccaccio's Teseida.mily /emi-ly/ [3 sylls.] as a girls' name is pronounced EM-i-ee. It is of Latin origin, and the meaning of Emily is rival; laborious; eager."
524,msmarco,_doc,MARCO_2463352,5.91946,"Due to the Fourth of July holiday, many series’ won’t be new on Sunday. Still, there is no shortage of things for “Game of Thrones” fans to tune in to. Below is a full list of shows airing on Sunday, as well as when to watch: “Game of Thrones” - HBO. 8 p.m. EDT. If you really can’t stand the thought of a Sunday without Jon Snow (Kit Harington), Sansa Stark (Sophie Turner), Daenerys Targaryen (Emilia Clarke) and the gang, tune in to HBO on Sunday to re-watch the Season 6 finale, “Winds of Winter.”. “Big Brother” - CBS."
525,msmarco,_doc,MARCO_3543451,5.91946,"The Alamo Mission in San Antonio, commonly called the Alamo, and originally known as the Mission San Antonio de Valero, is a UNESCO World Heritage Site in San Antonio, Texas. Founded in the eighteenth century as a Roman Catholic mission and fortress compound, it was the site of the Battle of the Alamo in 1836.fter forming in 1892, the Daughters of the Republic of Texas (DRT) began trying to preserve the Alamo. In 1905, Adina Emilia De Zavala and Clara Driscoll successfully convinced the state legislature to purchase the remaining buildings and to name the DRT as the permanent custodian of the site."
526,msmarco,_doc,MARCO_3603466,5.91946,"The original, costly, traditional balsamic vinegar (Aceto Balsamico Tradizionale), is made from a reduction of cooked white Trebbiano grape juice, and used as a condiment.It has been produced in Modena and Reggio Emilia since the Middle Ages, being mentioned in a document dated 1046.odena uses a different system to indicate the age of its balsamic vinegars (Aceto Balsamico Tradizionale di Modena). A white-coloured cap means the vinegar has aged for at least 12 years and a gold cap bearing the designation extravecchio (extra old) shows the vinegar has aged for 25 years or more."
527,msmarco,_doc,MARCO_6110316,5.91946,"1971 Pablo Neruda (Chile). Pablo Neruda was a Chilean author who wrote romantic poetry and won the Literature Nobel Prize in 1971.. He dedicated himself to classical writing and avoided the avant-garde movements of the time.Neruda's political activism in the Chilean Communist Party led him to exile.owever, h received the Nobel Prize for his work as a playwright, having written 67 plays such as The Great Galeotti (1881). The choice to award the Literature Nobel Prize to Jose Echegaray was widely criticized by other Spanish writers such as Leopoldo Alas (Clarin) and Emilia Pardo Bazan."
528,msmarco,_doc,MARCO_64685,5.9156933,"He enjoys the opportunity to be able to critically reflect on practice, using documentation as a way to communicate easily with families and colleagues the thinking behind practice. Janet Robertson Janet is the Outdoor Teacher at Mia Mia, Institute of Early Childhood, Macquarie University.Her professional interests include the Educational Project of Reggio Emilia, outdoor education and thinking for young children, pedagogical documentation and listening (in the pedagogical sense).owever, it is not just a document in which we celebrate children’s experiences ‘after the event’. Pedagogical documentation is a way of keeping the process of thinking and the ‘problem at hand’ open and visible to the group of children and adults while it is occurring (Olsson, 2009)."
529,msmarco,_doc,MARCO_1264279,5.9156933,"After forming in 1892, the Daughters of the Republic of Texas (DRT) began trying to preserve the Alamo. In 1905, Adina Emilia De Zavala and Clara Driscoll successfully convinced the state legislature to purchase the remaining buildings and to name the DRT as the permanent custodian of the site.n the 19th century, the mission complex became known as the Alamo. The name may have been derived from the grove of nearby cottonwood trees, known in Spanish as alamo. álamo, alternatively in, 1803 the abandoned compound was occupied by The Second Flying company Of San carlos De, parras Álamo alamo álamo de Parras. in coahuila"
530,msmarco,_doc,MARCO_2168624,5.9156933,"Update July 5, 5:52 P.M.: Since this original article was published, Kit Harington’s Game of Thrones co-star, actress Emilia Clarke, went on record saying she thinks there’s a ”50/50“ chance Jon Snow will come back from the dead.t is worth noting, however, that the language Weiss used to describe Jon Snow, “Dead is dead,” is a very familiar phrase to book readers. “Dead is dead” appears on the very first page of the very first book of A Song of Ice and Fire in reference to, you guessed it, some wildlings who then come back to life."
531,msmarco,_doc,MARCO_3543460,5.9156933,"Ten years later, it became a fortress housing a military unit, the Second Flying Company of San Carlos de Parras, who likely gave the mission the name Alamo. During the Texas Revolution, Mexican General Martin Perfecto de Cos surrendered the fort to the Texian Army in December 1835, following the siege of Bexar.fter forming in 1892, the Daughters of the Republic of Texas (DRT) began trying to preserve the Alamo. In 1905, Adina Emilia De Zavala and Clara Driscoll successfully convinced the state legislature to purchase the remaining buildings and to name the DRT as the permanent custodian of the site."
532,msmarco,_doc,MARCO_4994786,5.9156933,"Emily /emi-ly/ [3 sylls.] as a girls' name is pronounced EM-i-ee. It is of Latin origin, and the meaning of Emily is rival; laborious; eager.Feminine of Emil, from the Latin name Aemilia, feminine form of the old Roman surname Aemilius (probably from aemulus).Literary: the form Emelye was used in the 14th century by Chaucer's The Knight's Tale , which was a translation of Emilia, the form in Chaucer's source, Boccaccio's Teseida.here is overlap in usage between variants of Emily, Amelia, Emma and Emmeline. 19th-century novelist and poet Emily Bront; poet Emily Dickinson; ettiquette maven Emily Post; actress Emily Watson."
533,msmarco,_doc,MARCO_5135056,5.911941,"Amelia /ame-lia/ [4 sylls.] as a girls' name is pronounced a-MEEL-yah. It is of Latin and Old German origin, and the meaning of Amelia is rival, eager work. Blend of two medieval names: the Latin Emilia (see Emily) and the Latin German Amalia, meaning work.An 18th-century Princess Amelia brought the name to Britain.melia is a very prominent first name for females (#331 out of 4276, Top 8%) and a slightly less prominent surname for all people (#112365 out of 150436, Top 75%). (2000 U.S. Census). Displayed below is the birth name popularity of Amelia for girls. Amelia reached its top rank of #15 in the U.S. in the year 2014."
534,msmarco,_doc,MARCO_1451460,5.9082026,"Iago is a fictional character in Shakespeare's Othello. The play's main antagonist, Iago is the 'Ancient' of General Othello as well as being husband of Emilia, who is in turn the attendant of Othello's wife Desdemona.Iago hates Othello and devises a plan to destroy him by making him believe that his wife is having an affair with his lieutenant, Michael Cassio.The role is thought to have been first played by Robert Armin, who typically played intelligent clown roles like Touchstone in As You Like It or Feste in Twelfth Night.ago hates Othello and devises a plan to destroy him by making him believe that his wife is having an affair with his lieutenant, Michael Cassio. The role is thought to have been first played by Robert Armin, who typically played intelligent clown roles like Touchstone in As You Like It or Feste in Twelfth Night."
535,msmarco,_doc,MARCO_5004740,5.904478,"In King's Landing, Sansa frets about her prospects, Tyrion's new situation agitates Shae, and Tywin counsels the king. Daenerys exchanges gifts with a slave lord outside Yunkai, Melisandre reveals a secret to Robert Baratheon's illegitimate son Gendry, and Brienne faces a formidable foe at Harrenhal.Emilia Clarke and Peter Dinklage star in an episode written by George RR Martin, whose novels form the basis for the series.aenerys exchanges gifts with a slave lord outside Yunkai, Melisandre reveals a secret to Robert Baratheon's illegitimate son Gendry, and Brienne faces a formidable foe at Harrenhal. Emilia Clarke and Peter Dinklage star in an episode written by George RR Martin, whose novels form the basis for the series."
536,msmarco,_doc,MARCO_2055225,5.893388,"The girl's name Mila is a variant of Milagros (Spanish) and Milena (Czechoslovakian, Slavic), and the meaning of Mila is miracles; favored. Mila is a pet form of various names in eastern European languages, including the Czech Miloslava and Dobromila, the Polish Kamill and Emilia and the Russian Ludmilla.It is also used in Spanish for Emelia. Mila, is a female name of Slavic Origin.It is a diminutive of Slavic names beginning or ending with Mila which derived from the element Milmeaning gracious, dear. Name Mila generally means Gracious or Dear, is of Russian, Bulgarian, Polish origin, Name Mila is a Feminine (or Girl) name. .Mila is a pet from of various names in eastern European languages.ame Mila generally means Gracious or Dear, is of Russian, Bulgarian, Polish origin, Name Mila is a Feminine (or Girl) name. . Mila is a pet from of various names in eastern European languages."
537,msmarco,_doc,MARCO_4788171,5.738282,"Famous French Food. Famous french food is created using ingredients renowned for being the Food of France. Specialities the french call their own!! France is full of Famous Foods, creating food delicacies is in french history.That's why French Food is respected all over the world. Some of the world's most expensive and famous foods come from France. Their rareness and the techniques used to make them, are sometimes very time consuming and questionable.amous French Food. Famous french food is created using ingredients renowned for being the Food of France. Specialities the french call their own!! France is full of Famous Foods, creating food delicacies is in french history."
538,msmarco,_doc,MARCO_4935280,5.113226,"Famous French Food. Famous french food is created using ingredients renowned for being the Food of France. Specialities the french call their own!! France is full of Famous Foods, creating food delicacies is in french history. That's why French Food is respected all over the world. Some of the world's most expensive and famous foods come from France. Their rareness and the techniques used to make them, are sometimes very time consuming and questionable. From Provincial French Cooking to Nouvelle Cuisine the ingredients can remain the same, made famous by just presenting them differently."
539,msmarco,_doc,MARCO_4788168,4.7829056,"Garbure is a Famous Traditional French Recipe from the South-West of France. Fruit Tart 'Tarte aux Fruits' is a famous french food found in bakeries all over France. This recipe is Traditional to the Region of Provence.amous French Food. Famous french food is created using ingredients renowned for being the Food of France. Specialities the french call their own!! France is full of Famous Foods, creating food delicacies is in french history."
540,msmarco,_doc,MARCO_4986406,4.6185846,"Brie Cheese is perhaps one of the most famous of the 400+ French cheese's in France. The original 'Brie' and 'Brie-de-Meaux' come from the smallest french province of France, Ile de France. Walnuts are famous in the Perigord region of France. Walnut trees are grown all over the south east area of France.amous French Food. Famous french food is created using ingredients renowned for being the Food of France. Specialities the french call their own!! France is full of Famous Foods, creating food delicacies is in french history."
541,msmarco,_doc,MARCO_4308076,4.535694,Traditional French Food Recipes. Traditional french food recipes are famous for using seasonal and regional ingredients to create wholesome country french food we all enjoy eating. Famous French Food. Famous french food is created using ingredients renowned for being the food of France.
542,msmarco,_doc,MARCO_4505256,4.5240774,"Famous french food is created using ingredients renowned for being the Food of France. Specialities the french call their own!! France is full of Famous Foods, creating food delicacies is in french history. That's why French Food is respected all over the world. Some of the world's most expensive and famous foods come from France. Their rareness and the techniques used to make them, are sometimes very time consuming and questionable."
543,msmarco,_doc,MARCO_4788167,4.1067753,"Find French recipes and restaurants using the interactive map of France or by one of the French Regions, Traditional French Food Recipes. Traditional french food recipes are famous for using seasonal and regional ingredients to create wholesome country french food we all enjoy eating.Famous French Food. Famous french food is created using ingredients renowned for being the food of France.raditional, french meat recipes include duck, deer and wild boar in their meat dishes, from all around France. French Desserts. The best french desserts recipes usually involve fruit."
544,msmarco,_doc,MARCO_8441995,4.1067753,"Best Answer: Regional French Food of Burgandy The French regional food of Burgundy is known for being substantial and served in particularly large portions. The most famous regional food from Burgundy in Boeuf Bourguignon, which is beef marinated with mushrooms, onions and carrots.Similar to French regional food from Normandy, many recipes from Burgundy make substantial use of cream based sauces.he food of Perigord is famous for its truffles and poultry. A special food that is particularly popular in Perigord is goose liver pate served with many main dishes in this region in France."
545,msmarco,_doc,MARCO_6756870,3.9961772,"While this isn't a list of all female chefs, it does include all the most famous women in the kitchen-from Italian female chefs to others with shows on a food channel, heads of notable restaurants, and any famous woman chef whipping up amazing food in kitchens all over the world.Z. G Options.rom Food Network female chefs to other famous women cooks, this list includes the likes of Sophie Grigson to Jennifer Paterson and more."
546,msmarco,_doc,MARCO_5905050,3.9939795,"Dalmatian Cuisine: Croatian food prepared in Dalmatia region is specific because of the way the food is prepared. Most of the times they cook their food (in water), sometimes they use a grill or, as they call it the gradele and the famous peka, which is a method of baking.he stories around Croatian food have always been amusing and educational, because through the stories about food one actually learns a lot about the history of this country. As everywhere on the coast of Croatia, peka is famous in these parts also."
547,msmarco,_doc,MARCO_1600026,3.9843779,"Nutrition: the study of nutrients in food, how the body uses nutrients, and the relationship between diet, health and disease. Major food manufacturers employ nutritionists and food scientists. Nutritionists may also work in journalism, education and research.ippocrates is also famous for having said Let thy food be thy medicine and thy medicine be thy food.. Antoine Lavoisier (France, 1743-1794) - became known as the father of chemistry and also the father of nutrition. He became famous for the statement Life is a chemical process."
548,msmarco,_doc,MARCO_2351377,3.9805503,"Acana Dog Food. Acana Dog Food is famous for using first class ingredients that are grown and caught locally in the region that Acana food is manufactured. They say that they only buy the ingredients from suppliers that they know and trust, and that ingredients are delivered daily.cana Dog Food is famous for using first class ingredients that are grown and caught locally in the region that Acana food is manufactured. They say that they only buy the ingredients from suppliers that they know and trust, and that ingredients are delivered daily."
549,msmarco,_doc,MARCO_4320915,3.9667015,"50 Famous Indian Food Dishes. A listing of 50 famous Indian dishes that North Americans are likely to have tried (primarily Mughlai dishes with a few dishes from the Punjabi, South India, Goa, Guejarat and Indianized Hakka). This list was loosely inspired by about.com's list & the list on vahrehvah.com.0 Famous Indian Food Dishes. A listing of 50 famous Indian dishes that North Americans are likely to have tried (primarily Mughlai dishes with a few dishes from the Punjabi, South India, Goa, Guejarat and Indianized Hakka). This list was loosely inspired by about.com's list & the list on vahrehvah.com."
550,msmarco,_doc,MARCO_5988244,3.923996,"Waffles, fries, chocolate, beer…there’s more to Belgium than junk food. Here are 10 traditional Belgian dishes you should try when you visit. Waffles, fries, chocolate, beer… Belgium may be famous for its junk food, but there's far more to its national cuisine than that.Ahead of the Eat!Brussels food festival, taking place in the capital September 11–14, we've picked 10 lesser-known Belgian dishes that are pleasure filled, not pound heavy.affles, fries, chocolate, beer… Belgium may be famous for its junk food, but there's far more to its national cuisine than that. Ahead of the Eat! Brussels food festival, taking place in the capital September 11–14, we've picked 10 lesser-known Belgian dishes that are pleasure filled, not pound heavy."
551,msmarco,_doc,MARCO_7276035,3.8431187,Famous People Born in Alaska; Famous People in Baseball; Famous Yavapai Junior College Alumni; Famous Baseball Players; Famous People Named Schilling; Famous People Born on November 14; Famous People Born in Anchorage; Famous People Born in 1966
552,msmarco,_doc,MARCO_6502815,3.829644,"By Mack LeMouse | Miscellaneous | Rating: The piano is a highly versatile instrument which has many famous players and has produced many famous tunes. There are famous pianists in Jazz, in Pop in Rock and of course in classical, and it's hard to say who the most famous among all these are.y Mack LeMouse | Miscellaneous | Rating: The piano is a highly versatile instrument which has many famous players and has produced many famous tunes. There are famous pianists in Jazz, in Pop in Rock and of course in classical, and it's hard to say who the most famous among all these are."
553,msmarco,_doc,MARCO_8095003,3.8218007,"Try Our Food Lovers Guide to Food in Denmark. Denmark is a land of traditions that tie the cuisine to the land and sea. The food bloggers of this gorgeous country live both in and out of that tradition. Danish food bloggers range from the truly professional, including several published authors, to the slightly off-beat and “mad”. The food range is extraordinarily diverse. Anyone choosing to live in Denmark will enjoy these culinary guides. Here’s a List of the Most Famous Danish Food to Choose From National Nordic Food Lab – From gin to salmon, this food blog covers anything and everything in Scandinavian and exotic foods."
554,msmarco,_doc,MARCO_6281374,3.8143792,"The exceptional quality of Devon food and drink produced in the Heart of Devon means that the area is becoming as famous for its award-winning restaurants, food festivals, markets and vineyards as it is for its stunning coast and Devon countryside.he exceptional quality of Devon food and drink produced in the Heart of Devon means that the area is becoming as famous for its award-winning restaurants, food festivals, markets and vineyards as it is for its stunning coast and Devon countryside."
