,_index,_type,_id,_score,_source.body
220,msmarco,_doc,MARCO_4899780,6.2332306,"While Melatonin addiction is just simply not a problem, getting rid of addictions with the help of melatonin may be a possibility. While there are a limited number of studies done on this topic, it seems that melatonin could potentially be helpful for those with addictions to:1  Sedatives and sleeping pills.elatonin Addiction. If you are concerned about addiction to melatonin, you can stop being concerned. In the thousands of studies done over the past decade, and even years of usage of Melatonin for Children, there have just simply been no reports of addiction to melatonin or dependency in anyone."
221,msmarco,_doc,MARCO_6918704,6.2332306,"Natural melatonin in foods. Natural melatonin in foods can be found in small amounts and best source of natural melatonin are some vegetables, fruits, meat and grains. Melatonin is also known as natural sleep aid.Melatonin is a hormone synthesized in the brain by the pineal gland and in the gastrointestinal tract.atural melatonin in foods can be found in small amounts and best source of natural melatonin are some vegetables, fruits, meat and grains."
222,msmarco,_doc,MARCO_7976109,6.231313,"Melatonin is produced by the pineal gland and sends a signal to regulate the sleep-wake cycle in the sleep center of the brain. Interestingly, melatonin is also produced in the retina, the skin, and the GI tract, but this is not the melatonin what affects your biological sleep clock. This is the really important thing you should understand about melatonin: Melatonin is a sleep and body clock regulator – NOT a sleep initiator. Melatonin works with your biological clock by telling your brain when it is time to sleep."
223,msmarco,_doc,MARCO_367317,6.229399,"How to take Melatonin. Melatonin is taken as one tablet 1 to 2 hours before bedtime and with food. Melatonin is licensed in the UK for up to 13 weeks but The Online Clinic will not prescribe it for this length of time.If you have been suffering from insomnia, we recommend that you see a doctor face to face.ow to take Melatonin. Melatonin is taken as one tablet 1 to 2 hours before bedtime and with food. Melatonin is licensed in the UK for up to 13 weeks but The Online Clinic will not prescribe it for this length of time."
224,msmarco,_doc,MARCO_1871300,6.227489,"One milligram (mg) is equal to 1,000 micrograms (mcg). Therefore, if you were taking 300 micrograms of melatonin then you would need to find a product that is 0.3 milligrams of melatonin. The highest amount of melatonin found over-the-counter is 3 milligrams or 3,000 micrograms.ne milligram (mg) is equal to 1,000 micrograms (mcg). Therefore, if you were taking 300 micrograms of melatonin then you would need to find a product that is 0.3 milligrams of melatonin. The highest amount of melatonin found over-the-counter is 3 milligrams or 3,000 micrograms."
225,msmarco,_doc,MARCO_6025196,6.227048,"How To Increase Cortisol Levels Naturally. 1  Taking a diet to increase cortisol levels naturally such as eating food that are high in sugar and starch such as bread, pasta, and sweets. This will surely increase your cortisol level naturally. 2  Another way to increase the production of cortisol is by getting the right amount of sleep."
226,msmarco,_doc,MARCO_5481656,6.2236795,"26 Followers. A. One milligram (mg) is equal to 1,000 micrograms (mcg). Therefore, if you were taking 300 micrograms of melatonin then you would need to find a product that is 0.3 milligrams of melatonin. The highest amount of melatonin found over-the-counter is 3 milligrams or 3,000 micrograms.6 Followers. A. One milligram (mg) is equal to 1,000 micrograms (mcg). Therefore, if you were taking 300 micrograms of melatonin then you would need to find a product that is 0.3 milligrams of melatonin. The highest amount of melatonin found over-the-counter is 3 milligrams or 3,000 micrograms."
227,msmarco,_doc,MARCO_6461157,6.2236795,"1 Cautions: If you need to get up in the morning within 2-3 hours, Take regular instead of time release melatonin. 2  Time release melatonin may last into the waking hours, causing confusion and mood problems. 3  Do not take melatonin if you awaken less than one hour before you need to get up.istake #2: I can take melatonin at any time. If melatonin is used during daytime brightness, it can cause adverse effects. If the body clock is receiving conflicting daytime light signals and dark signals from melatonin, it can malfunction and not work properly when it is time to go to sleep later."
228,msmarco,_doc,MARCO_6167789,6.2217803,"3. Foods containing melatonin. Melatonin is a hormone made by a small gland in the brain. Melatonin helps control your sleep and wake cycles. Very small amounts of it are found in foods such as banana, corn, rice, tomatoes, almonds, seeds and oats.You can also buy it as a supplement.. Foods containing melatonin. Melatonin is a hormone made by a small gland in the brain. Melatonin helps control your sleep and wake cycles. Very small amounts of it are found in foods such as banana, corn, rice, tomatoes, almonds, seeds and oats."
229,msmarco,_doc,MARCO_3104074,6.2198844,"Check out these 10 facts about melatonin. 1. Melatonin is a hormone produced in the pineal gland of the brain that is responsible for regulating sleep cycles. 2. Melatonin is often considered to be the body’s natural pacemaker.It plays an instrumental role in signaling time of day and time of year, helping to regulate your body’s internal clock.3.heck out these 10 facts about melatonin. 1. Melatonin is a hormone produced in the pineal gland of the brain that is responsible for regulating sleep cycles. 2. Melatonin is often considered to be the body’s natural pacemaker."
230,msmarco,_doc,MARCO_1751872,6.216104,"15. The timing of melatonin may also be important and we chose to administer it 10 min before sedation for practical reasons. The sleep onset effect of oral melatonin has been reported to be in the range 30–35 min 10, 13 and if melatonin has an appreciable effect by 40 min then our study design should have shown it.5. The timing of melatonin may also be important and we chose to administer it 10 min before sedation for practical reasons. The sleep onset effect of oral melatonin has been reported to be in the range 30–35 min 10, 13 and if melatonin has an appreciable effect by 40 min then our study design should have shown it."
231,msmarco,_doc,MARCO_5328576,6.216104,Melatonin is a hormone made by a part of the brain called the pineal (say: pie-nee-all) gland. Melatonin may help our bodies know when it's time to go to sleep and when it's time to wake up.Melatonin supplements (in pill form) are also available.Two types of melatonin may be used in these pills: natural and synthetic (manmade). Natural melatonin is made from the pineal gland of animals. This form could be contaminated with a virus so it is not recommended.elatonin supplements (in pill form) are also available. Two types of melatonin may be used in these pills: natural and synthetic (manmade). Natural melatonin is made from the pineal gland of animals. This form could be contaminated with a virus so it is not recommended.
232,msmarco,_doc,MARCO_5469337,6.2123375,"If 1 mg of melatonin isn’t enough, your body may be telling you to add other methods to help your sleep. If you’ve been taking melatonin for longer than two weeks: This may be a sign that your body’s sleep issues come from another problem, like stress or depression, that must be addressed differently. How should I take melatonin? Take 0.3 -1 mg of melatonin 90 minutes before you go to sleep. This amount of time will allow your brain to recognize the melatonin you took and make you feel sleepy. Before you go to bed, it may be helpful to keep the lights down and turn off a nearby television or computer, as light exposure actually inhibits your body from using its own natural melatonin."
233,msmarco,_doc,MARCO_5278476,6.177547,"A typical dose in a melatonin pill contains 3mg of melatonin which can raise your natural melatonin levels up to twenty times, but there have never been any reported cases of toxicity or overdose."
234,msmarco,_doc,MARCO_6907261,6.165782,"That study found that the pineal gland, through melatonin, is involved in the mechanisms that regulate the onset of menopause, and by maintaining higher levels of melatonin, the onset of menopause can be delayed. Dr. Pierpaoli is, without a question, a zealous advocate for melatonin."
235,msmarco,_doc,MARCO_3345276,6.163828,"A typical dose in a melatonin pill contains 3mg of melatonin which can raise your natural melatonin levels up to twenty times, but there have never been any reported cases of toxicity or overdose. The data in the table below has been extracted from the Mayo Clinic advice on this subject."
236,msmarco,_doc,MARCO_2305436,6.1618757,"What is melatonin? Melatonin is produced by various tissues in the body, although the major source is the pineal gland in the brain. The production and release of melatonin from the pineal gland occurs with a clear daily (circadian) rhythm, with peak levels occurring at night."
237,msmarco,_doc,MARCO_4334401,6.1599255,"Research has shown that list of foods with melatonin is quite abundant. This hormone plays several important roles in our bodies, such as a sleep regulator, antioxidant and Glutathione booster. However, not all foods with melatonin are able to raise blood melatonin levels high enough to help with sleep disorders."
238,msmarco,_doc,MARCO_3523752,6.157977,I often check melatonin levels in people with chronic diseases or symptoms. Adequate sleep is sometimes the crucial missing link needed to encourage the body to begin healing. Melatonin is on many researchers' minds due to the beneficial effects melatonin seems to have on many types of conditions beyond insomnia.
239,msmarco,_doc,MARCO_6367561,6.157977,"In part, your body clock controls how much melatonin your body makes. Normally, melatonin levels begin to rise in the mid- to late evening, remain high for most of the night, and then drop in the early morning hours. Light affects how much melatonin your body produces."
240,msmarco,_doc,MARCO_7043675,6.157977,"Light = production of melatonin in the gland is stopped. So, when levels of light fall, melatonin is produced = inducing sleep Therefore… Light, the pineal gland and melatonin regulate the sleep-wake cycle. Pineal gland is really important as a pacemaker in birds and reptiles."
241,msmarco,_doc,MARCO_5784653,6.1521435,"Light affects how much melatonin your body produces. During the shorter days of the winter months, your body may produce melatonin either earlier or later in the day than usual. This change can lead to symptoms of seasonal affective disorder (SAD), or winter depression. Natural melatonin levels slowly drop with age."
242,msmarco,_doc,MARCO_4075147,6.148264,"Nature Made melatonin products are manufactured under our strict guidelines and contains no added flavors or preservatives. Melatonin is a hormone in the body that helps to regulate sleep cycles. When melatonin levels are low, less of the hormone is released into the bloodstream, resulting in restlessness or wakefulness. A sleepless night can leave you feeling fatigued."
243,msmarco,_doc,MARCO_6737167,6.135271,"Plasma melatonin levels are about 3 times greater than levels obtained from saliva. Thus, when comparing results between studies, a 3 pg/mL salivary dim-light melatonin onset (DLMO) would be comparable to a plasma DLMO of approximately 10 pg/mL."
244,msmarco,_doc,MARCO_60505,6.1347437,"Serotonin and melatonin are both neurotransmitters derived from the essential amino acid tryptophan, found in protein. These brain messengers are important for regulating our sleep cycles and our moods.ryptophan and 5-HTP can be converted into serotonin in the digestive tract but must transported to the brain where it is then synthesized into melatonin. The pineal gland in the brain switches on melatonin synthesis when it detects lower levels of light in the ambient environment."
245,msmarco,_doc,MARCO_2550684,6.1347437,"Our circadian rhythm (or ‘body clock’) is influenced by melatonin, as it acts as a ‘time cue’, anticipating sleep. It is also an important physiological regulator of the sleep-wake cycle. Melatonin is not a sedative, but a sign of darkness or night-time, and is a cue for innate night-time behaviour. In the morning when plasma levels of melatonin decrease, sleep ends and wakefulness begins."
246,msmarco,_doc,MARCO_4451284,6.1347437,"When it comes down to it, taking melatonin to fall asleep sooner doesn’t even work. “When it’s nighttime and melatonin levels are high,” says Dr. Wurtman “taking melatonin supplements is like putting a drop of water into an empty bucket; when it’s daytime, it’s like putting a drop of water into a full bucket.”."
247,msmarco,_doc,MARCO_3793513,6.1333265,"This hormone regulates sleep patterns, referred to as our “circadian rhythm.” When night falls, melatonin levels rise almost ten-fold, commanding our bodies and mind to wind and eventually shut down in order to rejuvenate. In the daytime, when exposed to sunlight, melatonin levels are then suppressed."
248,msmarco,_doc,MARCO_5618501,6.1328197,"Dosage for Adults. Melatonin dosing doesn't appear to be different for adults or the elderly. Dosages of Melatonin for Sleep have been from 0.1 to 20 mg that have effectively restored sleep pattern problems. One study that found dosages of 0.1 mg, that's just 1/10 of one milligram, to have significant improvements in sleep problems compared melatonin blood levels against a group of healthy people WITHOUT sleep problems."
249,msmarco,_doc,MARCO_455711,6.125142,"1 Melatonin can affect the level of sugar in the blood. 2  If you have diabetes, check with your healthcare provider before taking the supplement. 3  You may need to monitor your blood sugar more often, and your healthcare provider may need to adjust the dose of your diabetes medications. The liver helps to remove melatonin from your body. 2  Therefore, if you have liver disease, your body may not handle the supplement as well as normal. 3  Melatonin may worsen seizure disorders. 4  However, there is some evidence that it may be helpful for seizures in some situations."
250,msmarco,_doc,MARCO_60508,6.125142,"Since serotonin is a precursor for melatonin, serotonin deficiencies can lead to sleep disorders and insomnia. Insomnia is a condition where sleep is disturbed through trouble getting to sleep, trouble staying sleep and waking up too early in the morning.ryptophan and 5-HTP can be converted into serotonin in the digestive tract but must transported to the brain where it is then synthesized into melatonin. The pineal gland in the brain switches on melatonin synthesis when it detects lower levels of light in the ambient environment."
251,msmarco,_doc,MARCO_5444937,6.1216984,"Coffee consumed late in the evening resets the internal body clock by delaying a rise in the level of melatonin, the body’s chief sleep hormone. Fluctuating levels of melatonin help determine the natural time to go to sleep and wake up, so a double espresso three hours before bed time could leave you staring at the clock and unable to sleep."
252,msmarco,_doc,MARCO_7152949,6.1216984,"It can help to get 15 minutes of morning sunlight each day to start helping your melatonin levels work more properly. You can also eat certain foods that help get your levels back where they should be too. These foods contain certain nutrients that assist with serotonin production, which is necessary for proper melatonin production in the body. Remember, your hormones are always working together to help you, so long as you give them what they need to do their job effectively."
253,msmarco,_doc,MARCO_4213854,6.1213145,"The pineal gland contains high levels of calcium and can be used by radiographers to mark the middle of the brain in X-ray images. What does the pineal gland do? The pineal gland is best known for the secretion of the hormone melatonin, which is released into the blood and possibly also into the brain fluid, known as cerebrospinal fluid. The body's daily (circadian) clock controls the production of pineal melatonin, so melatonin is commonly used in human research to understand the body's biological time."
254,msmarco,_doc,MARCO_4899784,6.117494,"Melatonin is a precious master hormone Melatonin = C13H16N2O2 and is produced in the pineal gland, which is just below the hypothalamus, just below the two hemispheres of the … brain.It is very difficult to get at in a 'live' human patient.elatonin is not habit forming, having no withdrawal symptoms like heavy-duty 'knock-out' sleeping pills do. Melatonin does NOT force the body to sleep like commercial sleeping pills; it relaxes the body, calms the heart rate, cools the body, and prepares it for sleep and body repair at the cellular level."
255,msmarco,_doc,MARCO_6867520,6.113681,"Melatonin may affect blood pressure. Caution is advised in people taking drugs, herbs, or supplements that affect blood pressure. Melatonin may affect blood sugar levels.Caution is advised in people with diabetes or low blood sugar and those taking drugs, herbs, or supplements that affect blood sugar.elatonin may affect blood pressure. Caution is advised in people taking drugs, herbs, or supplements that affect blood pressure. Melatonin may affect blood sugar levels."
256,msmarco,_doc,MARCO_6737166,6.11206,"As expected, circulating melatonin levels were lower in night shift workers compared to day shift workers. When evaluated by chronotype, however, the authors found that morning-type night shift workers were better able to maintain normal melatonin levels than evening-type night shift workers. These differences in the effect of chronotype were statistically significant in every instance (P-interaction < 0.01)."
257,msmarco,_doc,MARCO_6630183,6.1098747,"A: Melatonin is a hormone that helps to regulate the sleep-wake cycle. Levels of the hormone drop during the day and rise at night. Studies suggest that melatonin helps restore sleep when the body's internal clock is disrupted like when people work at night and sleep during the day or as a result of jet lag.elatonin overdose can lead to severe drowsiness and affect your sleep-wake cycle. Symptoms of a melatonin overdose may include headache, drowsiness, and upset stomach. If you suspect an overdose, you should contact a poison-control center or emergency room immediately."
258,msmarco,_doc,MARCO_455715,6.1043825,There’s also evidence that disturbances to melatonin production may affect the body’s insulin levels. Insulin resistance—the body’s inability to use insulin effectively— is a fundamental characteristic of Type 2 diabetes.here’s also evidence that disturbances to melatonin production may affect the body’s insulin levels. Insulin resistance—the body’s inability to use insulin effectively— is a fundamental characteristic of Type 2 diabetes.
259,msmarco,_doc,MARCO_6442316,6.1043825,"Melatonin may affect blood pressure. Caution is advised in people taking drugs, herbs, or supplements that affect blood pressure. Melatonin may affect blood sugar levels. Caution is advised in people with diabetes or low blood sugar and those taking drugs, herbs, or supplements that affect blood sugar. Blood sugar levels may need to be monitored by a qualified healthcare professional, including a pharmacist, and medication adjustments may be necessary."
260,msmarco,_doc,MARCO_4840818,6.094723,"Serotonin is a neurotransmitter found in your gastrointestinal tract, platelets and central nervous system. Tryptophan is a building block of serotonin as well as of melatonin. Tryptophan is an essential amino acid, meaning that you cannot synthesize it in your body, but must obtain it from dietary sources.In your central nervous system, serotonin helps to regulate mood, sleep and appetite.our pineal gland produces melatonin, and your intestinal cells and brain’s nervous center produces serotonin. Both melatonin and serotonin play several roles in human behavior and cognition. Serotonin syndrome is a medical condition defined as excess levels of serotonin in your body."
261,msmarco,_doc,MARCO_6041087,6.089115,"5-HTP is a direct precursor to serotonin, while serotonin is a precursor to melatonin. Melatonin is the hormone that’s responsible for sleeping. It helps to control your sleep and wake cycles.So, some of the 5-HTP you take, will eventually become this sleep hormone.herefore, when people take 5-HTP, they ultimately boost serotonin levels. You will commonly find this amino acid in nootropic stacks, allowing users to decrease stress levels and enhance mood. If you have stimulating nootropics in your stack, then this is a great addition for balancing everything out."
262,msmarco,_doc,MARCO_60504,6.0739636,"Sleep and melatonin, a hormone, are both subject to circadian rhythms in humans and other animals; in other words, they follow a daily cycle.The levels of the hormone, and our regular pattern of sleep, are linked to the natural 24-hour light-dark cycle caused by the earth's rotation.Melatonin has been termed the hormone of darkness, due to the fact that it's released into the blood stream during the night.he levels of the hormone, and our regular pattern of sleep, are linked to the natural 24-hour light-dark cycle caused by the earth's rotation. Melatonin has been termed the hormone of darkness, due to the fact that it's released into the blood stream during the night."
263,msmarco,_doc,MARCO_7798388,6.0638404,Melatonin side-effects are usually temporary and can be relieved by reducing the melatonin dosage. About 8% of people taking 5 mg of melatonin or less per day will feel sleepy during the day. For a complete list of melatonin side effects pls. visit this link:http://www.melatoninfaq.com/melatonin-side-effects/ .
264,msmarco,_doc,MARCO_619333,6.062869,"Body clock sleep problems have been linked to a hormone called melatonin. Light and dark affect how the body makes melatonin. Most melatonin is made at night. During the day, light tells your body to make less melatonin. If you work at night in artificial light, your body may be making less melatonin than it needs."
265,msmarco,_doc,MARCO_1919897,6.062869,"Natural melatonin in foods. Natural melatonin in foods can be found in small amounts and best source of natural melatonin are some vegetables, fruits, meat and grains. Melatonin is also known as natural sleep aid. Melatonin is a hormone synthesized in the brain by the pineal gland and in the gastrointestinal tract."
266,msmarco,_doc,MARCO_6484493,6.0618987,"Dr. Breus, who was featured on the Dr. Oz show to discuss the problems with melatonin, explains, This is the really important thing you should understand about melatonin: Melatonin is a sleep and body clock regulator – NOT a sleep initiator. Melatonin works with your biological clock by telling your brain when it is time to sleep. Melatonin"
267,msmarco,_doc,MARCO_7262064,6.0618987,"Using melatonin correctly can help sleep and mood problems, but melatonin can be tricky, and if misused can cause insomnia and even depression. Here are some of the common mistakes people make, and guidelines to use melatonin the right way. Mistake #1: Melatonin is a sleep hormone. Most people think melatonin is a natural sleeping pill."
268,msmarco,_doc,MARCO_7981001,6.0609293,"The connection between melatonin and depression refers to the ability of the hormone melatonin to reduce the symptoms of depression. In some cases, however, the use of melatonin can actually worsen symptoms of depression. Since melatonin is not regulated by the government, safety has not been thoroughly examined. Taking melatonin supplements should never be considered unless under the direct supervision of an experience health care provider."
269,msmarco,_doc,MARCO_7654365,6.0589933,"Melatonin Interesting Facts. 1  Melatonin is a hormone secreted by the pineal gland in the brain. 2  The precursor to melatonin is serotonin, a neurotransmitter that’s derived from the amino acid tryptophan. 3  When it’s dark, your body produces more melatonin.  When it’s light, the production of melatonin decreases."
270,msmarco,_doc,MARCO_2865300,6.0580263,"Melatonin is not the only important hormone that is both secreted by the pineal gland and critical to the regulation of the body clock. Complementary to melatonin is serotonin, which is as important to waking functions as melatonin is to sleepiness.elatonin is not the only important hormone that is both secreted by the pineal gland and critical to the regulation of the body clock. Complementary to melatonin is serotonin, which is as important to waking functions as melatonin is to sleepiness."
271,msmarco,_doc,MARCO_4334402,6.055132,"Walnuts appear to have the highest amount of melatonin after tart cherries – great additional nutritional benefit of this nut which is on our List of Superfoods. Foods with melatonin precursors, tryptophan and serotonin, were not included in our overview of foods with melatonin. Read about glutathione content in foods on our page Glutathione Foods. The following studies were reviewed to determine foods with melatonin and melatonin concentrations in them:"
272,msmarco,_doc,MARCO_6918705,6.054169,"Natural melatonin in foods can be found in small amounts and best source of natural melatonin are some vegetables, fruits, meat and grains.Melatonin is also known as natural sleep aid. Melatonin is a hormone synthesized in the brain by the pineal gland and in the gastrointestinal tract.atural melatonin in foods can be found in small amounts and best source of natural melatonin are some vegetables, fruits, meat and grains."
