,_index,_type,_id,_score,_source.body
729,msmarco,_doc,MARCO_6100382,5.152879,"Occasionally, melatonin is used as a complementary medicine in cancer treatment for breast, brain, lung, prostate, head and neck, or gastrointestinal cancer. Melatonin is sometimes used to mitigate the side effects of chemotherapy including weight loss, nerve pain, weakness and a condition called thrombocytopenia."
730,msmarco,_doc,MARCO_6560234,5.152879,Veterinarians recommend for reducing Cortisol to give 3 mg of melatonin twice a day for dogs under 30 lbs and 6 mg of melatonin twice a day for dogs over 30 lbs. For separation anxiety or for fireworks or sleep give about 1 hour before event.
731,msmarco,_doc,MARCO_7549919,5.152879,"Getting proper rest helps you function during the day. Melatonin is a hormone produced in the pineal gland that helps to regulate the body’s natural biorhythm, or sleep/wake cycle. Supplemental melatonin taken one hour before bedtime may help to support sleep."
732,msmarco,_doc,MARCO_7672357,5.152879,"Ramelteon is used to help patients who have sleep-onset insomnia (difficulty falling asleep) fall asleep more quickly. Ramelteon is in a class of medications called melatonin receptor agonists. It works similarly to melatonin, a natural substance in the brain that is needed for sleep."
733,msmarco,_doc,MARCO_6907265,5.152879,"The great news is melatonin has been shown to slow down the aging process. A research team in Paris found melatonin-based treatment can delay the first signs of aging in small mammals by at least three months (considering the animal lives just to 12 months, this is quite substantial!)."
734,msmarco,_doc,MARCO_6981422,5.152879,"PRESCRIBED FOR: Melatonin is used for sleeplessness and adjusting sleep-wake cycles due to jet lag or work schedule changes. Melatonin is also used for treatment of: 1  some Alzheimer's disease symptoms, 2  ringing in ears, 3  depression, and. 4  migraine headaches."
735,msmarco,_doc,MARCO_7452408,5.152879,"Make sure you get BRIGHT sun exposure regularly. Your pineal gland produces melatonin roughly in approximation to the contrast of bright sun exposure in the day and complete darkness at night. If you are in darkness all day long, it can't appreciate the difference and will not optimize your melatonin production."
736,msmarco,_doc,MARCO_8739626,5.152879,"Because of the potential for side effects and interactions with medications, people should take dietary supplements only under the supervision of a knowledgeable health care provider. Some people may have vivid dreams or nightmares when they take melatonin. Taking too much melatonin may disrupt circadian rhythms (your body clock)."
737,msmarco,_doc,MARCO_406624,5.151906,"For sleep disturbance in people with a learning disability, 0.5-9 milligrams of melatonin has been taken by mouth for 32-73 days. For sleep disturbance in those with Parkinson's disease, 3-50 milligrams of melatonin has been taken by mouth at bedtime for 2-4 weeks."
738,msmarco,_doc,MARCO_2305440,5.151906,"Melatonin supplements are sometimes used to treat jet lag or sleep problems (insomnia). Scientists are also looking at other good uses for melatonin, such as: 1  Treating seasonal affective disorder (SAD). 2  Helping to control sleep patterns for people who work night shifts."
739,msmarco,_doc,MARCO_2569223,5.151906,"It tells your body that it’s nighttime and it’s time to go to bed. Melatonin is a powerful hormone. Many may mistake its power for that of a sleeping pill and feel compelled to take more for better sleep. However, at the wrong dosage, melatonin may actually destroy your sleep cycle."
740,msmarco,_doc,MARCO_2569226,5.151906,"1 If you take more than an hour to fall asleep, or you need to shift your sleep more than an hour, consider taking time-released melatonin. 2  It is also important to use a high-quality, standardized melatonin supplement. 3  Try to find the lowest dose available and do not cut the pill."
741,msmarco,_doc,MARCO_3747971,5.151906,"Melatonin Hormone. The pineal gland is a small, pine cone-shaped organ located in the brain. It secretes the hormone known as melatonin. The hormone helps the body maintain its circadian rhythm -- the internal clock that determines a person's sleep-wake cycle."
742,msmarco,_doc,MARCO_3117294,5.151906,"Consider the following uses for these lenses: 1  Sleep problems – Excessive light, especially blue light given off by computer screens, televisions and ambient light in most homes, suppresses melatonin. Melatonin, our natural sleep hormone, helps us get to sleep."
743,msmarco,_doc,MARCO_3043645,5.151906,"Kind of. Ramelteon (Rozerem) and Belsomra (Suvorexant) may represent the best and safest sleep-promoting drugs available today. Rozerem is a melatonin agonist which binds to the meletonin receptors MT1 and MT2 with high affinity and specificity. Of course, melatonin is the natural ligand for these receptors."
744,msmarco,_doc,MARCO_4926020,5.151906,"Alopecia X is another common form of dog hair loss that melatonin can be effective in treating. It’s successful in resulting in part or full hair regrowth in up to 40% of cases. When treating hair loss in dogs, melatonin can either be given orally or through implants."
745,msmarco,_doc,MARCO_5723800,5.151906,"CAUTION: Melatonin should NOT be used by people with leukemia, Hodgkin's disease, lymphoma or multiple myeloma. Melatonin's beneficial effect on immunity could worsen immune system cancers. Calcium supplements should also be taken with care to avoid hypercalcemia. Leukemia and MDS are very similar types of cancer."
746,msmarco,_doc,MARCO_5391474,5.151906,See also... 1  Clonazepam Drug Interactions. 2  clonazepam orally disintegrating tablets General Consumer Information. 3  Melatonin Time Release Drug Interactions.  Melatonin Time Release General Consumer 1  Information. Drug Interactions Checker.
747,msmarco,_doc,MARCO_6100380,5.151906,"“Melatonin is not a sleeping pill”. That’s what Dr. Michael Breus, “ The Sleep Doctor ,” tells patents who inquire about this popular supplement. Like me and many other practitioners who have researched this supplement, Dr. Breus believes melatonin is a bad answer to insomnia."
748,msmarco,_doc,MARCO_7672353,5.151906,Ramelteon (ra mel' tee on) is a synthetic melatonin receptor agonist with affinity for both the melatonin type 1 and type 2 receptors (MT1 and MT2). These receptors are believed to be involved in the maintenance of the circadian rhythm that regulates the normal sleep-wake cycle.
749,msmarco,_doc,MARCO_8717772,5.151906,"1 Take the time release tablet first and then place the sublingual tablet under your tongue.  Cautions: If you need to get up in the morning within 2-3 hours, Take regular instead of time release melatonin. Time release melatonin may last into the waking hours, causing confusion and mood problems."
750,msmarco,_doc,MARCO_518423,5.1509337,1 hormone-like secretion (in hormone: Endocrine-like glands and secretions) 2  jet lag (in jet lag) 3  pineal gland (in pineal gland) (in pineal gland: Pineal hormones) 4  MedlinePlus - Melatonin.  University of Maryland Medical Center - Melatonin.
751,msmarco,_doc,MARCO_551604,5.1509337,"As a guide, the most appropriate timing for melatonin administration appears to be preflight early evening treatment followed by treatment at bedtime for 4 days after arrival when traveling eastbound; whereas, on a westbound flight it is better to take melatonin for 4 days at bedtime when in the new time zone."
752,msmarco,_doc,MARCO_903779,5.1509337,"Melatonin is a hormone secreted by the pineal gland in the brain. It helps regulate other hormones and maintains the body's circadian rhythm. The circadian rhythm is an internal 24-hour clock that plays a critical role in when we fall asleep and when we wake up. When it is dark, your body produces more melatonin."
753,msmarco,_doc,MARCO_38430,5.1509337,"Drug Melatonin. The generic Melatonin combination is manufactured by 3 companies. The information provided includes the cost of the drug and the type of drug-tablet, capsule, syrup, cream, gel, ointment, liquid or injection. To view the price of the drug click on the brand name."
754,msmarco,_doc,MARCO_118014,5.1509337,"For occasional sleep disturbance or jet lag, 3-5 mg should be taken one hour before bedtime. Melatonin should not be taken continuously for longer than four weeks. Higher doses or prolonged periods of use should only be attempted under medical supervision. Prolonged use of melatonin may interfere with sleep patterns."
755,msmarco,_doc,MARCO_367321,5.1509337,"Consequently in Britain you cannot buy melatonin over the counter (OTC), as you can in some other parts of the world like Poland and the US. The ban is fatuous: those in the know simply order it from the US via the Internet.onsequently in Britain you cannot buy melatonin over the counter (OTC), as you can in some other parts of the world like Poland and the US. The ban is fatuous: those in the know simply order it from the US via the Internet."
756,msmarco,_doc,MARCO_3049863,5.1509337,Peaceful Sleep: Red wine can give you a peaceful sleep due to the presence of a substance called melatonin. Melatonin can stimulate your body clock and keeps you healthy. So consume a moderate amount of red wine (50 to 100 ml) before bedtime for a peaceful sleep.
757,msmarco,_doc,MARCO_2127113,5.1509337,"When used occasionally and at the correct time, melatonin is a fine means of encouraging sleep. But, ironically, with prolonged use, it can actually amplify insomnia. Having too much melatonin in the system, the theory goes, overwhelms the receptors, changing how a patient reacts to the hormone — whether it’s endogenous or exogenous."
758,msmarco,_doc,MARCO_1802140,5.1509337,"In your brain, trytophan is converted into the hormone serotonin, which promotes relaxation. In darkness, serotonin is converted into melatonin in the pineal gland. Now, melatonin is a well-known cure for sleeping disorders. It is widely used for treating insomnia symptoms for elderly and depressive patients. It also enhances the quality of restorative sleep."
759,msmarco,_doc,MARCO_5260380,5.1509337,why is melatonin bad for autoimmune disorders why is melatonin bad for autoimmune disorders are cases cause of this condition are prescriptions can be found in bunches. This type of arthritis stomach irritability. The disease causes the loss of hair. * Halo Nevus * Anemia * Diabetes: Type 2 Diabetes.
760,msmarco,_doc,MARCO_6338487,5.1509337,"Foods that Contain Melatonin : Other lucid-friendly foods include milk, yogurt, eggs, fish (especially cod and tuna), broccoli, sweet potatoes, mushrooms and lentils. These foods not only contain vitamin B5 (a coenzyme acid that is essential for the synthesis of melatonin), they also contain tryptophan."
761,msmarco,_doc,MARCO_6367557,5.1509337,"In addition to helping you fall asleep and bestowing a feeling of overall comfort and well being, melatonin has proven to have an impressive array of anti-cancer benefits. Melatonin inhibits the proliferation of a wide range of cancer cell types, as well as triggering cancer cell apoptosis (self destruction)."
762,msmarco,_doc,MARCO_7064486,5.1509337,"For sleep disturbance in Alzheimer's disease, 1.5-10 milligrams of melatonin has been taken by mouth nightly for 10 days to 35 months, together with light exposure or in the form of capsules. For sleep disturbance in those with asthma, three milligrams of melatonin has been taken by mouth for four weeks."
763,msmarco,_doc,MARCO_7629388,5.1509337,"For insomnia in the elderly, melatonin has been taken by mouth in doses of 0.1-5 milligrams at or two hours before bedtime for up to several months, in the form of melatonin-rich night milk or slow-release Circadin®. A dose of 0.5 milligrams has been placed in the cheek for four nights."
764,msmarco,_doc,MARCO_8567988,5.1509337,"Anatomy and Physiology. 1  The pineal gland is a small gland located inside the skull. It is richer in lecithin than any other part of the body. 2  It appears that the major function of the pineal is to produce melatonin. Melatonin is produced in greater quantities during darkness, as the pineal gland is inhibited by light."
765,msmarco,_doc,MARCO_774261,5.1499624,"That said, melatonin has been tested in children aged 1 to 18 years old who had atopic dermatitis and disturbed sleep (Melatonin Supplementation for Children With Atopic Dermatitis and Sleep Disturbance: A Randomized Clinical Trial.) In this particular study it was found to improve sleep, although the abstract does not discuss the dosage used."
766,msmarco,_doc,MARCO_903773,5.1499624,"Several human studies have measured the effects of melatonin supplements on sleep in healthy people. A wide range of doses has been used, often taken by mouth 30 to 60 minutes prior to sleep time. Results have been mixed. Some evidence suggests that melatonin may work best for people over 55 who have insomnia."
767,msmarco,_doc,MARCO_2865299,5.1499624,"Biorhythms and the biological clock involvement of melatonin and the pineal gland in life and disease.Nir I. Department of Pharmacology, Hebrew University-Hadassah Medical School, Jerusalem, Israel. [PubMed-indexed for MEDLINE].iorhythms and the biological clock involvement of melatonin and the pineal gland in life and disease."
768,msmarco,_doc,MARCO_1193723,5.1499624,"Melatonin, a derivative of the amino acid tryptophan, is produced in humans, other mammals, birds, reptiles, and amphibians. 1  In humans, melatonin plays an important role in the regulation of sleep cycles (i.e., circadian rhythm). Its production is influenced by the detection of light and dark by the retina of the eye."
769,msmarco,_doc,MARCO_1085322,5.1499624,"Early human studies have looked at melatonin use in people with different types of late-stage cancer, including cancer of the brain, breast, colon, rectum, stomach, liver, lung, pancreas, testicles, immune system, skin, kidney, and soft tissues. Melatonin has been used together with many other agents and therapies."
770,msmarco,_doc,MARCO_2127110,5.1499624,"These products, such as melatonin, are not required to be tested for effectiveness, purity, or safety. Common side effects associated with melatonin are drowsiness, headache, and dizziness. Less common side effects are mild tremor, anxiety, abdominal cramps, irritability, confusion, nausea, vomiting, and low blood pressure."
771,msmarco,_doc,MARCO_2071476,5.1499624,"Melatonin can cause drowsiness if taken during the day. If you are drowsy the morning after taking melatonin, try taking a lower dose. Additional side effects include stomach cramps, dizziness, headache, irritability, decreased libido, breast enlargement in men (called gynecomastia), and reduced sperm count."
772,msmarco,_doc,MARCO_2031978,5.1499624,There is currently no recommended dose for melatonin supplements. Different people will have different responses to its effects. Lower doses appear to work better in people who are especially sensitive. Higher doses may cause anxiety and irritability. The best approach for any condition is to begin with very low doses of melatonin.
773,msmarco,_doc,MARCO_2305438,5.1499624,"Overview. Melatonin is a hormone secreted by the pineal gland in the brain. It helps regulate other hormones and maintains the body's circadian rhythm. The circadian rhythm is an internal 24-hour clock that plays a critical role in when we fall asleep and when we wake up. When it is dark, your body produces more melatonin."
774,msmarco,_doc,MARCO_3107927,5.1499624,"As add-on to antihypertensive therapy, prolonged-release melatonin has improved blood pressure control in people with nocturnal hypertension. People with circadian rhythm sleep disorders may use oral melatonin to help entrain (biologically synchronize in the correct phase) to the environmental light-dark cycle."
775,msmarco,_doc,MARCO_5278478,5.1499624,Melatonin is one of the least toxic substances known. People have taken as much as 6 grams (600 to 3000 times the normal dosage) of the substance in carefully monitored studies with no sign of toxicity. Only four complaints regarding melatonin have been report to the FDA (USA's Food and Drug Administration).
776,msmarco,_doc,MARCO_6655649,5.1499624,"Melatonin is a natural, non-addicting hormone supplement that assists with sleep. Millions of people in the United States take it in order to get a good night’s sleep after having difficulties falling asleep or staying asleep. However, beware! Melatonin may be harmful to your sleep if taken inappropriately."
777,msmarco,_doc,MARCO_7264729,5.1499624,"Benefits: 1  Both melatonin and valerian are used to treat insomnia and sleep issues. 2  Valerian is also recommended to treat anxiety, stress, muscular spasms and cramps. 3  Melatonin is being investigated to help with cancer care (improve response rates, survival time and quality of life)."
778,msmarco,_doc,MARCO_774262,5.148992,"Several case reports have described the use of melatonin 2 to 5 mg in children 6 months to 14 years of age. 7 , 71 Outcomes of studies in children have been similar to those in adults. Melatonin given to healthy or developmentally impaired children was most effective in treating delayed sleep onset."
779,msmarco,_doc,MARCO_903778,5.148992,"Ongoing research has shown that oral melatonin supplements can promote the dipping process. They can reduce nocturnal systolic blood pressure by about 6 mm/Hg, and diastolic pressure by 4 mm/Hg. Not surprisingly, the studies also indicate that melatonin improves sleep quality, which allows the body to relax more."
780,msmarco,_doc,MARCO_406623,5.148992,"For sleep disturbance in those with depression, 0.5-10 milligrams of melatonin has been taken by mouth for 3-4 weeks, in addition to regular therapy. For sleep disturbance in healthy people, 0.1-80 milligrams of melatonin has been taken by mouth, generally nightly before bed for one or several days up to 26 weeks."
781,msmarco,_doc,MARCO_2668210,5.148992,"When you travel, you can take melatonin to help with jet lag, which is daytime fatigue that occurs when changing time zones. The first night you arrive at your destination, you can take 0.5 to 5 mg of melatonin. Taking it can help you sleep and reset your sleeping patterns to match the new time zone you traveled to."
782,msmarco,_doc,MARCO_4130196,5.148992,"Melatonin is the chemical your brain releases to make you sleepy, and it’s available over the counter, but it’s not regulated by the FDA and isn’t right for everyone. However, one study found that a dose of 5mg of melatonin in the early evening helped participants to adjust to new time zones faster."
783,msmarco,_doc,MARCO_1193722,5.148992,What is Melatonin? Melatonin is the natural hormone your body secretes that helps to maintain your wake-sleep cycle (also called “biological clock”). The wake-sleep cycle is the process of sleep and wakefulness; in humans this averages 8 hours of nighttime sleep and 16 hours of daytime activity.
784,msmarco,_doc,MARCO_3523755,5.148992,"2, 3 In addition to being produced in vertebrates, melatonin is also found in plants, bacteria, unicellular eukaryotes, and invertebrates. 4. Melatonin secretion is inhibited by environmental light and stimulated by darkness, with secretion starting at 9 PM and peaking between 2 and 4 AM at approximately 200 pg/mL."
785,msmarco,_doc,MARCO_7064484,5.148992,"For Alzheimer's disease or cognitive decline, melatonin has been taken by mouth in doses of 1-10 milligrams daily for 10 days up to 35 months. For inflammation, melatonin has been taken by mouth in doses of 10 milligrams nightly for six months or five milligrams the night before and one hour before surgery."
786,msmarco,_doc,MARCO_7077323,5.148992,"Stomach Distress. Melatonin can cause stomach problems, including nausea, vomiting or stomach cramps. Melatonin may also trigger Crohn’s disease symptoms, MayoClinic.com warns. Crohn’s disease, an inflammatory bowel disease, can cause abdominal pain, diarrhea, rectal pain and fever."
787,msmarco,_doc,MARCO_7262068,5.148992,"Learn when to take melatonin. Melatonin can been used for circadian rhythm sleep disorders such as delayed sleep-wake phase disorder, which results in the inability to fall asleep before 2:00 am or later. It can also be used to help with sleep problems related to working night shifts, general insomnia, and jet lag."
788,msmarco,_doc,MARCO_7716758,5.148992,"This allows the melatonin to be absorbed directly into the body. People use melatonin to adjust the body's internal clock. It is used for jet lag, for adjusting sleep-wake cycles in people whose daily work schedule changes (shift-work disorder), and for helping blind people establish a day and night cycle."
789,msmarco,_doc,MARCO_8519536,5.148992,"Recommended dosage, active amounts, other details. For regulating the sleep cycle, doses of melatonin between 500mcg (0.5mg) and 5mg seem to work. Start with 500mcg, and if it doesn’t work, work up to 3-5mg. The benefits of melatonin are not dose-dependent - taking more will not help you fall asleep faster."
790,msmarco,_doc,MARCO_2426666,5.1480227,"Some parents are turning to Melatonin, described as an all natural supplement, to help their kids fall asleep. But some doctors say it may not be as natural as advertised and have a warning. (Published Thursday, Aug. 30, 2012). Melatonin is a hormone that is secreted by your brain and is present in every person's body. It is produced at a higher rate at a young age."
791,msmarco,_doc,MARCO_3793515,5.1480227,"“It’s important to understand that melatonin can help induce sleep, but it will not maintain sleep,” says Dr. Kothare. Melatonin supplements can also be a great way to break the cycle of insomnia, deal with jet lag, or adjust to life as a shift worker, says Dr. Kothare."
792,msmarco,_doc,MARCO_3776237,5.1480227,If we dont we will quickly take over people how does melatonin affect blood how does melatonin affect blood pressure pressure have millions of suppresses the chemicals like endorphins that binds or recovery has enabled other cough-sufferers that are interesting and useful in fractures – pressure s usually two glands are frequently prescribe how does ...
793,msmarco,_doc,MARCO_4836969,5.1480227,"The most common melatonin side effects include: Headache; Dizziness; Nausea; Drowsiness; Other, less common melatonin side effects might include short-lasting feelings of depression, mild tremor, mild anxiety, abdominal cramps, irritability, reduced alertness, confusion or disorientation, and abnormally low blood pressure (hypotension)."
794,msmarco,_doc,MARCO_5606708,5.1480227,"1 having a lot of bright lights at night, as light inhibits the mechanism of activating the pineal gland to prompt melatonin synthesis.  taking NSAIDS, anti-anxiety drugs, antidepressants, beta blockers, steroids, calcium channel blockers too late in the evening can affect melatonin synthesis."
795,msmarco,_doc,MARCO_7226465,5.1480227,"Melatonin tablets can also provide relief for fearful dogs. Try it when there’s lightning, thunderstorms or other loud noises such as fireworks. Effectiveness varies, just as it does with people. You can’t expect miracles. But it is possible canine calming will last up to 8 hours. Give melatonin around 10:00pm if your dog is staying up all night."
796,msmarco,_doc,MARCO_8312001,5.1480227,"Blue light and Melatonin Blue light suppresses Melatonin production, which is important to the sleep cycle Night time viewing of back lit devices stimulate the brain to stay awake and not prepare for sleep Over time, prolonged amounts of artificial Blue light can have effects on the immune system"
797,msmarco,_doc,MARCO_235058,5.147054,1 For trouble falling asleep: 1 mg to 6 mg of melatonin before bedtime for up to one month has been used.  Sleeping problems in people with sleep-wake cycle disturbances: 0.5 mg to 12 mg of melatonin daily for up to 12 weeks has been used in children and adolescents 3 months to 17 years-old.
798,msmarco,_doc,MARCO_97922,5.147054,"Melatonin Side Effects. Change in sleep pattern; headache. Severe allergic reactions (rash; hives; difficulty breathing; tightness in the chest; swelling of the mouth, face, lips, or tongue); confusion; depression; fast heartbeat; hypothermia (fast breathing, shivering). Not all side effects for melatonin may be reported."
799,msmarco,_doc,MARCO_367324,5.147054,"Melatonin was available from health-food shops in the UK before 1995, but it was banned from general sale on the grounds that it was a medicinal product (previously, it was considered a nutritional supplement). It is not available from pharmacies because it does not have a licence for sale as a medicine.any of my friends and colleagues, when on holiday, buy over the counter medicines not available in the UK-mainly Tylenol and melatonin."
800,msmarco,_doc,MARCO_2343688,5.147054,"Has anyone experienced loose watery stools with use of melatonin? I started taking 3 mg of melatonin about 3 months ago when I was experiencing insomnia after the death of my brother. It worked so well I continued to take it nightly rather than just as needed. Then 6 weeks ago I started to have foul smelling, watery diarrhea 5-10 times a day."
801,msmarco,_doc,MARCO_4056499,5.147054,"Get over jet lag. When you travel, you can take melatonin to help with jet lag, which is daytime fatigue that occurs when changing time zones. The first night you arrive at your destination, you can take 0.5 to 5 mg of melatonin. Taking it can help you sleep and reset your sleeping patterns to match the new time zone you traveled to."
