,_index,_type,_id,_score,_source.body
456,msmarco,_doc,MARCO_5227160,5.55744,"Melatonin may also be injected into the muscle to help treat cancer. How does it work? Melatonin's main job in the body is to regulate night and day cycles or sleep-wake cycles. Darkness causes the body to produce more melatonin, which signals the body to prepare for sleep."
457,msmarco,_doc,MARCO_6100378,5.55744,"And too much melatonin is a bad for you. Popping a melatonin pill (or two) is the easiest way to overload your body with this hormone. Research is now revealing that our production of melatonin not only governs our circadian rhythms, but plays a role in scavenging free radicals and supporting the immune system."
458,msmarco,_doc,MARCO_7064485,5.55744,"Melatonin is a natural hormone when produced in the body (the endogenous hormone). Melatonin is not a vitamin. Melatonin supplements (exogenous hormone) are made synthetically and all products and strengths on the U.S. market are available without a prescription at the pharmacy, nutrition stores, and other retail shops."
459,msmarco,_doc,MARCO_4025885,5.5564656,"Problems in assessment of acute melatonin overdose. We do know that melatonin, far from poisoning a rat liver, protects that liver from destruction by acetaminophen poisoning. The following shows control, MT (melatonin), acetaminophen, and MT with acetaminophen. Liver inflammation was significantly reduced."
460,msmarco,_doc,MARCO_4075142,5.5564656,"Mistake #2: I can take melatonin at any time. If melatonin is used during daytime brightness, it can cause adverse effects. If the body clock is receiving conflicting daytime light signals and dark signals from melatonin, it can malfunction and not work properly when it is time to go to sleep later."
461,msmarco,_doc,MARCO_3972787,5.5564656,"One milligram (mg) is equal to 1,000 micrograms (mcg). Therefore, if you were taking 300 micrograms of melatonin then you would need to find a product that is 0.3 milligrams of melatonin. The highest amount of melatonin found over-the-counter is 3 milligrams or 3,000 micrograms. There are different strengths available."
462,msmarco,_doc,MARCO_1709407,5.5564656,"The Importance of Melatonin. I personally believe that melatonin is one of the most important nutrients to help you optimize your sleep, as it plays a crucial role in your circadian rhythm or internal clock. Melatonin is produced by a pea-sized gland in the middle of your brain called the pineal gland."
463,msmarco,_doc,MARCO_1018959,5.5564656,"Eight of the subjects took 5 mg of melatonin, while nine subjects took a placebo. Those who took melatonin had almost no symptoms of jet lag. Six out of nine placebo subjects scored above 50 on the jet lag scale, and all of the melatonin subjects scored below."
464,msmarco,_doc,MARCO_4948744,5.5564656,"Also, melatonin supplements can be effective in treating certain sleep disorders, including jet lag, says Avidan. But studies suggest you must time the melatonin you take carefully to help with jet lag. On the day you depart, take melatonin when it is bedtime at your destination. Continue taking it for several days."
465,msmarco,_doc,MARCO_6655652,5.5564656,"Melatonin Can Do Much More Than Help You Sleep. There's a reason melatonin is on many doctor's must-have anti-aging list and touted by celebrities like Suzanne Somers for its powerful ability to encourage sleep and slow aging. While melatonin is produced during deep sleep, its benefits are not reserved to the midnight hours, however."
466,msmarco,_doc,MARCO_7976108,5.5564656,"Q: Is melatonin safe to use for kids? A: Melatonin supplements are found to cause side effects such as bedwetting, diarrhea and dizziness in children. If your child absolutely needs to take melatonin, try the lowest recommended dosage first under the guidance of an experienced doctor. 38"
467,msmarco,_doc,MARCO_8154889,5.5564656,"The primary role of the pineal gland is to secrete melatonin. Melatonin is a derivative of the amino acid tryptophan, from which serotonin; the precursor of melatonin is derived. This hormone controls various body rhythms, in particular, the internal body clock and sleeping and waking patterns."
468,msmarco,_doc,MARCO_7549926,5.5564656,I stopped the melatonin.. The St. Peter's mixed results are hard to explain but the doctors we spoke to agree one thing is clear: melatonin isn't necessarily qualified to be a safe sleep aid for kids. Melatonin is a hormone that is secreted by your brain and is present in every person's body.
469,msmarco,_doc,MARCO_6981420,5.5564656,DRUG CLASS AND MECHANISM: Melatonin is a natural hormone produced by the pineal gland in the body. Commercially available melatonin that is sold as medicine is produced in the laboratory. Melatonin regulates sleep-wake cycle. Check with your healthcare professional before using herbs or other supplements.
470,msmarco,_doc,MARCO_7654364,5.5564656,"Melatonin's main job in the body is to regulate night and day cycles or sleep-wake cycles. Darkness causes the body to produce more melatonin, which signals the body to prepare for sleep. Light decreases melatonin production and signals the body to prepare for being awake."
471,msmarco,_doc,MARCO_6655648,5.5554924,"Melatonin is thought to regulate sleep cycles and help to set the brain’s biological clock. But the amount of melatonin produced by the body lessens as we age, with adults experiencing about a 37 percent decline in daily melatonin output between the ages of twenty and seventy."
472,msmarco,_doc,MARCO_8200538,5.5554924,"A PubMed study: http://www.ncbi.nlm.nih.gov/pubmed/10753413. The Serotonin / Melatonin Connection. Some serotonin is converted in the pineal gland to melatonin, which regulates sleep patterns. Melatonin has been shown to be helpful in getting a good night’s sleep and in some cases reducing tinnitus symptoms."
473,msmarco,_doc,MARCO_7474303,5.5554924,"If you take melatonin, choose commercial supplements produced in a lab. Melatonin supplements made from animal sources might contain contaminants. Avoid activities that require alertness — such as driving or operating heavy machinery — for four to five hours after taking melatonin."
474,msmarco,_doc,MARCO_235061,5.55452,Melatonin inhibits breast cancer via a number of pathways. Melatonin can slow the growth of many types of cancer especially hormone dependent ones. Past newsletters have mentioned its particular role in breast cancer. This newsletter will look at some of the mechanisms by which melatonin acts against breast cancer.
475,msmarco,_doc,MARCO_7064487,5.55452,"For jet lag, 0.1-8 milligrams of melatonin has been taken by mouth on the day of travel (close to target bedtime at destination), then daily for several days, in the form of standard or slow-release melatonin (Circadin®). For memory, three milligrams of melatonin has been taken by mouth before testing."
476,msmarco,_doc,MARCO_8673445,5.55452,"Many melatonin supplements contain potentially harmful substances. Xylitol is, for example, a toxic artificial sweetener often found in melatonin products. Otherwise, this natural drug can be given to your dog in low doses. Melatonin works well for canines with mild sleep problems as well as separation anxiety issues."
477,msmarco,_doc,MARCO_774260,5.553549,"Nineteen participants entered into the double-blind phase of the trial and were randomized to receive placebo or melatonin 5 mg in a crossover fashion for 30 days (10 days with melatonin/placebo, 5-day washout period, 10 days of melatonin or placebo, and 5-day washout period)."
478,msmarco,_doc,MARCO_3776240,5.553549,"Melatonin Lowers Blood Pressure. 1  According to a study whose results are published in the February 2004 issue of Hypertension, repeated use of melatonin appears to lower blood pressure. Melatonin plays a role in regulating your internal clock, which appears to be disturbed in people with high blood pressure."
479,msmarco,_doc,MARCO_8154887,5.553549,"The Pineal Gland and Melatonin. The pineal gland or epiphysis synthesizes and secretes melatonin, a structurally simple hormone that communicates information about environmental lighting to various parts of the body. Ultimately, melatonin has the ability to entrain biological rhythms and has important effects on reproductive function of many animals."
480,msmarco,_doc,MARCO_1502873,5.5525784,"Melatonin is actually quite safe. There’s no evidence that melatonin supplementation will down-regulate normal endogenous production of the hormone. It’s a commonly-held concern with melatonin, but it’s just not the case whether you’re supplementing with 0.5 mg, 2 mg, or 5 mg."
481,msmarco,_doc,MARCO_1885178,5.5525784,"While the full function of the pineal gland is still somewhat mysterious, we do know that it secretes the hormone melatonin. Melatonin is a hormone from the pineal gland that helps regulate biological rhythms such as sleep and wake cycles. In other words, it's melatonin that directs your internal clock - the one that allows you to wake up about the same time every morning without an alarm clock."
482,msmarco,_doc,MARCO_5993321,5.5525784,"Melatonin has been studied for insomnia in the elderly. Prolonged-release melatonin has shown good results in treating insomnia in older adults. Short-term treatment (up to three months) of prolonged-release melatonin was found to be effective and safe in improving sleep latency, sleep quality, and daytime alertness."
483,msmarco,_doc,MARCO_406626,5.551609,"A dose of 0.5 milligrams of melatonin has been taken under the tongue for six days. For seizure disorders, doses of melatonin taken by mouth were 3-10 milligrams daily for 2-4 weeks to three months. For sleep (general), doses of melatonin taken by mouth were 0.3-10 milligrams."
484,msmarco,_doc,MARCO_345476,5.551609,"Of the two, MT1 is most specific for sedation, and Rozerem has a 15-fold greater affinity for MT1 than straight melatonin, a fact that probably accounts for why melatonin is only mildly effective as a sleep aid (see this meta-analysis of melatonin studies: Brzezinski A et al., Sleep Med Rev 2005;9:41-50)."
485,msmarco,_doc,MARCO_367322,5.551609,"Melatonin is a chemical that your own brain releases to put you to sleep. Melatonin that you can purchase is very effective. It is one of the best remedies that I have seen to help with insomnia.I do not see a problem with you buying any over the internet.If it has been deemed illegal for you to 'own' it in your country, then there would be a problem.elatonin is a chemical that your own brain releases to put you to sleep. Melatonin that you can purchase is very effective. It is one of the best remedies that I have seen to help with insomnia."
486,msmarco,_doc,MARCO_3345278,5.551609,"Melatonin might also reduce the time it takes to fall asleep — although this effect is typically mild. Melatonin might be more effective for other types of sleep issues, such as delayed sleep disorder or other sleep disorders affecting circadian rhythm. The most common melatonin side effects include: 1  Daytime sleepiness. 2  Headaches."
487,msmarco,_doc,MARCO_5827393,5.551609,"Answers From Experts & Organizations (1) SUCCESS! A. One milligram (mg) is equal to 1,000 micrograms (mcg). Therefore, if you were taking 300 micrograms of melatonin then you would need to find a product that is 0.3 milligrams of melatonin. The highest amount of melatonin found over-the-counter is 3 milligrams or 3,000 micrograms. There are different strengths available."
488,msmarco,_doc,MARCO_8813429,5.5506406,"Melatonin is a hormone secreted by the pineal gland in the brain. It helps regulate other hormones and maintains the body's circadian rhythm. The circadian rhythm is an internal 24-hour clock that plays a critical role in when we fall asleep and when we wake up. When it is dark, your body produces more melatonin. When it is light, the production of melatonin drops."
489,msmarco,_doc,MARCO_886208,5.549673,"Melatonin is involved in the regulation of the sleep-wake cycle, circadian rhythms, and seasonal changes in the light dark cycle. Commonly used to induce sleep, some (but not all) find it to reduce jet lag. There is a high concentration of melatonin in the pineal gland, where it is manufactured. I was surprised to learn that there are significant amounts of melatonin present in the gastrointestinal tract."
490,msmarco,_doc,MARCO_8261801,5.549673,"Overview. Melatonin is a hormone secreted by the pineal gland in the brain. It helps regulate other hormones and maintains the body's circadian rhythm. The circadian rhythm is an internal 24-hour clock that plays a critical role in when we fall asleep and when we wake up. When it is dark, your body produces more melatonin. When it is light, the production of melatonin drops."
491,msmarco,_doc,MARCO_8519535,5.549673,"Pure melatonin is most often sold as a pill or capsule, but you can also buy it in liquid or even spray form. The advertised strength of the melatonin dose may range from 1mg up to 10mg or more. It is important to remember that melatonin is not regulated by the U.S. Food and Drug Administration (FDA). As such, production and quality standards are not enforced, so the dose may actually vary from the listed strength."
492,msmarco,_doc,MARCO_774267,5.5487065,"Data taken from a study of one 3-year-old boy with SMS supplemented with melatonin 6 mg or placebo over 12 consecutive nights suggest that melatonin supplementation is associated with a shorter time to sleep induction (3.36 ± 2.23 hours with melatonin vs 7.32 ± 3.71 hours with placebo, P < 0.05)."
493,msmarco,_doc,MARCO_4056500,5.5487065,"20 Nov 2012. If you've never taken melatonin, then I would say cut it in half and try half at a time. It takes a little while to make you sleepy. I have seen time release melatonin that are 10 mg, and those would be ok, you're not getting it all at once. I have taken it for years, including when I was in the army. Was never late, and I'm still not. I'm a stickler for being on time and melatonin has never been a problem. I take 10mg every night."
494,msmarco,_doc,MARCO_3045766,5.5487065,"Can Melatonin and Exercise Stop Alzheimer's? Now it seems that melatonin, the sleep hormone, also has important anti-aging effects. There seems to be a good amount of buzz in the Alzheimer's community about this recent research and the use of exercise and melatonin to reduce brain deterioration. It appears that after beginning treatment mice showed improvement in behavior, learning, and memory. You can read a summary of the results below."
495,msmarco,_doc,MARCO_6351704,5.5487065,"Many of melatonin's biological effects in animals are produced through activation of melatonin receptors, while others are due to its role as a pervasive and powerful antioxidant, with a particular role in the protection of nuclear and mitochondrial DNA.n animals, melatonin is involved in the entrainment (synchronization) of the circadian rhythms of physiological functions including sleep timing, blood pressure regulation, seasonal reproduction and many others."
496,msmarco,_doc,MARCO_4835513,5.5477405,"Pure melatonin is most often sold as a pill or capsule, but you can also buy it in a liquid or even spray form. The advertised strength of the melatonin dose may range from 1 mg up to 10 mg or more. It is important to remember that melatonin is not regulated by the U.S. Food and Drug Administration (FDA). As such, production and quality standards are not enforced, so the dose may actual vary from the listed strength."
497,msmarco,_doc,MARCO_4699890,5.5477405,"Serotonin and melatonin are both hormones that regulate various human functions such as sleep, appetite and mood. Serotonin, which is produced in the body, is known as a neurotransmitter; this means it is responsible for sending messages between nerve cells.n turn, it is then converted into both serotonin and melatonin. Additionally, serotonin can be converted into melatonin by the body. Both 5-HTP and tryptophan can be purchased in supplemental form."
498,msmarco,_doc,MARCO_4840820,5.5477405,"Serotonin and melatonin are essential neurotransmitters with distinct roles in regulating mood and health. Serotonin is a natural stimulant. Melatonin is a sedative derived from serotonin.An inadequate supply or inefficient use of either neurotransmitter is linked to mental illness.erotonin and melatonin work as neurotransmitters, chemicals carrying signals between neurons in the brain. Serotonin enhances mood and provides energy."
499,msmarco,_doc,MARCO_774268,5.546776,"Owing to melatonin's antioxidant properties, the use of melatonin for the prevention of postoperative pericardial adhesion formation has been investigated. Twelve dogs received pericardial abrasions to promote adhesion and were randomized to receive either melatonin 10 mg/kg plus ethanol 5% in 10 mL sodium chloride or 10 mL sodium chloride dilution with ethanol 5%."
500,msmarco,_doc,MARCO_38426,5.546776,"There is some scientific evidence that melatonin might improve alertness in people with jet lag. But it doesn't seem to be as useful for other jet lag symptoms such as daytime sleepiness. Melatonin might also be helpful for insomnia for some people. There is also some evidence that melatonin might improve the effectiveness of cancer drugs used to fight tumors in the breast, lung, kidney, liver, pancreas, stomach and colon. But it should only be used for this purpose with the help of a healthcare professional."
501,msmarco,_doc,MARCO_38429,5.546776,"Drug Melatonin. The generic Melatonin is manufactured by one company. The information provided includes the cost of the drug and the type of drug-tablet, capsule, syrup, cream, gel, ointment, liquid or injection. To view the price of the drug click on the brand name. Please also note that Medindia's database currently has 1 Brands of Generics of Melatonin listed."
502,msmarco,_doc,MARCO_6760523,5.546776,"Melatonin might be more effective for other types of sleep issues, such as delayed sleep disorder or other sleep disorders affecting circadian rhythm. Other, less common melatonin side effects might include abdominal discomfort, mild anxiety, irritability, confusion and short-lasting feelings of depression. In addition, melatonin supplements can interact with various medications, including: Blood-thinning medications (anticoagulants)"
503,msmarco,_doc,MARCO_7231735,5.546776,"[Show abstract] [Hide abstract] ABSTRACT: In a series of four separate studies of the 24-hour pattern of melatonin secretory function in man, the following results were obtained. Sequential measurement of the concentration of melatonin in plasma and urine demonstrated a 24-hour rhythm in which more melatonin is secreted during the sleep-lights off as compared to the waking-lights on period."
504,msmarco,_doc,MARCO_3396592,5.545812,"Melatonin, also known as N-acetyl-5-methoxy tryptamine, is a hormone that is produced by the pineal gland in animals and regulates sleep and wakefulness. Melatonin is also produced in plants where it functions as a first line of defense against oxidative stress. In animals, melatonin is involved in the entrainment (synchronization) of the circadian rhythms including sleep-wake timing, blood pressure regulation, seasonal reproduction, and many others."
505,msmarco,_doc,MARCO_4840815,5.545812,"The precursor to melatonin is serotonin, a neurotransmitter that itself is derived from the amino acid tryptophan. Within the pineal gland, serotonin is acetylated and then methylated to yield melatonin.Synthesis and secretion of melatonin is dramatically affected by light exposure to the eyes.he pineal gland or epiphysis synthesizes and secretes melatonin, a structurally simple hormone that communicates information about environmental lighting to various parts of the body."
506,msmarco,_doc,MARCO_5693223,5.545812,"During health exams, tell your doctor if you are taking melatonin. And tell your doctor if you are having trouble sleeping (insomnia), because it may be related to a medical problem. In adults, melatonin is taken in doses from 0.2 mg to 20.0 mg, based on the reason for its use. The right dose varies widely from one person to another. Talk to your doctor to learn the right dosage and to find out if melatonin is right for you."
507,msmarco,_doc,MARCO_7764605,5.545812,"Melatonin might be more effective for other types of sleep issues, such as delayed sleep disorder or other sleep disorders affecting circadian rhythm. Other, less common melatonin side effects might include abdominal discomfort, mild anxiety, irritability, confusion and short-lasting feelings of depression. If you're considering taking melatonin supplements, check with your doctor first — especially if you have any health conditions."
508,msmarco,_doc,MARCO_3163510,5.544849,"Melatonin. Melatonin is a hormone produced by the pineal gland, a small gland in the brain, that plays a part in the body's sleep cycles. The brain makes this neurohormone from the amino acid tryptophan.elatonin. Melatonin is a hormone produced by the pineal gland, a small gland in the brain, that plays a part in the body's sleep cycles. The brain makes this neurohormone from the amino acid tryptophan."
509,msmarco,_doc,MARCO_4699896,5.544849,"These foods contain amino acids, vitamins and complex carbohydrates necessary for melatonin manufacture. Foods that contain serotonin-boosting substances, namely the amino acid tryptophan, include seafood, dairy, chicken, nuts, seeds and eggs.n turn, it is then converted into both serotonin and melatonin. Additionally, serotonin can be converted into melatonin by the body. Both 5-HTP and tryptophan can be purchased in supplemental form."
510,msmarco,_doc,MARCO_6442310,5.544849,"@literally45-- I recommend switching to another treatment, because melatonin really does cause a spike in blood sugar. I have diabetes and I cannot take melatonin. Any food or supplement that causes sudden changes in blood sugar is bad because these spikes lead to insulin resistance, which is the precursor to diabetes. This goes for a food that's high in carbohydrates and sugar. It also goes for melatonin. @literally45-- I don't think that supplements lead to diabetes."
511,msmarco,_doc,MARCO_7231737,5.544849,"Melatonin supplements are all natrual and are generally safe for anyone to take. The only side effect that has been consistent, among users of melatonin, is drowsiness. Although melatonin itself does not improve the symptoms of ADHD, the fact that it allows the sufferer to obtain more sleep results in fewer or less extreme symptoms. These supplements can be purchased in 3 mg. doses or 5 mg doses, though a 3 mg. dosage is usually recommended to start out with."
512,msmarco,_doc,MARCO_367316,5.543887,"Melatonin works by triggering chemical receptors in the brain to encourage sleep. Melatonin is available by prescription only and is given as a short-term treatment of insomnia in people age 55 and over.The medicine should not be used for longer than 13 weeks.elatonin is not recommended for people with allergies or sensitivity to any of the medicine's ingredients, or who have problems with the immune system, kidney or liver problems. Alcohol should be avoided while taking melatonin."
513,msmarco,_doc,MARCO_2668208,5.543887,"The time of day that you take melatonin is very important. If you take it because you have trouble staying asleep, you can take a controlled release formulation before going to bed. However, if you take it because you have trouble falling asleep, it is recommended to take it up to three hours before you go to bed; timing is individual and may require some experimentation. If you wake up in the middle of the night, don't take melatonin to go back to sleep. Doing so will throw off your internal body clock. Melatonin should only be taken before your ..."
514,msmarco,_doc,MARCO_4840816,5.541966,"Definition of MELATONIN. : a vertebrate hormone that is derived from serotonin, is secreted by the pineal gland especially in response to darkness, and has been linked to the regulation of circadian rhythms.See melatonin defined for kids.ADVERTISEMENT. Greek melas black + -tonin (as in serotonin). a vertebrate hormone that is derived from serotonin, is secreted by the pineal gland especially in response to darkness, and has been linked to the regulation of circadian rhythms. See melatonin defined for kids. ADVERTISEMENT."
515,msmarco,_doc,MARCO_4899775,5.541966,"Melatonin is a hormone made by the pineal gland, a small gland in the brain. Melatonin helps control your sleep and wake cycles. Very small amounts of it are found in foods such as meats, grains, fruits, and vegetables.You can also buy it as a supplement.elatonin supplements are sometimes used to treat jet lag or sleep problems (insomnia). Scientists are also looking at other good uses for melatonin, such as: 1  Treating seasonal affective disorder (SAD)."
516,msmarco,_doc,MARCO_5328579,5.541966,"Occasionally, melatonin is used as a complementary medicine in cancer treatment for breast, brain, lung, prostate, head and neck, or gastrointestinal cancer. Melatonin is sometimes used to mitigate the side effects of chemotherapy including weight loss, nerve pain, weakness and a condition called thrombocytopenia.elatonin's effects on sleep, other hormones and cancer are the reason it has been studied ever since its discovery in the 1950s. In the mid-1990s, synthetic melatonin became available as a nutritional supplement."
