,_index,_type,_id,_score,_source.body
0,msmarco,_doc,MARCO_6630182,10.413197,"Melatonin is a naturally occurring hormone synthesized in the brain that regulates normal sleep and wake cycles. Melatonin levels naturally start to rise in the evening and remain elevated for most of the night, signalling to our body that it is time to sleep.his is the really important thing you should understand about melatonin: Melatonin is a sleep and body clock regulator – NOT a sleep initiator. Melatonin works with your biological clock by telling your brain when it is time to sleep. Melatonin does not increase your sleep drive or need for sleep."
1,msmarco,_doc,MARCO_60503,10.157663,"Melatonin is produced by the pineal gland and sends a signal to regulate the sleep-wake cycle in the sleep center of the brain. Interestingly, melatonin is also produced in the retina, the skin, and the GI tract, but this is not the melatonin what affects your biological sleep clock.This is the really important thing you should understand about melatonin: melatonin is a sleep and body clock regulator NOT a sleep initiator.Melatonin works with your biological clock by telling your brain when it is time to sleep. Melatonin does not increase your sleep drive or need for sleep.elatonin is not considered an effective treatment for insomnia. Melatonin in pill form does not function like your body’s naturally produced melatonin: it affects the brain in bursts and rapidly leaves the system, instead of the slow build up and slow wash-out that your body’s naturally produced melatonin experiences."
2,msmarco,_doc,MARCO_5328574,9.678219,"Melatonin is a hormone, also known as N-acetyl-5-methoxytryptamine, it is a naturally occurring compound found in humans, animals, microbes and plants.In animals and humans, melatonin levels vary during the daily cycle. It is intimately involved in regulating the sleeping and waking cycles.nowledge center. Melatonin is a hormone, also known as N-acetyl-5-methoxytryptamine, it is a naturally occurring compound found in humans, animals, microbes and plants. In animals and humans, melatonin levels vary during the daily cycle."
3,msmarco,_doc,MARCO_5328573,9.672511,"Knowledge center. Melatonin is a hormone, also known as N-acetyl-5-methoxytryptamine, it is a naturally occurring compound found in humans, animals, microbes and plants. In animals and humans, melatonin levels vary during the daily cycle.It is intimately involved in regulating the sleeping and waking cycles.nowledge center. Melatonin is a hormone, also known as N-acetyl-5-methoxytryptamine, it is a naturally occurring compound found in humans, animals, microbes and plants. In animals and humans, melatonin levels vary during the daily cycle."
4,msmarco,_doc,MARCO_3349369,9.38982,"Melatonin – A signal of darkness and marker for circadian rhythms Melatonin is a naturally occurring hormone that is key to sleep and the sleep-wake cycle in humans and animals 8. In the body, melatonin is produced by the pineal gland in the brain when night falls. The retina detects failing light, and the level of melatonin gradually increases, reaching its peak in the middle of the night in natural circumstances 9."
5,msmarco,_doc,MARCO_6092856,9.366854,"Read More. Melatonin is a naturally occurring neuro-hormone that is secreted by the pineal gland in the brain. When released from the pineal gland, melatonin causes drowsiness and a decrease in core body temperature. The levels of melatonin rise throughout the evening hours and peak in the middle of the night.elatonin is a hormone secreted from pineal gland and is important for the sleep-wakefulness cycle. High doses of melatonin can induce sleep(80mg) but low doses do not(2-10) but may only increase your propensity for slee."
6,msmarco,_doc,MARCO_8519541,9.295473,"Listed doses may not be controlled or accurate, meaning the amount of melatonin in a pill you take may not be the amount listed on the package. Most commercial products are offered at dosages that cause melatonin levels in the blood to rise to much higher levels than are naturally produced in the body. Taking a typical dose (1 to 3 mg) may elevate your blood melatonin levels to 1 to 20 times normal. For melatonin to be helpful, the correct dosage, method and time of day it is taken must be appropriate to the sleep problem. Taking it at the wrong time of day may reset your biological clock in an undesirable direction."
7,msmarco,_doc,MARCO_3960638,9.263039,"Melatonin is not considered an effective treatment for insomnia. Melatonin in pill form does not function like your body's naturally produced melatonin; it effects the brain in bursts and rapidly leaves the system, instead of the slow build-up and slow wash-out that your body's naturally produced melatonin experiences. The correct dosage of melatonin can be a problem. According to research conducted at M.I.T., the correct dosage of melatonin for it to be effective is 0.3-1.0 mg. Many commercially available forms of melatonin are in three to 10 times the amount your body would need. In fact, there is some evidence that higher doses may be less effective."
8,msmarco,_doc,MARCO_4840822,9.230542,"Melatonin and serotonin are two naturally occurring substances found in your body. Your pineal gland produces melatonin, and your intestinal cells and brain’s nervous center produces serotonin. Both melatonin and serotonin play several roles in human behavior and cognition.Serotonin syndrome is a medical condition defined as excess levels of serotonin in your body.our pineal gland produces melatonin, and your intestinal cells and brain’s nervous center produces serotonin. Both melatonin and serotonin play several roles in human behavior and cognition. Serotonin syndrome is a medical condition defined as excess levels of serotonin in your body."
9,msmarco,_doc,MARCO_1085320,9.1474,"Melatonin helps you develop healthy sleeping patterns. Overview. Melatonin helps you develop healthy sleeping patterns. According to MayoClinic.com, melatonin is a hormone that is naturally produced in the brain. Melatonin is released and stimulated in the brain by darkness, and is suppressed by both natural and artificial light. Although melatonin is naturally produced, melatonin supplements are prescribed and used for a variety of reasons."
10,msmarco,_doc,MARCO_6630185,9.094063,"Melatonin is naturally produced in your brain. It tells your body that it’s nighttime and it’s time to go to bed. Melatonin is a powerful hormone.Many may mistake its power for that of a sleeping pill and feel compelled to take more for better sleep. However, at the wrong dosage, melatonin may actually destroy your sleep cycle. Too much melatonin at one time may also cause headaches, nausea, dizziness, or irritability.rom This Episode: Melatonin is naturally produced in your brain. It tells your body that it’s nighttime and it’s time to go to bed. Melatonin is a powerful hormone. Many may mistake its power for that of a sleeping pill and feel compelled to take more for better sleep."
11,msmarco,_doc,MARCO_4899781,8.957747,"Melatonin is a hormone found naturally in the body. Melatonin used as medicine is usually made synthetically in a laboratory. It is most commonly available in pill form, but melatonin is also available in forms that can be placed in the cheek or under the tongue.elatonin is a hormone found naturally in the body. Melatonin used as medicine is usually made synthetically in a laboratory. It is most commonly available in pill form, but melatonin is also available in forms that can be placed in the cheek or under the tongue."
12,msmarco,_doc,MARCO_4899777,8.876152,"Melatonin is a naturally occuring neuro-hormone which is synthesized by the pineal gland. Natural melatonin is thought to regulated sleep, mood, puberty, and ovarian cycles. Melatonin supplements are still be investigated for use in people.hanks for your question. In its natural form, melatonin is produced by the brain’s pineal gland to regulate the sleep cycle. When the body is working best, the level melatonin in the bloodstream rises sharply, reducing alertness and inviting sleep, and in the morning it falls back, encouraging waking."
13,msmarco,_doc,MARCO_621868,8.846309,"5 Ways To Increase Melatonin Naturally. There’s a reason that Melatonin is called the ‘hormone of darkness.” Melatonin is the substance, produced by the body at night, that regulates your sleep patterns. Melatonin is crucial to a good night’s sleep."
14,msmarco,_doc,MARCO_2949950,8.813183,"Most commercial melatonin based sleep products contain dosages that cause melatonin levels in your body to rise above naturally produced levels – in effect, they amplify the production of melatonin, so the dosage you take is not a good guide for the amount you will have in your blood after taking the supplement."
15,msmarco,_doc,MARCO_8562620,8.797056,"While research has shown the body’s naturally-produced melatonin helps regulate sleep, synthetic melatonin has proven less than impressive. One thing that has been virtually ignored, however, are the foods that are able to increase the body’s natural melatonin production. Melatonin is a hormone produced by the pineal gland. Not only does it control your circadian (sleeping and waking) cycles, but it is responsible for regulating other hormones as well. It plays a role in regulating female reproductive hormones including menstruation and menopause."
16,msmarco,_doc,MARCO_7557836,8.782419,Pineal gland hormones include melatonin and ramelteon (Rozerem). How pineal gland hormones work. Melatonin is a hormone produced by the pineal gland (located in the brain) during the dark hours of the day-night cycle (circadian rhythm).Melatonin levels in the body are low during daylight hours. The pineal gland responds to darkness by increasing melatonin levels in the body.elatonin is a hormone produced by the pineal gland (located in the brain) during the dark hours of the day-night cycle (circadian rhythm). Melatonin levels in the body are low during daylight hours. The pineal gland responds to darkness by increasing melatonin levels in the body.
17,msmarco,_doc,MARCO_2131247,8.764225,"Melatonin is a naturally occurring hormone in the human body. Individuals experience sleep disturbances and other sleep-related issues often either do not produce adequate melatonin, or do not respond well to the melatonin they naturally produce. As such, melatonin in the form a dietary supplement may be the answer."
18,msmarco,_doc,MARCO_97925,8.756435,"Melatonin in pill form does not function like your body’s naturally produced melatonin: It affects the brain in bursts and rapidly leaves the system, instead of the slow build-up and slow wash-out that your body’s naturally produced melatonin experiences. The correct dosage of melatonin can be a problem."
19,msmarco,_doc,MARCO_2900385,8.754493,"Melatonin is not considered an effective treatment for insomnia. Melatonin in pill form does not function like your body’s naturally produced melatonin: It affects the brain in bursts and rapidly leaves the system, instead of the slow build-up and slow wash-out that your body’s naturally produced melatonin experiences."
20,msmarco,_doc,MARCO_7474306,8.754493,From some quick research it seems the ill long term effects are much so unknown. Melatonin is a hormone secreted naturally by the pineal gland. Melatonin is the sleep hormone. It is said to induce sleep without any negative side effects. Melatonin is secreted mainly at night. Melatonin is found naturally in plants and in algae.
21,msmarco,_doc,MARCO_8468229,8.750612,"Melatonin and butterbur extracts are interesting examples of naturally derived products that consumers must be wary of are. Melatonin is a popular natural “sleep aid”, and naturally derived melatonin comes from the pineal glands of animals, which may contain viral material. Synthetic melatonin is molecularly exactly the same, and is much safer to take."
22,msmarco,_doc,MARCO_1018960,8.740946,Melatonin Benefits. Melatonin is a substance that occurs naturally and is synthesized from serotonin and then produced by the pineal gland. Production of melatonin is highest at night and will basically signal the body that it would be time to sleep. This means that melatonin deals with the person’s perceptions and the natural reaction to night and daytime. Persons suffering from insomnia naturally are deficient with the natural substance.
23,msmarco,_doc,MARCO_3104076,8.670765,"Melatonin is a hormone produced naturally by the pineal gland in response to darkness. Levels remain high during sleep until the pineal gland tapers off production in response to light.elatonin was a top choice. However melatonin dose more than influence sleep. Melatonin also regulates the start of menstruation, the length of ovulation cycles and menopause, according to the University of Maryland Medical Center. Melatonin supplements are purported to help bone loss and menopause symptoms."
24,msmarco,_doc,MARCO_1751868,8.636479,"Our circadian rhythm (or ‘body clock’) is influenced by melatonin, as it acts as a ‘time cue’, anticipating sleep. It is also an important physiological regulator of the sleep-wake cycle. Melatonin is not a sedative, but a sign of darkness or night-time, and is a cue for innate night-time behaviour.In the morning when plasma levels of melatonin decrease, sleep ends and wakefulness begins.elatonin – A signal of darkness and marker for circadian rhythms. Melatonin is a naturally occurring hormone that is key to sleep and the sleep-wake cycle in humans and animals."
25,msmarco,_doc,MARCO_4129555,8.531684,"(Of a cell, gland, or organ) produce and discharge (a substance): insulin is secreted in response to rising levels of glucose in the blood. More example sentences.Synonyms. 1  Melatonin, produced naturally from the amino acid tryptophan, is a hormone secreted by a gland in the brain.2  Natural interferons are a group of small proteins secreted by cells following viral infection. 3  Sweat is secreted by glands in the skin when it is necessary to lose excess heat from the body. Melatonin, produced naturally from the amino acid tryptophan, is a hormone secreted by a gland in the brain. 2  Natural interferons are a group of small proteins secreted by cells following viral infection. 3  Sweat is secreted by glands in the skin when it is necessary to lose excess heat from the body."
26,msmarco,_doc,MARCO_6092859,8.493122,"Melatonin is a naturally occurring hormone, which plays an important role in regulating sleep. Secreted by the pineal gland, a small endocrine gland located in the brain, Melatonin controls the circadian rhythm, the body's internal clock that controls when a person falls asleep and wakes up.elatonin is a hormone secreted from pineal gland and is important for the sleep-wakefulness cycle. High doses of melatonin can induce sleep(80mg) but low doses do not(2-10) but may only increase your propensity for slee."
27,msmarco,_doc,MARCO_367323,8.490194,"Melatonin is a hormone that is produced naturally by the body from the pineal gland in the brain. Melatonin forms part of the signal series in the circadian rhythm. In particular, Melatonin influences the onset of sleep by causing drowsiness and a lowering of the body temperature.ow to take Melatonin. Melatonin is taken as one tablet 1 to 2 hours before bedtime and with food. Melatonin is licensed in the UK for up to 13 weeks but The Online Clinic will not prescribe it for this length of time."
28,msmarco,_doc,MARCO_8739625,8.477484,"Melatonin in pill form does not function like your body’s naturally produced melatonin: It affects the brain in bursts and rapidly leaves the system, instead of the slow build-up and slow wash-out that your body’s naturally produced melatonin experiences."
29,msmarco,_doc,MARCO_7654367,8.442053,"Melatonin is naturally produced by our bodies, but caffeine, alcohol and tobacco use can all lower melatonin levels in the body. So can working the night shift or having poor vision. For some people, melatonin can help get their inherent rhythms get back on track."
30,msmarco,_doc,MARCO_4116626,8.433276,"Melatonin is a naturally occurring neuro-hormone that is secreted by the pineal gland in the brain. When released from the pineal gland, melatonin causes drowsiness and a decrease in core body temperature. The levels of melatonin rise throughout the evening hours and peak in the middle of the night."
31,msmarco,_doc,MARCO_1151960,8.407101,"Melatonin and serotonin are two naturally occurring substances found in your body. Your pineal gland produces melatonin, and your intestinal cells and brain’s nervous center produces serotonin. Both melatonin and serotonin play several roles in human behavior and cognition. Serotonin syndrome is a medical condition defined as excess levels of serotonin in your body."
32,msmarco,_doc,MARCO_5932556,8.343526,Melatonin is a hormone produced naturally by the pineal gland in response to darkness. Levels remain high during sleep until the pineal gland tapers off production in response to light.elatonin is a hormone produced naturally by the pineal gland in response to darkness. Levels remain high during sleep until the pineal gland tapers off production in response to light.
33,msmarco,_doc,MARCO_3045768,8.337194,"MELATONIN Overview Information. Melatonin is a hormone found naturally in the body. Melatonin used as medicine is usually made synthetically in a laboratory. It is most commonly available in pill form, but melatonin is also available in forms that can be placed in the cheek or under the tongue. This allows the melatonin to be absorbed directly into the body."
34,msmarco,_doc,MARCO_1792050,8.312084,"Melatonin supplements can be beneficial in numerous ways, but there are also side effects of melatonin which should be considered. Melatonin is a hormone naturally produced in the pituitary gland, located in the brain.Some fruits, vegetables, meats, and other foods contain traces of melatonin.hile not as common, there are other side effects of melatonin supplementation. For instance, in one medical study among men it was found that melatonin causes sperm concentrations to be decreased, and the motility rate also declines significantly."
35,msmarco,_doc,MARCO_6867521,8.30825,"Melatonin is a hormone found naturally in the body. Melatonin used as medicine is usually made synthetically in a laboratory. It is most commonly available in pill form, but melatonin is also available in forms that can be placed in the cheek or under the tongue. Jet lag. 2  Most research shows that melatonin can improve certain symptoms of jet lag such as alertness and movement coordination. 3  Melatonin also seems to slightly improve other jet lag symptoms such as daytime sleepiness and tiredness."
36,msmarco,_doc,MARCO_4899779,8.285393,"From This Episode: Melatonin is naturally produced in your brain. It tells your body that it’s nighttime and it’s time to go to bed. Melatonin is a powerful hormone. Many may mistake its power for that of a sleeping pill and feel compelled to take more for better sleep.However, at the wrong dosage, melatonin may actually destroy your sleep cycle. Too much melatonin at one time may also cause headaches, nausea, dizziness, or irritability.elatonin is a powerful hormone. Many may mistake its power for that of a sleeping pill and feel compelled to take more for better sleep. However, at the wrong dosage, melatonin may actually destroy your sleep cycle."
37,msmarco,_doc,MARCO_7654368,8.124357,"MELATONIN Overview Information. Melatonin is a hormone found naturally in the body. Melatonin used as medicine is usually made synthetically in a laboratory. It is most commonly available in pill form, but melatonin is also available in forms that can be placed in the cheek or under the tongue."
38,msmarco,_doc,MARCO_4415938,8.114615,Melatonin is a hormone naturally produced by the body to help regulate the normal sleep-wake cycle. Release of melatonin is stimulated by the presence of darkness and normally begins around 9 pm. Melatonin release is inhibited by light. It isn't just sunlight that prevents melatonin from being released.
39,msmarco,_doc,MARCO_38425,8.10492,"Melatonin is also known as MEL. Melatonin is naturally produced in the body in response to the perception of light. Melatonin has been used to ease insomnia, combat jet lag, protect cells from free-radical damage, boost the immune system, prevent cancer, and extend life. Melatonin has not been evaluated by the FDA for safety, effectiveness, or purity."
40,msmarco,_doc,MARCO_2131254,8.099126,"Symptoms of an Overdose on Melatonin. Even if melatonin is a naturally occuring substance inside the body, it is still possible to overdose on it. If you take too much melatonin supplements, you may experience the usual Melatonin Side Effects and/or it can cause some serious problems like the ones listed below: 1  Lethargy. 2  Problems in the liver. 3  Problems in the eye. 4  Seizures. 5  Weakness. 6  Disorientation."
41,msmarco,_doc,MARCO_1919892,8.0971985,"Certain foods naturally contain melatonin, a sleep-inducing hormone. The pineal gland in your brain normally produces melatonin and secretes the hormone into your blood at night. Melatonin regulates your circadian rhythm, a biological response to light and darkness and sleep and wakefulness over a 24 hour cycle. Supplements containing 3 mg or less of melatonin are popular remedies for insomnia."
42,msmarco,_doc,MARCO_6630178,8.085671,"Melatonin is a hormone that's naturally found in the body. A synthetic version of melatonin is available as a supplement that's used to treat sleep disorders and other problems. It's not known whether melatonin is effective in treating any specific medical condition.elatonin overdose can lead to severe drowsiness and affect your sleep-wake cycle. Symptoms of a melatonin overdose may include headache, drowsiness, and upset stomach. If you suspect an overdose, you should contact a poison-control center or emergency room immediately."
43,msmarco,_doc,MARCO_1751869,8.081843,"Melatonin is a hormone found naturally in the body. Melatonin used as medicine is usually made synthetically in a laboratory. It is most commonly available in pill form, but melatonin is also available in forms that can be placed in the cheek or under the tongue. Sleeping problems in people with sleep-wake cycle disturbances. 2  Taking melatonin by mouth is helpful for disturbed sleep-wake cycles in children and adolescents with intellectual disabilities, autism, and other central nervous system disorders."
44,msmarco,_doc,MARCO_3107934,8.081843,"Works with the body's natural cycle to safely and gently promote sleep. All of us produce the hormone melatonin naturally in our brains. It helps set sleep and wake cycles in humans, animals, and even plants and fungi. The amount of melatonin your body produces varies throughout the day and is based on its exposure to light. Darkness makes the body produce more melatonin, which induces sleep, while light suppresses its production. We include melatonin in a handful of our products to help gently promote sleep."
45,msmarco,_doc,MARCO_3349365,8.07976,Melatonin is a naturally occurring hormone that is key to sleep and the sleep-wake cycle in humans and animals. Melatonin is a naturally occurring hormone that is key to sleep and the sleep-wake cycle in humans and animals.
46,msmarco,_doc,MARCO_1919898,8.078023,"Walnuts also contain large amounts of omega-3 fatty acids, which have been shown to inhibit certain types of cancer and to keep the heart healthy. Melatonin is best known as a sleep remedy. It is a naturally occurring hormone produced by the pineal gland, located in the center of the brain. At night or in the dark, the pineal gland releases melatonin to regulate the sleep cycle. The body produces less melatonin with advancing age. While melatonin doesn t require a prescription, it is a potent hormone."
47,msmarco,_doc,MARCO_6630184,8.078023,"A: Melatonin is a hormone found naturally in the body, but can also be made in a laboratory. The main function of melatonin, in the body, is to regulate night and day cycles or sleep-wake cycles.Darkness causes the body to produce more melatonin, which signals the body to prepare for sleep.elatonin overdose can lead to severe drowsiness and affect your sleep-wake cycle. Symptoms of a melatonin overdose may include headache, drowsiness, and upset stomach. If you suspect an overdose, you should contact a poison-control center or emergency room immediately."
48,msmarco,_doc,MARCO_6351698,8.076143,"Today we’ll talk about natural melatonin cycles, how melatonin relates to health, and also how melatonin is taken as a supplement. Your Natural Melatonin Cycle. Melatonin is a hormone produced by the pineal gland. It also acts as a neurotransmitter.In dim light conditions melatonin levels will start to rise about 2 hours before your habitual bedtime, and peak about 2 hours afterwards.This increase is partly responsible for tired feelings before bedtime.oday we’ll talk about natural melatonin cycles, how melatonin relates to health, and also how melatonin is taken as a supplement. Your Natural Melatonin Cycle. Melatonin is a hormone produced by the pineal gland. It also acts as a neurotransmitter."
