,_index,_type,_id,_score,_source.body
0,msmarco,_doc,MARCO_5092674,11.3316145,"In the cassoulet of Toulouse, the meats are pork and mutton, the latter frequently a cold roast shoulder. The Carcassonne version is similar but doubles the portion of mutton and sometimes replaces the duck with partridge. The cassoulet of Castelnaudary uses a duck confit instead of mutton. In France, cassoulets of varying price and quality are also sold in cans and jars in supermarkets, grocery stores and charcuteries. The cheapest ones contain only beans, tomato sauce, sausages, and bacon. More expensive versions are likely to be cooked with goose fat and to include Toulouse sausages, lamb, goose, or duck confit. Haute cuisine versions require mixing pre-cooked roasted meats with beans that have been simmered separately with aromatic vegetables, but this runs counter to cassoulet's peasant origins."
1,msmarco,_doc,MARCO_4548198,10.144835,"The recipe for Toulouse cassoulet. A typical dish of the pink city, Toulouse cassoulet consists of some essential ingredients and some ingredients that vary according to the cook. Of course, there is pork (loin, hock, fresh sausage), but there is also duck confit, bacon, local sausage, and neck of mutton.There are also variants with goose fat confit.he recipe for Toulouse cassoulet. A typical dish of the pink city, Toulouse cassoulet consists of some essential ingredients and some ingredients that vary according to the cook. Of course, there is pork (loin, hock, fresh sausage), but there is also duck confit, bacon, local sausage, and neck of mutton."
2,msmarco,_doc,MARCO_7667707,9.95245,"Feijoada (. [fɐjʒuˈaðɐ] , [fejʒuˈadɐ]) is a stew of beans with beef and pork, which is a typical Portuguese dish. Feijoada is also typically cooked in former Portuguese colonies such as Brazil, Macau, Angola, Mozambique and Goa (India).However, the recipe can differ slightly from one country to another.odern variants of the dish are based on ancient Feijoada recipes from the Portuguese regions of Beira, Estremadura, and Tras-trás-Os. Montes In, brazil (feijoada feijoada) brasileira is often considered the national. dish"
3,msmarco,_doc,MARCO_3537405,9.881999,"A legendary French chef once said this duck and beans stew was the god of southwestern French food. He was wrong. Cassoulet is the god of ALL FOODS. Nothing — and I mean NOTHING — can match the comfort brought to you by a good cassoulet. It is the most heartwarming and delicious dish there is. Making a good cassoulet takes some time and effort, but it’s all worth it."
4,msmarco,_doc,MARCO_7667714,9.747508,"Feijoada has been described as a national dish of Brazil, specially of Rio de Janeiro, as other parts of Brazil have other regional dishes.odern variants of the dish are based on ancient Feijoada recipes from the Portuguese regions of Beira, Estremadura, and Tras-trás-Os. Montes In, brazil (feijoada feijoada) brasileira is often considered the national. dish"
5,msmarco,_doc,MARCO_1225565,9.736937,"The colorful components of feijoada. Many of the countries represented in this year's World Cup have a national dish that they consider their own; Yorkshire pudding in the U.K., kimchi in South Korea, wienerschintzel in Austria, Tom Yum (one of the few) in Thailand and many more. In Brazil, the dish to have is feijoada (fey-jwah-duh). Feijoada won’t be found in the U.S. on the menus of Fogo de Chao or other churrascarias, but the flavors found in a bowl of feijoada is enough to battle any night out with wandering spits of barbecued meats."
6,msmarco,_doc,MARCO_7667715,9.731216,"In this case, the country is Brazil and the stew is feijoada (fay-ZHWA-dah). Feijoada has as many versions as there are cooks, but in Brazil it almost always has black beans and always has a mixture of salted, smoked and fresh meats.Some versions are a little spicy from the sausages, others totally mild.eijoada has as many versions as there are cooks, but in Brazil it always has black beans and always has a mixture of salted, smoked and fresh meats. that’s incorrect. in the northeast of Brasil, feijoada is made with “feijao mulatinho,” or brown beans. recipes for this type of feijoada abound on the internet. Huh."
7,msmarco,_doc,MARCO_1899968,9.727422,"Feijoada is a stew of beans with beef and pork, which is a typical dish in Portugal and former Portuguese colonies, such as Brazil, Macau, Angola, Mozambique and Goa. Modern variants of the dish are based on ancient Feijoada recipes from the Portuguese regions of Beira, Estremadura, and Trás-os-Montes. In Brazil, feijoada is often considered the national dish. The basic ingredients of feijoada are beans with fresh pork or beef. In northwest Portugal, it is usually made with white beans; in the northeast, it is generally prepared with kidney beans, and includes other vegetables such as tomatoes, carrots, and cabbage."
8,msmarco,_doc,MARCO_7667712,9.716122,"Many of the countries represented in this year's World Cup have a national dish that they consider their own; Yorkshire pudding in the U.K., kimchi in South Korea, wienerschintzel in Austria, Tom Yum (one of the few) in Thailand and many more. In Brazil, the dish to have is feijoada (fey-jwah-duh).Feijoada won’t be found in the U.S. on the menus of Fogo de Chao or other churrascarias, but the flavors found in a bowl of feijoada is enough to battle any night out with wandering spits of barbecued meats.eijoada is one of those acts of love that takes time and a little TLC to make. A good recipe is a great guide for creating feijoada in the home. Celebrity chef and restauranteur Emeril Lagasse shares his recipe along with tips on making this emblem of Brazil (below)."
9,msmarco,_doc,MARCO_5092670,9.483352,"Cassoulet. Cassoulet is a rich, slow-cooked casserole originating in the south of France, containing meat, pork skin and white haricot beans. The dish is named after its traditional cooking vessel, the cassole, a deep, round, earthenware pot with slanting sides."
10,msmarco,_doc,MARCO_4548192,9.46502,"Toulouse-style sausages are the classic ingredient in cassoulet, that hearty bean, confit and pork extravaganza that is a hallmark of any self-respecting French cook’s repertoire.Traditional Toulouse sausages are all pork, and are minced by hand rather than ground — a fine option I do myself from time to time.oulouse-style sausages are the classic ingredient in cassoulet, that hearty bean, confit and pork extravaganza that is a hallmark of any self-respecting French cook’s repertoire."
11,msmarco,_doc,MARCO_6351406,9.455505,"BELCONNEN. Tara from In The Taratory nominates Ellacure in Bruce as her breakfast go-to, she says the bean and chorizo cassoulet (below) “is filling, tasty and has enough spice to kickstart the morning!” Michelle Brotohusodo is also a fan,loving the grilled asparagus, poached eggs, crispy pancetta & shaved parmesan.ara from In The Taratory nominates Ellacure in Bruce as her breakfast go-to, she says the bean and chorizo cassoulet (below) “is filling, tasty and has enough spice to kickstart the morning!” Michelle Brotohusodo is also a fan,loving the grilled asparagus, poached eggs, crispy pancetta & shaved parmesan."
12,msmarco,_doc,MARCO_7667708,9.447363,"The word feijoada comes from the word feijao, feijão which Is portuguese for. Beans feijoada is a black bean stew that is brewed with a variety of salted and smoked pork and beef products from-carne seca to smoked pork. spareribseijoada is one of those acts of love that takes time and a little TLC to make. A good recipe is a great guide for creating feijoada in the home. Celebrity chef and restauranteur Emeril Lagasse shares his recipe along with tips on making this emblem of Brazil (below)."
13,msmarco,_doc,MARCO_3488472,9.444206,"So it comes as no surprise that they make such a natural addition to all kinds of comfort foods. Indeed, the mild, delicate flavor of BUSH'S ® Great Northern Beans is the perfect addition to any soup, stew, dip, cassoulet, sauce and white chili, and they're a reliably delicious side dish in their own right.We'd expect nothing less from such a hardy (and hearty) bean.Try them in Reduced Sodium!o it comes as no surprise that they make such a natural addition to all kinds of comfort foods. Indeed, the mild, delicate flavor of BUSH'S ® Great Northern Beans is the perfect addition to any soup, stew, dip, cassoulet, sauce and white chili, and they're a reliably delicious side dish in their own right."
14,msmarco,_doc,MARCO_7667709,9.443554,"Feijoada is a black bean stew that is brewed with a variety of salted and smoked pork and beef products from carne-seca to smoked pork spareribs. The more traditional feijoada also includes “cheaper” cuts such as pig’s ears, feet and tails, and beef tongue.eijoada is one of those acts of love that takes time and a little TLC to make. A good recipe is a great guide for creating feijoada in the home. Celebrity chef and restauranteur Emeril Lagasse shares his recipe along with tips on making this emblem of Brazil (below)."
15,msmarco,_doc,MARCO_7667713,9.439758,"Adorable animal families that will make you aww. Feijoada is a traditional bean and meat stew that is widely popular in Portugal and Brazil. The dish gets its name from feijao, feijão The portuguese word “for.” Beans feijoada is made with either beef or, pork which may be fresh or-salt. curedhe dish gets its name from feijao, feijão The portuguese word “for.” Beans feijoada is made with either beef or, pork which may be fresh or-salt. Cured the beans used may be white, beans red kidney beans or black turtle. beans"
16,msmarco,_doc,MARCO_7667706,9.435978,"Feijoada is a traditional bean and meat stew that is widely popular in Portugal and Brazil. The dish gets its name from feijao, feijão The portuguese word “for.” Beans feijoada is made with either beef or, pork which may be fresh or-salt. Cured the beans used may be white, beans red kidney beans or black turtle. beanshe dish gets its name from feijao, feijão The portuguese word “for.” Beans feijoada is made with either beef or, pork which may be fresh or-salt. Cured the beans used may be white, beans red kidney beans or black turtle. beans"
17,msmarco,_doc,MARCO_4009632,9.065103,"Additionally, Fogo offers a gourmet Market Table & Feijoada Bar, which includes seasonal salads, soup, fresh vegetables, feijoada (traditional black bean stew with rice, fresh orange and yuca flour), and much more."
18,msmarco,_doc,MARCO_1225570,9.064127,Feijoada is one of those acts of love that takes time and a little TLC to make. A good recipe is a great guide for creating feijoada in the home. Celebrity chef and restauranteur Emeril Lagasse shares his recipe along with tips on making this emblem of Brazil (below).
19,msmarco,_doc,MARCO_1899971,9.05926,"Feijoada (Portuguese pronunciation: [fejʒuˈadɐ]) is a stew of beans with beef and pork, which is a typical Portuguese dish. Feijoada is also typically cooked in former colonies such as Brazil, Macau, Angola, Cape Verde, Mozambique and Goa (India). However, the recipe can differ slightly from one country to another."
20,msmarco,_doc,MARCO_1899970,9.055385,"The basic ingredients of feijoada are beans with fresh pork or beef. In Brazil, it is usually made with black beans; in the northeast (Bahia), it is generally prepared with kidney beans (Feijoada à Brasileira), and includes other vegetables such as tomatoes, carrots, and cabbage. The stew is best prepared over low heat in a thick clay pot."
21,msmarco,_doc,MARCO_4009625,8.956997,Market Table and Feijoada Bar at Fogo de Chão Brazilian Steakhouse Fogo was great with a lot of different meat options . The servers greeted me as soon as the wonderful hostess sat me down for my dinner with my partner. She made great…
22,msmarco,_doc,MARCO_2225557,8.797118,"The following item is a pick of the Denver Post's. Denver's best rustic-French restaurant, with cuisine from the Gallic countryside. Pair your dish of cassoulet with a bottle from the well-edited wine list."
23,msmarco,_doc,MARCO_8398650,8.793204,"wikiHow to Make a Casserole. Casserole is French word for saucepan, and like the French cassoulet, refers to any recipe baked in the dish of which it shares its name. In a casserole, any variety of starches, meats, and vegetables may be combined and baked together to create a meal."
24,msmarco,_doc,MARCO_5092673,8.792228,"These are cooked with the beans and removed once the beans are cooked and thrown away. Making cassoulet is quite a perfomance, this recipe will make enough for at least 6 people. If you have any left over, it can be frozen or will keep in the fridge for a few days. Source(s): http://www.sausagelinks.co.uk/recipe_det..."
25,msmarco,_doc,MARCO_1219652,8.790278,"The Burgundians also pride themselves on their ability to cook snails to perfection. South France: Basque and Spanish tastes have influenced the food of southern France, and peppers, spicy sausage and tomatoes are easily and widely available. Cassoulet is probably the most renowned dish in the region."
26,msmarco,_doc,MARCO_7030832,8.787362,"Confit as a cooking term describes when food is cooked in grease, oil or sugar water (syrup), at a lower temperature than deep frying.eat confit is a specialty of the southwest of France (Toulouse, Dordogne, etc.) and is used in dishes such as cassoulet. Confit preparations originated as a means of preserving meat without refrigeration."
27,msmarco,_doc,MARCO_5092677,8.785422,"In France, cassoulets of varying price and quality are also sold in cans and jars in supermarkets, grocery stores and charcuteries. The cheapest ones contain only beans, tomato sauce, sausages, and bacon. More expensive versions are likely to be cooked with goose fat and to include Toulouse sausages, lamb, goose, or duck confit."
28,msmarco,_doc,MARCO_1356530,8.784453,"Recipes / Meatloaf internal temperature (1000+) Ricotta Stuffed Chicken. 2122 views. have an internal temperature of 165°F, thigh meat should have an internal temperature of. Cassoulet (photos) 327 views. pepper to taste Roast the pork to an internal temperature of 175 degrees F (we went to 140."
29,msmarco,_doc,MARCO_1206912,8.782519,"With one-hundred-and-twenty foods carrying quality or origin labels, Midi-Pyrenees pyrénées is the region with the widest variety of regional culinary. Specialities apart from the famous (cassoulet meat and bean) stew And toulouse, sausage the restaurants of the pink city offer any number of duck and goose. dishes"
30,msmarco,_doc,MARCO_8053189,8.782519,Main course. 1  Confit duck leg with flageolet ragoût and celeriac mash By James Martin. 2  Chicken cassoulet By Nigel Slater. 3  Bourbon-glazed turkey with confit turkey legs By Matt Tebbutt. 4  Barbary duck with cherries and chocolate ganache By Jason Atherton.
31,msmarco,_doc,MARCO_2417569,8.779625,"At the Bistro, Jean Béraud. A bistro /ˈbiːstroʊ/, is, in its original Parisian incarnation, a small restaurant, serving moderately priced simple meals in a modest setting. Bistros are defined mostly by the foods they serve. French home-style cooking, and slow-cooked foods like cassoulet, a bean stew, are typical. 1 History."
32,msmarco,_doc,MARCO_4548191,8.7777,"Description. In France, there are many versions of the Toulouse Sausage. However, the main ingredients are: Pork, Red Wine and Garlic.We marinate our pork in the red wine for at least 24 hours before adding lashings of fresh garlic, fresh herbs and cracked black pepper.he most famous recipe for Toulouse sausage is the Cassoulet. However Toulouse is great with Pasta and Salads but also, please try those on the Barbecue as they are simply delicious."
33,msmarco,_doc,MARCO_7030831,8.7777,"Confit (French, pronounced [kɔ̃fi] or in English con-fee) comes from the French word confire which means literally preserved; a confit being any type of food that is cooked slowly over a long period of time as a method of preservation.eat confit is a specialty of the southwest of France (Toulouse, Dordogne, etc.) and is used in dishes such as cassoulet. Confit preparations originated as a means of preserving meat without refrigeration."
34,msmarco,_doc,MARCO_5230179,8.775779,"Other highlights pulled from the vaults include Maine Lobster Tamale (Wine Cask), Poached Green Lip Mussels in Coconut, Lemongrass and Leek Broth (Sage & Onion), Quail Two Ways (Citronelle), Cassoulet with Duck Confit and Foie Gras Coulis (NU), Tomato and Herb-Braised Beef Short Ribs (bouchon) and Veal Chop with Mustard-Tarragon Sauce (Downey's)."
35,msmarco,_doc,MARCO_4548193,8.773861,"A local speciality. This fresh sausage was first found at the markets of Toulouse at the end of the 18th century. Try as you might, you will not find it anywhere else, not even in the area around the city. Toulouse sausage is a speciality of the South-West, and carries a prestigious red label.ow to enjoy Toulouse sausage. Whether eaten grilled or in a confit (preserved in fat), in a cassoulet or with haricot beans from Tarbes, Toulouse sausage retains its unique flavour and reveals the authentic taste of the South-West."
36,msmarco,_doc,MARCO_6012205,8.773861,"Tear bread slices into small pieces. Process in a food processor until coarse crumbs form. You can use these fresh crumbs for making meatballs, topping oysters destined for the broiler, or adding a crisp layer to cassoulet.ear bread slices into small pieces. Process in a food processor until coarse crumbs form. You can use these fresh crumbs for making meatballs, topping oysters destined for the broiler, or adding a crisp layer to cassoulet."
37,msmarco,_doc,MARCO_6351411,8.771947,"My favourite place for breakfast in Tuggeranong is the Woolshed Cafe. My breakfast favourite has become the pancakes as they change the flavours every week. The coffee is also fantastic, especially because they manage to never burn the soy milk.ara from In The Taratory nominates Ellacure in Bruce as her breakfast go-to, she says the bean and chorizo cassoulet (below) “is filling, tasty and has enough spice to kickstart the morning!” Michelle Brotohusodo is also a fan,loving the grilled asparagus, poached eggs, crispy pancetta & shaved parmesan."
38,msmarco,_doc,MARCO_4548197,8.770037,"Free from colourings, preservatives and additives, Toulouse sausage is 75% lean pork and 25% pork breast, with salt and pepper, all contained in a natural skin. Its pinkish colour and wide diameter of 3 cm give it its distinctive appearance.ow to enjoy Toulouse sausage. Whether eaten grilled or in a confit (preserved in fat), in a cassoulet or with haricot beans from Tarbes, Toulouse sausage retains its unique flavour and reveals the authentic taste of the South-West."
39,msmarco,_doc,MARCO_7030835,8.770037,"Confit of goose (confit d'oie) and duck (confit de canard) are usually prepared from the legs of the bird. The meat is salted and seasoned with herbs, and slowly cooked submerged in its own rendered fat (never to exceed 85 °C (185 °F)), in which it is then preserved by allowing it to cool and storing it in the fat.eat confit is a specialty of the southwest of France (Toulouse, Dordogne, etc.) and is used in dishes such as cassoulet. Confit preparations originated as a means of preserving meat without refrigeration."
40,msmarco,_doc,MARCO_4548189,8.766228,"Toulouse sausage is a small French sausage made of coarsely diced pork flavored with wine, garlic and seasonings. Toulouse sausage is usually braised or fried and makes a good addition to many dishes such as cassoulet.Categories 1  : Pork sausage.oulouse sausage is a small French sausage made of coarsely diced pork flavored with wine, garlic and seasonings. Toulouse sausage is usually braised or fried and makes a good addition to many dishes such as cassoulet. Categories 1  : Pork sausage."
41,msmarco,_doc,MARCO_6012199,8.764328,"To make toasted breadcrumbs, spread the fresh crumbs in an even layer on a large rimmed baking sheet. Bake in a 350° oven, stirring occasionally, until browned and dry, then transfer hot breadcrumbs to a large bowl.Drizzle with 1 Tbsp. extra-virgin olive oil, season, and toss to coat.ear bread slices into small pieces. Process in a food processor until coarse crumbs form. You can use these fresh crumbs for making meatballs, topping oysters destined for the broiler, or adding a crisp layer to cassoulet."
42,msmarco,_doc,MARCO_6351412,8.764328,"Thanks muchly from a fellow breakfast foodie! My most craved Canberra brekkie is the smoked trout and scrambled eggs (with a side of hollandaise) at Ellacure …. http://karinscuisine.blogspot.com.au/2013/06/terrific-trout-ellacure.html … so, so, so good! Oh no!ara from In The Taratory nominates Ellacure in Bruce as her breakfast go-to, she says the bean and chorizo cassoulet (below) “is filling, tasty and has enough spice to kickstart the morning!” Michelle Brotohusodo is also a fan,loving the grilled asparagus, poached eggs, crispy pancetta & shaved parmesan."
43,msmarco,_doc,MARCO_4548190,8.758652,"Saucisse de Toulouse. 168 pages on this wiki. Toulouse sausage (French: saucisse de Toulouse) (named for the French city of the same name) is a small French sausage made of coarsely diced pork flavored with wine, garlic, and seasonings.The sausage is usually braised or fried and is often incorporated into such dishes as cassoulet. This article is a stub.aucisse de Toulouse. 168 pages on this wiki. Toulouse sausage (French: saucisse de Toulouse) (named for the French city of the same name) is a small French sausage made of coarsely diced pork flavored with wine, garlic, and seasonings."
44,msmarco,_doc,MARCO_1899975,8.381882,a dish of rice and black beans baked with various kinds of meat and sausage. Origin of feijoada Expand. Portuguese. Latin.
45,msmarco,_doc,MARCO_1899976,8.377945,"This feijoada recipe is a relatively simple one, and I think it has a good balance of smokiness (from the addition of smoked bacon and ham hocks) and meatiness (two words: pork. shoulder)."
46,msmarco,_doc,MARCO_8211340,8.372068,"One of the few dishes eaten the length and breadth of Brazil, feijoada is a hearty stew of black beans, sausages and cuts of pork of varying quality – traditionally veering towards the lower end, with trotters, and ears all going into the mix."
47,msmarco,_doc,MARCO_7777497,8.371092,"What are the traditional dishes of Rio de Janeiro? Considered by many to be the national dish of Brazil, feijoada is a stew of beans (usually black beans, but also white beans, red beans and pinto beans) and a meat, typically beef or pork."
48,msmarco,_doc,MARCO_216725,8.370117,"Cuisine/Drinks. The national dish of Brazil is feijoada, which is a stew of black beans with pork, beef, and other ingredients, including tomatoes, carrots, and cabbage. This dish was brought to South America by the Portuguese. Rice and beans is a daily staple in any Brazilian household."
49,msmarco,_doc,MARCO_7777503,8.370117,"Feijoadas are very popular in Rio, especially as a Wednesday or Saturday lunch, and is often accompanied by chopped fried collard greens (couve mineira), roasted cassava flour (farofa), orange slices, and is traditionally served with a pot of hot sauce on the side."
50,msmarco,_doc,MARCO_4009627,8.369143,"Market Table & Feijoada Bar ved Fogo de Chão Brazilian Steakhouse My first Brazilian churrasco steakhouse experience was at Fogo de Chao in Washington, DC. about ten years ago and was impressed with the meal and the overall experience.…"
51,msmarco,_doc,MARCO_1225569,8.369143,"June 13, 2014. Many of the countries represented in this year's World Cup have a national dish that they consider their own; Yorkshire pudding in the U.K., kimchi in South Korea, wienerschintzel in Austria, Tom Yum (one of the few) in Thailand and many more. In Brazil, the dish to have is feijoada (fey-jwah-duh)."
52,msmarco,_doc,MARCO_2629732,8.369143,"Feijoada, typical brazilian dish made with black beans and several kinds of meat, mainly from pork. These make for delicious dishes, whether savoury or sweet. Many dishes use rice or beans as a staple or base ingredient, since these are widely available, filling and fairly nutritious."
53,msmarco,_doc,MARCO_3071446,8.367197,"Vegetables and starches. Vegetables that are popular in Portuguese cookery include tomatoes, cabbage, and onions. There are many starchy dishes, such as feijoada, a rich bean stew with beef and pork, and açorda, a thick bread-based casserole generally flavoured with garlic, parsley, and coriander or seafood."
54,msmarco,_doc,MARCO_1899972,8.367197,"The name comes from feijão, Portuguese for beans.. The basic ingredients of feijoada are beans with fresh pork or beef. In northwest Portugal, it is usually made with white beans; in the northeast, it is generally prepared with kidney beans, and includes other vegetables such as tomatoes, carrots, and cabbage."
55,msmarco,_doc,MARCO_4009628,8.365255,"Buffet: Try the Gaucho Lunch deal – for $15 you can partake of the Market Table Buffet and Feijoada Bar, which is a real steal.. Best for Buffet Because: With 29 restaurants across Brazil, Mexico and the United States, Fogo de Chao as offered consistently excellent fare since 1975."
56,msmarco,_doc,MARCO_1899969,8.365255,"Feijoada (pronounced fay-ZWAH-da) is a delicious stew of pork and black beans that's traditionally served over rice with fresh orange slices. In Brazil, this dish is often served on special occasions, but preparing it in a slow cooker makes it possible to serve this rich dish on the busiest weeknights."
