,_index,_type,_id,_score,_source.body
474,msmarco,_doc,MARCO_6035456,2.6896627,"Definition. Sprains and strains are common injuries that share similar signs and symptoms, but involve different parts of your body. A sprain is a stretching or tearing of ligaments — the tough bands of fibrous tissue that connect two bones together in your joints. The most common location for a sprain is in your ankle.efinition. Sprains and strains are common injuries that share similar signs and symptoms, but involve different parts of your body. A sprain is a stretching or tearing of ligaments — the tough bands of fibrous tissue that connect two bones together in your joints. The most common location for a sprain is in your ankle."
475,msmarco,_doc,MARCO_6062206,2.6896627,"SPECIES: Sei (pronounced say) and Bryde's (pronounced broodus) whales are so similar that it was not until the early 1900's that the whalers realized they were hunting two different species. Sei whales acquired their name from the work seje, the Norwegian name for pollock, a close relative of codfish.PECIES: Sei (pronounced say) and Bryde's (pronounced broodus) whales are so similar that it was not until the early 1900's that the whalers realized they were hunting two different species. Sei whales acquired their name from the work seje, the Norwegian name for pollock, a close relative of codfish."
476,msmarco,_doc,MARCO_5913495,2.6896627,Schweizer feels meek should be understood as meaning powerless. The phrase inherit the earth is also similar to theirs is the Kingdom of Heaven in 5:3. Schweizer notes that two terms reflect the two different views of the end times current when Matthew was writing.One view was that the end of the world would see all the believers brought up to join the Kingdom of Heaven.he phrase inherit the earth is also similar to theirs is the Kingdom of Heaven in 5:3. Schweizer notes that two terms reflect the two different views of the end times current when Matthew was writing.
477,msmarco,_doc,MARCO_6193328,2.6896627,"There are three main types of lice that all have similar symptoms, though they occur on different parts of the body: 1  head lice: found on the scalp, neck, and ears.2  body lice: start out on clothing or in beds, but move from those locations to people’s skin. 3  pubic lice: also called “crabs,” found on pubic hair and skin.here are three main types of lice that all have similar symptoms, though they occur on different parts of the body: 1  head lice: found on the scalp, neck, and ears."
478,msmarco,_doc,MARCO_6230869,2.6896627,"A locus (plural loci) is the specific location or position of a gene, DNA sequence, on a chromosome, in the field of genetics.Each chromosome carries many genes; humans' estimated ' haploid ' protein coding genes are 20,000-25,000, on the 23 different chromosomes.A variant of the similar DNA sequence located at a given locus is called an allele.ach chromosome carries many genes; humans' estimated ' haploid ' protein coding genes are 20,000-25,000, on the 23 different chromosomes. A variant of the similar DNA sequence located at a given locus is called an allele."
479,msmarco,_doc,MARCO_7772242,2.6896627,"Continental drift was a theory that explained how continents shift position on Earth's surface. Set forth in 1912 by Alfred Wegener, a geophysicist and meteorologist, continental drift also explained why look-alike animal and plant fossils, and similar rock formations, are found on different continents.ontinental drift was a theory that explained how continents shift position on Earth's surface. Set forth in 1912 by Alfred Wegener, a geophysicist and meteorologist, continental drift also explained why look-alike animal and plant fossils, and similar rock formations, are found on different continents."
480,msmarco,_doc,MARCO_7948512,2.6896627,"Once you have your hot dog assembled they may move in for the kill and see if they can score a piece. You might be thinking that a hot dog is all meat, so it might be OK for a cat. The reasons you shouldn’t give a cat a hot dog are similar to the reasons why humans shouldn’t eat hot dogs.We’ll go into detail on the different reasons below.ou might be thinking that a hot dog is all meat, so it might be OK for a cat. The reasons you shouldn’t give a cat a hot dog are similar to the reasons why humans shouldn’t eat hot dogs. We’ll go into detail on the different reasons below."
481,msmarco,_doc,MARCO_7197522,2.6896627,"Pollination is a classic example of mutualism. Mutualism is the way two organisms of different species exist in a relationship in which each individual benefits from the activity of the other. Similar interactions within a species are known as co-operation.Mutualism can be contrasted with interspecific competition, in which each species experiences reduced fitness, and exploitation, or parasitism, in which one species benefits at the expense of the other. Mutualism is a type of symbiosis.ollination is a classic example of mutualism. Mutualism is the way two organisms of different species exist in a relationship in which each individual benefits from the activity of the other. Similar interactions within a species are known as co-operation."
482,msmarco,_doc,MARCO_7408813,2.6896627,"It is similar but has a different method for maintaining output. It does not control CFM output as well as an ECM and is a lower quality motor. you're mixing up Variable Speed vs. ECM. ECM is the motor technology.Variable Speed is the buzzword for Constant CFM control technology. X-13 is an ECM motor with a constant torque controller. it's not a lower quality motor.he X-13 is not an ECM motor. It is similar but has a different method for maintaining output. It does not control CFM output as well as an ECM and is a lower quality motor. EDIT: Yes, oversizing the furnace DOES affect efficiency."
483,msmarco,_doc,MARCO_8345195,2.6896627,I've seen similar things when a video card fails or begins to fail. Try using a different video card to see if the issue persists. Make sure your power supply is rated to handle your video card and everything else in your system. If it's a power hiccup it's possible your system may have been damaged because of it.'ve seen similar things when a video card fails or begins to fail. Try using a different video card to see if the issue persists. Make sure your power supply is rated to handle your video card and everything else in your system. If it's a power hiccup it's possible your system may have been damaged because of it.
484,msmarco,_doc,MARCO_8397815,2.6896627,It is so called because the cancer cells are small. Non small cell lung cancers fall into 3 common types and make up about 87 out of 100 lung cancers (87%). These types are grouped together because they behave in a similar way. They respond to treatment differently to small cell lung cancer.here are three common types of non small cell lung cancer. These are grouped together because they behave in a similar way and respond to treatment in a different way to small cell lung cancer. They make up about 87 out of 100 lung cancers in the UK (87%).
485,msmarco,_doc,MARCO_8397817,2.6896627,Non small cell lung cancer. There are three common types of non small cell lung cancer. These are grouped together because they behave in a similar way and respond to treatment in a different way to small cell lung cancer. They make up about 87 out of 100 lung cancers in the UK (87%).here are three common types of non small cell lung cancer. These are grouped together because they behave in a similar way and respond to treatment in a different way to small cell lung cancer. They make up about 87 out of 100 lung cancers in the UK (87%).
486,msmarco,_doc,MARCO_1601296,2.68858,"Carob: has no caffeine or other stimulants. If someone is sensitive to caffeine or theobromine (some people get headaches, acne or very jittery), then it makes sense to avoid chocolate. Carob-although not a substitute-can be made into similar kinds of treats as chocolate (brownies, cookies, etc).arob: it's definitely a different flavor than chocolate, but it's delicious, too! I think the problem is when people expect carob to be a chocolate substitute, and to taste similar. It doesn't. It might look similar, but it has its own unique flavor."
487,msmarco,_doc,MARCO_3371832,2.68858,"Some bicycle manufacturers only make high-end bikes, others only low-end cheap bikes, while some bigger companies sell a whole range of bicycle types in various price ranges. When trying to calculate the best bike to buy, it is more important to compare bikes of a similar type, using similar frames and groupsets. These will also generally fall within a similar price bracket. The best brand of bike for you, can be different to the best brand for someone else."
488,msmarco,_doc,MARCO_5744999,2.68858,Types of isotopes – examples of isotopes: The isotopes are called as the atoms of the similar elements contain the similar atomic number and the similar chemical properties but various only in mass number.et us discuss about the examples of isotopes. Soddy named these elements of the different mass numbers having same atomic number as isotopes. The iso means same and topos means place that is atoms placed at the same position in the periodic table.
489,msmarco,_doc,MARCO_8502322,2.68858,"The problem with gluten allergy, and even celiac disease, is that there is no specific set of symptoms that allow you to confirm or eliminate a gluten allergy diagnosis.What we can do is take a look as some of the common symptoms, and see if it might be a gluten allergy.efore we start, please be aware that many of the symptoms for gluten allergy are similar to those of celiac disease, which is similar in many ways, although fundamentally a different disease. Managing the disease is similar for the two conditions; this will also be discussed later in this article."
490,msmarco,_doc,MARCO_6355565,2.687551,"Isotope separation. The physical separation of different isotopes of an element from one another. The different isotopes of an element as it occurs in nature may have similar chemical properties but completely different nuclear reaction properties. Therefore, nuclear physics and nuclear energy applications often require that the different isotopes be separated."
491,msmarco,_doc,MARCO_6788951,2.6847448,"No matter how different all living things may look, we all have things in common. Monkeys, people, lizards and frogs all need to breathe, see, move around, etc. These common activities are the result of common genes. So creatures that have to do similar things will often share similar DNA.o these genes will stay the same (or very similar) in all living creatures. These three reasons are why your DNA is 99% identical to a chimpanzee's. And it's 95% identical to a monkey's. And why you are about 79% identical to a mouse and even 36% identical to a little fruit fly!"
492,msmarco,_doc,MARCO_7853551,2.6847448,"Homologous structures are parts of the body that are similar in structure to other species' comparative parts. Scientists say these similarities are evidence that life on earth share a common ancient ancestor from which many or all other species have evolved over time. Evidence of this common ancestry can be seen in the structure and development of these homologous structures, even if their function is different. Examples. The more closely organisms are related, the more similar the homologous structures between organisms. Many mammals, for example, have similar limb structures."
493,msmarco,_doc,MARCO_7274499,2.6847448,"Image caption Rare earth elements are chemically similar and are sometimes used in similar ways. Rare earths are a group of 17 chemically similar elements crucial to the manufacture of many hi-tech products. Despite their name, most are abundant in nature but are hazardous to extract. Most rare earth elements have uses in several different fields, as well as those listed below. Neodymium This is used to make powerful magnets used in loudspeakers and computer hard drives to enable them to be smaller and more efficient."
494,msmarco,_doc,MARCO_7688273,2.6847448,"Convergent evolution. Convergent evolution is the independent evolution of similar features in species of different lineages. Convergent evolution creates analogous structures that have similar form or function but were not present in the last common ancestor of those groups. The cladistic term for the same phenomenon is homoplasy. The recurrent evolution of flight is a classic example, as flying insects, birds, pterosaurs, and bats have independently evolved the useful capacity of flight. Functionally similar featur"
495,msmarco,_doc,MARCO_375487,2.6821012,goes great with see colors that combine well with your chosen color more color combos get more color combinations for your color see more shades view different shades of your selected color view similar colors see colors resembling the one you ve chosen share share colors with your friends on social networkssend e mail your color to others print print your colorore color combos get more color combinations for your color see more shades view different shades of your selected color view similar colors see colors resembling the one you ve chosen share share colors with your friends on social networks
496,msmarco,_doc,MARCO_404562,2.6821012,"The Class 221 are similar to the Class 220 Voyager units, but they were built with a tilting mechanism enabling up to six degrees of tilt to allow higher speeds on curved tracks, most have 5 coaches, and they have a different bogie design.They have a maximum speed of 125 mph (200 km/h).he Class 221 are similar to the Class 220 Voyager units, but they were built with a tilting mechanism enabling up to six degrees of tilt to allow higher speeds on curved tracks, most have 5 coaches, and they have a different bogie design. They have a maximum speed of 125 mph (200 km/h)."
497,msmarco,_doc,MARCO_2736599,2.6821012,"Turquoise is found in its natural state in places with dry climates around the world. It can be mined in the U.S., Mexico, Iran, Chile, China, and Tibet.While the characteristics of each stone are very similar, different mines produce slight variations of turquoise. Advertisement. Let’s take a look at some of the places in North America where you can find turquoise.t can be mined in the U.S., Mexico, Iran, Chile, China, and Tibet. While the characteristics of each stone are very similar, different mines produce slight variations of turquoise. Advertisement. Let’s take a look at some of the places in North America where you can find turquoise."
498,msmarco,_doc,MARCO_4034473,2.6821012,"Bush green beans grow different than pole beans because bush beans grow as a bush and are generally grown in rows, similar to butter beans. Planting bush beans is really not much different than planting pole beans.They both require similar planting depths, but the spacing is a bit different.ust place the seeds on top of the soil for now. Continue placing the bush bean seeds on top of the soil at eight inch intervals until you run out of seeds or run out of row; whichever comes first. Bush bean seeds typically need to be planted at a depth of 1-1/2 inches deep."
499,msmarco,_doc,MARCO_4186223,2.6821012,"In the convective zone, heat and energy are carried outward along with matter in swirling flows called convection cells. This motion is similar to the roiling flows seen in a pot of boiling water. The inner parts of the Sun (core and radiative zone) spin differently than the outer layers (convective zone).n the convective zone, heat and energy are carried outward along with matter in swirling flows called convection cells. This motion is similar to the roiling flows seen in a pot of boiling water. The inner parts of the Sun (core and radiative zone) spin differently than the outer layers (convective zone)."
500,msmarco,_doc,MARCO_941609,2.6821012,1 More Color Combos: Get more color combinations for your color. 2  See More Shades: View different shades of your selected color. 3  View Similar Colors: See colors resembling the one you've chosen. 4  Share: Share colors with your friends on social networks. 5  Send: E-mail your color to others. 6  Print: Print your color. See More Shades: View different shades of your selected color. 2  View Similar Colors: See colors resembling the one you've chosen. 3  Share: Share colors with your friends on social networks. 4  Send: E-mail your color to others.
501,msmarco,_doc,MARCO_941611,2.6821012,1 Goes Great With: See colors that combine well with your chosen color. 2  More Color Combos: Get more color combinations for your color. 3  See More Shades: View different shades of your selected color. 4  View Similar Colors: See colors resembling the one you've chosen. 5  Share: Share colors with your friends on social networks. See More Shades: View different shades of your selected color. 2  View Similar Colors: See colors resembling the one you've chosen. 3  Share: Share colors with your friends on social networks. 4  Send: E-mail your color to others.
502,msmarco,_doc,MARCO_1981941,2.6821012,"A fillet of alligator is a staple of “southern” culture and has been a staple of the diet of many Native American tribes in the south for thousands of years. It is said that alligator meat tastes very similar to chicken, and is served in many different variations.I personally think it has the firmness of pork and a unique flavor that is sort of a mix of chicken and fish. It may sound starnge but most of us here really like it. Some of our friends enjoy alligator ribs too. fillet of alligator is a staple of “southern” culture and has been a staple of the diet of many Native American tribes in the south for thousands of years. It is said that alligator meat tastes very similar to chicken, and is served in many different variations."
503,msmarco,_doc,MARCO_2418553,2.6821012,"The soprano has the highest vocal range of all voice types, with the highest tessitura. A soprano and a mezzo-soprano have a similar range, but their tessituras will lie in different parts of that range.The low extreme for sopranos is roughly A 3 or B ♭ 3 (just below middle C). Within opera, the lowest demanded note for sopranos is F 3 (from Richard Strauss 's Die Frau ohne Schatten). soprano and a mezzo-soprano have a similar range, but their tessituras will lie in different parts of that range. The low extreme for sopranos is roughly A 3 or B ♭ 3 (just below middle C)."
504,msmarco,_doc,MARCO_2477797,2.6821012,1 Goes Great With: See colors that combine well with your chosen color. 2  More Color Combos: Get more color combinations for your color. 3  See More Shades: View different shades of your selected color. 4  View Similar Colors: See colors resembling the one you've chosen. 5  Share: Share colors with your friends on social networks. More Color Combos: Get more color combinations for your color. 2  See More Shades: View different shades of your selected color. 3  View Similar Colors: See colors resembling the one you've chosen. 4  Share: Share colors with your friends on social networks.
505,msmarco,_doc,MARCO_4870075,2.6821012,"Etymology & Historical Origin-Cason. Cason is a modern American invention, new to the 21st century. It appears as if some parents coined it from the popularity of similar sounding names: Jason, Mason. Perhaps it was coined from Carson via the removal of the “r” for a different sounding name, or changing Casey to Cason.Hard to say for sure.In any case, as an invented name, Cason has no etymological roots and therefore no meaning.t appears as if some parents coined it from the popularity of similar sounding names: Jason, Mason. Perhaps it was coined from Carson via the removal of the “r” for a different sounding name, or changing Casey to Cason."
506,msmarco,_doc,MARCO_6230870,2.6821012,"Example of bands. A locus (plural loci) is the specific location or position of a gene, DNA sequence, on a chromosome, in the field of genetics. Each chromosome carries many genes; humans' estimated ' haploid ' protein coding genes are 20,000-25,000, on the 23 different chromosomes.A variant of the similar DNA sequence located at a given locus is called an allele.ach chromosome carries many genes; humans' estimated ' haploid ' protein coding genes are 20,000-25,000, on the 23 different chromosomes. A variant of the similar DNA sequence located at a given locus is called an allele."
507,msmarco,_doc,MARCO_5484033,2.6821012,1 Goes Great With: See colors that combine well with your chosen color. 2  More Color Combos: Get more color combinations for your color. 3  See More Shades: View different shades of your selected color. 4  View Similar Colors: See colors resembling the one you've chosen.5  Share: Share colors with your friends on social networks. Goes Great With: See colors that combine well with your chosen color. 2  More Color Combos: Get more color combinations for your color. 3  See More Shades: View different shades of your selected color. 4  View Similar Colors: See colors resembling the one you've chosen.
508,msmarco,_doc,MARCO_6179368,2.6821012,"Report Abuse. Fungal cells are usually tubular filaments called hyphae. They have a cell wall of chitin rather than cellulose. The cell structures are similar to plants in that they have vacuoles, mitochondria, ribosomes, etc.At certain times of the life cycle, fungal cells become dikaryotic with two nuclei resulting from the fusion of two different strains of hyphae.hey have a cell wall of chitin rather than cellulose. The cell structures are similar to plants in that they have vacuoles, mitochondria, ribosomes, etc. At certain times of the life cycle, fungal cells become dikaryotic with two nuclei resulting from the fusion of two different strains of hyphae."
509,msmarco,_doc,MARCO_6521874,2.6821012,"How hydrogen peroxide sunk a nuclear submarine. The chemical formula of hydrogen peroxide is H 2 O 2 which looks similar to water. Its properties however, are completely different. Hydrogen peroxide is commonly used as an antiseptic and to lighten or bleach hair.Hydrogen peroxide is commonly sold in chemists at a concentration of 3 to 5% with water.ow hydrogen peroxide sunk a nuclear submarine. The chemical formula of hydrogen peroxide is H 2 O 2 which looks similar to water. Its properties however, are completely different. Hydrogen peroxide is commonly used as an antiseptic and to lighten or bleach hair."
510,msmarco,_doc,MARCO_6787316,2.6821012,"Origin: Esters of synthetic fats, produced from glycerol, natural fatty acids and another organic acid (acetic, lactic, tartaric, citric). The fatty acids are mainly from plant origin, but also fats of animal origin may be used.The product generally is a mixture of different components, with a composition similar to partially digested natural fat esterified with other natural acids..Function & characteristics: Emulsifiers and stabilisers.he product generally is a mixture of different components, with a composition similar to partially digested natural fat esterified with other natural acids.. Function & characteristics: Emulsifiers and stabilisers."
511,msmarco,_doc,MARCO_6716480,2.6821012,"Viral hepatitis is an infection of the liver caused by one of several viruses. In the United States, the most common types of viral hepatitis are Hepatitis A, Hepatitis B, and Hepatitis C. While all three types of hepatitis can cause similar symptoms, each virus is spread in different ways.Are gay and bisexual men at risk for viral hepatitis? Yes.n the United States, the most common types of viral hepatitis are Hepatitis A, Hepatitis B, and Hepatitis C. While all three types of hepatitis can cause similar symptoms, each virus is spread in different ways. Are gay and bisexual men at risk for viral hepatitis? Yes."
512,msmarco,_doc,MARCO_6933662,2.6821012,"Prosciutto is very different from either bacon or pancetta, but we think it gets confusing because the words prosciutto and pancetta can sound similar to our non-Italian ears! Prosciutto is made from the hind leg of a pig (ie, the ham), and outside Italy, calling it prosciutto indicates a ham that has been cured.The quality of prosciutto is entirely in how it's cured. The outside of the ham is usually rubbed with just salt and sometimes a mix of spices.rosciutto is very different from either bacon or pancetta, but we think it gets confusing because the words prosciutto and pancetta can sound similar to our non-Italian ears! Prosciutto is made from the hind leg of a pig (ie, the ham), and outside Italy, calling it prosciutto indicates a ham that has been cured."
513,msmarco,_doc,MARCO_7014019,2.6821012,1 See More Shades: View different shades of your selected color. 2  View Similar Colors: See colors resembling the one you've chosen. 3  Share: Share colors with your friends on social networks. 4  Send: E-mail your color to others. Goes Great With: See colors that combine well with your chosen color. 2  More Color Combos: Get more color combinations for your color. 3  See More Shades: View different shades of your selected color. 4  View Similar Colors: See colors resembling the one you've chosen. 5  Share: Share colors with your friends on social networks.
