,_index,_type,_id,_score,_source.body
724,msmarco,_doc,MARCO_2252884,2.4251976,"The number of nucleons (both protons and neutrons) in the nucleus is the atom's mass number, and each isotope of a given element has a different mass number. For example, carbon-12, carbon-13 and carbon-14 are three isotopes of the element carbon with mass numbers 12, 13 and 14 respectively.hus different isotopes of a given element all have the same number of electrons and share a similar electronic structure. Because the chemical behavior of an atom is largely determined by its electronic structure, different isotopes exhibit nearly identical chemical behavior."
725,msmarco,_doc,MARCO_2720677,2.4251976,"Edit Page Last Edit: 1 year 5 months ago. The Elder Scrolls Online features Armor types similar to those found in Skyrim: Ebony, Daedric, etc. Armor is not locked to specific classes. A Sorcerer is able to wear heavy armor and a Dragon Knight is able to wear light armor. Also, just like other Elder Scrolls games, different armor types assist/boost different things. There are three different armor types in the game: 1  Light Armor-Assists magic regeneration and bonus."
726,msmarco,_doc,MARCO_4306360,2.4251976,"Neurodiversity, short for neurological diversity, refers to the diversity of human brains and minds, and to the idea that this is a natural, valuable form of diversity. There is a great deal of variation among human brains and human minds, and this variation is called neurodiversity. Different people think differently – not just because of differences in culture or life experience, but because their brains are “wired” to work differently. Neurodiversity is a natural form of diversity, found in every human society. It is similar in many ways to other forms of diversity, such as ethnic, racial, cultural, sexual, or gender diversity."
727,msmarco,_doc,MARCO_5460667,2.4251976,"Sulfamethoxazole/trimethoprim, as the name implies, contains two different antibiotics. Trimethoprim does not belong to a specific class of medications. Sulfamethoxazole belongs to a group of drugs known as sulfonamides (sulfa drugs).These two antibiotics work in different but similar ways. Essentially, both sulfamethoxazole and trimethoprim work by inhibiting the production of folic acid in bacteria, although they work in different stages of folic acid production.ombining sulfamethoxazole with trimethoprim increases the effectiveness and decreases the chance of antibiotic resistance (the development of bacteria with the ability to resist antibiotics)."
728,msmarco,_doc,MARCO_6286439,2.4251976,"Gneiss has mineral composition of mica, feldspar and quartz. The mica is an extra mineral in gneiss and that is why it is different from granite. Gneiss rocks form from pre-existing granite rocks with the pressure and high temperature in the crust of the Earth. Igneous rock which is one fifth quartz is also granite. 2  The mineral formation of granite and gneiss is quite similar but high pressure and temperature changes basically form granite. 3  Different colours of granite rocks tell you all about the actual mineral composition is different in a variety of rocks."
729,msmarco,_doc,MARCO_6093341,2.4251976,"Corporate Diversification Strategies. A pet store owner starting a dog-walking business is an example of diversification. Brand X Pictures/Brand X Pictures/Getty Images. The older your business gets, the more difficult it might be to increase market share or profits, especially if you’re seeking exponential growth.hen choosing diversification strategies, look at your current customer base to determine if you can sell them different items or if you can add new customers by selling them a similar product at a different price or under a different name."
730,msmarco,_doc,MARCO_5986660,2.4251976,"Asexual Spores. The fungi form a wide range of different types of spores. Very different types of spores are formed following asexual or sexual processes. LINK Where the spore is genetically similar to its parent, and is formed following a vegetative division, it can be called an asexual spore.he haploid sexual spores of the Ascomycota are formed inside an ascus. Spore formation is initiated following hormonal interaction between hyphae of different mating types. Following plasmogamy, the two haploid nuclei exist in a dikaryon for a short period."
731,msmarco,_doc,MARCO_6316860,2.4251976,"A person with a different totem cannot initiate burial of the deceased. A person of the same totem, even when coming from a different tribe, can initiate burial of the deceased. For example a Ndebele of the Mpofu totem can initiate burial of a Shona of the Mhofu totem and that is perfectly acceptable in Shona tradition.But a Shona of a different totem cannot perform the ritual functions required to initiate burial of the deceased.he main part of them is divided into five major clans and adjacent to some people of very similar culture and languages. Therefore, there are various interpretations whom to subsume to the Shona proper and whom only to the Shona family."
732,msmarco,_doc,MARCO_1297614,2.421406,"It is more generally a measure of spread. The mean is a measure of location. The ratio of the standard deviation to the mean is called the coefficient of variation. This can be helpful in distinguishing two data sets that are given in different units.For example if we are comparing economic data from two different countries, the data might be quoted in different currencies. similar ratio is the index of dispersion, which is the square of the standard deviation divided by the mean. In biology, for example, we might look at the locations of trees within a wood. An index of dispersion equal to 1 would indicate a dispersal consistent with a Poisson process, i.e. uniformly at random."
733,msmarco,_doc,MARCO_4898660,2.421406,"The continental crust is made mostly of rocks with a composition similar to granite (a light-colored rock you would expect to find in the Sierra Nevada), whereas the oceanic crust is made mostly of rocks with a composition of basalt (a dark-colored rock, like the rocks that make up the Hawaiian volcanoes).ecause continental crust is less dense than oceanic crust it floats higher on the mantle, just like a piece of Styrofoam floats higher on water than a piece of wood does. The mantle, oceanic crust and continental crust have different densities because they are made of different kinds of rock with different densities."
734,msmarco,_doc,MARCO_6286436,2.421406,"1 The parent rocks are still granite and some other diorite gneiss, biotite gneiss and garnet gneiss. 2  However, gneiss formed from different hard conditions like high pressure and temperature. 3  The process of formation of igneous rock into gneiss is called metamorphosis. Igneous rock which is one fifth quartz is also granite. 2  The mineral formation of granite and gneiss is quite similar but high pressure and temperature changes basically form granite. 3  Different colours of granite rocks tell you all about the actual mineral composition is different in a variety of rocks."
735,msmarco,_doc,MARCO_7624967,2.421406,"Each of the five mother sauces is made with a different liquid, and a different thickening agent — although three of the mother sauces are thickened with roux, in each case the roux is cooked for a different amount of time to produce a lighter or darker color.. Espagnole Sauce. The Espagnole Sauce, also sometimes called Brown Sauce, is a slightly more complex mother sauce. Espagnole is made by thickening brown stock with roux. So in that sense it's similar to a veloute. Velouté the difference is that espagnole is made with tomato puree purée and mirepoix for deeper color. and flavor"
736,msmarco,_doc,MARCO_3662346,2.4138446,"While all FICO ® Score versions consider high credit card utilization to be reflective of higher risk, FICO ® Score 8 is more sensitive to highly utilized credit cards. So if a credit report shows a high balance close to the card's limit, FICO ® Score 8 will likely be more impacted than a previous score version.s a result, there are lenders currently using different FICO ® Score versions. As an analogy, it is similar to how people or businesses are on different versions of Microsoft Windows or have different generations of a smart phone."
737,msmarco,_doc,MARCO_3662350,2.4138446,"All FICO ® Score products made available on myFICO.com include a FICO ® Score 8, the FICO ® Score most widely used by lenders, along with additional FICO ® Score versions, including prior base FICO ® Score versions as well as industry-specific auto and bankcard versions. Learn more.s a result, there are lenders currently using different FICO ® Score versions. As an analogy, it is similar to how people or businesses are on different versions of Microsoft Windows or have different generations of a smart phone."
738,msmarco,_doc,MARCO_5382915,2.4138446,"Rheumatoid arthritis and osteoarthritis are different types of arthritis. They share some similar characteristics, but each has different symptoms and requires different treatment. So an accurate diagnosis is important. Osteoarthritis is the most common form of arthritis.Rheumatoid arthritis affects about one-tenth as many people as osteoarthritis. The main difference between osteoarthritis and rheumatoid arthritis is the cause behind the joint symptoms.Osteoarthritis is caused by mechanical wear and tear on joints. Rheumatoid arthritis is an autoimmune disease in which the body's own immune system attacks the body's joints.heumatoid arthritis affects about one-tenth as many people as osteoarthritis. The main difference between osteoarthritis and rheumatoid arthritis is the cause behind the joint symptoms."
739,msmarco,_doc,MARCO_6412119,2.4138446,"There are many different reasons why you might want to make a usb thumb drive bootable, The main reason is to use the usb thumb drive as a recovery tool, but you can use it for many more different things as well. In this guide I will show you lots of different ways to make a usb thumb drive bootable.ethod 5 – Create a bootable linux install usb thumb drive. This bootable usb thumb drive is similar to the bootable drive described in method 2. Step 1: Download a program called unetbootin http://www.make-bootable-disks.com/d...-drive-13.html Extract the file and double click on the .exe."
740,msmarco,_doc,MARCO_1220574,2.4063115,"Naproxen and ibuprofen work in the body the same and have the same side effects. Ibuprofen is typically taken every 6-8 hours; naproxen is taken every 12 hours. Aspirin works a little differently than ibuprofen and naproxen but has very similar side effects. The usual dose of aspirin is 500-1,000 mg every 4-6 hours. Acetaminophen works a little differently than naproxen and ibuprofen, has different side effects, and can be taken every 6-8 hours. So, to answer my brother-in-law’s question… He could take his naproxen (Aleve) eight hours after taking ibuprofen (Motrin, Advil) or he could take ibuprofen 12 hours after taking naproxen."
741,msmarco,_doc,MARCO_7874182,2.4063115,"Rheumatoid arthritis and osteoarthritis are different types of arthritis. They share some similar characteristics, but each has different symptoms and requires different treatment. So an accurate diagnosis is important. Osteoarthritis is the most common form of arthritis.Rheumatoid arthritis affects about one-tenth as many people as osteoarthritis. The main difference between osteoarthritis and rheumatoid arthritis is the cause behind the joint symptoms.Osteoarthritis is caused by mechanical wear and tear on joints. Rheumatoid arthritis is an autoimmune disease in which the body's own immune system attacks the body's joints.steoarthritis is the most common form of arthritis. Rheumatoid arthritis affects about one-tenth as many people as osteoarthritis. The main difference between osteoarthritis and rheumatoid arthritis is the cause behind the joint symptoms."
742,msmarco,_doc,MARCO_5757719,2.3988068,"Electron cloud is an informal term in physics. It is used to describe where electrons are when they go around the nucleus of an atom. The electron cloud model is different from the older Bohr atomic model by Niels Bohr.Bohr talked about electrons orbiting the nucleus, in a way similar to how the planets go around the Sun.The electron cloud model says that we can not know exactly where an electron is at any given time, but the electrons are more likely to be in specific areas.n the Bohr model, electrons were assigned to different shells. These shells explained the repeating patterns of chemical properties in the periodic table. Using quantum mechanics, chemists can use the electron cloud model to assign electrons to different atomic orbitals. These atomic orbitals are not all spheres."
743,msmarco,_doc,MARCO_4076726,2.3976946,Body part in different species that is similar in function but not in structure that evolved in response to a similar environmental challenge.
744,msmarco,_doc,MARCO_8260428,2.3968909,: to be very similar to but not exactly like (something) (chiefly Brit). : to do or make a thing that is very similar to but not exactly like (something).: to calculate the almost exact value or position of (something). to be very similar to but not exactly like (something) (chiefly Brit). : to do or make a thing that is very similar to but not exactly like (something).
745,msmarco,_doc,MARCO_5238142,2.393954,"1 Any two equilateral triangles are similar. 2  Two triangles, both similar to a third triangle, are similar to each other (transitivity of similarity of triangles). 3  Corresponding altitudes of similar triangles have the same ratio as the corresponding sides."
746,msmarco,_doc,MARCO_3833970,2.393746,"* Similarity due to common ancestry. *If both have a similar trait, it is true that they are related if last common ancestor also had it. *Similar structures have different structures."
747,msmarco,_doc,MARCO_7102716,2.393746,"An example of the different definitions of shape. The two triangles on the left are congruent, while the third is similar to them. The last triangle is neither similar nor congruent to any of the others, but it is homeomorphic."
748,msmarco,_doc,MARCO_6855664,2.3910258,"A group of cells grouped together to perform a similar function is a tissue. FOr example, all of your mucels perform a similar function. The muscles are actually tissues consisting of a group of similar cells. A group of cells grouped together to perform a similar function is a tissue."
749,msmarco,_doc,MARCO_3373836,2.3900516,"1 Two triangles, both similar to a third triangle, are similar to each other (transitivity of similarity of triangles). 2  Corresponding altitudes of similar triangles have the same ratio as the corresponding sides. 3  Two right triangles are similar if the hypotenuse and one other side have lengths in the same ratio."
750,msmarco,_doc,MARCO_311595,2.389805,"The aim of a sequence alignment is to match the most similar elements of two sequences. This similarity must be evaluated somehow. They seem quite similar: both contain one indel and one substitution, just at different positions."
751,msmarco,_doc,MARCO_796441,2.3890784,"The HRs for losartan vs candesartan were similar for an LVEF of less than 40% and an LVEF of 40% or more, and similar to the whole population (all were statistically significant in favor of candesartan).he HRs for losartan vs candesartan were similar for an LVEF of less than 40% and an LVEF of 40% or more, and similar to the whole population (all were statistically significant in favor of candesartan)."
752,msmarco,_doc,MARCO_1427608,2.3890784,"The hallucinations are similar because everyone’s brain is similar in structure and the chemicals cause similar reactions. It is not proof of an afterlife, just proof that we are very similar in structure. Mr. Fox June 8, 2010 at 5:03 pm Reply. This actually explains my OOBE when I was a kid."
753,msmarco,_doc,MARCO_2399718,2.388106,"If two triangles are similar, their corresponding angles are not congruent. b. If corresponding angles of two triangles are not congruent, the triangles are not similar. c. If two triangles are similar, their corresponding angles are congruent. d. If corresponding angles of two triangles are congruent, the triangles are similar."
754,msmarco,_doc,MARCO_5557615,2.388106,"Classification is considered to be the placing of similar objects into similar groups. In science, classification is a part of taxonomy. Taxonomy is science of naming living things by putting them into categories. Classification is considered to be the placing of similar objects into similar groups. In science, classification is a part of taxonomy."
755,msmarco,_doc,MARCO_381254,2.3878376,"No. Hydrocodone is a bit different opioid than codeine but they are in the same family and therefore similar. Hydrocodone is considered a bit stronger by some, a bit more habit forming, but they work in similar ways."
756,msmarco,_doc,MARCO_5368392,2.3878376,"The closing single quotation mark is identical or similar in form to the apostrophe, and similar to the prime symbol. These three characters have quite different purposes, however. See also: ditto mark."
757,msmarco,_doc,MARCO_5403573,2.3878376,"1 Disorders Related to (or sometimes with similar symptoms to)Schizophrenia 2  : Knowing the symptoms of these disorders, and how they can be similar and different from schizophrenia, can help prevent a possible misdiagnosis."
758,msmarco,_doc,MARCO_6658506,2.3878376,"Ritalin contains methylphenidate which has a similar structure to the amphetamines in Adderall. While the active ingredient of Ritalin is similar to those of Adderall, it is sufficiently different as to provide a good alternative to the amphetamines."
759,msmarco,_doc,MARCO_7902208,2.3878376,"Pterygium and Pinguecula Both a pterygium and a pinguecula are abnormal growths that form on the surface of the eye. While they may appear similar, and have similar symptoms and causes, they are actually different conditions."
760,msmarco,_doc,MARCO_7536182,2.3878376,"Symptoms of the following disorders can be similar to those of aspergillosis. Comparisons may be useful for a differential diagnosis. There many different disorders, infections or conditions that may have symptoms similar to those found with aspergillosis."
761,msmarco,_doc,MARCO_773626,2.3861642,"It’s made through similar means, and it has a similar sugar profile. As they’re very similar, it makes sense that they’d be used in similar ways which is why agave nectar is such a popular sweetener for processed foods within the natural foods communities: sodas and ice cream comes to mind."
762,msmarco,_doc,MARCO_5894906,2.3861642,"If you like Lana Rhoades, you may also like. Adele Wiesenthal - blue-eyed brunette, similar face and body. Alexandra Daddario - blue-eyed brunette, similar face and body. Ashley Adams - similar face and body. Elizabeth Hurley - blue-eyed brunette, similar face and body."
763,msmarco,_doc,MARCO_7995909,2.3861642,"“Therefore, we may define a cause to be an object, followed by another, and where all the objects similar to the first are followed by objects similar to the second. Or in other words, where, if the first object had not been, the second never had existed” (309).Therefore, we may define a cause to be an object, followed by another, and where all the objects similar to the first are followed by objects similar to the second. Or in other words, where, if the first object had not been, the second never had existed” (309)."
764,msmarco,_doc,MARCO_4049253,2.385872,"(Employees do not have to receive identical penalties, but if all relevant circumstances are similar, the penalties should be similar.) Rule of other thumb: Major differences in situation or circumstances can justify very different penalties."
765,msmarco,_doc,MARCO_6746660,2.385872,"Kelvin–Helmholtz instability (similar, but different from the diocotron instability in plasmas) Rayleigh–Taylor instability Plateau-Rayleigh instability (similar to the Rayleigh–Taylor instability)"
766,msmarco,_doc,MARCO_4685038,2.3851948,"1 All squares are similar. 2  All congruent polygons are similar. 3  All similar polygons are congruent. 4  All regular pentagons are similar. . 5  List the congruent angles and proportions for the sides. 6  If and, find the scale factor. 7  If, find. 8  If, find. 9  Find the perimeter of and."
767,msmarco,_doc,MARCO_3890522,2.3842263,"Definition SIM Similar Matrices. Suppose $A$ and $B$ are two square matrices of size $n$. Then $A$ and $B$ are similar if there exists a nonsingular matrix of size $n$, $S$, such that $A=\similar{B}{S}$. We will say “$A$ is similar to $B$ via $S$” when we want to emphasize the role of $S$ in the relationship between $A$ and $B$."
768,msmarco,_doc,MARCO_6787549,2.3842263,"Considered to have some characteristics similar to flux cored wires and other characteristics similar to solid wire, metal cored wires do share a similar construction to flux cored wires and performance similar to solid MIG wires. The outer metallic sheath of a cored wire conducts the electrical current for welding."
769,msmarco,_doc,MARCO_1581064,2.3839083,"This reaction parallels a similar transformation of alcohols to alkyl chlorides, although its mechanism is different. Other reagents that produce a similar conversion to acyl halides are PCl 5 and SOBr 2."
770,msmarco,_doc,MARCO_1518460,2.3839083,Full Definition of ANALOGUE. 1. : something that is analogous or similar to something else. 2. : an organ or part similar in function to an organ or part of another animal or plant but different in structure and origin. 3.
771,msmarco,_doc,MARCO_8216713,2.3839083,Homologous structures refer to structures on different species that are similar in function and their evolutionary origin. Analogous structures are similar in function but do …not share a similarity in evolutionary origin.
772,msmarco,_doc,MARCO_7183873,2.3839083,"Ethanol vs Methanol. Sometimes things that look so similar are actually quite different. This is the case with ethanol and methanol. These two substances not only sound similar, but if you put them in two separate glasses they would also look the same."
773,msmarco,_doc,MARCO_7216802,2.3839083,"Similar polygons have the same shape, but can be different sizes. Specifically, two polygons are. similar if two things are true: The corresponding sides of each are in the same proportion. The corresponding interior angles are the same (congruent)."
774,msmarco,_doc,MARCO_4442679,2.3838816,"Every organism can be classified at 7 different levels-kingdom, phylum, class, order, family, genus and species. Each level contains organisms with similar characteristics. The kingdom is the largest group and very broad.Each successive group contains fewer organisms, but the organisms are more similar.The species is the smallest group and is very narrow.Organisms within a species are able to mate and produce fertile offspring. The following chart traces the classification of a grizzly bear through each of the 7 levels of classification. At each level, be aware of the characteristics the different organisms share.he species is the smallest group and is very narrow. Organisms within a species are able to mate and produce fertile offspring. The following chart traces the classification of a grizzly bear through each of the 7 levels of classification. At each level, be aware of the characteristics the different organisms share."
775,msmarco,_doc,MARCO_7373911,2.3832588,Definition of similar. 1  1 : having characteristics in common : strictly comparable. 2  2 : alike in substance or essentials : corresponding no two animal habitats are exactly similar — W. H. Dowdeswell. 3  3 : not differing in shape but only in size or position similar triangles similar polygons.
776,msmarco,_doc,MARCO_217188,2.3819466,"The Geography of East Asia. 1  The climate of East Asia is both similar to and different from that of Europe and the United States. 2  It is similar in that it is a temperate climate, with colder winters and warm summers."
777,msmarco,_doc,MARCO_2353846,2.3819466,"Farmed and wild salmon have very similar nutrients. Atlantic. salmon and Pacific salmon look similar on the outside. But. between species and even within the same species, each type of. salmon can have different flavors, textures and flesh color."
778,msmarco,_doc,MARCO_4911267,2.3819466,explains the morphological similarity yet major genetic differences found between slime molds and fungi AND refers to two different organisms that develop similar characteristics in adaptation to similar environments.
779,msmarco,_doc,MARCO_4797900,2.3819466,"Difference Between Silk and Satin. Silk and satin are both smooth and soft. These two materials are widely used by people because of its smoothness. Though these two come with somewhat similar features and have a similar look, they are quite different in every sense."
780,msmarco,_doc,MARCO_5198749,2.3819466,"An ocean-dwelling mollusk whose foot is adapted as tentacles that surrounds its mouth How are the foot structures of a snail, a clam, and an octopus similar and different? Similar ~ they all have a muscular foot without any skeletal parts"
781,msmarco,_doc,MARCO_6622665,2.3819466,"Difference Between Ethanol and Methanol. Sometimes things that look so similar are actually quite different. This is the case with ethanol and methanol. These two substances not only sound similar, but if you put them in two separate glasses they would also look the same."
782,msmarco,_doc,MARCO_8531927,2.3819466,"For not so famous names, you'll have to do a name search to find out if the same name, or similar names, are already in use, and how they're being used. If another company is using the same or a similar name to market different products and services, it may be fine for you to use the name for your business."
