,_index,_type,_id,_score,_source.body
258,msmarco,_doc,MARCO_2467268,2.7259753,"Wire transfers and ACH payments may seem similar, almost identical. However, the two are quite different, and understanding the differences between them is beneficial for anyone who is interested in using electronic methods of payments for moving money to and from bank accounts.ire transfers and ACH payments may seem similar, almost identical. However, the two are quite different, and understanding the differences between them is beneficial for anyone who is interested in using electronic methods of payments for moving money to and from bank accounts."
259,msmarco,_doc,MARCO_5684314,2.7259753,"Some of these types have similar symptoms and cause similar infections. Hepatitis is a medical term that means inflammation of the liver. It can be caused by many different things. However, one of the most common causes of hepatitis is an infection with a virus.epatitis A, B, and C are the most common types of viral hepatitis in the United States. Hepatitis is a medical term that means inflammation of the liver. It can be caused by many different things."
260,msmarco,_doc,MARCO_6019981,2.7259753,"Take-home message. With their similar names, it can be confusing as to what the roles of betaine and cocamidopropyl betaine are in shampoos and conditioners. Since they are structurally very different, each one imparts unique properties to products in which they are present.ake-home message. With their similar names, it can be confusing as to what the roles of betaine and cocamidopropyl betaine are in shampoos and conditioners. Since they are structurally very different, each one imparts unique properties to products in which they are present."
261,msmarco,_doc,MARCO_8155326,2.7259753,"One way species change over time is called convergent evolution. Convergent evolution is when two species, that are not related via a recent common ancestor, become more similar. Most of the time, the reason behind convergent evolution occurring is the build up of adaptations over time to fill a certain niche. When the same or similar niches are available in different geographical locations, different species will most likely fill that niche."
262,msmarco,_doc,MARCO_8528767,2.7259753,"For comparison, see similar climate charts and information for our other African destinations: ► Botswana climate – Similar weather pattern to Namibia, perhaps with slightly higher rainfall. ► Congo climate – A very different weather pattern from Namibia. ► Kenya climate – A very different weather pattern from Namibia."
263,msmarco,_doc,MARCO_2011321,2.7253847,"Click here: Similar Polygons. Recall that two shapes are congruent if they have the same shape and size. When two shapes have the same shape but different sizes, we call the shapes similar. You can also think of similar objects or shapes as scaled versions of each other."
264,msmarco,_doc,MARCO_82515,2.7240477,"FORMS OF MANEUVER Just as similar phases are common to all offensive operations, so similar forms of maneuver are common to all attacks. These forms of maneuver include envelop­ ment, the turning movement, infiltration, penetration, and frontal attack. While fre­ quently used in combination, each attacks the enemy in a different way, and each poses different challenges to the attacking commander. ENVELOPMENT . Envelopment is the basic form of"
265,msmarco,_doc,MARCO_3697644,2.7240477,"The term genitourinary system is the urinary and reproductive systems, which are often considered together because of their their proximity to each other.The different parts of the urinary system in the body are somewhat similar in males and females. People of both genders have kidneys which process waste.he female reproductive system is part of the genitourinary system. Men have very different reproductive systems than women, but the sexes share similar urinary systems."
266,msmarco,_doc,MARCO_1678941,2.7240477,"The symptoms of prostatitis are similar to other diseases of the prostate, yet there are some distinct differences. Prostatitis is different in that essentially it's an infection and/or inflammation of the prostate gland.There are several varieties of prostatitis, which fall into four categories.he symptoms of prostatitis are similar to other diseases of the prostate, yet there are some distinct differences. Prostatitis is different in that essentially it's an infection and/or inflammation of the prostate gland. There are several varieties of prostatitis, which fall into four categories."
267,msmarco,_doc,MARCO_2563115,2.7240477,"Some synthetic opiates or opioids with a different chemical structure but similar effects on the body and brain are propoxyphene (Darvon), meperidine (Demerol), and methadone. Physicians use many of these drugs to treat pain.ome synthetic opiates or opioids with a different chemical structure but similar effects on the body and brain are propoxyphene (Darvon), meperidine (Demerol), and methadone. Physicians use many of these drugs to treat pain."
268,msmarco,_doc,MARCO_3132127,2.7240477,"This can lead to analogous structures in different species that occupy the same type of niche and environment in different locations. When Carolus Linnaeus first began classifying and naming species with taxonomy, he often grouped similar looking species into similar groups.nalogous structures do not have to have the same evolutionary path. One analogous structure may have come into existence long ago, while the analogous match on another species may be relatively new."
269,msmarco,_doc,MARCO_6081315,2.7240477,"A homologous structures are structures that share an evolutionary  ancestry. An example of homologous structures would be the bones in  the arms of a human, the wings of a b … at, and the legs of a dog.tructures that are embryologically similar, but have different functions, are called homologous structures. Though these animals look different, a comparison of homologous structures indicates that they are quite similar. This suggests that these animals evolved from a common ancestor.   by: Lameace[=."
270,msmarco,_doc,MARCO_7429062,2.7240477,"An oboe can be used in several different ways. For one, it can be used to summon undead beings with its horrible farting sound (see necromancy). The oboe, being made of grenadilla or similar rosewoods, can also be used as a hollow shortsword for cutting down thy enemies.n oboe can be used in several different ways. For one, it can be used to summon undead beings with its horrible farting sound (see necromancy). The oboe, being made of grenadilla or similar rosewoods, can also be used as a hollow shortsword for cutting down thy enemies."
271,msmarco,_doc,MARCO_8775971,2.7240477,"The Naan burger is a hamburger served on naan bread. The naan burger has very similar ingredients to normal burgers, but is sometimes made with ham. The use of flatbread creates a taste experience different from hamburgers made with bread.he naan burger has very similar ingredients to normal burgers, but is sometimes made with ham. The use of flatbread creates a taste experience different from hamburgers made with bread."
272,msmarco,_doc,MARCO_5238139,2.7234306,"This article assumes that a scaling can have a scale factor of 1, so that all congruent shapes are also similar, but some school text books specifically exclude congruent triangles from their definition of similar triangles by insisting that the sizes must be different if the triangles are to qualify as similar."
273,msmarco,_doc,MARCO_7197765,2.7234306,"Also, the Flag of Malacca, a state in Malaysia, is similar, having the same colors (except the yellow star and moon) and a similar canton design, although the proportions and color order are different. The state of Amazonas in Brazil also adopted a similar flag 1982."
274,msmarco,_doc,MARCO_842207,2.7221217,"These different dimensions are very similar to Geert Hofstede's Cultural Dimension theory, a theory that looks at unique aspects of cultures and rates them on a scale for comparison.Now, I am not trying to say dogs to humans are the same, but the way they interact is quite similar.hese different dimensions are very similar to Geert Hofstede's Cultural Dimension theory, a theory that looks at unique aspects of cultures and rates them on a scale for comparison."
275,msmarco,_doc,MARCO_5331724,2.7221217,"evolution. the process of development in which an organ or organism becomes more and more complex by the differentiation of its parts; a continuous and progressive change according to certain laws and by means of resident forces. convergent evolution. the development, in animals that are only distantly related, of similar structures or functions in adaptation to similar environment. divergent evolution. the development of different characteristics in animals that were closely related in response to being placed in different environments."
276,msmarco,_doc,MARCO_5542336,2.7221217,Lesson of the Week: Amigos Falsos-False Cognates. Beware of words that are not what they seem! A word that looks or sounds similar to one in English but actually has a totally different meaning is called a false cognate.Below are some of these tricky little guys.esson of the Week: Amigos Falsos-False Cognates. Beware of words that are not what they seem! A word that looks or sounds similar to one in English but actually has a totally different meaning is called a false cognate.
277,msmarco,_doc,MARCO_6467297,2.7221217,"In considering whether taking supplemental digestive enzymes may be beneficial, one should recognize that the term digestive enzymes is a catchall that includes a variety of compounds with different purposes—similar to vitamins or probiotics..n considering whether taking supplemental digestive enzymes may be beneficial, one should recognize that the term digestive enzymes is a catchall that includes a variety of compounds with different purposes—similar to vitamins or probiotics.."
278,msmarco,_doc,MARCO_6209304,2.7221217,"Spanish False Cognates. I created this page to keep Spanish students from falling victim to false cognates! The most common mistake made when speaking is to use a Spanish word that looks or sounds similar to an English word but has a totally different meaning. This can result in confusion and embarrassment!. A Spanish word that is similar to an English word, but has a different meaning, is known as a false cognate."
279,msmarco,_doc,MARCO_348212,2.7201977,"Differences between Crocodiles, Alligators and Caimans. Crocodiles are often mistaken for alligators and caimans. While they are similar there are significant differences among them. Those differences are enough to put them all into different families when it comes to the scientific categorization.The snout is the biggest difference with the crocodile and the alligator.ifferences between Crocodiles, Alligators and Caimans. Crocodiles are often mistaken for alligators and caimans. While they are similar there are significant differences among them. Those differences are enough to put them all into different families when it comes to the scientific categorization."
280,msmarco,_doc,MARCO_2600260,2.7201977,1 As it not possible makes it software application is defect free but testing will be necessary. 2  Most important thing of testing is the development environment is different than the Testing environment and the testing done on testing environment is similar to the Production environment. Most important thing of testing is the development environment is different than the Testing environment and the testing done on testing environment is similar to the Production environment.
281,msmarco,_doc,MARCO_4048668,2.7201977,"Learned generalization or secondary generalization is an aspect of learning theory. In learning studies it can be shown that subjects, both animal and human will respond in the same way to different stimuli if they have similar properties established by a process of conditioning.earned generalization or secondary generalization is an aspect of learning theory. In learning studies it can be shown that subjects, both animal and human will respond in the same way to different stimuli if they have similar properties established by a process of conditioning."
282,msmarco,_doc,MARCO_2170241,2.7201977,"Homemade Baharat Spice Blend Recipe. In the past while, I've explored many different cuisines from around the world, and one thing I've noticed is that most of them tend to have a mix of spices, often similar spices, that are staples in their cuisine.omemade Baharat Spice Blend Recipe. In the past while, I've explored many different cuisines from around the world, and one thing I've noticed is that most of them tend to have a mix of spices, often similar spices, that are staples in their cuisine."
283,msmarco,_doc,MARCO_2796230,2.7201977,"Terrestrial Planets Within Our Solar System. In our solar system, there are eight planets. Half of these are terrestrial planets that have both very similar and very different characteristics. In order of proximity to the Sun, they are: Mercury, Venus, Earth, and Mars.errestrial Planets Within Our Solar System. In our solar system, there are eight planets. Half of these are terrestrial planets that have both very similar and very different characteristics. In order of proximity to the Sun, they are: Mercury, Venus, Earth, and Mars."
284,msmarco,_doc,MARCO_3181088,2.7201977,Ancient India Geography. India and its surrounding countries are so similar in culture and climatic conditions that the region is sometimes called the Indian sub-continent. In ancient times the geography of India was a little different than what it is today.ncient India Geography. India and its surrounding countries are so similar in culture and climatic conditions that the region is sometimes called the Indian sub-continent. In ancient times the geography of India was a little different than what it is today.
285,msmarco,_doc,MARCO_3459604,2.7201977,"The fronds of a fennel plant do look similar to the dill leaves, though their taste is quite different. The anise flavour from fennel is a lot stronger than dill. It is not recommended to substitute fennel leaves for dill.he fronds of a fennel plant do look similar to the dill leaves, though their taste is quite different. The anise flavour from fennel is a lot stronger than dill. It is not recommended to substitute fennel leaves for dill."
286,msmarco,_doc,MARCO_3612058,2.7201977,"18,481 pages on this wiki. A Pet on FarmVille is similar to an animal, being animated and able to wander on a farm. They are slightly different, however, in that they are not able to be harvested and can follow a farmer around.You can choose its gender, color, name it then place it on the farm.8,481 pages on this wiki. A Pet on FarmVille is similar to an animal, being animated and able to wander on a farm. They are slightly different, however, in that they are not able to be harvested and can follow a farmer around."
287,msmarco,_doc,MARCO_6005618,2.7201977,"Mars and Earth are very different planets when it comes to temperature, size, and atmosphere, but geologic processes on the two planets are surprisingly similar. On Mars, we see volcanoes, canyons, and impact basins much like the ones we see on Earth.ars and Earth are very different planets when it comes to temperature, size, and atmosphere, but geologic processes on the two planets are surprisingly similar. On Mars, we see volcanoes, canyons, and impact basins much like the ones we see on Earth."
288,msmarco,_doc,MARCO_6080571,2.7201977,Heishi from Africa. A different kind of heishi-type beads are crafted using a similar technique in some African nations. The materials differ somewhat; they may include vegetable material such as husks or shells and thick pieces of ostrich eggshell.eishi from Africa. A different kind of heishi-type beads are crafted using a similar technique in some African nations. The materials differ somewhat; they may include vegetable material such as husks or shells and thick pieces of ostrich eggshell.
289,msmarco,_doc,MARCO_7862633,2.7201977,"The rods are narrower than the cones and distributed differently across the retina, but the chemical process in each that supports phototransduction is similar. A third class of photoreceptor cells was discovered during the 1990s: the photosensitive ganglion cells.he rods are narrower than the cones and distributed differently across the retina, but the chemical process in each that supports phototransduction is similar. A third class of photoreceptor cells was discovered during the 1990s: the photosensitive ganglion cells."
290,msmarco,_doc,MARCO_6709925,2.7201977,"Math Geometry Worksheets. Congruent polygons are the same size and shape. Similar polygons have the same shape, but can be different sizes. Click on the the core icon below specified worksheets to see connections to the Common Core Standards Initiative.ongruent polygons are the same size and shape. Similar polygons have the same shape, but can be different sizes. Click on the the core icon below specified worksheets to see connections to the Common Core Standards Initiative."
291,msmarco,_doc,MARCO_2433983,2.7195282,"The closing single quotation mark is identical or similar in form (depending on the font) to the apostrophe and similar to the prime symbol. However, these three characters have quite different purposes. The double quotation mark is similar to—and often used to represent—the ditto mark and the double prime symbol."
292,msmarco,_doc,MARCO_606204,2.7163553,"Many different conditions can cause chronic pelvic pain. You may have one or more of them. All can have similar symptoms, and that often makes it hard to figure out the source of the pain. The main symptom is pain that lasts for more than six months, but there are usually other symptoms, as well.any different conditions can cause chronic pelvic pain. You may have one or more of them. All can have similar symptoms, and that often makes it hard to figure out the source of the pain. The main symptom is pain that lasts for more than six months, but there are usually other symptoms, as well."
293,msmarco,_doc,MARCO_843368,2.7163553,"1 Both mitochondria and chloroplasts contain DNA, which is fairly different from that of the cell nucleus, and that is similar to that of bacteria (in being circular and in its size).2  Mitochondria utilize a different genetic code than the eukaryotic host cell; this code is very similar to bacteria and Archaea.he theory postulates that the mitochondria evolved from aerobic bacteria (probably proteobacteria, related to the rickettsias), and that the chloroplast evolved from endosymbiotic cyanobacteria (autotrophic prokaryotes)."
294,msmarco,_doc,MARCO_91188,2.7163553,"Cancer is an uncontrolled growth of abnormal cells. It is found in animals as well as humans. There are many different types of cancer that are found in animals, symptoms are often similar to those in people (eg. abnormal swelling, unexplained weight loss, lethargy / reluctance to exercise etc).here are many different types of cancer that are found in animals, symptoms are often similar to those in people (eg. abnormal swelling, unexplained weight loss, lethargy / reluctance to exercise etc)."
295,msmarco,_doc,MARCO_284884,2.7163553,"Biomes are regions of the world with similar climate (weather, temperature) animals and plants. There are terrestrial biomes (land) and aquatic biomes, both freshwater and marine.Would you like to know what the weather is like in different biomes around the world?iomes are regions of the world with similar climate (weather, temperature) animals and plants. There are terrestrial biomes (land) and aquatic biomes, both freshwater and marine. Would you like to know what the weather is like in different biomes around the world?"
296,msmarco,_doc,MARCO_1125312,2.7163553,(biology). Having similar structure and anatomical position (but not necessarily the same function) in different organisms suggesting a common ancestry or evolutionary origin (e.g. wings of bats and arms of humans are homologous).(chemistry).aving similar structure and anatomical position (but not necessarily the same function) in different organisms suggesting a common ancestry or evolutionary origin (e.g. wings of bats and arms of humans are homologous). (chemistry).
297,msmarco,_doc,MARCO_2339555,2.7163553,Please try again later. Learn how to use Excel 2010 to calculate the mean (or average) and standard deviation of a range of data. You can do this for two sets of data so that you can compare them to see if they are similar or different.1  Education. 2  Standard YouTube License.lease try again later. Learn how to use Excel 2010 to calculate the mean (or average) and standard deviation of a range of data. You can do this for two sets of data so that you can compare them to see if they are similar or different.
298,msmarco,_doc,MARCO_3600239,2.7163553,"The Earth's magnetic field is attributed to a dynamo effect of circulating electric current, but it is not constant in direction. Rock specimens of different age in similar locations have different directions of permanent magnetization.agnetic Field of the Earth. The Earth's magnetic field is similar to that of a bar magnet tilted 11 degrees from the spin axis of the Earth. The problem with that picture is that the Curie temperature of iron is about 770 C."
299,msmarco,_doc,MARCO_6887789,2.7163553,"Answer: Waterspouts are similar to tornadoes, but they form in a different manner. Generally, waterspouts are given the honor of being called a tornado over water. But waterspouts are not truly given the name of a real tornado until they reach land.nswer: Waterspouts are similar to tornadoes, but they form in a different manner. Generally, waterspouts are given the honor of being called a tornado over water. But waterspouts are not truly given the name of a real tornado until they reach land."
300,msmarco,_doc,MARCO_5062063,2.7163553,"Bird flu is a phrase similar to  swine flu ,  dog flu ,  horse flu , or  human flu  in that it refers to an illness caused by any of many different strains of influenza viruses that have adapted to a specific host.ird flu is a phrase similar to  swine flu ,  dog flu ,  horse flu , or  human flu  in that it refers to an illness caused by any of many different strains of influenza viruses that have adapted to a specific host."
301,msmarco,_doc,MARCO_5146367,2.7163553,", to establish the 10 most common procedures performed, to determine whether nurse practitioners in different settings perform similar procedures and to determine where NPs received their procedures education.The study did not examine NPs' competency in performing procedures. to establish the 10 most common procedures performed, to determine whether nurse practitioners in different settings perform similar procedures and to determine where NPs received their procedures education."
302,msmarco,_doc,MARCO_5717800,2.7163553,"For example Coca-Cola and Pepsi, two similar companies competing for the same market can employ these strategies to outdo each other. Differentiation is a marketing strategy where a company produces goods that are different from those offered by other companies.or example Coca-Cola and Pepsi, two similar companies competing for the same market can employ these strategies to outdo each other. Differentiation is a marketing strategy where a company produces goods that are different from those offered by other companies."
303,msmarco,_doc,MARCO_6852684,2.7163553,"Compounds that have the same molecular formula but different chemical structures are called isomers. Remember isomerism is a property between a pair (or more) of molecules, i.e. a molecule is an isomer of another molecule. A similar relationship is that of brother or sister...ompounds that have the same molecular formula but different chemical structures are called isomers. Remember isomerism is a property between a pair (or more) of molecules, i.e. a molecule is an isomer of another molecule. A similar relationship is that of brother or sister..."
304,msmarco,_doc,MARCO_6836053,2.7163553,"Experienced observers can sometimes recognize phlogopite by its brown color. As noted above, biotite is a name used for a number of black mica minerals that have different chemical compositions but very similar physical properties.These minerals generally can not be distinguished from one another without laboratory analysis.xperienced observers can sometimes recognize phlogopite by its brown color. As noted above, biotite is a name used for a number of black mica minerals that have different chemical compositions but very similar physical properties."
305,msmarco,_doc,MARCO_7687785,2.7163553,"A few other birds have a comb or similar appendage, in some cases bearing a different name such as helmet in the guinea, and a few have wattles with some having a single median one rather than a pair. The comb is the basis of the Latin name or classification of chickens. few other birds have a comb or similar appendage, in some cases bearing a different name such as helmet in the guinea, and a few have wattles with some having a single median one rather than a pair. The comb is the basis of the Latin name or classification of chickens."
