,_index,_type,_id,_score,_source.body
256,msmarco,_doc,MARCO_8295754,7.7916737,"A few days ago I was delighted to learn that Dr. Oz was going to again feature The Paleo Diet on his nationally syndicated television show along with one of my co-authors, Nell Stephenson, of The Paleo Diet Cookbook."
257,msmarco,_doc,MARCO_4894339,7.789716,"Dairy: Shunned by vegan and paleo dieters alike, dairy has no place in the pegan eating plan, since many people have a hard time digesting it. Soy: This vegan diet staple is a no-no in the pegan and paleo camps."
258,msmarco,_doc,MARCO_3494171,7.78776,"Following the Paleo diet means steering clear of all grains, legumes, dairy, processed foods, and sugar, which will likely lead to weight loss. But the Paleo diet can be extreme, and tough for many to stick with long-term."
259,msmarco,_doc,MARCO_4229915,7.78776,"by CavemanGreg on. Nuts are an integral part to the Paleo diet. In fact, it was the ranting of my significant other about eating too much nuts that jump started my research and eventual transition with the Paleo diet in the first place! So, lets talk about nuts today!"
260,msmarco,_doc,MARCO_8806564,7.78776,"Weâve also broken this list down into the specific food groups, so you can see which meats, vegetables, fruits, nuts, and fats are on the paleo diet. In addition to all of that, weâve also included a comprehensive list of foods not allowed on the paleo diet."
261,msmarco,_doc,MARCO_7427612,7.786492,21 Day Keto Diet Meal Plan! Because they donât make it easy to lose weight and keep the weight off. My â21 Day Keto Dietâ by My Keto Coach makes it simple to enjoy the foods you loveâwithout calorie counting!
262,msmarco,_doc,MARCO_428689,7.7858057,"The truth is our ancestors ate in a lot of ways, Harvard paleoanthropologist and author of The Story of the Human Body Daniel Lieberman told me: There is no one 'Paleo diet.' There are millions of Paleo diets. What's more, we didn't necessarily evolve to eat meat."
263,msmarco,_doc,MARCO_3033402,7.7858057,"Pegan DON'Ts. Dairy: Shunned by vegan and paleo dieters alike, dairy has no place in the pegan eating plan, since many people have a hard time digesting it. Soy: This vegan diet staple is a no-no in the pegan and paleo camps."
264,msmarco,_doc,MARCO_2504840,7.7858057,"FastPaleo.com exists for you to share your paleo diet and primal diet recipes with the world. Whether you are an established food blogger with your own site and fans looking for more exposure, or just getting started with your paleo journey and looking for a place to post your very first recipe...."
265,msmarco,_doc,MARCO_324718,7.7838535,"Paleo is a lifestyle. The paleo diet is by no means a temporary diet, says Cordain. It's meant to be a lifestyle, just as it was thousands of years ago. You don't just stop it if and when you start feeling better or reach your goal weightâyou stick it out for the long haul."
266,msmarco,_doc,MARCO_324720,7.7838535,"The Paleo diet is based on the notion that humans should eat the real, whole, unprocessed foods that we were intended to eat. Pretty simple, right? The Paleo diet is based on the notion that humans should eat the real, whole, unprocessed foods that we were intended to eat."
267,msmarco,_doc,MARCO_2870761,7.7819033,"Not part of a true Paleo diet. Following The Paleo Diet, though, you can have the occasional glass of wine or beer during a cheat meal. (Alcohol only adds empty calories anyway, and if youâre trying to lose weight, every calorie counts.) Time savers."
268,msmarco,_doc,MARCO_3107875,7.7819033,"Are there benefits of following the Paleo diet for fibromyalgia sufferers? The Paleo diet involves focusing on foods that humans ate back during the days of caves and fireside cuisine. It focuses on grass-fed meats, fruits, vegetables, nuts, and seeds."
269,msmarco,_doc,MARCO_4229916,7.7819033,"Nuts are an integral part to the Paleo diet. In fact, it was the ranting of my significant other about eating too much nuts that jump started my research and eventual transition with the Paleo diet in the first place! So, lets talk about nuts today! A lot of folks are misinformed about nuts."
270,msmarco,_doc,MARCO_8295755,7.7819033,"If you do eat any foods that come from a can or a box, you would still need to check the sodium on food labels. What Else You Should Know. Costs: Eating a lot of meat and fish can raise your grocery bill. Support: You can do this diet on your own. If you want to connect to your fellow Paleos, there are Paleo Diet forums online."
271,msmarco,_doc,MARCO_4032234,7.779955,"Other supporters of the Paleo diet believe that changing your lifestyle to model your evolutionary ancestors will lower your risk for obesity, cardiovascular diseases, cancer and other ailments. Athletes also find the Paleo diet to be a great way to add protein to their strict eating behaviors."
272,msmarco,_doc,MARCO_5799275,7.7799406,"The only time it will is when youâve restricted your caloric intake to the point that you are starving yourself. Using Keto-OS. The rules of the ketogenic diet are simple: consume calories in a ratio of 75% fat, 20% protein and 5% carbohydrates.When you do this, your body will be trained to use fat for fuel.Once your body has exhausted the fat from your diet, it will seek out more fuel from your bodyâs fat reserves.he rules of the ketogenic diet are simple: consume calories in a ratio of 75% fat, 20% protein and 5% carbohydrates. When you do this, your body will be trained to use fat for fuel. Once your body has exhausted the fat from your diet, it will seek out more fuel from your bodyâs fat reserves."
273,msmarco,_doc,MARCO_8406643,7.7787094,"Keto-OS: Instant Ketosis Is Finally Here. Jun 25, 2015 by Keto King in LCHF News. Most of my friends would say that when they hear the word keto or ketosis or anything related to high fat diets Iâm told they immediately think of me. Thereâs a reason for this."
274,msmarco,_doc,MARCO_8322555,7.7787094,"The keto dietâs main goal is to keep you in nutritional ketosis all the time. If youâre just getting started with your keto diet, you should eat up to 25 grams of carbs per day. Once youâre in ketosis for long enough (about 4 to 8 weeks), you become keto-adapted, or fat-adapted."
275,msmarco,_doc,MARCO_324715,7.7780085,"One of the biggest pluses of the paleo diet isn't about nutrition at allâit's about the support paleo eaters give each other. Online community forums, Facebook pages, and even Meetup groups are filled with people living the ancient lifestyle in modern times. You won't find that with many other diets."
276,msmarco,_doc,MARCO_1479318,7.7780085,"Health Benefits of a Paleo Diet. For most people the fact the Paleo diet delivers the best results is all they need. Improved blood lipids, weight loss, and reduced pain from autoimmunity is proof enough. Many people however are not satisfied with blindly following any recommendations, be they nutrition or exercise related."
277,msmarco,_doc,MARCO_6888398,7.7780085,"The Paleo diet also results in a high potassium low sodium intake ratio. Thousands of years ago, there was an abundance of available potassium and a scarcity of sodium. The Paleo diet can deliver 11,000 mg of potassium compared to 700 mg of sodium daily."
278,msmarco,_doc,MARCO_6914803,7.7780085,"The Paleo Diet recommends an appropriate balance of acidic and basic (alkaline) foods (i.e., grass produced or free ranging meats, fish and seafood, fruits, and vegetables) and will not cause osteoporosis in otherwise healthy individuals. Indeed, The Paleo Diet promotes bone health."
279,msmarco,_doc,MARCO_2316458,7.7767687,"transamination the process by which amino groups are transferred from one AMINO ACID to form another, using a keto acid as an intermediary. The mechanism takes place in the liver, and is important in the breakdown of excess amino acids to form keto acids and in the formation of new amino acids (perhaps not available in the diet) from keto acids."
280,msmarco,_doc,MARCO_2058594,7.776064,"Eat like a caveman and shed pounds. That's the theory behind the Paleo Diet. Loren Cordain, PhD, who literally wrote the book on The Paleo Diet, claims that by eating like our prehistoric ancestors, weâll be leaner and less likely to get diabetes, heart disease, cancer, and other health problems."
281,msmarco,_doc,MARCO_5339949,7.774121,"Micronutrients For A Nourishing Diet. Taken within the context of modern food culture, Paleo can easily start to seem like an endless list of limitations: no grains, no legumes, no seed oils, no processed foodsâ¦ Paleo appears to be a series of restrictions or deviations from the ânormalâ diet that everyone would presumably eat otherwise."
282,msmarco,_doc,MARCO_8072723,7.774121,"The Paleo diet side effects like lethargy and loss of memory are caused by a lack of carbs. Despite some of the paleo diet side effects like the absence of dairy products, which restrict calcium consumption, many celebrities like Megan Fox and Ray Mears have vouched for its effectiveness in weight loss."
283,msmarco,_doc,MARCO_8072725,7.7721796,"The paleo diet does not incorporate grains. This leads to one of the major paleo diet side effects â Vitamin B deficiency. Grains are generally rich in vitamin B, which is essential for good skin and oral health.The lack of this vitamin leads to anemia and various skin issues."
284,msmarco,_doc,MARCO_262395,7.770241,"A delectable low-calorie gluten free pizza that is also suitable for those following the 5:2 fast diet, the Paleo diet as well as vegetarians. This cauliflower crust pizza is tasty and very filling and is only per 240 calories portion. (This recipe serves 2 people - for a paleo friendly version, omit the cheese."
285,msmarco,_doc,MARCO_459318,7.766369,"In 2010, she began with the Paleo diet, excluding dairy, grains, legumes, refined carbohydrates, and vegetable oils. After one year, her bilirubin levels returned to the normal range, her jaundice and constipation resolved, and her migraines reduced to roughly one every two months. Her fatigue and dermatitis, however, persisted. She followed the standard Paleo diet for a total of 20 months."
286,msmarco,_doc,MARCO_5959412,7.762504,"Sprouting 101: How to Sprout Everything from Adzuki to Lentils. Beans, beans everywhere and not a one to eat. Thatâs how I feel about trying to eat a vegetarian Paleo diet. But, thankfully, if I sprout, soak or ferment my beans, they are a bit more Paleo-friendly. In the process of changing my diet, Iâve learned some great tips on sprouting everything from adzuki beans to lentils."
287,msmarco,_doc,MARCO_8212298,7.7605743,"Indeed one of the reasons grains are excluded from the Paleo diet is due to their carbohydrate load. Another major reason is that they contain problematic anti-nutrients (i.e. lectins, saponins, enzyme inhibitors, etc.) that are well-known triggers of a leaky gut and subsequent inflammation. There are âcarb heavyâ foods allowed on the Paleo diet, such as fruit, but we recommend eating these foods in moderation."
288,msmarco,_doc,MARCO_8420965,7.758647,"The only fruit you should eat on a paleo diet is berries. Strawberries, blueberries, etc. Great comments Brittany. I work in diabetes and athero research and have to push aside all the commonly held beliefs.he only fruit you should eat on a paleo diet is berries. Strawberries, blueberries, etc. Great comments Brittany. I work in diabetes and athero research and have to push aside all the commonly held beliefs."
289,msmarco,_doc,MARCO_4461650,7.754797,"Whole 30 Review: 30 Days Without Sugar, Dairy, or Grains. I mentioned at the beginning of this month that I was doing the Whole 30 challenge. Sharing many of the principles of the Paleo diet, this eating plan eschews grains, dairy, and sugar for 30 days. mentioned at the beginning of this month that I was doing the Whole 30 challenge. Sharing many of the principles of the Paleo diet, this eating plan eschews grains, dairy, and sugar for 30 days."
290,msmarco,_doc,MARCO_4443118,7.754797,"As of this week, I have been 100% Primal. What does this mean, you may be asking? In a previous post, I outlined the differences between The Makerâs Diet, Paleo, and Primal. In essence, itâs eating the way our ancestors ate.s of this week, I have been 100% Primal. What does this mean, you may be asking? In a previous post, I outlined the differences between The Makerâs Diet, Paleo, and Primal. In essence, itâs eating the way our ancestors ate."
291,msmarco,_doc,MARCO_8637723,7.754797,"For the average weight-loss warrior, comparing diets is hard to do. Fortunately, a new study ran the numbers and found that, when it comes to weight lost, Paleo wins. For the study, researchers from the Cardiovascular Associates of Virginia Beach split 280 overweight men and women into four diet camps: Paleo, vegan, Mediterranean, and DASH (Dietary Approaches to Stop Hypertension)."
292,msmarco,_doc,MARCO_8021878,7.7394714,"In January 2015, Mark Hyman, MD, a functional medicine proponent and bestselling author, introduced the Pegan (Paleo-vegan) diet on his blog.1 Essentially, the Pegan diet combines the Paleo belief that processed foods and products of modern agriculture (such as dairy, grains, and legumes) are harmful to the body with an emphasis on fruits and vegetables that Hyman associates with veganism.2 Hyman advocates eating fresh, local, organic, and sustainably raised foods."
293,msmarco,_doc,MARCO_6210610,7.724262,"Paleo isnât low-carb or low-fat, jackass. Yes, we eat âspecificâ carbs and fats, but I assure you, my fist-sized meat portion and plate full of vegetables is NOT high-protein. Get your facts straight, blogger. Paleo is LOWER carb than the standard American diet.ere are three steps to countering these problems: 1  Eat the Bulletproof Diet. 2  Follow the macronutrient guidelines from the Bulletproof Diet and aim for around 60-80% of your calories from high quality fats and oils. 3  Cook your food correctly."
294,msmarco,_doc,MARCO_7994923,7.7212896,"Skyy Vodka (even the flavored ones) are keto friendly! (self.keto) submitted 3 years ago by echopandoraF 25 5'2 | SW: 275 (240ish Keto SW) | CW: 210 | GW 150. I started keto a few weeks back, and when drinking socially, would usually default to rum and diet coke. Oh how I missed my flavored drinks! So this weekend, my roommate brought home some Skyy Vodka Blood Orange flavored, and after googling it for a good ten minutes, I found it to be carb free and had some. The next day I tested a few times on my ketostix (I'm paranoid), and sure enough, I was still in ketosis."
295,msmarco,_doc,MARCO_274989,7.7167006,"Video: Nutrition Basics: What you need to know about the Paleo Diet. Coconut sugar is made from the sap of flower buds from the coconut palm tree. (Itâs not made from coconuts as you might think.) The sap is boiled over moderate heat to evaporate most of its water content.The final product is coconut sugar, which is caramel-coloured and tastes similar to brown sugar.ideo: Nutrition Basics: What you need to know about the Paleo Diet. Coconut sugar is made from the sap of flower buds from the coconut palm tree. (Itâs not made from coconuts as you might think.) The sap is boiled over moderate heat to evaporate most of its water content."
296,msmarco,_doc,MARCO_2073473,7.71565,"According to Mark Hyman, MD, the Pegan diet looks like this: Focus on the glycemic load of your diet. This can be done on a vegan or paleo diet, but harder on a vegan diet. Focus on more protein and fats."
297,msmarco,_doc,MARCO_2781507,7.7136903,"It has many similarities to the Atkinâs Diet, and is cousins with other popular diets like South Beach and Paleo. Below, weâve outlined exactly what the ketogenic diet is, how and why it works, and how you can get started with a ketogenic diet today."
298,msmarco,_doc,MARCO_7783019,7.7019715,"Although research on the effectiveness of diets other than the Mediterranean diet is scant, many people with RA have tried these diet approaches to help manage symptoms: 1  Vegan. This diet excludes all animal products, including meat, dairy, cheese, eggs, and fish, according to the AND. 2  Paleo."
299,msmarco,_doc,MARCO_1155169,7.700025,"A Paleo Diet Meal Plan. There is no one ârightâ way to eat for everyone and paleolithic humans thrived on a variety of diets, depending on what was available at the time. Some ate a low-carb diet high in animal foods, others a high-carb diet with lots of plants."
300,msmarco,_doc,MARCO_8092325,7.69808,"Final Thoughts on Dangers of Fad Diets Fad diets are usually very restrictive, unsustainable, unlikely to teach you any lasting healthy habits and possibly even dangerous. Fad diet examples include DASH, Atkins, Paleo, Gluten-Free, Zone and South Beach diets."
301,msmarco,_doc,MARCO_8295753,7.69808,"Vegetarian or vegan: This diet emphasizes meat and fish, and Cordain says it's impossible to follow a Paleo Diet without eating meat, seafood, or eggs. Excellent vegetarian sources of protein, such as beans and other legumes, are not allowed. Low-salt diet: The diet doesn't allow salt"
302,msmarco,_doc,MARCO_4297728,7.692258,"View Full Version : Is there any lunch meat i can eat by its self on a very low carb diet? Support for Atkins diet, Protein Power, Neanderthin (Paleo Diet), CAD/CALP, Dr. Bernstein Diabetes Solution and any other healthy low-carb diet or plan, all are welcome in our lowcarb community."
303,msmarco,_doc,MARCO_7503207,7.690321,"Support for Atkins diet, Protein Power, Neanderthin (Paleo Diet), CAD/CALP, Dr. Bernstein Diabetes Solution and any other healthy low-carb diet or plan, all are welcome in our lowcarb community. Forget starvation and fad diets -- join the healthy eating crowd! You may register by clicking here, it's free!"
304,msmarco,_doc,MARCO_1076682,7.6845207,"Please share your experience with healthy foods for diabetes diet plan. Please share your experience with diets, or types of diets that have helped you manage type 2 diabetes. Please share tips and experiences that you have found helpful in managing your diabetes when eating or dining out. Please share your experience with managing your diabetes with a paleo Diet."
305,msmarco,_doc,MARCO_4230493,7.6845207,"Can we drink it. Welcome to the Active Low-Carber Forums. Support for Atkins diet, Protein Power, Neanderthin (Paleo Diet), CAD/CALP, Dr. Bernstein Diabetes Solution and any other healthy low-carb diet or plan, all are welcome in our lowcarb community. Forget starvation and fad diets -- join the healthy eating crowd!"
306,msmarco,_doc,MARCO_4297726,7.6825914,"View Full Version : Is there any lunch meat i can eat by its self on a very low carb diet? Welcome to the Active Low-Carber Forums. Support for Atkins diet, Protein Power, Neanderthin (Paleo Diet), CAD/CALP, Dr. Bernstein Diabetes Solution and any other healthy low-carb diet or plan, all are welcome in our lowcarb community."
307,msmarco,_doc,MARCO_6605196,7.6825914,"Many dieters develop symptoms that let them know ketones are present. For many people beginning a low-carb diet, ketosis kicks in after a few days of strict adherence to the diet. In fact, many low-carbohydrate plans, such as Atkins and paleo, have an initial phase in which dieters take in extremely low amounts of carbohydrates (usually less than 25 grams per day) to kick start ketosis."
308,msmarco,_doc,MARCO_3595129,7.680664,"Welcome to the Active Low-Carber Forums. Support for Atkins diet, Protein Power, Neanderthin (Paleo Diet), CAD/CALP, Dr. Bernstein Diabetes Solution and any other healthy low-carb diet or plan, all are welcome in our lowcarb community. Forget starvation and fad diets -- join the healthy eating crowd! You may register by clicking here, it's free!"
309,msmarco,_doc,MARCO_5580814,7.676814,"A sugar-free zone. Welcome to the Active Low-Carber Forums. Support for Atkins diet, Protein Power, Neanderthin (Paleo Diet), CAD/CALP, Dr. Bernstein Diabetes Solution and any other healthy low-carb diet or plan, all are welcome in our lowcarb community. Forget starvation and fad diets -- join the healthy eating crowd! You may register by clicking here, it's free!"
310,msmarco,_doc,MARCO_3081036,7.665309,"Adopt a diet that includes foods rich in potassium and low in sodium, such as the Paleo diet, the Mediterranean diet or the DASH diet, to stay healthy and prevent heart diseases.Healthy adults should aim for 4,700 milligrams of potassium a day while keeping their sodium intake lower than 2,300 milligrams.eep your blood pressure in the optimal range by getting enough potassium, mainly from plant-based foods like vegetables, fruits and tubers, and less sodium from processed foods."
311,msmarco,_doc,MARCO_433285,7.65007,"With a friendly and enthusiastic tone, Gundry explains his view that eating a healthy diet can turn off genes in the human body that lead to weight gain and chronic disease. Gundry's rather complex three-phase diet plan focuses on reducing or eliminating grains and sugar, in favor of lean protein and large amounts of vegetables. The initial phases of Gundry's eating plan bear some similarities to the Paleolithic or caveman diet, as presented in books such as Ray Audette's NeanderThin or Loren Cordain's The Paleo Diet."
312,msmarco,_doc,MARCO_7293861,7.6462793,"Low-Carb and Ketogenic Diets. Ketosis is a popular weight loss strategy. Low-carb eating plans include the first part of the Atkins diet and the Paleo diet, which stress proteins for fueling your body. In addition to helping your burn body fat, ketosis can make you feel less hungry.s part of this process, it makes ketones. If you're healthy and eating a balanced diet, your body controls how much fat it burns, and you don't normally make or use ketones. But when you cut way back on your calories or carbs, your body will switch to ketosis for energy."
313,msmarco,_doc,MARCO_954418,7.6411667,"Below, youâll find our Paleo diet Food List. This is a list of foods and to what extent they are accepted as Paleo. Our guidelines are created using a mixture of all of the Paleo gurusâ philosophies and research, our own beliefs, and what is realistic to implement in your daily life."
314,msmarco,_doc,MARCO_3510137,7.635316,It's all good and well to talk Paleo and Primal and 'no grain' this and 'no dairy' that and 'low Omega-6 to Omega-3 ratios' and blah blah blah. But if the whole concept of Paleo or 'evolutionary eating' is foreign to you it can be difficult to conceptualise what a Paleo diet would actually look like on a day-to-day basis.
315,msmarco,_doc,MARCO_6914805,7.6333694,"Living Paleo For Dummies. The foods to avoid in the Paleo (or cave man) diet are ones that wreak havoc on your health and sabotage weight-loss goals. Unapproved Paleo foods create hormonal imbalances, trigger inflammation, and make you age more quickly."
316,msmarco,_doc,MARCO_7951914,7.6294813,"As the Paleo/Primal movement picks up steam, we are seeing more and more Paleo friendly restaurants pop up everywhere. If you live in the San Diego area checkout our list of top Paleo Diet friendly places to grab a bite. If dinning in is more your style, checkout Grass Fed Beef in San Diego."
317,msmarco,_doc,MARCO_862975,7.6275406,"The Place of Dairy on a Paleo Diet. When it comes to dairy and Paleo, some debates pop-up. Dairy definitely is in a grey zone. In the strict Paleo sense, dairy of any form was not consumed in the Palaeolithic Era, other than human milk in infancy of course. It just wasnât very practical to milk wild game."
318,msmarco,_doc,MARCO_1155166,7.6260176,"These five groups, consisting of proteins, dairy, fruit, vegetables, and grains, are meant to categorize the different types of food necessary for people to maintain a healthy and balanced diet. If you subscribe to the supposed health benefits of the paleo diet, then the USDAâs food pyramid goes out the window. Well, the grains and dairy do at least. Paleolithic humans did not consume dairy or grains, because they were living in a pre-agricultural era."
319,msmarco,_doc,MARCO_5943832,7.610158,"If you have recently gone paleo, you may be wondering what you can substitute for milk in your daily life that fits within the paleo diet. Coconut milk is arguably the best paleo milk substitute, as it is thick, creamy and versatile. The healthiest form of coconut milk can be obtained in a few ways -- the first is to extract the milk directly from whole coconuts. Whole coconut milk can also be found in cans or made from dried coconut flakes at home."
320,msmarco,_doc,MARCO_2058589,7.6031165,"Most of us are familiar with the five major food groups, as put forward by the US Department of Agriculture. These five groups, consisting of proteins, dairy, fruit, vegetables, and grains, are meant to categorize the different types of food necessary for people to maintain a healthy and balanced diet. If you subscribe to the supposed health benefits of the paleo diet, then the USDAâs food pyramid goes out the window. Well, the grains and dairy do at least. Paleolithic humans did not consume dairy or grains, because they were living in a pre-agricultural era."
321,msmarco,_doc,MARCO_986641,7.602338,"Experts weigh in on Mediterranean, DASH, or Keto diets for losing weight and staying healthy. Here are the diets you should try to stay in shape and manage diseaseâand the ones you should avoid. What are the best (and worst) diets for 2018?"
322,msmarco,_doc,MARCO_8322551,7.60038,"The Complete Ketogenic Diet Guide For Beginners Click to pin this guide! This guide was designed to help you kick-start your keto diet and get you into ketosis! Below are the basics of the ketogenic diet, how to get started and how to guarantee success."
