,_index,_type,_id,_score,_source.body
674,msmarco,_doc,MARCO_1646655,6.6908193,"Itâs really hard to drink really great beers on a keto, low carb diet. No more craft beers or IPAs. Youâre doomed to mostly light beers which generally just leave me longing for something more. Basically, you want to avoid anything red, amber or dark."
675,msmarco,_doc,MARCO_1842727,6.6908193,"Now that you know what ketosis is and how long it can take, you need to know when it is working. In your mind, you may be a little impatient looking for these signs of ketosis. I wanted to break down how you will know it is working. One major sign is that your sugar cravings are going down. Keep in mind that you canât do the Keto diet on and off."
676,msmarco,_doc,MARCO_3013720,6.6908193,"Protein intake during the first 3 weeks. Adequate protein intake and developing ketosis are both critical for maximising fat loss and sparing muscle mass during the ketogenic diet. However, it will take up to 3 weeks before your body gets keto-adapted (in some cases even more)."
677,msmarco,_doc,MARCO_4209540,6.688871,"Alcoholic drinks. Beer is not one to recommend if you are on a keto low carb diet. Beer contains maltose, which is quickly absorbed by the body and 20-40% of the energy come from carbohydrates (depending on strength). Wine you can drink occasionally. It is important not to choose the sweet wines."
678,msmarco,_doc,MARCO_5126872,6.688871,"Ketosis is a natural process the body initiates to help us survive when food intake is low. During this state, we produce ketones, which are produced from the breakdown of fats in the liver. The end goal of a properly maintained keto diet is to force your body into this metabolic state."
679,msmarco,_doc,MARCO_6958201,6.688871,The amount of carbs youâre allotted each day and the best type of keto diet for you to follow will depend on: 1  Your current weight. 2  Your current body fat percentage. 3  Your height. 4  Your gender. 5  Your fitness and activity levels.
680,msmarco,_doc,MARCO_7277650,6.688871,Keto Bars is a snack replacement bar that is specifically designed for a ketogenic diet. It has no added sugar and is completely free from gluten and nuts. It contains whey protein concentrate as its source of protein and coconut plus heavy cream as its source of fat.
681,msmarco,_doc,MARCO_665868,6.6869245,"Nuts are a great, protein-rich food perfect for adherents to the keto diet. Opt for nuts packed with healthy fats like Brazil nuts, pecans, and walnuts. One serving contains between one to two carbs plus fiber to keep your blood sugar level."
682,msmarco,_doc,MARCO_818039,6.6869245,"When ketones are your sole source of energy, you have a buildup, and thus, you deplete your phosphorous and calcium. This can lead to stress fractures and bone problems. Headaches, bad mood, and bad memory. Because carbs are the optimal energy source for the brain, the keto diet starves your brain of fuel."
683,msmarco,_doc,MARCO_1141469,6.6869245,"There are basic signs and symptoms that indicate that youâre in ketosis, but please note that Iâm differentiating between the signs of keto flu (covered in the post Iâm linking to) that many experience in the first days of a ketogenic diet, and the feeling of being in ketosis when the flu has subsided:"
684,msmarco,_doc,MARCO_2012374,6.6869245,"Once you give up most carbs, make sure you include foods like avocados (potassium), nuts (magnesium), bone broth or sauerkraut (sodium) in your diet. If you want to learn more, have a look at my post here: Keto-flu and Sufficient Intake of Electrolytes. Please, feel free to pin it and share it with your friends."
685,msmarco,_doc,MARCO_3726051,6.6869245,"I tell my wife, if its green, we can eat it. I lose about 8 lbs in 2 days whenever I go into Keto after being away from the diet for any lengthy period. Its mostly water weight. If you go off for five days and come back, you'll lose 5 right off the bat... excess water dropping off."
686,msmarco,_doc,MARCO_5037659,6.6869245,"An average dinner for someone on keto is a moderate portion of protein with some added fat and a side dish of green leafy vegetables with added fat. Though sometimes you might just want a heavy, comforting dish that gets rid of the cravings you have. Itâs definitely possible to do this on a low-carb diet."
687,msmarco,_doc,MARCO_8073562,6.6869245,"A proper keto low-carb diet always means you get a lot more energy from natural fat (like butter or olive oil, etc.). The body has two main sources of energy: carbs and fats. Take away most of the carbs and the body switches to burning fat for energy."
688,msmarco,_doc,MARCO_8312584,6.6869245,The most common motivation why people should not go on a keto diet is the risk of having a heart attack or similar heart problems. There is a research report published by researchers at the Cincinatti Childrenâs Hospital Medical Center that describes possible life threatening cardiac complications.
689,msmarco,_doc,MARCO_4209546,6.68498,"This is Day 10 of my new series, 31 Days on a Keto Diet. I am participating in 31 Days, an online writing challenge started by home blogger, Myquillyn Smith (The Nester), and now hosted by Crystal Stine, where bloggers pick one topic and write a post on that topic every day in October."
690,msmarco,_doc,MARCO_468082,6.68498,7 Comments on Eat Keto Meal Plan. Iâm trying to start the ketogenic diet but I canât seem to find much information on how much to eat and when to eat or what to eat !! reddit. you can download the app on your smartphone and it is absolutely amazing. The app is called reddit is fun.
691,msmarco,_doc,MARCO_2173951,6.68498,"This understanding, based on real life data from people following a ketogenic dietary approach, will help us fine tune our diet and lifestyle to suit our goals whether they be: 1  weight loss, 2  diabetes management, 3  therapeutic keto, or. 4  athletic performance."
692,msmarco,_doc,MARCO_1823441,6.68498,"The keto flu is when youâre going through withdrawals from not eating carbohydrates. When you first start a ketogenic diet, youâre body will be in sort of a shock stage. Being that we are conditioned from birth to depend on glucose as a fuel source, our body is kinda confused on whatâs happening."
693,msmarco,_doc,MARCO_3132403,6.68498,"The fastest way to reach ketosis using your diet is by limiting carbs to 20% of total calories per day, but some low carbers eat ver y low amounts of carbs â less than 5%. How to Eat Carbs for Keto. Choose the lowest carb fruits and the lowest carb veggies."
694,msmarco,_doc,MARCO_2793473,6.68498,"KetoShred combines the most recommended ketosis supplements in one convenient daily supplement to help accelerate your weight loss goals while minimizing keto flu symptoms by replenishing essential vitamins, micro-nutrients, electrolytes, & enzymes needed most during a ketogenic or low carbohydrate diet."
695,msmarco,_doc,MARCO_3726050,6.68498,"This approach is referred to as carb-loading. You basically remain on the standard keto diet five days out of the week (normally Monday through Friday). And on the weekends (typically 24 â 48 hours), you eat around 500 â 600 grams of carbs to replenish muscle glycogen."
696,msmarco,_doc,MARCO_4986997,6.68498,"When planning what to eat on a keto diet you need to stay away from starchy vegetables. Include lots of broccoli, cauliflower, lettuce, kale, dark green lettuce varieties, cucumbers, asparagus, and zucchini. You can also have things like cabbage, Brussels sprouts, celery, chives, and fresh herbs and spices."
697,msmarco,_doc,MARCO_4335805,6.68498,"Iâve seen high class resturants even hire people just from their scrambled eggs. Bacon and eggs is a staple breakfast for many people on the keto diet, so I figured Iâd add this in here to really let you take it to the next level! The key to great scrambled eggs is to never overcook, and always add more richness to them."
698,msmarco,_doc,MARCO_1137152,6.683037,"However, incorporating certain keto-friendly foods that are rich in protein and healthy fats into a well-rounded diet can get you to your pounds-dropping goals faster. That's because these eats help you build more lean muscle, prevent blood sugar highs and lows, and keep cravings at bay. Subscribe X Close."
699,msmarco,_doc,MARCO_7828962,6.683037,"24 Benefits of the Ketogenic Diet. You may have heard the term âketosisâ, âketoâ or âketogenic dietâ thrown about in various health, weight-loss and sports performance blogs. The âketo dietâ is growing in popularity â especially in the circles I just mentioned."
700,msmarco,_doc,MARCO_8101762,6.683037,Helpful Links. 1  Overview of PSMF Livestrong.com article. 2  Printable PSMF Basic Diet Guidelines. 3  Some FAQ. 4  Forum post on Atavis' PSMF Excel Macro Calculator at bodybuilding.com. Direct Download Link. / 5 r/keto.
701,msmarco,_doc,MARCO_7877583,6.683037,"Keto Bars are made with love and with the exact types of ingredients that ketogenic dieters are looking for. Out with junk ingredients, in with ingredients like natural dark chocolate, raw coconut, heavy cream, and butter. 18g Fat. 2g Net Carbs. 7g Protein. Gluten Free."
702,msmarco,_doc,MARCO_8322550,6.683037,The best way to avoid (or end) the keto flu is to add more sodium and electrolytes to your diet. 1  Here are the most effective (and tasty) ways to get more sodium: 2  Adding more salt to your food. 3  Drinking soup broth. 4  Eating plenty of salty foods like bacon and pickled vegetables.
703,msmarco,_doc,MARCO_900069,6.681096,"Cut Carbs to Reach Ketosis. The fastest way to reach ketosis using your diet is by limiting carbs to 20% of total calories per day, but some low carbers eat very low amounts of carbs â less than 5%. How to Eat Carbs for Keto. Choose the lowest carb fruits and the lowest carb veggies."
704,msmarco,_doc,MARCO_4235138,6.681096,"Natural fat, high-fat sauces: Butter and cream are both great to use in cooking food. These will help you feel full and they make food taste great! Hollandaise sauce is a popular one for the keto diet, you can make your ow. Coconut oil and olive oil are also popular options for cooking."
705,msmarco,_doc,MARCO_4209543,6.6791573,"No, you can not drink really good beer on a keto diet. No more craft beers or IPAs. Anything red, amber or dark is off the table. Some low carb beer picks include (per 12 oz/bottle): Bud Select 55: 55 calories, 1.9 carbs. MGD 64: 64 calories, 2.4 carbs."
706,msmarco,_doc,MARCO_1250223,6.6791573,"Approved spirits on a keto, low carb diet include: 1  Vodka (Three Olives, Absolut, Grey Goose, etc.) 2  Rum (Captain Morgan, etc) 3  Gin (Tanqueray, Beefeater, etc) 4  Tequila. Whiskey (Jack Danielâs, etc.) 5  Scotch. Brandy.  Cognac (Hennessy, etc.)"
707,msmarco,_doc,MARCO_3132406,6.6791573,"The fastest way to reach ketosis using your diet is by limiting carbs to 20% of total calories per day, but some low carbers eat ver y low amounts of carbs â less than 5%. How to Eat Carbs for Keto. Choose the lowest carb fruits and the lowest carb veggies. Cover them with healthy fats."
708,msmarco,_doc,MARCO_4618768,6.6791573,"Keto adaptation occurs when shifting the body away from glucose and towards fat metabolism. The adaptations to ketosis are complex and involve most systems of the body. The major adaptations occur in the body's tissues, especially the brain, liver, kidney and muscles (Lyle McDonald, The Ketogenic Diet, chapter 5, 1998)."
709,msmarco,_doc,MARCO_1250227,6.67722,"Itâs really hard to drink really great beers on a keto, low carb diet. No more craft beers or IPAs. Youâre doomed to mostly light beers which generally just leave me longing for something more. Basically, you want to avoid anything red, amber or dark. Some low carb beer picks include (per 12 oz/bottle):"
710,msmarco,_doc,MARCO_5473763,6.67722,"How to achieve a healthy low-carb lifestyle 46:42 How should you formulate a low-carb or keto diet exactly in order to maximize success? How much fat, protein and carbs should you eat? The 5 common mistakes on LCHF 09:25 Is it hard to reach your goal weight, are you hungry or do you feel bad?"
711,msmarco,_doc,MARCO_7238095,6.67722,"Welcome. This page has everything you need to know âHow To Start A Low-Carb Dietâ. Shopping lists, a free challenge, what to eat, what to avoid and recipes. UPDATE: take a look at the NEW Low-Carb Keto Shop on Amazon. So watch the video below, and letâs get started! How To Start a Low Carb Diet"
712,msmarco,_doc,MARCO_8122445,6.675285,"Keto coffee is the perfect morning or afternoon beverage for someone following a ketogenic diet. Itâs also a way of giving this ketogenic philosophy of eating a try. Instead of loading your coffee with carbohydrate-rich milk and sugar, youâre adding in seriously beneficial fats like beef gelatin and bone broth collagen."
713,msmarco,_doc,MARCO_1393978,6.673352,"What do I eat? The Keto Diet is a low carb, high fat, medium protein plan designed to start a natural process called ketosis. Once in ketosis, your body burns fat instead of sugar and youâll see accelerated weight loss as a result. The ideal ratio of fat to protein to carbs is 65% / 30% / 5%."
714,msmarco,_doc,MARCO_4442655,6.673352,"If you are on a ketogenic or very low carb (VLC) diet (e.g. with 50-100gr carb/day and/or eating ketone producing MCT oils such as coconut oil), you may have a dilemma of having high Blood Glucose (BG) despite eating LC: If you are keto adapted, that is, your body is using ketones and even though you have sufficient insulin (say >5 microU/ml) your ..."
715,msmarco,_doc,MARCO_1393986,6.667563,"Rules of a basic keto diet plan: 1  20 net carbohydrates per day (thatâs the total carbs minus fiber) 2  Eat meats and dairy that are 1-2 carbs or less (most meats have zero) 3  Eat vegetables that are 5 or less. 4  Eat them baked, fried, boiled, stir-fried, sauteed, roasted or microwaved."
716,msmarco,_doc,MARCO_4578061,6.665637,"Recent Posts. 1  The Keto Diet Plan â Lose Weight, Repair DNA and Increase Physical Strength. 2  Cold Water Vs Warm Water: One of Them is Damaging to Your Health. 3  Give Me 10 Minutes, Iâll Give You The Truth About Vitamin B12 Deficiency. 4  10 Tips to Strengthen Your Knees and Keep Them Healthy."
717,msmarco,_doc,MARCO_2477437,6.663713,"1Why Keto diet is bad for you and can prove fatal. 2Believe it or not: Aam Aadmi Party spent Rs 1 crore of taxpayers money on chai and samosa. 3How to pair your cooking with your guests' favorite wines, according to a top winery chef. 4A Gurgaon cafÃ© is serving delicious 200-calorie sandwich and zero sugar milk shakes."
718,msmarco,_doc,MARCO_6666455,6.6598706,"Ketogenic diets force your body to adapt to using fat for fuel when glucose (from carbs) is not present, this is known as ketosis. Ketones are a by-product of ketosis and keto sticks (also known as ketostix or ketosticks) are urine testing strips which detect the presence of ketones in the blood. They are small plastic strips with an absorbent pad on the end, you urinate on the absorbent pad and it changes colour to reflect the amount of ketones present in your urine."
719,msmarco,_doc,MARCO_1807244,6.6560354,"Latest posts by Johan Bengtsson (see all) 1  Weight loss smoothie recipe - August 25, 2013. 2  Low carb ice cream recipes - August 22, 2013. 3  Cancer diet book recommendations - August 21, 2013. 4  Ketostix to know if you are in ketosis or not - August 17, 2013. 5  Keto breath, tips to help improve it - July 30, 2013."
720,msmarco,_doc,MARCO_6739572,6.6560354,"Supplementing your diet with 7 Keto will help increase energy levels and decrease stored fat, a combination everyone can be happy with. L-Carnitine. Although naturally produced by your body, L-Carnitine is still one of the best supplements to take when it comes to burning fat and boosting energy. L-Carnitine is an amino acid thatâs main priority is to transport fatty acids to your mitochondria, the furnace that uses them as fuel to create energy."
721,msmarco,_doc,MARCO_4442653,6.652208,"If you are on a ketogenic or very low carb (VLC) diet (e.g. with 50-100gr carb/day and/or eating ketone producing MCT oils such as coconut oil), you may have a dilemma of having high Blood Glucose (BG) despite eating LC: If you are keto adapted, that is, your body is using ketones and even though you have sufficient insulin (say >5 microU/ml) your body tries to keep your BG higher than necessary, e.g. above 100-110 mg/dl."
722,msmarco,_doc,MARCO_6286971,6.6483874,"Anywhere from 2 â 7 days, depending on your body type, activity levels, and what youâre eating. The fastest way to get into ketosis is to exercise on an empty stomach, restrict your carbohydrate intake to 20g or less per day, and be vigilant with your water intake.ou can view the 30 Day Keto Diet Plan to get an idea of what I eat on a regular basis, and how it all plays into calculating your macros. What your job here is, is to make it fit into your own macros. That means adjusting the portion sizes to make the calories higher or lower."
723,msmarco,_doc,MARCO_5797173,6.6483874,"Ketosis is an eating plan where the body uses ketones to fuel the brain and body instead of glucose like most people use when on the SAD (standard American diet). It can be very helpful for blood sugar and consistent energy because fat is a very stable source of fuel.hen you are in ketosis, fat will need to be 70-85% of your calories. Make sure to eat only healthy fats listed here: 3. Get A Meter. Get a ketone blood meter (find resources here from the King of Keto: Jimmy Moore) and the testing sticks."
724,msmarco,_doc,MARCO_7293867,6.6483874,"This is normal. Once your body becomes keto-adapted, your body will be able to fully utilize the fats as its primary source of energy. Many studies done have shown that there is no long term drop in performance for professional athletes on a very low carb ketogenic diet.ince the glucose is being used as a primary energy, your fats are not needed, and are therefore stored. Typically on a normal, higher carbohydrate diet, the body will use glucose as the main form of energy. By lowering the intake of carbs, the body is induced into a state known as ketosis."
725,msmarco,_doc,MARCO_1955020,6.644574,"Brain Octane. Give Your Brain The Fuel It Needs! If youâve ever heard of the Keto Diet, then youâre in for a treat. Even if you havenât, then youâre about to discover a new way to get a HUGE surge in mental and physical energy. Brain Octane gives your body and mind a huge source of energy that serves to fuel it for even the most difficult tasks. It uses a specific component that scientists call a âmedium chain triglycerideâ which is thought to be used in the process of ketosis."
726,msmarco,_doc,MARCO_8122637,6.644574,"Since the fiber doesnât count in your daily carb intake you can subtract it. That leaves you with net carbs. If we take the example I mentioned in the beginning: The bag of steamed broccoli had a total of 12 grams of carbs but 4 of them was fibre.The net carb total is 8 grams and thatâs the number you count.ell, first of all. If you want to know how to count carbs you have to look at the carbs in everything you eat, vegetables included. The rule of thumb when youâre on the lchf/keto diet is to only eat vegetables that grow above the ground."
727,msmarco,_doc,MARCO_4397306,6.6443696,Turkey Meatballs - Paleo; Pork Stew; Paleo Wrap; Bacon; Paleo Zucchini Pasta; Cauliflower Rice; See all items from Paleo
728,msmarco,_doc,MARCO_4894544,6.637497,"For another delicious Paleo breakfast recipe, try my Paleo Pancakes recipe. If you and your family are looking for a wealth of delicious Paleo recipes, check out my friend Sebastian Noelâs Paleo Recipe Book."
729,msmarco,_doc,MARCO_4904228,6.637497,Be sure to see our list of Paleo-approved foods to know what you can have. P.S. Take a look at the Paleo Grubs Book. With 470+ easy-to-prepare Paleo recipes in 17 comprehensive categories it is the only Paleo book you will ever need.
730,msmarco,_doc,MARCO_1891593,6.6369696,AAA. 1  Home. 2  Prediabetes Prediabetes Risk factors. 3  Type 1 Type 1 Diabetes Type 1 diabetes symptoms. 4  Type 2 Type 2 Diabetes Type 2 diabetes symptoms. 5  Food + Recipes Food + Drink Recipes. 6  Living With Diabetes Blood glucose Blood glucose level ranges. 7  Treatment Low carb Keto diet Diabetes drugs Alpha glucosidase inhibitors.
731,msmarco,_doc,MARCO_4894545,6.635542,"It is really hard to see the benefits of eating Paleo for kids which makes it a real challenge to get them on board with the Paleo lifestyle. If your kids are having trouble adapting to Paleo breakfasts, my gluten-free Paleo Breakfast Bread will quickly change that."
732,msmarco,_doc,MARCO_2554189,6.635282,"# 57 Assimilation and role of the liver. Assimi l a ti on is the movement of dig este d f oo d molecules into the cells of the body where they are used, becoming part of the cells. - Some amino acids are transaminated to produce a different amino acid. - 2  The rest are deaminated to produce ammonia (NH3) and a keto acid. + 3  NH3 is converted into urea, which is transported to the kidneys and excreted. + 4  The keto acid is used primarily as energy for liver cells."
733,msmarco,_doc,MARCO_963924,6.631469,"Figure-4-The Î±-amino group of a substrate amino acid displaces the enzyme lysine, to form a Schiff base linkage to PLP. Figure-5- A different a-keto acid reacts with PMP (Pyridoxamine phosphate) and the process reverses, to complete the reaction. Figure-6 -Overall reaction showing the role of B6-Phosphate, the transfer of Î±-amino group from donor amino acid to Pyridoxal phosphate forms Pyridoxamine phosphate, and a keto acid."
734,msmarco,_doc,MARCO_7238096,6.6200376,Itâs got an archive of over 25 recipes (and growing). Check it out at the link below and eat well! Awesome Paleo Breakfast Ideas. If youâre still looking for more awesome recipes after thatâ¦wellâ¦youâre in luck. Hereâs 101 more awesome and easy paleo breakfast ideas. 101 Paleo Breakfast Ideas & Recipes. Apple Cider Paleo Donuts
735,msmarco,_doc,MARCO_8479732,6.6181164,"Reply. Legumes are not considered Paleo, especially if you are on the Auto-Immune Protocol (AIP). People with healthy guts might tolerated them occasionally, but I havenât seen anyone recommending legumes as part of a regular paleo lifestyle.eply. Legumes are not considered Paleo, especially if you are on the Auto-Immune Protocol (AIP). People with healthy guts might tolerated them occasionally, but I havenât seen anyone recommending legumes as part of a regular paleo lifestyle."
736,msmarco,_doc,MARCO_389922,6.6180835,"Examples of popular arginine analogs include L-arginine, arginine malate, arginine alpha-ketoglutarate, arginine keto-isocaproate and/or arginine ethyl ester. Consult with your doctor before adding any supplement to your weight-loss program.L-Arginine has many important functions in the human body, but its most relevant effects for weight loss are boosting levels of nitric oxide (NO) and HGH (human growth hormone), according to Everything You Need to NO by Jordana Brown.hoto Credit littlehenrabi/iStock/Getty Images. L-Arginine may have potent effects on your weight-loss results. As an essential amino acid, arginine exists in your diet as a component of protein-rich foods."
737,msmarco,_doc,MARCO_1404928,6.612375,"The Paleo Autoimmune Protocol page is one of the most popular pages on this site and questions about it regularly arrive in my inbox. That tells me that a lot of people have autoimmune disease and are looking to deal with it using the paleo diet.An expert in this area is Sarah Ballantyne, aka The Paleo Mom.o if youâre suffering from autoimmune disease, her site really is a one-stop shop for you! My own experience with the AIP is that it can be very hard to stick to so I sat down for virtual coffee with Sarah, and asked her a few questions about her experience with paleo and the autoimmune protocol."
738,msmarco,_doc,MARCO_8479733,6.610468,"The Autoimmune Paleo Protocol, shortened to AIP or simply Autoimmune Paleo, provides the body with building blocks for rebuilding gut health. The common factor between all types of autoimmunity is a permeable intestinal lining, also called leaky gut.he Autoimmune Paleo Protocol, shortened to AIP or simply Autoimmune Paleo, provides the body with building blocks for rebuilding gut health. The common factor between all types of autoimmunity is a permeable intestinal lining, also called leaky gut."
739,msmarco,_doc,MARCO_8123797,6.60477,"Hunan Beef Recipe â 15 Minutes (Paleo, Low Carb, Gluten-free): Pin it to save for later! Hunan Beef Recipe - 15 Minutes (Paleo, Low Carb, Gluten-free) This easy Hunan beef recipe takes less than 15 minutes to make! Naturally paleo, gluten-free, and low carb Chinese food that's full of flavor. Hunan Beef Recipe - 15 Minutes (Paleo, Low Carb, Gluten-free) This easy Hunan beef recipe takes less than 15 minutes to make!"
740,msmarco,_doc,MARCO_2870762,6.565593,"The paleo diet runs on the same foods our hunter-gather ancestors supposedly ate: fruits, vegetables, meats, seafood, and nuts."
741,msmarco,_doc,MARCO_4006098,6.565593,"Weâve also broken this list down into the specific food groups, so you can see which meats, vegetables, fruits, nuts, and fats are on the paleo diet."
742,msmarco,_doc,MARCO_1248267,6.565593,"The Paleo diet is the healthiest way you can eat because it is the ONLY nutritional approach that works with your genetics to help you stay lean, strong and energetic!"
