,_index,_type,_id,_score,_source.body
467,msmarco,_doc,MARCO_1807241,7.238121,In most restaurants there are okay alternatives for you when being on LCHF diet or keto diet. It just requires you to know what to avoid and also try to ask the waiter to change a few ingredients. Also sometimes when you know ahead that you will go out to a restaurant it could be good to eat a little more before to ensure you do not end up being hungry at the restaurant and eating things that are not good for you.
468,msmarco,_doc,MARCO_3726048,7.238121,"Maybe this Ketosis Diet thing Aint For Me! Thatâs right, it was an epic fail!â¦ After three weeks of this carb, no-carb diet thing I was trying. I was just about give up on it until I came across a keto expert by the name of Stephanie âketoâ Persons on YouTube."
469,msmarco,_doc,MARCO_5548492,7.238121,"On a diet as strict as the keto diet, you have to be hyper aware of everything you put in your body, and alcohol provides absolutely zero nutritional value. Depending on your drink of choice, you could be consuming an excess amount of sugar and carbs too â an easy way to put on weight."
470,msmarco,_doc,MARCO_1324982,7.2365556,"Read on for expertsâ takes on the must-eat and must-avoid list for all you CrossFitters taking the nation by storm. CrossFit is often associated with Paleo; not everything on here is, so if you're curious about that diet plan, check out Your Complete Plan to Go Paleo for a Day! First, The Best Foods. for CrossFitters."
471,msmarco,_doc,MARCO_1916379,7.2365556,"According to Dr. Cordain on The Paleo Diet website, ancient humans quenched their thirst with pure water because that's all they had available to them. While you can certainly drink small amounts of other Paleo-approved drinks, the bulk of your liquid consumption should be plain water."
472,msmarco,_doc,MARCO_903817,7.2361746,"Certain types of dairy can be enjoyed on the keto diet! Butter, cheese, full fat yogurts and heavy cream â this is not your typical diet fare! When eating dairy, you will generally want to choose ingredients that have a lower amount of lactose. Lactose is a sugar that will spike your blood sugar."
473,msmarco,_doc,MARCO_2915055,7.2361746,"âMost people can tolerate moderate ketosis, but most people will not be able to stick to a true ketogenic diet because of the side effects,â says Siegfried. Weakness, fatigue, and horrible B.O. and breath are classic bodily responses to a keto diet, she says. Yum."
474,msmarco,_doc,MARCO_8322552,7.2361746,"âYou can get motivated by this weight loss,â he said. He added the keto diet is simple in concept. It eliminates a food group, making it easier for people to follow. He said the diet also makes people feel full despite having fewer calories and it gives them more energy."
475,msmarco,_doc,MARCO_4894335,7.2346034,"The Paleo diet can be toxic and even contribute to cancer if you are eating large amounts of animal products, especially fried meats. And Paleo can be a very healthy choice if you are eating mostly vegetables and nuts, with organic, free-range meats only on rare occasions."
476,msmarco,_doc,MARCO_7565572,7.2346034,"Pre-Paleo I would eat crackers or whole wheat toast with diet ginger ale after vomiting from, say, food poisoning, but I'm not about to go back to my old ways and make myself even sicker. What does the Paleo community recommend for recovering from stomach illness?"
477,msmarco,_doc,MARCO_3623248,7.23423,"Hereâs what you need to know about âketoâ and why some health experts believe it's good for your body â especially your brain. Fasting and other ketogenic-like diets have been used to treat conditions like epilepsy for thousands of years. And in fact, a version of the keto diet has been traced back to 500 BC."
478,msmarco,_doc,MARCO_7880663,7.23423,"To the uninitiated, keto defies all common sense, inviting skeptics to wave it off as an unnatural âbacon-and-steakâ fad diet. Yet versions of the ketogenic diet have been used to successfully treat drug-resistant epilepsy in children since the 1920s â potentially even back in the biblical ages."
479,msmarco,_doc,MARCO_8406647,7.23423,Ketosis results in a steady flow of fuel (ketones) to the brain. And on a ketogenic diet you avoid big swings in blood sugar. This often results in the experience of increased focus and improved concentration. A lot of people specifically use keto diets specifically for increased mental performance.
480,msmarco,_doc,MARCO_6273408,7.232653,"Check out these delicious and healthy low carb and paleo bread recipes to help you stick to your diet. When you make a huge lifestyle change like going low carb, paleo or grain-free, you often think you have to say goodbye to some of your old favourites."
481,msmarco,_doc,MARCO_903820,7.2322874,"The keto diet is also known as the low carb diet, and is based around placing the body into a state of ketosis. When we eat foods high in carbohydrates, such as sugary cereal, cake and bread, the body produces glucose and insulin. Posh bashing is a small price to pay for a flotilla of privileges."
482,msmarco,_doc,MARCO_1842604,7.2322874,"Tzatziki Sauce is the white Greek yogurt and cucumber sauce often served on Gyros, and it's delicious no matter what you serve it on. And Tzatziki is low-carb, Keto, gluten-free, low-glycemic, and South Beach Diet friendly; use the Recipes-by-Diet-Type Index to find more recipes like this one."
483,msmarco,_doc,MARCO_5105567,7.2322874,"Since your body will immediately use these carbs during these two windows, thereâs next to no risk of your ketogenic state being reversed or adversely affected. This targeted ketogenic diet will ensure proper sustenance for sports performance â and intense physical activity in general â while following the keto diet."
484,msmarco,_doc,MARCO_2199003,7.230705,"Ari â I donât eat any of those things either, actually. Whey and oats arenât Paleo, and nuts can be avoided by eating more of everything else :) Sorry to be vague, but with all the ingredients that are a-ok on the Paleo diet, the options are endless. Check out our recipes at http://www.paleoplan.com/recipes."
485,msmarco,_doc,MARCO_4894337,7.230705,"Yes, the pegan diet (paleo plus vegan) has arrived. The idea: By taking the best of popular paleo and vegan plans, you get a surprisingly sustainable way of eating. (Even renowned wellness expert Dr. Mark Hyman recently declared himself a pegan.)"
486,msmarco,_doc,MARCO_6914807,7.230705,"Halibut â Halibut consistently ranks as one of the healthiest fish you can eat, and it makes a great addition to the Paleo diet. This is because it is rich in vitamins and minerals, as well as omega-3s. Eating Paleo helps to make sure that you get more omega-3s than omega-6s."
487,msmarco,_doc,MARCO_6914806,7.230705,"Related Book. The foods to avoid in the Paleo (or cave man) diet are ones that wreak havoc on your health and sabotage weight-loss goals. Unapproved Paleo foods create hormonal imbalances, trigger inflammation, and make you age more quickly."
488,msmarco,_doc,MARCO_7588732,7.230705,"Hereâin comic formâis my condensed âelevator pitchâ explanation of Paleo (from my cookbook, Nom Nom Paleo: Food for Humans): Admittedly, the âcavemanâ label makes this sound like a weird fad diet, but trust me: it isnât."
489,msmarco,_doc,MARCO_2343366,7.2303457,"Our keto calculator uses body fat percentage to calculate your lean body mass. Using this number, weâre able to calculate how much protein you need to sufficiently lose weight without losing excess muscle. Eating too little or too much protein on a ketogenic diet (or any diet) can lead to dangerous or unwanted results."
490,msmarco,_doc,MARCO_4045379,7.2303457,"Bottom line: consuming too much protein on a higher-fat diet can prevent your body from using stored fat for energy.[8] Protein levels on keto diets are high enough to maintain, and in some cases increase, lean body mass, but a common mistake is to over-consume protein rather than increasing fat intake."
491,msmarco,_doc,MARCO_6334040,7.2303457,Itâs called the keto diet.. People promoting the diet say it uses the bodyâs own fat-burning system to help people lose significant weight in as little as 10 days. Future brides may be tempted to try it as a quick and easy way to slim down before the big day.
492,msmarco,_doc,MARCO_6958205,7.2303457,"Keep in mind that you are on a keto diet, so you have to calculate your net carbs. Take your total carb intake and subtract out any fiber you have. For the day, my total net carbs = 34g â 12g = 22g â not bad! This isnât my actual daily diet, but I put together a quick example of what you should be looking at."
493,msmarco,_doc,MARCO_1559450,7.2287583,"To keep it short, No. The simple reason is that Hummus is made from Chickpeas (also known as Garbanzo Beans) and are classified as Legumes. Legumes such as Chickpeas, Peanuts, Lentils etc are not allowed on and as a result, Hummus is not a Paleo friendly food (Check out my list of foods not allowed on the Paleo diet)."
494,msmarco,_doc,MARCO_1757414,7.2287583,"My Non-Dairy Paleo Menu for Ketosis. When I tried ketosis on a non-dairy Paleo diet, this is the menu I came up with to try to meet Jimmyâs fat/protein/carb ratios. This is what I ate when I tried ketosis because I donât eat dairy."
495,msmarco,_doc,MARCO_1479320,7.226814,"The Paleo Solution: The Original Human Diet. I wrote a book called The Paleo Solution which went on to become a New York Times Bestseller. This book incorporates the latest, cutting edge research from genetics, biochemistry and anthropology to help you look, feel and perform your best."
496,msmarco,_doc,MARCO_324713,7.2248707,"Many folks seem to think that eating according to a Paleo diet means going super-duper low-carb and consuming gobs and gobs of meat and animal fat. But for me, Paleo looks more like this: Yes, high-quality proteins and fats are part of the equation, but so are lots of vegetables and even (gasp!) carbohydrates."
497,msmarco,_doc,MARCO_8295752,7.2248707,"You can include small amounts of nuts. The preferred fats are saturated fats such as raw coconut oil, lard, duck fat, butter, and tallow as well as monounsaturated fats like extra virgin olive oil and avocados. (Read Paleo 101 for the simple 15 rules of a Paleo diet)."
498,msmarco,_doc,MARCO_223469,7.224535,"Basic Instructions and Recipes for Low-Carb Breakfast Casseroles. Making a low-carb breakfast casserole on the weekend helps me eat a good breakfast all week! All these breakfast casseroles are also South Beach Diet friendly, Keto, Low-glycemic, and gluten-free. Use the Recipes-by-Diet-Type Index to find more recipes like this."
499,msmarco,_doc,MARCO_7427614,7.224535,1 Access to your very own âKeto Coachâ for coaching and support. 2  Every book ordered is personalized to your specific weight. 3  No counting calories â We do all the work for you. 4  Finally beat your carb cravings & feeling hungry all the time* â like other diets.  Learn why and how a ketogenic diet works â and why others fail.
500,msmarco,_doc,MARCO_5273760,7.22293,"Is too much watermelon bad??? My husband and I started Paleo about 2 and a half weeks ago. We've been strict on the diet so far, however, I've been craving watermelon like crazy for a snack. I can sometimes eat 3-4 bowls a day. I know you can have this on the Paleo plan, but, is this too much? Since watermelon is mostly made up of water (and sugar), just wondering if I'm eating too much."
501,msmarco,_doc,MARCO_4894546,7.22293,"Primal Breakfast Ideas. If your diet is more Primal than Paleo and you include some dairy, here are a few Primal Breakfast ideas for you. 73. Greek yoghurt with nuts, berries and your favourite spices. 74. Apple and cheese is a winning combination! 75. Try the paleo cereal suggestions in raw milk instead of coconut. 76."
502,msmarco,_doc,MARCO_4894547,7.22293,"Itâs common to minimise fruit intake on a Paleo Diet, due to itâs high fructose content. If youâre targeting weight loss, it can be a good idea to minimise fruit and nuts. However, if youâre all for fruit, here are some fruity Paleo Breakfast Ideas."
503,msmarco,_doc,MARCO_5548493,7.222602,"Your body will return to a ketogenic state once it has burned up all the alcohol. In conclusion, just because you can drink on a keto diet, doesnât mean you should. Alcohol is generally unhealthy and inhibits your judgment, making it more likely that youâll make decisions that could compromise your diet and progress. But that doesnât mean you have to miss out on the St. Patrickâs Day festivities!"
504,msmarco,_doc,MARCO_6273409,7.220991,"Check out these delicious and healthy low carb and paleo bread recipes to help you stick to your diet. When you make a huge lifestyle change like going low carb, paleo or grain-free, you often think you have to say goodbye to some of your old favourites. Pizza, burgers with buns, sandwiches, french toast."
505,msmarco,_doc,MARCO_1133621,7.2190537,"Fortunately, a new study ran the numbers and found that, when it comes to weight lost, Paleo wins. For the study, researchers from the Cardiovascular Associates of Virginia Beach split 280 overweight men and women into four diet camps: Paleo, vegan, Mediterranean, and DASH (Dietary Approaches to Stop Hypertension)."
506,msmarco,_doc,MARCO_3494177,7.2190537,"The Paleo diet is low in carbs, leaning heavily toward protein, fats, and veggies. Paleo-friendly foods include meat (preferably pasture-raised and grass-fed), fish, shellfish, eggs, non-starchy vegetables (preferably organic), berries, and fats (e.g. butter, avocado, coconut oil)."
507,msmarco,_doc,MARCO_4861970,7.2190537,"The protein-heavy, low-carb principles of the Paleo diet are popping up in restaurants like HG SPLY Co. in Dallas and Hu Kitchen in New York City; exotic new Paleo-inspired products such as grass-fed beef pemmican, a Native American meat paste, are hitting the shelves."
508,msmarco,_doc,MARCO_3433036,7.2171187,"Paleo is not a weight-loss âdiet.â Itâs a way of eating for health and longevity â which, for some people, involves weight loss as one piece of the big picture. With that said, weight loss is an important goal for a lot of Paleo dieters, and itâs certainly very motivating as an outward sign of changes under the hood."
509,msmarco,_doc,MARCO_6417813,7.216813,"HOW DO I INCREASE KETONES LEVELS IN MY BODY? In the past, the process of increasing ketones in the blood was achieved through a strict, carbohydrate-restive diet called the ketogenic diet. This allowed the body to move from using glucose (sugar) as its primary source of fuel, and to transition to using fats as its primary source of fuel. Today, we can achieve this state through exogenous ketone supplementation with Keto-OS."
510,msmarco,_doc,MARCO_1974134,7.2148876,"Low-Carb Baked Eggs with Avocado and Feta. Low-Carb Baked Eggs with Avocado and Feta are a delicious quick breakfast option that's also Keto, low-glycemic, gluten-free, and South Beach Diet friendly! Use the Recipes-by-Diet-Type Index to find more recipes like this one. Click here to PIN Low-Carb Baked Eggs with Avocado and Feta!"
511,msmarco,_doc,MARCO_4940893,7.212963,"TKD is a Targeted Ketogenic Diet. It's a modified version of the Standard Keto Diet (High fat, adequate protein, very low carb) where carbohydrates are consumed around exercise times. SKD will be fine for the vast majority of people, but if you find yourself hitting a wall in an intense workout, it can help out by giving you a bit of a glycemic 'boost' for the workout and promoting post-workout glycogen synthesis."
512,msmarco,_doc,MARCO_8359892,7.212963,"A low-carb diet restricts carbs, for example recommending under 20 net grams per day on a keto low-carb diet. 1. You can eat a lot of vegetables before reaching 20 grams of net carbs, even if you add some colorful peppers and tomatoes. Roughly 20 ounces â more than half a kilo â of vegetables, full of other nutrients (low-carb vegetables guide)."
513,msmarco,_doc,MARCO_8485753,7.207471,"According to Dr. Cordain on The Paleo Diet website, ancient humans quenched their thirst with pure water because that's all they had available to them. While you can certainly drink small amounts of other Paleo-approved drinks, the bulk of your liquid consumption should be plain water. If you don't think it tastes good, squeeze in lemon or lime juice to enhance the flavor. Mineral water and coconut water are acceptable, too."
514,msmarco,_doc,MARCO_862983,7.205547,"Non-Dairy Cheese (Cave Food Kitchen) â contains nuts (cashews) Paleo Cheddar Cheese (And Love it, Too) â contains nuts (cashews) Autoimmune Paleo Diet Nut-Free and Dairy-Free âCheeseâ (The Spunky Coconut) â nut-free. This one is made with cauliflower puree and coconut butter, plus probiotics and seasonings."
515,msmarco,_doc,MARCO_428688,7.205547,"What Paleo diets get wrong: We're not evolved for meat, and our ancestors ate carbs. Updated by Julia Belluz on December 11, 2015, 8:51 a.m. Republican presidential hopeful and Paleo acolyte Jeb Bush eating a pork chop. Presidential candidate Jeb Bush recently made headlines for losing 40 pounds on the campaign trail."
516,msmarco,_doc,MARCO_7919759,7.205547,"The Kitchen Equipment Encyclopedia for Paleo/Primal Eaters. by Don Wiss. The items listed here cover preparing only these ingredients: meat, fish, shellfish, eggs, tree nuts, vegetables, roots, fruit, berries, mushrooms, herbs and spice seeds. Or foods that are popular on the paleo/primal/caveman/hunter-gatherer/low-carb/Atkins/South Beach diets."
517,msmarco,_doc,MARCO_3019305,7.205286,But many experts argue that it isnât safe. A new twist on extreme weight loss is catching on in some parts of the United States. Itâs called the keto diet.. People promoting the diet say it uses the bodyâs own fat-burning system to help people lose significant weight in as little as 10 days. Future brides may be tempted to try it as a quick and easy way to slim down before the big day.
518,msmarco,_doc,MARCO_3508953,7.201458,"Water weight loss is common when you first start a low carb diet. Ketosis has a diuretic effect to it that can cause many pounds of weight loss in only a few days. While I hate being the bearer of bad news, this isnât fat.ou can view the 30 Day Keto Diet Plan to get an idea of what I eat on a regular basis, and how it all plays into calculating your macros. What your job here is, is to make it fit into your own macros. That means adjusting the portion sizes to make the calories higher or lower."
519,msmarco,_doc,MARCO_276883,7.1940417,"Paleo is a way of eating based on the supposed habits of prehistoric hunter-gatherers. But Fred Flintstone most likely didn't adhere to these rules. According to a paper published Tuesday in the Quarterly Review of Biology, cavemen ate a much more varied diet than Paleo devotees are led to believe. For the study, the authors examined prior research on the anatomical, environmental, chemical and feeding behaviors of mammals from 6 million to 1.6 million years ago."
520,msmarco,_doc,MARCO_2870759,7.1940417,"If youâre following the basic Paleo approach, try to get at least 2Â½ hours of moderate-intensity activity (like brisk walking) each week, along with a couple days of muscle-strengthening activities. The Centers for Disease Control and Prevention offers tips to get you started. The Paleo Diet suggests a similar approach, and offers tips to sneak in exercise throughout the day (i.e., getting off the subway a stop early) while reminding you exercise can be fun â if youâre doing something you like."
521,msmarco,_doc,MARCO_5799283,7.193824,"Carbohydrates are the easiest thing for the body to process, and therefore it will use them first â resulting in the excess fats to be stored immediately. In turn, this causes weight gain and health problems that are associated with high fat AND high carbohydrate diets, NOT a keto diet.or a normal person that is starting a ketogenic diet, eating 25-40g of net carbs a day, the total adaptation process will take about 2 weeks. My advice is to cut your carbs to fewer than 15g to ensure that you are well on your way into ketosis within 1 week."
522,msmarco,_doc,MARCO_8416793,7.1902213,"Cooking, sprouting or soaking your grains, legumes, nuts and seeds all helps to decrease the number of lectins they contain, but none of those processes completely eliminates the lectins, except for pressure cooking.osted on March 30, 2011 by Neely. This entry was posted in Paleo Tips and Tricks and tagged anti-nutrient, decrease lectins, grains, immune response, leaky gut, lectins, legumes, nuts, pressure cooking, seeds, soaking grains, soy, sprouting, the paleo diet."
523,msmarco,_doc,MARCO_5767327,7.1900187,"Burning muscle can occur, usually when your protein intake is not high enough, which can be a problem with some radical diets. The body needs 10 essential amino acids, and if you are not getting them in your diet, your body will scavenge muscle tissue for them.ou have to work to burn fat. Photo Credit Jupiterimages/Polka Dot/Getty Images. Ketosis is when your body is preferentially burning ketones for fuel, instead of sugars. This state should not be confused with diabetic ketosis or keto-acidosis. Ketones are produced when your body is burning fat instead of glycogen."
524,msmarco,_doc,MARCO_2793470,7.1870003,"How People Found This Review: and keto os scam, and keto os reviews, and Keto OS Side Effects, and keto os review, and keto//os reviews, and what is the difference in KAN and OTG keto supplements. Click here to submit your review."
525,msmarco,_doc,MARCO_6259158,7.1826024,"Such as these Mango Sorbet Bars that are vegan, gluten free, paleo, and made from only 6 ingredients.Making this a healthy celebration. No need to worry about ruining that pre-prom or bikini season diet.Todayâs flavours include mango, macadamia nuts, and coconut.This trio was just meant to be.n my dictionary, a celebration always includes food. Such as these Mango Sorbet Bars that are vegan, gluten free, paleo, and made from only 6 ingredients. Making this a healthy celebration. No need to worry about ruining that pre-prom or bikini season diet."
526,msmarco,_doc,MARCO_3998018,7.1824284,"Vegetables with less than 5 percent carbs may be eaten relatively freely. If youâre on a not-too-strict low-carb diet (more than 20 grams per day), you can probably eat all you want of all these low-carb vegetables. If youâre on a keto low-carb diet (below 20 grams a day), you may need to be a bit careful with some of the vegetables. You should probably be especially careful with peppers or tomatoes â these carbs quickly add up towards the 20 grams-a-day limit. Just one medium-sized pepper may contain 6-8 grams of digestible carbs. Top 10 low-carb vegetables"
527,msmarco,_doc,MARCO_6259159,7.175012,"In my dictionary, a celebration always includes food. Such as these Mango Sorbet Bars that are vegan, gluten free, paleo, and made from only 6 ingredients. Making this a healthy celebration. No need to worry about ruining that pre-prom or bikini season diet.Todayâs flavours include mango, macadamia nuts, and coconut.This trio was just meant to be.n my dictionary, a celebration always includes food. Such as these Mango Sorbet Bars that are vegan, gluten free, paleo, and made from only 6 ingredients. Making this a healthy celebration. No need to worry about ruining that pre-prom or bikini season diet."
528,msmarco,_doc,MARCO_6928750,7.175012,So basically that Marbo Activator stimulating is trigeminal neuralgia an autoimmune disease hormone that regulates the amount of participants. Paleo Recipes â Paleo Diets. Roasted Carrots and Onion with Honey Balsamic Dressing and bacteria: These medications dietary calcium binds to actin swivels and reduce symptoms.roper treatment to further develops from an overproduction outpaces regeneration involves gently squeezing the headaches and a foreign invaders like influenza or other common way would expect an immune system and especially powerful medicines which help in the world health rankings.
529,msmarco,_doc,MARCO_8416791,7.175012,"Lectins are proteins found in animals (including you) and plants â theyâre everywhere, especially in grains, legumes (especially soy), nuts and seeds. They have many protective functions in the human body â everything from recognizing pathogens to controlling protein levels in the blood.osted on March 30, 2011 by Neely. This entry was posted in Paleo Tips and Tricks and tagged anti-nutrient, decrease lectins, grains, immune response, leaky gut, lectins, legumes, nuts, pressure cooking, seeds, soaking grains, soy, sprouting, the paleo diet."
530,msmarco,_doc,MARCO_5473765,7.1748667,"Say your body needs 1800 calories, and you only eat 1300 calories. Weight loss will occur because your body uses roughly 500 calories of body fat to cover the missing 500 calories from your diet: This leads to a theoretical weight loss of 1 lb per week (3500 kcal per pound of fat). If you ate 1300 calories on keto and lost 2 lbs in a week, youâd have to use 1000 calories from fat stores. That means that 1000 calories of expended energy are external of your diet a day, for 7 days. If that isnât the case, the formula does not work."
