,_index,_type,_id,_score,_source.body
0,msmarco,_doc,MARCO_4813852,14.960573,"Whatâs the Difference Between Paleo and Keto? In the end, the main difference between Paleo and keto is one of emphasis. Keto emphasizes being in the state of ketosis whereas Paleo emphasizes food quality. In practice, most folks on a Paleo diet eat a much higher amount of carbohydrates than those on a ketogenic diet."
1,msmarco,_doc,MARCO_6531724,14.597973,"Keto isnât a âdiet,â itâs a way of life. Itâs the basic set of principles that low carb diets are based on. Atkins is one of the most popular keto diets, South Beach is another, Paleo is often considered keto as well, but Iâm not doing Atkins, and Iâm not doing South Beach. I am doing a lot of Paleo."
2,msmarco,_doc,MARCO_4179216,14.594963,"So that means finding and eating fatty animals. So a paleo diet, just like a keto diet, focuses on getting fat and protein as a primary source of energy. However, the big difference is paleo doesnât avoid potatoes, sweet potatoes, carrots, and other tubers and root vegetables. These particular vegetables fit completely within the paleo framework, but they should be avoided in a keto diet."
3,msmarco,_doc,MARCO_4813849,14.577671,"So that means finding and eating fatty animals. So a paleo diet, just like a keto diet, focuses on getting fat and protein as a primary source of energy. However, the big difference is paleo doesnât avoid potatoes, sweet potatoes, carrots, and other tubers and root vegetables. These particular vegetables fit completely within the paleo framework, but they should be avoided in a keto diet. Paleoâs focus is on tapping into the ancient ways."
4,msmarco,_doc,MARCO_6839025,14.404047,"Ketogenic Diet: The Vegan Keto Way: Your guide to ketogenic low carb diet with high fat and protein recipes (Ketogenic diet plan, ketogenic diet beginners ... Paleo Ketogenic Vegan Smart Moves: Avoid Dieting Mistakes, Vegan, Vegan Diet, Vegan for Beginners, Diabetes, Diabetes Diet, Anti-inflammatory Diet, Paleo ..."
5,msmarco,_doc,MARCO_4813856,14.207796,"The Keto Diet Vs The Paleo Diet: Is Ketosis Better Than Paleo? If youâre someone interested in improving their health or losing weight, youâve likely heard of the ketogenic diet and the Paleo Diet at some point."
6,msmarco,_doc,MARCO_6663994,13.90482,Pounds to Kilo Converter; DIET REVIEWS... NEW Top 10 Diets 2018; Weight Watchers Free; Choosing the Right Diet ; Low Carb Diet; The Keto Diet; The Paleo Diet; The Atkins Diet; Diabetic Diet; Intermittent Fasting; Whole 30; 21 Day Fix; Vegetarian Diet; Mediterranean Diet; WEIGHT LOSS ARTICLES... Dietary Supplements ; Weight Loss Surgery; Weight Watchers Points system
7,msmarco,_doc,MARCO_986646,13.806473,"You may have noticed the aforementioned diets donât include some more popular ones, such as the Keto diet or the Paleo diet. In fact, the Keto diet has an overall score of just 1.9 out of 5, or tied for last place on the list at #39."
8,msmarco,_doc,MARCO_3665521,13.785995,"The keto âdiet,â also known as the ketogenic âdiet,â is a lifestyle change that is low carb. Everybody does it their own way (hence all the diet names and programs) but the most basic keto diet is a mix of low carb, paleo and gluten-free. The cross-fit folks do it too."
9,msmarco,_doc,MARCO_5823432,13.330794,27 indulgent keto desserts under 5gr of carbs 27 indulgent keto desserts under 5gr of carbs all week you work hard at your job you go to the gym you eat your keto or keto paleo diet you stay on track you do your best
10,msmarco,_doc,MARCO_4813853,13.323487,"submitted 4 years ago by osellr. Recently joined r/keto. I have been progressing to a paleo diet that mostly consists of meat and vegetables. When Joining r/keto, I noticed that it is very very similar to paleo. My question to you guys and girls, is, what are their differences, and what are their similarities."
11,msmarco,_doc,MARCO_1807236,12.843702,Related posts: 1  Low carb food when at party or restaurant. 2  Paleo diet compared with LCHF. 3  Food to eat when on low carb keto diet. 4  Things to avoid on low carb diet.
12,msmarco,_doc,MARCO_4813855,12.83786,"Truthfully, itâs possible to follow a ketogenic diet while also adopting some of the primary principles of the Paleo Diet: you can simply follow the keto macronutrient ratios (carbs, fats, and protein) while also removing all manmade carb sources (and other processed elements) from your daily diet."
13,msmarco,_doc,MARCO_2872990,12.817502,"This way of eating is now commonly known as a low-carbohydrate, high-fat (LCHF) diet. At its most extreme, it excludes almost all carbohydrates and is known as a ketogenic diet â keto for short. Many popular diets â paleo, South Beach, Dukan, Protein Power, Sugar Busters, Whole30 â are variations on the LCHF theme."
14,msmarco,_doc,MARCO_1007835,12.505859,"The doctor put my son on a low fat diet, but that didn't really do anything (for a year). So since I was on keto, I started him slowly on a semi LCHF diet. It's really more paleo, with more fruits and veggies and stuff. Lots of meals are meat and veggies and that's it."
15,msmarco,_doc,MARCO_8420958,12.404743,"Though a very low carb diet generally has me above actual ketosis, it is not hard to intentionally dip into small to moderate ketosis by reducing oneâs vegetable intake. I will say, though, that my experiences have taught me that oneâs protein intake can be higher than this article indicates for a ketogenic diet.ould just like to point out that Avocado is great, because although it has a lot of carbs, over 90% of it is fiber which is undigested and so can be ommitted. Great article. While Iâm not on a full blown paleo/keto diet, I am completely wheat free, not gluten free just wheat and wheat gluten free."
16,msmarco,_doc,MARCO_8420959,11.866878,"Some people say when youâre in ketosis your brain doesnât get enough energy, but some would argue that the glucose your liver produces on its own when youâre in ketosis is more than enough to feed your brain. Studies have shown that you can even train endurance activities at an elite level on a ketogenic diet.ould just like to point out that Avocado is great, because although it has a lot of carbs, over 90% of it is fiber which is undigested and so can be ommitted. Great article. While Iâm not on a full blown paleo/keto diet, I am completely wheat free, not gluten free just wheat and wheat gluten free."
17,msmarco,_doc,MARCO_5037663,11.744278,"Since I decided to make it dairy-free, I also wanted it to be Paleo compliant just because my blog does focus on some Paleo recipes. I hope you enjoy this Keto Paleo Meal Plan! I have previously uploaded a 7-day PCOS meal plan in 2016 that you can also check out that is low carb."
18,msmarco,_doc,MARCO_1692051,11.736976,"8 paleo, keto, grain-free, dairy-free and low carb soup recipes that the whole family will love, regardless of their eating style. Plus, a new recipe for Keto Fat Bomb Hamburger Soup. There are few things that I love more than a warm bowl of keto soup on a cold day."
19,msmarco,_doc,MARCO_8406642,11.347826,"Fat Loss Accelerated: How to Blast Fat the Paleo-Keto way! Instant Ketones & High-fat, moderate-protein, low-carb dietsâcalled ketogenic or keto dietsâare becoming more popular, and with good ..."
20,msmarco,_doc,MARCO_8406645,11.340021,"InstaKetonesâ¢ & How They Transform Your Metabolism. Fat Loss Accelerated: How to Blast Fat the Paleo-Keto way! Instant Ketones & High-fat, moderate-protein, low-carb dietsâcalled ketogenic or keto dietsâare becoming more popular, and with good reason."
21,msmarco,_doc,MARCO_7739839,10.649077,"Some of these are pure fat and some contain fat. Fats make the blender a little harder to clean but we need fat for balance, satiety and texture. If youâre eating Keto (very low carb Paleo) just add more fat and protein options. Avocado and avocado oil."
22,msmarco,_doc,MARCO_1119833,10.635492,"Sourced from grass-fed and finished free-roaming cattle, Natural ForceÂ® Collagen Peptides are dairy-free, gluten-free, Paleo Certified, and Keto-friendly. Each scoop is 100% collagen protein, and is free from artificial ingredients of any kind. They dissolve easily and mix flavorlessly into both hot and cold beverages."
23,msmarco,_doc,MARCO_8154565,10.271667,"Ketogenic Diet For Beginners: All Truth, Pros And Cons Of Ketogenic Diet: (lowâ¦ Find this Pin and more on Keto Success by tondadt. Diet plan for keto diet free ketogenic recipes,good food for keto diet how to begin a keto diet,keto diet plan for diabetes keto diet success stories."
24,msmarco,_doc,MARCO_1071976,10.135308,"Caveman Diet, 7.6 out of 10 based on 221 ratings. Get the #1 caveman diet app in iTunes. Download Paleo.io now! The caveman diet is another term for the paleo diet. The paleo diet is commonly referred to as the caveman diet due to the fact that, while on the paleo diet, you eat the same foods as caveman did.The paleo diet is also so simple that âa caveman could do it.â.egardless of the origin of the name, the caveman diet has many of the same principles as the paleo diet."
25,msmarco,_doc,MARCO_2749663,9.687917,"In all of my popular Paleo Diet books including The Paleo Diet, The Paleo Diet for Athletes, The Paleo Diet Cookbook and The Paleo Answer, I have always suggested that moderate alcohol consumption is consistent with the health goals of the Paleo Diet, despite our research1 showing that virtually all humans living as hunter gatherers during the ..."
26,msmarco,_doc,MARCO_8806566,9.670534,"Paleo Diet Food List. Updated: September 5, 2015. This is the definitive paleo diet food list. In it, youâll find a list of the paleo diet meats, vegetables, fruits, nuts, seeds, and oils that are allowed on the paleo diet. You can throw these into any delicious paleo recipe (or make up your own) and be 100% sure that youâre paleo diet compliant :)."
27,msmarco,_doc,MARCO_7858986,9.482396,"Multiple diets have been reported to reverse Hashimotoâs and/or other autoimmune conditions, including a gluten-free diet, iodine-free diet, Feingold Diet, Specific Carbohydrate Diet, GAPS Diet, The Paleo Diet, Autoimmune Paleo Diet, soy-free diet, dairy-free diet, low-FODMAPs Diet, the Body Ecology Diet, vegetable juicing and elemental diets."
28,msmarco,_doc,MARCO_4894338,9.469244,"Paleo vs. Vegan Diet â the Pros & Cons. [Below is my transcript of my video about the Paleo vs. vegan diet, along with supplemental information on the topic.] In this video, Iâm going to settle the debate of Paleo vs. vegan diet, and really go over all the benefits of going Paleo and maybe some of the cons. While I donât eat a Paleo diet, itâs close â¦ and Iâll explain why. Iâm also going to discuss the vegan diet, its great benefits as well as the cons of going that way."
29,msmarco,_doc,MARCO_4115814,9.428701,"Understanding the Paleo Diet. The definition of a diet is âthe kinds of food a person, animal, or community habitually eatsâ. By definition, the paleo diet should be known as the âhuman dietâ because itâs the diet humans have thrived off for the last 200,000 years. The paleo diet encourages you to get back to your roots and gives you an easy template to choose nutrient dense foods. To better understand the paleo diet, you only need to remember these two statements;"
30,msmarco,_doc,MARCO_4986998,9.410941,"This means you have to be careful and make sure you know what you can eat on a keto diet. Eating the wrong things can slow or halt your progress! Use this post to help you stay on track or get started with a ketogenic diet. Figuring out what you can eat on a keto diet can be tough if you are just starting out. It can be helpful to know what you can eat on a ketogenic diet! Figuring out what to eat on a keto diet can be hard enough, figuring out what to eat when you need to be keto and watch out for allergens can be a nightmare!"
31,msmarco,_doc,MARCO_8581412,9.400944,"Thatâs okay, too. The key is to stay consistent and focus on eating healthy keto foods. Treat the keto diet as what it is â not simply a diet, but a lifestyle and metabolic shift in your health. Now, that being said, what we can tell you is the average results people experience when losing weight on keto. Average Weight Loss on the Ketogenic Diet Typically, in the first week of the keto diet people see a very quick drop in weight â anywhere from a few pounds to as much as 10! Thatâs because keto causes you to initially release a lot of water weight (not fat) from drastically cutting your carb intake."
32,msmarco,_doc,MARCO_8479734,9.39061,"It means that everyone has a different take on what is paleo and what isn't. And if that's not confusing enough, there is also the autoimmune protocol. So let's first identify what paleo is and then explore the more restrictive AIP (autoimmune protocol). I like Kurt Harris's Paleo 2.0 manifesto Here the best.I like Loren Cordain's book The Paleo Diet and Robb Wolf's book The Paleo Solution the best.he autoimmune protocol of paleo means eliminating those foods. And remember, the diet is only part of your recovery. You also have to get good sleep, manage your stress and ENJOY YOUR LIFE! Attitude plays a huge part."
33,msmarco,_doc,MARCO_4951486,9.293728,"Foods that are not on the paleo diet are anything processed, grains, legumes (beans and peanuts), raw dairy, salt, and oils. Raw Dairy is considered by some experts to be paleo while others believe it doesnât make the list. A paleo diet with dairy added in is called a Neo-Paleo diet. The Good and Bad of the Paleo Diet."
34,msmarco,_doc,MARCO_324719,9.291181,"The paleo diet (also nicknamed the caveman diet, primal diet, Stone Age diet, and hunter-gatherer diet) is hugely popular these days, and goes by one simple question: What would a caveman eat? Here, we explain what the paleo diet involves, its pros and cons, and, ultimately, what a modern person needs to know to decide whether or not to take the paleo diet plunge. Advertisement 2 of 14 Getty Images"
35,msmarco,_doc,MARCO_2870756,9.287345,"A paleo diet typically includes lean meats, fish, fruits, vegetables, nuts and seeds â foods that in the past could be obtained by hunting and gathering. A paleo diet limits foods that became common when farming emerged about 10,000 years ago. These foods include dairy products, legumes and grains. Other names for a paleo diet include Paleolithic diet, Stone Age diet, hunter-gatherer diet and caveman diet."
36,msmarco,_doc,MARCO_6994981,9.282879,"I would like to report some good news for The Paleo Diet community. Past criticism of The Paleo Diet by the U.S. News and World Reports, which rated the Paleo Diet dead last among 32 popular diets, indicated that the Paleo Diet had not been adequately tested in the long term in the scientific and medical literature."
37,msmarco,_doc,MARCO_5943834,9.279697,"A great question to ask is â Does the Paleo diet work? â Here we have a head to head comparison between the Paleo diet and Mediterranean diet in insulin resistant Type 2 Diabetics. The results? The Paleo diet group REVERSED the signs and symptoms of insulin resistant, Type 2 diabetes. The Mediterranean diet showed little if any improvements. It is worth noting that the Mediterranean diet is generally held up by our government as âthe diet to emulateâ despite better alternatives."
38,msmarco,_doc,MARCO_4032237,9.275884,"What Exactly is the Paleo Diet? The Paleo Diet (sometimes called The Caveman Diet) has become very popular lately. Those who practice the diet swear that it improves their health, increases energy, improves insulin sensitivity, and helps shed unwanted pounds. (1) But others believe that the diet's insistence on quality local or organic foods is all just elitist foodie nonsense. (2) Who's right? In this post, I'll explore the basic Paleo diet idea, what evidence may support its main arguments, and how far the diet itself as has evolved."
39,msmarco,_doc,MARCO_1807243,9.266361,Eating out when on keto or lchf diet. Sometimes it can be hard to stick with your keto diet or your LCHF diet when eating out. We have all been in that situation when you go out with some friends and you all select a restaurant that you know does not serve keto/lchf food. In this article we will give some guidelines on what are the best alternatives to choose when going to different restaurants and eating out.
40,msmarco,_doc,MARCO_8312590,9.233715,"Keto diet general risks. As previously mentioned the keto diet is often used as a treatment for epilepsy. However on the website epilepsy.com there are also some possible side effects and keto diet risks listed. Some people who have been on a keto diet have experienced dizziness, nausea, vomiting and diarrhea."
41,msmarco,_doc,MARCO_2073476,9.141446,"THE PEGAN {Paleo + Vegan} DIET. The Pegan diet is a modified version of the Paleo and Vegan diets. The Pegan diet takes the best, most healthful qualities of both diets, creating an eating style that combines the best of two worlds! Download the Pegan eBook here. A little background: The Paleo (or âcavemanâ) diet, includes foods that our hunter-gatherer ancestors ate: meat, fish, eggs, vegetables, and fruit."
42,msmarco,_doc,MARCO_1916383,9.06312,"He is the worldâs leading expert on Paleolithic diets and has lectured extensively on the Paleolithic nutrition worldwide. Dr. Cordain is the author of six popular bestselling books including The Real Paleo Diet Cookbook, The Paleo Diet, The Paleo Answer, and The Paleo Diet Cookbook, summarizing his research findings. About the Author: Loren Cordain, PhD, Professor Emeritus."
43,msmarco,_doc,MARCO_1945215,9.0611315,"Ordinarily, on a typical keto diet, it takes 3 to 5 days to enter into the state of ketosis, depending on how many carbohydrates per day you were eating before you started restricting carbs. But there are much faster methods.ost low-carb diet plans come with strict rules and guidelines. A keto diet plan is no different. Ketogenic diets suggest you limit your carbohydrate intake to no more than 20-net carbs per day. However, if you eat less than 20-net carbs and bump up your activity level, you'll get into ketosis faster."
44,msmarco,_doc,MARCO_4894344,9.042868,"The Verdict & Other Diets. Now, if Iâm comparing the Paleo vs. vegan diet and I had to choose for my entire life to follow one of the two diets, I would actually choose the Paleo diet regime before the vegan diet. Personally, my favorite diet is following more of a traditional diet or a GAPS diet."
45,msmarco,_doc,MARCO_3326349,9.041446,"A Keto Diet for Beginners. A ketogenic diet, or keto diet, is a very low-carb diet, which turns the body into a fat-burning machine. It has many potential benefits for weight loss, health and performance, but also some potential initial side effects. A ketogenic diet is similar to other strict low-carb diets, like the Atkins diet or LCHF (low carb, high fat)."
46,msmarco,_doc,MARCO_1071984,9.028734,"Eat like a caveman and shed pounds. That's the theory behind the Paleo Diet. Loren Cordain, PhD, who literally wrote the book on The Paleo Diet, claims that by eating like our prehistoric ancestors, weâll be leaner and less likely to get diabetes, heart disease, cancer, and other health problems.at like a caveman and shed pounds. That's the theory behind the Paleo Diet. Loren Cordain, PhD, who literally wrote the book on The Paleo Diet, claims that by eating like our prehistoric ancestors, weâll be leaner and less likely to get diabetes, heart disease, cancer, and other health problems."
47,msmarco,_doc,MARCO_7588734,8.984018,"What is the Paleo Diet? The definition of a diet is âthe kinds of food a person, animal, or community habitually eatsâ. By definition, the paleo diet should be known as the âhuman dietâ because itâs the diet humans have thrived off for the last 200,000 years. The paleo diet encourages you to get back to your roots and gives you an easy template to choose nutrient dense foods."
48,msmarco,_doc,MARCO_4183088,8.981389,"Q. How is the Paleo Diet different? A. The Paleo Diet is the unique diet to which our species is genetically adapted. This program of eating was not designed by diet doctors, faddists, or nutritionists, but rather by Mother Natureâs wisdom acting through evolution and natural selection."
49,msmarco,_doc,MARCO_2118550,8.976446,"The 3 Ketogenic diet types all offer different benefits and help alleviate some of the concerns associated with the general, always low carb ketogenic diet. One of the main criticisms of a ketogenic diet plan is that itâs difficult to workout with intensity because of a lack of energy (due to cutting carb intake). There are different types of ketogenic diets which tweak keto so that the dieter can still workout with intensity and even eat carbs every week."
50,msmarco,_doc,MARCO_5757469,8.975554,"Keto FAQ. Learn everything about Ketosis, LCHF, Keto and other diets. Cheese when on keto diet. Cheese in all its forms is something you normally can eat a lot of when you eat according to a keto diet. Cheese usually contains very little carbohydrate but as always, it is important to read the contents when you buy it."
51,msmarco,_doc,MARCO_4032232,8.9744,"The Paleo diet contends that the diet of our hunting and gathering ancestors, which consisted of fatty meats, vegetables and a little fruit, enabled them to live a healthier lifestyle. Although the evidence that the Paleo diet is actually a healthier lifestyle is a little sketchy, some health professionals believe the diet has positive benefits. Loren Cordain, professor of health and exercise science at Colorado State University, believes the Paleo diet has several benefits."
52,msmarco,_doc,MARCO_4032233,8.966736,"A. The Paleo Diet is the unique diet to which our species is genetically adapted. This program of eating was not designed by diet doctors, faddists, or nutritionists, but rather by Mother Natureâs wisdom acting through evolution and natural selection. The Paleo Diet is based upon extensive scientific research examining the types and quantities of foods our hunter-gatherer ancestors ate. The foundation of The Paleo Diet is meat, seafood, and unlimited consumption of fresh fruits and veggies."
53,msmarco,_doc,MARCO_6452586,8.964576,"Also referred to as the caveman diet, Stone Age diet and hunter-gatherer diet, the Paleo Diet is focused on avoiding refined foods, trans fat, dairy and sugar, and consuming lean proteins; fresh vegetables and fruits; and healthy fats through nuts, seeds, avocados, fish oil and grass-fed meat.lso referred to as the caveman diet, Stone Age diet and hunter-gatherer diet, the Paleo Diet is focused on avoiding refined foods, trans fat, dairy and sugar, and consuming lean proteins; fresh vegetables and fruits; and healthy fats through nuts, seeds, avocados, fish oil and grass-fed meat."
54,msmarco,_doc,MARCO_7371179,8.964576,"Welcome to the Active Low-Carber Forums. Support for Atkins diet, Protein Power, Neanderthin (Paleo Diet), CAD/CALP, Dr. Bernstein Diabetes Solution and any other healthy low-carb diet or plan, all are welcome in our lowcarb community.Forget starvation and fad diets -- join the healthy eating crowd!elcome to the Active Low-Carber Forums. Support for Atkins diet, Protein Power, Neanderthin (Paleo Diet), CAD/CALP, Dr. Bernstein Diabetes Solution and any other healthy low-carb diet or plan, all are welcome in our lowcarb community. Forget starvation and fad diets -- join the healthy eating crowd!"
55,msmarco,_doc,MARCO_7277653,8.948448,"Being on a ketogenic diet restricts your choices in food â both store-bought and homemade. It is only wise to know about the best low carb protein bars for keto because when youâre preparing for your keto diet, you need to have a go-to snack for when you need a quick calorie source. It's only wise to know about the best low carb protein bars for keto because when youâre preparing for your keto diet, you need to have a quick go-to snack."
56,msmarco,_doc,MARCO_4242144,8.938625,"Standard Ketogenic Diet. 1  SKD â (Standard Keto Diet) The standard keto diet is eating high fats, medium protein and low carbs on a day to day basis. No exceptions! 2  As the most common of all types of keto diets. You want to limit your carb intake to 30 grams or less per day."
57,msmarco,_doc,MARCO_6546983,8.938625,"Many people following a keto LCHF diet are unsure about how much protein they should be eating. Itâs a common belief that a low carb diet should be high in protein. As we all know, eating a LCHF keto diet means eating most of your calories as fat, not protein. On a LCHF keto diet [â¦]"
58,msmarco,_doc,MARCO_8312589,8.938625,"Keto diet risks liver damage. In a Korean study from 2005 it was also said that a keto diet can give you liver damage, pancreatitis and electrolyte imbalances. There is also a possibility for getting osteopenia, kidney stones and cardiac problems after following a low carb diet such as the keto diet for a long time."
59,msmarco,_doc,MARCO_818042,8.9366865,"What Is a Keto Diet? A keto â short for ketogenic â diet is a low-carb diet, in which the body produces ketones in the liver to use as energy in lieu of carbohydrates (more on that later). Like other low-carb, high-fat (LCHF) diets, keto draws people in with its promised weight-loss results."
