,_index,_type,_id,_score,_source.body
236,msmarco,_doc,MARCO_8627991,5.8514905,"symbolic interactionism. (noun) The theory that society is possible because of the shared meanings and social patterns created during social interactions.Audio Pronunciation: (sym·bo·lic in·ter·act·ion·ism). Download Audio Pronunciation: symbolic interactionism.mp3.Usage Notes:1  Herbert Blumer (1900–1986) is credited with coining the term. 2  Symbolic interactionism is a microsociological perspective. 3  Scholars in the field of symbolic interactionism include Charles Horton Cooley (1864–1929), George Herbert Mead (1863–1931), and Georg Simmel (1858–1918).noun) The theory that society is possible because of the shared meanings and social patterns created during social interactions. Audio Pronunciation: (sym·bo·lic in·ter·act·ion·ism). Download Audio Pronunciation: symbolic interactionism.mp3. Usage Notes: 1  Herbert Blumer (1900–1986) is credited with coining the term."
237,msmarco,_doc,MARCO_5441216,5.8026047,"See Marks & Spencer Hourly Wages, Marks & Spencer Bonuses, or check out salaries for Marks & Spencer Internship or Marks & Spencer Contractor."
238,msmarco,_doc,MARCO_7901079,5.7908516,"Spencer, MA. Sponsored Topics. Spencer is a town in Worcester County, Massachusetts, United States. The population was 11,688 at the 2010 census. For geographic and demographic information on the census-designated place Spencer, please see the article Spencer (CDP), Massachusetts."
239,msmarco,_doc,MARCO_2276358,5.7869644,"John Spencer, 8th Earl Spencer. Edward John Johnnie Spencer, 8th Earl Spencer, MVO (24 January 1924 – 29 March 1992), styled Viscount Althorp until 1975, was a British peer and the father of Diana, Princess of Wales. Contents."
240,msmarco,_doc,MARCO_6814464,5.785026,"Disclaimer. Spencer County is an area in Spencer County, Indiana with a population of 20,843. There are 10,455 male residents living in Spencer County and 10,388 female residents. The total number of households is 8,072 with 2.54 people per household on average. Total household expenditures in Spencer County are below the national average."
241,msmarco,_doc,MARCO_811776,5.783092,"The New York Times. Weddings/Celebrations. Caroline Spencer, Thomas Spanos. Caroline Bliss Spencer, the daughter of Jody Boghossian Spencer and Randal W. Spencer of Providence, R.I., was married there Saturday to Thomas Michael Spanos, a son of Mary Kelly Spanos and Thomas Spanos of Campbell Hall, N.Y."
242,msmarco,_doc,MARCO_7004667,5.7811613,"Spencer County Jail. Indiana. The Spencer County Jail is located at 120 North 2nd Street, Rockport, IN 47635. You can reach the Spencer County jail reception desk by using the phone number (812) 649-2286. For help with Spencer County bail bonds or legal matters please see our local listings posted to the right."
243,msmarco,_doc,MARCO_7901080,5.7811613,"Spencer (CDP), Massachusetts. Spencer is a census-designated place (CDP) in the town of Spencer in Worcester County, Massachusetts, United States. The population was 5,700 at the 2010 census. Spencer is located at 42°14′35″N 71°59′39″W / 42.24306°N 71.99417°W / 42.24306; -71.99417 (42.243276, -71.99437)."
244,msmarco,_doc,MARCO_7285953,5.7811613,"Lady Kitty Eleanor Spencer was born December 28, 1990. 1  She is the eldest daughter of Charles Spencer, 9th Earl Spencer, and his first wife, Victoria Lockwood. 2  She has a younger brother, Louis, and twin sisters, Eliza and Amelia. Here they are in 2000 with their father, Charles Spencer. 3  Lady Kitty's mother is a former model."
245,msmarco,_doc,MARCO_5748548,5.7806754,"Herbert Randall Wright (born October 8, 1995),[1] better known by his stage name G Herbo (formerly known as Lil Herb) is an American rapper and songwriter from Chicago, Illinois."
246,msmarco,_doc,MARCO_2315995,5.7801976,"1 Lady Kitty Eleanor Spencer was born December 28, 1990. 2  She is the eldest daughter of Charles Spencer, 9th Earl Spencer, and his first wife, Victoria Lockwood. 3  She has a younger brother, Louis, and twin sisters, Eliza and Amelia. Here they are in 2000 with their father, Charles Spencer. 4  Lady Kitty's mother is a former model."
247,msmarco,_doc,MARCO_7061965,5.7801976,"Octavia Spencer Net Worth is $12 Million Octavia Spencer's salary $75 Thousand Per Episode Octavia Spencer Bio/Wiki 2017. Octavia Spencer is an American movie actress and television personality. She’s certainly one of the rare performers who have won not just the Oscar award, but also the Screen Actors Guild, Golden Globe, and also the BAFTA."
248,msmarco,_doc,MARCO_2315992,5.779235,"Spencer, 48, and his wife Countess Spencer, 39, welcomed their first child together, daughter Lady Charlotte Diana Spencer, on July 30. She was born at their family home in Althorp and weighed 8 lb., 14 oz. Lady Charlotte Diana is the first baby to be born at the estate (where the Princess of Wales was buried) since 1793. She's adorable –- another feisty little Spencer girl."
249,msmarco,_doc,MARCO_3288997,5.779235,"Read: Group plans to protest during University of Cincinnati talk by white nationalist Richard Spencer. Read: UC college Republicans to white nationalist Richard Spencer: Don't come. Why UC? The University of Cincinnati has been selected by Cameron Padgett as a venue at which Richard Spencer will appear, because Mr. Padgett desires to share Spencer's message with as many people as possible, said Bristow."
250,msmarco,_doc,MARCO_5748544,5.7787194,"G Herbo. Herbert Randall Wright (born October 8, 1995), better known by his stage name G Herbo (formerly known as Lil Herb) is an American rapper and songwriter from Chicago, Illinois."
251,msmarco,_doc,MARCO_2041570,5.774434,"Nicknames: Princess Diana, The Lady Diana Spencer, Diana Spencer, The Hon Diana Spencer, Lady Di, Diana Frances Spencer. Height: 1.778 m. Country: England. The famous and beloved Princess Diana had a $55 million net worth before her tragic death 14 years ago in 1997. In addition to her net worth, she was famous all over the world both for her marriage to Prince Charles and her humanitarian work."
252,msmarco,_doc,MARCO_3008118,5.774434,"Spencer County was formed in January 1824, by the 32nd Kentucky General Assembly. The land that now makes up Spencer County was taken from Bullitt County, Shelby County, and Nelson County. Spencer County became Kentucky's 77th county. The county was named for Kentucky's Captain Spier Spencer, who fought and died in the Battle of Tippecanoe. Later that year, in December 1824, Taylorsville was made the county seat. In 1829, the city was incorporated."
253,msmarco,_doc,MARCO_4726494,5.768968,It continues to be a well known company of many family brands today. Johnson and Johnson is a family owned company since 18906 when Herbert F. Johnson Sr became partner of the company after two years of it being founded by his father. It continues to be a well known company of many family brands today.
254,msmarco,_doc,MARCO_3378691,5.7670236,"English. French. German. Spanish. Italian. Herbert George Wells, better known as H. G. Wells, was an English writer best known for such science fiction novels as The Time Machine, The War of the Worlds, The Invisible Man and The Island of Doctor Moreau."
255,msmarco,_doc,MARCO_2540108,5.7668004,"Childhood & Early Life. Winston Churchill was born on 30 November 1874 in Oxfordshire in the United Kingdom. A descent of the Spencer family, Winston Leonard Spencer-Churchill was born to a politician father Lord Randolph Churchill and mother Lady Randolph Churchill who was the daughter of an American millionaire. descent of the Spencer family, Winston Leonard Spencer-Churchill was born to a politician father Lord Randolph Churchill and mother Lady Randolph Churchill who was the daughter of an American millionaire."
256,msmarco,_doc,MARCO_2316000,5.764901,"Personal life. 1  Lady Kitty Eleanor Spencer (born (1990-12-28)28 December 1990) 2  Lady Eliza Victoria Spencer (born (1992-07-10)10 July 1992) 3  Lady Katya Amelia Spencer (born (1992-07-10)10 July 1992) 4  Louis Frederick John Spencer, Viscount Althorp (born (1994-03-14)14 March 1994); heir apparent to the earldom."
257,msmarco,_doc,MARCO_7435230,5.7630053,"Town of Spencer. The Township of Spencer is located in southwestern corner of Marathon County. It is bordered on the north by Eau Pleine Road, East by Lincoln Avenue, South by Lincoln Spencer Road and the west by east side Fairhaven Avenue. It borders Clark County on the west and Wood County on the south. The Town is in District 27 for the Marathon County Board of Supervisors. The township’s location designation if T26N – R2E is almost six miles square with the exception of the Village of Spencer taking out a section on the northeast quadrant."
258,msmarco,_doc,MARCO_6448050,5.7573285,"Norman Keith Collins, also known as Sailor Jerry, (1911–1973) is one of the most well known traditional tattoo artists. Herbert Hoffmann (1919–2010), began tattooing in Germany during the 1930s. Together with fellow artists Karlmann Richter and Albert Cornelissen he was featured in the 2004 film Blue Skin (German: Flammend' Herz)."
259,msmarco,_doc,MARCO_207593,5.755458,"Prince Harry is widely believed by DNA researchers to have a matrilineal ancestor, Eliza Kewark, who was Indian; if this is the case, it would make Prince Harry of 1/128th Indian ancestry. Prince Harry’s paternal grandfather Prince Philip was born in Mon Repos, Corfu, Greece, although he is not of Greek ancestry.n his mother’s side, Prince Harry is the grandson of John Spencer, 8th Earl Spencer (the son of Albert Spencer, 7th Earl Spencer and Lady Cynthia Hamilton) and The Honourable Frances Roche (the daughter of Maurice Roche, 4th Baron Fermoy and Ruth Roche, Baroness Fermoy)."
260,msmarco,_doc,MARCO_7808655,5.755458,"father: Prince Charles, child of Queen Elizabeth and Prince Philip. mother: Princess Diana, child of Frances Spencer and King Edward VIII. Frances Spencer was the secret child of Edward VIII's brother George and his wife Marina. Marina was first cousin to Prince Philip as their fathers were brothers.ather: Prince Charles, child of Queen Elizabeth and Prince Philip. mother: Princess Diana, child of Frances Spencer and King Edward VIII. Frances Spencer was the secret child of Edward VIII's brother George and his wife Marina. Marina was first cousin to Prince Philip as their fathers were brothers."
261,msmarco,_doc,MARCO_5060109,5.7534637,"Rodrigo Diaz de Vivar, El Cid. In 1080, when this film begins, the territory that is now Spain and Portugal was split between Christian and Muslim kingdoms. Emir Ben Yussuf (Herbert Lom) rouses the Muslim princes of the southern part, known as al-Andalus, to conquer the Christian north, some of which is known as León-Castile."
262,msmarco,_doc,MARCO_3516,5.7496066,"Herbert Paul Brooks (August 5, 1937 – August 11, 2003) was an American ice hockey coach, best known for coaching the United States hockey team to a gold medal at the 1980 Winter Olympic Games in a spectacular event known ever since as the Miracle on Ice. The Miracle on Ice was Brooks' crowning achievement and legacy."
263,msmarco,_doc,MARCO_2346311,5.7496066,"Aaron was known as Hammerin' Hank and Bad Henry during his playing career because of his considerable skills as a batter. Henry Louis Aaron was born February 5, 1934, in Mobile, one of Herbert and Estella Aaron's eight children. Hank's brother Tommie would also play for the Atlanta Braves. The Aarons grew up in a low-income section of Mobile known as Down the Bay.."
264,msmarco,_doc,MARCO_3968681,5.7342515,"As a contemporary of and successor to the Civil Rights Movement, the Black Power movement created, what sociologist Herbert H. Haines refers to as a positive radical flank effect  on political affairs of the 1960s.he first popular use of the term Black Power as a social and racial slogan was by Stokely Carmichael (later known as Kwame Ture) and Willie Ricks (later known as Mukasa Dada), both organizers and spokespersons for the Student Nonviolent Coordinating Committee (SNCC)."
265,msmarco,_doc,MARCO_198552,5.730431,"Chicago, Cook County, Illinois, United States (1994 – present) Herbert Randall Wright (born October 8, 1995), better known by his stage name G Herbo (formerly known as Lil Herb) is an American rapper and songwriter from Chicago, Illinois. Herb released his debut mixtape, Welcome to Fazoland, to critical acclaim in February 2014, followed by a second mixtape Pistol P Project in December 2014."
266,msmarco,_doc,MARCO_3288994,5.7089515,Alt-right leader Richard Spencer in Cincinnati: When and where is he speaking? Spencer is best known from the deadly Charlottesville rally in August
267,msmarco,_doc,MARCO_6676520,5.6951923,"She became Lady Diana Spencer after her father inherited the title of Earl Spencer in 1975. Although she was known for her shyness growing up, she did show an interest in music and dancing. Diana also had a great fondness for children."
268,msmarco,_doc,MARCO_2050286,5.6834736,"She grew up in Park House, situated on the Sandringham estate, and was educated in England and Switzerland. In 1975, after her father inherited the title of Earl Spencer, she became known as Lady Diana Spencer. She came to prominence in February 1981 when her engagement to Prince Charles was announced."
269,msmarco,_doc,MARCO_8176529,5.6834736,"Spencer County Kentucky Cemeteries, Then and Now. Compiled by Edna Montgomery Burgin, a listing of all known burials and burial grounds in Spencer County, over 110 in total, excluding Valley Cemetery, in three volumes, each volume 90 plus pages plus index."
270,msmarco,_doc,MARCO_2448624,5.681527,"Explain that Spencer W. Kimball was a third-generation member (first—Heber C. Kimball, second—Andrew Kimball, third—Spencer W. Kimball). As a young boy he knew some Church members who had personally known the Prophet Joseph Smith."
271,msmarco,_doc,MARCO_3288993,5.6795826,"White supremacist and leader of the so-called alt-right Richard Spencer will be coming to speak on the campus of the University of Cincinnati, but where and when exactly? The location and specific date for Spencer to speak has not yet been decided, but Enquirer research shows what UC expects to see from a visit by a known white nationalist."
272,msmarco,_doc,MARCO_8224236,5.6795826,"awards and honors. Octavia Spencer, in full Octavia Lenora Spencer (born May 25, 1970, Montgomery, Alabama, U.S.), American actress who was known for her numerous small, generally comic roles before she shot to stardom as one of the lead characters in the film The Help (2011)."
273,msmarco,_doc,MARCO_3303142,5.67376,"The exciting news that Genie Francis has just signed a three-year contract with ABC’s General Hospital has fans wondering just what is in store for her role of Laura Spencer. This iconic character is a household name thanks to the pairing with Tony Geary, also known as Luke Spencer, Laura’s former flame."
274,msmarco,_doc,MARCO_5968284,5.669888,"Laura Spencer (actress) Laura Spencer (born May 8, 1986) is an American actress. She is known for playing Jane Bennet in the web series adaptation of Pride and Prejudice and The Lizzie Bennet Diaries (2012), and for playing Emily Sweeney on the CBS television series The Big Bang Theory. 1 Career."
275,msmarco,_doc,MARCO_5968289,5.667955,"Laura Spencer (actress) From Wikipedia, the free encyclopedia. Laura Spencer (born May 8, 1986) is an American actress. She is known for playing Jane Bennet in the web series adaptation of Pride and Prejudice and The Lizzie Bennet Diaries (2012), and for playing Emily Sweeney on the CBS television series The Big Bang Theory."
276,msmarco,_doc,MARCO_7822668,5.6660233,"The Alternative Right is a term coined in 2008 by Richard Bertrand Spencer, who heads the white nationalist think tank known as the National Policy Institute, to describe a loose set of far-right ideals centered on “white identity” and the preservation of “Western civilization.” In 2010, Spencer, who had done stints as an editor of The American ..."
277,msmarco,_doc,MARCO_5669456,5.6640935,"Dates: April 16, 1889 -- December 25, 1977. Also Known As: Charles Spencer Chaplin, Sir Charlie Chaplin, The Tramp. Charles Spencer Chaplin was born on April 16, 1889, in South London. His mother, Hannah Chaplin (nee Neé), hill was a vaudeville (singer stage Name Lily). harley"
278,msmarco,_doc,MARCO_3131314,5.662166,"View Resume | Official Photos ». Spencer Boldman is an American actor, born July 28, 1992 in Dallas, Texas. He grew up in Plano. Spencer is known for starring in the series Lab Rats (2012)_ and the TV movie _Zapped (2014)_, and will play the male lead in the film Cruise (2016), written and directed by Rob Siegel."
279,msmarco,_doc,MARCO_7815012,5.662166,"British royalty Princess Diana Spencer was born on July 1, 1961, near Sandringham, England. Diana, Princess of Wales, was one of the most adored members of the British royal family. She was the daughter of Edward John Spencer, Viscount Althorp, and Frances Ruth Burke Roche, Viscountess Althorp (later known as the Honorable Frances Shand Kydd)."
280,msmarco,_doc,MARCO_8423050,5.658316,"Janelle Monáe, left, Taraji P. Henson and Octavia Spencer in “Hidden Figures,” which is slated for release in January. ATLANTA — Taraji P. Henson hates math, and Octavia Spencer has a paralyzing fear of calculus, but that didn’t stop either actress from playing two of the most important mathematicians the world hasn’t ever known."
281,msmarco,_doc,MARCO_8224234,5.646811,"Janelle Monáe, left, Taraji P. Henson and Octavia Spencer in “Hidden Figures,” which is slated for release in January. Credit Hopper Stone/20th Century Fox ATLANTA — Taraji P. Henson hates math, and Octavia Spencer has a paralyzing fear of calculus, but that didn’t stop either actress from playing two of the most important mathematicians the world hasn’t ever known."
282,msmarco,_doc,MARCO_8224233,5.646811,"Uncovering a Tale of Rocket Science, Race and the ’60s. Janelle Monáe, left, Taraji P. Henson and Octavia Spencer in “Hidden Figures,” which is slated for release in January. ATLANTA — Taraji P. Henson hates math, and Octavia Spencer has a paralyzing fear of calculus, but that didn’t stop either actress from playing two of the most important mathematicians the world hasn’t ever known."
283,msmarco,_doc,MARCO_1937839,5.5149293,"Diana Frances Spencer was her name.She was the daughter of Earl Edward Johnnie Spencer(8th Earl Spencer),and bore the courtesy honorific of Lady.."
284,msmarco,_doc,MARCO_1788547,5.51312,George Herbert Mead on the self. Sociologists sometimes come back to George Herbert Mead as a founder who still has something important to contribute to contemporary theory.
285,msmarco,_doc,MARCO_7203136,5.5121355,"54 people named Herbert Pollack found in New York, Florida and 14 other states. Click a state below to find Herbert more easily."
286,msmarco,_doc,MARCO_1037780,5.5111513,"Herbert Hoover-The Man. Herbert Hoover, 31st President of the United States, was a man of many interests. He was an engineer, a conservationist, a fisherman, a humanitarian, and a politician, not always in the same order."
287,msmarco,_doc,MARCO_8484312,5.5111513,Symbolic interactionism was developed by thinkers such George Herbert Mead and Herbert Blumer in the 20th century. Mead believed that one's self develops through social interactions.
288,msmarco,_doc,MARCO_4945482,5.5101686,"Herbert Hoover and the Colorado River. Herbert Hoover, 31st President of the United States, was a man of many interests. He was an engineer, a conservationist, a fisherman, a humanitarian, and a politician, not always in the same order."
289,msmarco,_doc,MARCO_4699169,5.5100203,"Spencer Sheriff. Find Spencer Oklahoma sheriff's office, department, headquarters, jail and detention center. Sheriffs provide information on records, arrests, inmates, warrants, and mugshots. Spencer Sheriff."
290,msmarco,_doc,MARCO_7063687,5.5100203,"Princess Diana was born Diana Frances Spencer on July 1, 1961. Her parents were Edward John and Frances Spencer Viscount and Viscountess Althorp, later Earl and Countess Spencer."
291,msmarco,_doc,MARCO_3597174,5.5091867,"Burke & Herbert Bank Personal Checking. At Burke & Herbert Bank, we’ve made checking accounts more than just simple and convenient; we’ve made them rewarding."
292,msmarco,_doc,MARCO_5401323,5.5091867,"Hence the name: the Hoover Institution on War, Revolution and Peace. It was the creation of the first Herbert Hoover. The second Herbert Hoover, whom I knew, was a bitter man crushed by defeat and generally unbeloved."
293,msmarco,_doc,MARCO_5413691,5.5091867,"George Herbert Mead (1863—1931) George Herbert Mead is a major figure in the history of American philosophy, one of the founders of Pragmatism along with Peirce, James, Tufts, and Dewey."
294,msmarco,_doc,MARCO_8207983,5.5090413,"Owen County Courthouse, Spencer, Indiana Spencer, Indiana, was named after a soldier, George Spencer, who fought in the Battle of Tippecanoe on 7 November 1811, and died on the battlefield after being shot three times."
295,msmarco,_doc,MARCO_7141621,5.5090413,"The ancestors of the Spencer family migrated to England following the Norman Conquest of 1066. The surname Spencer is for a butler or steward. The surname Spencer was originally derived from the Old French word despensier, of the same meaning."
296,msmarco,_doc,MARCO_703903,5.508206,"Herbert is a mild form of abuse meaning a silly, or dim-witted person. The origin of this term seems to be that it was derived from the name Herbert, which meant bright.. It was used in the very direct opposite, to mean dumb."
297,msmarco,_doc,MARCO_1798834,5.508206,"Herbert is quite a bold name and a welcome find. Sweet yet elegant, the name is a great blend of character and flair. A creative name, that may be just right for you. Herbert falls into the classic name category."
298,msmarco,_doc,MARCO_4741553,5.508206,"The Memoirs Of Herbert Hoover: The Cabinet and the Presidency, 1920–1933 (1952) The Memoirs Of Herbert Hoover: 1929 - 1941 the Great Depression (1952) The Ordeal of Woodrow Wilson (1958)"
299,msmarco,_doc,MARCO_8222629,5.508206,Herb Simon; Herbert A. Simon; Herbert Alexander Simon; Simon. Instance hypernyms: economic expert; economist (an expert in the science of economics) psychologist (a scientist trained in psychology)
300,msmarco,_doc,MARCO_8207978,5.5080633,"Spencer County Spencer county bears the name of the patriotic Captain Spier Spencer, of Harrison county, who fell in the battle of Tippecanoe. The south part of the county is level, the middle undulating, and the northeast hilly."
301,msmarco,_doc,MARCO_8324121,5.5080633,"In iWanna Stay With Spencer, it was implied Carly used to be a sick child. According to Spencer, she has to take vitamins every day and suffers from allergies and asthma. She had her last asthma attack when she was seven years old. Spencer gives her decaffeinated coffee although she is not aware of this."
302,msmarco,_doc,MARCO_4638322,5.507226,"Herbert Hoover's name is mentioned in the famous theme song to All in the Family with the lyrics...Mister, we could use a man like Herbert Hoover again. The show ranked number-one in the yearly Nielsen ratings from 1971 to 1976."
303,msmarco,_doc,MARCO_6079166,5.5070863,"Criminal Minds: Feb. 15, 2017 Spencer. Spencer Reid, one of the team's own, is arrested in Mexico for drug trafficking and murder. And while it's obvious to Spencer's FBI friends that he's being framed, it isn't so cut and dried for the Mexican authorities."
304,msmarco,_doc,MARCO_8753524,5.5070863,"Well, maybe I have something for you in store. A couple of weeks ago I've created a style guide based on each little liar and this (and unfortunately already the last one) is all about Spencer Hasting's gorgeous preppy style. Read here to find out about all the tips & tricks to get Spencer's look! SPENCER HASTINGS."
305,msmarco,_doc,MARCO_634547,5.506247,Herbert F. Johnson Museum of Art added 9 new photos from September 10 to the album: Fall 2015 Opening Reception — at Herbert F. Johnson Museum of Art.
306,msmarco,_doc,MARCO_4417635,5.506247,"Herbert J. Cohen, M.D. Professional Interests. Dr Herbert J. Cohen is an internationally recognized expert in developmental disabilities including autism, intellectual disabilities, cerebral palsy and learning disabilities."
307,msmarco,_doc,MARCO_2700934,5.50611,"Current Local Time: Spencer, Iowa is in the Central Time Zone: The Current Time in Spencer, Iowa is: Thursday 2/1/2018 3:36 PM CST Spencer, Iowa is in the Central Time Zone"
308,msmarco,_doc,MARCO_2315996,5.50611,"Spencer was born in London on 20 May 1964 and named Charles Edward Maurice, with Queen Elizabeth II as his godmother. His parents were then called Viscount and Viscountess Althorp, as his grandfather Albert Spencer, 7th Earl Spencer, was still alive."
309,msmarco,_doc,MARCO_4693692,5.50611,"Comments and insights on the name Spencer: | Edit. A male name, definitely not female. Pronounced Spen-sir. I love the name Spencer for a boy, not much a fan of it for a girl. I am a girl, and named Spencer, and I happen to think it's good for both genders."
310,msmarco,_doc,MARCO_8504286,5.50611,"At the festival, Spencer gets a text from Toby, telling her to meet him in the funhouse. The text, however, was not really from Toby, it was a set-up from A.. Spencer gets trapped in the funhouse until Ian and her family show up and free her. Then Spencer gets a real text from Toby asking where she is."
311,msmarco,_doc,MARCO_244260,5.505269,"Herbert Hoover. Herbert Clark Hoover (August 10, 1874 – October 20, 1964) was an American politician who served as the 31st President of the United States from 1929 to 1933 during the Great Depression."
