,_index,_type,_id,_score,_source.body
0,msmarco,_doc,MARCO_8479667,11.977543,"Herbert Spencer. For other people named Herbert Spencer, see Herbert Spencer (disambiguation). Herbert Spencer (27 April 1820 – 8 December 1903) was an English philosopher, biologist, anthropologist, sociologist, and prominent classical liberal political theorist of the Victorian era."
1,msmarco,_doc,MARCO_8479669,11.83728,"Herbert Spencer was a theorist whose valuable insights have often been drowned in a sea of irrelevance and spacious reasoning. He is popularly known as the British Aristotle and often called the second founding father of sociology. Spencer's ideas have left an indelible impression on the succeeding writers. Spencer's name was associated with the birth of sociology in England. Herbert Spencer was born an April 27, 1820, in Derby in England."
2,msmarco,_doc,MARCO_5195831,11.678907,"Herbert Spencer: An Estimate and Review (1904) by Josiah Royce. Lectures on the Ethics of T.H. Green, Mr. Herbert Spencer, and J. Martineau (1902) by Henry Sidgwick. Spencer-smashing at Washington (1894) by Lester F. Ward. A Perplexed Philosopher (1892) by Henry George. A Few Words with Mr Herbert Spencer (1884) by Paul Lafargue."
3,msmarco,_doc,MARCO_8064768,11.533332,"Herbert Spencer (1820—1903) British philosopher and sociologist, Herbert Spencer was a major figure in the intellectual life of the Victorian era. He was one of the principal proponents of evolutionary theory in the mid nineteenth century, and his reputation at the time rivaled that of Charles Darwin. Spencer was initially best known for developing and applying evolutionary theory to philosophy, psychology and the study of society -- what he called his synthetic philosophy (see his A System of Synthetic Philosophy, 1862-93)."
4,msmarco,_doc,MARCO_7280595,11.280567,"Herbert Spencer. Herbert Spencer (1820–1903) is typically, though quite wrongly, considered a coarse social Darwinist. After all, Spencer, and not Darwin, coined the infamous expression “survival of the fittest”, leading G. E. Moore to conclude erroneously in Principia Ethica (1903) that Spencer committed the naturalistic fallacy."
5,msmarco,_doc,MARCO_5195827,11.272839,"Herbert W. Spencer. Herbert Winfield Spencer (April 7, 1905 – September 18, 1992) was a Chilean-born American film and television composer and orchestrator. Spencer gained industry fame when he teamed up with fellow 20th Century Fox orchestrator Earle Hagen in 1953 to create the Spencer-Hagen Orchestra."
6,msmarco,_doc,MARCO_3973817,11.221432,"British philosopher Herbert Spencer went a step beyond Darwin's theory of evolution and applied it to the development of human society. In the late 1800s, many Americans enthusiastically embraced Spencer's Social Darwinism to justify laissez-faire, or unrestricted, capitalism.In 1859, Charles Darwin published Origin of Species, which explained his theory of animal and plant evolution based on natural selection..ritish philosopher Herbert Spencer went a step beyond Darwin's theory of evolution and applied it to the development of human society. In the late 1800s, many Americans enthusiastically embraced Spencer's Social Darwinism to justify laissez-faire, or unrestricted, capitalism."
7,msmarco,_doc,MARCO_3519190,10.999693,"Spencer, Herbert. Herbert Spencer (1820-1903), the English philosopher-scientist, was a leading figure in the intellectual revolution of the nineteenth century. Although largely ignored today, Spencer in his own time was enormously influential and played a significant role in the development of biology, psychology, sociology, and anthropology."
8,msmarco,_doc,MARCO_709709,10.988077,"Herbert Spencer by Miss A. Grant. [Click on thumbnail for larger picture. A Victorian biologist and philosopher, Herbert Spencer was born April 27th, 1820, at the height of British industrialism. He was educated at home in mathematics, natural science, history and English, among some other languages. Spencer was sickly in his youth, all eight of his other siblings dying at a young age."
9,msmarco,_doc,MARCO_5195834,10.982294,"Herbert Spencer. Herbert Spencer (27 April 1820 – 8 December 1903) was an English philosopher, biologist, anthropologist, sociologist, and prominent classical liberal political theorist of the Victorian era. Spencer developed an all-embracing conception of evolution as the progressive development of the physical world, biological organisms, the human mind, and human culture and societies."
10,msmarco,_doc,MARCO_3973811,10.91231,"Social Darwinism was the application of Charles Darwin`s scientific theories of evolution and natural selection to contemporary social development.In nature, only the fittest survivedso too in the marketplace.This form of justification was enthusiastically adopted by many American businessmen as scientific proof of their superiority. Leading proponents of Social Darwinism included the following: 1  Herbert Spencer (1820-1903).2  Spencer was an English social philosopher and prime advocate of Darwin`s theories, perhaps doing more than any other figure of his era to gain acceptance for the theory of evolution.n nature, only the fittest survivedso too in the marketplace. This form of justification was enthusiastically adopted by many American businessmen as scientific proof of their superiority. Leading proponents of Social Darwinism included the following: 1  Herbert Spencer (1820-1903)."
11,msmarco,_doc,MARCO_7897846,10.619646,"But the expression often used by Mr. Herbert Spencer, of the Survival of the Fittest, is more accurate, and is sometimes equally convenient.”. Herbert Spencer (1820-1903) was the eldest of nine children, all the rest of whom died in infancy."
12,msmarco,_doc,MARCO_5195833,10.61376,"Herbert W. Spencer; Born: Herbert Winfield Spencer April 7, 1905 Santiago, Chile: Died: September 18, 1992 (aged 87) Culver City, California"
13,msmarco,_doc,MARCO_7280593,10.607893,"Herbert Spencer, not Darwin, coined the term Survival of the Fittest. Find this Pin and more on Social Justice by HealthyEatingCO. The Richest Man in the World: Andrew Carnegie . Herbert Spencer, not Darwin, coined the term Survival of the Fittest. See More"
14,msmarco,_doc,MARCO_7280590,10.602041,"Herbert Spencer (1820—1903) British philosopher and sociologist, Herbert Spencer was a major figure in the intellectual life of the Victorian era. He was one of the principal proponents of evolutionary theory in the mid nineteenth century, and his reputation at the time rivaled that of Charles Darwin."
15,msmarco,_doc,MARCO_420775,10.596209,"Internet Encyclopedia of Philosophy. Herbert Spencer (1820—1903) British philosopher and sociologist, Herbert Spencer was a major figure in the intellectual life of the Victorian era. He was one of the principal proponents of evolutionary theory in the mid nineteenth century, and his reputation at the time rivaled that of Charles Darwin."
16,msmarco,_doc,MARCO_6099605,10.576884,"Karl Marx is the father of the conflict theory in sociology. The fathers of sociology include Émile Durkheim, Karl Marx, Herbert Spencer, and Auguste Comte. Karl Marx is the father of the conflict theory in sociology. The fathers of sociology include Émile Durkheim, Karl Marx, Herbert Spencer, and Auguste Comte. Karl Marx is the father of the conflict theory in sociology."
17,msmarco,_doc,MARCO_7143760,10.569206,"Herbert Spencer coined the phrase survival of the fittest. Survival of the fittest is a phrase that originated from Darwinian evolutionary theory as a way of describing the mechanism of natural selection. The biological concept of fitness is defined as reproductive success. In Darwinian terms the phrase is best understood as Survival of the form that will leave the most copies of itself in successive generations. Herbert Spencer first used the phrase, after reading Charles Darwin's On the Origin of Species, in his Principles of Biology, in which he"
18,msmarco,_doc,MARCO_2511685,10.55394,"Herbert Spencer, a 19th century philosopher, promoted the idea of Social Darwinism. Social Darwinism is an application of the theory of natural selection to social, political, and economic issues.In its simplest form, Social Darwinism follows the mantra of the strong survive, including human issues.t is important to note that Darwin did not extend his theories to a social or economic level, nor are any credible evolutionists subscribing to the theories of Social Darwinism. Herbert Spencer's philosophy is only loosely based on the premises of Darwin's work."
19,msmarco,_doc,MARCO_2511693,10.55394,social darwinism. A term associated with Herbert Spencer (1820–1903) who applied Darwin’s theory of evolution to the social sphere. This postulated that natural selection allows those members of society who are well adapted to their social environment to flourish while the others fall by the wayside.ocial darwinism. A term associated with Herbert Spencer (1820–1903) who applied Darwin’s theory of evolution to the social sphere. This postulated that natural selection allows those members of society who are well adapted to their social environment to flourish while the others fall by the wayside.
20,msmarco,_doc,MARCO_2575680,10.55394,"The father of social Darwinism. by Russell Grigg. Herbert Spencer (1820–1903) was an enormously influential English philosopher and agnostic of the Victorian era who coined the term ‘survival of the fittest’.Dubbed ‘the philosopher of the Evolution movement’, he published a theory of evolution seven years before Darwin.he father of social Darwinism. by Russell Grigg. Herbert Spencer (1820–1903) was an enormously influential English philosopher and agnostic of the Victorian era who coined the term ‘survival of the fittest’."
21,msmarco,_doc,MARCO_4555243,10.55394,"The work of such classical sociological theorists as Auguste Comte, Karl Marx, Herbert Spencer, Emile Durkheim, Max Weber, Georg Simmel, and Vilfredo Pareto was important in its time and played a central role in the subsequent development of sociology.he work of such classical sociological theorists as Auguste Comte, Karl Marx, Herbert Spencer, Emile Durkheim, Max Weber, Georg Simmel, and Vilfredo Pareto was important in its time and played a central role in the subsequent development of sociology."
22,msmarco,_doc,MARCO_3973816,10.546349,"As the name suggests, Social Darwinism is a theory based on Charles Darwin s scientific findings in On the Origins of Species. Herbert Spencer, an English intellectual and Social Darwinist, applied the study to economic life and actually coined the phrase survival of the fittest.s the name suggests, Social Darwinism is a theory based on Charles Darwin s scientific findings in On the Origins of Species. Herbert Spencer, an English intellectual and Social Darwinist, applied the study to economic life and actually coined the phrase survival of the fittest."
23,msmarco,_doc,MARCO_7897847,10.513238,Spencer and the Fittest. Herbert Spencer was a 19th-century philosopher and social idealist. He was known to be a strong supporter of Darwin's methods of evolution and a supporter of the evolutionary process by way of his writings and critiques of others.
24,msmarco,_doc,MARCO_2575682,10.275864,"It was Spencer, not Darwin, who first popularized the term ‘evolution’; it was Spencer who coined the term ‘survival of the fittest’. Spencer’s theory of evolution was basically Lamarckism, i.e. that organs develop or diminish by use or disuse, and that such changes are inherited by future generations.he father of social Darwinism. by Russell Grigg. Herbert Spencer (1820–1903) was an enormously influential English philosopher and agnostic of the Victorian era who coined the term ‘survival of the fittest’."
25,msmarco,_doc,MARCO_8712692,10.135104,"These nouns refer to what is known, as through study or experience. Knowledge is the broadest: Science is organized knowledge (Herbert Spencer). Information often implies a collection of facts and data: A man's judgment cannot be better than the information on which he has based it. (Arthur Hays Sulzberger).. Metaphysics. the doctrine that the reality of perceived external objects is known intuitively, without the intervention of a representative idea. 2. Metaphysics. the doctrine that knowledge rests upon axiomatic truths discerned intuitively."
26,msmarco,_doc,MARCO_7897854,9.928501,"In the early 1850s, according to historian Richard Hofstadter, Herbert Spencer . . . coined the phrase survival of the fittest.. Spencer's phrase referred to competition both in human. economics and in animal life."
27,msmarco,_doc,MARCO_709706,9.926539,"In simple terms, it is as if Spencer's phrase, the survival of the fittest, had been claimed by him as the basis of a political doctrine. But there's a problem with Hofstadter's celebrated work: His claims bear almost no resemblance to the real Herbert Spencer."
28,msmarco,_doc,MARCO_3298972,9.92458,"While Darwin coined the term struggle for survival, it was Herbert Spencer (1820-1903) who invented and popularized the concept of survival of the fittest, and Spencer is widely considered the chief proponent of social Darwinism."
29,msmarco,_doc,MARCO_3112995,9.912861,"Despite the fact that social Darwinism bears Charles Darwin's name, it is also linked today with others, notably Herbert Spencer, Thomas Malthus, and Francis Galton, the founder of eugenics. In fact, Spencer was not described as a social Darwinist until the 1930s, long after his death."
30,msmarco,_doc,MARCO_8479672,9.912861,"Childhood/Family Life. Herbert Spencer was born on April 27, 1820 in Derby, England (Bolender 2004). He was the first child born in a family that had nine children. Of the nine children, Spencer was the only child to survive infancy. His parents were George and Harriet."
31,msmarco,_doc,MARCO_7897851,9.910914,"Who coined the phrase “the survival of the fittest”? Herbert Spencer. Spencer was an engineer, philosopher, and psychologist, who in his day was as famous as Darwin. He first coined the phrase “survival of the fittest” in his Principles of Biology (1864), having been inspired by Darwin’s theory of natural selection."
32,msmarco,_doc,MARCO_6090212,9.887703,"British philosopher Herbert Spencer went a step beyond Darwin's theory of evolution and applied it to the development of human society. In the late 1800s, many Americans enthusiastically embraced Spencer's Social Darwinism to justify laissez-faire, or unrestricted, capitalism. In 1859, Charles Darwin published Origin of Species, which explained his theory of animal and plant evolution based on natural selection.."
33,msmarco,_doc,MARCO_2511692,9.883861,"Social Darwinism was the application of Charles Darwin`s scientific theories of evolution and natural selection to contemporary social development.In nature, only the fittest survivedso too in the marketplace.eading proponents of Social Darwinism included the following: 1  Herbert Spencer (1820-1903). 2  Spencer was an English social philosopher and prime advocate of Darwin`s theories, perhaps doing more than any other figure of his era to gain acceptance for the theory of evolution."
34,msmarco,_doc,MARCO_5195832,9.880026,"Herbert Spencer was an English philosopher, biologist, anthropologist, sociologist, and prominent classical liberal political theorist of the Victorian era. Spencer developed an all-embracing conception of evolution as the progressive development of the physical world, biological organisms, the human mind, and human culture and societies. As a polymath, he contributed to a wide range of subjects, including ethics, religion, anthropology, economics, political theory, philosophy, literature, astro"
35,msmarco,_doc,MARCO_6310530,9.880026,"Ecology is not just biological, but a human science as well. An early and influential social scientist in the history of human ecology was Herbert Spencer. Spencer was influenced by and reciprocated his influence onto the works of Charles Darwin.owever, the term appears to have come into common use in the medical and public health literature in the mid-twentieth century. This was strengthened in 1971 by the publication of Epidemiology as Medical Ecology, and again in 1987 by the publication of a textbook on Public Health and Human Ecology."
36,msmarco,_doc,MARCO_3973815,9.868565,"Despite the fact that social Darwinism bears Charles Darwin's name, it is also linked today with others, notably Herbert Spencer, Thomas Malthus, and Francis Galton, the founder of eugenics. In fact, Spencer was not described as a social Darwinist until the 1930s, long after his death.he term Darwinism had been coined by Thomas Henry Huxley in his April 1860 review of  On the Origin of Species , and by the 1870s it was used to describe a range of concepts of evolutionism or development, without any specific commitment to Charles Darwin 's own theory."
37,msmarco,_doc,MARCO_8629242,9.8647585,"Despite the fact that social Darwinism bears Charles Darwin's name, it is also linked today with others, notably Herbert Spencer, Thomas Malthus, and Francis Galton, the founder of eugenics. In fact, Spencer was not described as a social Darwinist until the 1930s, long after his death. can find nothing in the Brehon laws to warrant this theory of social Darwinism, and believe further study will show that the Cain Saerrath and the Cain Aigillue relate solely to what we now call chattels, and did not in any way affect what we now call the freehold, the possession of the land."
38,msmarco,_doc,MARCO_4744687,9.857168,"Social Darwinism: The Theory of Evolution Applied to Human Society. Social Darwinism was the application of Charles Darwin`s scientific theories of evolution and natural selection to contemporary social development. In nature, only the fittest survived—so too in the marketplace. This form of justification was enthusiastically adopted by many American businessmen as scientific proof of their superiority. Leading proponents of Social Darwinism included the following: Herbert Spencer (1820-1903). Spencer was an English social philosopher and prime advocate of Darwin`s theories, perhaps doing more than any other figure of his era to gain acceptance for the theory of evolution."
39,msmarco,_doc,MARCO_4898632,9.823069,"For the most part it advocated state intervention in society and protectionist practice (economic, but also racial protection: ‘The purity of the race is in danger')[2]. The most well-known representative of this ideology is a contemporary of Darwin, Herbert Spencer."
40,msmarco,_doc,MARCO_8310284,9.814275,"These nouns refer to what is known, as through study or experience. Knowledge is the broadest: Science is organized knowledge (Herbert Spencer). Information often implies a collection of facts and data: A man's judgment cannot be better than the information on which he has based it. (Arthur Hays Sulzberger)."
41,msmarco,_doc,MARCO_1093038,9.805508,"These nouns refer to what is known, as through study or experience. Knowledge is the broadest: “Science is organized knowledge” (Herbert Spencer). Information often implies a collection of facts and data: “A man's judgment cannot be better than the information on which he has based it” (Arthur Hays Sulzberger)."
42,msmarco,_doc,MARCO_4663890,9.793857,"Durkheim (1858-1917) who devoted himself to the scientific study of sociology is widely regarded as a pioneer in French sociology. It is known that Emile Durkheim inherits some of Auguste Comte and Herbert Spencer's ideas and developed a systematic sociology both in theory and methodology (Mo&ntilde;ivas, 2007, p. 18)."
43,msmarco,_doc,MARCO_5290601,9.790951,"The term, sociology, meaning the study of society was given to this new science by the man. He suggested applying the scientific method, known as positivism, to society. Herbert Spencer is referred as the second founder of sociology. Unlike Comte, he thinks that sociology should not influence social reform. He thinks that the evolution of society should be left to improve on its own."
44,msmarco,_doc,MARCO_8479668,9.779357,Herbert Spencer (1820 - 1903) - Strongly influenced by the views of Charles Darwin. - Biologicial Model of Society society is sa set of interdependent parts that work together to maintain the system over time. - Used Darwin's theory of evolution to describe the nature of society. - Social change + unrest = evolution toward stability and perfection. - Ideas became known as social Darwinism.
45,msmarco,_doc,MARCO_278216,9.747702,"the social sciences, sociology emerged in Western Europe as a distinct discipline in the mid-1800s. Auguste Comte, Herbert Spencer, Karl Marx, Emile Durkheim, and Max Weber were early thinkers in the development of sociology. The idea of applying the scientific method to the social world, known as positivism, was first proposed by Auguste Comte. Based on this innovation and Comte’s effort to apply the scientific method to social life, he is credited as being the founder of sociology."
46,msmarco,_doc,MARCO_3519191,9.249135,Herbert Spencer was a British philosopher and anthropologist during  the Victorian era. He coined the phrase survival of the fittest  and used it in his Principles of Biol…ogy in 1864.
47,msmarco,_doc,MARCO_419395,9.243233,"You've simply borrowed an idea that's not your own, but you've distorted it, and are trying to apply it where it's not applicable. What I want you to observe is that in Herbert Spencer's definition of 'life' the activity of a machine is included--there is nothing in the definition that is not applicable to it."
48,msmarco,_doc,MARCO_7143755,9.241268,"Many believe that Charles Darwin coined the term survival of the fittest. In fact, it was philosopher Herbert Spencer. According to science, evolution means much more th … an just natural selection of the strongest."
49,msmarco,_doc,MARCO_996937,9.239307,"At home was several hours' hack-work waiting for him before he went to bed, and after he went to bed there was a volume of Weismann waiting for him, to say nothing of Herbert Spencer's Autobiography, which was as replete for him with romance as any thrilling novel."
50,msmarco,_doc,MARCO_1327609,9.239307,Social Darwinism  is a derogatory term associated with the 19th century Malthusian theory developed by Whig philosopher Herbert Spencer. It is associated with evolutionary theory but now widely regarded as unwarranted.
51,msmarco,_doc,MARCO_4318575,9.239307,Soundtrack for movie of same name. Music composed and conducted by Alfred Newman (nominated for an Oscar for the title song along with lyricist Sammy Cahn). Orchestrations by Earle Hagen and Herbert Spencer.
52,msmarco,_doc,MARCO_4744684,9.239307,"Social Darwinists held that the life of humans in society was a struggle for existence ruled by “survival of the fittest,” a phrase proposed by the British philosopher and scientist Herbert Spencer."
53,msmarco,_doc,MARCO_8133932,9.239307,"Survival of the fittest is a famous phrase of Herbert Spencer which describes the idea that there is, in nature, competition to survive and reproduce. It is a metaphor, as are the phrases struggle for existence, and natural selection, both of which were used by Charles Darwin."
54,msmarco,_doc,MARCO_709701,9.237347,"Herbert Spencer (27 April 1820 – 8 December 1903) was an English philosopher, biologist, anthropologist, sociologist, and prominent classical liberal political theorist of the Victorian era."
55,msmarco,_doc,MARCO_1327611,9.237347,"Social Darwinism is a belief, which became popular in England, Europe and America, in the late 19th and early 20th centuries. Herbert Spencer, an English philosopher in the 19th century was one of the most important Social Darwinists."
56,msmarco,_doc,MARCO_2541216,9.237347,Herbert Spencer was one of the leading sociologists of his time and was an influencer of the structural-functionalist perspective. Learn more about the man who coined the phrase 'survival of the fittest' and understand the positive and negative aspects of social Darwinism.
57,msmarco,_doc,MARCO_3519193,9.237347,"A: Survival of the fittest was the phrase that was coined by Herbert Spencer to describe only the fittest societies surviving over time, thus upgrading the world as a whole. Expert answered|niKlaus|Points 284|. Log in to see link for more information."
58,msmarco,_doc,MARCO_5195829,9.237347,"Learn about Herbert Spencer Gasser: his birthday, what he did before fame, his family life, fun trivia facts, popularity rankings, and more. Fun facts: before fame, family life, popularity rankings, and more."
59,msmarco,_doc,MARCO_7897849,9.237347,"Himmelfarb, discussing this essay, asserts even more directly that. the phrase, 'survival of the fittest' was used here for the first. time.8 James Rogers, citing A Theory of Population, affirms. that Herbert Spencer used the phrase 'survival of the fittest' as."
60,msmarco,_doc,MARCO_5283127,9.23539,"Cooley s most important concept, that of the looking-glass self, is very Spencerian in nature. As Herbert Spencer wrote of the importance of the components of society, the individuals, so Cooley picked up with how the individuals, in turn, develop from society."
61,msmarco,_doc,MARCO_5774043,9.23539,"Another word for effect. These nouns denote an occurrence, situation, or condition that is caused by an antecedent. An effect is produced by the action of an agent or a cause and follows it in time: “Every cause produces more than one effect” (Herbert Spencer)."
62,msmarco,_doc,MARCO_3298968,9.233433,"It is important to note that Darwin did not extend his theories to a social or economic level, nor are any credible evolutionists subscribing to the theories of Social Darwinism. Herbert Spencer's philosophy is only loosely based on the premises of Darwin's work."
