,_index,_type,_id,_score,_source.body
665,msmarco,_doc,MARCO_4479584,5.316693,"When Tan died, Broca examined his brain and found that there was damage to part of the left frontal cortex. This part of the brain has come to be known as Broca's Area.. In 1876, Karl Wernicke found that damage to a different part of the brain also caused language problems.This area of the brain (Wernicke's Area), was further back and lower in the brain compared to Broca's area. In fact, Wernicke's area is in the posterior part of the temporal lobe.n most people (97%), both Broca's area and Wernicke's area are found in only the left hemisphere of the brain. In the early 1950s, the famous neurosurgeon Wilder Penfield and his colleague Herbert Jasper, described how electrical stimulation of certain areas of the brain blocked language."
666,msmarco,_doc,MARCO_8487146,5.316693,"1 November 6 – U.S. presidential election, 1928: Republican Herbert Hoover wins by a wide margin over Democratic Governor of New York Alfred E. Smith. 2  November 17 – The Boston Garden opens in Boston.3  November 18 – Mickey Mouse appears in Steamboat Willie, the third Mickey Mouse cartoon released, but the first sound film. May 10 – The first regular schedule of television programming begins in Schenectady, New York by the General Electric 's television station W2XB (the station is popularly known as WGY Television, after its sister radio station WGY)."
667,msmarco,_doc,MARCO_1123547,5.309216,"Tutankhamun was an Egyptian pharaoh of the 18th dynasty, during the period of Egyptian history known as the New Kingdom. He is popularly referred to as King Tut.His original name, Tutankhaten, means Living Image of Aten, while Tutankhamun means Living Image of Amun.In hieroglyphs, the name Tutankhamun was typically written Amen-tut-ankh, because of a scribal custom that placed a divine name at the beginning of a phrase to show appropriate reverence.he 1922 discovery by Howard Carter and George Herbert, 5th Earl of Carnarvon of Tutankhamun's nearly intact tomb received worldwide press coverage. It sparked a renewed public interest in ancient Egypt, for which Tutankhamun's burial mask remains the popular symbol."
668,msmarco,_doc,MARCO_3614895,5.3089175,"Producer | Actress. Iman was born on July 25, 1955 in Mogadishu, Somalia as Iman Abdulmajid. She is a producer and actress, known for Project Runway Canada (2007), Out of Africa (1985) and No Way Out (1987).She has been married to David Bowie since June 6, 1992. They have one child.She was previously married to Spencer Haywood.roducer | Actress. Iman was born on July 25, 1955 in Mogadishu, Somalia as Iman Abdulmajid. She is a producer and actress, known for Project Runway Canada (2007), Out of Africa (1985) and No Way Out (1987). She has been married to David Bowie since June 6, 1992."
669,msmarco,_doc,MARCO_4257528,5.2869525,"Key is best known for writing the words to the national anthem of the United States of America, 'The Star-Spangled Banner'. (Photo by FPG/Archive Photos/Getty Images). On March 3, 1931, U.S. President Herbert Hoover signed an act that officially made The Star Spangled Banner the national anthem for the United States.Before this time, the United States had been without any national anthem.History of The Star Spangled Banner.The words of The Star Spangled Banner were first written on September 14, 1814 by Francis Scott Key as a poem titled, The Defence of Fort McHenry..efore this time, the United States had been without any national anthem. History of The Star Spangled Banner. The words of The Star Spangled Banner were first written on September 14, 1814 by Francis Scott Key as a poem titled, The Defence of Fort McHenry.."
670,msmarco,_doc,MARCO_4931928,5.2869525,"Description: Puush.exe is not essential for the Windows OS and causes relatively few problems. Puush.exe is located in a subfolder of C:\Program Files. Known file sizes on Windows 8/7/XP are 567,880 bytes (60% of all occurrences), 565,480 bytes or 568,904 bytes. The application has no file description.The puush.exe file is certified by a trustworthy company.Puush.exe is not a Windows core file. The program has no visible window. The process is loaded during the Windows boot process (see Registry key: ).Puush.exe is able to record keyboard and mouse inputs. Therefore the technical security rating is 37% dangerous. Dean Herbert) or consult PPY 's Customer Service.he puush.exe file is certified by a trustworthy company. Puush.exe is not a Windows core file. The program has no visible window. The process is loaded during the Windows boot process (see Registry key: )."
671,msmarco,_doc,MARCO_7418455,5.2789545,"Well known former pupils include the 19th-century parliamentary leader John Bright, mathematician Lewis Fry Richardson (father of fractals ), historian A.J.P Taylor, the Nobel peace prize winner of 1959 Philip John Noel-Baker, Cabinet Secretary Sir Jeremy Heywood and Stuart Rose, Chief Executive of Marks & Spencer.ell known former pupils include the 19th-century parliamentary leader John Bright, mathematician Lewis Fry Richardson (father of fractals ), historian A.J.P Taylor, the Nobel peace prize winner of 1959 Philip John Noel-Baker, Cabinet Secretary Sir Jeremy Heywood and Stuart Rose, Chief Executive of Marks & Spencer."
672,msmarco,_doc,MARCO_1937837,5.116377,Princess Diana's maiden name was Spencer as when her grandfather died her father became Earl Spencer and she became a Lady.
673,msmarco,_doc,MARCO_4693689,5.116377,I like the name Spencer and it never made me think of dispenser until now lol. I think Spencer is good as a first or middle name.
674,msmarco,_doc,MARCO_1937838,5.114401,Report Abuse. Princess Diana's maiden name was Spencer as when her grandfather died her father became Earl Spencer and she became a Lady.
675,msmarco,_doc,MARCO_2700937,5.114401,"Current local time in Spencer, Iowa with information about Spencer, Iowa time zones and daylight saving time."
676,msmarco,_doc,MARCO_6526940,5.114401,Russell “Block” Spencer Net Worth is $10 Million Russell “Block” Spencer Biography
677,msmarco,_doc,MARCO_7677002,5.112428,"Lara Spencer has been divorced from David Haffenreffer since June 19, 2015. They had been married for 14.7 years. Lara Spencer is currently available."
678,msmarco,_doc,MARCO_1328870,5.1114435,"Spencer Electric, Inc. employs one person. In Malta, an average company has between 2 and 20 employees, meaning that Spencer Electric, Inc. is one of the smaller employers in the area."
679,msmarco,_doc,MARCO_3893803,5.1114435,"| Yowza! Caroline is the daughter of Karen Spencer and the namesake of her aunt, Caroline Spencer Forrester, who died of leukemia in 1990 while married to Ridge Forrester."
680,msmarco,_doc,MARCO_4771326,5.1114435,"The Spencer Davis Group are a British rock band formed in Birmingham in 1963, by Spencer Davis with Steve Winwood and his brother, Muff Winwood."
681,msmarco,_doc,MARCO_7150971,5.1114435,"U.S. Post Office - Spencer 110 4th St, Spencer NC 28159-2214 Phone Number: (704) 633-1394"
682,msmarco,_doc,MARCO_1937835,5.11046,Princess Diana's maiden name was Spencer as when her grandfather died her father became Earl Spencer and she became a Lady. As a titled royal since birth Charles does not technically have a surname.
683,msmarco,_doc,MARCO_5324468,5.11046,"Percy LeBaron Spencer is regarded as the inventor of the microwave oven. Spencer worked as an engineer with the Raytheon company, which was a company that developed defence and industrial equipment."
684,msmarco,_doc,MARCO_6141496,5.109477,"Abigail Spencer. Abigail Spencer (born August 4, 1981 in Gulf Breeze, Florida) is an American actress. She appeared in Season 3 as Suzanne Farrell."
685,msmarco,_doc,MARCO_8504283,5.109477,"Making the world better, one answer at a time. Spencer and Toby break up in season two episode twelve. Toby broke up with Spencer because there were things that have to do with her family that she said she could never tell him."
686,msmarco,_doc,MARCO_8618655,5.109477,"Rockport is a city in Ohio Township, Spencer County, Indiana, along the Ohio River. The population was 2,270 at the 2010 census. The city is the county seat of Spencer County."
687,msmarco,_doc,MARCO_1328876,5.108495,"Employees Spencer Electric, Inc. employs one person. In Malta, an average company has between 2 and 21 employees, meaning that Spencer Electric, Inc. is one of the smaller employers in the area. Advertisement References"
688,msmarco,_doc,MARCO_1937834,5.108495,Report Abuse. Princess Diana's maiden name was Spencer as when her grandfather died her father became Earl Spencer and she became a Lady. As a titled royal since birth Charles does not technically have a surname.
689,msmarco,_doc,MARCO_2276356,5.108495,"A close relative of Henry Spencer (died c. 1478) was John Spencer, who in 1469 had become feoffee (feudal lord) of Wormleighton in Warwickshire and a tenant at Althorp in Northamptonshire in 1486."
690,msmarco,_doc,MARCO_3295102,5.108495,"Divorce, being hard on all parties, was made easier for me with Mr. Spencer's help. He looked out for me and my children's well being. Any questions I may have had were... Divorce, being hard on all parties, was made easier for me with Mr. Spencer's help. He looked out for me and my children's well being."
691,msmarco,_doc,MARCO_3937557,5.108495,"What she dropped is evidence that Wren and Melissa are moving to England, which is unknown by anyone, including Spencer. When Toby sees Spencer, he shows her the document, causing her to question why they have kept the move to London a secret."
692,msmarco,_doc,MARCO_4875779,5.108495,"Spencer MacPherson (born June 12, 1997) portrays older Charles on Reign. Spencer MacPherson was born June 12, 1997 in Mississauga, Ontario. He is single."
693,msmarco,_doc,MARCO_8064762,5.108495,"In 1855, Spencer published his second book, The Principles of Psychology. As in Social Statics, Spencer saw Bentham and Mill as major targets, though in the present work he focussed on criticisms of the latter's associationism."
694,msmarco,_doc,MARCO_67590,5.1075144,"The early sociology of Spencer came about broadly as a reaction to Comte and Marx; writing before and after the Darwinian revolution in biology, Spencer attempted to reformulate the discipline in what we might now describe as socially Darwinistic terms."
695,msmarco,_doc,MARCO_3008122,5.1075144,"Spencer County is a county located in the U.S. state of Kentucky. As of the 2010 census, the population was 17,061. Its county seat is Taylorsville. The County was founded in 1824 and named for Spier Spencer."
696,msmarco,_doc,MARCO_1928617,5.1075144,"Below are the normal opening hours for Marks & Spencer, Colliers Wood. For seasonal (e.g. Christmas & Easter) and bank holiday opening hours please visit Marks & Spencer's website."
697,msmarco,_doc,MARCO_2749295,5.1075144,"In the pilot episode, we meet Spencer, Aria, Emily and Hanna, one year after Alison's disappearance. 'Pretty Little Liars' Costume Closet Revealed: How Spencer, Aria, Hanna and Emily Get Their Bold Looks."
698,msmarco,_doc,MARCO_4693687,5.1075144,"need a boy name that goes siblings Trevor and spencer. Our boys names are Trevor Ray and Spencer Jay. My husbands name is Jason Ray, which is how we came up with our boys' middle names."
699,msmarco,_doc,MARCO_4443282,5.1075144,"He's the son of Henry Spencer, Sr., played by Brian Doyle Murray, and followed his father's footsteps in becoming a detective, but does not seem to get along with him, and is estranged from his younger brother, Jack Spencer, played by Steven Weber."
700,msmarco,_doc,MARCO_5887319,5.1075144,"Spencer Savings Bank Routing Number. In our record, the routing number for Spencer Savings Bank is 211371599. The following is the information for the routing number of 211371599. 176 Main Street."
701,msmarco,_doc,MARCO_8699634,5.1075144,"When Brandon Spencer was delivering mail recently and saw legs sticking out from underneath a car in a garage, he initially thought someone was doing automotive work. Clinton, IA, City Carrier Assistant Brandon Spencer."
702,msmarco,_doc,MARCO_2708576,5.1065345,Spencer Swears In Navy Under Secretary And Assistant Secretary RDA Spencer Swears In Navy Under Secretary And Assistant Secretary RDA Defense Daily | 12/05/2017 | Rich Abott
703,msmarco,_doc,MARCO_4322111,5.1065345,"Southern Alleghenies Museum, Pennsylvania. Spencer Museum of Art at the University of Kansas. Scroll down to the bottom of the page for 3 prints by Grant Wood. Spencer Museum of Art at the University of Kansas."
704,msmarco,_doc,MARCO_4257005,5.1065345,What is a thick steak cut from the filet of beef called? Is the Spencer steak the end cut of the ribeye and therefore there are only 4 Spencer steaks on one beef? No. It used a be a very popular name for the ribeye steak. It is just another name for a ribeye.
705,msmarco,_doc,MARCO_6090209,5.1065345,"Carnegie argued, for example, that if workers were to have an eight-hour day, the state would have to regulate it -- something that Spencer never would have approved. Carnegie also ignored Spencer's complete opposition to philanthropy, as the American business tycoon was one of the great philanthropists of his day."
706,msmarco,_doc,MARCO_7285948,5.1065345,"Just like her aunt, Diana, Princess of Wales, Lady Kitty Spencer definitely has a love of fashion. Some are claiming Spencer is also the spitting image of her iconic aunt, but we just don't see it. Naughty in @rottenroach 🙆🏼"
707,msmarco,_doc,MARCO_7570635,5.1065345,"Try expanding your search for Therapists in Spencer to a larger area (e.g. Worcester County, Massachusetts) How can I tell if a therapist is right for me? Therapists in Spencer are able to work with a wide range of issues."
708,msmarco,_doc,MARCO_8351414,5.1065345,"Research On Immortality (2006) Edit. After the fall of most of Umbrella, Alex continued her work for Spencer, being the last remaining child at his side. The brightest of them all, in Spencer's view and words, Alex excels at absorbing the abilities of others.."
709,msmarco,_doc,MARCO_153107,5.1055555,"Spencer Shay (born November 11) is Carly Shay's older brother, and the first child of Mr. and Mrs. Shay. Since their father is in the military, Spencer is Carly's legal guardian. His mom has never been mentioned. His star sign is Scorpio."
710,msmarco,_doc,MARCO_1291675,5.1055555,"Phil Spencer, the head of Xbox at Microsoft, explained at the E3 gaming conference how backward compatibility was one of the most requested features for Xbox owners. Microsoft has listened to its fans, Spencer said, and will deliver the feature later this year."
711,msmarco,_doc,MARCO_1684490,5.1055555,"The N.A.T. Club is mentioned when Spencer confronts Melissa destroying evidence outside the mask-maker's shop. Melissa yells, It's not about some stupid club!. Spencer, however, retorts that because of their connection to what happened to Alison the day she 'died' someone was blackmailing them because of it."
712,msmarco,_doc,MARCO_986074,5.1055555,"The Best Actress winner brought her younger brother, Spencer Stone, to the big night. And Spencer seems to be Emma's favourite plus one, having also joined her at the SAG Awards and the Golden Globes earlier in 2017."
713,msmarco,_doc,MARCO_2316001,5.1055555,"Inside the insanely decadent life of Lady Kitty Spencer – Princess Diana's niece Britain's Lady Kitty Spencer lives a decadent lifestyle, but that's sort of expected considering her place in the aristocracy"
714,msmarco,_doc,MARCO_2790449,5.1055555,"Mr. Spencer is Holden’s History teacher at Pencey Prep. He is completely a different person then Holden. Mr. Spencer is an old, white-haired man who is always sick, taking pills, and smells of Vicks at all times."
715,msmarco,_doc,MARCO_4253996,5.1055555,"Jesse Spencer. Matthew Casey. Jesse Spencer stars as Matthew Casey, a strong, intuitive lieutenant who leads the Truck Company and is unwavering in his commitment to the job, on NBC's drama Chicago Fire.."
716,msmarco,_doc,MARCO_4798980,5.1055555,"Aiden Spencer is a fictional character on the ABC soap opera General Hospital. He is the son of Lucky Spencer and his ex-wife, Nurse Elizabeth Webber. He was formerly believed to be the son of Prince Nikolas Cassadine."
717,msmarco,_doc,MARCO_4693685,5.1055555,A girl's first name that goes with the middle name Spencer. My husband and I are having our second baby girl in July. My husband's name is Spencer and I think it would be incredibly special for the baby to have his name as her middle name.
718,msmarco,_doc,MARCO_4693691,5.1055555,"My husband and I are having our second baby girl in July. My husband's name is Spencer and I think it would be incredibly special for the baby to have his name as her middle name. Since Spencer can be either a girl or boy name, I think it is perfect for our little one."
719,msmarco,_doc,MARCO_4768355,5.1055555,"Spencer Lake is filled with blue icebergs—which, in fresh water, are called growlers. When you get off the Alaska Railroad, you can float next to the ice on a raft trip across the lake with Spencer Glacier Rail and Raft. Or, you can hike to the glacier."
720,msmarco,_doc,MARCO_4771334,5.1055555,"Gimme Some Lovin%27 by The Spencer Davis Group Songfacts. This song was written by the group's lead singer, Steve Winwood (Spencer Davis was their guitarist - he was chosen as the group's namesake because he was the only one who enjoyed doing interviews)."
721,msmarco,_doc,MARCO_4693686,5.1055555,"My husband's name is Spencer and I think it would be incredibly special for the baby to have his name as her middle name. Since Spencer can be either a girl or boy name, I think it is perfect for our little one. My only dilemma is that I am having trouble finding a first name that goes well with it."
722,msmarco,_doc,MARCO_8064763,5.1055555,"In the 1860s and 1870s, for example, the influence of Spencer's evolutionary theory was on a par with that of Charles Darwin. In 1883 Spencer was elected a corresponding member of philosophical section of the French academy of moral and political sciences."
723,msmarco,_doc,MARCO_8207986,5.1055555,"Thank God for the loving and compassion ate leaders and volunteer workers of the Spencer County Animal Shelter. They are a blessed gift to all of God's lost, helpless and otherwise vulnerable pets and ... strays in Spencer County."
724,msmarco,_doc,MARCO_7385369,5.1055555,"If we compare the popularity statistics of SPENCER to USA's population statistics, we can estimate that as of August.13.2016 02:37 there are 147,058 people named as SPENCER in the United States and the number is increasing by 1,186 people every year."
725,msmarco,_doc,MARCO_7676995,5.1055555,"Lara Spencer's Biography. Lara Spencer was named lifestyle anchor for ABC's Good Morning America in March, 2011. She was previously the show's National Correspondent for 5 years, from 1999 to 2004."
726,msmarco,_doc,MARCO_2276350,5.1045775,"Hereditary titles held by the Spencers include the dukedom of Marlborough, the earldoms of Sunderland and Spencer, and the Churchill viscountcy. Two prominent members of the family during the 20th century were Sir Winston Churchill and Diana, Princess of Wales."
727,msmarco,_doc,MARCO_2790446,5.1045775,"Spencer is unable to help Holden because he does not understand Holden and even if he did, Holden doesn’t want to listen. Holden meets Mr. Antolini at Elkton Hills high school where Antolini was his English teacher. Mr. Antolini is very different than Mr. Spencer."
728,msmarco,_doc,MARCO_4771328,5.1045775,"(1966) (1967) Gimme Some Lovin' is a song written by Steve Winwood, Spencer Davis and Muff Winwood, although solely credited to Steve Winwood on the UK single label, and performed by The Spencer Davis Group."
729,msmarco,_doc,MARCO_6090211,5.1045775,"Many successful capitalists of the late 19th century embraced Spencer's philosophy. These captains of industry used his words as justification to oppose social reform and government intervention. As Spencer said, these would interfere with the natural -- and beneficial -- law of survival."
730,msmarco,_doc,MARCO_628418,5.1036005,"Diana Frances Spencer was born in Norfolk, England on July 1, 1961. She was born into a high ranking and important British family. Her father, John Spencer, was a Viscount when she was born and would later inherit the title of Earl."
731,msmarco,_doc,MARCO_4139336,5.1036005,"My grandfather was watching a microwave testing rig, and he realized that the peanut-cluster bar in his pocket started to melt — it got quite warm, Rod Spencer, inventor and grandson of Percy Spencer, told Business Insider."
732,msmarco,_doc,MARCO_2914717,5.1036005,The company says their palm oil use is less than 5% of their total oil use and they do not use palm oil for frying. marks & spencer Marks & Spencer told Panorama that they have reduced the use of palm oil in the company's products wherever possible over the last two years.
733,msmarco,_doc,MARCO_2971558,5.1036005,"What is Princess Diana's name... When she was born, as the daughter of a viscount, she was called the Hon Diana Frances Spencer, and when her father inherited the earldom she became Lady Diana Frances Spencer … : she was born an aristocrat but a non-Royal and therefore a commoner."
734,msmarco,_doc,MARCO_1692322,5.1036005,Meet the Monster is track #10 on the album The Way of the Fist. It was written by Bathroy/moody/snell/spencer. Meet the Monster is track #10 on the album The Way of the Fist. It was written by Bathroy/moody/snell/spencer.
735,msmarco,_doc,MARCO_2273362,5.1036005,"Spencer Jill Hastings: Spencer is a headstrong, intelligent, overachieving girl who comes from the wealthy Hastings family. She is portrayed by Troian Bellisario in the hit ABC Family TV series of the same name, loosely based on the books."
736,msmarco,_doc,MARCO_1812983,5.1036005,"I am changing my last name for reasons I do not wish to specify. My first name is Abigail, but I prefer Abby. My middle name is Spencer. am changing my last name for reasons I do not wish to specify. My first name is Abigail, but I prefer Abby. My middle name is Spencer."
737,msmarco,_doc,MARCO_3300882,5.1036005,"The Brown-Spencer family is made up of Brown's three daughters from a previous marriage, and Spencer's three children. To make cooking dinner manageable every night, each child is assigned a day to be a kitchen helper. Maggie Starbard/NPR."
738,msmarco,_doc,MARCO_3355688,5.1036005,Comments22 Share. Marty Caruthers was the personal assistant Spencer hires in iBalls. He originally had the job of cleaning up the Pini's bathroom. Marty is seen doing things like giving Spencer a pedicure and pulling out his chair. They have also baked and frosted a cake together.
739,msmarco,_doc,MARCO_3043604,5.1036005,"Returned to his father, baby John's name is changed to Spencer Cassadine in honor of Nikolas' half siblings, Lulu and Lucky Spencer. The child's great grandmother, Helena hires Colleen McHenry to become the baby's nanny."
740,msmarco,_doc,MARCO_3008124,5.1036005,"You can also find Mount Eden, Spencer County, Kentucky real estate agents who specialize in land and rural retreats. Sign up for our Mount Eden, Spencer County, Kentucky email alerts and never miss out on a new listing again!"
741,msmarco,_doc,MARCO_3127077,5.1036005,"In the village of Dolgeville, take Spencer Street west. This will become Spencer Road, Carlson Road and finally Peckville Road. Just after crossing the Moore Road, you will cross the Ransom Creek. The parking area is on the left just past the creek."
742,msmarco,_doc,MARCO_4653701,5.1036005,"Finally, the craziest theory of all: Outlast thinks Spencer was adopted from Radley. It's revealed Spencer was born through a surrogate in the Pretty Little Liars book series (Outlast mistakenly says she was adopted). This could definitely be a twist on that storyline on the show."
743,msmarco,_doc,MARCO_5235472,5.1036005,"Early Career. Growing up as the second youngest of seven children, Octavia Spencer didn't think that she would become an actress. While interested in performing, she was encouraged by her mother to do something more practical. At Auburn University, Spencer studied English and Theater Arts."
744,msmarco,_doc,MARCO_5550308,5.1036005,"Deception involves acting in such a way which leads another person to believe something, that you, yourself, do not believe to be true (see Ekman; Miller & Stiff). The following example helps illustrate this point: Brad and Spencer. Brad and Spencer are both part of the same circle of friends."
745,msmarco,_doc,MARCO_6103462,5.1036005,"At the ceremony, the Royal Standard which had covered the coffin was removed by Diana's brother moments before she was buried, and replaced with the Spencer family flag; the Earl claimed that She (Diana) is a Spencer now.. Princes Charles, William and Harry agreed to the change."
746,msmarco,_doc,MARCO_6661585,5.1036005,Learn about the slip slop step in the lindy hop in this free dance lesson video. Expert: Spencer Weisbond & Jessi Patz. Contact: www.hopswingjump.com. Bio: Spencer Weisbond has been dancing Lindy Hop since 1998.
747,msmarco,_doc,MARCO_5887317,5.1036005,"Spencer Savings Bank Routing Number. Basic Info Reviews History Routing Number Locations. In our record, the routing number for Spencer Savings Bank is 211371599. The following is the information for the routing number of 211371599."
748,msmarco,_doc,MARCO_8182895,5.1036005,"Spencer used the idea of survival of the fittest in biology and theorized human society had evolved the same way (Cooper 15). Social Darwinism, as Spencer's theory is called, pits everyone against each other to survive in the world where humans are soldiers in a war for survival."
