,_index,_type,_id,_score,_source.body
512,msmarco,_doc,MARCO_511298,5.4773154,"Gloucester Cathedral, formally the Cathedral Church of St Peter and the Holy and Indivisible Trinity, in Gloucester, England, stands in the north of the city near the River Severn.It originated in 678 or 679 with the foundation of an abbey dedicated to Saint Peter (dissolved by King Henry VIII).n 1582, Robert Lichfield is recorded as the organist of Gloucester Cathedral. Notable among the organists are composers and choral conductors of the Three Choirs Festival, Herbert Brewer, Herbert Sumsion and John Sanders."
513,msmarco,_doc,MARCO_4479591,5.4773154,"In most people (97%), both Broca's area and Wernicke's area are found in only the left hemisphere of the brain. In the early 1950s, the famous neurosurgeon Wilder Penfield and his colleague Herbert Jasper, described how electrical stimulation of certain areas of the brain blocked language.n most people (97%), both Broca's area and Wernicke's area are found in only the left hemisphere of the brain. In the early 1950s, the famous neurosurgeon Wilder Penfield and his colleague Herbert Jasper, described how electrical stimulation of certain areas of the brain blocked language."
514,msmarco,_doc,MARCO_4611629,5.4773154,"Temple of Doom Fedora Edit. With the filming of Indiana Jones and the Temple of Doom, Indy's hat took a few twists of its own. Herbert Johnson didn't use a new model to create their Indy hats. What some people mistakenly imply is that Stetson also provided Indy's hat.ith the filming of Indiana Jones and the Temple of Doom, Indy's hat took a few twists of its own. Herbert Johnson didn't use a new model to create their Indy hats. What some people mistakenly imply is that Stetson also provided Indy's hat."
515,msmarco,_doc,MARCO_6220339,5.4773154,"And the invention was soon followed by mirror drum based TV by a Russian Inventor named Leon Theremin in 1927. Herbert Ives from the Bell Labs transferred moving images from 50 apeture disk.Philo Farnsworth, the electronic inventor discovered earliest electronic television.nd the invention was soon followed by mirror drum based TV by a Russian Inventor named Leon Theremin in 1927. Herbert Ives from the Bell Labs transferred moving images from 50 apeture disk."
516,msmarco,_doc,MARCO_7867679,5.4773154,8 Oatley Point Reserve contains excellent examples of Sandstone Gully Forest and Sandstone Ridgetop Woodland. The gully forest occupies the slopes of the reserve leading down to the water; it is dominated by tall Blackbutts E. pilularis and Grey Ironbark E. paniculata.ccess to the reserve is from Herbert Street (where there is a designated car parking area) or from Algernon Street. There are several walking tracks in the reserve; the main one commences from the Herbert Street car park and continues around the base of the reserve to Oatley Point.
517,msmarco,_doc,MARCO_8504284,5.4763145,"‘Pretty Little Liars’ Season 5 Spoilers: Do Spencer & Toby Break Up? ‘Pretty Little Liars’ returns in just a few days on Tuesday, June 10, and we’re breaking down the latest on all the Rosewood couples for you! Are Spencer and Toby still together or are they headed towards splitsville? Click to WATCH our exclusive interview with Troian Bellisario! Spencer (Troian Bellisario) and Toby (Keegan Allen) one of the longest standing couples on Pretty Little Liars, but are they calling it quits, after their tumultuous season? HollywoodLife.com spoke to Troian who gave us a relationship update for Season 5 — keep reading for the latest on Spoby!"
518,msmarco,_doc,MARCO_2800775,5.475416,"George Walker Bush was the 43rd President of the United States. The last of the father and son presidents, John Adams and John Quincy Adams were the first, his father was George Herbert Walker Bush, the 41st U.S. President. For being such famous Texans, the Bush family tree is filled with Yankee forebears.he last of the father and son presidents, John Adams and John Quincy Adams were the first, his father was George Herbert Walker Bush, the 41st U.S. President. For being such famous Texans, the Bush family tree is filled with Yankee forebears."
519,msmarco,_doc,MARCO_4603579,5.475416,"MacArthur said that was correct and that we would have avoided all of the losses, the Atomic bomb, and the entry of Russia into Manchuria.” -Herbert Hoover. – “MacArthur’s views about the decision to drop the atomic bomb on Hiroshima and Nagasaki were starkly different from what the general public supposed. . .acArthur said that was correct and that we would have avoided all of the losses, the Atomic bomb, and the entry of Russia into Manchuria.” -Herbert Hoover. – “MacArthur’s views about the decision to drop the atomic bomb on Hiroshima and Nagasaki were starkly different from what the general public supposed. . ."
520,msmarco,_doc,MARCO_5918584,5.475416,in hindsight fdr might look like a shoo in for the 1932 presidential election the campaign unfolded during the darkest days of the great depression and roosevelt s opponent republican incumbent herbert hoover was the man many americans perhaps unfairly held personally responsible for their miseryn hindsight fdr might look like a shoo in for the 1932 presidential election the campaign unfolded during the darkest days of the great depression and roosevelt s opponent republican incumbent herbert hoover was the man many americans perhaps unfairly held personally responsible for their misery
521,msmarco,_doc,MARCO_6808220,5.475416,"The Worldwide Church of God changed its name to Grace Communion International in April of 2009. Visiting their website, I found their beliefs conform to orthodox Christian doctrine. In the past, under the direction of Herbert Armstrong, the WCG did subscribe to heretical doctrine.he Worldwide Church of God changed its name to Grace Communion International in April of 2009. Visiting their website, I found their beliefs conform to orthodox Christian doctrine. In the past, under the direction of Herbert Armstrong, the WCG did subscribe to heretical doctrine."
522,msmarco,_doc,MARCO_7957235,5.475416,15915. The first recombinant DNA. Stanley Cohen and Herbert Boyer's historic experiment used techniques to cut and paste DNA to create the first custom-made organism containing recombined or recombinant DNA. SOURCE: DNAi. 15626. Paul Berg and Stanley Cohen. Herbert Boyer: Former varsity lineman turned biotech bigwig. Expert at cutting DNA before most people knew it could be done. Stanley Cohen: A born tinkerer; figured out the trick of using loops of DNA called plasmids to transform bacterial DNA.
523,msmarco,_doc,MARCO_4017352,5.4735203,"White Sands became a national monument on 18 Jan 1933 by order of President Herbert Hoover. Efforts to preserve the area's brilliant gypsum dunes had begun in the late 1800's, but it was the enthusiasm of local booster Tom Charles that finally led to the park's creation.hite Sands became a national monument on 18 Jan 1933 by order of President Herbert Hoover. Efforts to preserve the area's brilliant gypsum dunes had begun in the late 1800's, but it was the enthusiasm of local booster Tom Charles that finally led to the park's creation."
524,msmarco,_doc,MARCO_955328,5.4735203,"It has emerged as part of a movement toward a general science of complexity. Rooted in the work of economist, Herbert Simon, chemist, Ilya Prigogine, and psychologist, Jean Piaget, hierarchy theory focuses upon levels of organization and issues of scale. There is significant emphasis upon the observer in the system.t has emerged as part of a movement toward a general science of complexity. Rooted in the work of economist, Herbert Simon, chemist, Ilya Prigogine, and psychologist, Jean Piaget, hierarchy theory focuses upon levels of organization and issues of scale. There is significant emphasis upon the observer in the system."
525,msmarco,_doc,MARCO_1585987,5.4735203,"The character's early life is explored in the Prelude to Dune prequel trilogy (1999–2001) by Brian Herbert and Kevin J. Anderson, and he returns in the form of a ghola in the Herbert/Anderson conclusion to the original series, Sandworms of Dune (2007). Stilgar also appears in the prequels Paul of Dune (2008) and The Winds of Dune (2009). Stilgar is portrayed by Everett McGill in David Lynch's 1984 film Dune, by Uwe Ochsenknecht in the 2000 Dune miniseries and by Steven Berkoff in the 2003 sequel miniseries Children of Dune."
526,msmarco,_doc,MARCO_990496,5.4735203,"Derived from the German given name Hellwig, which is a newer form of both Helmwig meaning helmet and battle and HEILWIG. HEPPENHEIMER German. From Heppenheim, the name of a city in Hessen. HERBERT Dutch, English, French, German. Derived from the male given name HERBERT. HERMANN German. From the given name HERMANN.rom a given name meaning servant of god from Germanic god god and scalc servant. GRANER German, Hungarian. Meaning of Gran, Gran being the German name for Esztergom, a small city in northern Hungary."
527,msmarco,_doc,MARCO_1931093,5.4735203,"Introduction. Herbert Hoover (1874-1964), America’s 31st president, took office in 1929, the year the U.S. economy plummeted into the Great Depression. Although his predecessors’ policies undoubtedly contributed to the crisis, which lasted over a decade, Hoover bore much of the blame in the minds of the American people.ntroduction. Herbert Hoover (1874-1964), America’s 31st president, took office in 1929, the year the U.S. economy plummeted into the Great Depression. Although his predecessors’ policies undoubtedly contributed to the crisis, which lasted over a decade, Hoover bore much of the blame in the minds of the American people."
528,msmarco,_doc,MARCO_2785041,5.4735203,"Roosevelt served as a reform governor from 1929 to 1932, and promoted the enactment of programs to combat the Great Depression that occurred during his governorship. Roosevelt defeated incumbent Republican president Herbert Hoover in November 1932, at the depth of the Great Depression.Energized by his personal victory over polio, FDR used his persistent optimism and activism to renew the national spirit.oosevelt defeated incumbent Republican president Herbert Hoover in November 1932, at the depth of the Great Depression. Energized by his personal victory over polio, FDR used his persistent optimism and activism to renew the national spirit."
529,msmarco,_doc,MARCO_3060732,5.4735203,"Inside, the policemen discovered the bodies of Herbert Clutter (48), his wife Bonnie Mae (45), and their two children, Kenyon Neal (14) and Nancy Mae (15); all four had been shot in the head with a shotgun, and Herbert had also had his throat slashed.n the morning of Sunday, November 16, 1959, Finney County Sheriff Earl Robinson, Garden City Police Chief Mitchell Geisler, and Assistant Chief Ritch Rohleder were called to a farm house in Holcomb (about ten miles from Garden City) because friends had been unable to contact the family that lived there."
530,msmarco,_doc,MARCO_3084432,5.4735203,"Best was a direct descendant of Major William Best, who in 1749 was one of the founders of Halifax, Nova Scotia. Best's father, Herbert Huestes Best, was a country doctor whose practice straddled the U.S.-Canadian border. As a teenager, Best often accompanied his father on his rounds in a horse-drawn buggy.Best's mother was Luella Fisher Best.est's father, Herbert Huestes Best, was a country doctor whose practice straddled the U.S.-Canadian border. As a teenager, Best often accompanied his father on his rounds in a horse-drawn buggy. Best's mother was Luella Fisher Best."
531,msmarco,_doc,MARCO_4544158,5.4735203,"The penalties are not bigger than Neymar. 3 thousand 900 euro mark has been fined, which is about Tk 3.84 lakh in Bangladeshi currency. The physician's name is Herbert Kremer. Six years ago, Neymar's son, Davey Luke, delivered the delivery. Neymar has appealed for a second time in the São Paulo court against the fine. But by rejecting his appeal, the court feels Neymar has the responsibility to pay the doctor Herbert Kremer's fees. The news agency EFE has heard the hearing in the court, according to the PSG star agreed to the fine."
532,msmarco,_doc,MARCO_5411668,5.4735203,"From Fasching, a German carnival (Fastnacht meaning eve of the beginning of the fast, or the time before Lent) celebrated in Austria and Catholic Bavaria, and bauer meaning farmer. FAUST German. Derived from the given name Faust, a form of FAUSTUS.erived from the German given name Hellwig, which is a newer form of both Helmwig meaning helmet and battle and HEILWIG. HEPPENHEIMER German. From Heppenheim, the name of a city in Hessen. HERBERT Dutch, English, French, German. Derived from the male given name HERBERT. HERMANN German. From the given name HERMANN."
533,msmarco,_doc,MARCO_6826929,5.4735203,"Hall effect. n. 1. (General Physics) the production of a potential difference across a conductor carrying an electric current when a magnetic field is applied in a direction perpendicular to that of the current flow.[named after Edwin Herbert Hall (1855-1938), American physicist who discovered it].all effect. n. 1. (General Physics) the production of a potential difference across a conductor carrying an electric current when a magnetic field is applied in a direction perpendicular to that of the current flow. [named after Edwin Herbert Hall (1855-1938), American physicist who discovered it]."
534,msmarco,_doc,MARCO_7867676,5.4735203,"2.2 Oatley Point Resrve Oatley Point Reserve is a much larger area of bushland than Neverfail Bay Reserve and is over 3 Ha in area. It is located on Oatley Point, as the south-western headland of Oatley Bay (figure 4).It is surrounded on three sides by water. Figure 4 Oatley Point Reserve.ccess to the reserve is from Herbert Street (where there is a designated car parking area) or from Algernon Street. There are several walking tracks in the reserve; the main one commences from the Herbert Street car park and continues around the base of the reserve to Oatley Point."
535,msmarco,_doc,MARCO_7567041,5.4735203,"1911 National Insurance Act. In 1908 David Lloyd George, the Chancellor of the Exchequer in the Liberal government led by Herbert Asquith proposed the 1911 National Insurance Act.This measure gave the British working classes the first contributory system of insurance against illness and unemployment.n 1908 David Lloyd George, the Chancellor of the Exchequer in the Liberal government led by Herbert Asquith proposed the 1911 National Insurance Act. This measure gave the British working classes the first contributory system of insurance against illness and unemployment."
536,msmarco,_doc,MARCO_8176535,5.4725337,"By Ken D. Thompson, Hardcover 114 pages. Life of James Morrison Heady, blind and deaf author, philosopher, poet, designer and inventor from Spencer County. $15.00 plus $2.00 shipping. Offered by the Spencer County Historical and Genealogical Society, P.O. Box 266, Taylorsville, KY 40071. Order Book `A’, Spencer County, Kentucky. An abstract of the actions and orders of the County Court in the years 1824-1828, after being formed as a county. Spiral bound, 143 pages including index. Price $21.00 plus $2.00 Shipping."
537,msmarco,_doc,MARCO_444052,5.46974,"If you have ever seen the movie King Kong, you may remember the building that the giant ape climbs. The Empire State Building officially opened on this day in history, May 1, 1931. President Herbert Hoover pressed a button in Washington, D.C., and on came the lights in the world's tallest skyscraper.Before that, the Chrysler Building briefly held the record at 1046 feet.f you have ever seen the movie King Kong, you may remember the building that the giant ape climbs. The Empire State Building officially opened on this day in history, May 1, 1931. President Herbert Hoover pressed a button in Washington, D.C., and on came the lights in the world's tallest skyscraper."
538,msmarco,_doc,MARCO_2341168,5.46974,"Herbert Hoover was born on March 10, 1874 in West Branch, Iowa. His family were devout Quakers. At age eight, Hoover was orphaned and was sent to live with relatives. They showed him little affection, but taught him the importance of hard work and industry. In 1891, Hoover entered Stanford University's School of Engineering, graduating in 1895. Four years later, he married his wife, Lou Henry and they had two sons, Herbert Jr. and Allan. From an early age, Hoover showed a prodigious talent for engineering and was hired by the engineering firm Bewick and Moering, working in Australia and then in China."
539,msmarco,_doc,MARCO_1432866,5.46974,"One-term incumbent Governor Gary Herbert is running for re-election. Herbert will be 69 in 2016. He was the Lieutenant Governor of Utah from 2005 to 2009 and became Governor after Jon Huntsman, Jr. resigned to become United States Ambassador to China.He won the seat in a 2010 special election and was elected to his first full term with 68.4% of the vote in 2012.he last gubernatorial elections for New Hampshire, Oregon, and Vermont took place in 2014, as Oregon is holding a special election due to the resignation of governor John Kitzhaber, and the governors of New Hampshire and Vermont both serve two-year terms."
540,msmarco,_doc,MARCO_1882190,5.46974,"7 steps to hack into someone’s bank account. 7 Steps to hack a bank account. The experiment: Herbert Thompson* in 2008 wanted to show the public how easy it was to access someone’s personal information and bank account.He did the experiment on someone who he barely knew, a girl named Kim. Steps to hack a bank account. The experiment: Herbert Thompson* in 2008 wanted to show the public how easy it was to access someone’s personal information and bank account. He did the experiment on someone who he barely knew, a girl named Kim."
541,msmarco,_doc,MARCO_2721120,5.46974,"Braselton Journal; Actress Buys Town A Place on the Map. BRASELTON, Ga., March 29— Herbert Braselton, a 69-year-old member of the family that for 113 years has owned this town except for 200 acres or so, said today he was satisfied that the family had done the right thing by selling it.raselton Journal; Actress Buys Town A Place on the Map. BRASELTON, Ga., March 29— Herbert Braselton, a 69-year-old member of the family that for 113 years has owned this town except for 200 acres or so, said today he was satisfied that the family had done the right thing by selling it."
542,msmarco,_doc,MARCO_3856935,5.46974,"President Roosevelt signs the Declaration of War against Japan, December 1941. October 29, 1929, was a dark day in history. Black Tuesday is the day that the stock market crashed, officially setting off the Great Depression.Unemployment skyrocketed--a quarter of the workforce was without jobs by 1933 and many people became homeless.President Herbert Hoover attempted to handle the crisis but he was unable to improve the situation.lack Tuesday is the day that the stock market crashed, officially setting off the Great Depression. Unemployment skyrocketed--a quarter of the workforce was without jobs by 1933 and many people became homeless. President Herbert Hoover attempted to handle the crisis but he was unable to improve the situation."
543,msmarco,_doc,MARCO_3699411,5.46974,"Curtis ran for Vice President with Herbert Hoover as President in 1928. They won a landslide victory. Although they ran again in 1932, the population saw Hoover as failing to alleviate the Great Depression, and they were defeated by Franklin D. Roosevelt and John Nance Garner.n 1928 Curtis ran with Herbert Hoover heading the Republican ticket for president and vice-president. Following their landslide 58% to 41% victory, Curtis resigned from the Senate on March 3, 1929 to assume the office of Vice President. The pair was inaugurated, he had an Indian jazz band perform, on March 4, 1929."
544,msmarco,_doc,MARCO_4552051,5.46974,"The Dead Zone is a 1983 American horror thriller film directed by David Cronenberg.The screenplay by Jeffrey Boam was based on the 1979 novel of the same name by Stephen King. The film stars Christopher Walken, Brooke Adams, Tom Skerritt, Herbert Lom, Anthony Zerbe, Colleen Dewhurst and Martin Sheen.he screenplay by Jeffrey Boam was based on the 1979 novel of the same name by Stephen King. The film stars Christopher Walken, Brooke Adams, Tom Skerritt, Herbert Lom, Anthony Zerbe, Colleen Dewhurst and Martin Sheen."
545,msmarco,_doc,MARCO_5411673,5.46974,"Derived from the given name BURKHARD. BOESCH Bösch. German derived from a nickname of the given NAME. SEBASTIAN Bosch, German. Dutch derived From dutch bussch. WOOD Boettcher. Böttcher german occupational name (meaning cooper) barrel Maker. in germanerived from the German given name Hellwig, which is a newer form of both Helmwig meaning helmet and battle and HEILWIG. HEPPENHEIMER German. From Heppenheim, the name of a city in Hessen. HERBERT Dutch, English, French, German. Derived from the male given name HERBERT. HERMANN German. From the given name HERMANN."
546,msmarco,_doc,MARCO_5411672,5.46974,"DIETER German. Derived from the given name DIETER. DIETRICH German. Derived from the given name DIETRICH. DIRCHS Dutch, German. Variant of DIRCKS. DITTMAR German. Derived from a given name of the elements theud meaning people or race and mari or meri meaning famous.erived from the German given name Hellwig, which is a newer form of both Helmwig meaning helmet and battle and HEILWIG. HEPPENHEIMER German. From Heppenheim, the name of a city in Hessen. HERBERT Dutch, English, French, German. Derived from the male given name HERBERT. HERMANN German. From the given name HERMANN."
547,msmarco,_doc,MARCO_6216495,5.46974,"[ 2 syll. har-ber(t) , ha-rbe-rt ] The baby boy name Harbert is pronounced as HH AA-RB-erT †. Harbert is used chiefly in Dutch and Frisian, and its origin is Germanic.Harbert is a variant of the name Herbert (English, French, German, and Polish).The contracted forms Haro (Frisian) and Harro (Frisian) are variants of the name.Harbert is not widely used as a baby name for boys. It is not listed within the top 1000 names.arbert is a variant of the name Herbert (English, French, German, and Polish). The contracted forms Haro (Frisian) and Harro (Frisian) are variants of the name."
548,msmarco,_doc,MARCO_6153790,5.46974,symbolic interactionism. (noun) The theory that society is possible because of the shared meanings and social patterns created during social interactions.Audio Pronunciation: (sym·bo·lic in·ter·act·ion·ism). Download Audio Pronunciation: symbolic interactionism.mp3.Usage Notes:1  Herbert Blumer (1900–1986) is credited with coining the term.noun) The theory that society is possible because of the shared meanings and social patterns created during social interactions. Audio Pronunciation: (sym·bo·lic in·ter·act·ion·ism). Download Audio Pronunciation: symbolic interactionism.mp3. Usage Notes: 1  Herbert Blumer (1900–1986) is credited with coining the term.
549,msmarco,_doc,MARCO_6663597,5.46974,"He tells Perry that he is talented. Floyd Wells-An inmate at Lansing prison. After Perry leaves on parole, he became Dick's cellmate. He is a former employee of Herbert Clutter, and he tells Dick about the ranch and the layout of the house. Lowell Lee Andrews-Andrews was a young college student who murdered his family.He is a schizophrenic.e tells Perry that he is talented. Floyd Wells-An inmate at Lansing prison. After Perry leaves on parole, he became Dick's cellmate. He is a former employee of Herbert Clutter, and he tells Dick about the ranch and the layout of the house. Lowell Lee Andrews-Andrews was a young college student who murdered his family."
550,msmarco,_doc,MARCO_7896563,5.46974,"Early Life. Jane Goodall was born on April 3, 1934, in London, England, to Mortimer Herbert Goodall, a businessperson and motor-racing enthusiast, and the former Margaret Myfanwe Joseph, who wrote novels under the name Vanne Morris Goodall.Along with her sister, Judy, Goodall was reared in London and Bournemouth, England.arly Life. Jane Goodall was born on April 3, 1934, in London, England, to Mortimer Herbert Goodall, a businessperson and motor-racing enthusiast, and the former Margaret Myfanwe Joseph, who wrote novels under the name Vanne Morris Goodall."
551,msmarco,_doc,MARCO_7015810,5.46974,"FERA camps for unemployed women in Arcola, Pennsylvania; Second Camp, ca. 07/1934. Federal Emergency Relief Administration (FERA) was the new name given by the Roosevelt Administration to the Emergency Relief Administration (ERA) which President Herbert Hoover had created in 1932.ERA camps for unemployed women in Arcola, Pennsylvania; Second Camp, ca. 07/1934. Federal Emergency Relief Administration (FERA) was the new name given by the Roosevelt Administration to the Emergency Relief Administration (ERA) which President Herbert Hoover had created in 1932."
552,msmarco,_doc,MARCO_771434,5.468767,"1.JOHN SMITH. Newton Jasper Smith, a son of James John and Emma (Rogers) Smith, was born in 1863 and died in 1927. He married Permilia Spencer. Permilia, a daughter of John White and Permilia (Andrews) Spencer, was. born in 1864 and died in 1923. Children of Newton Jasper and Permilia (Spencer) Smith.oseph Nelson Smith, a son of John and Frances (Cochran) Smith, was born. 54 in Roane County VA (WV) and died in 1944. He. married Anna Liza Crookshank in 1879. Anna, a daughter of David S. Crookshank, was born in 1863 and died in 1952."
